Review,Star
생각보다 따뜻해서 위에 숏패딩만 입어도 괜찮았구 재질도 좋았어요!! 평소에 원피스 잘 안 입는데 무난무난한 디자인이어서 부담없이 입을 수 있었습니당,4.0
사이즈 프리말고 좀더 있었으면 좋았을 뻔ㅋㅋ 원하던 스커트 길이는 안나오네요,4.0
사이즈 프리말고 좀더 있었으면 좋았을 뻔ㅋㅋ 원하던 스커트 길이는 안나오네요,4.0
색감이랑 꽈베기 무늬 넘 아쁘고 포인트 로고도 작아서 브담스럽지 않아요 근데 길이가 좀 짧아서 아쉬워용,4.0
생각보다 두껍고 가격대비 품질이 좋아요 예뻐요,5.0
생각보다 좀 짧긴한데 부드러워서 좋아요 까칠하진 않아요!,5.0
짧긴한데 휘뚜루마뚜루 입기좋음 비칠까봐 걱정했는데 그런거없슴,5.0
짧긴한데 휘뚜루마뚜루 입기좋음 비칠까봐 걱정했는데 그런거없슴,5.0
좀 덜 추울때 샀으면 맨날 입었을듯 그래도 싸게 잘 삼,5.0
생각보다 두껍고 가격대비 품질이 좋아요 예뻐요,5.0
생각보다 좀 짧긴한데 부드러워서 좋아요 까칠하진 않아요!,5.0
짧긴한데 휘뚜루마뚜루 입기좋음 비칠까봐 걱정했는데 그런거없슴,5.0
짧긴한데 휘뚜루마뚜루 입기좋음 비칠까봐 걱정했는데 그런거없슴,5.0
좀 덜 추울때 샀으면 맨날 입었을듯 그래도 싸게 잘 삼,5.0
길이감 적당합니다! 원피스류가 상체 움직임에따라 좀 더 잘 딸랴올라가는지라 그것만 조심하면 될 것 같아요! 도톰한 소재라 아래로 착 감기는 맛이 있어서 마음에 들어요,5.0
저에게 크지도 작지도 않고 편안하게 잘 맞아요! 도톰한 니트라 날리지 않고 안정감 있어서 만족합니다!,5.0
얇은 니트인 줄 알았는데 받아보니 도톰해서 너무너무 좋았어요! 겨울에 입기 추워보이면 어쩌나했는데 그렇지 않고 따뜻해보입니다!,5.0
예뻐요!!!! 너무 예쁘게 입기 딱이고 부해보이지 않아서 좋아요,5.0
길이도 적당허고 롱부츠에 완전찰떡 너무 예뻐요 기대이상,5.0
"생각보다 도톰하고  재질이 부드러워요

착용감도 좋아요

키가작아서  뚱해보일까봐 걱정했는데  
가격대비 
좋아용♡",5.0
"생각보다 도톰하고  재질이 부드러워요

착용감도 좋아요

키가작아서  뚱해보일까봐 걱정했는데  
가격대비 
좋아용♡  짧아서   스타킹신고 부츠신어야될듯해요",5.0
"생각보다 도톰하고  재질이 부드러워요

착용감도 좋아요

키가작아서  뚱해보일까봐 걱정했는데  
가격대비 
좋아용♡  짧아서   스타킹신고 부츠신어야될듯해요",5.0
"생각보다 길고 허리도 조임없긴해요 
그래도 괜찮아요",5.0
"키 168에 작아요!!!
안에무조건 레깅스나 짧은바지필수",5.0
"생각보다 도톰하고  재질이 부드러워요

착용감도 좋아요

키가작아서  뚱해보일까봐 걱정했는데  
가격대비 
좋아용♡",5.0
"생각보다 도톰하고  재질이 부드러워요

착용감도 좋아요

키가작아서  뚱해보일까봐 걱정했는데  
가격대비 
좋아용♡  짧아서   스타킹신고 부츠신어야될듯해요",5.0
"생각보다 도톰하고  재질이 부드러워요

착용감도 좋아요

키가작아서  뚱해보일까봐 걱정했는데  
가격대비 
좋아용♡  짧아서   스타킹신고 부츠신어야될듯해요",5.0
"생각보다 길고 허리도 조임없긴해요 
그래도 괜찮아요",5.0
"키 168에 작아요!!!
안에무조건 레깅스나 짧은바지필수",5.0
무진장세일로 잘 구매했어요 아주 데일리템입니다,5.0
무진장세일로 잘 구매했어요 아주 데일리템입니다,5.0
"생각보다 몸에 핏되고 치마 길이는 짧아요 
160 이상인 분들은 너무 짧다고 느껴질 길이네여!",4.0
치마가 너무 짧은거 빼고는 완전 예뻐요 세일할때 꼭 사세요 롱부츠와 입으면 찰떡입니당 앗그리고 빨래할때 조심해야할거ㅛ같아요,4.0
"피팅만 해봄 더워지면 입고 다닐게요 많이
판매하세요",3.0
"정말정말 예뻐요. 원피스가 이렇게 날씬해보이게 해주다니!!
여러분 그냥 사세요. 허리 잡아줘서 정말 깔끔한 핏이에요!",5.0
핏이 너무 예뻐요!! 정말 허리 실짝 잡아줘서 날씬해보입니다,5.0
인생원피스에요. 정말 정말 예뻐요. 원피스 잘 안어울리는 체형인데 이건 진짜 예뻐보이게 만들어줘요!!! 니트원피스인데 허리를 살짝 잡아줘서 날씬해보입니다. 니트짜임도 부담스럽지 않고 탄탄해서 오래입을 수 있을 것같아요. 다른 색으로 또 구매할 예정이에요!,5.0
"목이 짧아 스트레스인 사람 여기로 다 모여주세요ㅠ 진짜 브이넥 얘쁘게 빠져서 넘맘들,,흑흑 살 좀 더 까서 S입을 수 있는 날이 온다면 다른 사이즈로 또 살만큼 예쁨ㅜㅜ 그리고 이 원피스 롱부츠랑 같이 장착하면 뭐 옷걱정 할 필요도 없이 걍 룩북 한개 뚝딱 완성; 최근 블프 세일이니 뭐니 할때 끼워서 산 옷 중에서는 제일 비싼감이 있던 건데(그마저도 세일중이라 삼) 클스마스에 입으랴고 아껴두기로 함><\\ 
허리가 좀 더 챡 달라붙는 룩이 되면 더 예쁠 듯 한데, 그러면 밥먹으러 가서 새모이만큼 먹어야 할 것이기 때문에 살짝 헐렁st인 이느낌 긍정적으로 받아들임ㅎ 암튼 추촨",5.0
확실히 기장이 짧아요… 그래서 아우터 꼭 긴걸로 잘 입으셔야합니다 생각보다 도톰해서 겨울니트 원피스에요 안 껄끄럽고 화면과 같습니다,5.0
"정말정말 예뻐요. 원피스가 이렇게 날씬해보이게 해주다니!!
여러분 그냥 사세요. 허리 잡아줘서 정말 깔끔한 핏이에요!",5.0
핏이 너무 예뻐요!! 정말 허리 실짝 잡아줘서 날씬해보입니다,5.0
인생원피스에요. 정말 정말 예뻐요. 원피스 잘 안어울리는 체형인데 이건 진짜 예뻐보이게 만들어줘요!!! 니트원피스인데 허리를 살짝 잡아줘서 날씬해보입니다. 니트짜임도 부담스럽지 않고 탄탄해서 오래입을 수 있을 것같아요. 다른 색으로 또 구매할 예정이에요!,5.0
"목이 짧아 스트레스인 사람 여기로 다 모여주세요ㅠ 진짜 브이넥 얘쁘게 빠져서 넘맘들,,흑흑 살 좀 더 까서 S입을 수 있는 날이 온다면 다른 사이즈로 또 살만큼 예쁨ㅜㅜ 그리고 이 원피스 롱부츠랑 같이 장착하면 뭐 옷걱정 할 필요도 없이 걍 룩북 한개 뚝딱 완성; 최근 블프 세일이니 뭐니 할때 끼워서 산 옷 중에서는 제일 비싼감이 있던 건데(그마저도 세일중이라 삼) 클스마스에 입으랴고 아껴두기로 함><\\ 
허리가 좀 더 챡 달라붙는 룩이 되면 더 예쁠 듯 한데, 그러면 밥먹으러 가서 새모이만큼 먹어야 할 것이기 때문에 살짝 헐렁st인 이느낌 긍정적으로 받아들임ㅎ 암튼 추촨",5.0
확실히 기장이 짧아요… 그래서 아우터 꼭 긴걸로 잘 입으셔야합니다 생각보다 도톰해서 겨울니트 원피스에요 안 껄끄럽고 화면과 같습니다,5.0
길이는 짧은거 좋아해서 문제는 없는데 생각보단 나한텐 길었음ㅎ 그래도 핏이 이뻐요 허리 못잡아주는건 감안하기!,5.0
"길이도 적당하고 두툼해서 좋아요
딱 무난무난한 니트원피스",5.0
배송도 빠르고 디자인이랑 색감도 화면 그대로여서 좋았는데 170기준으로는 조금 짧아요ㅠㅠ 165이하이신 분들이 입기에 좋은 거 같아요 근데 니트가 단독으로 입기엔 조금 까실해서 끈나시 입고 입었어요! 그래도 세탁하고 변형도 많이 없어서 좋았습니다!,4.0
차르르한 느낌이 좋습니다 좋은 가격에 구매해서 만족!,5.0
짧다고 하는데 기장 딱 괜찮아요! 허리라인이 없어서 벨트가 필수템되었습니다,5.0
"아이보리 잘입었어서 블랙 또 샀는데 길이가 훨씬 짧네요.. 너무 짧은거 싫어해서 좀 별로입니다.어반드레스 니트도 있는데 그때도 같은 상품도 사이즈가 뒤죽박죽 너무 차이나서 교환하거 난리도 아니었는데,,그때만이 아니라 여기 상품이 원래 상품사이즈가 너무 들쭉날쭉한것 같아 신뢰가 안가네요",1.0
"아이보리 잘입었어서 블랙 또 샀는데 길이가 훨씬 짧네요.. 너무 짧은거 싫어해서 좀 별로입니다.어반드레스 니트도 있는데 그때도 같은 상품도 사이즈가 뒤죽박죽 너무 차이나서 교환하거 난리도 아니었는데,,그때만이 아니라 여기 상품이 원래 상품사이즈가 너무 들쭉날쭉한것 같아 신뢰가 안가네요",1.0
"허리도 꽤나 잡아주는 디자인이에요
3-4만원대로 할인할때 구매하세요",5.0
"할인할때 3만원대에 사서 만족해요
심플하고 이뻐요",5.0
"아이보리 잘입었어서 블랙 또 샀는데 길이가 훨씬 짧네요.. 너무 짧은거 싫어해서 좀 별로입니다.어반드레스 니트도 있는데 그때도 같은 상품도 사이즈가 뒤죽박죽 너무 차이나서 교환하거 난리도 아니었는데,,그때만이 아니라 여기 상품이 원래 상품사이즈가 너무 들쭉날쭉한것 같아 신뢰가 안가네요",1.0
"아이보리 잘입었어서 블랙 또 샀는데 길이가 훨씬 짧네요.. 너무 짧은거 싫어해서 좀 별로입니다.어반드레스 니트도 있는데 그때도 같은 상품도 사이즈가 뒤죽박죽 너무 차이나서 교환하거 난리도 아니었는데,,그때만이 아니라 여기 상품이 원래 상품사이즈가 너무 들쭉날쭉한것 같아 신뢰가 안가네요",1.0
"허리도 꽤나 잡아주는 디자인이에요
3-4만원대로 할인할때 구매하세요",5.0
"할인할때 3만원대에 사서 만족해요
심플하고 이뻐요",5.0
"흰색이 너무 이뻐서 검정도 구매해요 
적당히 두꺼워요",5.0
저렴하게 잘샀어요 근데 너무 짧아요! 밖에 나갈 땐 검정치마를 하나 더 입어주었습니다.,5.0
"유교걸임에도 너무 제 스타일의 디자인이라 포기할 수 없어 하의를 하나 더 입는걸로 자체결정했습니다!
그만큼 도톰하고 허리도 더 얇아보이고 소매도 길어서 완전 좋아요!",5.0
옷은 정말 예쁜데 팔뚝에 살이 많아서 부각이 좀 되네요 ㅜ 그래도 옷은 예쁩니다.,4.0
늘어질까봐 조금 걱정되지만 핏도 재질도 맘에 들어욥,4.0
"제 가격에 질이 그렇게 좋지는 않습니다 ㅜ 늘어날 것 같아유ㅠ
그래도 세일할때 사서 후회는 없습니다",5.0
키가 있다보니 조금 짧긴하지만 알고 산거라 문제 없었어요! 니트 재질도 좋고 약간 도톰해서 10월 말에 원피스 위 가볍게 자켓만 걸쳐도 별로 안 추웠습니닷☺️☺️ 키가 있으신분들은 반바지 꼭 입으셔야 될거같아요! 저는 약간 밝은 청반바지 입었는데 깔끔하고 슬림한 원피스다보니 잘 어울렸습니다! 배송도 꼼꼼하게 잘왔고 빠루게 도착했어요,5.0
"옷 너무 예쁩니다. 요즘 가장 많이 입고다녀요!!
배송도 엄청 빠르고 몸매 보정이 저절로됩니다!",5.0
"유교걸이라 길이가 좀 걱정됐는데 조심하면 괜찮을 거 같아요
좀 더 짧았으면 못 입었을 거 같아요
할인가로 합리적으로 샀고 붙는 핏은 아닌데 허리가 살짝 들어가 있어서 맘에 들어요",5.0
이뻐여! 너무딱달라붙지도않고 적당하니조아여! 부츠랑찰떡인원피스   기장도땁입니다,5.0
잘 맞고 생각보다 핏이 더 맘에들어용. 롱부츠랑 코디했슴댜,5.0
키가 있다보니 조금 짧긴하지만 알고 산거라 문제 없었어요! 니트 재질도 좋고 약간 도톰해서 10월 말에 원피스 위 가볍게 자켓만 걸쳐도 별로 안 추웠습니닷☺️☺️ 키가 있으신분들은 반바지 꼭 입으셔야 될거같아요! 저는 약간 밝은 청반바지 입었는데 깔끔하고 슬림한 원피스다보니 잘 어울렸습니다! 배송도 꼼꼼하게 잘왔고 빠루게 도착했어요,5.0
"옷 너무 예쁩니다. 요즘 가장 많이 입고다녀요!!
배송도 엄청 빠르고 몸매 보정이 저절로됩니다!",5.0
"유교걸이라 길이가 좀 걱정됐는데 조심하면 괜찮을 거 같아요
좀 더 짧았으면 못 입었을 거 같아요
할인가로 합리적으로 샀고 붙는 핏은 아닌데 허리가 살짝 들어가 있어서 맘에 들어요",5.0
이뻐여! 너무딱달라붙지도않고 적당하니조아여! 부츠랑찰떡인원피스   기장도땁입니다,5.0
잘 맞고 생각보다 핏이 더 맘에들어용. 롱부츠랑 코디했슴댜,5.0
겨울쿨톤 정말 잘 어울릴 것 같은 색상이었어요!! 세일 때 쿠폰 먹여서 샀더니 합리적인 가격인 가격에 구매할 수 있었습니다!! 😍 키 크신 분들에겐 좀 짧을 것 같아요 제 키에 허벅지 중간까지 왔습니당,5.0
생각보다 짜임이 탄탄하고 질이 좋아요 ! 매우 짧긴하지만 조심해서 잘 입어보겠숩니댜,5.0
모델샷보고 약간 시스루일 줄 알았는데 생각보다 짜임이 탄탄하고 잘 안비쳐요!,5.0
색감은 화면이랑 똑같아요 블랙이라서 그런가 디자인은 일단 마음에 들어오 배송도 빠른 편이고 일단 편하게 입기 좋습니다 할인해서 좋은 가격에 구매했네요,5.0
"편하고 예쁘다고 하네요 단, 길이가 짧대요 속바지 필수랍니다",5.0
"옷도 두껍구 한겨울에 패딩이랑 잘입을듯해요
키큰여성분들은 바지꼭 챙겨입읍시댱
이옷에 레깅스입으니 몸매짱 좋아보여용",5.0
"팔 들면 밑에가 보여서 좀 그래요
그것 말고는 다 만족해요",4.0
"다른 후기처럼 정말 짧아요 만세하면 그냥 배까지 올라가요
안에 청바지 입고 입었어요
무겁기도하고 여름에 입기에는 더워요",5.0
가을겨울에입기좋은 원피스! 맘에듭니다! 가격도세일해서 굿!,5.0
오 이뻐여! 생각보다얇지않고 제가키가작은데 기장도 길지도않고딱이쁩니다!,5.0
"옷도 두껍구 한겨울에 패딩이랑 잘입을듯해요
키큰여성분들은 바지꼭 챙겨입읍시댱
이옷에 레깅스입으니 몸매짱 좋아보여용",5.0
"팔 들면 밑에가 보여서 좀 그래요
그것 말고는 다 만족해요",4.0
"다른 후기처럼 정말 짧아요 만세하면 그냥 배까지 올라가요
안에 청바지 입고 입었어요
무겁기도하고 여름에 입기에는 더워요",5.0
가을겨울에입기좋은 원피스! 맘에듭니다! 가격도세일해서 굿!,5.0
오 이뻐여! 생각보다얇지않고 제가키가작은데 기장도 길지도않고딱이쁩니다!,5.0
원피스로 입기에는 짧고 가디건으로 입어도 좋아요^^=,5.0
여자친구 선물로사줬는데 너무 잘어울리네요! 너무이뻐요,5.0
여자친구 선물로 사줬는데 딱맞네요! 너무이뻐요,5.0
좋아요 부드러워요 따뜻해요 부드러워요 핫하면서도 귀여워요,5.0
좋아요 부드러워요 따뜻해요 부드러워요 핫하면서도 귀여워요,5.0
데이트할때 입으려고 샀는데 진짜 잘 입었어요 만족,5.0
데이트할때 입으려고 샀는데 진짜 잘 입었어요 만족,5.0
156기준 허벅지 반정도 너무 짧지도 길지도 않게 딱 적당하게 오는 기장감이라 좋았어요 특히 옷 자체에 라인이 이뻐서 몸먀가 예뻐보이고 색감이 무난하고 니트소재라 어떤 아우터든 잘 어울려요! 그리고 소매도 살짝플레어에 길어서 여리여리해 보이고 따뜻합니다 니트 질도 좋고 강추에요!👍💓,5.0
제 생각보다 엄청 짧지 않아서 좋았어요! 니트라서 따뜻하게 입을 수 있을 것 같네여,5.0
생각보다 두께가 있는 편이고 벨트랑 같이 하면 더 예뻐요,5.0
데이트할때 입으려고 샀는데 진짜 잘 입었어요 만족,5.0
데이트할때 입으려고 샀는데 진짜 잘 입었어요 만족,5.0
156기준 허벅지 반정도 너무 짧지도 길지도 않게 딱 적당하게 오는 기장감이라 좋았어요 특히 옷 자체에 라인이 이뻐서 몸먀가 예뻐보이고 색감이 무난하고 니트소재라 어떤 아우터든 잘 어울려요! 그리고 소매도 살짝플레어에 길어서 여리여리해 보이고 따뜻합니다 니트 질도 좋고 강추에요!👍💓,5.0
제 생각보다 엄청 짧지 않아서 좋았어요! 니트라서 따뜻하게 입을 수 있을 것 같네여,5.0
생각보다 두께가 있는 편이고 벨트랑 같이 하면 더 예뻐요,5.0
무난하지만 안무난한 드레스네요 최고에요 추천드려요,5.0
니트가 두꺼워서 겨울에도 입을 수 있을거 같아요 다만 허리부분이 너무커요,5.0
니트가 두꺼워서 겨울에도 입을 수 있을거 같아요 다만 허리부분이 너무커요,5.0
니트가 두꺼워서 겨울에도 입을 수 있을거 같아요 다만 허리부분이 너무커요,5.0
"길이가 짧은 편이기는 하는데 그 대신 비율은 좋아 보이는 효과가 있구요
머리 묶을 때 손을 올리거나 고개를 숙일 때 신경 써서 조심해야 해요!
니트 재질에 너무 두껍지도 얇지도 않고 가슴라인이 너무 깊지도 않고 그렇다고 해서 답답해 보이지 않는 적당한 파임이라 날씬해 보여요!",5.0
"생각보다 두껍고 허리 라인이 덜 잡혀 있어서 모델처럼 예쁜 핏은 안나와요 제가 말라서 더 헐렁했을 수도 있네요
길이는 저한테 딱 좋은 것 같고요 세일할 때 저렴하게 사서 만족합니다",4.0
고민하다가 구했는데 생각보다 도톰해서 너무 좋았어요! 그리고 허리라인있어서 날씬해보이긴하는데 팔이 널널해서 좀 부해보이는…? 길이는 160기준으로 허벅지 반까지 오는데 후기에 짧다는 말 많아서 걱정했는데 생각보다 괜찮았어요!!,5.0
엄청 고민하다가 샀는데 허리에 라인 들어가있어서 날씨해보여요 그리고 원단도 두꺼워서 겨울에 쌉가넝! 길이는 160기준으로 허벅지 반정도인데 오바다 싶을정도로 짧은건 아니었어용 팔은 너무 낙낙해서 오히려 약간 부해보였어요ㅠㅠ 그래듀 전체적으로 만족합니다,5.0
짱짱 이뻐요ㅠㅠ 어반드레스 옷 진짜 다 예뻐요!! 최고에요,5.0
"배송이 빨라서 좋았습니다!
길이는 짧은 걸 알고 시켜서 전 안에 치마 받혀 입었습니당(그래도 많이 짧지 않고 약 2~3cm 정도 짧은 느낌이었습니당)",5.0
"생각보다 두껍고 허리 라인이 덜 잡혀 있어서 모델처럼 예쁜 핏은 안나와요 제가 말라서 더 헐렁했을 수도 있네요
길이는 저한테 딱 좋은 것 같고요 세일할 때 저렴하게 사서 만족합니다",4.0
고민하다가 구했는데 생각보다 도톰해서 너무 좋았어요! 그리고 허리라인있어서 날씬해보이긴하는데 팔이 널널해서 좀 부해보이는…? 길이는 160기준으로 허벅지 반까지 오는데 후기에 짧다는 말 많아서 걱정했는데 생각보다 괜찮았어요!!,5.0
엄청 고민하다가 샀는데 허리에 라인 들어가있어서 날씨해보여요 그리고 원단도 두꺼워서 겨울에 쌉가넝! 길이는 160기준으로 허벅지 반정도인데 오바다 싶을정도로 짧은건 아니었어용 팔은 너무 낙낙해서 오히려 약간 부해보였어요ㅠㅠ 그래듀 전체적으로 만족합니다,5.0
짱짱 이뻐요ㅠㅠ 어반드레스 옷 진짜 다 예뻐요!! 최고에요,5.0
"배송이 빨라서 좋았습니다!
길이는 짧은 걸 알고 시켜서 전 안에 치마 받혀 입었습니당(그래도 많이 짧지 않고 약 2~3cm 정도 짧은 느낌이었습니당)",5.0
"타이트한 핏은 아니지만 어느정도 허리라인은 강조되어 보입니다. 

제가 입기에는 짧은 느낌이 있어 안에 검정 치마 입었습니다. 많아 보이지 않아 이질감이 없었어욥!

소재는 부들부들하고 두께감이 있어 한겨울에도 입기 괜찮을 것 같아요!",5.0
"사이즈 등 생각했던 핏과 색감 다 적당해요
괜찮았습니다
근데 좀 팔뚝살이 부각되긴 합니다
뚱뚱해보여요",3.0
길이도 생각보다 길고 해서 가을겨울에 그냥 편하게 입을수있을듯,4.0
"길이도 딱맞고 가을에 입기 딱 좋은 것 같아요
아우터 하나 걸치면 적당해요",5.0
허리를 안 잡아줘서 아쉬워요 무난무난한 옷입니다,5.0
"예뻐요 생각보다 두툼해서 더 좋고 기장도 제 키엔 딱 예쁘게 맞네요!
다만 제가 어깨는 넓은 편이고 그에 비해 골반은 없는 역삼각형 몸인데 옷 핏 자체가 제 체형에는 안 어울리네요ㅠㅠ
어깨는 더 부각돼 보이고, 치마가 예쁜 a라인으로 떨어지는게 아니라서 애매해요",4.0
키가 작아서 살짝 길은감이 잇긴하지만 옷자체는 너무예뻐요ㅠㅠ,4.0
"할인가로 잘 샀어요
타이트한 핏은 아닌데 여리여리해보여요",5.0
"할인가로 사서 가격대비 짱짱한 제품 잘 샀어요
타이트한 핏은 아닌데 핏 괜찮아요
그런데 후기 말대로 짧긴해요
안에 입을만한 하의 생각해보려구요",5.0
"핏이 굉장히 예쁘고, 가격도 착해서 잘 입고 다닐거 같아요
얇다는 평이 많았는데, 생각보다 그렇게 얇지도 않아서 아우터 입고 입으면 따뜻합니다!",5.0
"예뻐요 생각보다 두툼해서 더 좋고 기장도 제 키엔 딱 예쁘게 맞네요!
다만 제가 어깨는 넓은 편이고 그에 비해 골반은 없는 역삼각형 몸인데 옷 핏 자체가 제 체형에는 안 어울리네요ㅠㅠ
어깨는 더 부각돼 보이고, 치마가 예쁜 a라인으로 떨어지는게 아니라서 애매해요",4.0
키가 작아서 살짝 길은감이 잇긴하지만 옷자체는 너무예뻐요ㅠㅠ,4.0
"할인가로 잘 샀어요
타이트한 핏은 아닌데 여리여리해보여요",5.0
"할인가로 사서 가격대비 짱짱한 제품 잘 샀어요
타이트한 핏은 아닌데 핏 괜찮아요
그런데 후기 말대로 짧긴해요
안에 입을만한 하의 생각해보려구요",5.0
"핏이 굉장히 예쁘고, 가격도 착해서 잘 입고 다닐거 같아요
얇다는 평이 많았는데, 생각보다 그렇게 얇지도 않아서 아우터 입고 입으면 따뜻합니다!",5.0
사진과 같습니다. 너무 부드럽고 예쁩니다. 잘 입고다녀요~,5.0
생각보다 두께감도 있고 핏도 괜찮아요. 저렴하게 잘 샀어요,5.0
"디자인 예쁘고 잘 맞아요.
길이가 짧은감이 있지만 그게 매력인것 같아요.
롱부츠랑 환상의 짝궁일듯 합니당~~",4.0
너무 핏하지 않아서 편하게 입기 좋네요 따뜻해요,4.0
여리여리한 핏으로 입기에 좋아요 더 추워지기 전에 입으려고요,5.0
핏 예쁜 필수 니트 원피스 입니다 진작 안사고 망설였던게 후회되네요,5.0
너무너무 짧지만 꽤 도톰하고 라인은 괜찮아요~ 세일 받으면 그냥 뭐 무난합니다,3.0
와 진짜 너무너무너무너무 짧아요 165이상이시면 절대 못입을 느낌입니다.. 심지어 잘올라가요 두께는 꽤 도톰해서 생각했던 막 여리여리한 느낌은 아니지만 라인은 예뻐서 괜찮네요,3.0
가을 겨울에 입을 수 있는 검정 니트 원피스 찾고 있었는데 지난번부터 살까말까 고민하다가 이번에 구입했습니다. 진작살껄 그랬어요 추워져서 아쉽네요 핏 예쁘고 편합니다!,5.0
156인데 … 짧아요 그리고 생각보다 도톰해요 그리고 허리 라인이 좀 더 들어갔으면 좋겠는데 허리가 생각보다 커서 통짜가 되네요.. ? 그리고 어깨부분이 좀 부해보이긴 해요ㅠ,4.0
너무너무 짧지만 꽤 도톰하고 라인은 괜찮아요~ 세일 받으면 그냥 뭐 무난합니다,3.0
와 진짜 너무너무너무너무 짧아요 165이상이시면 절대 못입을 느낌입니다.. 심지어 잘올라가요 두께는 꽤 도톰해서 생각했던 막 여리여리한 느낌은 아니지만 라인은 예뻐서 괜찮네요,3.0
가을 겨울에 입을 수 있는 검정 니트 원피스 찾고 있었는데 지난번부터 살까말까 고민하다가 이번에 구입했습니다. 진작살껄 그랬어요 추워져서 아쉽네요 핏 예쁘고 편합니다!,5.0
156인데 … 짧아요 그리고 생각보다 도톰해요 그리고 허리 라인이 좀 더 들어갔으면 좋겠는데 허리가 생각보다 커서 통짜가 되네요.. ? 그리고 어깨부분이 좀 부해보이긴 해요ㅠ,4.0
"원피스로 입고 싶었지만 기장이 도저히 안되겠어서 가디건이나 롱티로 바지와 같이 입고 있어요ㅎ
그래도 라인이 예뻐서 만족합니다",5.0
"허리는 살짝 남고 어깨는 안 남게 맞아요
근데 약간.. 상체 발달형으로 보여요 입으면",4.0
"소매가 넓게 퍼지는 스타일이라 더 이쁘고 두께감도 있고
너므 달라 붙지 않아서 예뻐요",5.0
"생각보다 두꺼워서 좋았오요!
겨울에 입기좋을 것 같아요!",5.0
하나만 휘뚜루마뚜루 입어도 돼서 편해용 재질도 안따가워요,5.0
길이가 짧다는 후기 많아서 걱정했는데 158인 저한테는 너무 짧지더 길지도 않은 예쁜길이에요! ㅎㅎ두께도 생각보다 두꺼워서 너무 춥지 전에는 입을수 있을꺼같아오!,5.0
