Review,Star
예뻐요. 깔끔하게 잘 왔고 사이즈 넉넉합니다. 롱부츠에도 어울리고 운동화에도 깔끔히 잘 어울릴 것 같습니다. 바지다 보니 활동감좋고 겉으로 보기엔 치마니까 다리도 길어보이고 좋네여 (가랑이가 보이면 다리짧은 분들은 더 짜리몽땅해보입니다ㅠ 그게 접니다) 왜 다들 많이 사는지 알겠어요. 저도 깔별로 미리 사뒀습니다 ㅎㅎ,5.0
포실포실 예뻐요. 흰색 아니고 노란끼 많이 도는 아이보리구요. 블랙보다 좀 더 포실포실하게 부피감있게 올라오는 느낌이네요. 진짜 속바지가 킬포인트인게 이거 하나로 너무 짧은느낌없이 잘 입을 듯 합니다 (짧지만 가릴곳 가려주고 딱 달라붙지 않으니 부담이 덜하는..?) 여행룩 주말룩에 강추입니다. 기분전환하기 좋네요,5.0
예뻐요! 근데 노란빛이 험페이지 사진보다 많이 돌아서 참고하시고 구매하샤야될서 거터요,5.0
생각보다 조금 부담스러운데 말라보이고 이뻐요 바지라서 편해요,5.0
생각한것보다 더 풍성하네요 밴딩이라 편하고 바지라서 짧아도 좋아요,5.0
생각보다 더 풍성해서 약간 부담스러워요 그래도 다리 말라보이고 이뻐요,5.0
구매한 자켓이 아직 안와서 집에 있는거랑 입어봄,4.0
"속바지 고무 짱짱해서 치마 속 철통방어합니다
하얀 색 보단 살짝 노란 기 있는 크림색이에요",5.0
"광고도 많고 후기도 많아서 결국 세일을 못참고 구매했어요!
생각보다 빳빳하고 까슬한 레이스에요! 그리고 엄청 퐁실해서
코디된 느낌이랑 비슷하게 입으면 귀여워요
ㅇ바지처럼 귀엽게 떨어지는데 그부분은 안쪽으로 말아올리면 안보여서 그렇게 입었어요!",5.0
치마가 짧은데 치마바지라서 걱정없이 입을 수 있어요 핏도 이쁘고 여리여리해서 꾸미고 싶은날에 딱인거같아요,5.0
생각보다 더 풍성해서 약간 부담스러워요 그래도 다리 말라보이고 이뻐요,5.0
구매한 자켓이 아직 안와서 집에 있는거랑 입어봄,4.0
"속바지 고무 짱짱해서 치마 속 철통방어합니다
하얀 색 보단 살짝 노란 기 있는 크림색이에요",5.0
"광고도 많고 후기도 많아서 결국 세일을 못참고 구매했어요!
생각보다 빳빳하고 까슬한 레이스에요! 그리고 엄청 퐁실해서
코디된 느낌이랑 비슷하게 입으면 귀여워요
ㅇ바지처럼 귀엽게 떨어지는데 그부분은 안쪽으로 말아올리면 안보여서 그렇게 입었어요!",5.0
치마가 짧은데 치마바지라서 걱정없이 입을 수 있어요 핏도 이쁘고 여리여리해서 꾸미고 싶은날에 딱인거같아요,5.0
"길이가 넘 짧고 검정 흰색 두개 다 샀는데
흰색 허리가 너무 커요",4.0
"이쁜데
넘넘 짧고 살짝 누런 아이보리 색이에요
마음에 듭니다만 살짝 아쉽네여 ㅜ",5.0
고민하고 또 고민해서 산 튜튜스커트.. 후회 읎읍니다.. 존예 그냥 사세요^^ 수,5.0
"빵실빵실 목이 버섯 같은 디테일이 마음에 들어용 치마 내리다가 레이스 부분 찢어져서 마음이 아파여 ㅜ 살살 다루시길 ,,,",5.0
"사진과 그대로에요 디테일들이 괜찮음 
배송도 제때왔어요",5.0
"속바지도 있어서 안 신경쓰이고 좋았어요
실물이랑 사진이랑 같음",5.0
"속바지 내장되어 있어서 짧아도 편하고
디자인이 정말 귀엽습니다 잘 입어지면
블랙으로 또 구매하려고요 ...",5.0
"생각보다 노란색이에요 
사진이 화이트같이 찍혀서 어두워도 아이보리겠거니하고 샀더니 더 노래요",5.0
"퀄리티대비 가격 비싸고 배송도 느렸지만.. 입음
생각보다 많이 노래서 걱정됨",3.0
배송이 엄청 느려요 옷은 예상대로... 가격값 못하지만 함 입어보겠슴둥,3.0
"속바지도 있어서 안 신경쓰이고 좋았어요
실물이랑 사진이랑 같음",5.0
"속바지 내장되어 있어서 짧아도 편하고
디자인이 정말 귀엽습니다 잘 입어지면
블랙으로 또 구매하려고요 ...",5.0
"생각보다 노란색이에요 
사진이 화이트같이 찍혀서 어두워도 아이보리겠거니하고 샀더니 더 노래요",5.0
"퀄리티대비 가격 비싸고 배송도 느렸지만.. 입음
생각보다 많이 노래서 걱정됨",3.0
배송이 엄청 느려요 옷은 예상대로... 가격값 못하지만 함 입어보겠슴둥,3.0
"귀여워요! 퀄리티가 아주 맘에 듭니다
오래 기다린 보람이있네요",5.0
진짜 너무 예뻐요… 몸도 예뻐 보이고 요즘 맨날 입어요,5.0
색감 예쁘고 프릴도 저렴해보이지않고 딱 좋아요 약간 바닐라크림색인데 후드랑 매치해도 이쁠거같네요,5.0
엄청 고민하다가 산건데 역시 기장은 짧지만 기분이 좋아지는 옷이에요 심플하게 입고 이 스커트만 입어도 드레스업되는 느낌이에요,5.0
오래 기다렸는데 치마 너무 귀엽고 예뻐요! 다 잘어울려요,5.0
오래 기다렸는데 치마 너무 귀엽고 예뻐요! 다 잘어울려요,5.0
짧긴하지만 바지로 되어있어서 괜찮아용 공주 풍이지만 상의를 잘입으면 소화될듯해요,5.0
짧은데 바지라서 좋구 넘 이뻐요 💕💕 배송도 예상보다 빨랏구 넘 귀여워용,5.0
"너무너무 귀여운 스커트 팬츠에요 요즘 이런 발레스커트
같은 스커트가 유행이라 사고 싶었는데 풍성하면서 러블리하고 귀여운 느낌을 주는거 같아요 만족스럽습니다 잘 구매 한것 같네요 이뻐요",5.0
생각보다 더 노란빛 많이 도는 크림색이고 길이가 많이 짧지만.. 핏이 너무 이쁘고 포인트로 입기 좋아요,5.0
오래 기다렸는데 치마 너무 귀엽고 예뻐요! 다 잘어울려요,5.0
짧긴하지만 바지로 되어있어서 괜찮아용 공주 풍이지만 상의를 잘입으면 소화될듯해요,5.0
짧은데 바지라서 좋구 넘 이뻐요 💕💕 배송도 예상보다 빨랏구 넘 귀여워용,5.0
"너무너무 귀여운 스커트 팬츠에요 요즘 이런 발레스커트
같은 스커트가 유행이라 사고 싶었는데 풍성하면서 러블리하고 귀여운 느낌을 주는거 같아요 만족스럽습니다 잘 구매 한것 같네요 이뻐요",5.0
생각보다 더 노란빛 많이 도는 크림색이고 길이가 많이 짧지만.. 핏이 너무 이쁘고 포인트로 입기 좋아요,5.0
비슷한 제품들이 요즘 여기저기 많이 나오고 있지만 그래도 일찍 잘 산거 같구요~~ 컬러가 생각보다 더 노란 크림이긴한데 유니크하고 예뻐요:),5.0
올블랙 코디를 많이 입어서 블랙이랑 고민하다 결국 크림컬러 샀는데 너무 이뻐요ㅠㅠ 완전 러블리 그잡채..🫶🏻 그치만 또 부츠랑 레더 자켓과 매치하면 힙하게도 스타일링이 가능해서 완전 최고에요! 가격도 좋고 과하지않고 반바지라 은근 휘뚤템입니다. 봄코디 이걸로 완성이에요!! 블랙도 사고싶어요ㅠ,5.0
올블랙 코디를 많이 입어서 블랙이랑 고민하다 결국 크림컬러 샀는데 너무 이뻐요ㅠㅠ 완전 러블리 그잡채..🫶🏻 그치만 또 부츠랑 레더 자켓과 매치하면 힙하게도 스타일링이 가능해서 완전 최고에요! 가격도 좋고 과하지않고 반바지라 은근 휘뚤템입니다. 봄코디 이걸로 완성이에요!! 블랙도 사고싶어요ㅠ,5.0
넘이쁘고 제 키엔 넘짧긴합니다 ㅎㅎ 좀만 더 길었으면 데일리로 입었을듯,5.0
생각보다 엄청 가벼운소재이고 기엽긴한데 추울땐못입을거같긴하네영,4.0
실물이 훨 이뻐요! 힙하게 입어도 좋고 러블리하게 코디해도 이쁠거같네여!,5.0
마감 괜찮고 디테일도 넘 이쁘어요 봄여름가을에 입기 딱 좋을거같아여! 속치마로 입어도 넘 이쁠거같네여 가격이 좀 있는 편이지만 전 만족합니다,5.0
"솔직히 비싼 것 같음 정가주고는 안살듯
색감은 예쁜데 디자인이 좀 과함
밖에서 입기 좀 그렇다.. 스타일링 잘해야할듯",5.0
배송 좀 느렸음 색감은 레몬 한방울 섞인 아이보리 느낌 디자인은 좀 공주풍 세탁은 안해봐서 모르겠습니다,5.0
생각보다 과해보이긴 하는데 그래도 어떻게 스타일링 하느냐에 따라 다를 것 같긴 합니다.. 그냥 나쁘진 않은것같음,5.0
실물이 훨 이뻐요! 힙하게 입어도 좋고 러블리하게 코디해도 이쁠거같네여!,5.0
마감 괜찮고 디테일도 넘 이쁘어요 봄여름가을에 입기 딱 좋을거같아여! 속치마로 입어도 넘 이쁠거같네여 가격이 좀 있는 편이지만 전 만족합니다,5.0
"솔직히 비싼 것 같음 정가주고는 안살듯
색감은 예쁜데 디자인이 좀 과함
밖에서 입기 좀 그렇다.. 스타일링 잘해야할듯",5.0
배송 좀 느렸음 색감은 레몬 한방울 섞인 아이보리 느낌 디자인은 좀 공주풍 세탁은 안해봐서 모르겠습니다,5.0
생각보다 과해보이긴 하는데 그래도 어떻게 스타일링 하느냐에 따라 다를 것 같긴 합니다.. 그냥 나쁘진 않은것같음,5.0
I like it very much! I have been following the brand for a long time! I finally bought it! I plan to buy black together! Very exquisite!,5.0
예쁘네용 너무 귀엽구 활동하기 편해요 좋습니당,5.0
꺄악 타임세일할 때 너무 잘 샀어요 기번 좋아요 예뻐요,5.0
찬구 선물로 사죴는네 넘 맘에 들고 뿌듯해유 잘입어라 친구야~!,5.0
친구 생일선물로 사줬는데 넘. 맘에 들어해서 저도 좋네요 ㅎㅎ 너무 이뻤어요!!,5.0
생각보다 되게 얇더라구여! 그래두 이쁘구 어떻게 코디할지 고민많이되는..ㅎ 맨투맨에 잘어울릴거같아용 니트두 잘 어울리고,4.0
"세일하길 기다렸어요
사랑해... 볼륨감이 사진으로도 넘쳤지만
실제 받아보니 더 볼륨있는 디자인이에요
부모님앞에서 입기 민망하긴한데
풀메하고 흰스타킹 코디하면 너무 예쁠거같아요
빨리 봄이 왔으면!! 노란끼 있는데
오히려 예뻐요 추천!!",5.0
배송이 조금 느렸는데 그만큼 예쁘기도 예쁘고 생각보다 화려한 느낌이라 어떻게 입을지 고민되지만 잘입을것 같아요! 안에 속바지있는게 진짜 좋습니다,5.0
블랙 크림 가지고 있는데 다른 느낌으로 둘 다 너무 예뻐요ㅠㅠ,5.0
프릴이 과하지 않고 딱 적당히 풍성해서 박시한 상의랑 같이입으면 예뻐요,5.0
생각보다 되게 얇더라구여! 그래두 이쁘구 어떻게 코디할지 고민많이되는..ㅎ 맨투맨에 잘어울릴거같아용 니트두 잘 어울리고,4.0
"세일하길 기다렸어요
사랑해... 볼륨감이 사진으로도 넘쳤지만
실제 받아보니 더 볼륨있는 디자인이에요
부모님앞에서 입기 민망하긴한데
풀메하고 흰스타킹 코디하면 너무 예쁠거같아요
빨리 봄이 왔으면!! 노란끼 있는데
오히려 예뻐요 추천!!",5.0
배송이 조금 느렸는데 그만큼 예쁘기도 예쁘고 생각보다 화려한 느낌이라 어떻게 입을지 고민되지만 잘입을것 같아요! 안에 속바지있는게 진짜 좋습니다,5.0
블랙 크림 가지고 있는데 다른 느낌으로 둘 다 너무 예뻐요ㅠㅠ,5.0
프릴이 과하지 않고 딱 적당히 풍성해서 박시한 상의랑 같이입으면 예뻐요,5.0
속바지에도 레이스가 달려 있어서 속바지 따로 안 입어도 보기 나쁘지 않고 신경 쓰이지 않아서 특히 좋아요:),5.0
"너무 귀여워요 사진 촬영할때 입으려고 샀는데 평소에도 여기저기 잘 입을거 같아요
배송도 빠르고 봄이랑 잘 어울리는 옷!",5.0
예약배송인거 알고 사써요 배송은 굳!! 넘 예뻐요 봄에 입으면 딱,5.0
특별한 날 입을 것 같아요 바지로 되어있어 입기 편해요,4.0
디자인도 독특하고 예뻐요! 특별한 날 입기 좋아요,4.0
너뮤 귀여운 스커트예요 봄에 잘 입고다니겠슴당,5.0
부담 없는 노란 빛바랜 듯한 색상이라서 화이트보다 위화감 없이 어우러져서서 좋아요,5.0
아이보리라 걱정했는데 화이트가 아닌 아이보리인 게 신의 한수였음,5.0
퐁실퐁실해서 귀여워요! 짧지만 바지라서 크게 길이가 신경쓰이진 않습니다. 모양이 쉽게 변형되지 않아서 앉았다 일어날 때도 괜찮아요. 그런데 아이보리는 비침이 있는게 아쉬워요 검은 스타킹이랑 매치하기 조금 그런….,4.0
"화이트 튜튜 느낌의 스커트를 구매하고 싶었는데 이 상품이 
여러 스타일에 매치하기 쉬울 거 같아서 샀습니다.
치마 바지 형태여서 더 편하고 고무줄 밴딩이라 사이즈에 
크게 구애받지 않아요. 만족합니다.",5.0
디자인도 독특하고 예뻐요! 특별한 날 입기 좋아요,4.0
너뮤 귀여운 스커트예요 봄에 잘 입고다니겠슴당,5.0
부담 없는 노란 빛바랜 듯한 색상이라서 화이트보다 위화감 없이 어우러져서서 좋아요,5.0
아이보리라 걱정했는데 화이트가 아닌 아이보리인 게 신의 한수였음,5.0
퐁실퐁실해서 귀여워요! 짧지만 바지라서 크게 길이가 신경쓰이진 않습니다. 모양이 쉽게 변형되지 않아서 앉았다 일어날 때도 괜찮아요. 그런데 아이보리는 비침이 있는게 아쉬워요 검은 스타킹이랑 매치하기 조금 그런….,4.0
"화이트 튜튜 느낌의 스커트를 구매하고 싶었는데 이 상품이 
여러 스타일에 매치하기 쉬울 거 같아서 샀습니다.
치마 바지 형태여서 더 편하고 고무줄 밴딩이라 사이즈에 
크게 구애받지 않아요. 만족합니다.",5.0
너무 귀여운 옷! 아직 입어보지는 않았지만 마음에 듭니다.,5.0
너무 귀염뽀짝한옷이에요! 포인트되는 너무 귀여운옷,5.0
디자인 귀여워요 ໒꒰ྀི∩˃ ᵕ ˂∩꒱ྀི১ 길이가 짧은 편인데 안에 속바지 있어서 좋아요,5.0
"디자인은 캉캉치마인데 약간 불편할거같은 디자인인데
팬츠라서 입으면 편해요! 색감은 화면과 같아요
배송도 빠르고 만족합니당",5.0
"생각보다 퀄리티도 좋고, 바지 타입이라 더 좋아요!",5.0
생각보다 인형옷 재질이에요 .. 발레복 같기두 하고 봄에 잘 입어보겠습니당,4.0
생각보다 인형옷 재질이에요 .. 발레복 같기두 하고 봄에 잘 입어보겠습니당,4.0
짧은데 바지가 있어서 편했구요 그만큼 다리도 엄청 길어보여요 ㅎㅎ,5.0
바지 스타일이라 속바지 없이도 가능한 점이 좋아요,5.0
생각보다 인형옷 재질이에요 .. 발레복 같기두 하고 봄에 잘 입어보겠습니당,4.0
생각보다 인형옷 재질이에요 .. 발레복 같기두 하고 봄에 잘 입어보겠습니당,4.0
짧은데 바지가 있어서 편했구요 그만큼 다리도 엄청 길어보여요 ㅎㅎ,5.0
바지 스타일이라 속바지 없이도 가능한 점이 좋아요,5.0
"스커트 너무 귀여워서 구매했어요 
처음엔 길이가 너무 짧을까봐 걱정했는데
입어보니까 적당하구 이쁩니당 ㅎㅎ
배송도 빠르고, 포장고 꼼꼼하게 배송해주셧네요
색감은 사진으로는 약간 밝은거 같았는데
받아보니 속옷도 안비치고 좋아요!",5.0
생각보다 노래요 좀 더 하얀 아이보리면 좋겠어요. 생각보다 많이 짧아서 길었으면 합니다,5.0
생각보다 많이 노래서 조금 아쉬웠지만 꽤 예쁩니다! 아이보리 버전도 있으면 좋겠고 조금더 길었으면 좋겠엉ㅎ,5.0
"공주 되고 싶은 당신은 얼른 이 상품을 구매하시길… 너무 귀엽고 사랑스럽습니다 ㅎ.ㅎ 짧은 치마지만, 안에 바지가 있어 좋아용 봄에 잘 입고 다닐 듯 싶습니다~!",5.0
예쁜 치마를 가지고 싶어 서치하다가 이 상품을 발견했어요 ㅎㅎ 처음에는 짧은 기장에 고민하다가 막상 입고 돌아 다니니까 치마 안에 바지가 있어 신경쓰이지 않아요! 공주 되고 싶은 분들은 얼른 겟하세요^.^,5.0
튜튜가 풍성해서 존재감이 확실해요! 예약 배송이어서 며칠 기다렸습니다,5.0
"안어울리면 어떡하나 했는데 진짜 귀엽고 바지로 되어잇어서 생각보다 짧은기장인게 부담스럽지 않구요 
그리고 허리도 가늫어보이고 다리도 말라보여요,, 
컬러는 좀 누런 크림컬러인데 검정속옷 입고 입어봣더니
비침이 잇어요,, 속옷컬러는 신경 써야할거 같음!
블랙도 사고싶네영ㅇ",5.0
"in스타나 유튜브에서 많이 보이길래 참지 못하고 ,,, 색상이 좀 누렇(?)다고 해서 얼마나 누렇겠어 하고 시켰더니 진짜 누래용 !!! 아이보리보단 베이지에 더 가까운 느낌 ??? 키가 큰 편 인데도 불구하고 바지가 같이 붙어있어서 넘 편하고  넘 귀여워요 :)",5.0
"안에 같이 동봉되어있는 카드가 맘에 드네요
치마도 이뻐요 아이보리끼 뺀 완전 화이트 컬러도 출시되었으면 좋겠어요",5.0
"안에 같이 동봉되어있는 카드가 맘에 드네요
치마도 이뻐요",5.0
"생각보다 속바지가 들어나는 기장이지만 밴딩이 있어서 허벅지 위로 올려두면 안보이고 괜찮아요
봄되면 줄기차게 입고다니고 싶네요
많이 밝고 연한 레몬크림색인데, 마음에 들어요
발레코어 이제는 가는 물이지만 튀튀는 너무 귀여워서 포기가 어렵네요",5.0
"안어울리면 어떡하나 했는데 진짜 귀엽고 바지로 되어잇어서 생각보다 짧은기장인게 부담스럽지 않구요 
그리고 허리도 가늫어보이고 다리도 말라보여요,, 
컬러는 좀 누런 크림컬러인데 검정속옷 입고 입어봣더니
비침이 잇어요,, 속옷컬러는 신경 써야할거 같음!
블랙도 사고싶네영ㅇ",5.0
"in스타나 유튜브에서 많이 보이길래 참지 못하고 ,,, 색상이 좀 누렇(?)다고 해서 얼마나 누렇겠어 하고 시켰더니 진짜 누래용 !!! 아이보리보단 베이지에 더 가까운 느낌 ??? 키가 큰 편 인데도 불구하고 바지가 같이 붙어있어서 넘 편하고  넘 귀여워요 :)",5.0
"안에 같이 동봉되어있는 카드가 맘에 드네요
치마도 이뻐요 아이보리끼 뺀 완전 화이트 컬러도 출시되었으면 좋겠어요",5.0
"안에 같이 동봉되어있는 카드가 맘에 드네요
치마도 이뻐요",5.0
"생각보다 속바지가 들어나는 기장이지만 밴딩이 있어서 허벅지 위로 올려두면 안보이고 괜찮아요
봄되면 줄기차게 입고다니고 싶네요
많이 밝고 연한 레몬크림색인데, 마음에 들어요
발레코어 이제는 가는 물이지만 튀튀는 너무 귀여워서 포기가 어렵네요",5.0
생각보다 노란 것도 맞는데 그래도 예쁨 검은색도 추가 구매,5.0
좀 튈것 같긴 하는데 그래도 이쁘긴해요! 특별한 날 입을게요,4.0
오랫동암 고민하다가 결국 샀는데 후회 없어요! 정말 공들여서 프릴 작업을 하신 것 같아요. 튜튜 스커트 중에 러프넥이 제일 예쁜 것 같아요.,5.0
오랫동암 고민하다가 결국 샀는데 후회 없어요! 정말 공들여서 프릴 작업을 하신 것 같아요. 튜튜 스커트 중에 러프넥이 제일 예쁜 것 같아요.,5.0
오랫동암 고민하다가 결국 샀는데 후회 없어요! 정말 공들여서 프릴 작업을 하신 것 같아요. 튜튜 스커트 중에 러프넥이 제일 예쁜 것 같아요.,5.0
후기대로 색감이 노란끼가 많이 돌긴하는데 예쁩니다~! 배송이 오래걸렸지만.. 상의 코디를 잘하면 예쁘게 입을 수 있을거같아요~,5.0
생각보다 짧지만 그래도 속바지가 있어서 괜찮아요 이쁘네요,5.0
이런 튀튀 스커트 찾고 있었는데 마음에 들어요~~ 사진보다 조금 더 노란끼 돌아요,4.0
"바지가 요렇게 되어있는지는 몰랐지만 아무튼 귀여워요
밝은 레몬색립니다
빨리 날 풀려서 입고싶어용",5.0
색이나 모양은 사진과 동일하고 발송이 오래걸리긴 했지만 독특한 디자인으로 마음에 드는 제품입니다,4.0
후기대로 색감이 노란끼가 많이 돌긴하는데 예쁩니다~! 배송이 오래걸렸지만.. 상의 코디를 잘하면 예쁘게 입을 수 있을거같아요~,5.0
생각보다 짧지만 그래도 속바지가 있어서 괜찮아요 이쁘네요,5.0
이런 튀튀 스커트 찾고 있었는데 마음에 들어요~~ 사진보다 조금 더 노란끼 돌아요,4.0
"바지가 요렇게 되어있는지는 몰랐지만 아무튼 귀여워요
밝은 레몬색립니다
빨리 날 풀려서 입고싶어용",5.0
색이나 모양은 사진과 동일하고 발송이 오래걸리긴 했지만 독특한 디자인으로 마음에 드는 제품입니다,4.0
좀 짧아서 부담스럽긴한데 속바지 있어서 괜찮음. 백목이버섯 같고 귀여워요.,5.0
고무줄이 살짝 졸려서 완전 편한 느낌은 아니지만 아무 상관 없을 정도로 예뻐요 치마가 아니라 바지 형태라 짧아도 신경 안쓰이고 다리 길어보입니다!,5.0
디자인이 정말 귀엽고 속바지가 있어서 짧은 기장이여도 부담스럽지 않습니다 ! 노란 크림에 가까운 색상이고 어떤 옷에 입어도 어울리네요 !,5.0
디자인이 너무 귀엽고 바지라서 완전 편하고 즇아요,5.0
"속바지가 있어서 짧은 기장이여도 부담스럽지 않습니다 ! 
베이지 노랑 크림의 가까운 색상입니다 ! 디자인이 귀여워서 그런지 어떤 옷에 입어도 잘 어울리고 발레 코어룩이 되네요 !",5.0
바지라서 너무 편하고 좋아요 디자인도 완전 맘에 듭니가 ㅜ,5.0
너무 기엽고 디테일 퀄리티 너무 좋아요 검은색도 살까 고민중입니가 ㅠ,5.0
치마가 큐티하고 공주공주해서 너무 귀여워요 블랙살까 크림 살까 고민하다가 크림샀는데 이게 더귀엽고 짧아도 안에 바지가 있어서 걱정없이 좋아용 굿굿,5.0
생각보다 더 크림색이고 밴딩이 짱짱해서 잘못하면 살툭튀가 될 수도 있다는…!!!,5.0
고민했는데 구매하길 잘했어요 ㅎㅎ 입으면 핏이 넘 예뻐요 허리 얇아보입니다!,5.0
바지라서 너무 편하고 좋아요 디자인도 완전 맘에 듭니가 ㅜ,5.0
너무 기엽고 디테일 퀄리티 너무 좋아요 검은색도 살까 고민중입니가 ㅠ,5.0
치마가 큐티하고 공주공주해서 너무 귀여워요 블랙살까 크림 살까 고민하다가 크림샀는데 이게 더귀엽고 짧아도 안에 바지가 있어서 걱정없이 좋아용 굿굿,5.0
생각보다 더 크림색이고 밴딩이 짱짱해서 잘못하면 살툭튀가 될 수도 있다는…!!!,5.0
고민했는데 구매하길 잘했어요 ㅎㅎ 입으면 핏이 넘 예뻐요 허리 얇아보입니다!,5.0
크림색이라 노란끼 있구요(흰색 이불이랑 차이 큼) 입으면 핏이 넘 예뻐요 허리 얇아보입니다! 고민했는데 구매하길 잘했어요,5.0
아이보리이긴 한데 연한 레몬색 원단이예요 속바지 있어서 편해요!,5.0
진짜 너무 예뻐요 어디든 예쁠 거 같은 치마구 속바지 있어서 좋아요 ㅎㅎ,5.0
진짜 너무 예뻐요 어디든 예쁠 거 같은 치마구 속바지 있어서 좋아요 ㅎㅎ,5.0
아무옷이나 매치해도 예쁘게 소화가능 ㅠㅜ 너무 잘산 것 같아서 좋아요!,5.0
고민 수만번하다가 정가에 온갖 쿠폰 먹여서 구매했는데 안아깝게 퀄리티가 미쳤고 핏도 딱 귀여어요. 근데 구매하니까 세일해서 살짝 슬펐다가 바로 블랙까지 구매했어요.,5.0
너무 귀엽고 예뻐요. 고민 수만번하다가 정가에 온갖 쿠폰 먹여서 구매했는데 안아깝게 퀄리티가 미쳤고 핏도 딱 귀여어요. 근데 구매하니까 세일해서 살짝 슬펐다가 바로 블랙까지 구매했어요. 최고,5.0
"유튜버가 추천했는데 넘 특이하구 퐁실퐁실 기여운 치마라 바로 구매 갈겼어요
치마인줄 알았는데 바지라 짧은데도 되게 편했어요!!
계절 상관없이 코디할 수 있어서 여행갈 때도 잘 입었습니다 ㅎㅎ 색이 완전 쨍한 화이트인줄 알았는데 크림색이더라구요..? 오히려 좋아 😊",5.0
"유튜버가 추천했는데 넘 특이하구 퐁실퐁실 기여운 치마라 바로 구매 갈겼어요
치마인줄 알았는데 바지라 짧은데도 되게 편했어요!!
계절 상관없이 코디할 수 있어서 여행갈 때도 잘 입었습니다 ㅎㅎ 색이 완전 쨍한 화이트인줄 알았는데 크림색이더라구요..? 오히려 좋아 😊",5.0
뷰티유투버 입은거 보고 구매하게됐어여~~2개 구매했는데 맘에들어요~~,5.0
너무 귀엽고 예뻐요. 고민 수만번하다가 정가에 온갖 쿠폰 먹여서 구매했는데 안아깝게 퀄리티가 미쳤고 핏도 딱 귀여어요. 근데 구매하니까 세일해서 살짝 슬펐다가 바로 블랙까지 구매했어요. 최고,5.0
"유튜버가 추천했는데 넘 특이하구 퐁실퐁실 기여운 치마라 바로 구매 갈겼어요
치마인줄 알았는데 바지라 짧은데도 되게 편했어요!!
계절 상관없이 코디할 수 있어서 여행갈 때도 잘 입었습니다 ㅎㅎ 색이 완전 쨍한 화이트인줄 알았는데 크림색이더라구요..? 오히려 좋아 😊",5.0
