Review,Star
너무 맘에 들어요! 허리 부분이 약간 남지만 핏 자체가 예뻐서 부해 보이지 않아요.,5.0
"디자인 이쁘고 기장은 제 신체 사이즈에
미니 원피스였어용 참고해서 구매하세요
재질은 많이 두껍지 않은 초가을용? 니트예요 ㅎㅎ
겨울에 입으시려묜 이너 필요할 듯!
얇은데두 허리 꽤나 잘 잡아주고 핏이 이뻐요 👏🏼👏🏼👏🏼",5.0
생각보다 속 안 보이고 괜찮아요 근데 넘 짧아서 빤스 다 보일 것 같음,3.0
이쁜데 보풀이 너무 잘생기는 것 같기두 이거 빼곤 다 괜찮은것같애용,4.0
아직 안입어 봤지만 여성 스러운 라인으로 입기 좋을것 같음,4.0
사진 보이는 것 보다 도톰하고 무게 좀 있어요 키 158인데도 기장 짧아요 만세하면 아찔할 정도? 장신이신 분들은 똥꼬치마 될듯요 ㅠ 참고하세용! 옷은 이뻐여,5.0
도톰해서 가을겨울에 입기 좋아요. 길이감도 제 키에 적당한 정도입니다!,5.0
"제 키가 작은편이라 저에게 딱 맞는 기장의 니트원피스입니다
너무 딱 달라붙지 않아서 편하고 좋아요!",5.0
허리선이 들어가서 너무 이뻐요 근데 많이 짧아용..,5.0
생각보다 속 안 보이고 괜찮아요 근데 넘 짧아서 빤스 다 보일 것 같음,3.0
이쁜데 보풀이 너무 잘생기는 것 같기두 이거 빼곤 다 괜찮은것같애용,4.0
아직 안입어 봤지만 여성 스러운 라인으로 입기 좋을것 같음,4.0
사진 보이는 것 보다 도톰하고 무게 좀 있어요 키 158인데도 기장 짧아요 만세하면 아찔할 정도? 장신이신 분들은 똥꼬치마 될듯요 ㅠ 참고하세용! 옷은 이뻐여,5.0
도톰해서 가을겨울에 입기 좋아요. 길이감도 제 키에 적당한 정도입니다!,5.0
"제 키가 작은편이라 저에게 딱 맞는 기장의 니트원피스입니다
너무 딱 달라붙지 않아서 편하고 좋아요!",5.0
허리선이 들어가서 너무 이뻐요 근데 많이 짧아용..,5.0
괜찮아요 아직 안입어봤는데 배송은 빠르편이넹ㅎ,3.0
괜찮아요 아직 안입어봤는데 배송은 빠르편이에요,3.0
짧긴 한데 이쁜 니트 원피스예요 코트 입고 입으면 좋아요,5.0
키 164.5기준 조금 짧긴 한데 적당히 예쁜 기장이에요. 생각보다 두껍고 예뻐요,4.0
"길이가 좀 짧은 편이긴 한데 괜찮아용 근데 160 넘는 사람들한테는 많이 짧으실 듯,, 살짝 부해보이긴 한데 이뻐욤",5.0
"길이가 좀 짧은 편이긴 한데 괜찮아용 근데 160 넘는 사람들한테는 많이 짧으실 듯,, 살짝 부해보이긴 한데 이뻐욤",5.0
제가 상비라서 그런 건지는 모르겠는데 핏이 조금 애매해요... 오히려 저는 단추 다 풀러서 가디건 걸치듯이 입으니까 훨 예쁜 것 같네요!,4.0
"생각보다 도톰한 소재
목이 너 파였으면 해서 수선 예정",5.0
"164기준 뒤에가 너무 짧아요 ㅜㅠ
그래도 니트원피스인데 핏좋고 안뚱뚱해보여서 젛아여",5.0
"길이가 좀 짧은 편이긴 한데 괜찮아용 근데 160 넘는 사람들한테는 많이 짧으실 듯,, 살짝 부해보이긴 한데 이뻐욤",5.0
"길이가 좀 짧은 편이긴 한데 괜찮아용 근데 160 넘는 사람들한테는 많이 짧으실 듯,, 살짝 부해보이긴 한데 이뻐욤",5.0
제가 상비라서 그런 건지는 모르겠는데 핏이 조금 애매해요... 오히려 저는 단추 다 풀러서 가디건 걸치듯이 입으니까 훨 예쁜 것 같네요!,4.0
"생각보다 도톰한 소재
목이 너 파였으면 해서 수선 예정",5.0
"164기준 뒤에가 너무 짧아요 ㅜㅠ
그래도 니트원피스인데 핏좋고 안뚱뚱해보여서 젛아여",5.0
164기준 치마가 좀 많이 짧아요ㅠㅠ 그거 외엔 날씬해보이고 핏 너무이뻐요!,5.0
두께감이 있어서 따뜻하고 포근해요 이쁘고 좋아요!!,5.0
여기 옷이 전반적으로 키 큰 사람들한테 좋은 거 같아요..! 키 작은 저는 상의만 사야겠네용ㅜㅜ 옷 자체는 군더더기 없이 예쁩니다,4.0
후기보고 짧을줄 알았능데 생각보다 괜찮아여!! 도톰합니다,5.0
세일해서 충동적으로 저렴하게 구매한 거라 기대 안 했는데 넘 예뻐용,5.0
이거 진짜 이뻐요 세일할때 싸서 샀는데 이상적인 니트원피스핏?? 이에요 진짜 이쁘니까 고민하고 계시면 꼭 사세용,5.0
"무게는 가볍고 아주 두껍지도 얇지도 않은 두께에요
라인은 이쁘게 떨어지고 길이가 짧긴하지만 잘 입을 수 있을거같아요! 대신 손들면 까꿍입니다",5.0
제가 상비라서 그런 건지는 모르겠는데 핏이 조금 애매해요... 오히려 저는 단추 다 풀러서 가디건 걸치듯이 입으니까 훨 예쁜 것 같네요!,4.0
"생각보다 두껍고 널널해요
지금 날씨에 입기 딱 좋습니다.",5.0
허리 라인이 들어가 있어 너무 좋았습니다 사진이랑 똑같아요!,5.0
"무게는 가볍고 아주 두껍지도 얇지도 않은 두께에요
라인은 이쁘게 떨어지고 길이가 짧긴하지만 잘 입을 수 있을거같아요! 대신 손들면 까꿍입니다",5.0
제가 상비라서 그런 건지는 모르겠는데 핏이 조금 애매해요... 오히려 저는 단추 다 풀러서 가디건 걸치듯이 입으니까 훨 예쁜 것 같네요!,4.0
"생각보다 두껍고 널널해요
지금 날씨에 입기 딱 좋습니다.",5.0
허리 라인이 들어가 있어 너무 좋았습니다 사진이랑 똑같아요!,5.0
"여성스러워 보입니다 예빠요 ㅎㅎ 
조금 짧지만 잘입을게요",5.0
"예뻐요 조금 짧긴 하지만 예뻐요 아주 굿
여성스러워보임",5.0
단독으로 입긴 그렇고 스커트랑 같이입으니 괜찮아요,4.0
길이는 적당한데 팔이랑 몸통이 좀 많이 남아요 허리부분 안잡아줄줄 알았는데 좀 잡아주고 엄청 얇지도 않고 쫀쫀해요~,5.0
사기전엔 얇을줄 알았는데 생각보다 더 두꺼워서 겨울에 입어도될것 같아요,5.0
사기전엔 얇을줄 알았는데 생각보다 더 두꺼워서 겨울에 입어도될것 같아요,5.0
사기전엔 얇을줄 알았는데 생각보다 더 두꺼워서 겨울에 입어도될것 같아요,5.0
배송빠르고 라인도이쁘고가격도 착합니다 오래입을거같아요,5.0
"아이보리도 구매하고 싶었는데 같은옷만 색상 다른것보다 다른 디자인으로 사는게 낫겠다 싶어서 블랙만 구매했거든요? 근데 아이보리가 너무 눈에 아른거려서 다른곳에서 비슷한걸 샀지만… 너무 후회했어요 비슷해도 퀄리티가 어반드레스가 훨씬 좋아요 마감처리나 로고, 재질 자체가 달라요ㅠㅠ 2만원 더주고라도 어반꺼 살걸 후회막심이네요ㅠㅠ",5.0
"생각보다 짧아서 키 크신 분들은 총장 꼭 확인 하세요!
그래도 옷 자체가 너무 예뻐서 겨울용 반바지랑 입으면 딱이에요.
얇은 편이지만 니트류라서 가을엔 단독으로 입어도 좋을 거 같아요!",5.0
사기전엔 얇을줄 알았는데 생각보다 더 두꺼워서 겨울에 입어도될것 같아요,5.0
사기전엔 얇을줄 알았는데 생각보다 더 두꺼워서 겨울에 입어도될것 같아요,5.0
배송빠르고 라인도이쁘고가격도 착합니다 오래입을거같아요,5.0
"아이보리도 구매하고 싶었는데 같은옷만 색상 다른것보다 다른 디자인으로 사는게 낫겠다 싶어서 블랙만 구매했거든요? 근데 아이보리가 너무 눈에 아른거려서 다른곳에서 비슷한걸 샀지만… 너무 후회했어요 비슷해도 퀄리티가 어반드레스가 훨씬 좋아요 마감처리나 로고, 재질 자체가 달라요ㅠㅠ 2만원 더주고라도 어반꺼 살걸 후회막심이네요ㅠㅠ",5.0
"생각보다 짧아서 키 크신 분들은 총장 꼭 확인 하세요!
그래도 옷 자체가 너무 예뻐서 겨울용 반바지랑 입으면 딱이에요.
얇은 편이지만 니트류라서 가을엔 단독으로 입어도 좋을 거 같아요!",5.0
"생각보다 더 두툼한 스타일의 니트원피스에요
맨살에 입어도 부드러워요",5.0
"벨트와 같이 매치해서 허리를 잡아주게 입고, 롱부츠랑 매치하니 너무 예쁘네요",5.0
"진짜 너무이뻐요
55입는데 딱 예쁘게맞아요
옷감이 여러번입으니 살짝 보풀이 나려하지만
디자인이 진짜 최애입니다
세일가에 감사히 입고있어요",5.0
"아직 입고 나가지 못했지만 디자인이나 핏은 너무 예뻐요
약간 큐티하면서 예쁜거  같아요 ㅎㅎ",5.0
"넘 이쁘고 허리 라인 잡아줘서 좋은데, 짧다..
가만히 있으면 괜찮은데 손 들거나 다리 좀 올리면 속옷 보인다.. ㅠ",4.0
"배송도 너무 빠르고 화면하고 똑같아서 너무 좋았어요 
살 쪄서 걱정했는데 핏도 좋아서 히뚜루마뚜루 잘 입을거 같습니다 어반드레스 최고ㅠㅜ",5.0
길이가 짧아서 조금 부담스러웠지만 예쁘게 입었어요. 어디든 무난하게 코디해서 입을 수 있고 목부분이 많이 파이지 않아서 괜찮았어요,5.0
길이가 짧아서 조금 부담스러웠지만 예쁘게 입었어요. 목 부분은 많이 파이지 않아서 부담없이 입을 수 있어요,5.0
너무 길지도 짧지도 않아서 좋았어요 핏도 딱 예쁜 핏인데 도톰해서 마음에 들어요,5.0
나쁘지 않아요! 다만 그렇게 고급져 보이진 않습니다. 휘뚜루 마뚜루 입기 좋아요!,4.0
"배송도 너무 빠르고 화면하고 똑같아서 너무 좋았어요 
살 쪄서 걱정했는데 핏도 좋아서 히뚜루마뚜루 잘 입을거 같습니다 어반드레스 최고ㅠㅜ",5.0
길이가 짧아서 조금 부담스러웠지만 예쁘게 입었어요. 어디든 무난하게 코디해서 입을 수 있고 목부분이 많이 파이지 않아서 괜찮았어요,5.0
길이가 짧아서 조금 부담스러웠지만 예쁘게 입었어요. 목 부분은 많이 파이지 않아서 부담없이 입을 수 있어요,5.0
너무 길지도 짧지도 않아서 좋았어요 핏도 딱 예쁜 핏인데 도톰해서 마음에 들어요,5.0
나쁘지 않아요! 다만 그렇게 고급져 보이진 않습니다. 휘뚜루 마뚜루 입기 좋아요!,4.0
"조금 후즐지근해보일 수 있긴한데, 허리 핏이 예쁘게 떨어져서 마음에 들어요. 다만 기장이 짧아서 팔은 못 들거같아요.",5.0
"넘예쁨 봄되서 자주 입을 것임
지금은 니트로 활용
봄에는 원피스로 입을 예정 화이팅",5.0
단독으로 입긴 그렇고 스커트랑 같이입으니 괜찮아요,4.0
짧다는 리뷰 보고 샀어요! 조금 짧긴 한데 그래도 예뻐요!,5.0
키가 작아서인지 길이감은 짧은 느낌은 안들었어요.롱부츠에 코디하면 이쁘긴하네요 ㅎㅎ몸에 비해 팔뚝살이 부자라 그런지 ㅜㅠ하체에 비해서 상체가 우람해보이지만 원피스 자체 라인은 입으면 너무 이쁩니다.손 쪽으로 팔 통이 넓어서 긴팔원숭이같지만 팔뚝 좀 빼고 이쁘게 입어볼게요,4.0
키작녀에게는 너무 크고 길어서 입기가 힘들어용 ㅠㅠ,3.0
"키작녀에게는  너무너무 크고 긴 어반드레스…..
슬푸다",3.0
너무 이뻐욘 너무 이뻐욘 너무 이뻐욘 너무 이뻐욘,5.0
모델 사진이 예뻐서 구매했는데 생각보다 핏이 더 예뻐요! 다만 길이가 좀 짧아서 160 이상이시면 너무 짧아 못 입을 것 같네용ㅎㅎ 저도 팔 들면 속옷 다 보여요!,5.0
디자인이나 색상이 사진하고 동일하고 마음에 듭니다 배송도 빨랐어요 감사합니다 많이파세요,5.0
키작녀에게는 너무 크고 길어서 입기가 힘들어용 ㅠㅠ,3.0
"키작녀에게는  너무너무 크고 긴 어반드레스…..
슬푸다",3.0
너무 이뻐욘 너무 이뻐욘 너무 이뻐욘 너무 이뻐욘,5.0
모델 사진이 예뻐서 구매했는데 생각보다 핏이 더 예뻐요! 다만 길이가 좀 짧아서 160 이상이시면 너무 짧아 못 입을 것 같네용ㅎㅎ 저도 팔 들면 속옷 다 보여요!,5.0
디자인이나 색상이 사진하고 동일하고 마음에 듭니다 배송도 빨랐어요 감사합니다 많이파세요,5.0
전체적으로 큰데 검정이라서 그런가 옷에 잡아먹힌 느낌이라 많이 못 입었어용 라인은 예쁘게 해주는 것 같아요!,4.0
"편하고 이뽀서 너무 다주 입었더니 금방 피에요
그래도 이뻐서 자꾸 입어요",5.0
예뻐용 ! 생각보다 도톰하고 좋습니다 근데 다른 후기들처럼 길이가 짧긴 합니다,5.0
니트가 얇지도 않고 탄탄해용 기장이 짧은편이지만 블랙이라 저렴해보이지도 않습니당,5.0
"기장이 짧은 감은 있지만 꾸안꾸로 입기 좋을거같어용
허리 라인이 들어가보여서 몸매 좋아보이는듯합니다!",5.0
"생각보다 니트재질이 두꺼워서 한겨울에도
입을수있겠어요  울세탁했는데
변형없구요 디자인도 이뻐요",5.0
다리 짧은 편인 159인데 입었을 때 딱 예쁜 길이지만 매우 조심해야하는 길이에요 머리 정리하려고 손 들면 허벅지까지 올라가고 숙이면 팬티 보일랑말랑 느낌쑤,4.0
"상체에 살이 있는편이라서 조금 부해보였긴힌지만, 밑으로 퍼지는 디자인 이어서 허리가 짱 얇아보임!
가을,봄에 완전 추천해요",5.0
"생각보다 헐렁한핏이었어요 이쁘긴한데 라인을 좀 더 잡아주는핏이었으면 더 좋았겠다 조금 아쉽지만
이뻐요",4.0
키가작은편인데 기장은 짧은편이고 롱부츠랑 찰떡일거같아요 두툼하고 안따가워요 허리라인들어간것도 이뻐요,4.0
"생각보다 니트재질이 두꺼워서 한겨울에도
입을수있겠어요  울세탁했는데
변형없구요 디자인도 이뻐요",5.0
다리 짧은 편인 159인데 입었을 때 딱 예쁜 길이지만 매우 조심해야하는 길이에요 머리 정리하려고 손 들면 허벅지까지 올라가고 숙이면 팬티 보일랑말랑 느낌쑤,4.0
"상체에 살이 있는편이라서 조금 부해보였긴힌지만, 밑으로 퍼지는 디자인 이어서 허리가 짱 얇아보임!
가을,봄에 완전 추천해요",5.0
"생각보다 헐렁한핏이었어요 이쁘긴한데 라인을 좀 더 잡아주는핏이었으면 더 좋았겠다 조금 아쉽지만
이뻐요",4.0
키가작은편인데 기장은 짧은편이고 롱부츠랑 찰떡일거같아요 두툼하고 안따가워요 허리라인들어간것도 이뻐요,4.0
가격에비해 재질도 괜찮고 두툼해요 기장은 짧은편이라 조심해야할듯 허리라인 들어간것도 이뻐요,4.0
생각보다 팔부분이 작네요 힝 제가 다이어트를 해서 입겠습니다,4.0
허리도 잘록해보이고 착용감 괜찮은것 같아요. 그런데 팔은 기네요. 봄이 오면 입고 다녀야 될것 같아요. 가격대비 만족입니다.,4.0
허리도 잘록해보이고 착용감 괜찮은것 같아요. 그런데 팔은 기네요. 봄이 오면 입고 다녀야 될것 같아요. 가격대비 만족입니다.,4.0
니트 원피스 넘 이뻐요 여성스러우면서도 뭔가 살짝 매혹적인 느낌도 나고 여러번 입게 될 것 같아요 ! 검스에 입어도 좋고 그냥 입어도 이뻐요 >_<,5.0
가성비 좋은 겨울 원피스예요! 키 작은 분들에게 추천합니다.,5.0
"재질은 생각보다 부드러워요! 제가 키가 작은데도 조금 부담스러운 길이네요. 키 크신분들한텐 너무 짧을 것 같아요.
소매는 플레어?느낌으로 퍼지는 것이 이뻐요ㅎㅎ
날이 따뜻해서 살스에 스피드러너 신었는데, 싸이하이 부츠나 롱부츠에 매치하려고 샀어요. 추운 날엔 목폴라에 부츠로 스타일링 하려구요. 가성비 좋은 겨울 원피스입니다ㅎㅎ",5.0
소재 탄탄한 느낌인데 상체가 막 날씬해보이는 핏은 아니에요. 고민 많이했는데 원피스랑 레이어드해서 여기저기 입어보려고 품었습니다!,3.0
상체가 막 날씬해보이는 핏은 아니에요. 고민 많이했는데 원피스랑 레이어드해서 여기저기 입어보려고 품었습니다!,3.0
길이는 적당한데 팔이랑 몸통이 좀 많이 남아요 허리부분 안잡아줄줄 알았는데 잘 잡아주고 엄청 얇지도 않고 쫀쫀해요~,5.0
가성비 좋은 겨울 원피스예요! 키 작은 분들에게 추천합니다.,5.0
"재질은 생각보다 부드러워요! 제가 키가 작은데도 조금 부담스러운 길이네요. 키 크신분들한텐 너무 짧을 것 같아요.
소매는 플레어?느낌으로 퍼지는 것이 이뻐요ㅎㅎ
날이 따뜻해서 살스에 스피드러너 신었는데, 싸이하이 부츠나 롱부츠에 매치하려고 샀어요. 추운 날엔 목폴라에 부츠로 스타일링 하려구요. 가성비 좋은 겨울 원피스입니다ㅎㅎ",5.0
소재 탄탄한 느낌인데 상체가 막 날씬해보이는 핏은 아니에요. 고민 많이했는데 원피스랑 레이어드해서 여기저기 입어보려고 품었습니다!,3.0
상체가 막 날씬해보이는 핏은 아니에요. 고민 많이했는데 원피스랑 레이어드해서 여기저기 입어보려고 품었습니다!,3.0
길이는 적당한데 팔이랑 몸통이 좀 많이 남아요 허리부분 안잡아줄줄 알았는데 잘 잡아주고 엄청 얇지도 않고 쫀쫀해요~,5.0
"몸에 착 붙는 슬림한 핏
겨울이라 안에 슬립입고 겹쳐 입어요,롱부츠랑 신고 칼라 머플러해서 가볍게 입어요.쇽패딩 코디추가하면 지금 날씨도 dk",4.0
사진이랑 비슷한데 허리가 조금 널널해서 너무 마르싴 분들은 허리가 남을거 같아용,5.0
위시 담아뒀다가 할인하길래 구매했어요 ㅎㅎ 살을 좀 더 빼면 이쁘게 입을 수 있을 듯^.^.. ㅎㅎ 기장이 생각보다 짧아서 허벅지 커버는 어려우나 이쁘긴 해요….,4.0
색감 선명하고 꼬임 니트 디테일이 너무 예뻐요~! 탄탄하고 도톰해서 마음에 들지만 유일한 단점은 너무 짧다는 부분입니다..,4.0
얇고 흐물텅할 줄 알았는데 생각보다 도톰하고 탄탄한 재질이라 놀랐어요!! 디자인 너무 예뻐요~ 다만 좀 많이 짧긴 하네요.. 저는 이너원피스 사서 안에 받쳐입을 생각입니다,4.0
살을 좀 더 빼면 이쁘게 입을 수 있을 듯^.^.. ㅎㅎ 기장이 생각보다 짧아서 허벅지 커버는 어려우나 이쁘긴 해요….,4.0
와 제 키에도 짧네요 사진 상으로 봤을 때는 얇아 보였는데 니트 재질이네요,5.0
"유교녀에겐 허락할 수 없는 길이네요 ㅜㅜ
예쁘지만.. 이렇게 입는건 집에서만 입어보는걸루 만족하고 레이어드해서 아래 뭘 입어야할듯합니다

딱 금액만큼 싼재질이오요",5.0
키가 작은편인데 짧은편이에요 롱부츠랑 찰떡이에요 재질도 가격에비해 좋아요 두툼하고 따뜻함,5.0
"예뻐요.잘코디해서입어볼게요.
블랙,베이지 두종료 구매했어요.",4.0
살을 좀 더 빼면 이쁘게 입을 수 있을 듯^.^.. ㅎㅎ 기장이 생각보다 짧아서 허벅지 커버는 어려우나 이쁘긴 해요….,4.0
와 제 키에도 짧네요 사진 상으로 봤을 때는 얇아 보였는데 니트 재질이네요,5.0
"유교녀에겐 허락할 수 없는 길이네요 ㅜㅜ
예쁘지만.. 이렇게 입는건 집에서만 입어보는걸루 만족하고 레이어드해서 아래 뭘 입어야할듯합니다

딱 금액만큼 싼재질이오요",5.0
키가 작은편인데 짧은편이에요 롱부츠랑 찰떡이에요 재질도 가격에비해 좋아요 두툼하고 따뜻함,5.0
"예뻐요.잘코디해서입어볼게요.
블랙,베이지 두종료 구매했어요.",4.0
모델언니처럼 여리여리한 느낌은 안나지만 여성스럽고 검은색이라 비침 부담없이 입을 수 있어요! 연말룩으로도 좋을것같아요><,5.0
장바구니에 한참 담아뒀다가 블프 할인때 얼른 샀지요 ㅋㅋ 전부터 눈독들이고 있었는데 기대한 만큼 너무 만족스러워요!! 아이보리랑 고민했는데 니트소재라 좀 부해보일까봐 블랙했어요 입어봤더니 역시나 어깡인 저는 블랙이 더 나은듯해요 ㅠㅠ 이 옷에 워커나 부츠 신으먄 찰떡!,5.0
"미니 스커트라서 부츠에 
코디도 편하네요…
가볍게 패딩이나 코트안에 입기엔
괜찮을거같아요~
많이 짧긴합니다.",4.0
"사실 너무 많이 고민한 옷이에요 뚱뚱해보일까보ㅓ?
근데 생각보다 전혀 안뚱뚱해보이네요
그냥 본인이 뚱뚱허지 않은 사람이라면 뚱뚱해보이지 않을거에요ㅎㅎ
옷 싸게 잘 사서 좋아요!",5.0
"사실 너무 많이 고민한 옷이에요 뚱뚱해보일까보ㅓ?
근데 생각보다 전혀 안뚱뚱해보이네요
그냥 본인이 뚱뚱허지 않은 사람이라면 뚱뚱해보이지 않을거에요ㅎㅎ
옷 싸게 잘 사서 좋아요!",5.0
"팔부분은 생각보다 널널한데 전체적으로 괜찮아요
그리고 생각햇던것보단 조금 두꺼운 재질이에요",4.0
이 가격에 이 정도 퀄리티면 매우 만족합니다. 배송도 매우 빠른편이어서 좋고 허리가 살짝 들어가있는 라인이 좋아요,5.0
디자인 깔끔하고 길이도 짧긴한데 괜찮은 정도에요,5.0
너무 좋아요 ! 세일할때 사서 만족스러워요 보풀은 좀 잘 일어날것같아요,5.0
"156cm에 허벅지 반정도 와요
저한테는 많이 짧지않아서 좋었어요",5.0
이 가격에 이 정도 퀄리티면 매우 만족합니다. 배송도 매우 빠른편이어서 좋고 허리가 살짝 들어가있는 라인이 좋아요,5.0
디자인 깔끔하고 길이도 짧긴한데 괜찮은 정도에요,5.0
너무 좋아요 ! 세일할때 사서 만족스러워요 보풀은 좀 잘 일어날것같아요,5.0
"156cm에 허벅지 반정도 와요
저한테는 많이 짧지않아서 좋었어요",5.0
"가볍게 코트안에 입거나
롱부츠에 코디용으로는 양호해요~",5.0
"가볍게 코트안에 입기엔
괜찮을거같아요~
미니 스커트라서 부츠에 코디도
편할거같구요..",5.0
"바지랑도 어울리고 스커트랑도 어울려요.
두껍고 보풀은 니트라 어쩔수 없네요",5.0
"바지랑도 어울리고 스커트랑도 어울려요.
두껍고 보풀은 니트라 어쩔수 없네요",5.0
"바지랑도 어울리고 스커트랑도 어울려요.
두껍고 보풀은 니트라 어쩔수 없네요",5.0
좋아오 배송도 빠르고 너무만족합니다요 최고입니더,5.0
무난하니 이가격에 이정도면 만족해요 좋아요 헤헤,5.0
옷이 생각보다 조금 짧긴 하지만 핏이 미쳤습니다...,5.0
워낙 후기가 많아서 기대했는데 고민한 시간이 아까워요ㅠ,5.0
생각보다 짧아요  마르고 160초반 분들까지 예쁠것같아요,5.0
좋아오 배송도 빠르고 너무만족합니다요 최고입니더,5.0
무난하니 이가격에 이정도면 만족해요 좋아요 헤헤,5.0
옷이 생각보다 조금 짧긴 하지만 핏이 미쳤습니다...,5.0
워낙 후기가 많아서 기대했는데 고민한 시간이 아까워요ㅠ,5.0
생각보다 짧아요  마르고 160초반 분들까지 예쁠것같아요,5.0
재질은 괜찮고 다 좋은데 생각보다 많이 짧아요 엉덩이가 커서그런가,5.0
니트가 부드럽지는 않지만 이쁘고 기장도 적당해서 잘 입고 다닐 수 있어요 딱 무난한 원피스입니다!!,5.0
니트가 부드럽지는 않지만 이쁘고 기장도 적당해서 잘 입고 다닐 수 있어요 딱 무난한 원피스입니다!!,5.0
출근용으로 입으려고샀는데.혹시.넘  파였을까  걱정했는데 부담스럽지않고 다들 이쁘다고 하네요 ㅎㅎ 소매부분도 이쁘고 포근하고 만족스러워요,5.0
"제가 상비라서 가슴부분이 작은거빼고는
이쁩니다
적당한 바스트이신 분들은 예쁘게
맞을것같아요",5.0
두께도 톡톡하고 사이즈도 딱 좋았어요~ 허리가 널널해서 편하게 입기 좋아용!!!,5.0
키작녀에게 잘 맞는 길이고 부드럽고 이쁜데 한겨울에 입긴 어렵겠어요~ 마음에듭니다,5.0
검정색샀는데 흰색도 탐나요!! 한겨울은 조금 추울것같아요,5.0
"가격 완전 맘에들때 샀는데 배송 및 포장 굿이였고요. 길이는 158 기준으로 딱 좋아요. 160이상 은 좀 짧으실듯 하고요. 타이트하게 붙는 핏이 아니고, 정55 입는데요. 사이즈 여유있어서 좋아요^^",5.0
"오 진짜 후기들 처럼 짧긴 짧아요
전 키가 작아서 소화 가능하긴 한데
160 넘으시는 분들은 비추..",4.0
두께도 톡톡하고 사이즈도 딱 좋았어요~ 허리가 널널해서 편하게 입기 좋아용!!!,5.0
키작녀에게 잘 맞는 길이고 부드럽고 이쁜데 한겨울에 입긴 어렵겠어요~ 마음에듭니다,5.0
검정색샀는데 흰색도 탐나요!! 한겨울은 조금 추울것같아요,5.0
"가격 완전 맘에들때 샀는데 배송 및 포장 굿이였고요. 길이는 158 기준으로 딱 좋아요. 160이상 은 좀 짧으실듯 하고요. 타이트하게 붙는 핏이 아니고, 정55 입는데요. 사이즈 여유있어서 좋아요^^",5.0
"오 진짜 후기들 처럼 짧긴 짧아요
전 키가 작아서 소화 가능하긴 한데
160 넘으시는 분들은 비추..",4.0
편하고 길이도 이쁜거같아요 마음에들어서 화이트도 고민중입니다,5.0
