title,keyword
[무료반품]베켄바우어 트랙탑 - 인디고_IP0418,"사이즈, 아디다스, 편하다, 색감, 만족하다, 져지, 재질, 기장, 가을, 핏"
파이어버드 트랙탑 - 블랙_IJ7058,"사이즈, 배송, 편하다, 아디다스, 핏, 져지, 보리, 크다, 기장, 적당하다"
ASI 포시즌 에센셜 피그먼트 후드집업_차콜 그레이,"색감, 사이즈, 지퍼, 배송, 편하다, 핏, 디자인, 적당하다, 무겁다, 가격"
[무료반품]베켄바우어 트랙탑 - 블랙화이트_II5763,"사이즈, 배송, 디자인, 아디다스, 포인트, 핏, 흔하다, 흰색, 보리, 크다"
2WAY 스웻 후드 집업 (MELANGE GREY),"사이즈, 지퍼, 편하다, 핏, 적당하다, 후드 집업, 기장, 크다, 길이, 투"
[유튜버 PICK]FR-40S 프렌치 워크 5P 자켓_Military Navy,"사이즈, 디자인, 크다, 편하다, 만족하다, 오버핏, 핏, 어울리다, 걸치다, 배송"
[쿨탠다드] 릴렉스드 베이식 블레이저 [블랙],"여름, 시원하다, 사이즈, 블 레이저, 얇다, 핏, 편하다, 가격, 가성비, 배송"
시어 후드 베스트 블랙,"얇다, 여름, 사이즈, 편하다, 가볍다, 재질, 덥다, 걸치다, 가격, 배송"
[SAINT YEAR] 세미 오버 핏 셋업 수트_GREY,"사이즈, 핏, 바지, 가성비, 적당하다, 가격, 결혼식, 얇다, 색감, 셋업"
MATIN KIM LOGO COATING JUMPER IN BLACK,"사이즈, 배송, 재질, 디자인, 얇다, 편하다, 마뗑킴, 가을, 만족하다, 핏"
