Review,keyword
진짜 여름용이라 시원하고 비닐 느낌이에요 핏엄청 좋아요 일복 으로 하나더 구매 하려구오,"여름 용이, 구오, 시원하다, 하나, 일복, 비닐, 핏엄청"
색감이 이쁘고 스트릿하게 입기 좋은 옷입니다 넣어입어도 이쁘고 빼입어도 이뻐요,"색감, 스트릿, 빼, 넣다"
사이즈 적당하고 컬러감 좋습니다 기본티로 활용하기 좋네요 ,"적당하다, 활용, 티, 사이즈, 컬러"
다 만족합니다 근데 생각보다 되게 크네옹 그래도 잘 입겟슴다,"만족하다, 크다 옹, 입겟슴다"
탄한 옷으로 세탁하면 할수록 매력적인 질감과 컬러로 변하네요 ,"매력, 세탁, 변하다, 질감, 컬러"
옷이 큽니다 그래도 이쁘네요 좋습니다 가성비 최고,"크다, 가성비, 최고"
역시 믿고 입는 소버먼트 너무 좋고 이뻐요 감사해요,"버먼 트, 믿다"
오버핏으로 나와서 라지도 크네요 딱 맞는 것 갗아요,"나오다, 라지, 크다, 오버핏, 맞다, 갗아"
색삼 좋고 너무 얇지 않아서 좋네요 나중에 다른 색상도 사야겠어요,"색상, 나중, 색삼, 얇다"
옷 원단이 너무 좋고 마감도 좋네요 만족스럽습니다 ,"만족스럽다, 원단, 마감"
탄한 소재에 색감도 예쁘네요 여름에도 체형보완 굿,"체형 보완, 소재, 여름, 색감"
심플해 보이지만 멋스러워요 소재도 좋고 맘에 들어요 ,"심플, 보이, 소재, 멋 스럽다"
배송이 빨라서 좋았어요 원하는 색이라서 자주 잊어요,"배송, 색, 원하다, 잊다"
사이즈 좋고 핏좋고 편하고 변형감없어요 색도 갠잔고,"갠 잔고, 편하다, 사이즈, 색도, 핏좋, 변형 없다"
깔끔하고 두께도 적당해서 여름에 입기에 딱이에요 ,"적당하다, 여름, 딱이다, 두께, 깔끔하다"
청바지와 입어도 원턱팬츠와 입어도 잘 어울려요 ,"턱 팬츠, 어울리다, 청바지"
사이즈 크게 나와서 좀 작게 시켰더니 아주 좋움요,"사이즈, 나오다, 작다, 크게"
차콜이라 어떤 바지랑 입어도 좋아요 L사이즈여서 넉하니 좋아요 ,"사이즈, 차콜, 바지, 어떻다"
깔끔하고 생각보다 안두꺼워서 한여름에도 잘 입을 것 같습니다,"한여름, 두껍다, 깔끔하다"
오버핏이고 살짝 큰편이에요 색감 이쁘고 좋아요,"크다 편이, 색감, 오버핏"
구입해보니까 너무좋아요 재구매 의사가 가득합니다 추천드려요 ,"추천 드리다, 가득하다, 재다, 의사"
예쁩니다 빛 각도에따라서 짙은 브라운느낌도 살짝 나는 거 같기도 하구요 다른 색도 궁금해서 블루랑 스톤네이비도 같이 구입했는데 색감 비교샷도 같이 올려봅니다 ,"올리다, 스톤 네이비, 궁금하다, 블루, 색도, 색감, 짙다"
무지티 중에서 제일 잘입고 있습니다 보통의 반팔티들보다 두껍고 짱합니다,"보통, 티, 중, 무지 티, 제일, 짱하다, 두껍다"
배송도 잘지켰고 제품이 너무 좋아여 자주애용합니다,"애용, 배송, 제품, 지키다"
배송은 조금 걸리긴했지만 색상 맘에듭니다 좋아요,"맘에듭니, 배송, 색상, 걸리다"
생각했던 것보다 몸에 닿는 느낌이 좋아요 편하게 툭 입으면 아무 바지에나 잘 맞는거 같네요 ,"편하다, 바지, 몸, 맞다, 닿다"
재질이나 두께감 핏은 너무너무 맘에들고 좋습니다 다만 옷이 좀 커요 레이어드 티를 입고 입을랬는데 레이어디 티를 덮어버립니다 그냥 단독으로 입거나 넣입해야겠어요,"재질, 레이, 레이어 드, 크다, 단독"
색깔 너무 좋고 핏 좋고 목부분도 잘 안늘어날거같아요,"목 부분, 늘어나다, 색깔"
기장이 너무 길어서 넣어입어야 할 거 같은데 다른 옷들에 비해 이 옷이 은근 넣입하기 힘들더라구요 몸 좋으신 분들이 입으면 진짜 핏 좋을듯 저 처럼 마른분들이 입어도 어깨쪽 체형보완이 있어 무리없이 입으실 듯 팔통이 살짝 큰데 접어 입으면 괜찮아요 요즘 핫하잖아요 다들 하나씩 장만 해 놓으십쇼,"체형 보완, 마르다 분, 접다, 분, 힘들다, 비다"
이쁘고 아무렇게나 툭 걸치기 좋네요 다만 목이 좀 좁긴해요,"좁다, 걸치다, 목, 아무렇다"
사이즈 적당하고 어디에든 잘 어울립니다 만족합니다,"만족하다, 어울리다, 적당하다, 사이즈"
 기준 원하던 사이즈 입니다 여유있게 입는 걸 좋아하는데 핏도 마음에 들고 무엇보다 피그먼트 색감이 좋네요 여유있게 반바지에 입고 긴바지에입고 추리닝에입고 모두 만족할 것 같아요 ,"추리 닝, 바지, 만족하다, 사이즈, 색감, 원하다"
편하고 아주 좋습니다 원하는 핏과 색감이에요 꼭 사세요 ,"색감, 편하다, 원하다, 핏"
휘뚜루마뚜루 입니다 색감좋고 목늘어남 거의 없을 느낌,"목 늘어나다, 없다, 색감"
옷이 생각보다 크긴 한데 탄하고 좋네요 다만 옷이 확실히 싸서 그런가 생각보다는 옷 질감이 아쉽네요 그치만 가격대비 괜춘한듯,"가격 대비, 확실하다, 그치다, 탄하, 런가, 크다, 질감"
무난무난함의 정석이에요 딱 깔끔하고 적당한 오버핏이에요 기본 피그먼트티 원하시는분들에게 추천드립니다 색감도 깔끔하고 두깨감이나 핏도 적당합니다,"추천 드리다, 함, 적당하다, 원하다 분, 적당하다, 정석, 색감, 피그먼트티, 기본, 핏"
 적당한 세미오버핏이라 말라보이지 않고 좋습니다 피그먼트 염색도 이 색상이 가장 이쁜거 같아요 다만 야외에서 햇빛 그대로 흡수합니다 두께감이 그렇게 두껍진 않으나 자외선 때문인지 도로 더운 날이 아니었지만 상의가 정말 따가웠어요 ,"말라보, 색상, 적당하다, 상의, 덥다, 염색, 피그먼트, 흡수, 가장"
맨투맨만 구매했었는데 반팔도 마찬가지로 퀄리티가 좋아요,"마찬가지, 퀄리티, 투맨, 팔도"
재질은 힘이 있고 많이 두껍지는 않아요 여름에도 입을 수 있을 사이즈는 좀 크게 나와서 한사이즈 작게 사도 될듯 디자인에 포인트도 있고 워싱도 이쁩니다 다른 색상도 구매할려구요,"워싱, 색상, 재질, 사이즈, 사이즈, 디자인, 구, 여름, 나오다"
소버먼트 후기가 많아 첨으로 구매했는데 질감좋고 탄하네요,"버먼 트, 후기, 질감, 많다"
착용감 좋아요 부드럽고 피그먼트라 그런지 주름도 안생기고 뒷면도 이쁘네요 색감도좋아요,"생기다, 피그먼트, 그렇다, 부드럽다, 착용, 주름, 색감, 면도"
이전에 라지 주문해서 잘 입었는데 좀더 오버한 사이즈 입고 싶어서 다시 주문했어요 요론색상 티셔츠는 이게 갑입니당,"색상, 갑, 이전, 티셔츠, 주문, 사이즈, 오버, 라지"
너무 예뻐요 요즘 피그먼트가 너무 예뻐보여서 피그먼트로 유명한 브랜드를 찾다가 알았네요 품질도 너무 좋아거 자주 입을거같습니다,"피그먼트, 피그먼트, 유명하다, 품질, 브랜드, 찾다"
두께가 두꺼운거를 찾는데 딱 원하던 두께입니다 좋아요 ,"원하다, 두께, 두께, 두껍다, 찾다"
일단 기장이 확실히 정핏입니다 셔츠안에 입기 좋네요 어깨부분을 확실히 보완해주는부분이 마음에 듭니다,"보완 해주다 부분, 셔츠, 기장, 확실하다, 듭니, 어깨 부분"
편하게 입기에 딱 좋을거 같아요 두께감은 조금 있는편이에요,"편하다, 편이, 두께 감다"
오버핏이고 무게가 있는 반팔입니다 모양이 잡혀있고 목부분이 아주 짱합니다 총장은 좀 깁니다 결론은 뭐 좋습니다,"팔, 목 부분, 무게, 총장, 결론, 짱하다, 잡히다"
배송이 빠르고 옷 재질이 좋은거 같아요 나중에 하나 더 사야겠어요 ,"나중, 배송, 재질, 하나, 빠르다"
짱하고 소재 좋은게 느껴져요 색도 이뿌고 자주 입을거 같네용,"소재, 색도, 짱하다, 이뿌다, 느껴지다"
피그먼트 워싱이 느낌있네요 제 기준으로 워싱이 좀더 강했으면 더 느낌있지 않았을까 하는 생각임요 핏감은 양호합니다,"워싱, 기준, 피그먼트, 좀더, 핏감, 양호, 느끼다"
 세 아저씨도 잘 입을게요 소버먼트 번째인데 역시 만족스럽습니다,"아저씨, 만족스럽다, 버먼 트, 번"
사이즈 넉해서 하나 작게사도 괜찮을것 같네여 이쁩니다 뒷판 디테일 굿,"넉, 사이즈, 작다 사도, 디테일, 하나, 판"
역시 인기있는 이유가 있네요 오버하게 핏이 이쁘고 특히 등라인이 이쁘게 잡혀있네요 목부분도 튼합니다 ,"틀다, 라인, 오버, 이유, 목 부분, 핏, 잡히다"
재질도 좋고 사이즈도 넉하니 좋네요 약간 두껍긴 하지만 지금 입기 딱 좋아요,"사이즈, 재질, 지금, 두껍다"
배송 빠르고 옷 탄하고 핏도 좋습니다 목 부분이 타이트해서 입고벗는데 쪼금 힘드네요,"타이 트, 배송, 탄하, 힘드다, 부분, 핏, 쪼금, 벗다, 빠르다"
재질은 부들부들한 재질은 아니고 좀 뻣한듯 합니다 두께는 살짝 두툼한 느낌이고 빈티지한 느낌이 좋네요,"빈티, 아니다, 재질, 부들부들하다, 두툼, 뻣한듯, 두께"
예쁩니다 뒤에 디테일 좋아여 m시텨도 괜찮았을듯 ,"시텨, 디테일, 뒤"
저렴하게 좋은상품 잘 구입했네요 굿 추천합니다,"추천, 저렴하다, 상품"
생각보다 디자인 핏 다 괜찮네요 자주 입을 예정이에옹 검청이랑 입기 좋을듯,"검청, 디자인, 예정 옹"
 옷이 좀 크게 나온 듯 해서 s사이즈로 샀는데 생각했던 거 처럼 너무 오버하지않게 루즈핏 느낌 나옴 재질은 탄하고 목 넣는 부분이 좁은편임,"좁다 편임, 사이즈, 재질, 탄하, 나오다, 나오다, 처럼, 부분"
빈티지한 느낌 제대로네요 다른 색상도 구매 의향 있습니다 핏도 저함테 딱 맞아요 배송도 빨라서 만족합니다,"만족하다, 빈티, 색상, 배송, 제대로, 함테, 핏"
살짝 흐릿한 색감이 너무 좋네요 사이즈는 기장은 좀 길지만 어깨 선이 예쁘고 목부분이 착 감겨서 속에 다른 티를 입고 입어도 티가 전혀 안나요,"사이즈, 색감, 목 부분, 선, 기장, 길, 감겨, 안나, 전혀"
옷 너무 이쁘네요 원단도 좋은거 같고 가격 값 해요 잘 입을게요,"원단, 가격"
저랑 비슷한 스펙 가지신분들은 저랑 같은 사이즈로 가셔야될듯 ,"가지 신분, 사이즈, 스펙, 갈다 되다"
평소에 옷을 크게 입는 것을 좋아하는데 옷 사이즈가 커서 굉장히 만족합니다 색상도 정말 마음에 드네요 ,"만족하다, 커서, 사이즈, 색상, 평소, 크게"
이너용으로 S구매 실측보다 전체적으로 더 작은편,"전체, 작다 편, 실"
제 몸 에는 xl이 딱좋네요 살짝 오버한 느낌이나구요 많이 두껍지 않아서 코디할때 여기저기 활용도가높아요 가장 만족스러운건 빈티지한 색이구요 세탁후 전혀 변형없고 좋네요,"여기저기, 만족스럽다, 빈티, 색 이구, 전혀, 오버, 가장, 세탁 후"
색은 이쁘지만 사이즈나 재질 등이 입기어렵고 너무 별로네요 어떤사이즈를 샀어야 맞는지도 모르겠고 그냥 별로렸어요,"어렵다, 사이즈, 별로, 색, 재질, 사이즈"
티셔츠로 등이길래 얼마나 좋을지 궁금해서 사봤는데 역시 좋군요 ,"이기다, 궁금하다, 티셔츠, 사보다"
너무 이쁘네요 지금까지 잘 입고 있습니다 많이 파세요 ,"파다, 지금"
재질이 좋고 캐주얼 하고 가을에도 입기 좋을 거 같아요,"캐 주얼, 재질, 가을"
탄하고 두껍고 위아래 세트로 후드티 안에 받쳐입기 좋은 것 같아요,"세트, 탄하, 후드 티, 위아래, 받치다, 두껍다"
친오빠 주려고 샀습니다 제 스펙엔 크지만 인 친오빠한텐 딱 맞을거 같습니다 일단 제가 뺏어 입고싶네여 질도 좋고 탄하고 무엇보다 핏이 너무 예뻐여 차콜 선택하길 잘한거 같아요 굿,"선택, 려고, 탄하, 질도, 크다, 스펙, 차콜"
음 주변친규들이 많이 입는거보고 구매했는데 마른체형이라 쪼끔 안어울리는거 같긴합니다 그래두 샀으니까 예쁘게 입을게욥 사이즈는 조금 큽니다 키크고 마르신분이 구매하는건 비추에요 ,"보고, 어울리다, 주변 친규, 마르다 체형, 마르 신분, 사이즈, 욥, 크다, 비추다"
오버핏으로 입기 좋고 색감이 너무 이뻐서 마음에 들어요 ,"색감, 오버핏"
원단이 좀 두꺼유 서 더울수있는데 튼툰해보입니다 봉제 마감 퀄리티 완벽합니다 소버먼트 최고 ,"튼툰 보이다, 완벽하다, 원단, 버먼 트, 퀄리티, 마감, 봉제, 최고, 두껍다 유, 덥다"
선물로 사줬는데 너무 이쁩니다 다른색상도 살게요,"선물, 색상, 살다, 사주다"
적당히 워싱된 느낌이 정말 맘에듭니다 코디하기도 쉬운거 같아요,"코디 기도, 적당하다, 맘에듭니, 워싱된, 쉽다"
생각보다 안두꺼워서 시원해요 핏은 무지 이뻐요 다만 할인을 안해서 조금 비싼데 목시보리 짱하고 퀄리티는 최상입니다 할인 좀 해주세용 한 장 더 살게여,"시원하다, 해주다, 목시 보리, 살, 안해, 비싸다, 할인, 퀄리티, 할인"
디자인도 무난하고 사이즈도 좋아요 꾸안꾸로 입기에 좋습니다,"사이즈, 디자인, 꾸다 꾸다"
생각보다 옷이 얇고 사이즈가 제가 원하던 사이즈여서 만족해요 평소 사이즈 입어요,"사이즈, 만족하다, 사이즈, 사이즈, 평소, 원하다"
배송도 빠르고 상품도 사진과 같네요 잘 구매한 것같습니다 ,"사진, 배송, 상품, 빠르다"
재질이 좋아요 핏도 생각했던 핏이라 자주 입을것같아요 ,"재질, 핏, 핏"
타사 피그먼트 워시드 티셔츠랑 고민하다가 후면 절개 라인 들어간 게 맘에 들어서 소버먼트로 구매했습니다 색이 딱 제가 원하던 물빠진 차콜입니다 원단이 얇진 않으나 지금 날씨에 뭘 입어도 더워서 그런가 자주 입게 되네용 오버핏 티셔츠 고민하시면 추천드립니다 ,"추천 드리다, 고민, 차콜, 티셔츠, 고민, 티셔츠, 원하다, 피그먼트, 들어서다"
길이랑 사이즈 딱 제가 원했던거라 넘 좋어용 최고,"길이, 사이즈, 최고, 원하다"
새로운 느낌의 티셔츠 좋아요 한여름에 입기에는 두꺼워서 아쉽,"티셔츠, 새롭다, 한여름, 아쉽다, 두껍다"
적당했습니다 키 몸무게 저랑 비슷하시면 m 추천드려요 무게는 조금 무거운 감이 있습니다,"추천 드리다, 몸무게, 무겁다, 무게, 적당하다"
재질 너무 맘에들고 옷이 너무 이뻐요 그냥 진짜 강추합니다,"강추, 재질, 그냥"
목도 짱하고 재질도 튼하고 특히 뒤에 박음질 스티치 디자인이 이뻐요,"박음질, 재질, 스티치, 디자인, 틀다, 목도, 짱하다, 뒤"
무난하게 예쁩니다 핏감 자체도 좋고 오버핏으로 입기 매우 괜찮아요 ,"자체, 핏감, 오버핏"
너무 이쁘고 자주입게되네요 만족스러워요 강추합니다,"강추, 만족스럽다, 되다"
소버먼트 특유의 피그먼트는 확실히 디테일이 다르네요 퀄도 좋고 색감도 잘 뽑아서 항상 잘 이용 중입니다,"피그 멀다 틀다, 중, 이용, 디테 일이, 버먼 트, 항상, 확실하다, 다르다, 퀄, 색감"
베스트 컬러라고 생각해요 여러벌 산거 인증입니다 옷 잘 입는 동생이 추천해줘서 쥐색으로 중고제품 구매해봤습니다 왠걸 너무 마음에 들더군요 너무 얇아서 찌셔츠가 되지도 너무 두툼해서 답하지도 않은 딱 적당한 두께에 멋스러운 색감 같은 제품 여러장 색상만 다르게 구매했습니다 재구매야 말로 최고의 찬사아닐까요 돈만 넉하면 다른 컬러도 전부 사서 소장하고 싶네요 무조건 추천입니다 ,"동생, 무조건, 인증, 소장, 적당하다, 색상, 추천"
엄청 뻣하지않고 재질 좋고 이쁩니다 다만 물이 좀 많이 빠지긴하네여,"물이, 재질, 뻣, 빠지다"
크고 목 주변 탄하고 색감 이쁘고 여기저기 다 잘 어울려요 ,"여기저기, 어울리다, 탄하, 주변, 크다, 색감"
색깔 좋고 사이즈 좋고 가격 좋고 다좋아요 다른색도 사야겠어요 다만 한여름은 더워요,"덥다, 색도, 한여름, 사이즈, 가격, 색깔"
여름계절에 몸에 부담없이 착용 사용가능한 제품입니다 ,"사용 가능하다, 제품, 착용, 몸, 여름 계절, 부담"
아주 잘입고 다니고 있습니다 만족스러워요 추천,"만족스럽다, 추천"
가격대비 이쁜데 너무 많이 팔려서 자꾸 클론이 보입니다 티셔츠 퀄리티는 너무 좋아요,"클론, 퀄리티, 티셔츠, 팔다, 가격 대비, 보이다, 자꾸"
피그먼트 워싱이라 기가 막히게 예쁘고 왜 이 브랜드의 베스트셀러인지 보란듯이 보여주네요,"베스트셀러, 피그먼트, 막히다, 워싱, 보여주다, 브랜드, 듯이"
소버먼트 맨투맨 잘입고 있었는데 반팔이라 구매해 봤어요 두께가 약간 있지만 옷이 튼해서 맘에 들어요 핏도 나쁘지 않아서 자주 입을꺼 같아요,"버먼 트, 투맨, 틀다, 팔이, 나쁘다"
적절한 오버핏에 무난한 색감이라서 손이 많이 가요,"적절하다, 색감, 가요, 손, 오버핏"
옷소재가 탄하고 세탁돌려도 늘어나거나 그런게 없습니다 아주좋아요,"늘어나다, 탄하, 세탁 돌리다, 그렇다, 없다, 소재"
너무너무 이쁩니다 너무 만족하구요 고민마시구 카드슬래쉬 하세오 후회없습니다,"고민 말다, 만족하다, 후회 없다, 카드 슬래쉬"
생각보다 기장이 더 긴 것 같고 조금 아쉬운 느낌이 들어요,"기장, 아쉽다"
쏘합니다 괜찮아요 두께감때문에 한여름빼고 초여름 초가을에 입기좋을듯 총길이는 적당한데 팔길이가 많이길어요,"길이, 쏘다, 적당하다, 길이, 초가을, 초여름, 길, 두께 때문"
옷 이쁘고 사이즈 딱좋고 목쪽 잘 늘어나지 않아서 좋네요 ,"늘어나다, 사이즈, 목쪽, 딱좋다"
옷이 편하고 무난하게 입을 수 있어서 너무 좋아요,편하다
적당한 두께고색감과 재질 다 좋아요 사이즈표로는 엄청 클즐 알았는데 생각보다 엄청 오버핏이지는 않아요,"적당하다, 표, 재질, 크다 즐, 오버핏, 알다"
기대 안했는데 색감도 너무 예쁘고 핏도 좋습니다,"색감, 기대, 핏"
오버핏으로 나와서 좀 넉하고 입기 편하네요 색도 괜찮고 나름 만족하면서 입고있어요 ,"만족하다, 넉, 나오다, 색도, 편하다, 나름, 오버핏"
옷이 생각보다 더욱 오버핏이라 소화하기가 어려워요,"어렵다, 소화, 더욱, 오버핏"
일단 재질이 두껍고 좋아서 오래 입을 수 있을듯해요 근데 기장 살짝 미스,"재질, 기장, 미스, 두껍다"
피그먼트 티 처음사보는데 색하고 가격 만족합니다,"만족하다, 피그먼트, 처음 사보다, 색, 가격"
외출용 보다는 집에서 입기 너무 편해요 할인도 많이해주거요 ,"집, 편하다, 할인, 외출, 주거"
상단 어깨쪽에 실밥이 터져서 왔네요 눈에 그렇게 띠진 않아서 그냥 입으려고요 무난합니다 ,"실밥, 터지다, 상단, 눈, 오다, 어깨 쪽, 띠진"
티셔츠 맘에드는 없었는데 상품평이 좋아서 사게됬구요 원단이 딴해서 아주오래 입을듯요 소버먼트 브랜드 맨투맨이랑 후드 티셔츠 모두섭렵 예정입니다 ,"투맨, 섭렵, 상품 평이, 버먼 트, 티셔츠, 원단, 브랜드, 에드"
물빠진 매력이 아주 좋습니다 강추해요 감사합니다,"강추, 매력, 물 빠지다"
생각 보다 옷이 오버핏이에요 색감은 너무 이쁘고 데일리로 입기 너무 이쁜 옷이에요 ,"색감, 일리, 오버핏"
이 브랜드가 맘에 드는 것 같아요 딱 사이즈도 적당하고 무난합니다 구매하기 괜찮아요,"사이즈, 적당하다, 브랜드"
디자인 핏 모두 이쁘고 빈티지한 느낌도 들고 그러네요 계절바뀌면 이너로 사용해도 좋을것 같아요 ,"사용, 빈티, 디자인, 그렇다"
이뻐요 사진은 제 몸이 엉망이라 그렇지 옷은 이뻐요,"사진, 엉망, 몸, 그렇다"
사이즈도 좋고 색깔도 좋아서 정말 잘 입고 다닙니다,"사이즈, 색깔"
옷은 다 좋은데 한번 빨면 어두운 색깔이 다 빠져서 밝아져요,"한번, 두운, 색깔, 빠지다, 밝아지다"
소버먼트만 몇갸쨔 구매인지 모르겠네요 너무 좋아요 정말 가성비 최고의 티네요 ,"버먼 트, 가성비, 티, 최고, 모르다, 몇갸쨔"
피그먼트 워싱이 들어가있어서 그런지 일반 면티보다 몸에 안달라붙어 생각보다 시원합니다 ,"티보, 그렇다, 피그먼트, 워싱, 시원하다, 일반, 몸, 달라붙다, 들어가다"
이쁜데 너무 기장이 기네요 수선해서 입어야 할것 같아요,"기장, 수선하다, 기네"
평소에 옷 뭐 입을지 고민하기 싫을 때 입습니다 하나쯤 있으면 좋을 거 같아요 ,"평소, 고민, 하나, 싫다"
피그먼트 워싱이 들어간 소버먼트의 반팔티셔츠입니다 후염색 및 가공 통해 빈티지한 워싱 효과와 발색을 갖고 있다고 하는데요 스트릿한 코디에 찰떡인지라 요즘 카고바지에 자주 코디하고 있습니다 핏은 세미오버핏으로 제 스펙에 딱 맞습니다 소재는 탄한 면 으로 한여름에 입기는 두꺼울수도 있겠다 싶네요 다만 탄한만큼 찌툭튀는 걱정안하셔도 됩니다,"티셔츠, 걱정, 버먼 트, 코디, 빈티, 카 바지, 발색, 통해, 효과"
색감은 이쁜데 기장이 긴게 조금 아쉽네요 넣입해야 될것 같습니다,"색감, 기장, 아쉽다, 되다, 넣다"
기장이 생각한 것보다는 길긴 한데 원단 톱하니 어깨도 넓어보이고 옷이 예뻐서 같은 색으로 하나 더 쟁이려고 두 번 주문했습니다,"쟁이려, 톱, 기장, 색, 길다, 원단, 하나, 주문"
생각보다 두껍지 않고 체형보완되는 빳한 느낌이 좋습니다 정사이즈 사도 오버핏이고 아마 한사이즈 작게사도 세미오버핏이지 않을까 싶습니다 ,"정사 이즈, 작다 사도, 사이즈, 사도, 아마, 체형 보완 되다, 오버핏"
착욤감 질감 색상 모든게 마음에 들어요 힙합니다 ,"착욤감, 색상, 모든, 힙합, 질감"
사이즈 딱 맞습니다 색상도 생각한데로 잘빠졌고 다른색으로 추가 구매할거에요 ,"색, 색상, 사이즈, 추가, 잘빠지다, 맞다"
사이즈 좋고 재질도 흐물거리지 않고 탄한 재질이라 좋습니다 색상도 딱이구 여름에 휘뚜루 마뚜루 입기 좋을꺼 같아요 ,"재질, 재질, 사이즈, 흐 물다, 색상, 여름, 휘뚜루"
많이사고 유명한 이유가 있네요 재질도 좋고 입으니 어깨 잡아줘서 핏이 좋아요,"유명하다, 잡다, 이유, 재질, 핏, 어깨"
색감이랑 핏 너무 이뻐요 사이즈는 생각보다 커요,"색감, 크다, 사이즈"
착용감 길이도 잘맞고 몸에 잘 달라붙고 착 감기는게 맘에 듬 재질 튼하고 느낌이 좋아 오래 잘 입을거 같음 사이즈 딱임 다른 색상도 사러감,"색상, 착용, 사이즈, 길이, 틀다, 감다, 몸"
피그먼트 포인트가 맘에 들고 차콜 색상이라 편하게 매치할 수 있어서 좋아요 핏도 넉한 오버핏이라 만족합니다,"매치, 만족하다, 피그먼트, 색상, 포인트, 편하다, 넉, 차콜"
피그먼트 워싱 들어간 옷 처음 입어보는데 굉장히 만족스럽습니다,"만족스럽다, 입어보다, 피그먼트, 들어가다, 워싱, 처음, 굉장하다"
색이 한여름엔 좀 더워보임 하지만 이쁜 핏이 커버합니다,"커버, 덥다 보임, 색, 한여름, 핏"
인기 많은덴 이유가 있네요 많이 오버하니 한치수 작게 추천,"치수, 이유, 추천, 오버, 인기, 작다, 많은덴"
색감이랑 워싱 맘에 들고 두께도 얇은 편 아니라서 좋네요 다만 기장이 좀 길어요 ,"색감, 기장, 워싱, 아니다, 두께"
오버핏으로 잘나온거 같아요 핏도 예쁘게 잘 떨어지고 도톰해서 잘 잡아주는거 같아요,"잘나오다, 잡다, 도톰하다, 핏, 오버핏, 떨어지다"
엄청 재질도 좋고 시원해요 색감도 미쳤어요 또 살거에요,"살다, 시원하다, 재질, 색감, 미치다"
무지티에 대한 불신을 깨줬습니다 워싱 핏 디테일 뭐 하나 빠지는 요소 없이 아주 깔끔하게 맞아 떨어지네요,"무지 티, 워싱, 불신, 디테일, 요소, 대한, 빠지다, 맞다"
여름에 입기에도 두께감도 적절하고 소재도 탄해서 좋아요,"적절하다, 소재, 여름, 두께 감다"
다른건 모르겠고 옷이 너무 좋고 진짜 완전 추천입니다,"추천, 다르다, 모르다"
목부분도 탄하고 편해요 더운재질같긴한데 그래도 많이입을것같아요,"목 부분, 편하다, 탄하, 덥다 재질"
편안하게 휘뚜루마뚜루 입기좋은 옷이에용 워싱 디자인덕분에 심하지도 않게 잘 입을거같아용 강추 ,"디자인 덕분, 편안하다, 강추, 심하다, 워싱"
