Review,keyword
여름이 다가와서 티셔츠 구경하다 구매했네요 첫인상은 제가 생각했던 핏보다는 팔이 좀 긴것 말고는 옷이 튼하게 잘 만든거 같아요 한번 세탁했는데 목이나 기장이 줄어 들거나 하지는 않아요 전반적으로 만족해요 ,"만족하다, 만들다, 목, 구경, 전반, 다가오다, 기장"
피그먼트라 은하니 예쁜 색감이 나구요 심플하지만 심하지 않은 색이라 자주 입을듯 합니다 ,"은하, 심플, 피그먼트, 색감, 심하다, 색, 나다"
사이즈 라지 딱맞구요 근데좋아요 피그먼트 첨 입는데 좋네요,"피그먼트, 사이즈, 라지, 맞다"
상품 받고 확인해보니 재질도 좋고 이쁘게 잘 입고 다닐거 같아요 ,"확인, 상품, 재질, 받다"
사이즈딱 좋고 옷도이쁘고 살짝덥긴한데 좋아요,덥다
이쁘고 배송도 갠찬은편이에요 색상도 사진이랑 비슷해요,"갠차다 편이, 사진, 색상, 배송"
면이 탄해서 오래 입을 수 있을 것 같아요 목도 엄청 짱합니다 굿,"목도, 짱하다"
배송 빠르네요 옷도 딱 맞아요 올 여름에 잘 입을거 같아요,"배송, 여름, 빠르다, 맞다"
기장 살짝 길긴한데 그럼에도 품질이 좋아서 잘입을 것 같아요 ,"길다, 기장, 품질, 그렇다"
빈티지한느낌에 핏도 이쁘고 자주 입을거 같아요,"핏, 빈티"
샌드베이지색이 너무맘에들어 차콜색도 샀어요 좋습니다 ,"새다 드 베이지색, 차콜 색도"
좋아요 가성비 최고예요 주저하지 마시고 두개 사세요,"가성비, 주저, 말다, 개, 최고"
목 짱하고 색감도 좋고 전체적으로 무난하고 좋아요,"전체, 색감, 짱하다"
배송도 너무너무 빠르고 제품에 굉장히 만족합니다,"만족하다, 배송, 제품, 빠르다, 굉장하다"
살짝 오버사이즈로 아주 이쁘네요 좀 무거운거 빼곤 다 좋아요,"오버 사이즈, 무겁다, 빼다"
피그먼트 다잉 너무 맘에 들고 얇은듯 시원해서 여름에 잘 입고 다닐거같아요 ,"피그먼트, 시원하다, 다잉, 여름, 얇다"
좋은 가격에 구매해서 상당히 맘에 듭니다 자주 사용할것같아서 좋습니다,"상당하다, 가격, 듭니, 사용"
무지 피그먼트반팔은 소버먼트가 탑이네요 추천합니다 ,"피 먼트 팔, 버먼 트, 추천, 무지"
소버먼트 품질은 말할 것도 없고 적당하게 연출되는 오버핏이 너무 예뻐요,"버먼 트, 적당하다, 품질, 말, 오버핏, 연출 되다, 없다"
사이즈나 색감 아주 좋습니다 원단도 두껍지않아 좋네요,"원단, 사이즈, 색감, 두껍다"
사이즈 적당하고 색도 원했던 것 만큼 예뻐요 추천 드립니다,"적당하다, 드리다, 추천, 사이즈, 색도, 원하다"
원단도 좋고 사이즈도 좋아요 물론 컬러도 좋습니다,"원단, 사이즈, 컬러"
항상 랭킹 상위권에 있는 피그먼트 옷이라 궁금했었는데 기회가 되어 구입해보았습니다 옷 재질도 마감도 모두 짱해서 마음에 듭니다 다만 한 사이즈 더 큰 옷이 있었으면 어땠을까 싶기도 해요 ,"마감, 항상, 사이즈, 랭킹, 피그먼트, 재질"
항상 랭킹 상위권에 있는 피그먼트 옷이라 궁금했었는데 기회가 되어 구입해보았습니다 옷 재질도 마감도 모두 짱해서 마음에 듭니다 한 사이즈 위의 옷이 있었으면 어땠을까 싶기도 해요 ,"항상, 사이즈, 마감, 랭킹, 피그먼트, 재질, 듭니"
오버핏중 제일 핏도 이쁘고 소재도 고급스럽습니다 가성비 최고에요 그레이 칼라가 제일 이쁜듯요,"고급스럽다, 가성비, 그레이, 제일, 소재, 칼라, 오버핏, 핏"
잃어버리면 다시 구매 할 의향 있을정도로 이뻐요 잘 쓰겠습니다 ,"다시, 잃어버리다, 의향, 쓰다"
딱 원하는 핏에 원하던 색감 다만 너무 이쁜 스태디라 그런가 시내나가면 같은 옷 여러명보임 ,"원하다, 시내, 원하다, 런가, 스태디, 명 보임, 색감, 핏"
사이즈가 널하니 좋고 색감과 핏이 상당히 예뻐요 ,"상당하다, 사이즈, 색감, 널, 핏"
배송이 조금 늦었지만 입었을때 핏이 아주 좋습니다,"배송, 핏, 늦다"
배송도 빠르고 옷도 항상 재질 좋고 이쁘고 좋습니다,"항상, 배송, 재질, 빠르다"
배송이 좀 늦게왔지만 만족합니다 티셔츠가 짱해여,"배송, 티셔츠, 만족하다, 늦다 오다"
리뷰가 좋아서 그정도일까 싶었는데 생각보다 좋네요 면도 좋은 듯 하고 입기 편할거 같아요 한번 시착해보고 세탁했어요 잘 입을 듯 합니다 제 기준에 s가 오버핏으로 맞네요 ,"착, 편하다, 리뷰, 면도, 한번"
색감도 화면에서 보여지는 그대로이고 많이 판매되는 이유가 느껴질만큼 만족스럽 습니다 ,"보이다, 만족스럽다, 그대로, 색감, 이유, 화면, 느껴지다, 판매 되다"
 일 예약배송인데 일에 받았네요 핏이나 색감 워싱 다 마음에 드는데 배송이 많이 아쉽습니다,"배송, 워싱, 색감, 일, 핏, 배송, 아쉽다, 받다"
옷 이쁘게 잘 입겠습니다 좀 널하고 배송이 좀 느린게 아쉽긴 했어요 ,"배송, 널, 느리다, 아쉽다"
원단이 좋고 핏도 이쁩니다 세일기간때 잘산거 같아요 ,"원단, 잘살다, 기간, 핏"
워낙 등치가 있다보니 적당히 맞습니다 제 신체 사이즈로는 오버핏은 아닙니다 잘 입을게요 ,"사이즈, 아니다, 치가, 적당하다, 신체, 워낙, 오버핏, 맞다"
색깔도 이쁘고 오버하게 입는편인데 좋아여 보통 사이즈 입는데 이건 L도 충분합니다,"편, 충분하다, 이건, 사이즈, 오버, 보통, 색깔"
무난해서 어떤 옷이랑도 잘 어울리네요 핏도 잘 떨어져서 자주 입을 것 같아요,"어울리다, 핏, 어떻다, 떨어지다"
소버먼트 피그먼특 국룰이라고 생각합니다 너무 이쁘고 사이즈 큰데 팔소매 롤업 번 하면 또 그만의 멋이 있어요 단 기름같은거 묻으면 얼룩이 티가 심하니 조심하셔요,"피그먼특, 얼룩, 국룰, 조심하다, 소매, 버먼 트, 심하다"
소버먼트 피그먼특 국룰이라고 생각합니다 너무 이쁘고 사이즈 큰데 팔소매 롤업 번 하면 또 그만의 멋이 있어요 단 기름같은거 묻으면 얼룩이 티가 심하니 조심하셔요 ,"피그먼특, 얼룩, 국룰, 조심하다, 소매, 버먼 트, 심하다"
입어보니까 생각보다 이쁘고 편합니당 재질도 튼한거 같구,"편하다, 틀다, 재질, 입어보다"
 입니다 워싱도 이쁘고 만족합니다 ,"만족하다, 워싱"
한치수 작게샀더니 사이즈 알맞아요 소매가 조금 길지만 입을만해요 ,"만해, 치수, 길, 소매, 사이즈, 작다, 알맞다"
사이즈가 딱이네요 크게 나와서 좋습니다 하나 더크게샀으면 입기 힘들었을뻔,"사이즈, 나오다, 하나, 힘들다 뻔, 딱이다, 더크, 크게"
오버핏으로 입기 예뻐요 한여름에는 조금더울거같은데 더워도 이뻐서 입고있어요 ,"덥다, 한여름, 덥다, 오버핏"
제작년 스버먼트 티 사고 잘입고 있어서 품질은 좋은거 알고있엏는데 색상이 이뻐 구매햇는데 역시나 퀄리티 좋습니다,"색상, 스버먼트, 작년, 품질, 퀄리티, 사고"
 대인데 무난한 디자인 찾으시는거면 딱입니다,"디자인, 대다, 딱이다, 찾다"
운동 좀 하신 분들은 소매 두번 접어서 입으면 더 이뻐요 등쪽에 가로선 하나 있어서 밋하지도 않고 이뻐용 워싱느낌도 잘 나고 아주 만족입니당,"만족, 접다, 운동, 가로서다, 번, 소매, 나다"
엄청 크다 이건 아닌데 오버핏으로 적당히 커서 되게 이쁘네여 뒤에 포인트로 프린팅같은게 옶어도 안심 고 굿,"적당하다, 포인트, 커서, 이건, 안심, 아니다, 크다, 옶어"
가성비 좋아요 색상도 딱원하던 색상이에요 굳,"색상, 가성비, 색상, 원하다"
이쁘네요 무난한색이긴한데 워싱이들어가서 좋아용,"색 이기다, 워싱 들어가다"
일반 라지보다는 조금 더 오버 핏하게 나왔어요 두께감도 적당해서 좋아요,"적당하다, 라지, 오버, 일반, 핏하, 두께 감다, 나오다"
색감이 예뻐서 사봤는데 역시 예쁘네요 디테일도 좋고 너무 잘샀습니다,"색감, 디테 일도, 사보다"
와 티셔츠 색감 정말 이뻐요 원단이 까슬해서 피부에 달라붙지 않아서 상쾌한 느낌이 마음에 들어요 두께감은 있기 때문에 여름철 야외보다 에어컨 환경에 어울릴듯 하고 반팔러라면 늦가을에서 초겨울까지 가능한 정도에요 ,"팔다, 여름철, 환경, 에어컨, 티셔츠, 원단, 가능하다"
상품배송빠릅니다새즈좋습니다오버사이즈네요,상품 배송 빠르다 좋습니 오버 사이즈
L사니까 세미오버핏느낌으로 떨어짐 저란 비슷하신분들 l이 괜찮을거같네요,"란, 신분, 세미 오버핏, 떨어지다, 사"
사이즈 넉하게 잘맞고 예뻐요 색상듀 마음에들고 배송도 빠르네요,"색상 듀, 배송, 넉, 사이즈, 잘맞다, 빠르다"
 에 키로 상체 마른편인데 M싸이즈 입으니 거의 딱 맞게 떨어지는것 같습니다 다른 색상은 L싸이즈로 구입했는데 저랑 비슷한 체형이시면 L싸이즈로 가시면 될것같네요 소버먼트 옷은 항상 마음에 듭니다 잘입을게요 ,"마르다 편, 싸이, 싸이, 체형 시, 상체, 버먼 트, 가시, 색상"
반바지랑 세트로 구입했는데 반바지보다 티셔츠가 더 얇아서 좋네요 색감도 화면이랑 비슷하고 흐릿한 차콜이 맘에듭니다 사이즈는 적당히 오버핏으로 편하고 생각보단 덜 무거워요,"맘에듭니, 무거워, 사이즈, 티셔츠, 적당하다, 반바지, 반바지, 화면, 색감"
세미오버핏에 색감도 예쁘고 뒤에 스티치 디테일이 마음에들어요,"디테 일이, 스티치, 색감, 뒤, 세미 오버핏"
핏 오버핏으로 저에게는 아주 맘에 드는 핏이 나오네요 평소 착용사이즈에서 하나 작게 입으면 좋은 것 같아요 두깨 살짝 두껍긴한데 그래도 탄한 느낌으로 입고싶어서 구입했습니다 한여름에는 뭘 입어도 덥겠지만 튼한 느낌을 원하시면 추천합니다 색상 요즘 그레이나 물빠진 색감들이 많이 보이고 빈티지한 느낌도 나고 블랙계열 옷들과 입으면 아주 괜찮을 것 같아서 구입했습니다 포장과 배송도 모두 맘에듭니다 ,"착용 사이즈, 추천, 포장, 맘에듭니, 색감, 원하다, 색상"
디자인 좋아요 배송 빨라요 색감 사진그대로 가격 낫베드 세탁 변형 없음 무게 보통 올여름 편하게 입고다닐듯합니다 버뮤다진청반바지랑 입으면 이쁠듯,"버뮤다 진청 반바지, 변형, 사진 그대로, 배송, 편하다, 디자인, 보통, 올여름, 가격"
피그먼트 맨투맨도 거의 년전에 구매해서 지금까지 입고있습니다 반팔티 역시 탄하고 꾸안꾸의 정석이라고 볼 수 있다고 생각합니다 활용도가 아주 높은 아이템 입니다 ,"정석, 투맨, 피그먼트, 년전, 티, 활 용도"
후드티를 구매 후 두꺼우면 어쩌지 걱정했지만 적당합니다 색감도 이쁘고 무엇 보다도 착용감이 편합니다,"적당하다, 착용, 편하다, 후드 티, 색감"
약간 오버핏으로 입기에 딱 좋습니다 배송 빠르네요,"배송, 오버핏, 빠르다"
오버핏 옷감은 얇은데 딴함 핏이 아주 잘나와서 대만족,"만족, 잘나오다, 핏, 옷감, 오버핏, 얇다, 함"
원단이 짱해서 체형보완도 되고 그렇다고 두꺼운 두께감도 아니라 한여름에도 잘 입을거 같아요,"체형 보완, 원단, 한여름, 아니다, 짱하다, 두께 감다, 두껍다, 되다"
옷이 생각보다 탄해서 비침도 없고 너무 좋아요,"비치다, 없다"
배송도 빠르고 저렴한 가격으로 잘 샀습니다 잘입을게요,"저렴하다, 가격, 배송, 빠르다"
상품 사진과 거의 비슷하고 핏도 딱맞게 감기도록 좋아요 ,"사진, 감다, 상품, 핏, 맞다"
좋은 상품을 빠른배송으로 만나볼수 있어서 좋았습니다 ,"상품, 나볼 수, 빠르다 배송"
색감이 좋아요 재질도 좋아요 여름철 잘 입고 다니겠습니다,"여름철, 색감, 재질"
여름에 데일리로 항상 입습니다 핏 색감 재구매의사까지 개맛도리고요 솔직히 배송은 좀 늦은편이지만 이정도 맛도리면 기다릴만 한거같고 다음 색갈 뭐 입을지 장바구니 고민 중 검정색도 도전해보려구요 후회안할듯,"도전, 검정색, 솔직하다, 배송, 이정, 장바구니, 일리, 기다리다"
색감도 좋고 재질이 쫀하니 너무 좋습니다 여름 필수템으로 안착 ,"필수, 재질, 안착, 색감, 여름, 쫀하"
핏도 너무 이쁘고 워싱도 이쁘게 들어가 있어서 너무 마음에 들어요,"들어가다, 워싱, 핏"
너무 예뻐요 옷 뒤에 포인트가 맘에듭니다 색도 예뻐요,"맘에듭니, 포인트, 색도, 뒤"
정말 사이즈도 좋고 다 좋습니다 오늘 하나 더 구매하려고 합니당 ,"오늘, 사이즈, 하나"
원단 튼하고좋아요 핏도좋고 다른색상도 추가 구매하려구요 ,"색상, 원단, 추가, 핏도좋, 틀다"
이쁘게 잘 입겠습니다 색 잘빠졌어요 다른색도 구매예정,"색도, 예정, 잘빠지다"
피그먼트 특유의 느낌은 덜하지만 세탁 할수록 나리라 믿고 편하고 싸게 삿으니 열심히 입어볼래영,"입어보다, 피그먼트, 편하다, 덜하다, 특유, 세탁, 나리, 싸다"
예쁘네요 넥라인도 탄하고 잘 입겠습니다 좋네요,"넥라인, 탄하"
중학생 아이가 좋아하며 잘 입어요 편안하면서도 스타일이 좋아서 손이 자주 가는 것 같습니다 희 검만 입더니 좋아요 배송 빠르게 잘 받았어요 ,"편안하다, 중학생, 스타일, 손, 배송, 가다, 검"
상품 너무 이쁘고 입었을때도 핏 좋습니다 앞으로도 자주 애용할께요,"상품, 애용, 앞"
아무 바지에 돌려 입기 좋은것 같아요 잘 입겠습니다 ,"바지, 돌리다"
디자인은 심플하니 이쁘고 배송빠르고 좋습니다,"심플, 디자인, 배송 빠르다"
힙한 색감에 핏듀 너무 오버해서 딱 좋은 느낌이에요,"오버, 힙, 색감, 핏듀"
옷 너무 간지나고 이쁨요 같이 구매한 바지랑 입으니 스타일 굿,"간지나다, 바지, 스타일"
평소에 좋아하는 색감이라 사봤는데 색깔도 딱 좋고 두꺼울까 걱정했는데 두께도 적당해서 좋습니다 ,"적당하다, 평소, 색감, 색깔, 사보다, 두께, 두껍다, 걱정"
가볍고 원단 좋으며 여러가지 매치 해서 입기 좋습니다 다른색도 구매해야겠네요 배송도 빨라서 좋았습니다 ,"여러가지, 가볍다, 배송, 색도, 매치, 원단"
옷 이쁘고 핏좋고 변형감이 별로 없는 편한 반팔티,"변형, 티, 편하다, 별로, 핏좋, 없다"
보통 다른 티셔츠는 애매해서 XL 입는데 요건 L이 잘 맞네요 피그먼트라 세탁은 주의해서 해야겠습니다,"피그먼트, 주의, 보통, 세탁, 티셔츠, 애매하다, 요건"
배송도 빠르고 좋아요 재질도좋고 사이즈 적당해서 좋네요,"적당하다, 배송, 사이즈, 재질, 빠르다"
일단 핏 괜찮구요 몇번 빨면 더 색감이 이뻐질것 같아요 ,"색감, 몇번"
여름에 요긴하게 잘 입을 피그먼트 워싱 티셔츠네요 무난해요,"티셔츠, 요긴, 피그먼트, 여름, 워싱"
재질이 탄하고 핏도 예뻐서 다른색도 사고싶어오,"색도, 재질, 탄하, 핏"
편하게입기너무너무좋아요 강추합니다 가성비채고,"가성비 채다, 강추, 편하다"
컬러도 예쁘고 사이즈도 적당해요 세탁해 여러번입고 쓰는 후기인데 소버먼트 티셔츠 계속 구입하게 될것 같아요,"번, 적당하다, 버먼 트, 티셔츠, 세탁, 사이즈, 컬러, 후기"
배송도 적당히 빨라요 일단 너무 예뻐서 자주 착용할것같네요 ,"적당하다, 배송, 착용, 빨르다"
어디에나 잘 어울려요 가성비 좋고 재구매의사 있습니다,"어울리다, 재다 의사, 가성비"
피그먼트 챠콜색상 맘에 들어요 너무 두껍지도 않아서 여름까지 잘 입어질듯 하네요 ,"피그먼트, 챠 콜색, 여름, 두껍다"
피그먼트 때문에 단품만 입어도 뭔가 채워진 느낌이 있어서 좋고 등 뒤에 봉제선 디테일이 너무나도 예쁘니다,"봉제 선, 피그먼트, 디테 일이, 채우다, 뭔가, 품"
무난하게 어디에 입기 다 괜찮은 옷인거 같습니다 뒤에 선이 살짝 포인트가 되어 이쁜거같네요 재질도 괜찮으며 기장이 생각한대로여서 넣어입기 딱 좋은 사이즈네요 만족합니다,"만족하다, 대로, 사이즈, 선, 기장, 재질, 포인트"
옷이 탄해서 상당히 덩치가 커 보이네여 오버핏으로 몸이 커 보이고 싶은 분들에게 강추 합니다 다른색상으로 더 구입하고 싶습니다,"덩 치가, 색상, 상당하다, 보이, 강추, 보이, 몸"
오버핏이라 사이즈 크게 나온것같아요 유니클로 티셔츠 사이즈 기준 라지 엑라 입는데 이건 실측보고 M샀더니 맞네요 키크신분들은 정사로 가도 되고 초반이나 그 이하는 한사이즈 다운해서 입는게 잘 맞을 것 같네요 색감은 미쳤고 핏도 매우 좋습니다 소재가 두꺼워서 각도 잘살긴히는데 그렇다고 더울정도로 두껍진 않은것같아요 결론은 핏 미쳤다,"잘살다, 다운, 이하, 실 보고, 덥다, 초반, 소재, 사이즈, 이건"
상품평이 좋아서 구입했습니다 일단 배송은 느려요 인기가 많아서 그런지 좀 늦게 받았네요 두께는 생각보다 두껍지 않네요 아웃스탠딩 반팔 티보다 얇아요 사이즈는 제 기준 L 사시면 좋을 것 같아요 어느 정도 여유도 있고 탄성이 없다 보니 입고 벗을 때 딱 좋습니다 핏은 오버핏이에요 여름에 입기 너무 좋고 너무 두껍지 않아 편합니다 전체적으로 할인받아 저렴하게 구입해서 너무 만족하고 이 정도 두께에 이 정도 가격이면 다른 색도 구입하고 싶네요 잘 입을게요 ,"전체, 만족하다, 탄성, 상품 평이, 가격 이면, 사시, 사이즈"
소버먼트 반팔은 첫구매인데 나름 아뻐요 맘에 듭니다 그런데 박음질이 별루에요 잘 입을께요 ,"버먼 트, 박음질, 팔, 별루, 듭니, 나름"
기본 반팔티로 아주 좋습니다 한여름에 입기에는 조금 두꺼운 감이 있어요,"티, 한여름, 기본, 두껍다"
한여름에 못입을 거 같다는 후기를 많이 봤는데 그정돈 아닙니다 여름에도 충분하 입을 수 있을거 같네요 그리고 진짜 피그먼트 맛집답게 차콜 색감이 아주 예쁩니다 정말로 저한테는 L사이즈가 세미오버핏 보단 큰 느낌이에요 마음에 듭니다 ,"아니다, 테, 듭니, 색감, 사이즈, 피그먼트, 충분하다"
예상보다 실물 핏이 훨씬 좋네요 너무 만족합니다 점 ,"만족하다, 실물, 핏, 예상"
후기보고 L사려다 M샀는데 일반 라지사이즈 옷에 기장만 짧은 느낌입니다 네크라인 둘레가 굉장히 작아요 입고벗을때 좀 불편하네요,"불편하다, 라지 사이즈, 크라인, 기장, 일반, 후기 보고, 작다, 사려, 둘레, 벗"
역시 소버먼트 이뻐요 탄 그자체 정핏으로 가면 딱맞고 루즈하게 입으시려면 한치수 크게 가세요 ,"버먼 트, 자체, 루즈, 치수, 가세, 크게, 가면, 정핏"
금요일 오후 시에 주문했는데 그 다음주 수요일에 받음 ,"수요일, 금요일, 시, 오후, 다음주, 주문, 받다"
실제로보니 사진보다도 더 괜찮아요 다른 리뷰들과 같이 라인자체도 이쁘고 옷 좋은게 느껴지네요 S사이즈도 적당합니다 이쁘게 입을게요,"라인 자체, 사이즈, 리뷰, 적당하다, 실제, 사진"
재질도 좋고 탄해서 좋은데 슈퍼 오버핏 너무 커요,"크다, 슈퍼, 재질, 오버핏"
여름에 막 입기 좋은 그런 옷입니다 웬만한 모든 바지와 잘 어울리고 사이즈도 오버한게 좋아요,"어울리다, 오버, 사이즈, 그렇다, 바지, 모든, 여름"
생각보다는 괜찮아요 구매 잘 고려해보세요 굿,고려
워싱이 너무 예뻐요 빛에 따라 불규칙하게 보이는 워싱 때문에 그래픽이 따로 없는데도 그 자체로 포인트가 되는 옷이에요 원단은 여름옷 치고 두꺼운 느낌인데 오버사이즈로 입어서 그런지 바람이 잘 통해서 옷 때문에 덥다는 느낌은 못 받았네요 언제든 부담없이 자주 꺼내입을 수 있는 최고의 티셔츠입니다 ,"티셔츠, 덥다, 워싱, 불규칙하다, 통해, 그렇다, 워싱, 그래픽, 오버 사이즈"
재질도 마음에 들고 자주입고 다닙니다 이쁘네요 여름 옷 ,"재질, 여름"
옷이 딴해서 몸에 컴플렉스 있으면 여러방면으로 커버해줍니다 다만 너무 딴해서 길들여지 않으면 따로 노는것처럼 느이기도 해요 ,"커버 해주다, 방면, 길들이다, 컴플렉스, 느, 몸"
피그먼트라서 그특유의 질감은 있어요 조금 무거운 느낌 시원한 옷은 아니에요 근디 이쁘게잘나와서 아무대나 입어도 무난한느낌을 줘요,"아니다, 무겁다, 시원하다, 피그먼트, 주다, 질감, 디, 그특유"
소버먼트 제품 좋아해서 할인마다 사는데 옷 품질이 좋아요 보통 XL입는데 L입으니 오버핏 되네요 M사이즈면 정사이즈 될듯해요 색상별로 다 구매하고싶네요,"사이즈, 정사 이즈, 색상 별로, 버먼 트, 품질, 할인, 보통, 살다"
원단 부드럽고 좋아요 손이 자주 갑니다 구웃구웃,"가다, 원단, 부드럽다, 손, 웃 웃"
재질 탄하고 좋습니다 어깨 디테일도 좋구요 최고,"디테 일도, 재질, 탄하, 최고, 어깨"
최고 최고 탄한 소재부터 자기주장 완벽한 라인 디테일까지 사랑합니다 소버먼트 진짜 최애 재질 ,"주장, 소재, 버먼 트, 완벽하다, 사랑, 재질, 라인, 최애, 최고"
소버먼트 헤비 피그먼트 티셔츠 차콜 이쁘네용 별기대안하고 그냥 샀는데 샌갇보다 너무 괜찮아요 옷 재질도 부드럽고 좋아요 입었을때도 부드러움 사이즈는 오버핏이라서 다운해서 S 사이즈로 했습니다 그래도 넉하고 좋아요 피그먼트 티셔츠는 별로 일거같아 안사고 있었는데 예뻐서 다른샏도 사려구욘 ,"대안, 다운, 버먼 트, 티셔츠, 티셔츠, 사려 욘, 피그먼트, 사이즈, 부드럽다, 넉"
티가 이쁘네요 제 체격이시면 딱 맞는거 같습니다,"체격 시, 티, 맞다"
색감은 사진보다 잘나와서 이쁘구요 워싱 잘뺏어요 착용감 좋고 구김도 별로 없습니다 기장은 조금 길어서 L사도 괜찮을듯,"사진, 색감, 구김, 착용, 기장, 사도, 잘나오다, 워싱"
정말 이쁘고 어깨도 넓어보이고 이거에 와이드 팬츠 입으니까 정말 정말 이쁜것 같아요 근데 좀 두꺼워서 더워요 ,"덥다, 와이드, 팬츠, 어깨, 두껍다"
무난하니 한시즌 입기 딱 좋은거 같습니다 추천헤요,"추천헤, 시즌"
두께도 적당하고 너무 이뻐요 좋습니다 코디도 다 잘 어울려요,"어울리다, 적당하다, 코 디도, 두께"
피그먼트 워싱이 너무 이뻐요 아무바지나 두루두루 잘 어울려요 사이즈는 생각보다 크게 나온거 같아서 S 사이즈로 갔는데 핏 이쁘게 나와요 ,"어울리다, 사이즈, 워싱, 나오다, 사이즈, 바지, 나오다, 피그먼트"
색감이 너무 이쁘고 두께감도 있어서 오래 입을 수 있을거 같아요,"색감, 두께 감다"
색감 딱좋네요 여름에 입기 좋고 크기는 크나 생각한 핏은나와서 좋네용,"크기, 크다, 여름, 색감, 딱좋다, 핏 나오다"
색상은 화면 그대로 이고 좀 두꺼운편입니다 찜질방 옷 같은 느낌,"색상, 화면, 그대로, 찜질방, 두껍다 편입"
베이직하고 핏도 좋네요 세일할때 저렴하게 잘 구입했습니다,"베이직, 저렴하다, 일, 핏"
튼하고 편하고 품질 좋고 가성비 좋고 배송도 빨라요 ,"가성비, 편하다, 틀다, 배송, 품질, 빨르다"
m은 전체적으로 오버라 다 좋은데 기장이 길고 그렇다고 s사기엔 작지는 않지만 뭔가 비율이 깨짐,"전체, 사기, 기장, 비율, 작, 오버, 뭔가, 길다"
적당히 두꺼워 패치 안 붙여도 괜찮고 이쁘네요 자주 입을 듯 싶습니다,"적당하다, 패치, 싶다, 붙이다, 두껍다"
역시 소버먼트 힙한 스타일을 입고 싶으면 소버먼트 반팔 하나면 뚝딱 ,"버먼 트, 스타일, 힙, 팔, 하나, 싶다, 뚝딱"
재질은 톡 컬러는 빈티지 스러워서 더 멋스럽네요 오버핏으로 편하게 입을 수있어요,"재질, 편하다, 빈티, 스럽다, 컬러, 오버핏, 수, 멋 스럽다"
어깨선이 넓어서 어깨도 넓어보이고 기장도 많이 길지 않아요,"기장, 길다, 어깨 선, 어깨, 넓다, 넓다 보이"
돈 전혀 안아깝고 너무 잘 산 반팔입니다 많이 파세용,"전혀, 파다, 팔, 아깝다"
