Review,keyword
 M 사이즈 추천드려요 재질 두께감 핏 모두 다 만족스러워서 다른 색상으로도 추가로 구매할까 고민 중이에요 ,"추천 드리다, 색상, 만족스럽다, 중이, 사이즈, 추가, 고민, 재질"
새미오버핏으로 입기 좋아요 한여름에도 계속 밖에 있을게 아니면 괜찮아요,"아니다, 한여름, 새미 오버핏, 계속"
강추드립니다 굉장히 좋네요 최고의 티셔츠 굳,"강추 드리다, 티셔츠, 최고, 굉장하다"
색도 이쁘고 사이즈도 오버핏으로 딱 좋은거 같네요,"사이즈, 색도, 오버핏"
사이즈가 약간 오버핏이라 기장이 긴편이지만 반바지랑 입으면 찰떡입니다,"편이, 기장, 반바지, 사이즈, 찰떡, 오버핏"
일단 피그먼트티 자체가 너무 이뻐요 두께감도 있어서 체형보정도되고 꼭툭튀도 잘 막아주네요 가격대비 만족쓰,"만족 쓰다, 피그먼트티, 막다, 가격 대비, 자체, 체형 보정 되다"
클까 걱정했는데 딱 맞네요 역시 피그먼트 맛집입니다,"피그먼트, 크다, 맞다, 맛집, 걱정"
워싱이 되어있는게 아니라 세탁을할수록 세월이 지날수록 자연스러운 워싱으로 맂는 제품이에요 진한회색 그대로라고 보시면되고 핏은 여유로워요,"워싱, 여유 워, 워싱, 세탁, 세월, 자연스럽다, 그대로, 지나다, 제품, 아니다"
오빠가 차콜색 샀는데 좋아하는것 같아요 자주 입고 다니네요,"차콜 색, 좋아하다, 오빠"
두께 두껍고 탄하고 반팔이라 별로 덥지않아요,"탄하, 팔이, 별로, 두께, 두껍다, 덥다"
충분히 박시하고 넣어입어도 예쁩니다 다음에는 같은 색상이어도 앞에 그래픽이 들어간 거 사야겠어요,"색상 이어도, 그래픽, 박다, 충분하다, 들어가다, 앞, 넣다"
워싱이 잘들어가서 매력적인 색이고 총장도 잘맞아요,"매력, 총장, 색, 들어가다, 워싱, 잘맞다"
사이즈 적당하고 편합니다 배가 좀 있는데 커버 잘되요,"적당하다, 편하다, 사이즈, 커버, 배, 되다"
옷 예뻐요 이번여름에 잘입겠습니다 감사합니다 ,여름
생각했던 핏 그대로 나와서 좋았습니다 약간 오버핏에 색감 피그먼트 워싱 좋네요 조금 두껍습니다 ,"피그먼트, 색감, 워싱, 나오다, 그대로, 오버핏"
한 사이즈 작게 갈 껄 그랬어요 그래도 나쁘진 않네요 잘 입을게유 ,"유, 사이즈, 작다, 나쁘다, 그렇다"
적당히 두께감이 있어서 제가 반팔티 입으면 많이 꼭지가 튀어나오는데 이 옷은 잘 가려줘서 좋아요 근데 한번은 기름이 묻어서 그 부분만 세제로 씻었는데 검은 물이 나오면서 그 부분만 탈색이 ,"적당하다, 나오다, 티, 가다, 탈색, 한번, 물이, 세제, 부분"
색감 예쁘고 핏 예쁘게 잡혀요 박음질도 튼해서 퀄리티 좋습니다 ,"틀다, 잡히다, 박음질, 퀄리티, 색감"
아무 생각없이 입기 딱 좋습니다 시접이나 마감 등 기본적인건 다 갖췄고 핏도 만족스러워서 재구매 했습니다 ,"기본 건, 만족스럽다, 시접, 재다, 마감, 핏"
배송은 조금 느렸지만 포장도 꼼하고 이상없이 도착해서 좋았습니다 옷 두께가 얇지도 두껍지도 않아서 한여름에는 조금 더울것 같긴하지만 지금 잊기에는 너무 좋은 것 같아요 편하면서 스크릿 감성 한스푼 주기 좋은 것 같아요 ,"편하다, 배송, 도착, 감성, 포장, 한여름, 스푼, 지금"
색감도 예쁘고 워낙 단해서 핏이 예쁘게 나와요,"나오다, 단, 색감, 워낙, 핏"
고민할 필요없이 사세요 여러분 정말 너무 이뻐요 ,"고민, 필요없다"
색상도 좋고 핏도좋고 아주 예쁩니다 자주 입고 다니네요 좋아요 굿 ,"색상, 핏도좋"
사진보다는 얇은 느낌이 있어요 여름에 입기 좋을 거 같아요 만족합니당,"만족하다, 사진, 여름, 얇다"
색깔도 이쁘고 루즈핏으로 잘 떨어져요 긴 팔도 사야겠어요,"팔도, 색깔, 루즈핏, 떨어지다"
빈티지 느낌의 반팔티를 원했는데 딱이네요 두께감이 있어서 옷이 짱한 느낌이에요 ,"티, 빈티, 짱하다, 원하다, 딱이다, 두께"
좋습니다 좋아여 무난하니 엄청 자주입을 것 같아요 많이 파세용,"주입, 파다"
생각보다 색감이 너무 별로에요 사진보고 고급스러운 회색인줄 알고 샀는데 그냥 거적때기같은 느낌입니다 싼맛에 편하게 입으실분들만 사시고 스타일 연출을 위해 사시는건 저는 개인적으로 비추입니당,"실, 비추다, 고급스럽다, 개인, 연출, 사진 보고, 색감, 스타일"
평소 입던 정사이즈로 시켰습니다 편하게 자주 입을것 같습니다 ,"정사 이즈, 평소, 편하다"
여름철 코디 심할 때 반팔만으로 포인트가 돼서 좋아요,"팔만, 여름철, 포인트, 코디, 심하다, 돼다"
이쁜 피그먼트 색감입니다 절개도 어깨가 넓어보이고 무난하게 입기 너무 좋네요,"색감, 피그먼트, 절개, 어깨, 넓다 보이"
상품너무좋고 크기도좋고 디자인도예쁘네요 가성비조아요,"가성비, 크기, 상품, 디자인"
생각한것보다 시원해서 여름에 입기에 좋네요 편하게 입기 좋습니다,"편하다, 시원하다, 여름"
색감 적당하고 핏도 널하니 괜찮습니다 얇은데 튼한 느낌이라 더 좋아요 ,"적당하다, 널, 색감, 틀다, 핏, 얇다"
빈티지한 색감이 예뻐요 두께가 적당해서 핏이 예쁘네요,"적당하다, 빈티, 색감, 두께, 핏"
오랜만에 제값하는 반팔티를 구매한것 같아 기쁩니다 잘입을게요 ,"티, 기쁘다, 값"
인기많은데 이유가 있네요 넥라인이 견고해서 머리 집어넣고 뺄 때 힘든거 빼곤 만족스러워요 ,"만족스럽다, 견고하다, 넥라인, 이유, 머리, 힘드다, 인기 많다, 빼다, 집어넣다"
배송빼고 정말 다 좋은 거 같습니다 핏이 너무 제가 원하던 핏이라서 좋네요 ,"원하다, 핏, 핏, 배송 빼다"
차콜 티셔츠를 사고 싶었는데 워싱도 예쁘게 되서 아무데나 어울리는 듯해요,"어울리다, 티셔츠, 워싱, 차콜, 사고, 싶다, 되다"
색상은 차콜색이고 두께도 두껍고 핏도 좋아요 넥라인이 조금 큰것같지만 괜찮아요 색깔별로 구매 하고있어요 무지는 소버먼트 ,"차콜 색, 색상, 버먼 트, 넥라인, 무지, 색깔 별로, 두께"
엄청 커요 XL 사려다 L 샀는데 XL 샀으면 큰일날 뻔요 신축성은 없지만 품이 커서 입고 벗는데 무리 없구요 무난무난하게 잘 입을거 같습니다 ,"신축 성은, 커서, 큰일 날, 크다, 무리"
옷 휘뚤마뚤 입기좋고 탄해요 오래입을듯합니다,휘뚤마뚤
원단이 짱하고 탄해서 실루엣도 이쁘고 피그먼트 워싱이 무난하지 않아보여서 좋네요,"워싱, 피그먼트, 원단, 짱하다, 보, 실루엣"
옷이 도톰하니 형태를 살려줘서 좋습니다 옷도 커서 오버핏으로 딱좋네요 한여름에는 더울거같아요 ,"살리다, 한여름, 도톰하다, 형태, 커서, 오버핏, 딱좋다"
사이즈 너무 원하던 핏입니다 색도 이쁘구요 또사야겠음 ,"원하다, 색도, 사이즈, 핏입니"
워싱이 적당히 잘되어있고 뒷판 포인트가 너무 이뻐요,"적당하다, 포인트, 워싱, 판, 되어다"
백키로가 입기 괜찮네요 재질탄해요 찐한 다른색이 있음좋겠네요,"재질, 색, 백, 찌다"
색감이 정말 이쁘네요 사이즈도 딱 좋아요 자주입을것같네요,"색감, 사이즈, 주입"
이번 여름 반팔은 이걸로 끝 다른색 다 살거에요 너무 맛있습니다,"걸, 살다, 팔, 색, 여름, 맛있다"
유튜브 보고 사봤는데 괜찮네요 소재가 일단 면 소재가 아니고 조금 거친 거 같아요 어깨선도 각이 잡힌게 마른 사람이 입기에 딱 인거 같아여,"거치다, 소재, 잡히다, 아니다, 사람, 마르다"
그냥 저렴한 가격에 무난하게 입기 좋은 옷이네여,"저렴하다, 가격, 그냥"
포장 뜯자마자 옷을 만져보면 바로 아 이건 싸구려 원단이 아니구나라고 바로 생각들게합니다 너무얇은 원단도 아니구요 아무 무늬가 없는데도 디자인이 예쁘다는 생각이 들게하네요 심플한데도 정말 예뻐요 ,"아니다 구나, 아니다, 무늬, 원단, 만지다, 이건, 원단"
어깨가 넓어보이는 핏인 것 같아요 원했던 핏은 아니지만 재질이나 색감은 최고네요,"재질, 아니다, 색감, 핏, 최고, 원하다, 어깨, 넓다 보이다, 핏"
사이즈가 생각처럼 오버핏이라서 너무 좋고 그냥입어도 좋지만 레이어드용으로 입어도 좋아요 ,"레이어 드용, 사이즈, 오버핏"
생각보다 제품이 쫀하고 너무 마음에 드는 제품이에요 ,"제품, 제품, 쫀"
피그먼트 티 찾던 중 후기도 좋고 디테일도 있어서 구매했는데 오버핏에 딱 좋네요 이쁘게 잘 입을게요 ,"피그먼트, 디테 일도, 후기, 찾다, 오버핏"
뒤에 절개도 이쁘고 옷도 짱하고 완전 맘에듭니다,"맘에듭니, 절개, 뒤, 짱하다"
소재가 탄하고 색감이 좋아요 지금부터 여름까지 잘입을거 같아요,"소재, 지금, 탄하, 색감, 여름"
사진보다 조금 더 진한컬러에요 원단 톡하니 괜찮네요 얇지 않아서 좋아요,"진하다 컬러, 톡, 사진, 원단, 얇다"
전체적으로 사이즈가 커서 활동하기에 편할거 같습니다,"전체, 활동, 편하다, 사이즈, 커서"
핏좋고 단품이나 이너로 휘뚜루마뚜루 입기 좋아요 ,"품, 핏좋"
잘받았습니다 색도 마음에 들고 재질도 탄하네요,"재질, 색도, 받다"
여행가서 너무 잘 입었고 어깨도 넓어보이고 색상도 예쁩니다,"여행가, 색상, 어깨, 넓다 보이"
맘에듭니다 또 사고싶네요 가격도 맘에들어요 최고입니다,"맘에듭니, 가격, 최고"
S인데 엉덩이까지 다 덮는 길이에요 색깔이 그냥 회색아니구 빛에 따라 은하게 빛나는 회색이라 고급스럽고 맘에 들어요 긴팔 버전도 구매하고싶네요,"고급스럽다, 길이, 은하, 팔, 버전, 회색 아니다, 덮다"
건조기 돌려도 많이 안줄어들고 핏이 너무 멋집니다 ,"줄어들다, 건조기, 돌리다, 핏, 멋지다"
딱 전투용으로 입기 너무 좋아요 엄청 튼하고 빨래 여러번 돌려도 목 안 늘어나고 그대로네요,"전투, 번, 틀다, 그대로, 돌리다, 늘어나다"
이쁜 색감과 오버핏이 잘어우러져 데일리로 입고다니기 좋습니다 ,"어우러지다, 색감, 일리, 오버핏"
생각보다 사이즈 엄청 크구요 두꺼워서 여름끝날때쯤 입으면 좋을 것 같습니다,"크다, 사이즈, 여름 끝나다, 두껍다"
이쁜옷 받은거 같아요 실물이 더이쁘내요 또주문할게요,"실물, 받다, 주문"
생각보다 두꺼워서 덥긴 한데 그만큼 체형보정을 해줘서 나쁘지 않슴니다 핏은 진짜 이뻐여,"체형 보정, 덥다, 해주다, 핏, 않슴니, 두껍다"
조금 두껍긴 하지만 핏도 재질도 짱하니 좋습니다 ,"재질, 핏, 두껍다, 짱하다"
어좁멸치한텐 M도 큼 실화냐 근데옷은 이쁨 옷 재질이랑 색감은 기대한것보다 훨씬 좋음 사샘,"어좁 멸치, 재질, 색감, 샘, 실화, 기대하다"
평소 입는데 S가 오버로 입어도 적당한듯 합니다 ,"평소, 가다, 오버, 적당하다"
오버핏이고 이뻐요 어떤바지든 다 괜찮을꺼 같아요 ,"오버핏, 바지"
딱 제가 찾던 크기와 색의 옷을 찾아버린 저는 그만 참지못하고 백텀블링을 조져버렸습니다 실착 후 너무나도 아담한 키 때문에 옷이 좀 길어 보이기는 하지만 너무 얇지 않아 뚝떨어지는 핏감에 이번에는 앞덤블링을 조져 균형을 맞춰 주었습니다 이 가격에 상당히 만족스럽네요 ,"만족스럽다, 크기, 보이, 상당하다, 길다, 텀블링, 색, 실착"
색감 이쁩니다 재질도 짱해서 맘에 듭니다 대신 목이 좀 조이는 느낌이 들어서 L 사면 적당할거같습니다,"들어서다, 조이다, 색감, 목, 재질, 대신, 사면, 듭니, 짱하다"
반팔인데 단한 느낌이에요 조금 프리한편이고 팔도 길어서 한단 정도 접어서 입어도 이뻐요 ,"프리 한편, 접다, 팔, 팔도, 단, 한단"
오버핏이고 탄해서 아무떼나 막입기 좋을것같아요,"막, 오버핏, 떼"
일단 너무 예뻐요 핏도 좋고 색감 원단 너무너무 만족합니다 가격도 따봉 ,"만족하다, 가격, 색감, 원단, 핏"
색상이 너무 잘빠진것 같고 옷 면자체도 괜찮은것 같아요 최고,"자체, 색상, 최고, 잘빠지다"
너무 이쁘고 정사이즈 입니다 제 사이즈에 s면 딱입니다,"정사 이즈, 사이즈, 딱이다"
피그먼트 워싱이 예쁘게 잘들어가있어요 맘에들어요,"피그먼트, 워싱, 들어가다"
여기 맨투맨은 M사이즈 입는데 이거는 S입어도 사이즈 잘 맞네요,"사이즈, 투맨, 사이즈, 맞다"
약간 두께감이 있어서 핏이 편하고 퀄리티가 좋아서 자주 입을것 같네요,"퀄리티, 편하다, 두께, 핏"
티이쁩니다 색감도 괜찮구 생각보다 탄한 티셔츠에야,"색감, 티, 티셔츠"
사이즈 재질 가성비 모두만족스럽습니다 추천드립니다,"만족스럽다, 추천 드리다, 가성비, 사이즈, 재질"
살짝 두껍긴한데 짱하고 좋아요 한여름빼고는 잘 입을거 같아요 ,"한여름 빼다, 짱하다, 두껍다"
색깔이 너무 마음에 들고 두꺼울줄 알았는데 입었을때 생각보다 얇아서 좋았어요 ,"얇다, 알다, 색깔, 두껍다"
주아융 주아융 소버먼트 주아융 자바나스보다 주아용,"주 융, 주다, 버먼 트, 자바 나스"
좋습니다 쫀하고 비조금 맞았는데도 안젖구 좋아요 ,"비조 금, 쫀, 젖다, 맞다"
베이지랑 같이 주문했는데 둘 다 맘에 들어요 차콜이 피그먼트 느낌이 더 나네요 두깝지않고 순면이라 좋아요 ,"베이지, 피그먼트, 순면, 차콜, 나다, 주문, 깝"
굿입니다 두께가있어좋아요 굿입니다 잘입을게요,"두께, 굿"
예뻐요 기장도 적당하고 핏도 예쁘게 잘 나오는 듯,"적당하다, 기장, 나오다, 핏"
색이 맘에들고 옷이 진짜 탄해서 자주 입을듯함,"색, 함"
색이 너무 이뻐서 자주 입기 좋고 너무 입고다니기 좋아요,색
가격도 좋고 색감 핏 뒷면도 이뻐서 여름에 부담없이 입기 좋습니다 하나 더 사려고요,"가격, 색감, 여름, 하나, 부담"
피그먼트 워싱 입문으로 좋습니다 편하게 입기 좋고 사이즈도 오버핏으로 널합니다 ,"피그먼트, 입문, 편하다, 널, 사이즈, 워싱, 오버핏"
배송도 빠르고 옷도 무척 탄하고 예뻐요 한 번 사두면 교복처럼 여기저기 휘뚤마뚤 입기 짱 좋은 티셔츠인 것 갘아요 최공 ,"티셔츠, 여기저기, 교복, 배송, 무척, 탄하, 사두, 휘뚤마뚤, 최공"
평소에 너무 박시하게 입는 편은 아니라 m사이즈 주문했는데 딱 제가 원하는 만큼 루즈하게 나와서 좋았어요 ,"사이즈, 박다, 평소, 원하다, 아니다, 루즈, 나오다"
선물해줬는데 사이즈도 잘맞고 배송도 빠흐고 디자인도 예뻣어용,"사이즈, 디자인, 배송, 잘맞다, 선물 해주다, 뻣, 빠흐"
촉감 부드럽고 오버핏으로 핏감도 좋아요 역시 소버먼트 색감이 진짜 좋고 옷이 이뻐서 색상 다른걸로 몇 개 더 사야겠어요 ,"버먼 트, 색상, 색감, 부드럽다, 걸, 촉감, 핏감"
좋아요 힙하고 무난해서 코디하기도 편합니다 기본 티라서 밋할까 봐 고민하실 수도 있는데 등에 포인트가 될만한 디자인이 있으니까 고민 안 하셔도 됩니다,"고민, 코디 기도, 편하다, 힙, 디자인, 포인트, 고민, 티"
처음엔 무지티치고 비싸다고 생각했는데 핏 좋아서 만족해요 근데 생각보다 얇습니다 ,"무지 티, 만족하다, 비싸다, 처음, 얇다"
두께감 핏 박음질 다 완벽해요 운동할때 입어도 좋을것같아요 그리고 기장이 길지않아서 더 좋은거같아요 ,"기장, 완벽하다, 박음질, 운동, 두께, 길다"
소버먼트 티셔츠 너무 예쁘네요 꾸안꾸의 정석 소버먼트 오래오래 번창하세요,"번창, 버먼 트, 티셔츠, 정석, 오래오래, 꾸다 꾸다"
빈티지스럽고 재질이 싸구려같지않아 너무좋아요 키로 엑스라지 사이즈 기가막히게 핏감좋아요 잘입을게여,"빈티 스럽다, 엑스, 막히다, 재질, 사이즈, 핏감좋아, 싸구려"
소버먼트 옷은 절대 실망시키지 않아요 최고입니다,"실망, 버먼 트, 절대, 최고"
그냥 적당하게 입을만하고 배송 좋고 색감 같고 세탁후 변형 잘못느꼈어요,"만하, 적당하다, 변형, 배송, 세탁 후, 색감, 느끼다, 그냥"
아주조아여열심히입게씀미다기장이저는긴거같앙,쓰다 밉다 다기
사이즈 크고 널하고 색도 괜찮고 좋은거같습니다,"널, 사이즈, 크다, 색도"
두께 색감 핏 다 마음에 듭니다 가성비 최고네요 잘입을게요,"가성비, 색감, 듭니, 최고, 두께"
아들이 마음에 들어합니다 잘 입고 다녀요 행사할때 잘 샀어요 ,"아들, 행사"
운동 좀 하고 몸 좀 두껍다 하시는 분들 오버핏 입으면 핏이 애매해지는데 이 옷은 진짜 몸도 커보이고 오버핏으로 야무지게 잘 나와서 아주 맘에 듭니다 기장도 길지도 않고 야물딱져요 심지어 가벼움 ,"애매하다, 몸, 운동, 가볍다, 기장, 나오다"
배송이 진짜 빠르고요 피그먼트 색감이 너무 예쁩니다,"피그먼트, 배송, 색감, 빠르다"
아쥬 마음에 드는 핏이에요 잘입겠습니다 완전 강추,"강추, 아쥬, 핏"
역시 사람들이 많이 사는데는 이유가 있는거같습니다,"이유, 사람"
남편 사줬는데 너무 이뻐서 또 사줄까 고민중입니다 합리적인 가격이 이쁜 디자인과 핏 ,"고민, 디자인, 합리, 가격, 남편, 사주다, 사주다"
원단 재질도 좋고 옷 색감도 이뻐서 데일리로 입기에 좋은것 같아요 ,"일리, 재질, 색감, 원단"
피그먼트 입던 옷이 있는데 구매당시 크게사서 사이즈 조정해서 하나 더 사고 싶어서 찾아보다가 옷이 괜찮아보여서 구매하게됨 스펙으로도 스몰사이즈 여유감 있게 입을 수 있음 기장은 길지않고 어깨와 가슴은 여유가 좀 있는 편임 옷 재질은 약간 빠빳하고 반팔치고 두께감이 있어서 한 여름 낮에 입기는 힘들어 보임 핏감은 매우 좋음 새 옷 냄새는 좀 심한 편이라 세탁후 입기를 권장하고 잔 실밥은 거의 없을 정도로 옷 상태는 훌륭함 ,"조정, 팔, 스몰 사이즈, 당시, 기장, 재질, 실밥, 스펙"
이뻐요 가격도 괜찮고 소재도 짱하네요 마음에 ,"가격, 소재"
딱 원하던 핏에 피그먼트 티셔츠가 왔네요 배송도 빠르고 굳입니당,"피그먼트, 티셔츠, 배송, 원하다, 핏, 오다, 빠르다, 굳다"
재질이 좋고 목 부분이 탄해서 오래 입을 것 같아요 어깨 넓어보여서 좋아요 ,"재질, 부분, 어깨, 넓다 보"
오버핏인데 디자인이 좋고 핏이 잘나왔습니다 옷감도 두텁고 튼한 면이에요,"디자인, 두텁다, 틀다, 잘나오다, 옷감, 오버핏, 핏"
편하면서도 멋지고 자주 입기 좋을듯 진짜 좋아요,"편하다, 멋지다"
재질 탄하고 통기성 좋아서 여름에 입기 딱 좋네요 ,"통 기성, 재질, 탄하, 여름"
색상 디자인 착용감 다 만족합니다 데일리로 무난하게 자주 할만해요 ,"만족하다, 만해, 착용, 색상, 디자인, 일리"
옷 재질이 빳하고 괜찮은데 약간 더운 감이 있습니다,"재질, 덥다, 빳"
소버먼트 컷 헤비 피그먼트 티셔츠 차콜 주문했습니다 많이들 주문하시고 인기있는 옷이라서 더 기대 됬는데요 디자인은 정멀 군더기 없이 깔끔 그자체였는데 두께감은 진짜 더울때는 입기 힘들거같아요 하지만 디자인이나 입었을때 핏감은 정말 이뻐서 자주 입게 되는거같아요 세탁후 변형은 없었어요 색감은 화면과 똑같습니다 다음에 다른 색상으로 다시 재구매 의향있습니다 ,"주문, 화면, 티셔츠, 재다, 색상, 변형, 피그먼트, 색감, 군 더기"
s가니까 너무 오버하지 않고 원하던 핏 나와서 좋았어요,"나오다, 원하다, 오버, 가다"
피그먼트 때문에 단품만 입어도 뭔가 채워진 느낌이 있어서 좋고 등 뒤에 봉제선 디테일이 너무나도 예쁩니다 세탁마다 색감이 조금씩 빠져서 연해지는 것도 나름대로의 매력이 있습니다 ,"연해, 매력, 채우다, 나름, 색감, 뭔가, 봉제 선"
맘에드는 오버핏입니다 그리고 색감이 이뻐요 약간 물빠진듯한 잘입을게요 ,"색감, 에드, 오버핏, 물 빠지다"
편하게 입기 좋습니다 디자인이 깔끔해서 아무 바지나 입어도 잘어울리는것 같습니다,"디자인, 편하다, 바지, 어울리다, 깔끔하다"
좋아요 옷이 엄청 편하고 이뻐요 언제든지 입기 조헨요,"조헨, 편하다"
사이즈도 크지 않고 디자인도 무난해서 너무 이쁩니다,"사이즈, 디자인, 크다"
아주 맘에 듭니다 다른 색상도 많이 나왔으면 좋겠어요,"색상, 듭니, 나오다"
배송도 진짜 빠르고 옷도 편해서 대만족이에요 그리고 생각보다 두깨가 있어요,"만족, 편하다, 배송, 빠르다, 깨"
오버사이즈한 느낌보다는 핏한 느낌이 좋아서 M으로 주문했는데 딱 알맞게 떨어집니다 맘에 들어서 다른 색상도 보고 있습니다,"오버 사이즈, 색상, 들어서다, 보고, 주문, 핏"
너무 예뻐요 빈티지한 색상이 멋스럽고 어깨라인이 무심한듯 포인트되어 이쁩니다,"색상, 빈티, 포인트 되어다, 어깨 라인, 무심하다, 멋 스럽다"
아무 바지에나 잘어울리고 질릴것같지않아서 더 좋아용,"어울리다, 바지, 질리다"
소재가 조금은 두껍지만 핏이 좋고 초여름까지 잘입을 것 같아요,"소재, 핏, 초여름, 두껍다"
여름에 휘뚜루마뚜루 편하게 입을 수 있는 무난한 반팔,"편하다, 여름, 팔"
요즘 제일 손이 많이 가는 옷이에요 피그먼트 색에 적당한 틴탄함까지 완벽합니다,"완벽하다, 적당하다, 가다, 피그먼트, 손, 색, 제일"
예쁜옷에 나쁘지않는 가격 맘에들어서 자주입을거같네요,"들어서다, 가격, 나쁘다, 주입"
싼가격에 스타일리시한 제품 잘샀습니다 자주 입을거같아요 ,"스타일리시, 싸다 가격, 제품"
요즘 유행하는 티셔츠로 아주 좋아요 오래 입을듯 해요,"티셔츠, 유행"
사이즈 정말 찰떡이에요 크지도 작지도 않아서 핏이 정말 이뻐요,"크다, 사이즈, 핏, 찰떡"
탄하고 예쁩니다 맨투맨 잘 입었어서 반팔로도 사봤는데 좋아요 ,"팔로, 탄하, 투맨, 사보다"
크고 재질도 아주 탄해보여서 오래오래 입을 수 있을 것 같습니다요,"오래오래, 재질, 크다"
피그먼트 워싱 반팔티중에서 등인 이유가 있는거같습니다,"티, 피그먼트, 이유, 워싱"
원단이 튼해서 세탁해도 그대로인거 같아요 여름에 잘입을거 같습니다 다른 색상으로 하나 더 사야겠어요,"그대로, 색상, 틀다, 원단, 세탁, 여름, 하나"
너무 만족하고 티셔츠 무게감도있으면서 핏감 완전 만족 합니다 좋은 상품 감사합니다,"만족하다, 만족, 상품, 티셔츠, 무게 감다"
확실히 같은 차콜색이라도 피그먼트인 것이 훨씬 이쁘네요 믿고 입는 소버먼트인 것 같아요 옷 너무 이뻐요,"피그 멀다 트이다, 버먼 트이다, 차콜 색, 확실하다, 믿다"
차콜색 힙하고 이뻐요 소재는 탄하고 두께감 있어요,"차콜 색, 탄하, 힙, 소재, 두께"
믿고 사는 소버먼트 반팔까지 샀는데 진짜 퀄리티 너무너무 좋습니다,"버먼 트, 퀄리티, 살다, 팔, 믿다"
두께가 살짝 두꺼워서 핏을 잘 잡아주고 빨래를 해도 색 빠짐이 없어서 좋아요 ,"잡다, 해도, 핏, 없다, 빨래, 빠지다, 두께, 두껍다"
색갈도 이쁘고 저렴한 가격에 잘 산거 같아요 핏도 이쁘게 잘 빠지고 주변에서도 이쁘고 잘삿다고 이야기 합니다 ,"주변, 저렴하다, 색갈, 가격, 핏, 잘삿다, 이야기"
너무 예쁘게 잘 사용하고 있습니다 감사합니다 꼼한 원단에 만족하고 있습니다,"만족하다, 사용, 원단, 꼼"
가격도 저렴 하고 디자인 무난하고 배송 빨랐어요,"가격, 디자인, 배송, 저렴, 빨르다"
항상 만족하며 구매하는 브랜드입니다 믿고 아무거나 사도 만족하는 브랜드라 너무너무 좋아요 물품 품질도 좋고 감사합니다 다음에도 또 구매하겠습니다 저 믿고 사세요 까다로운 사람이라 따라사시면 후회 안할정도로 까다로워요 정말 맘에 들어요 감사합니다,"브랜드, 만족하다, 거나, 만족하다, 사도"
면단도 좋고 색 빠짐도 없고 무엇보다 핏이 정말 이뻐요 ,"단도, 핏, 없다, 빠지다"
