Review,keyword
"시어서커 비슷한 여름느낌 재질의 셔츠를 찾다가  평소 좋아하던 파르티멘토에서 마침 알맞은 셔츠를 발견했습니다!  반팔 셔츠인데 롤업해서 이쁘게 연출 가능하고, 얇지만 탄탄한 원단으로 여름에 시원하게 입고 다닐 수 있을 것 같습니다! 색감도 이쁘게 잘 빠졌네요 !","셔츠, 인데, 여름, 얇다, 팔, 색감, 시어서커"
진짜 대박 존예임 살짝 빈티지한 느낌나는 색상에 얇고 시원하고 펄럭거리는 느낌 지기네예 소매 롤업 포인트까지 거를 타선이 없심더,"지기, 타, 선, 없다, 심다, 느끼다, 색상, 얇다, 펄럭거리다, 시원하다"
옷 핏감이 여유있게 나와서 체형보완도 되고 너무 예뻐요!,"핏감, 되다, 나오다, 보완, 여유, 체형"
얇아서 여름에도 아주 잘 입을 것 같습니다 핏도 예뻐요,"핏, 얇다, 여름"
키180 몸무게80 XL사이즈 구입 품이 넓고 길이감 잘 맞아요. 칙칙한 색상에 흐들흐들 얇은 구져진 재질이라  그냥 봤을때 허접해보였는데 입으면  옷스타일은 멋져요 ㅎㅎ,"스타일, 색상, 멋지다, 보이다, 재질, 몸무게, 허다, 접다, 품"
음 무난하이 나쁘지 않네요 한 사이즈 큰거 할걸 그랬낭,"나쁘다, 하이, 사이즈, 그렇다, 낭"
일단 원단 자체가 얇고 통풍도 잘돼서 여름에 전혀 부담없이 걸쳐 입을 수 있어요! 박시한 느낌의 셔츠이고 스트릿 느낌의 하의랑 매치하면 더 예뻐요! 너무 만족합니다,"셔츠, 이고, 여름, 만족하다, 통풍, 얇다, 매치, 박, 시한"
배송이 지연되어 조금 오래 기다렸는데 사이즈 아주 이쁘게 떨어져서 대만족합니다ㅎㅎ안에 티셔츠 받쳐 입으면 어 예쁘더라구요,"기다리다, 배송, 지연, 되어다, 떨어지다, 만족하다, 받치다, 티셔츠"
평소에 오버핏을 즐겨입는데 딱 좋아요! 팔부분은 롤업이 가능해서 날씬해보여요,"오버핏, 평소, 롤업, 가능하다, 날씬하다, 보이다, 즐기다, 부분"
색감도 이쁘고 사이즈도 잘 맞아서 잘 입고 다닐 것 같아요,"맞다, 사이즈, 색감"
예상날짜보다 오바해서 받았지만 시원하고 이뻐요 데일리템으로 딱입니다 휘뚤마뚤 최고에요 하,"받다, 데일리, 딱이다, 오, 날짜, 휘뚤마뚤, 시원하다, 예상, 최고"
셔츠 처음입어 봤는데 너무 마음에 들어요 다른 셔츠도 사고 싶네요 사이즈도 적당하고 옷 두께도 괜찮아요 ,"셔츠, 두께, 싶다, 적당하다, 사이즈, 처음"
우왓 진짜 개이뻐요!! 얇기도 해서 여름에 입어도 될 거 같고 포켓이며 양쪽 팔 단추며 다 맘에 듭니다! 풀어도 잠궈도 이쁘네영,"개다, 포켓, 이며, 잠그다, 단추, 며, 풀다, 양쪽, 얇다"
딱 보자마자 마음에 들어서 구매했는데 예약 배송으로 어쩔수없이 늦게 받았지만 기다린게 후회없을정도로 아주 맘에 들어요 가격도 매우 저렴한데 다자인도 이쁘고 가성비가 아주 좋은것 같아요 아주 맘에 듭니다,"가격, 저렴하다, 예약, 배송, 늦다, 가성비"
딱 보자마자 마음에 들어서 구매했는데 예약 배송으로 어쩔수없이 늦게 받았지만 기다린게 후회없을정도로 아주 맘에 들어요 가격도 매우 저렴한데 다자인도 이쁘고 가성비가 아주 좋은것 같아요 아주 맘에 듭니다!,"가격, 저렴하다, 예약, 배송, 늦다, 가성비"
얇아서 한여름에도 입기 좋을거 같아영 셔츠로 포인트 주고싶을때 입기 딱입니당,"딱이다, 셔츠, 싶다, 주다, 얇다, 포인트, 여름"
할인해서 샀는데 생각보다 만족합니다 얇아서 한여름에도 가능할거같아요,"할인, 여름, 얇다, 만족하다, 가능하다"
일단 배송이 너무 빨라서 합격입니다. 옷 재질도 흐물흐물 기분이 좋아요,"배송, 기분, 합격, 재질, 라서, 흐물"
사이즈 큰걸 알고 샀지만 커요. 소재가 안입은것처럼 시원해요.,"사이즈, 크다, 소재, 시원하다, 처럼, 알"
소재가 얇고 부들부들해서 여름에 입고 다니기 딱 좋아요. 사이즈도 너무 크지 않고 적당해서 저랑 비슷한 체격이신 분들은 M 가셔도 좋을 것 같아요 이번 여름에 잘 입고 다닐 셔츠 하나 싸게 건졌네요 ..,"여름, 셔츠, 적당하다, 갈다, 분, 싸다, 얇다, 건지다"
호리호리해서 여름에 입기 좋습니다. 휘뚤마뚤 마싯어요,"마싯다, 여름, 휘뚤마뚤, 호리호리"
남성 제품이라 그런지 엄청 커요… 오버핏 느낌이 아니라 그냥 잘못입은 느낌…내 옷이 아닌 느낌으로 커요 하지만  촉감 보들살랑하니 좋고 보풀 잘 안날 재질이에요 색감 너무 이쁘구 팔 롤업 단추 디테일까지 너무 귀엽고 예뻐서 그냥 입을려구요 가격도 합리적이고 배송도 빠르고 포장도 꼼꼼하니 추천합니다,"포장, 귀엽다, 색감, 제품, 추천, 배송"
소재도 유니크한게 좋구요  여름에 시원하게 입을것 같아요,"여름, 시원하다, 유니크, 소재"
여행가서 입으려고 샀는데 아주 만족했네요 재질도 시원해서 좋았고 핏도 넉넉하니 오버하게 잘 맞네요. 여행아니더라도 여름에 자주 손 갈 것 같아요,"여행가, 여름, 여행, 만족하다, 맞다, 오버"
시원해보이고 너무 예뻐요 라지사이즈도 넘 크지않고 입을만하네요,"크다, 시원하다, 보이, 사이즈, 라지"
사이즈 너무 좋고 디테일 최고입니다 다음에 또 구매할게요,"디테일, 사이즈, 최고"
하늘하늘하고 여름에 코디해서 입기 너무 좋아요!,"여름, 하늘하늘하다, 코디"
얇고 나풀나풀해서 좋은데 가슴통이 너무 커서 가끔 좀 부담스럽긴 합니당,"부담스럽다, 가슴통, 커서, 얇다, 가끔"
여행가서 너무 이쁘고 편하게 입었네요! 디자인 핏 모두 만족스러운 옷입니다! 손 자주 갈 것 같네요!,"편하다, 만족스럽다, 여행가, 디자인"
내가 원했던 시골 농촌 소년 느낌. 그런데 한 줌의 트렌드를 넣은... 내년 여름에 요기나게 입을 수 있겠어요,"여름, 내, 줌, 원하다, 요기, 트렌드, 넣다"
This brand was loved by people for many years. It has a good design and quality. I love it. Please continue to make good products. Thank you for your effort lol nice design team.,
좀 먾이 입으니까 보풀생겼는데 티도 안나서 좋아요 ㅎ 암때나 입기 넘 좋아요,"생기다, 나서다, 먾, 티, 보풀"
얇아서 여름에 입기 좋고 색감이랑 소재 모두 맘에 들어요,"색감, 이랑, 여름, 얇다, 소재"
반팔위에 입으면 에어컨 튼 실내에서 따숩고 좋아요~ 그냥 입어도 예뻐요!,"실내, 따숩, 그냥, 위, 팔, 에어컨"
색도 퀄도 무난하니 한철입기에 괜찮은 것 같습니다,"퀄, 한철, 색도"
시원하고 디자인도 무난하지않아 좋아요. 기장은 살짝 짧은감이 있네요,"짧다, 디자인, 기장, 시원하다"
"배송은 좀 늦었지만 만족스럽습니다. 제품의 경우에는 가격이 저렴하다보니 생기는 문제일 수 있는데, 하루 입고 단추가 하나 날아갔습니다. 근데 디자인 품이 맘에들어서 아직도 잘 입고다니고있습니다. 전체적으로 만족입니다.","저렴하다, 제품, 가격, 배송, 만족스럽다, 디자인, 만족, 늦다, 하루"
가성비있게 여름에 입기 좋습니다 재질은 얇고 구김있는 느낌입니다,"여름, 얇다, 재질, 가성비, 구김"
시원하고 좋아요! 여행갔을때 잘 입고 다녔습니다 ㅎㅎ,"가다, 시원하다, 여행"
흐물흐물거리는 느낌이라 좋아요 편하게 입기 좋습니다,"편하다, 흐물흐물, 거리"
너무 에뻐요. 핏도 엄청 좋고 팔 소매 단추 디테일이 너무 남자답고 좋아요 재질은 린넨 느낌이라서 정말 시원합니다,"남다, 원하다, 핏, 디테, 일이, 재질"
비슷한 스타일의 다른 제품도 많은데 단추로 흰색 포인트를 줘서 넘 귀엽더라구요. 면 자체가 하늘 하늘해서 루즈하게 오바핏으로 구매 하는걸 추천드려요!!,"제품, 귀엽다, 구, 흰색, 스타일, 단추, 포인트, 추천, 드리다"
재질이 너무 시원하고 셔츠가 하늘하늘해서 착용감이 너무 좋았어요 .ᐟ 팔부분 디테일이 정말 마음에 들었습니다 :),"셔츠, 착용, 하늘하늘하다, 재질, 디테, 일이, 시원하다"
얇아요 너무 얇아요 생각했던거보다 더 여름에 입긴좋네요,"여름, 얇다"
xl 많이 클까봐 L 시켰는데 세탁하니 많이 줄어드네요 사이즈 업 하는 게 나을 거 같아요,"크다, 줄다, 드, 세탁, 나다, 사이즈, 많이"
가격대비 마감 핏 재질 좋아요 스타일 하기도 편하구 비침없습니다 ,"편하다, 스타일, 없다, 재질, 마감, 비침, 대비, 가격"
품이 진짜 크긴하네요 ㅋㅋ 옷 자체는 맘에 드는데 뭐랄까 약간 색이 좀 더 밝거나...아더컬러라도 있었으면 더 좋았을 것 같아요ㅠ 제가 입으니까 동남아에서 망고스틴 파는 젊은 사내 느낌이 나네요 그치만 맘에 들어요 근데 동생은 도둑 패션이래요 근데 힙한 선글라스 끼면 그나마 힙함으로 커버쳐지는 것 같아요,"컬러, 라도, 패션, 밝다, 색, 동생, 선글라스, 크다"
색감도 사진에서 보는 거랑 똑같고 좋아요 특히 팔 소매 올리는 디테일이 있어서 더욱 좋았던 거 같아요 아쉬운 점은 핏이 살짝 어벙한 느낌이 있는 거 말곤 다 좋아요 세탁 후에도 괜찮습니다,"색감, 세탁, 아쉽다, 사진"
패턴도 예쁘고 얇은데 비치지 않아서 더운 날씨에 잘 입고 다녔습니다,"덥다, 패턴, 날씨, 얇다, 비치, 지"
제질도 시원하고 소매 디테일도 좋아요 핏도원하던 핏입니다,"핏입니, 핏, 원하다, 디테, 일도, 질도, 시원하다, 소매"
반팔셔츠는 처음 입어보는데 시원하고 이쁩니다!,"입어보다, 셔츠, 시원하다, 처음, 팔"
링클이라 주름같은 거 신경 안써도 좋아요 소매부분 롤업해서 입으면 귀여울 구 같아요,"롤업, 귀, 여울, 써다, 링클, 주름, 소매"
원래 반팔셔츠 잘 안입는데 ㅋ 이건 진짜 얇고 편하규 휘뚜루마뚜루 너무 좋아요.,"얇다, 원래, 이건, 휘뚜루, 뚜루, 편, 하규, 셔츠"
딱 생각하던 재질이네요 편하게 잘 입을수있을거같아요,"재다, 편하다"
"여러 곳에서 좋은 평이 들려서 구매해 봤는데, 그 정도로 대단한 건 아닌 것 같습니다. 그냥 딱 가격에 만족할만한 퀄리티고 특별히 불편함이 느껴지지 않을 뿐, 링클 포인트 셔츠란 것만 제외하면 특별히 어디가 특출하게 대단하다고 하기는 어려울 것 같네요.  가장 아쉬운 부분은 소매 바깥쪽은 단추가 있어서 고정이 잘 되어있지만, 안쪽은 없어서 소매가 부분적으로 풀리는게 아쉬웠습니다.","퀄리티, 부분, 아쉽다, 포인트, 가격, 만족하다"
생각한 그대로 너뮤 이뽀요!! 고민하고 있다면 무조건 사시요😋,"고민, 하고, 사시, 뽀, 무조건, 그대로, 뮤"
가성비 깡패인듯 하네요 멋내기도 좋고 캐쥬얼도 좋아서 대학생들에게 봄비같은존재,"멋, 내, 기도, 가성비, 캐, 쥬얼, 깡패, 존재, 봄비"
딱 휴양지 무드로 연출하기 좋아요 이정도 가격에 이정도 퀄리티면 굿굿,"연출, 휴양지, 퀄리티, 가격, 무드"
그냥 무난무난해여 체크셔츠 입고싶을때 막입으면 될듯,"막, 싶다, 그냥, 셔츠, 체크"
사이즈도 딱 좋고! 배송도 빠르고 할인할 때 사서 그런지 더 마음에 들어요!!,"그렇다, 배송, 사이즈, 빠르다, 사서, 할인"
아주아주 이쁘고 사진이랑 똑같아요 역시 잘 구매 했습니다!,"사진, 이랑, 똑같다"
진짜 이쁨 여름에 더워서 반팔 셔츠 찾았는데 딱 이거에요 개추,"찾다, 셔츠, 여름, 덥다, 팔, 개추"
진짜 퀄좋고 예뻐요 또 주문하려고요 감사합니다,주문
색감은 올린 사진이랑 제일 비슷해요!! 자글자글한 소재가 마음에 듭니다  ᩚ  ᩚ 가격대비 짱 .. ᰔ  원래 사이즈를 크게 입는편이라 L 구매했어요 -! 얇고 가벼워서 더운여름에 딱일꺼같네요,"색감, 덥다, 가볍다, 소재, 여름, 사진, 이랑, 사이즈, 얇다"
너무 마음에 들어요 자주 애용할거같아요 잘입겠습니다,애용
진짜 이번여름에 산 셔츠중 재질이나 핏 제일만족스럽네요😊,"만족스럽다, 재질, 이나, 여름, 셔츠, 제일"
시원하고 아무데나 입기좋아요 티셔츠망 입다가 심심하면 입기에 딱좋은것 같아요 가격도 싸서좋아요,"티셔츠, 다가, 가격"
"예약 배송이라 주문 후 물건 수령까지 2주 정도 걸렸지만 제품을 받고 입어보니 기다린 보람을 느끼고 있습니다☺️ 여름에도 입을 수 있는 셔츠가 하나 있으면 좋겠다고 생각해서 구매한건데 그 역할을 너무 잘 해내고 있어요 ㅎㅎ 충분히 넉넉하게 나와서 제 스펙에 L사이즈도 입을 수 있을 듯 해요. 저는 넉넉하게 입고 싶어서 XL시키긴 했지만요.. 180 넘으시는 분들은 그래도 XL 추천합니당🦒 화면에서 보이는 것처럼 회색 베이스에 체크무늬 옷이에요. 화면과 동일하게 생겼습니다. 주름이 진 상태로 나온 제품이라 자연스러움이 느껴지는 디자인이라고 생각했어요. 빳빳한 셔츠는 조금만 주름지면 되게 거슬리고, 평소에 입을 때 주름 지지 않게 신경을 많이 썼는데 이 셔츠는 그럴 필요가 없어서 여기저기 휘뚜루마뚜루 입고 있습니다😼 잠궈서 입어도 예쁘고 안에 흰 티를 입고 그 위에 걸쳐도 예뻐요. 저는 요즘 같이 무더운 날씨에는 이 셔츠 하나만 잠궈 입곤 해요😙 옷이 몸에 달라붙지 않아서 더운 날에도 입기 좋아요!! 무게도 전혀 무겁지 않습니다~ 앞쪽 포켓의 활용도가 생각보다 많아서 놀랐어요. 물론 이 포켓을 멋(!)으로 활용하기도 하지만 요즘같이 푹푹 찌는 날씨에 가방에서 카드, 핸드폰 꺼내기도 너무 귀찮더라구요.. 그래서 가슴쪽 양 포켓에 교통카드나 핸드폰 넣고 다니며 유용하게 사용하고 있습니다😙 제 핸드폰은 6.1인치인데 포켓에 딱 들어가네용~ 단추 힘이 약한 건 조금 아쉽니다😢 빨래 한 번 돌렸는데 단추 묶고 있는 실이 떨어져나왔어요🙀","셔츠, 여름, 이에요, 묶다, 디자인, 이라고"
이 가격대 치고는 만족하면서 너무 잘 입었습니다. ,"만족하다, 치고는, 가격, 대"
좀 큰사이즈사서 덥긴한데 루즈핏이고 이뻐요 색상이뻐요,"루즈핏, 색상, 덥다, 사이즈, 사서"
롤업해서 입으니깐 예쁘네용 다림질 안해도 돼서 좋아요 호호,"롤업, 돼다, 다림질, 해도"
하늘 하늘 한 원다이고 시원 합니다. 가성비로 입기 좋네요 ,"가성비, 다이고, 하늘, 시원"
옷이 너무 시원하고 핏도 좋고 아주 마음에 들어요,"핏, 시원하다"
배송이 느렸지만 옷 이뻐요. 여름에도 입을만 하구 착용감도 좋아요 저는 L이 딱 좋은 거 같아요 ㅎ 다만 소매 부분은 그냥 안 접구 입는 게 좋은 거 같아요,"여름, 착용, 느리다, 배송, 그냥"
린넨소재 느낌으로 약간은 거친듯한 느낌이 있는 원단입니당. 체크무늬가 트렌디하고 아메카지룩에 찰떡이네용. 사이즈도  품이 넉넉하여 마음에듭니당. 잘입겠숩니당,"체크, 무늬, 소재, 찰떡, 사이즈, 숩, 니당다, 품, 원단"
얇아서 여름에 입기 딱이고 소매 롤업하면 포인트도 돼서 좋아요,"여름, 롤, 업다, 얇다, 딱이다, 포인트, 돼다, 소매"
얇고 우글거리는 소재라 살에도 안달라붙고 베리만족합니다. 무진장세일때 놓쳐서 못사고 다시 쿠폰먹여서 저렴하게 사서 좋습니다:) 평소사이즈 XL입는데 사실 L입어도 맞을꺼같은데 팔접어입고 박시하게 입으려고 XL삿는데 이쁩니다. 얼른 구매하세요!,"저렴하다, 살, 만족하다, 박다"
7/25 출고 예정이었는데 늦어져서 7/31에 출고될 수도 있다는 문자를 받았습니다. 그런데 예상보다 일찍 보내주셔서 감동!!  품이랑 소매 길이는 넉넉합니다! 그리고 두께가 얇아서 바람 불면 엄청 시원합니다!  항상 맏고 구매하는 파르티멘토 파이팅🔥,"늦어지다, 문자, 시원하다, 불면, 보내다, 예상, 받다, 파이팅"
옷 야무짐 엄청 시원함 휴가가서도 입기 좋을듯 옷 예쁨,"서도, 시원하다, 무짐"
디자인도 그렇고 마음에 들어요! 팔부분은 꼭 롤업해서 입어야할 것 같아요. 오버핏으로 착용하기 좋습니다.,"착용, 롤업, 오버핏, 디자인, 그렇다, 부분"
가성비 너무 좋은 제품이고 얇은데 핏도 좋고 체크셔츠 입문으로 좋은선택 인거 같습니다.,"제품, 이고, 셔츠, 핏, 입문, 가성비, 얇다, 선택"
체크패턴듀 예쁘고 시원하니 잘입을꺼 같아요 잘입을게요 ,"시원하다, 체크, 패턴"
얇고 시원해서 마음에 듭니다 다만 맨몸으로 입기엔 약간 거친 느낌이 있어서 에어리즘과 함께 입고있습니다 팔부분 끈과 단추가 있어서 접어입어도 예쁘고 풀어입어도 예뻐요 가성비 갑입니다!,"맨몸, 끈, 접다, 얇다, 시원하다"
롤업 하프 셔츠라 핏이 러프하게 잘 나와서 좋은 거 같아요 다만 입었을 때 일부러 각이 잡혀져 있는 건지 밑으로 가면서 배 부분이 넓어져서 튀어나온 거 같네요,"잡히다, 러프, 튀어나오다, 가면, 나오다, 밑, 셔츠"
이너로 티셔츠안입고 단품으로 입는게 더 이쁜거 같아요 기장 핏 적당해서 연청바지랑 코디하기 나쁘지않네요. 가볍고 얇아서 여름에 딱이네요,"연, 청바지, 적당하다, 가볍다, 여름, 얇다, 딱이다, 이너, 단, 품"
뭔가 안 입은듯한 시원함은 없네요 하지만 편하게 입기 좋고 와이프는 보더니 이쁘다고 합니다,"보더, 편하다, 쁘다, 없다, 뭔가"
한치수ㅈ크게 살걸 그랬나 기장이 조금만 더 길었으면 좋겠네요ㅎㅎ,"길다, 그렇다, 기장, 크게, 치수"
저렴한 가격에 구매해서 잘 입고있습니다. 원단감도 얇아서 여름에 입기좋고 색이 전체적으로 톤다운된 색감이라 하의를 밝게해서 포인트로 주고 위에 이 셔츠를 입었을때 밸런스가 매우 좋습니다,"셔츠, 색감, 색, 밝다, 여름, 저렴하다"
옷도 예쁘고 소재감도 얇아서 입기 좋고 색감도 예뻐서 편하게 입기에 넘 좋아요,"편하다, 얇다, 색감"
샹각보다 핏도 이쁘고 소매 쪽에 단추 있는게 너무 좋아요,"샹각, 핏, 쪽, 소매, 단추"
너무 시원하고 처음에 옷에서 냄새도 안나고 이 가격에 퀄리티가 너무 좋네오!!,"냄새, 네오, 처음, 퀄리티, 나다, 시원하다, 가격"
구매하시면 꼭 돌돌이나 털고 입으시길 실밥이 많이 나와요,"실밥, 나오다, 털다, 이나, 많이"
아주 크지만 편하게 입으려고 샀어요 여름에 잘입을거같아요,"여름, 편하다, 크다"
가볍고 주름이 안생겨서 너무 좋아요 세탁기돌리고 털어서 널어 놓으면 금방마르고 무엇보다도 옷이 너무 편해요,"편하다, 가볍다, 생기다, 주름, 널다, 놓다, 털다, 돌리다"
소재도 시원하고 이쁘고 여름에 최적 자주 입고 다니는중,"여름, 시원하다, 소재, 최적"
옷을 자주 입고있어요 핏이 좋아서 손이 많이 갑니다,"가다, 핏, 손, 많이"
배송도 엄청 빠르고 면도 엄청 시원한 면이라서 만족스러워요,"만족스럽다, 배송, 시원하다, 빠르다, 면도"
사이즈도 딱 맞고 재질도 시원해서 너무 좋습니다,"사이즈, 맞다, 시원하다, 재질"
너무 흔하네요 얘는 한 삼일에 한번씩 보는 것 같아요,"흔하다, 번, 씩, 얘, 삼일"
색감이 유독 예뻤던 걸로 기억해요. 선물용으로 사줬거든요. 받은 사람도 만족해 했었습니다.,"사주다, 만족하다, 선물, 기억, 색감, 받다, 사람, 걸"
아주 귀여운 셔츠입니다 너무 마음에 들고 시원해요,"셔츠, 시원하다, 귀엽다"
살짝 애매합니다 셔츠치고 핏도 어깨 좁아보였어요 한 사이즈 업해서 구매하기를 추천즈립니다,"추천, 립니, 업, 셔츠, 치고, 보이다, 핏, 애매하다, 사이즈, 좁다"
사이즈 적당하고 부들부들한 재질이라 좋아용 추천드립니다,"부들부들하다, 드리다, 적당하다, 재질, 사이즈, 추천"
셔츠가 이뻐서 샀다  정말 좋았다 최고였다 좋았다,"셔츠, 최고"
여름에 입기에도 소재가 얇고 나풀나풀거려서 괜찮아요. 소매 핏이 조금 애매한 게 오히려 좋기도 하고요. 다만...길에서 하루에 한 번씩 마주치는...,"하루, 기도, 나풀거리다, 애매하다, 길"
그냥 저냥 편하게 입기 좋다 사이즈는 살짝 크다 옷은 사진이랑 똑같다,"사진, 이랑, 사이즈, 편하다, 똑같다, 그냥, 냥"
"여름 내내 애용한 제품입니다, 얇기가 얇지만 비침이 없어 안에 이너를 착용하지 않고도 입을 수 있습니다. 세탁 후 쭈글거리기는 하지만 다림질을 하거나 하지 않더라도 자연스러워 괜찮습니다","세탁, 얇다, 제품, 여름, 자연스럽다, 애용, 다림질"
여행갈때 잘입었고 너무 이뻐서 잘산거같습니다,"잘살다, 여행"
재질이 얇고 시원해 한여름에도 입기 좋았습니다,"여름, 얇다, 재질, 시원하다"
잘 못 온 상품도 바로 교체해주셨고 역시나 인기 많은 이유가 있는 옷입니다.,"상품, 교체, 해주다, 이유, 인기, 많다"
생각하던 핏이 그대로 나와서 맘에 들어요! 다음에 또 구매할게요,"핏, 나오다, 그대로"
패턴 예쁘고 소재 탄탄하니 좋아요 여름에 딱 이네요,"여름, 소재, 패턴"
셔츠원단이 엄청 시원하고 좋습니다 진짜 강추합니다,"원단, 강추, 시원하다, 셔츠"
편하고 시원해서 여름철에도 입을만 한 몇 안 되는 셔츠입니다.,"여름철, 셔츠, 편하다, 시원하다, 되다"
너무 크고 더운 재질이라 손이 잘 안 가요 그치만 예쁩니다,"그치다, 재질, 가요, 크다, 손, 덥다"
제가 좋아하는 티 top3안에 듭니다 넘 예쁘고 펀해요 굿,"펀하다, 좋아하다, 듭니"
가성비 좋게 잘 구매해서 여름에 잘 입고있습니다 팔 단추 디테일도 좋아용,"여름, 디테, 일도, 가성비, 단추"
부들부들하고 진짜 편해서 좋아요 옆에 팔 접을 수 있도록 단추도 있어서 더 예쁘게 접을 수 있어요,"편하다, 접, 옆, 부들부들하다, 단추"
이쁘고 무난해서 편하게 입기 좋아요 원단이 덥지도 않구요,"편하다, 원단, 덥다"
긴팔을 받아 교환요청을 했는데 반품하고 다시 벋는데 일주일이걸렸네요. ㅡㅡ 사이즈에 비해 길이가 좀 짧은듯한 느낌이긴 한데 세탁 후 입어봐야겠네요,"세탁, 일주일, 입어보다, 짧다, 팔, 사이즈, 길이, 걸리다, 반품, 하고, 벋다"
크기가 좀 큰 편이지만 널널하게 입을 수 있어요!! 덥지 않은 재질,"덥다, 편이, 크기, 재질"
183/90 XL 옷 이쁘고 맘에드네요 가성비 굳굳,"에드, 가성비"
핏이 너무 많이 아쉬워요 ㅠㅜ 재질도 좋지 않고요 이 가격에 다른 상품을 사는 게 훨씬 나아요,"가격, 상품, 많이, 재질, 아쉽다, 나다"
사이즈도 널널하고 시원하고 부들부들한 재질이라 여름에 입기 좋아요 근데 단추 풀때 자꾸 걸려요...,"부들부들하다, 여름, 걸리다, 근데, 재질, 시원하다, 자꾸, 사이즈"
재질도 부드러우면서 좋고 코디 매칭할때도 좋아요! 다만 클론이 정말 너무 많어요...ㅎㅎ ,"부드럽다, 클론, 많다, 매칭, 코디, 재질"
올 여름에 제일 많이 본 반팔셔츠 같은데 팔이 단추 디테일이 좋아요,"팔이, 셔츠, 디테, 일이, 여름, 팔, 단추, 많이, 제일"
큰 기대 안하고 구매하였는데 생각보다 괜찮아서 휘뚜루 입고 다니기 좋습니다.,휘뚜루
매우 이쁘네여매우 이쁘네여매우 이쁘네여매우 이쁘네여,
오버핏이라 박시하게 입기 좋습니다. 이쁩니다 잘입겠습니다,"오버핏, 박다"
"옷도 크고 재질도 짱짱탄탄해서 좋네요. 두께감이 조금있어서 봄,가을에 딱일듯","가을, 두께감, 재질, 크다"
예뻐요. 하늘하늘 한 것도 느낌이 좋고. 팔에 단츄를 이용한 디테일도 좋고,"단츄, 디테, 일도, 팔, 이용, 하늘하늘"
색깔 똑같고 완전 시원해요! 여름에도 입기 좋은 것 같아요,"여름, 색깔, 똑같다, 시원하다"
좋아요 약간 공대생 같긴한데; 맘에 드네요 완전 부드러운 재질은 아닙니다,"부드럽다, 아니다, 재질"
사진보다 색이 좀 더 어두운 느낌이 없지않아 있는데 그래도 충분히 이쁘고 재질이 가벼워서 여름에 입기 좋은거 같아요!,"색, 여름, 벼워, 사진, 재질, 두운"
