Review,keyword
배송도 빠르고 이쁜옷이 왔습니다 하늘하늘 거리고 사이즈도 괜찮음,"사이즈, 배송, 거리, 오다, 빠르다"
랭킹 상위에 있듯이 믿고 입는 옷입니다 포인트 주기 너무 좋고 잘 입고있습니다,"랭킹, 포인트, 주기, 상위, 믿다"
시원하고 정말 뜨거운 날에 입기도 좋습니다 마감은 쏘 그래도 만족합니다 예쁘거든요,"만족하다, 시원하다, 마감, 날, 뜨겁다"
흐물흐물한 재질에 색감이나 핏은 트렌디한 것같아요 다만 재질이 단추쪽이나 마감은 아쉬워요 그래도 저렴한 가격에 입긴 괜춘해요 가격대비 비싸보임,"마감, 가격 대비, 재질, 흐물흐물, 저렴하다, 트렌디, 색감, 재질, 비싸다 보임, 가격"
넘나리 이쁜 BD 아디다스 핸드볼 스페지알 네이비 이쁘게 신겠습니당 ,"아디다스, 스 페지 알, 핸드볼, 네이비, 넘다, 신다 니당다"
사이즈 오버핏이라 넉하고 여름에 입기 좋아요 ,"넉, 사이즈, 여름, 오버핏"
무난한 셔츠들 보다 디자인이 유니크해서 예뻐요 ,"유니크, 셔츠, 디자인"
여름에 그냥 입어도 체크 패턴 때문에 포인트가 되고 코디가 완성이 됩니다 일주일에 번은 입을 정도로 자주 입어요,"완성, 일주일, 포인트, 패턴, 번은, 코디"
몇번 입긴했는데 잘 입진 못했어요 애매한 팔 기장 ,"기장, 애매하다, 몇번"
편하고 입기에 되게 좋은거같아요 강추하겠습니다,"편하다, 강추"
이뻐요 이빠요 무난하게 잘 입고 댕길 수 있는 옷이에용,댕길
하루만에 배송 너무 이쁘고 핏이 자연스럽게 연출 할수 있어서 놀랍습니다,"자연, 연출, 하루, 배송, 핏"
여름에 입기 시원하고 깔끔하니 좋습니다 가을까지 입을 수 있을거같아요,"시원하다, 여름, 깔끔하다, 가을"
너무 좋네요 가볍고 재질좋고 이쁘고 가성비 좋아요,"가성비, 가볍다, 재질"
옷 되게 편하고 예뻐요 만족합니다 추천하는 제품,"만족하다, 편하다, 추천, 제품"
여행가면서 앓은 체크셔츠 장만했는데 엄청 앓아서 시원하고 예뻐서 만족합니다 ,"여행가 면서, 체크 셔츠, 만족하다, 시원하다, 장만, 앓다, 앓다"
롤업해서 입으면 생각보다 짧아져서 당황하긴 했는데 막상 입으니까 예쁘네요,"당황, 롤업, 막상, 짧아지다"
배송도 빠르고 예뻐서 손도 많이가요 자주 입을꺼 같아요,"배송, 손, 빠르다, 가요"
체크남방이 입고 싶어서 이것저것 찾다가 색 조합도 무난하고 예뻐서 구매했습니당 더운날씨에 입기에도 재질이 시원해서 잘입고있어요 핏도 넉해서 이쁩니다,"덥다 날씨, 체크 남방, 시원하다, 넉, 재질, 조합, 핏"
사이즈 넉해편해요 촌이 얇고 후들후들해서 소매에 있는 단추로 롤업한 걸 고정해도 몸통쪽은 좀 금방 풀리는 것 빼곤 좋아요 색은 살제 입었을때가 좀 더 어두운것 같아요,"편하다, 고정, 롤업, 후 후, 단추, 사이즈, 소매, 살제, 금방, 색"
주름이 원래도 져서 약간 코디가 힘들긴 히지만 이빠요,"주름, 힘들다, 코디, 원래, 히"
너무 시원하고 여름에 땀흘려도 금방말라서 여행갈때 입기 좋았어요,"금방 말, 시원하다, 여름, 여행 갈다, 땀 흘리다"
가볍게 입기좋고 무난무난하고 시원하이 막 입기 좋아요,"시원하다, 가볍다"
좋습니다 팔 안걷는게 더 이쁜거같아요 시원하니 좋습니다,"시원하다, 걷다"
가격대비 너무 좋은거같아요 재질도 시원하니 여름에 잘입고다닐수 있어요,"가격 대비, 시원하다, 재질, 여름"
후기보고 샀는데 역시나 좋습니다 이뻐여 올여름 이거 많이 입음,"올여름, 후기 보고"
재질 핏 모두 좋습니다 흔하지 않은 디자인이라 자주 입을것같아요,"디자인, 재질, 흔하다"
기장이 길줄 알았는데 딱 맞아 떨어지고 핏도 너무 이쁘게 잘 나오네요,"기장, 나오다, 핏, 알다, 맞다, 떨어지다"
튼하고 잘 만들었습니다 다만 밖에서 명 마주칩니다,"마주치다, 틀다, 밖, 만들다"
셔츠에 빠져서 구매했는데 롤업 디테일 이뻐요 롤업이 된 제품인 줄 알았는데 롤업해서 단추로 고정할 수 있는 식으로 되어 있어요 천도 바람 잘 통해서 시원하고 잘 입을 수 있을거 같아요,"롤업, 롤업, 통해, 고정, 롤업, 셔츠, 시원하다, 단추, 식"
얇기는 하지만 색감이 좋아여 얇기는 하지만 색감이 좋아여,"색감, 얇다"
일단 처음봤을땐 어떻게 코디해야할지막했는데 막상입어보니까 어느바지에도 잘어울리고 셔츠만입어도 편하고 얇아서 입기좋고 흰티위에 입어도 너무잘어울려요 완전만족합니다 강추 ,"셔츠, 만족하다, 어울리다, 바지, 어울리다, 편하다, 강추, 희다 티위"
다른 사람들이랑 많이 겹치긴 하지만 이쁜거가타요,"사람, 겹 치다, 가타"
사람들 너무 많이입고다니네요 한달동안 네명이나봤어요 그마큼 이쁘다는 거겠죠 ,"마 크다, 사람, 달동, 명, 겠다"
얇고 시원해서 이번 여름 이 옷으로 견딜 수 있었어요,"시원하다, 견디다, 여름, 얇다"
상품도 만족스럽고 배송도 빠릅니다 추천합니다 상품도 만족스럽고 배송도 빠릅니다 추천합니다 ,"추천, 만족스럽다, 상품, 배송, 빠르다"
좋앙진짜로 이쁘고 소재 아쉬울줄 알았는데 굿해요,"소재, 알다, 아쉽다, 굿"
색감이 참 독특하게 예쁜 것 같아요 잘 입을게요 감사합니다,"색감, 독특하다"
원단이 정말 얇고 여름에 입기 너무 좋은 옷 같아요 잘 입을게용 ,"여름, 원단, 얇다"
길에 많이 보인다는게 아쉽지만 그만큼 예뻐요 자주입어요,"보이다, 길, 아쉽다"
얇아서 여름에 입어도 시원하고 좋은 것 같습니다,"시원하다, 여름, 얇다"
여름 셔츠가 필요해서 구매했습니다 단정한 느낌은 아니고 그냥 편하게 입을 수 있어요 얇아서 여름에 입기 딱 좋은 옷 같습니다 소매는 접어입는게 훨씬 예뻐요 ,"접다, 필요하다, 셔츠, 편하다, 단정하다, 여름, 아니다"
박시하고 캐쥬얼하게 입기 좋아요 통풍이 잘되는 시원한 소재는 아니라서 한여름에 입기는 좀 더운 것 같아요 예뻐서 자주 입고 싶은데 길거리 다니면 꼭 한두명씩 같은 옷 입은 사람 마주쳐서 머쓱 ,"마주치다, 명, 아니다, 캐 쥬얼, 시원하다, 소재, 머쓱, 박다"
사이즈가 크게 나와서 넉합니다 원단도 얇고 살에 붙지도 않아서 시원합니다 ,"시원하다, 넉, 사이즈, 원단, 나오다, 살, 얇다, 붙다, 크게"
시원한 소재라 여름에 입기 좋은거같아요 잘입고있어요,"소재, 시원하다, 여름"
요즘 스타일의 휘뚜루마뚜루 입을 수 있는 반팔셔츠입니다 무난하게 이뻐요,"셔츠, 스타일"
색감 너무 마음에 들어요 시원한 재질이라 여름에 입기 딱 이네용,"재질, 시원하다, 여름, 색감"
생각보다 길고 크네요 두께가 얇아서 한여름에 입기 좋아요 ,"한여름, 길다, 크다, 얇다, 두께"
옷이 이쁜데 생각보다 좀 크고 거리에 사람들이 엄청 많이 입고있어요,"사람, 거리, 크다"
 누나 선물로 사주게 됐습니다 사이즈 살짝 오버하게 입을 수 있고 여름에 입기 시원하다고 합니다 위에 사이즈 참고해서 구매하시면 좋을 거 같습니다 ,"시원하다, 참고, 사이즈, 선물, 사주다, 오버"
여름 셔츠 찾다가 편하게 입고 다니기 좋을 것 같아 구매했는데 원하던 느낌 딱이네요 단점은 주변에 꽤 많이 보여요,"편하다, 보이다, 주변, 원하다, 셔츠, 단점, 여름, 찾다"
옷 너무 마음에 들어요 요즘 이런 옷들이 좋네요 잘입어야지,이렇다
너무 예뻐서 샀는데 확실히 인기가 많아서 길 지나다니면 이 옷 많이 보여요 ,"확실하다, 지나다, 인기, 보이다, 많다"
주름 걱정없이 편하게 입을 수 있는 부드러운 소재입니다 여름에 잘 입을 수 있을 것 같습니다 ,"소재, 편하다, 부드럽다, 여름, 주름, 걱정"
여기저기 휘뚜루마뚜루 잘입고있어요 더워서 나시입고 걸쳐서 제일 많이 입는것같아요 흔하다고 하는데 생각보다 똑같은옷 많이 안마주친거같아요,"여기저기, 걸치다, 나시, 흔하다, 덥다, 제일"
원래 셔츠를 안좋아해서 살까 말까 한 달을 고민했는데 배송받고 나서 입어보니 정말 마음에 들어요 한 달의 시간이 아깝네요,"입어보다, 셔츠, 나서다, 달, 원래, 달"
어엄청 얇고 후들후들한 소재에 팔 접어서 고정할 수 있는 단추까지 있어서 너무 만족했던 반팔셔츠 입니다 어두운 색이라 딱히 비침은 못 느꼈고 나름 여기저기 다 잘 코디할 수 있는 무난하면서 예쁜 코디템이라고 생각해요 ,"셔츠, 여기저기, 어엄청, 고정, 접다, 코디, 코디템, 후 후"
여름에 입기좋습니다 엄청얇아서 유니 에어리즘입고 입우면 셔츠 입을만합니다,"에어 리즘, 셔츠, 여름, 유니, 얇다"
더위를 많이 타는 제겐 너무나 좋은 옷입니다 그리고 흐물흐물한게 귀여워요 다만 너무 많은 사람들이 입고 다녀요 하루에 한번씩은 꼭 이 옷을 입은 사람들이 보입니다 ,"보이다, 사람, 한번, 흐물흐물"
셔츠 무늬도 예쁜데 살짝 구겨진 느낌이라 너무 포멀하지 않은 스타일이 좋은 것 같아요 팔 접을 수 있는 디테일도 좋아요,"포 멀다, 스타일, 구기다, 디테 일도, 접, 셔츠, 무늬"
길까 걱정했는데 오버핏으로 예쁘게 맞습니다 품은 좀 넓은 편이구요 비침이 심하면 티를 입으려 했는데 비침은 거의 없아서 좋네요,"펴다, 비치다, 비치다, 심하다, 티, 품다, 맞다, 걱정"
넉하게 나온 것 같습니다 소매 접어서 입으면 딱이고 여름에 잘 입고 다녀요,"접다, 넉, 여름, 나오다, 소매, 딱이다"
포장도 꼼하고 배송도 빠르고 실물이 더 이쁘네요,"배송, 포장, 실물, 빠르다, 꼼"
여름에 입기 딱 좋은 셔츠 너무 시원하고 이뻐요 강추,"셔츠, 강추, 시원하다, 여름"
커플로 입으려고 구매했어요 피부가 하얀 분들한테 특히 더 잘 어울릴 것 같은 색감이에요 루즈한 바지랑 입으니까 넘 예쁘네요 ,"어울리다, 커플, 분, 바지, 색감, 루즈, 피부, 하얗다"
옷이 얇고 가벼운데 입으면 더워요 더위 많이 타시는 분은 비추입니다 가을 초에 입으면 딱 맞을 것 같아요 크기는 큽니다,"비추다, 크다, 크기, 덥다, 가볍다, 가을, 분"
사이즈 넉하고 얇아서 여름에 잘 입을 거 같아요 ,"넉, 사이즈, 여름, 얇다"
가성비 있게 입기 좋긴한데 확실히 내구성이 안좋습니다 ,"구성, 가성비, 확실하다, 안좋다"
옷 편하고 좋습니다 잘 안구겨져서 더 좋아요 막입기 좋음,"구기다, 편하다, 막"
살짝 두껍긴 한데 편하게 입기 좋습니다 안구겨져서 좋아요,"구기다, 편하다, 두껍다"
좀 까끌거리긴한데 크게 불편하진않고 얇고 편해서 좋아요,"편하다, 크게, 얇다, 불편하다, 끄다 끄다"
여름철에 입기좋은 반팔 셔츠입니다 무채색이라 조합해서 입기 너무 좋고 팔 쪽에 단추 디테일로 팔을 걷어도 이쁩니다 여성분들한테는 오버사이즈로 입는걸 좋아하실 경우에는 추천드립니다 ,"셔츠, 추천 드리다, 여성 늘다, 무채색, 조합, 경우, 여름철, 오버 사이즈, 단추"
얇아서 여름에 입기 너무 좋고 편한데 옷도 아무데나 입어도 이뻐여 잘 입겠습니다,"펴다, 여름, 얇다"
사진은 친구가 찍어줫습니다 저거 입고 친구들 만난 날에 똑같은 셔츠 입은 분들을 두 분이나 봣답니다 하 가끔 길 가다가 같은 셔츠 입으신 분들도 마니 봐요 편하게 입기 좋습니다만 약간 두꺼운 감이 없지않아 잇습니다 그리고 저한테는 약간 품이 커서 쪼금 더 작앗으면 더 perfect햇을 테지만 지금도 잘 입고 다닙닌다,"분, 다닙닌다, 친구, 테, 사진, 말다, 친구, 만난, 분"
재질 여름에 입기 좋고 팔 접을 수 있는게 좋은 것 같아요,"접, 재질, 여름"
남들과 많이 겹치는 옷이라는 단점이 있는데 여름에 입기 적당한 두께고 사진이랑 똑같은 색감이에요,"색감, 사진, 겹 치다, 적당하다, 단점, 여름, 남"
되게 얇고 편한 셔츠에요 대신에 사람들이 많이 입고 다녀서 꽤 겹쳐요 ,"셔츠, 겹 치다, 대신, 편하다, 사람, 얇다"
얇고 롤업 포인트가 맘에들어요 손이 자주가서 잘입고 댕겨요,"댕겨, 롤업, 포인트, 가다, 손, 얇다"
얇고 시원한 재질이라 여름에 입기 좋은 것 같아요,"재질, 시원하다, 여름, 얇다"
제품이 엄청 가성비 넘치고 편하고 좋습니다 만족 ,"가성비, 편하다, 넘다, 만족, 제품"
여름에 입기 너무 좋은 옷입니다 다만 마감이 아쉬워여,"마감, 여름, 아쉽다"
소재 얇고 좋아요 다만 다른 리뷰들처럼 마감이 아쉽지만 옷은 이쁨,"리뷰, 마감, 소재, 얇다, 아쉽다"
가성비가 너무 좋아요 소매부분에 단추도 있어 다양한 연출도 가능해요,"연출, 부분, 가성비, 단추, 가능하다, 다양하다"
시원한 재질의 옷은 아닌데 휘뚜루 마뚜루 입긴 좋습니다 마감이 부실해서 세일 많이 할때 구매 추천,"부실하다, 재질, 마감, 시원하다, 추천, 일, 아니다, 휘뚜루"
배송도 빠르게 왓고 항상 잘입구댕기고있어요 감사핮니다,"항상, 배송, 왓, 빠르다, 감사 핮니, 댕기"
재질은 정말 시원해요 원래 자연스러운 주름 있는 재질이라 혹시나 해서 다림질 하면 매끈하게 입을 수 있을까 싶어 다려봤는데 안 펴져요 아들이 말라서 루즈핏으로 입기에도 좀 큰 편입니다 ,"편입, 자연스럽다, 재질, 시원하다, 말, 재질, 아들"
반팔셔츠가 필요해서 주뭌햇는대 아주 이쁘네요,"셔츠, 필요하다, 뭌햇 늘다"
길에서 많이 보이지만 그만큼 예뻐요 요새 자주입어요,"길, 보이, 요새"
오버핏으로 입으려 했지만 길이감이 조금 짧은 느낌이 있어서 정핏으로 입고있어여,"길이, 짧다, 정핏, 오버핏"
세미 오버핏 체크셔츠 찾고 있었는데 장말 가성비 좋은 가격에 구매한 것 같습니다,"체크 셔츠, 가성비, 가격, 장말, 세미, 오버핏"
괘않은 티 인거같아요 많이 많이 파시고 부지되세요,"파시, 부지 되다, 괘않"
얇아서 여름에 아주 잘 입고 다닙니다 박시해서 더 이쁜것 같아요,"박 시해, 여름, 얇다"
깔끔하면서도 행사가격에 사서 만족합니다 약간 크긴한데 아여,"행사 가격, 크다, 만족하다, 사서, 깔끔하다"
깔끔하고 색감도 생각한 그대로입니다 만족해요,"만족하다, 그대로, 색감, 깔끔하다"
공대생 셔츠 같지도 않고 데일리로 입고 나가도 무난해서 강추드려요 ,"강추 드리다, 공대생, 셔츠, 일리"
실물이 백배 더 낫습니다 후기 보고 긴가 민가 해서 샀는데 좋은 선택이였어요 색감은 보랏빛과 차콜 색이 섞여 있어요,"실물, 색, 색감, 민가, 차콜, 백배, 보고, 후기"
실물이 백배 더 낫습니다 후기 보고 긴가 민가 해서 샀는데 좋은 선택이였어요,"실물, 민가, 보고, 백배, 선택, 낫다"
사이즈도 적당하고 아주예쁩니다 또한 재질이 좋네요,"적당하다, 사이즈, 재질"
사이즈 핏 색감 다 완벽하네요 자주 입을 것 같아요,"완벽하다, 사이즈, 색감"
구겨짐없이 입기 좋아요 코디하기 편하고 애용하는템입니당,"애용, 코디, 편하다, 구기다 짐"
제사이즈에 라지는 좀 크네요 근디 셔츠는 진짜 맛도리셔츠인거같아요 m사이즈로 다시살까 생각중이에요 ,"사이즈, 사이즈, 셔츠, 라지, 디, 크다, 맛 도리 셔츠, 다시 살다"
시원하고 사이즈나 핏도 딱입니다 실밥이 약간 풀려있는 부분이 많아 아쉽네요 ,"실밥, 시원하다, 사이즈, 부분, 풀다, 핏, 아쉽다, 많다, 딱이다"
디자인이 이쁘긴 한데 마르신 분들한테 추천합니다,"추천, 마르다, 디자인, 분"
요즘 딱 유행하는 체크셔츠인데 가격이 적당해서 구매했습니다 가성비 나쁘지 않고 기장이나 사이즈도 베스트네요 ,"체크 셔츠, 유행, 적당하다, 베스트, 가성비, 가격, 기장, 사이즈"
랭킹에 있는 이유가 있네요 사고 꽤 자주 손이 갔어요,"랭킹, 손, 이유, 사고, 가다"
힙하고 시원해서 여름에 자주 입을거 같아요 감사합니다,"시원하다, 힙, 여름"
이리저리 많이 보이긴 하는데 이쁩니다 후회 없으여,"보이다, 후회, 없다"
생각보다 크롭한 기장입니다 얇아서 한여름에도 입기 좋습니다 ,"기장, 크롭, 한여름, 얇다"
힙하고 시원하고 색감도 너무 이뻐서 잘 산거 같아요 ,"시원하다, 힙, 색감"
여행가서 입을려고 주문 했는데 출고도 빨리 처리 해주시고 옷도 무난하면서 이뻐요 ,"여행가, 해주시, 출고, 처리, 주문"
제가 이번 여름 내 꾸준히 입고 다녔던 체크셔츠입니다 길에서 같은 옷을 입은사람을 자주 마주치긴 하지만 빈티지 느낌이 너무 잘 맞아서 만족해요 얇아서 좋은데 바람이 잘 통하는 느낌은 아니에요 ,"체크 셔츠, 마주치다, 아니다, 만족하다, 통, 사람, 길, 빈티"
오프라인 매장에서 입어보고 구입했습니다 가격 저렴하고 퀄리티 좋네요 ,"입어보다, 매장, 저렴하다, 오프라인, 퀄리티, 가격"
딱 제시된 상품사진과 같은 색상으로 너무 이뻐요,"상품 사진, 색상, 제시 되다"
일단 옷 자체 디자인은 너므 예쁜데 한번입엇는데 단추부분 구멍이 찢어버려지고 살짝 조심히 입어야 될거같아요 그래도 너무 시원하고 예뻐요,"구멍, 단추 부분, 조심, 시원하다, 디자인, 자체, 너므"
요즘 날씨에 입기도 좋고 무엇보다도 핏이 너무 마음에 들었습니다 ,"날씨, 핏"
제가 입으려고 샀는데 생각보다 크고 안어울려서 오빠 주려고요 입으면 힙해져요 ,"어울리다, 힙, 주다, 크다, 오빠"
예뻐요 색감 굿 생각보다 밖에서 같은 옷 입은 사람 없어요 ,"색감, 사람, 없다, 밖"
옷이 엄청 얇아서 여름이 입기 너무너무 좋아요 근데 같은 입은 사람 개많음,"여름, 사람, 얇다, 개 많다"
저에게 맞는 옷을 찾았어요 소재도 얇은 느낌이라 좋았어요,"소재, 찾다, 얇다, 맞다"
통기성 좋고 한여름에 입기 최곱니다 사이즈는 그렇게 많이 박시하진 않고 기장은 좀 짧은편,"통 기성, 기장, 박다, 사이즈, 한여름, 최 곱다, 짧다 편"
얇고 편해서 자주 입고 다닐 것 같아요 예뻐서 만족해요,"만족하다, 편하다, 얇다"
생각보다 다들 많이 입고 다니더라구요 다른건 다 좋았으나 세탁한번하니 단추가 하나 떨어졌습니다 ,"세탁 번하다, 다르다, 단추, 하나"
생각보다 기장이 조금 긴데 오버핏이라 그냥 입으려구용,"기장, 오버핏, 그냥"
여름에 입기좋은 셔츠를 찾고있었는데 딱 인거 같습니더,"셔츠, 여름, 찾다"
뚱인데 잘맞아요 그리고 얇아서 여름에 입기딱이에요,"여름, 잘맞다, 딱이다, 얇다, 뚱"
사이즈도 적당하고 두껍지가 않아서 여름에도 입기 좋아요,"적당하다, 사이즈, 여름, 두껍다"
크기는 제가 입어도 큰데 더위 많이 타시는 분들은 여름에 입기엔 좀 많이 더울 것 같아요,"크기, 크다, 여름, 덥다, 분, 더위"
너무 예쁩니다 시원한 재질이라서 좋아요 여름에 입어도 됨,"재질, 시원하다, 여름"
만족해여 촤르 떨어지는 핏에 시원하고 아무바지에나 잘어울리는듯 좋네요,"바지, 만족하다, 시원하다, 촤르, 핏, 어울리다, 떨어지다"
대 만족 이네요 반팔셔츠를 원래 안입었다 이번에 뽐뿌와서 샀는데 이건 단품으로 입 때 이쁜듯,"셔츠, 품, 원래, 이건, 만족"
사진과 같이 예쁘고 입었을때 편안합니다 자주 입을 것 같아요 ,"사진, 편안하다"
롤업을 예쁘게 해서 입을 수 있는 셔츠에요 재질도 얇고 패턴이랑 질감도 예뻐서 대만족 입니다 여름 시작할때 살걸 그랬네요,"패턴, 롤업, 셔츠, 살걸, 재질, 만족, 질감"
여기저기 입기 좋은 링클 셔츠 바지도 어떤 바지던 매치하기 좋아요 오픈해서 입어도 예쁘네요 올 여름 자주 입었습니다,"오픈, 여기저기, 매치, 링클, 셔츠, 바지 던, 바지, 여름"
한번밖에 안입었는데 두번째 입을 때 단추 여매던 중 단추가 떨어졌습니다 너무 헐겁게 고정되어있어요 세탁이라도 하면 단추 다 떨어질 것 같아요 그리고 롤업 부분도 잘풀려서 모양이 이쁘지 않게 돼요 재질은 얇고 시원하지만 까슬까슬해서 단독으로 입기는 거친편입니다 ,"거치다 편입, 단추, 단추, 시원하다, 던, 롤업, 풀다, 헐겁다"
시원하고 편하게 아주 잘 압고 다닙니다 갈별로 구매함 ,"시원하다, 압, 갈다 별로, 편하다, 함"
얇은 체크셔츠 사고싶었는데 이걸로 잘 산 거 같습니다,"체크 셔츠, 걸, 얇다"
글쎄요 전 안어울려서 여자친구 줬더니 잘 입네요 마른사람한테 어울리는 옷같아요,"글쎄요, 어울리다, 여자친구, 마르다 사람, 어울리다, 주다"
길에서 많이 보이긴하는데 시원하고 좋습니다 만족,"보이, 만족, 시원하다, 길"
여름에 가볍게 입기 좋은거 같아요 총장이 살짝 짧은 느낌이 들는것 같긴 하네요,"총장, 가볍다, 여름, 짧다"
역시 파르티멘토를 따라갈수가 없네요 만족 대 만족입니다,"만족, 파르티멘토, 만족, 없다, 따라가다"
후들후들해서 여름에 단벌로 입기에 딱 좋아요 찰랑거리는 재질이라서 어디에 입어도 예뻐요,"재질, 후 후, 찰랑거리다, 단벌, 여름"
편하고 예쁘고 좋습니다 돈 아깝지 않아요 잘샀어요,"편하다, 아깝다"
사이즈 되게 크고 엄청 얇고 이뻐요 밖에 나가면 오억명이 입고 다니고 보풀이 잘 생지만 정말 이쁩니다,"오억, 생, 보풀, 사이즈, 크다"
넉하고 소재가 후들후들해서 좋아요 한여름엔 더운 재질 ,"후 후, 넉, 소재, 덥다, 재질, 한여름"
이번 더운 폭염에 스타일리쉬하게 잘입을것같아요 ,"폭염, 덥다, 스타일리쉬"
남자친구랑 커플로 입고싶어서 구매했어요 사이즈는 크긴한데 원래 오버핏 좋아해서 일부러 샀어요 얇아서 시원하고 좋습니당 ,"크다, 커플, 남자친구, 일부러, 시원하다, 원래, 사이즈, 좋아하다, 니당다"
두께감이 후들후들하게 얇아서 여름에 입고다니기 좋습니다 ,"후 후, 여름, 얇다, 두께"
배송빨랐어요 원단 시원하니 지금입기딱좋고 디자인 예뻐요 ,"시원하다, 원단, 디자인, 배송 빨르다, 지금 딱좋다"
사이즈 적당하고 옷 예뻐요 배송 빨라요 만족합니다,"만족하다, 적당하다, 사이즈, 배송, 빨르다"
디자인너무 예쁩니다 한사이즈 큰걸로 살걸 그랬어요 단점은 너무예뻐서 많이들 사셨는지 길가면 꼭 한두명씩 보이네요 ,"명, 디자인, 길가, 크다 걸, 사이즈, 보이다, 단점, 살걸"
잘 맞고 이런 셔츠 처음 입어보는데 잘 어울리는것같아서 좋았어요,"입어보다, 이렇다, 셔츠, 처음, 어울리다, 맞다"
박시한 셔츠 찾다가 산 제품인데 지금 날씨에 딱 맞게 얇고 가격도 착합니다 엄청 오버 핏을 원하시면 한치수 업 하시는거 추천드려요 ,"추천 드리다, 치수, 날씨, 원하다, 셔츠, 제품, 착하다, 박 시한"
체크패턴이 예쁘고 차콜 색감이 너무 잘빠졌네요 반바지에 매치해서 자주 입고 있어요 재구매의사 있습니다,"체크 패턴, 매치, 차콜, 재다 의사, 반바지, 색감, 잘빠지다"
조금 크지만 사이즈 제외하면 완벽 한 거 같아요 이쁩니다,"완벽, 크다, 사이즈, 제외"
배송은 빠르고 옷도 예쁘고 요즘 많이 보이긴 하는데 시원해서 좋네요,"시원하다, 배송, 보이다, 빠르다"
달라붙지않아서 시원하게 잘 입을꺼 같아요 품은 넓은편이고 길이는 짪은편이예요,"시원하다, 길이, 품다, 짪 편이, 달라붙다, 넓다 편이"
이가격에 이정도 퀄리티 셔츠면 무조건 사세요 너무 좋아요,"이정, 가격, 무조건, 셔츠, 퀄리티"
이뻐요 근데 이 옷 입은사람 이번 여름에만 명은 본듯,"명, 사람, 여름"
