Review,keyword
일단 소재가 너무 맘에들었고 반팔기장도 딱 코디하기 예쁘게 잘 떨어졌습니다 ,"기장, 코디, 소재, 떨어지다"
옷은 맘에 드는데 입고 나가면 하루에 한번 이상은 꼭 같은 옷 입은 사람 보여요 주변 사람들이 네 셔츠입었다고 말해주네요 ,"사람, 말 해주다, 이상은, 사람, 한번, 보이다"
잘입겠습니다 옷 이뻐요 추천드립미다요 담사요,"추천 드립 밉다, 담사"
흐물흐물한 원단감에 약간 비치고 엄청 시원합니다 그리고 팔 롤업하면 이뻐요,"롤 업다, 시원하다, 흐물흐물, 비치, 단감"
택배 받자마자 입어봤는데 단추가 떨어질 거 같았어요 그래서 전체적으로 한 번 더 손 봐줬어요 그거 말곤 너무너무 예쁘고 맘에 들어욤,"전체, 들어욤, 단추, 말다, 그거, 택배"
장점 가격대비 이쁘게 입을 수 있는 반팔 셔츠 단점 사람 많은 곳에서는 똑같은 옷이 많이 보일 수 있음,"장점, 가격 대비, 셔츠, 단점, 팔, 보이다, 사람"
배송도빠르고 시원해서 여름철에 입기 적합니다,"시원하다, 여름철, 적합, 배송 빠르다"
짱 시원해여 다들 제발 사새여 동생도 같이 입는데 사이즈 딱 좋아여 굳 ,"시원하다, 새, 동생, 사이즈, 제발"
여름에 입고다니기 너무 좋아요 유넥이랑 입어서 편한 느낌을 주거나 롤업할땐 슬리브리스도 괜찮더라구요 이너없이 입기엔 셔츠 사이즈가 생각보다 커서 이너 꼭 입게 되더라구요 그리구 요즘 인기가 많은지 길거리에 조금 많이 보입니다 그래도 편하고 이쁘게 잘 입고 다녀요,"보이다, 사이즈, 유넥, 인기, 주거"
부들부들하고 일반셔츠보다 입었을때 엄청 편합니다,"셔츠, 편하다, 부들부들하다"
예쁜데 입고 나가면 똑같은 옷 명은 있어요 그정도로 인기가 많네요,"명, 인기, 많다, 똑같다"
올 여름 시원하게 잘 입고 다녔습미다 코디하기도 쉬워요,"코디 기도, 시원하다, 여름, 쉽다, 밉다"
예뻐요 사이즈도 넉하고 패턴이 넘 맘에드네요 여자가 입어도 박시하게 예쁜 것 같아용,"사이즈, 박다, 넉, 여자, 패턴, 에드"
엄마한테 셔츠 예쁘다고 칭찬받았습니다 특유의 소재와 체크무늬가 좋습니다 ,"체크 무늬, 엄마, 특유, 셔츠, 소재, 칭찬 받다"
사이즈는 오버합니다 소매 단추있어서 여러 스타일 가능해요,"가능하다, 오버, 사이즈, 스타일, 여러, 소매, 단추"
셔츠 이쁘고 얇아서 덥지도 않아가지고 잘 입고 다녔어요,"덥다, 셔츠, 얇다"
맛도리입니다 날이너무 더워 생각보다 많이 입지는 못했네요 ,"날, 입지, 덥다, 맛 도리"
여름에 입기에 좋은 원단이고 가볍게 입기에 좋아요,"가볍다, 여름, 원단"
옷이 이뻐서 단품도 좋고 반팔에겹쳐서 입는것도 이쁘네요,"팔 겹 치다, 품"
일본청년이 된거같아 좋네요 시티보이 룩에 캐쥬얼하고 이쁩니다,"청년, 캐 쥬얼, 시티 보이, 된거, 룩"
너무 편하고 휘뚜루 마뚜루라 진짜 자주 입음 근데 이게 소문이 났는지 여기저기 파르티멘토 셔츠가 보임 나도 모르게 커플셔츠 엄청 맞춤 그치만 포기 못하는 휘뚜루마뚜루임,"커플 셔츠, 여기저기, 파르티 멘토, 편하다, 셔츠, 그치다, 소문, 모르다"
입고 나가면 강제 커플룩 됨 질은 잘 몰루겟슴 ᐟ ᐟ 그냥저냥,"강제, 커플룩, 질, 몰루겟슴"
하늘하늘하니 여름에 반팔위에 휘뚜루 걸치기 좋습니다 디자인도 마음에 들어요 ,"하늘하늘하다, 걸치다, 디자인, 여름, 휘뚜루, 위"
여름에 시원하게 입기 매우 좋습니다 만족스럽네요 ,"만족스럽다, 시원하다, 여름"
여름철에 입긴 덥지만 나름대로 잘 입고 다녔어요,"여름철, 덥다, 나름"
색상이 화면하고 똑같아요 사이즈는 약간 오버핏으로 입으니 좋아요,"사이즈, 색상, 화면, 오버핏, 똑같다"
예쁜 반팔셔츠 발견하고 얼른 구매했습니다 하자가있었지만 재고가 없어서 그냥 입으려고요 ,"셔츠, 발견, 얼른, 재고, 없다, 그냥"
여름에 너무 예쁘고 시원하게 잘입었습니다 근데 땀나면 좀 따가워요 그게 단점,"시원하다, 여름, 단점, 그게, 따다, 따갑다"
재질좋고 여름에 입기 좋은거 같네요 잘 샀습니다 ,"여름, 재질"
소재가 시원해서 여름에 입고 다나기 정말 좋아요 ,"시원하다, 소재, 다나, 여름"
롤업하면 팔길이도 예쁘게 떨어지고 소재도 시원해서 잘 입을게요,"롤 업다, 시원하다, 소재, 길이, 떨어지다"
체형이 크나 작으나 핏이좋고 달라붙지않아 시원하네요 성별구분없이 다양한 연령대에서 착용하기좋아 다시 재구매하네요 여 에 키로 남 에 키로,"연령, 시원하다, 재다, 체형, 크다, 작다, 다시, 핏이좋, 착용"
여름에 반팔티만 입기 지겨울때 추천합니다 재질도 얇아서 좋아요,"추천, 티, 재질, 여름, 겨울, 얇다"
너무 맘에 들고 좋아요 색깔 별로 구매하는 중 입니다 ,"별로, 색깔"
예쁘고 편해서 좋습다 보풀이 조금 아쉬워요 여름에 입기 좋아용,"편하다, 보풀, 여름, 아쉽다"
후기 좋은 이유가 잇네요 살에 달라붙지않아 여름에 입기 좋아요,"이유, 여름, 살, 후기, 잇다, 달라붙다"
아따 맛있다잇 괜찮네요 가성비로 입기 좋아요 얇은데 바람이 잘통하는건 아녜요 전체적으로 괜찮았어요 ,"전체, 자다 통, 가성비, 바람, 얇다, 아따, 녜, 맛있다 잇다"
이정도 가격으로 봤을때 나쁘지 않은것 같습니다,"이정, 가격, 나쁘다"
출퇴근 교복으로 입고있는데 편하고 좋습니다 잘입을게요,"교복, 편하다, 출퇴근"
여름에 입기 너무 좋고 옷이 시원시원 하네요 만족스럽습니다 ,"만족스럽다, 여름"
좋아요잉 얇고 시원해요잉 상이상으로 크긴 해요잉,"시원하다 잉, 상이, 크다, 해요잉, 잉, 얇다"
폼이 살짝 크긴 한데 기장감도 딱이고 핏도 좋습니다 ,"기장 감다, 크다, 폼, 핏, 딱이다"
핏이 너무 예쁘고 깔끔하게 입기 좋아요 강추입니다 ,"강추, 핏, 깔끔하다"
여름에 셔츠 하나 필요해서 사봤는데 너무 좋네요,"필요하다, 여름, 셔츠, 하나, 사보다"
옷은 참 이쁩니다 근데 입는 사람이 너무 많아서 입고 나가면 지하철에서 다섯명은 보입니다 옷 겹치는거 싫으신 분들은 비추합니다,"비추다, 겹 치다, 보이다, 지하철, 사람, 분"
저렴히 구매한 만큼 딱 그정도에 퀄리티 단추 마감도 아쉽고 기장도 짧은 편이라 아쉬움 또 길거리에서 은근히 보임,"길거리, 저렴하다, 은근, 퀄리티, 기장, 편이, 단추"
한여름에 입기도 좋을만큼 시원해요 힙해보입니다,"힙 보이다, 시원하다, 한여름"
남자친구 선물해줘서 여름에 더운데 시원하게 입기 좋아요,"선물 해주다, 시원하다, 남자친구, 여름, 덥다"
단추색상이 어두웠으면 좋았을텐데 전체적인 마감이 약한게 조금 아쉬움,"추색, 전체, 마감, 어둡다, 약하다, 아쉬움"
시원하게 잘입고 있습니다 단점이라면 입고다니는 분들이 많다는거 ,"단점 라면, 시원하다, 분, 많다"
쭈글쭈글해서 그냥 막 걸치기 이쁜것같아요 굿,"걸치다, 쭈글쭈글하다, 그냥"
여름가을에 레이어두로 입기 좋아요 추천합니다 ,"추천, 여름 가을, 레이어"
 인 제 키에 조금 큰 오버핏 걸치는 용도로 입어도 그냥 메인으로 입어도 너무 이뻐요,"메인, 걸치다, 키, 용도, 오버핏, 그냥"
완전 여름용 셔츠라서 오히려 입기 편했던거 같습니다,"여름, 셔츠, 편하다"
날씨가 더워서 그런지 생각보다 자주 입지는 못했습니다 더워용 ,"덥다, 날씨, 그렇다, 덥다, 입지"
사이즈가 크긴한데 어마어마하게 큰 정도는 아니구 편하게 입을만하게 커요 근데 재질이 좀 더운 것 같슴다 ,"만하, 크다, 어마어마하다, 크다, 사이즈, 재질, 편하다, 아니다, 덥다"
배송도 빨랏고 옷도 완전 좋고 핏도 완전 좋습니다,"배송, 핏, 빨랏"
옷이 재질이 시원하고 롤업 단추가 있는게 포인트가 됩니다 ,"포인트, 롤업, 시원하다, 재질, 단추, 되다"
옷은 예쁘고 좋지만 너무 많은사람이 입는다는 단점이 ,"단점, 많다 사람"
얇고 시원해요 바람에 살랑살랑 휘날리는 셔츠 굿,"시원하다, 셔츠, 바람, 휘날리다, 얇다"
처음엔 코디가 어려웠는데 계속 착용하니 예쁜 것 같아요,"착용, 처음, 코디, 어렵다, 계속"
이뿐데 주변에 너무 많이보여요 이젳못입겟어요,"주변, 젳, 이뿌다, 보 여요"
색상도 너무 마음에 들고 넉하니 편하게 입기 좋아요,"색상, 편하다"
시원한 재질이라 진짜 더웠던 이번 여름에 조금이나마 시원하게 옷 입고 외출 할 수 있었어요 ,"시원하다, 시원하다, 재질, 여름, 외출, 덥다"
일단 단품으로 입기에도 좋았고 이쁘고 시원헤서 아주 만족했습니다,"헤, 품, 만족하다"
얇고 엄청 시원해요 근데 이쁘니까 여름에 자꾸 손이가요,"손 가요, 시원하다, 여름, 자꾸, 얇다"
얇고 팔접는 디테일이 있어서 더 좋았습니다 색도 빈티지스럽고 좋아요,"빈티 스럽다, 디테 일이, 팔 접다, 색도, 얇다"
예쁘고 좋아요 근데 건조기 한번 돌리면 두번은 못 입습니다 ,"건조기, 번은, 돌리다, 한번"
가격 좋고 지금은 에어컨으로 시원한 실내에서 주로 입고 있네요,"에어컨, 실내, 시원하다, 가격, 주로, 지금"
패턴이랑 색이 너무 취향이였는데 단추가 몇번 안입었는데 떨어져서 아쉬웠습니다,"패턴, 단추, 색, 취향, 아쉽다, 몇번, 떨어지다"
어디에 입어도 찰떡이네요 꾸안꾸 입어도 좋고 단추를 다 잠구고 슬림한 넥타이 매고 꾸며도 이뻐요 ,"단추, 슬림, 넥타이, 매다, 잠구, 찰떡"
색감 패턴 디자인 핏 다 좋습니다 시원하고 최고예요,"시원하다, 디자인, 색감, 패턴, 최고"
흐물흐물 재질에 얇아서 좋아요 팔 접을 수 있는 부분도 마음에 듦 ,"접, 흐물흐물, 재질, 부분, 얇다"
옷은 이쁜데 보풀이 생기고 단추부분은 너무 약해서 떨어지고 오래 못 입을 듯,"생기, 단추 부분, 보풀, 약하다, 떨어지다"
남자친구 선물해줬는데 예뿌다고 조아해요 안튀는데 예쁜 체크라서 저도 맘에 들어용,"체크, 조아하다, 남자친구, 예뿌다, 튀다, 선물 해주다"
배송도 빨랐고 주름이 자연스러워서 자주 입을 수 있다는 점이 좋고 얇아서 시원함,"자연스럽다, 시원하다, 점, 주름, 배송, 얇다, 빨르다"
디테일도 있고 이쁘긴 한데 진짜 입고 다니는 사람 너어무 많음,"무, 디테 일도, 사람, 많다"
남자친구랑 커플로 맞췄어요 아주 귀엽고 시원해 버입니다 ,"남자친구, 커플, 버입니, 시원하다, 맞추다, 귀엽다"
남자칭구랑 커플로 맞췄어요 아주 귀엽고 시원해 보입니다 ,"남 자칭 구, 커플, 시원하다, 보이다, 맞추다, 귀엽다"
어깨가 넓은편인데 소매 잘접어서 입으니까 예쁘네요 색도 맘에 들고 잘입을게요,"접다, 소매, 색도, 어깨, 넓다 편"
굉장히 얇아서 시원하고 품도 넓어서 활동할때 편합니다 그리고 옷이뻐요 다만 단추구멍에 실밥이 이중으로 갈라져있어서 단추를 잠그거나 풀때 걸리는데 마감처리 약간 아쉬운거빼곤 좋아요,"마감 처리, 단추 구멍, 걸리다, 편하다, 실밥, 단추, 시원하다, 이중, 잠그다"
재질도 좋고 배송도 빨라서 잘 받았습니다 잘쓸게요,"잘쓰다, 재질, 배송, 받다"
톤 다운된 색상에 두께도 얇아서 여름에 입기 좋습니다 ,"색상, 여름, 얇다, 두께, 다운 되다"
여태 옷사서 같은 옷 본적이 거의 없눈데 이건 진짜 일주일에 명은 보는 거 같아용 눈치게임하면서 잘 입고 있습니다 얇고 가벼워서 편하게 착용가눙,"눈치, 본적, 일주일, 명, 착용 눙, 가볍다, 편하다, 이건"
재질 시원하고 좋아요 팔쪽에 단추가 뒤에도 있었으몀 좋겠어요,"시원하다, 단추, 재질, 쪽, 몀, 뒤"
예쁘긴 한데 입고 나가면 같은 옷 입은 사람 무조건 마주쳐서 약간 머쓱합니다 헣,"마주치다, 머쓱하다, 무조건, 사람"
무난무난 하고 재질이 시원시원해서 입기편합니다,"편하다, 시원시원하다, 재질"
디자인과 소재는 좋으나 기본적인 옷 품질 자체가 매우 떨어집니다 단추 단추구멍 등의 처리가 제대로 안되어있어 실밥 풀리고 단추 들어갔는데 안빠지고 이런 말도안되는 퀄리티는 처음이네요 옷 여기저기 실밥 나와있어 지저분하네요 돈이 아까워요,"단추 구멍, 지저분하다, 여기저기, 기본, 처음, 디자인, 소재, 단추, 자체, 처리"
저는 일본여행갈때 입었습니다 혹시 일본 가시는분들 저 이거입은사람 명 봤습니다 한 식당안에 명이 같은 남방이였어요 이쁘지만 흔함 조심,"사람, 가시다 분, 식당, 명, 조심, 일본, 흔하다"
일단 소재가 시원해서 입기 좋습니다 그리고 예뻐요 근데 단추가 잘 떨어집니다 그것만 빼면 완벽해요,"완벽하다, 시원하다, 소재, 단추, 빼다"
흔하긴 한데 그만큼 무난하게 이쁜 셔츠인거 같아요,"셔츠, 흔하다"
원단이 편해서 좋아요 그리고 깔끔해서 어디든 매치하기 좋아요,"매치, 편하다, 원단, 깔끔하다"
몸에도 안붙고 시원한재질이라 잘 입고다녔어요 근데 길에 똑같은거 입고다니는사람이 너무많음,"사람, 시원하다 재질, 몸, 길, 붙다, 똑같다, 많다"
넉하고 원하던핏이에요 저는 반바지에 빼입해서입는게 나은것같아요 ,"반바지, 넉, 빼입, 낫다, 원하다 핏"
디자인예쁘고 편하고 좋네요 다만 얇은버전은 보풀이 좀 생겨서 아쉬워요 ,"생기다, 편하다, 보풀, 얇다 버전, 아쉽다, 디자인"
시원하게 입으라고 선물용으로 샀는데 아주 좋아하네요 편하게 아무대나 입을수 있어 만족스럽습니다,"만족스럽다, 선물, 시원하다, 편하다, 좋아하다"
시원하게 입을거 샀는데 만족스럽네요 편하게 입을수 있어서 좋습니다 ,"만족스럽다, 편하다, 시원하다"
팔옆 단추 디테일도 좋았고 바삭하려다가 만 얇은 재질이라 너무좋았습니다,"재질, 바삭, 디테 일도, 단추, 옆, 얇다"
반팔 셔츠 하나 사고싶어서 샀는데 이뻐요 좀 힙한느낌도 나구 만족합니당,"만족하다, 팔, 셔츠, 나다, 하나, 힙"
별로 퀄 너무 구림 진짜 번 입고 버려야함 마감도 똑바로 안됨,"마감, 별로, 구림, 안되다, 버리다 야하다, 똑바로"
핏도 좋고 재질도 시원해서 너무 좋아요 여행갈때 입기 딱이에여,"시원하다, 재질, 여행 갈다, 핏"
요즘 이거만 입는 중 소매 디테일부터 흐물흐물한 느낌까지 이번시즌에 딱,"시즌, 디테일, 거만, 흐물흐물, 소매"
핏도 이쁘고 탄해서 오래입을 수 있을 것 같네요,핏
집 밖 마실용으로 마련했는데 아주 잘 산 반팔 셔츠,"마 실용, 셔츠, 팔, 마련"
핏감도 너무 좋았고 색깔도 너무 잘 빠졌어요 믿고 사세요,"빠지다, 믿다, 핏감, 색깔"
시원한 재질이고 이너없이 입어도 편했어요 하의 어떤거랑 입어도 잘어울림 ,"재질, 어울리다, 시원하다, 하의, 편하다"
핏감이 정말 좋고 컬러감도 고급지네요 정말 만족합니다 ,"만족하다, 고급 지네, 컬러 감다, 핏감"
여름에 더운데 얇아서 좋고 체크가 이뻐서 더 맘에 들어요,"여름, 덥다, 체크, 얇다"
오버핏으로 입고싶으면 한치수 크게 입는거 추천해요 실물이 훨 이쁩니당,"추천, 치수, 실물, 크게, 오버핏"
편하고 재질도 좋고 이뻐요 자주 입을거같아요 굿,"재질, 편하다"
팔 접고 고정이 가능해서 좋았고 시원해서 좋았어요 ,"고정, 시원하다, 가능하다, 접다"
제품에 문제가 있었는데 빠르게 교환처리 해주셨습니다 정상제품 입어보니 문제가 있던 상품은 사이즈도 잘못되어 있었어요 꼼하게 확인해주시면 더 좋을거 같습니다 옷은 너무 이뻐서 자주 손이 갈거 같아요 as빠르게 해주셔서 감사합니다 ,"확인 해주다, 해주다, 교환 처리, 입어보다, 사이즈, 문제, 정상 제품, 상품, 손"
얇고 부들부들해서 좋습니다 가슴쪽 포켓이 생각보다 큽니다 소매를 접어 고정할 수 있어서 좋습니다,"부들부들하다, 접다, 고정, 크다, 소매, 포켓, 얇다"
셔츠가 하늘하늘 해서 느낌있고 통풍도 잘되서 다른 셔츠에비해 훨씬 시원해요 크게 입는거 추천드려요 핏 장난아님 ,"시원하다, 추천 드리다, 셔츠 비다, 셔츠, 장난 아니다, 통풍"
생각보다 더워요 한여름빼고는 괜찮을것같아요,"덥다, 한여름 빼다"
얇아서 좋은데 앞면 기장이 뒷면 기장보다 좀 많이 짧아서 아쉬워요,"기장, 기장, 짧다, 얇다, 앞, 아쉽다"
옷의 가벼움 무난함이 좋습니다 다만 다른 리뷰에도 볼 수 있듯 마감 처리가 거의 엉망이라 해도 과언이 아닙니다 단추 한 개 제외 하고 전체 다시 손수 꿰맸습니다 실밥 조금만 빼내도 단추가 다 빠져요 애초애 처음부터 꿰맬 생각하시고 구매하시는 게 좋을 거 같습니다 ,"함, 단추, 과언, 애초 애, 엉망, 단추, 다시"
너무이뻐요 부들부들한 제질이여서 핏도 좋아요,"질, 부들부들하다, 핏"
시원하고 팔랑팔랑 거려서 입기 좋습니다 이런셔츠를 찾고있었어요,"셔츠, 거려, 시원하다, 찾다"
정말 입문용으로 잊기 좋은 셔츠인거 같아요 통도 널하니 정말 좋았어요,"입문, 셔츠, 통, 널, 잊다"
이번 여름에 엄청 많이 입고 다닌 셔츠가 아닐까 싶네요 같은 옷 입은 사람이 많이 보이긴 하는데 좋아여,"셔츠, 사람, 여름, 보이다"
색감이랑 핏이 정말 맘에들어요 대충 걸쳐도 예쁩니다 ,"걸치다, 색감, 대충, 핏"
여름에 입기도 좋고 핏도 이뿌고 좋아요 강추합니다,"강추, 여름, 이뿌다, 핏"
너무이뻐요 캐주얼하게 착용가능합니다 강력추천 ,"강력 추천, 캐 주얼, 착용 가능하다"
옷 시원하고 편해요 휘뚜루마뚜루 입기 좋은 옷입니다,"시원하다, 편하다"
저렴한 가격으로 예쁜 옷 잘 샀다고 생각하는데 마감이 정말 최악 실밥이 너무 나와있어서 다 잘라냈습니다,"저렴하다, 가격, 실밥, 마감, 최악, 자르다 내다"
디자인 완전 맘에 들고 마감이랑 재질도 좋은거같아요,"마감, 재질, 디자인"
아직 입고 나가보질 않아서 모르겠는데 재질은 되게 시원할 거 같은 재질이에요 제 스펙엔 굉장히 크지만 그거대로 귀여워요,"재질, 재질, 가보다, 크다, 스펙, 시원하다, 그거"
우선 상세페이지 내 색상과 다릅니다 더 찐하고 다크 네이비 보단 다크 브라운 그레이쪽에 더 가깝습니다 한 사이즈 다운 추천드려요,"추천 드리다, 다크, 상세 페이지, 다르다, 색상, 다운, 브라운, 사이즈, 네이비"
여름에도 시원하게 입을 수 있는 셔츠고 디자인 핏 다 좋아요 사이즈는 정말 잘 맞았습니다 ,"셔츠, 시원하다, 사이즈, 디자인, 여름, 맞다"
넘 예뻐서 돈도 없는데 사버렸어요 근데 팔을 접으면 넘 짧구 풀면 넘 길어서 애매해요 ,"접다, 애매하다, 돈, 팔, 짧다, 없다"
후리하게 입기 좋은 얇고 시원한 옷이네요 여름철 딱인듯,"여름철, 후리, 시원하다, 얇다, 딱이다"
여름에 입기 좋은 후들후들한 느낌의 셔츠였어요 소매는 접어입어야 예쁜것같아요 ,"소매, 후 후, 여름, 접다, 셔츠"
반팔셔츠가 필요했는데 얇고 여름에 입기 딱좋아요 색감마저 미쳤습니자,"셔츠, 색감, 여름, 필요하다, 얇다, 미치다, 딱좋다"
남편주려고 샀는데 제가 대신 입어봤어요 생각보다 길이는 짧은데 품이 크네요 남편 키가 인데 라지를 샀어야 하나 원래 라지 입는데 후기보고 비슷한 스펙이신 분들따라 사이즈 고른건데 제 남편은 뱃살 때문인지 좀 웃긴거같기도하고 본인은 마음에 들어하기도 하고 귀찮아서 걍 입힐려고여 두께 얇고 통풍 잘돼서 지금 입기 딱 좋은거 같아요,"남편 려고, 스펙, 기도, 입히다 려고, 사이즈, 통풍, 본인, 대신"
좋아용 배송도 빨라서 좋았어요 사용하기에도 괜찮네요,"사용, 배송"
옷 정말 예뻐요 다림질 안 해도 자연스러운 느낌 나고 좋아요 ,"자연스럽다, 다림질, 나다, 해도"
여름에 착용하기 좋고 생각보다 오버해요 시원해요,"오버, 착용, 시원하다, 여름"
체크무늬랑 소매 단추 디테일이 마음에 들어서 구매했습니다 색감은 사진이랑 똑같아서 좋았는데 저한테는 사이즈가 커서 좀 부해보이는 핏으로 보였습니다 여성분들보다는 남성분들에게 더 추천드리는 셔츠입니다 ,"여성, 셔츠, 추천 드리다, 부, 사이즈, 테, 체크 무늬, 사진, 들어서다, 색감"
왜 인기가 많은 옷인지 바로 알것같습니다 이가격에 나올수없는 옷이네요 너무 예쁘게 잘 입고있습니다,"가격, 인기, 알다, 많다"
아 사이즈 미스 심하진 않은데 한 사이즈 크게 살 걸 그랬어요,"사이즈, 심하다, 미스, 그렇다, 크게"
정말 다 좋은데 단추구멍 마감이 조금 부실한것 같네여 ,"단추 구멍, 마감, 부실하다"
어떻게 코디해도 스타일리쉬한 느낌이 드네요 이뻐요 ,"코디 해도, 어떻다, 스타일리쉬"
다른 아이템들과 무난하게 매치하기 좋고 여름철 실내 에어컨 추울 때 적당히 걸치기도 좋습니다 ,"매치, 걸치다 기도, 아이템, 적당하다, 여름철, 에어컨, 실내, 추다"
M샀다가 작아서 L로 다시 샀는데 M이 품은 넓은데 길이가 짧아서 늘려줬음 좋겠어요 ,"작다, 길이, 다시, 품다, 짧다, 늘리다 주다"
사진과 똑같아서 맘에 듭니다 여름에 입기 좋은 소재예요,"사진, 여름, 듭니, 소재, 똑같다"
패턴 이쁘고 질도 좋아요 시원시원해요 아쉬운점은 주일 한번정도는 같은옷 봐요 다행이 아직까진 안겹칠때 그만큼 이쁜가봐요,"시원시원하다, 한번, 다행, 패턴, 주일, 질도, 가보다"
사이즈도 적당하고 아주 좋습니다 잘입겠습니다,"적당하다, 사이즈"
왜 리뷰가 많음지 알겠네요 오버하면서 일단 마음에 들어요,"오버, 리뷰, 알다, 많다 음지"
사람들이 많이 입어서 조금 그러긴 했는데 옷은 예뻐요,"사람, 그렇다"
무난하게 어디에나 입어도 되는 가성비 좋은 제품입니다 ,"제품, 가성비, 되다"
시원한 재질과 롤업으로 멋까지 챙기는 셔츠 너무좋아요 단점은 입고 다니는 사람 넘무많아 ,"챙기다, 시원하다, 단점, 재질, 롤업, 사람, 셔츠, 멋"
오버핏이지만 자연스럽게 흐르는 재질이라 부해보이지 않고 조와요,"자연, 부, 조, 재질, 오버핏, 흐르다"
실물은 좀 더 어두운데 그거대로 예쁩니다 추천해요,"추천, 그거, 실물, 울다"
가성비 말 안되고 지나가다가 똑같은 사람 만날 수는 있지만 옷 자체는 이쁨,"지나가다, 만날, 자체, 수, 사람, 가성비, 안되다, 똑같다"
가성비가 말안되고 핏도 좋아요 근데 지나다 클론 만날 수도 있늠,"가성비, 만날, 지나다, 클론, 수도, 핏, 있늠, 말 안되다"
재질이 덕분에 구겨질 걱정할 필요 없고 색상이나 핏감도 너무 이뻐요 다만 다른 사람들 눈에도 너무 이뻐 보이는지 길 가다 보면 가끔 도플갱어 한두분을 만나는 상황이 있답니다 ,"색상, 보이다, 만나다, 상황, 걱정, 도플갱어, 재질, 구기다"
이쁩니다 여름네 단품으로도 입고 이너 티입고도 이쁘네요,"티, 품, 여름"
사이즈가 오버핏으로 잘 맞습니다 마음에 듭니다 ,"사이즈, 듭니, 맞다, 오버핏"
너무 좋아요 진짜 너무 예쁨 놀러갈때마다 항상 챙겨가는 옷이에요 단점이 있다면 팔부분 단추로 잠구고 걷어도 나중에 되면 다시 내려온다는거 이거말곤 진짜 다 너무 좋아요 ,"내려오다, 챙기다, 단추, 단점, 나중, 잠구, 항상, 다시"
크기가 조금크긴한데 겉옷형식으로 잘 활용하고있어요 예쁩니다,"크다, 크기, 활용, 겉옷 형식"
옷이너무이버서 좋어요 여름에 입기딱인거 같아요,"여름, 딱이다, 버"
사이즈 적당하고 시원합니다재구매의사깅츄합니다,"시원하다 재다 의사 깅츄, 적당하다, 사이즈"
편하고 좋습니다 가격도 싸고 손이 자주 가네요 굳,"편하다, 가격, 싸다, 가다, 손"
