Review,keyword
사진이랑 그대로예요 예뻐요 추리닝에 입어도 예쁘고 꾸안꾸로 대충 걸쳐도 예뻐요 간절기에 더 잘 입어질 것 같아요 ,"간절, 사진, 걸치다, 대충, 추리닝, 꾸다 꾸다"
진짜 돈 안아까워요 어디에 입어도 힙스러움 사람들이 다 어디꺼냐고 이뻐서 물어봐요 재질도 흔치 않고 팔 부분 라인에 점퍼 뒤 로고가 으쓱하게 만들어요 고민하지마시고 ,"고민 말다, 물어보다, 만들다, 으쓱, 치, 사람, 라인, 힙스러움"
진짜 돈 안아까워요 어디에 입어도 힙스러움 사람들이 다 어디꺼냐고 이뻐서 물어보네요 고민하지마시고 ,"고민 말다, 힙스러움, 물어보다, 사람, 끄다, 아깝다"
생각보다 널하고 남녀공용인거같아요 두께도 마냥 두껍지도 얇지도 않아서 요즘 날씨에 딱 좋은거같아요 ,"날씨, 널, 얇다, 마냥, 두께, 두껍다"
이뻐요 선물했는데 마음에들어하네요 고급집니다,"고급 지다, 선물"
무난하니 이뻐요 오늘 날씨 좋아서 입었는데 같은 옷 다른 색깔 입고 간 사람 마주쳤어요 헤,"날씨, 오늘, 사람, 색깔"
너무너무너무 사고 싶던 옷인데 계속 담아두다가 샀우요 예뻐용,"담다 다가, 사고, 싶다, 계속"
배송빠르고 포장꼼합니다 잘입겠습니다 감사합니다 ,"포장 꼼, 배송 빠르다"
착용감도 좋고핏도 이쁩니다 약간의 광택있지만 부담스럽지않아요 배송도빠르고 포장꼼합니다 잘입겠습니다 ,"착용 감다, 포장 꼼, 좋고핏, 부담, 배송 빠르다, 광택"
배송빠르고 포장꼼합니다 잘쓰겠습니다 감사합니다 ,"포장 꼼, 잘쓰다, 배송 빠르다"
뒤집어지게 예쁘고요 그냥 사야합니다 사이즈는 매우 크기때문에 스트링 필수로 조여야 예뿌더라구용 비닐봉지같은 느낌 오래갔으면 좋겠어용 ,"사이즈, 스트링, 필수, 크기 때문, 조여, 가다, 뿌더"
일단 소재 재질이 유니크해서 눈에 들어오네요 입고 나가면 이쁘다는 소리 많이 들었어요 얇아서 봄 가을에 적합해요,"유니크, 적합하다, 들어오다, 재질, 소재, 가을, 소리"
전부터 사구싶었는데 품절이라 못사구잇다가 이번에 삿는데 완전 만족합니다,"만족하다, 품절, 전, 삿는데, 잇다"
전부터 사구싶었는데 품절이라 못사구잇다가 이번에 삿는데 완전 만족합니다 ,"만족하다, 품절, 전, 삿는데, 잇다"
이뻐여 배송빠르고 옛날부터 고민한건데 가격대비 비싸서 군데 휘뚜루 잘입을듯요 코팅 재질감은 제가생각한거랑 좀 다른데 핏은 이뽀용,"고민, 가격 대비, 코팅, 재질감, 비싸다, 군데, 다르다, 휘뚜루"
쿠폰적용해서 저렴하게 구매했습니다 디자인 마음에 들어요 ,"쿠폰 용하다, 저렴하다, 디자인"
배송 빨라서 좋아요 생각보다 얇아서 좀 더 날 풀리면 입기 좋을 것 같아요 ,"배송, 풀리다, 얇다"
배송도 빠르고 포장도 잘 해와서 좋습니다 잘 입을게옹,"옹, 포장, 배송, 해오다, 빠르다"
로고 코팅이 주는 유니크한 느낌이 개성 있는 스타일을 완성시켜줘요,"완성, 코팅, 유니크, 스타일, 개성, 로고, 주다"
예뻐요 일단 재질은 말할것없구 은한 광택이 너무 예쁩니당 꼭사세요꼭,"광택, 재질, 은한, 말 없다, 꼭 꼭"
너무너무 이뻐요 재질도 가볍고 스타일리쉬해서 좋아요,"가볍다, 재질, 스타일리쉬"
와이프 선물로 사줬는데 좋아하네요 너무 튀지도 않고 잘입을거 같아요,"선물, 와이프, 튀다, 좋아하다, 사주다"
다른 후기들보고 샀는데 예쁘네요 웬만하면 후기 안남기는데 진짜 예쁨 냄새 문제로 말들 좀 있길래 뭐지 싶었는데 진짜 이상한 냄새가 좀 나네요 가죽냄새도 아니고 아노락 재질이라 그런건지 냄새 좀 빠지면 입고 다닐수있을거같네요 대만족 사이즈도 생각했던거와 비슷해서 남친이랑도 공유 가능할거같네요,"남친, 가죽 냄새, 사이즈, 아니다, 남기다, 재질, 이상하다, 만족, 건, 냄새"
비닐봉지같다길래 사알짝 걱정해 는데 걍 예쁘고 바스락거리게 입가좋아요 ,"바스락 거리, 걱정, 비닐봉지, 입가, 알짝"
여자친구 선물로 줬는데 너무너무 맘에들어해서 좋네요 ,"여자친구, 선물, 주다"
비닐같을줄 알고 구매 망설였는데 세미유광 재질이예요 스트링 조이면 핏예쁨,"세미 유광, 스트링, 조이, 알, 재질, 비닐, 망설이다, 핏예쁨"
오버사이즈여서 힙스러워여 재질은 가격대비 실망적이네요 ,"오버 사이즈, 실망 적다, 힙 스럽다, 재질, 가격 대비"
박시하고 힙스러운 사이즈네요 남자가 입어도충분해여,"충분하다, 힙, 박다, 사이즈, 남자"
예뽀요 고민하지말고 진작살껄 다른컬러도 살까 고민될정도랄까 아무데나 막 걸치기에도 좋고 얇아서 지금 부터 입기가 너무 좋네여,"걸 치기, 고민, 컬러, 지금, 진 작살 껄"
간절기에 입으려고 샀어요 얆아서 긴팔이나 반팔에 입기 좋구요 쌀할때 걸치기 딱이에요 괜히고밍하다가 늦게산거같아서 후회되용 예쁩니다,"걸치다, 간절, 팔, 이나, 후회되다, 얆아"
배송 빠르고 예뻐요 매장 보다 저렴히 구매했어요,"저렴하다, 매장, 배송, 빠르다"
배송도 빠르고 매장보다 저렴하게 구매했어요 예뻐요,"저렴하다, 매장, 배송, 빠르다"
좋아요 예뻐요 맘에들어요 아직은 좀 얇아서 춥고 더 따뜻해져야할거같아요,"추다, 얇다, 따뜻하다 야하다"
박시하게 나오기 때문에 여성분들은 저처럼 젤 작은 사이즈 해도 크게 입을수 있어요 ,"여성, 박다, 사이즈, 나오다, 작다, 크게, 해도"
생각보다품이넓습니다 오버하게A핏으로이쁜것같아요,"품 넓다, 오버 핏"
남녀공용으로입어도 좋을거같아서삿어요 저랑남편다마음에드네요,"남편 에드, 남녀 공용, 삿"
작년에 아이보리 입었는데 맘에들어서 블랙도 구매했어요 블랙도 매력있네요,"아이보리, 작년, 블랙, 들어서다, 매력"
실물로 보고 너무 예뻐서 무신사로 할인받아서 구매했네요 고민은 배송만 늦출뿐 언넝 사세요,"배송, 사, 실물, 고민, 언넝, 보고, 할인 받다"
진짜 이쁘고 좋아요 그거 말고 할말이 있을까 할정도로,그거
스타일리시 하고 입기 편하고 요새 날씨에 입기 정말 좋아요,"스타일리시, 날씨, 편하다, 요새"
옷이 원사이즈라서 조금 크긴한데 입기 편하고 좋아요,"편하다, 크다, 사이즈"
흠 사진이랑 비슷한데 요상한 냄새가 나요 그리고 지퍼가 퍽하네요,"상한, 사진, 지퍼, 냄새"
살펴보다가 마음에 들어서 고민하다가 바로 구매 결정했는제 택배상태도 꼼하고 배송도 빨리 왔어요 ,"택배 상태, 살펴보다, 고민, 배송, 들어서다, 오다"
운동복에도 일상복에도 잘활용할수있을것같아요 잘입을께요,"상복, 운동복, 자다 활용"
박스랑 옷걸이까지 세트로 이쁘게 포장해서 왔어요 할인할때 샀고 요즘같이 낮에 실내활동할땐 딱 좋아요 조금만 날씨 풀리면 자주 입을거같습니당,"포장, 날씨, 박스, 풀리다, 세트, 할인, 니당다, 오다"
따뜻한봄이네요 캠퍼스를 누비며 잘 입기 시작합니다 ,"캠퍼스, 시작, 누비, 따뜻하다"
생상도 이쁘고너무조아요 봄에 입기에 딱좋을거같아요 남녀누구나 핏하기 좋을거같아요 강력추천합니다,"강력 추천, 남녀, 생상, 봄, 핏, 무조, 딱좋다"
날 풀리고 입으려고 샀는데 디자인이나 색상 둘다 넘 이뻐요,"디자인, 색상, 풀리다, 두다"
유광 바람막이 GOAT 마뗑킴 당장 사세요 이 가격이면 안 살 이유 없음,"가격 이면, 유광, 바람막이, 이유, 없다, 마뗑킴"
마뗑킴만의 감성이 물씬하고 프리사이즈이지만 남녀 다 착용가능하여 커플켐으로 맞추었어요 너무너무 이쁜 디자이너 브랜드,"물씬하다, 착용 가능하다, 프리 사이즈, 디자이너, 감성, 커플켐, 남녀, 브랜드"
이쁘고 사이즈가 좀 넉해요 바스락 재질에 광택나는 유광,"사이즈, 유광, 광택, 넉, 재질, 바스락"
얇지만 휘뚜루마뚜루 잘 입어질것같아요 생일선물로 받았는데 너무 맘에 듭니다,"생일 선물, 듭니, 얇다, 받다"
재질이 특이해서 더 이쁜 것 같아요 사이즈는 남자가 입기에도 작지 않습니다 ,"재질, 특이하다, 사이즈, 작다, 남자"
간지가나용 간절기에 힙하게 입을 수 있겠어요 살짝 냄새 나서 며칠 통풍시켜줫네용,"간절, 간지 나용, 며칠, 힙하, 나서다, 냄새, 통풍 줫"
남자가 입어도 이쁘네요 따뜻해지면 자주입을거같아요,"남자, 따뜻하다, 주입"
스타일리쉬하고 핏도 좋아요 포장도 꼼히 오고 옷걸이까지와서 너무 좋습니다,"포장, 오다, 걸이 서다, 스타일리쉬, 꼼히, 핏"
예쁜 오버핏이에요 재질이 특이하면서 포인트되네요,"특이하다, 재질, 포인트 되다, 오버핏"
전부터 엄청 사고 싶었던 건데 간절기에 입기 좋을 것 같아서 질렀어요 재질이 비닐봉지 같다고 한 후기 많이 봐서 기대 안 했는데 생각보다 너무 괜찮아요 깔끔하게 꾸안꾸 느낌줄 수 있어서 좋고 전 잘 입을 것 같아요 나만 입을래 ,"간절, 재질, 비닐봉지, 전"
옷걸이까지 함께 보내주고 옷도 깔끔하고 무난하게 입을수있지싶어요 ,"보내다, 걸이, 깔끔하다"
좋아요 핏도원하는핏이구요 다른색상도사고싶어요,"핏 원하다 핏 이구, 색상"
딱맞아요 잘어울리는거가타 기분좋아요 근데생각보다너무얇아요,"어울리다 가타, 맞다, 기분, 얇다"
마뗑킴 베스트 자켓인듯 무신사에서 저렴하게 구매했어요,"사, 저렴하다, 베스트, 자켓, 마뗑킴"
길이감도 적당하고 스트링 조이면 크롭하게도 가능해서 아주 만족합니다 b,"크롭, 만족하다, 가능하다, 적당하다, 스트링, 조이, 길이 감다"
예뻐요 예전부터 보던 제품인제 아른아른 거려서 구입했네요 ,"거려, 제품 인제, 예전"
구매했는데 실물이 더 괜찮고 외출용으로 괜찮은듯 너무 추울때 입기는 그렇고 약간 환절기나 날 좋을때 입기 좋을듯,"환절기, 실물, 추다, 외출"
잘받았어요 마음에 들어요 정가보다 저렴히 구매해서 좋아요 ,"저렴하다, 정가, 받다"
아직 착용은 안했는데 목 부분이 하얗게 바란건 왜인지는 모르겠지만 만족합니다 약간 어벙한 핏인데 그래도 얇아서 덩치가 커보이지 않아요 투웨이라서 스타일링 다양하게 할 수 있어서 자주 입을 것 같아용 하의는 뭐든 입어도 꾸밈 안꾸밈 모두 될 것 같아용 저렴하게 할인할때 사서 좋숩니다 ,"만족하다, 덩 치가, 어벙, 바라다, 착용, 스타 일링, 크다 보이지, 하의"
거대한 비닐봉지 느낌이 있긴 하지만 그게 또 매력인 거 같고 핏이 너무 예뻐요 바람도 잘 막아지는 것 같습니다 안에 조금 껴입으면 요새 입기 딱 괜찮아용,"막다, 비닐봉지, 매력, 거대하다, 요새, 바람"
배송도 빨랐고 딱 생각한대로예용 빨리 날이 풀려서 단독으로 입고싶어요,"단독, 배송, 풀다, 날, 로예, 빨르다"
포장이 너무 꼼해서 놀랫어요 마뗑킴 특유의 느낌이 나서 너무좋고 이뻐요 교복처럼 입고다닐거같아요,"포장, 교복, 특유, 나서다, 마뗑킴, 놀랫어"
너무 비닐같지않고 살짝 유광있는정도예요 스트링 쪼이면 핏 딱 예뻐요 ,"스트링, 쪼이다, 유광, 비닐"
상품 잘 받았습니다 디자인이 너무 이뻐요 자주 입고 다닐예정,"디자인, 상품, 받다, 예정"
배송 빠르고 디자인 힙하고 좋아요 근데 처음에 지퍼가 안 열리길래 불량인 줄 알았네요 열심히 잡아당기니 열리긴 했습니다만 가격 생각하면 조금 아쉽습니다,"열리다, 열리다, 잡아당기다, 힙, 지퍼, 디자인, 배송, 가격"
가격대비 퀄리티가 아주 좋아요 잘 입을거같아요,"퀄리티, 가격 대비"
배송 빠르고 포장 상태 좋네요 다른 컬러도 구매할까싶네요,"컬러, 배송, 포장, 상태, 빠르다, 싶다"
피팅감은 만족스럽고 두께감도 생각보다 좋네요 지퍼가 살짝 아쉽습니다,"만족스럽다, 피팅 감다, 지퍼, 아쉽다, 두께 감다"
친구 선물용으로 사줬는데 폼 넉하니 오버하게 입으니 이뻐요,"선물, 오버, 친구, 사주다"
아주좋아요 너무좋아요 최고의 상품입니다최고,"최고, 상품 최고"
생일 선물로 구매했는데 친구가 너무 맘에 들어해요,"생일, 선물, 친구"
소재 재질 하나만으로도 포인트 되는 자켓 활용도 넘 조아요,"하나, 활용, 소재, 재질, 포인트, 자켓, 되다"
고민햇는데 핏도 이쁘고 배송도 빠르고 너무 이뻐요 다른 색상도 구매예정이에요 최고입니다아 ,"색상, 배송, 핏, 최고, 빠르다, 예정"
예쁜데 생각보다 얇네요 초여름까지도 입을수 있을것 같은 너낌,"초여름, 얇다, 낌"
음 퀄은 그닥인거같고 핏도 죽여준다 이건 아닌 거 같지만 일단 안고 가볼게여 하의는 치마든 바지든 숏츠입을 때 더 이뿐 듯,"바지, 치마, 이건, 죽여주다, 가보다, 아니다, 안고, 하의, 퀄"
이뻐요 다른색도 사고싶을정도 두깨는 조금 얇은편,"색도, 얇다 편, 깨"
재질도 특이해서 마음에들고 마뗑킴로고도 이뻐서 좋네요 봄에 자주입을듯합니다 ,"특이하다, 재질, 봄, 주입, 마뗑킴로고"
엄청이쁘고 남자가 입어도 잘맞아요 봄되면 자주 입을듯합니다 뒤에 마뗑킴로고도 이쁘고 재질도 특이해서 좋아요 ,"재질, 특이하다, 남자, 잘맞다"
지금날씨에는 추운데 조금 풀리면 딱 좋을것같아요,"지금 날씨, 추다, 풀리다"
소재는 바람막이 같은 얇은 소재로 바스락거려요 품도 넉해서 가볍게 여기저기에 걸치기 좋고 초여름까지 애용할듯해요 길이는 제 키에서 엉덩이 안 가리는 허리보다는 아래쪽까지 오는 길이감이라 적당해요 흰색 스티치가 은근 포인트 확실히 백로고가 주는 임팩트가 상당하고 디자인이 특별한건 아니지만 재질이 펄 같이 은하게 반짝거려서 나름 차별점을 주네요 유행 안타고 오래 입을 수 있을 베이직한 아이템같아서 좋아요,"적당하다, 걸치다, 엉덩이, 바스락 거려, 특별하다, 상당하다, 스티치, 넉, 아니다, 허리"
사이즈가 한 종류라서 후기 잘보고 구매해야할 것 같아요 ,"종류, 사이즈, 후기"
색감 화면과 같습니다 여성분들께 추천드립니다 ,"추천 드리다, 색감, 화면, 여성"
확실히 겨울에 입기에는 얇으나 봄가을에 걸치기 이쁜 자켓인 거 같아요,"걸치다, 확실하다, 겨울, 자켓, 얇다"
얇긴한데 재질도 특이하고 로고도 큼직하게 있어서 부담없이 평상시에 많이 입을 수 있을 것 같아요 빨리 날 풀렸으면 좋겠네용,"평상시, 큼직하다, 특이하다, 재질, 로고, 겠다, 얇다"
역시 믿고 입는 마뗑킴 재질이랑 사이즈 매우 좋습니다,"재질, 사이즈, 믿다, 마뗑킴"
배송 빠르고 잘 도착했어요 재질이 생각보다 반딱이는 재질이에요,"재질, 재질, 배송, 빠르다, 딱이다, 도착"
남자친구 선물로 줬는데 엄청 좋아해요 사이즈도 잘맞아요 ,"선물, 사이즈, 남자친구, 주다, 좋아하다, 잘맞다"
봄가을에 날씨 풀렸을 때 입기 좋을 것 같아요 소재도 독특해서 매력있네요,"날씨, 독특하다, 소재, 풀리다, 매력"
새 옷이라 그런지 살짝 냄새는 나지만 넘 이뻐여 바스락 거려서 조용한데서는 못입을거같습니다,"조용하다 서다, 그렇다, 거려, 냄새, 바스락"
아 마뗑킴은 진짜 천재에요 광 완전 빤딱빤딱할까봐 걱정했는데 그런 거 아니고 무채색 데일리룩에 맛있게 활용할 수 있는 정도네요 강추드립니다,"강추 드리다, 무채색, 아니다, 천재, 일리, 그렇다, 활용"
봄에 입기 좋은 두께에 누구나 좋아할 디자인에 포인트 로고가 등 뒤에 있는 깔끔한 옷입니다,"디자인, 포인트, 로고, 좋아하다, 뒤"
일단 디자인이 너무 예쁘구요 흔하지 않은 질감의 재질이 너무 맘에 드네요 유니크한 옷 득한거 같아서 너무 맘에 듭니다 ,"디자인, 재질, 득, 유니크, 질감, 듭니, 흔하다"
진짜 너무 만족 해요 이뻐요 세택후 변형되는것고 없고 배송도 빠르고 깔끔하고 좋아요 디자인은 진짜 너무이쁘고 만족입니더 너무 잘입고 있어요 가격대도 너무좋아요 이런상품은 진짜 최고에요,"만족, 만족, 디자인, 가격 대도, 상품, 배송, 세택후"
디자인 너무맘에들고 핏은 좀 널한 편입니다 사세요,"편입, 널, 디자인, 핏"
기다렸다거 샀는데 역시나 매우 만족스럽고 이쁩니다,"만족스럽다, 기다리다"
생각보다 배송도 빠르고 이쁘게잘 입을것같슴니다,"배송, 슴, 자다, 빠르다"
