Review,keyword
나이키 바람막이 대신으로 샀는데 너무 캐주얼하지도 않고 힙하거 좋습니다,"캐다 얼다, 힙하거, 대신, 나이키, 바람막이"
이거 사고 진짜 교복처럼 자주 입는중 요즘같은 날씨에 진짜 딱좋아요,"날씨, 교복, 중, 딱좋다, 사고"
실물이 훨 예뻐요 생각보다 얇아서 초여름까진 입을거같아요,"실물, 초여름, 얇다"
뒷모습 마땡킴 써있어서 넘 이뻐요 사이즈도 넉하고 좋네요,"넉, 사이즈, 써다, 마땡킴, 뒷모습"
옷 넘 이뻐요 다들 이쁘다고 난리네용 잘입을게요,난리
남자친구 선물로 사줬는데 길이감이나 재질이나 너무 좋았습니다 너무 얇지도 두껍지도 않았으며 광택 또한 예쁩니다 구김도 예쁘게 있고 만족스러웠습니다 ,"남자친구, 선물, 재질, 길이, 구김, 광택, 만족스럽다"
할인할때 구매해서 가성비 좋아요 가성비가 매우 좋아서 제품을 받으면 매우 만족합니다 친구한테도 구매 추천하고 싶어요 ,"친구, 추천, 만족하다, 가성비, 가성비, 제품, 할인"
광택나면서 만지면 부드럽고 등판의 마뗑킹로고가 딱 포인트로 너무 멋들어집니다 더 더워지기 전에 자주 입어야 겠네요 많이파세요 ,"광택 면서, 지면, 등판, 포인트, 더워지다, 부드럽다, 전"
와 진짜 핏도 예쁘고 은한 광택감이 미쳤어요 진짜 깔별로사고싶넹노,"광택, 은한, 핏, 미치다, 깔다 별로 넹노"
와 진짜예뻐요 은한 광택감이 진짜 신의한수네요 ,"신의한수, 광택, 은한"
인기좋은 이유가 있네요 디자인이나 퀄리티대비 가격이 저렴하네요 마뗑킴 감성까지 딱 간절기 아우터로 강추,"퀄리티 대비, 간절, 저렴하다, 이유, 아우 터, 가격, 디자인, 강추, 인기"
박시해서 왠만한 남자들은 다 착용가능합니다 가격대비 퀄도 상당히 조아요,"착용 가능하다, 박 시해, 가격 대비, 상당하다, 남자, 퀄, 왠만하다"
핏이 너무 이쁜것 같아요 근데 입고다니는 사람이 넘 많음,"사람, 핏, 많다"
너무너므 이뻐요 아직 추울때는 입기 좋아요 일교차클때 입기 좋고 가벼워서 들고다니기도 좋아요,"기도, 므, 가볍다, 교차 크다, 추다"
포장이 박스에 옷걸이에 비닐포장까지 너무 꼼해요,"포장, 박스, 걸이, 비닐 포장, 꼼해"
마뗑킴 너무 이쁘네요 휘뚜루마뚜루 편하게 입기좋을듯해요,"편하다, 마뗑킴"
생각보다 많이 커요 얇아서 쌀할때 입고가면 적당해서 죠습니다,"적당하다, 크다, 습니, 얇다, 쌀"
요즘 같이 일교차가 큰 날씨에 아주 산뜻하게 잘 입고 다니는 중 마뗑킴 만세 ,"교차, 날씨, 만세, 산뜻하다, 마뗑킴"
평소 상의 입어요 세미오버핏으로 핏이 이쁘네요 간절기용으로 외출할때 딱인것같아요 추천이요,"간절 기용, 추천, 평소, 상의, 핏, 외출, 세미 오버핏, 딱이다"
프리사이즈라 작을까봐 걱정했는데 적당한 오버핏이네요 평소 상의 입어요 간절기 외출복으로 좋은것같네요 추천해요,"추천, 평소, 프리 사이즈, 간절, 적당하다, 상의, 작다, 외출 복"
핏도 예쁘고 어디에 걸치든 편하고 어울려서 손이 많이 가는 아우터입니다 지금 환절기 입기 딱 좋은데 자주 품절되고 예약 배송이라 작년부터 눈독들이다가 이제 샀네요 ,"아우 터, 걸치다, 눈독 들이다, 작년, 배송, 어울리다, 환절기, 가다, 손"
웃이너무이뻐요 배송도빠르고지금입으면딱좋은거같아요,"웃, 배송 빠르다 지금 딱좋다"
옷이 너무 이뻐요 배송도빠르고 지금 입으면 딱 좋은거같애요,"지금, 애, 배송 빠르다"
생각보다 사이즈는 크고 스트링은 조여서 입어야 이쁩니다,"스트링, 조여, 사이즈, 크다"
넘 이뻐요 여자가 입으면 오버핏정도 남자가입으면 정핏으로 입기 좋아용,"남자, 여자, 정핏, 오버핏"
사이즈도좋고 쿠폰할인도받고 품절돼 었는데 재입고되서 샀어요 배송도빠르고 옷도 역시이쁘네요,"쿠폰 할인 받다, 재 서다, 었는데, 사이즈, 배송 빠르다, 품절 돼다"
휘뚜루 마뚜루템 만하니 손이 자주가요 굳임,"만하, 가요, 손, 마뚜루, 굳다, 휘뚜루"
상품이 디자인이 너무 예뻐서 친구들이 다 예쁘다고 해용,"상품, 친구, 디자인"
사이즈 박시해서 좋아요 이뻐요 스트링 쪼여서 입으면 이뻐요,"스트링, 박 시해, 사이즈, 쪼이다"
루즈한게 스타일이좋아요 트레이닝복에도 이쁘네요,"트레이닝복, 루즈, 스타일"
봄 바람막이용으로 아우터로 잘입고 있습니다 이뻐요 ,"바람막이, 아우 터"
전부터 사고싶어서 고민 끝에 샀는데 너무 마음에 들어요,"전, 고민, 끝"
오래기다렸어요 너무 너무 이뻐요 기다린보람이 있어요 인기가 많은 이유를 알겠네요 강추합니다 간지짱,"강추, 기다리다 보람, 이유, 인기, 기다리다, 알다, 많다, 간지"
환절기에 입기 좋은 아이템입니다 누구든 다 잘어울릴 것 같아요 ,"환절기, 어울리다, 아이템"
나이키 바람막이 사려다가 다 품절이라 마뗑킴으로 샀는데 아무데나 걸쳐도 잘 어울리는 휘뚤마뚤 템이에여,"어울리다, 품절, 바람막이, 걸치다, 나이키, 휘뚤마뚤"
이뿌다 귀엽다 사랑스럽다 편하다 좋다 만족한다 최고다 굳,"사랑스럽다, 만족하다, 편하다, 최고다, 이뿌다, 귀엽다"
너무 마음에 듭니다 빠른 배송 및 할인도 너무 좋아요,"할인, 듭니, 배송, 빠르다"
선물하려고 샀습니다 감사합니다 좋아하네요 번창하세요,"번창, 선물, 좋아하다"
블랙이랑 그레이 사서 출근할 때 돌려 입는 중이에요 핏도 예쁘고 완전 무난템이라 추천추천 ,"추천 추천, 블랙, 중이, 출근, 그레이, 사서, 돌리다"
디자인도이쁘고 제가 원하던 그대로이라 더 좋네요 ,"그대로, 원하다, 디자인"
덩치있는 남성분들 이거 입으셔도 괜찮습니다 예쁩니다 ,"남성, 덩 치다"
거의 매일 입고 있습니다 맨투맨 셔츠 등 부담없이 입을 수 있어서 더 자주 입을 것 같습니다 ,"매일, 셔츠, 투맨, 부담"
옷이 생각보다 크기는 한데 끝부분 조여서 입으니 괜찮구여 이것저것 걸쳐서 편하게 입을 수 있을 것 같습니다 ,"걸치다, 조여, 크기, 편하다"
오버핏이라 하단 부분 조여서 입으니 괜찮았습니다 옷이 얇긴한데 그래서 여름까지도 입을 수 있을 것 같습니다 ,"하단, 조여, 부분, 오버핏, 여름"
간절기나 요즘 밤애 입기 좋아요 핏도 예쁘고 만족해요,"만족하다, 간절, 밤애, 핏"
이쁘고 특이하길래 사봤는데 생각보다 엄청 이뻐요 와이프랑 같이 입고 있어요,"와이프, 특이하다, 사보다"
보자마자 반했습니다 너무 예쁘고 맘에 들어요 굿,반하다
아주 만족스럽네요 첫구맨데 핏감이 대만족입니다 ,"만족, 만족스럽다, 핏감"
로고 플레이가 너무 맛집인 마땡킴 패딩에 이어서 바막도 너무이쁘네요,"패딩, 플레이, 로고, 막도, 맛집, 마땡킴"
엄청 예뻐요 되게 얇을 줄 알았는데 생각보다 나름 두꺼워서 좋았어요,"나름, 얇다, 알다, 두껍다"
생각보다 재질도 괜찮고 두꺼워뇨 완전 비닐처럼 얇을 줄알았는데 아니더라고요 엄청 예뻐요,"아니다, 비닐, 재질, 얇다, 두껍다 뇨"
맘에 들어요 소재도 특이하고 디자인도 루즈핏이라 좋아요,"디자인, 소재, 특이하다, 루즈핏"
엡버용옙버요 조아요 조아요 두껍지도않고 막얇지도않고 바람막이템으로 잘입겠습니다요 포장도잘왓고 옷걸이도잇서요,"바람막이, 포장 자다 왓, 걸이 잇다, 엡버용옙버, 막 얇다, 두껍다"
사이즈도 저한테 너무 적당하고 배송이 너무 빨라서 좋았습니다,"배송, 적당하다, 사이즈"
너무 예뻐요 백화점에서 입어보고 샀는데 세상 힙하고 요즘 같은 환절기에 입기 진짜 좋은 것 같아요 ,"백화점, 입어보다, 환절기, 힙, 세상"
뒷로고가 포인트가 되는 바람막이 입니다 바스락거리는 소재로 편하게 입을 수 있고 허리에는 스트링이 들어가 있어 사이즈조절도 가능합니다 ,"가능하다, 바스락 거리, 허리, 조절, 스트링, 들어가다, 바람막이, 소재"
예약발송일보다 빨리 도착하긴했는데 지금날씨에 착용하기엔 살짝 덥네요 단품으로 입는 것보단 레이어드 했을때 더 이쁜 아이템입니다 ,"지금 날씨, 아이템, 레이어 드, 착용, 덥다, 품, 발송 일보"
바스락바스락 사이즈도 넉해요 날이 더워져서 가을에나 다싴 ,"넉, 더워지다, 사이즈, 가을, 날, 다싴"
고민고민하다 질렀어요 바스락바스락 소재가 독특,"고민 고민, 소재, 독특, 지르다"
어디에 걸쳐도 힙하고 좋아요 생각보다 따뜻하고 생각보다 덥지않아서 좋아요 바스락거려서 걱정이었는데 그건 그거대로 예쁘네요,"바스락 거려, 걸치다, 그거, 힙, 따뜻하다"
재질도 좋고 찾던 디자인데 핏도 예뻐서 만족입니다 ,"만족, 재질, 디, 핏, 찾다"
어디에 입어도 이쁘고 오버핏이라 매치만 잘하면 굉장히 힙해지는 느낌이랄까 아무대나 걸쳐서 입기 좋아요,"매치, 걸치다, 힙해"
핏이 좋고 이쁜거 같습니다 오래 기다렸지만 만족합니다,"만족하다, 핏, 기다리다"
기장이 쫌만 더 길었으면 하는 아쉬움이 있긴 하지만 만족해요,"만족하다, 기장, 쫌, 아쉬움, 길다"
지금 이날씨에 밤에 입기 딱 좋아요 배송도 예정보다 빨리 왔네요,"날씨, 배송, 밤, 지금, 오다, 예정"
많이 기장이 짧을거라 생각했는데 생각보단 괜찮아요,"기장, 짧다"
 월 발송 예약 주문이라 잊고있었는데 월에 받았어요 포장도 꼼하고 너무 이뻐요 ,"발송, 포장, 주문, 잊다, 예약, 받다, 꼼"
 월배송이라 기대안했는데 빨리받아서 넘 좋아요 매장에서 보고 구매한거라 넘 이쁘네요,"월배 송이, 매장, 보고, 받다, 대안"
사이즈는 진짜 크고 박시합니다 비닐 냄새가 너무 심해요,"사이즈, 박다, 심해, 냄새, 크다, 비닐"
예쁘긴 진짜 예쁜데 많이 박시한 편이고 처음 받았을때 비닐 냄새가 너무 심했어요 밖에 하루이틀 걸어뒀더니 사라지긴 했어요,"사라지다, 편이, 박 시한, 하루 이틀, 냄새, 비닐, 처음"
비닐봉지 룩이지만 예쁜 걸로 다했어용 사이즈가 조금만 작았으면 좋겠어욥 다음 시즌에는 S여성용 M남성용 이런식으로 출시해도 좋을 것 같네용 ,"남성, 성용, 식, 시즌, 사이즈, 비닐봉지, 룩, 출시, 걸"
간절기 아우터로 포인트 주기 너무 예쁘고 남자가 입기에도 괜찮은 품이네요 바스락 거리는 원단감이 나름 괜찮은 거 같아요,"간절, 아우 터, 단감, 거리, 남자, 포인트, 품다, 나름"
적당한 유광재질이라 이쁘고 두께도 적당해서 좋앗어용 ,"유광 재질, 적당하다, 적당하다, 두께"
예상 배송일보다 빨리 와서 좋아요 가볍게 입기 좋습니다,"배송 일보, 가볍다, 오다, 예상"
안녕하세요 마뗑킴 상품 잘 구매했어요 디자인 색감 모두 좋아요,"안녕하다, 상품, 디자인, 색감, 마뗑킴"
남녀공용이라 걱정했는데 사이즈 잘 맞아요 오히려 여성분께는 많이 오버핏일듯 소재감이 독특하니 예쁘네요,"남녀 공용, 소재, 독특하다, 사이즈, 여성 늘다, 맞다, 걱정, 오버핏"
너무 예뻐요 딱 적당하고 좋은거 같아요 잘 시킨거 같네요 재구매인데 무난무난 바막으러 좋아요,"재, 적당하다, 막다"
배송 빠르고 좋습니다 상품도 훌륭합니다 감사합니다,"훌륭하다, 상품, 배송, 빠르다"
안녕하세요 마뗑킴 점퍼 색감 핏 너무 좋네요 지금 입기도 딱이고 감사합니다,"안녕하다, 색감, 지금, 점퍼, 마뗑킴, 딱이다"
재질은 정말 만원짜리지만 의리로 입습니다 땀복이네요 ,"재질, 의리, 만원 짜다 리지, 땀복"
예뻐요 깔끔하고 좋아요 왜 사는지 알것같은 아이템 선물용으로도 좋아보이고 어쨋든 넘 좋아요 ,"선물, 살다, 아이템, 아보, 어쨋, 알다, 깔끔하다"
꼭 사세요 굿귯 포장깔끔 배송 빨라요 실물깡패 너무 멋져요 왜 사는지 알겠어요 ,"살다, 배송, 포장 깔다 끄다, 실물 깡패, 빨르다, 멋지다, 굿귯, 알다"
왜 사는지 알겟어요 힙해요 꼭 사세요 굿귯 포장깔끔 꼼 배송 빨라요 실물깡패 너무 멋져요 예쁨,"살다, 힙해, 배송, 포장 깔다 끄다, 알다, 실물 깡패, 빨르다"
왜 사는지 알겟어요 꼭 사세요 굿귯 포장 꼼 배송 빨라요 실물깡패 너무 좋아요 예쁨,"살다, 배송, 포장, 알다, 실물 깡패, 빨르다, 굿귯"
왜 사는지 알겤어요 굿귯 포장 꼼하고 배송 너무 빨라요 실물깡패 너무 좋아요 예쁨,"살다, 포장, 배송, 알겤어, 실물 깡패, 빨르다, 꼼, 굿귯"
 예약 배송이었는데 오늘 받았어요 받으면 내년에 입어야 하나 고민하고 있었는데 다행히 계절에 맞게 딱 맞춰 와서 너무 좋아요 더현대 가서 다른 색상 입어보고 검정색을 구매하고자 했지만 다 품절이어서 아쉬워 하던 중 무신사에 올라 와서 쿠폰 써서 너무나 저렴하게 구매 할 수 있어서 더 좋았습니다 제품도 하자 없이 잘 왔어요 ,"다행하다, 현대, 오다, 고민, 품절, 검정색, 사, 색상"
할인 통해서 구매할 수 있어서 너무 좋았습니다 잘 입고 다니겠습니돠 ,"통해, 할인, 돠"
여자친구 선물해줬는데 이쁘고 잘맞아서 만족하네요,"만족하다, 여자친구, 잘맞다, 선물 해주다"
처음에 너무 비닐같을까봐 걱정했었는데 딱 입어보고 걱정한거랑 달리 이뻤어요 근데 몇 지인은 옷재질이 왜그러냐고 하긴 하던데 전 만족입니당 ,"만족, 걱정, 입어보다, 달리, 지인, 처음"
원래도 뽑기라고 알고있었지만 스트링부분 끊어져 와서 차 빡침 근데 입어보니 이뻐서 차빡침 교환이 늦게될줄 알았는데 빨리되서 급빵끗 스트링 조여서입어야 이쁨 사이즈 폼 다 만족 키 큰데 상체 긴 사람은 짧을수도 있어요 ps 도쿄여행가서 입구 다녔는데 매우 만족함 ,"도쿄 여행가, 스트 링 부분, 만족하다, 사이즈, 입어보다, 스트링, 만족, 교환, 입구"
요즘처럼 일교차 큰 날에 스타일애면서 입기 딱입니다 ,"스타일 애 면서, 교차, 날, 딱이다"
너무 이뻐요 사이즈도 적당합니다 다른색상도 사고싶네요,"색상, 적당하다, 사이즈"
마땡킴은 역시 마땡킴이죠 가격빼고 완벽합니더,"완벽하다, 마땡킴이, 마땡킴, 가격 빼다"
남자친구랑 커플로 하려구 두개구입했는데 넘 이쁘고 만족스러워요,"만족스럽다, 남자친구, 커플, 개"
지금 날씨에 가볍게 걸치기 조아요 역시 마뗑킴 로고가 이뿝니다 ,"날씨, 걸치다, 가볍다, 로고, 지금, 이뿌다, 마뗑킴"
사이즈가 정핏이 아니라 오버로 나와서 안에 후드집업 레이어드 해도 이쁘고 그냥 단독으로만 입어도 괜찮습니다,"후드 집업, 단독, 사이즈, 나오다, 레이어 드, 오버, 해도, 아니다"
이번에 바람막이로 고민하고 있었는데 캐쥬얼 하게 잘 입어져서 포인트 주기도 좋고 손이 잘 갑니다,"캐 쥬얼, 고민, 가다, 손, 바람막이, 주기도, 포인트"
특유의 냄새만 빠지면 넘 이쁘네요 요즘 같은 날씨에 딱 좋아요,"날씨, 특유, 냄새, 빠지다"
포장상태 너무 좋았규 선물용으로도 좋고 가볍게입기에 편하며 스타일 내기 좋습니댜,"가볍다, 선물, 포장 상태, 스타일, 편하다, 내기, 규, 좋습니댜"
여기저기 코디 가능 재질이 구김이 안가서 편하게 입기 좋아요 더워지기전 많이 입어야겠어요 ,"여기저기, 더워지다 기전, 재질, 편하다, 가다, 구김, 가능, 코디"
디자인이 너무 이뻐서 구매했는데 사이즈도 딱 맞고 핏도 딱 맞아 떨어지네요 재질도 너무 얇지 않아서 봄에 입기 딱 좋습니다 ,"사이즈, 디자인, 재질, 봄, 핏, 얇다"
가볍게 걸치고 다녀도 예뻐여 포대자루 같은 느낌의 원단이 특이하고 힙해요,"걸, 가볍다, 특이하다, 힙해, 포대자루, 원단"
착용감도 너무 좋고 디자인이랑 원단 질감 쵝오예요 너무 바스락거리지 않고 은해요 팔 통은 좀 큰편이고 지퍼가 첨에는 빡해서 잘 안올라가서 고생했는데 몇번하고 나니 잘 돼요,"바스락 거리, 올라가다, 디자인, 착용 감다, 크다 편이, 지퍼, 첨, 질감, 나니"
윗부분의 길이를 조절할 수 있어서 키가 작으면 아무 생각 없이 ,"작다, 조절, 키, 길이, 부분"
예쁘고 힙하고 편하고 가볍고 어디든 다 잘 어울려요,"가볍다, 편하다, 어울리다, 힙"
고민하다가 샀는데 후회하지않고 너무나 만족스러운 선택이였습니다 박시한핏과 얇은 소재가 지금 딱입기 너무 좋고 이뻐요 ,"만족스럽다, 고민, 소재, 지금, 후회, 얇다"
딸아이사줫는데 스타일리쉬하고 너무이쁘네요 어디에 걸쳐도 멋스러운느낌입니다,"걸치다, 스타일리쉬, 멋, 딸아이 줫 늘다"
휘뚜루 마뚜루 템이에용 편하게 입기에 좋으면서도 스타일 좋고 그냥 바람막이인가싶은데 코팅된 느낌이 얇은 가죽 느낌도 나는거 같아요,"스타일, 편하다, 가죽, 나다, 휘뚜루, 얇다"
재질도 빳하니 좋고 아무때나입기 너무좋네요 강추입니당 ,"강추, 재질, 빳하"
편하게 아무때나 입기좋아서 손이자주가네요 두께도 너무얇지않아서 더 좋습니당,"손 이자 주가, 편하다, 니당다, 두께, 얇다"
원사이즈로 크게 나와서 막 입고 다니기가 좋습니다,"사이즈, 나오다, 크게"
요즘 날씨에 입기 너무너무 좋아요 벚꽃보러 갈때 입었어요,"날씨, 벚꽃, 갈다"
재질이 포인트 되아서 좋아여 이뻐서 잘입고 다녀요,"재질, 포인트, 되다"
너무 빛나는 재질이 아니라서 잘입고 있어요 예뻐요,"재질, 아니다, 빛나다"
남여 모두 가능한 디자인입니다 제 키에 살짝 기장이나 팔이 짧은 감이 있지만 입을만 합니다 가볍고 얇은 소재라 요즘에 가장 손이 잘가는 옷이네요,"디자인, 기장, 가능하다, 가다, 남여, 소재, 손"
지금날씨에 딱좋아요 마구얇지만않고 약간 광있어 느낌괸찬아요 ,"지금 날씨, 마구 얇다, 딱좋다, 괸 차다, 광"
요즘 날씨에 걸치기 딱 좋아요 그리고 예쁩니다 너무 유광도 아니고 빛 비추면 은하게 빛나니 매력있어요 그리구 큽니다,"걸치다, 날씨, 비추다, 크다, 아니다, 유광, 그리다, 은하"
생각한 그대로의 핏이고 보가보단 두껍습니다 너무 예뻐요,"그대로, 보가, 핏, 두껍다"
남자친구랑 커플로 맞췄어여 크롭도 있고 일반 기장도 있어서 커플로 맞춰입기 너무 좋아요 봄날씨에 딱 좋은 두께라 막 입기 너무 좋고 색도 블랙이라 어디에 코디해도 좋아요 아울렛에서 사는 것보다 이것저것 할인 받을 수 있어서 좋아요,"코디 해도, 남자친구, 봄날, 커플, 블랙, 크롭, 기장"
남자친구랑 커플로 맞췄어여 크롭도 있고 일반 기장도 있어서 커플로 맞춰입기 너무 좋아요 봄날씨에 딱 좋은 두께라 막 입기 너무 좋고 색도 블랙이라 어디에 코디해도 좋아요 ,"코디 해도, 커플, 남자친구, 크롭, 봄날, 블랙, 기장"
운동할 때 가벼운 아우터로 입기도 평소에 데일리로 입기도 다 좋은 휘뚜루마뚜루템이고 오버핏이니까 편하게 툭 걸치기 좋아요,"평소, 걸치다, 운동, 편하다, 아우 터, 일리, 가볍다"
배송은 빨리 왔어요 쿠폰 적립금 등 해서 저렴하게 구매할 수 있었어요 투웨이로 되어있어서 스타일링이 너무 편리하고 이뻐요 ,"스타 일링, 배송, 편리하다, 적립금, 쿠폰, 저렴하다, 투"
구매하려고 할 때 마다 품절이여서 이번에는 후다닥 구매했어요 투웨이로 되어있어서 스타일링 하기도 편리하고 핏감도 너므 이뻐요 밑단에 고무줄이 있어서 골반선에 맞추 입으면 다리도 더 길어보이고 이쁘답니당,"품절, 길다 보이, 고무줄, 스타 일링, 편리하다, 다리, 골반 선"
약간 옷 처음받았을때 옷냄새가 났음 그래도 이쁘게 잘입는중,"중, 처음 받다, 냄새, 나다"
옷은 얇은 바람막이 아니에요 약간 살짝 비닐 소재보다 두꺼움 사이즈 프리로 나와서 작은여성이 입기엔 클듯 ,"작다 여성, 사이즈, 바람막이, 소재, 아니다, 나오다, 비닐, 프리, 크다"
커플로 주문해서 너무 잘 입고 있습니다 지퍼가 불량인지 잘 안되는거 말고는 색감 기장 핏 모두 너무 좋네요 ,"주문, 커플, 지퍼, 기장, 색감"
밑에 고무가 있어서 다양하게 옷을 연출할 수 있어서 좋아요 봄 가을에 입으면 패션피플 ,"패션 피플, 연출, 가을, 고무, 밑, 다양하다"
세상사람들 마땡킴 옷도 잘만드는거 보고 가세요 가격은 좀 나가도 그만큼 값어치해요 진짜 이거 고민하는 사람 바 보 ,"세상 사람, 만들다, 고민, 사람, 가격, 가세, 보고"
매장에서 입어보고 샀는데 생각했던거처럼 너무나도 이쁜옷입니다 엄마랑 같이 입고 있는네 입을때마다 이쁘다고 칭찬남발하면서 입고 댕겨요 어디에 걸쳐도 대학민국 세상 제일가는 힙걸이 된듯한 느낌이 들어요 검은색도 그냥 검은색이 아니라 약간 레더 느낌나는 검은색이라 더 이쁜거 같아요 마땡킴 지갑만 잘만드는 줄 알았더니 옷도 잘만드네 다음은 가방이다 기다려라 ,"칭찬 남발, 검은색, 검은색, 매장, 대학 민국, 댕겨, 검은색, 걸치다, 힙걸, 입어보다"
지퍼가 좀 빡하긴 한데 예뻐서 괜찮아요 스트링으로 조이기 필수,"스트링, 지퍼, 이기, 필수, 빡"
디자인좋고 소재 좋고 크기도 낙하고 다 좋아요 다만 지퍼가 처음 올릴때 살짝 잘 안맞는 느낌 이 들긴하네요,"크기, 지퍼, 낙하, 소재, 처음, 올리다"
남자 평균키 몸무게 기준 잘맞아요 여자가 입으면 넉하고 남자도 잘맞아서 좋음 후드티 매치도 잘 어울리고 소재 좋습니다 ,"평균키, 어울리다, 넉, 매치, 소재, 여자, 기준, 남자, 몸무게"
지나가다 어떤 남자가 입고 있는걸보고 찾아서 구입했습니다 유니섹스 원사이즈라 L와 XL 사이 정도의 사이즈 인것같고요 키가 큰편이지만 살짝 박시한 느낌이 있습니다 그래도 손목이랑 허리에 밴딩으로 예쁘게 핏정리 가능합니다 펄감이 있지만 너무 반짝이지 않고 고급스럽습니다 세탁하면 벗겨질수 있다고 해서 섬유탈취제도 구입했네요 투웨이 지퍼여서 다양한 연출이 가능하고 아무렇게나 걸쳐도 이쁩니다,"고급스럽다, 지퍼, 가능하다, 크다 편이, 손목, 밴딩, 걸치다, 가능하다, 연출"
역시 무신사 너무 합리적이에여 세탁후 변형도 없고 너무 좋아요 배송도 빠르고 휘뚜루마뚜루입기 좋습니다,"합리, 변형도, 배송, 물다, 세탁 후"
넉하게 입기 좋구 얇아서 여름까지도 입을 수 잇어요,"넉, 잇다, 여름, 얇다"
 넉하게 입는 거 좋아하는 사람한텐 딱 맞는 크기예요 체격이 작은 저한텐 좀 큰데 편하게 입기 좋슴당,"넉, 편하다, 체격, 사람, 작다, 크다, 크기"
친누나 선물로 줬는데 누나가 너무 좋아해서 저도 기분이 좋네요 옷도 이뻐요,"친누나, 누나, 선물, 기분, 좋아하다, 주다"
가볍게 입기 좋고 스타일 좋아요 남자에게는 살짝 짧은감이 있어요 ,"가볍다, 스타일, 남자, 짧다"
여자친구랑 같이 입으려고 두장 구매했는데요 둘 다 만족하고 예쁘게 입고다니는 중입니다 고민하시는분 어서 구매하세요 ,"여자친구, 고민 분, 만족하다, 중, 어서"
요즘 마뗑김 인기많아서 저도 함 구매해봤어여 이뻐여 사이즈 생각보다 많이 크지않고 지금 입기 딱좋아요,"사이즈, 지금, 크다, 인기 많다"
얇지만 예뻐요 무난하고 얇은 만큼 가벼워서 자주 손이 감,"가볍다, 손, 얇다, 얇다"
생각보다 주름이 잘지긴하는데요 모르고 산것도아니라섷 이쁘긴해요 증맬루 근데 얇아서 날씨 쌀할땐 비추합니다 ,"자다, 비추다, 날씨, 증맬루, 주름, 모르다, 얇다"
조임 고무줄 끊어진게와서 교환하느라 좀 시간걸렸네여 품질이 엄청 좋다고 할순 없지만 데일리 스타일링 하기에는 좋은거같아요 ,"스타 일링, 교환, 품질, 고무줄, 일리, 순, 조이다"
역시 마뗑킴 믿고 사 다만 사이즈가 조금만 더 커도 예쁠거 같아용,"사이즈, 크다, 믿다, 마뗑킴"
