Review,keyword
블프 세일받고 여자친구랑 같이 두벌샀어요 좋아용,"여자친구, 일 받다, 벌, 블프"
바스락거리는게 유니크하규 좋습니다 가을에 입으면 좋을거같아요,"유니크 하규, 바스락 거리, 가을"
쿠폰받아서 매장보다 훨씬 싸게 샀어요 사이즈 오버핏으로 이쁘고 저는 스트링 안조이고 입는게 더 마음에 들어요 광택도 은하니 부담스럽지 않네요,"부담, 매장, 안좋다, 사이즈, 은하, 스트링"
간절기에 입기 좋아요 얇은 비닐 재질이에요 뒤에 로고가 넘 예뻐요 ,"간절, 재질, 로고, 비닐, 얇다, 뒤"
비닐 느낌이지만 디자인 넘 예뻐요 뒤에 로고가 킥이에요 지퍼 투웨이라 다양하게 연출 가능해요 얇아서 간절기에 많이 입을 수 있을 것 같아요 ,"간절, 킥, 가능하다, 연출, 디자인, 지퍼, 로고, 비닐, 다양하다"
약간 비닐 같은 재질로 만들어진 옷감입니다 가볍고 블랙 색상이라 아무 옷에나 가볍게 툭 걸치기 좋은 아이템입니다 ,"아이템, 만들어지다, 걸치다, 색상, 가볍다, 가볍다, 재질, 비닐, 블랙"
오버핏으로 되게 얇아요 바스락 가리는 소재이고 뒤에 마뗑킴 마크가 완전 예쁩니다 ,"소재, 마크, 가리다, 바스락, 오버핏, 얇다, 마뗑킴, 뒤"
와이프 사준건데 저한테도 맞아서 제가 더 많이 입고다니네요 이쁩니다 ,"테, 와이프, 맞다"
사이즈는 프리라서 엄청 크지만 스트링 조이면 핏이 예쁩니다 색은 아주아주 고급진 블랙이지요 받자마자 너무 이쁜데 세탁 걱정이 쬐끔되긴하지만 물 닿을일이 많을거 같아성 배송도 꼼하게 잘 왔습니다 ,"걱정, 블랙 이지, 조이, 스트링, 크다, 고급 진, 사이즈, 배송"
사이즈는 프리라서 엄청 크지만 스트링 조이면 아주아주 마음에 드는 핏이 나오네용 역시 마음에 드네요 기다리던 옷이라서 더 마음에 들어요 그래서 두색상 주문했네용 검정은 검정대로 너무너무 이뻐요 ,"사이즈, 색상, 나오다, 크다, 조이, 검정"
넘나 맘에드네요 저렴하게 잘 산거 같습니다 세일나중에하면 다른색도 사보고싶어 지네요,"나중, 에드, 저렴하다, 넘다, 색도, 지네, 사보다"
넘나 맘에드는데요 세일하면 다른색도 사고싶어지네요 ,"색도, 넘다, 일"
사이즈는 적당하고 배송도 박스로 잘되어있고 빨라서 만족합니다,"만족하다, 사이즈, 적당하다, 배송, 박스, 되어다"
배송도 이틀만에 오구 오버핏좋아하는대 너무아뿌네요 셍리쿠폰있어서 더 기분좋게 구매했어요 얇아서 간절기랑 봄가을에 입을 딱조 을것같아요,"간절, 이틀, 배송, 오구, 오버핏 좋아하다, 얇다, 셍리 쿠폰"
행사기간이라 좀 걸릴줄알았는데 배송도 빠르고 옷도 이뻐요,"행사 기간, 배송, 빠르다, 걸리다 알다"
배송 레전드네요 엄청 빨라요 옷도 너무 이뻐요오,"레전드, 배송, 오, 빨르다"
바스락 거리는 재질로 봄 가을에 입기 좋을 것 같아요,"재질, 거리, 가을, 바스락"
후기를 재구매부터 해버렸네용 너무 맘에들어서 잘입다가 요즘은 더워서 못입구있음 ,"들어서다, 재, 덥다, 후기, 버리다"
재구매 바로 두번째 구매라는점 섬물하나 하고 이제 제가일을려고 산고임 넉해서 저한테도 잘맞거등요 ,"가일 려고, 점, 넉, 섬물 하나, 테, 산고, 재다, 이제"
진짜 너무 예쁩니당 겨울이랑 한여름 빼고는 항상 입을 수 있어요 ,"겨울, 항상, 한여름, 빼다"
매장에서 입어보고 휘뚜루마뚜루 입을 수 있을 것 같아 바로 주문했습니다 숏에 후드 있는 제품이랑 고민했는데 기장이 긴 본 제품이 활용도가 더 높을 것 같아 결정했는데 너무 잘 구매한 것 같네요 ,"매장, 입어보다, 제품, 기장, 활 용도, 제품"
쿠폰 적용해서 저렴하게 잘삿습니다 선물용으로 구매한건데 받은사람이 너무 좋아하네요 감사합니당,"선물, 적용, 건데, 저렴하다, 쿠폰, 잘삿습니, 받다 사람, 좋아하다"
싸이즈가 원싸이즌데도 잘맞네요 느낌있고 블랙이라 코디하기 편해요,"싸이 즌데, 편하다, 싸다 이즈, 코디, 블랙, 느끼다, 잘맞다"
가격때문에 살까말까 고민하다가 샀는데 너무 뻐서 고민한 시간이 아깝습니댜 고민이신분들 무조건사세용 짱예빠용,"무조건 세용, 고민 이신, 고민, 고민, 아깝다 댜, 살 까맣다"
좋아요 질도좋고 가격대비 잘 샀어요 마뗑킴 처음인데 너부 좋슺니다,"가격 대비, 처음, 부, 질도, 좋슺니, 마뗑킴"
너무 예뻐요 딱 적당하고 좋은거 같아요 잘 시킨거 같네요 ,적당하다
넘 귀여운 디자인이에요 파주아울렛에서 입어보고 마음에 들었는데 마침 무신사에서 할인해서 바로 샀어요 너무 맘에 쏙 드네요,"사, 디자인, 입어보다, 할인, 마침"
정말 좋아요 얇지만 느낌있는 디자인과 재질입니다,"재질, 디자인, 얇다, 느끼다"
얇아서 좀 더울때 입어도 괜찮더라구요 이쁩니다,"얇다, 덥다"
매장에서 입어보고 샀는데 너무만족스러워요 잘산거 같아요,"매장, 입어보다, 만족스럽다, 잘살다"
너무 오버핏 유광이 너무 심한가 두가지가 걱정되어 망설이다 구매했는데 저는 둘다 만족합니다,"만족하다, 망설이다, 가지, 유광, 심하다, 두다, 오버핏"
오래 고민하다가 구매했는데 마음에 듭니다 후기들이 많아서 도움이 많이 되었어요 ,"고민, 도움, 듭니, 후기, 많다, 되어다"
예약배송 기다리는 시간이 조금 있었지만 기다린만큼 예뻐서 잘 구매한 것 같습니다 그리고 지퍼가 투웨이라서 더 편한 거 같아요 ,"기다리다, 지퍼, 기다리다, 편하다, 투"
블랙 바람막이 크롭 아닌걸로 사려고 알아보다가 구매했는데요 아주 좋습니다 반팔에 이것만 걸쳐도 조금 더 신경써서 입은 거 같은 느낌이 있어요 ,"신경 써다, 걸치다, 팔, 사려, 아니다 걸, 크롭, 알아보다, 바람막이, 블랙"
간지나요 요즘 더워져서 많이 못입지만 가을이 되면 자주 입을거 같아요,"더워지다, 간지나다, 가을, 되다"
코팅이 진짜 생각보다 더 예뻐서 좋아요 이 옷은 다른 색상도 좋지만 블랙이 진짜 최고입니다 예약발송으로 늦게 올까봐 걱정했는데 생각보다 빨리와서 잘 입고 다녔어요 ,"코팅, 색상, 블랙, 늦다, 오다"
구매 시기가 좀 늦어 요즘 입긴 너무 덥지만 앞으로 가을되면 잘 입을 거 같아요 사이즈 핏도 이쁘고 원단도 괜찮아요 요즘 입긴 너무 더워서 다시 더 얇은 바람 막이를 구매 해야겠어요 이옷은 디자인 핏 이쁨 ,"덥다, 디자인, 사이즈, 막, 덥다, 다시, 시기"
검은색 제품이라 어느 옷이나 찰떡으로 잘어울립니다 개인적으로는 저는 하의는 밝은 색상과 입었을 때 자켓이 더욱 눈길이 가는거 같아요 ,"개인, 어울리다, 가다, 눈길, 색상, 검은색, 하의, 더욱"
생각보다 오버핏이라 스트링으로 쪼이면서 입으려고요 예뻐요,"스트링, 쪼이다, 오버핏"
배송 빠르고 바스락 거리는 재질에 마뗑킴 로고 이쁩니다,"배송, 재질, 로고, 거리, 바스락, 빠르다, 마뗑킴"
잘맞아요 공용으로 입기도 좋고 배송 예정일보다 엄청 빨리와서 좋았어요,"공용, 배송, 잘맞다, 예정일, 오다"
편하게 막입기 좋은 거 같아요 더 얆은거 나오면 여름용으로 다시 사고 파요 지금 입긴 너무 더워서 그래도 봄가을엔 막입을수 있을 듯 ,"여름, 막, 막, 나오다, 편하다, 덥다, 사고, 다시"
지금 입기에는 많이 덥네요 화이트 구매 하려다 블랙 구매 했는데 막입기 좋아보여요 봄가을용으로 좋을 듯 합니다 ,"막, 덥다, 화이트, 블랙, 지금"
크기도 예쁘게 오버핏이고 나름 그렇게 얇진않아서 봄까지 엄청 잘 입었어요 ,"크기, 나름, 오버핏, 얇다, 봄"
약간 루즈핏이고 아방가르드한 느낌이에요 방수도 될거같네요,"아방가르드, 방수, 루즈핏, 되다"
너무 과하지않고 적당히 글로시하면서 포인트 되네요 ,"로시, 적당하다, 포인트, 되다"
배송은 좀 오래 걸렸지만 옷 너무 예뻐요 잘 입을게요,"배송, 걸리다"
사진처럼 예뻐요 사이즈는 많이 크네요 편하게 막 입기 좋을 것 같아요 좀 더 빨리살것을 넘 더워져서 한번도 못 입고 나갔어요 ,"사진, 더워지다, 사이즈, 편하다, 한번, 크다"
편하고 박시하게 입고다녀요 검정계열을 좋아해서 그런지 맘에들어요 크쿠,"편하다, 박다, 그렇다, 크쿠, 좋아하다, 검정 계열"
너무 좋아요 간절기에 걸치기 편하고 힙해보여서 무채색옷을 자주입어도 포인트로 딱좋아요,"힙, 걸치다, 간절, 포인트, 편하다, 무채색, 딱좋다"
상품 잘 받았습니다 퀄리티도 괜찮아보이고 디자인도 맘에들어서 자주 사용할 것 같아요 좋은상품 감사합니다 잘 쓰겠습니다,"퀄리티, 들어서다, 사용, 디자인, 상품, 상품, 쓰다, 받다"
지나가다가 어떤 분이 입은게 예뻐서 샀어요 잘산거 같습니당 예뻐요 ,"잘살다, 지나가다, 분, 어떻다, 니당다"
루즈 핏이고 소재가 예쁘고 포인트 되네요 뒷로고도 좋아요,"포인트, 소재, 루즈, 핏, 로고, 되다"
마뗑킴 아우터 처음 사봤는데 너무 만족스럽네요 남자가 입기에도 체형에 따라 세미오버핏 가능하고 재질이나 핏 디자인 등 훌륭합니다 봄가을에 교복처럼 입을 것 같아요 ,"만족스럽다, 훌륭하다, 가능하다, 재질, 디자인, 아우 터, 교복, 남자"
여자친구 주려고 샀는데 맘에 들어서 계속 입고 다녀요,"여자친구, 려고, 들어서다, 계속"
생각못했는데 옷걸이에 걸어져서 와서 좋았어요 ,"걸다, 오다, 걸이"
불량인 상품이 와서 교환요청 했는데 주정도 걸린거 같네요 아쉬워요,"교환 요청, 상품, 걸리다, 주정, 오다, 아쉽다, 불량"
작년뷰터 살까말까 하다가 구냥삿어요 근데 진작살걸 이뿌네요 배송도 짱빠름 엉덩이덮는길이 스트링조절해서 이뿌게입을게여,"스트 링 조절, 진 작살 걸, 작년 뷰터, 배송, 빠르다, 이뿌다, 이뿌다, 엉덩이 덮다 길이"
상품 디자인도 맘에들고 퀄리티도 괜찮은거 같아요,"퀄리티, 디자인, 상품"
마뗑킴 코팅 점퍼 사고 싶었는데 무신사에서 저렴하게 잘샀네요,"사, 저렴하다, 코팅, 점퍼, 사고, 싶다, 마뗑킴"
완전 자주 입어요 편하게 입기 딱이고 재질도 좋습니다 ,"재질, 편하다, 딱이다"
역시 마뗑킴이네요 패딩도 예쁘고 좋았는데 바람막이 디자인도 예쁘고 색상은 화면보다 더 마음에 들었어요,"색상, 화면, 디자인, 바람막이, 패딩, 마 뗑킴"
얇아서 초여름 아우터로 들고 다니기 좋고 레더처럼 보이지만 레더가 아니어서 더 매력이 있습니다,"아니다, 매력, 아우 터, 레더, 보이, 레더, 초여름"
엄청 힘해보여서 맘에 듭니다 가격도 이정도면 합리적인거 같아요 얼마나 입으려나 싶었는데 오래 입을 것 같네요,"합리, 힘, 듭니, 가격"
생각보다 더 크긴해요 그런데 역시 재질이 특이해서 넘예뻐요,"특이하다, 크다, 재질, 넘다"
적당한 오버핏에 간절기 용으로 딱 이에요 광택이 과할까봐 걱정했는데 고급스럽게 과하지 않게 이뻐요 지금은 덥고 초가을부터 입으면 될꺼같아요 ,"고급, 광택, 초가을, 간절, 적당하다, 덥다"
생각보다 덜 비닐같고 완존 마음에 들어요 배송도 빨랐고 꼼했어요 더 더워지기전에 많이 입을거같애용,"더워지다 기전, 배송, 완존, 애용, 빨르다, 비닐"
재질이 비닐같을까봐 고민 많이하다가 샀는데 너무 이뻐요 더 빨리 살걸 ,"재질, 살걸, 고민, 비닐, 많다"
진짜 너무너무예뻐요 주변에서 다 빌려달라고 난리에욬 ,"주변, 빌리다 달라, 난리 욬"
너무 이쁘네요 두께도 앏아서 간절기에 입기 좋을거같아요 핏도 굿 ,"간절, 핏, 앏아, 두께"
마뗑킴 코팅 점퍼 잘 받았습니다 가을에 잘 입을께요,"코팅, 점퍼, 가을, 받다, 마뗑킴"
라이더 스타일이면서 바람막이 겸 입고싶어서 구매했어요 ,"스타일 이면, 바람막이, 라이더"
예뻐요 오버핏으로 좋아요 계절내 입기 좋을듯해요,"오버핏, 계절 내"
남여 공용이라 키크면 팔길이가 좀 짧을순있는데 입을만 합니다,"키크, 공용, 길이, 남여, 짧다 순"
이 가격에 이정도 상품을 받을 수 있어서 좋아요 자주 이용 할게요,"이용, 상품, 이정, 가격, 받다"
무난한 기본 제품입니다 핏 예쁘고 좋아요 추천해요 ,"추천, 제품, 기본"
날씨가 애매해서 입고 나가지는 못했지만 옷은 예쁨,"날씨, 애매하다"
사이즈는 조금 오버하긴 한데 사이드에 있는 스트링 땡기면 되고 디자인은 너무너무 이뻐요 ,"사이즈, 오버, 사이드, 디자인, 스트링"
봄 가을에 유용하게 입겠어요 소매통이커서 약간불편하지만 핏은이쁘네요,"소매통 커서, 유용하다, 가을, 핏, 불편하다"
넉하고 적당히 얇아서 봄 옷으로 딱 맞아서 많이 입었어요,"적당하다, 넉, 얇다, 맞다"
봄 가을에 입기좋아요 흰색도사고싶네요 활용도가 좋아요,"활 용도, 가을, 흰색"
친구 선물로 사줬어요 엄청 맘에든데요 봄부터 가을까지 가넝,"선물, 봄, 가넝, 친구, 사주다, 가을"
어디든 휘뚜루 마뚜루 입기 좋아요 배송도 빨라여 밤에 입습니다 주로,"배송, 주로, 휘뚜루, 빨르다, 마뚜루, 밤"
 어디든 휘뚜루마뚜루 입고다니기 좋아요 배송도 빠릅니다 강추,"강추, 배송, 빠르다"
광택감이 있어 포인트가 되고 오버핏으로 이뻐요,"광택, 포인트, 오버핏, 되다"
비닐비닐한데 재질 좋고 가볍고 유광이지만 예쁩니다,"유광, 가볍다, 비닐 비닐, 재질"
봄 가을에 입기 딱 좋을 것 같아요 얇은 느낌이 좋고 유광이 생각보다 예쁩니다,"유광, 가을, 얇다"
화면과그래도 너무예뻐요 반짝거리는 소재라 포인트되고 맘에듭니다 뒤에 로고도 깔끔한게 예뻐오 박시핏이라 좋습니다 소재는 얇지만 비오눈날이나 환절기 딱인듯,"화면, 비다 눈날, 환절기, 맘에듭니, 소재, 소재, 로고, 얇다"
화면이랑 똑같고 너무 예뻐요 비닐같이 광나는 재질이여서 더예쁜거같아요 소재는 얇은편인데 환절기에입기 좋을것 같아요 뒤에로고가 포인트되서 더 맘에듭니다 너무 잘산템예오,"환절기, 화면, 광나, 맘에듭니, 재질, 소재, 얇다 편, 비닐"
살까말까 고민 많이 했는데 잘 산 거 같아요 실제로 보니 더 예뻐요,"실제, 고민, 살 까맣다"
포장 깔끔해서 좋았어요 그리고 생각보다 얇아요 사이즈 되게 큽니당 ,"크다, 사이즈, 포장, 얇다, 깔끔하다"
그냥 데일릻 입기좋은 바람막이에요 이쁘고 꾸안꾸로 딱,"바람막이, 데일 릻, 꾸다 꾸다, 그냥"
일단 핏이랑 반짝거리는 재질이 너무예뻐요 입고다들 예쁘다고 하네요 얇긴한데 쌀할때 입으면 딱 괜찮아요 ,"재질, 핏, 얇다, 쌀, 반짝거리다"
여자친구한테 취뽀겸 편하게 입을 수 있는 아우터 선물했는데 매우 마음에 들어하네요 디자인 자체도 이쁘고 간절기에 잘 입을 수 있는 제품이예요 ,"여자친구, 간절, 편하다, 자체, 아우 터, 디자인"
예전부터 구입하려고했던 제품이에요 사이즈도 좋고 재질이나 디자인 모두 맘에들어요 구입하길 잘했어요 ,"사이즈, 제품, 재질, 디자인, 예전"
조카 생일선물로 구매했습니다 인증사진 받았는데 오버핏으로 딱 이쁘더라구요 배송도 빨라 생일날 맞춰 받을 수 있어 좋았습니다 색과 보여지는 질감 도 상세페이지랑 동일해 보였어요 아직까지 아침저녁으로 쌀해서 잘 입는다고 해요 더 더워지면 못입을거 같기도 한데 학교 독서실 에어컨 아래서 입겠다고 합니당 맘에 들어해서 뿌듯해요 ,"아침 저녁, 생일 선물, 상세 페이지, 인증 사진, 보이다, 생일 날, 동일하다, 더워지다"
요즘같은 날씨에 입기 좋아요 너무 두껍지 않아서 여름에 들고 다니기 좋을거 같습니다 단점은 먼지가 좀 많이 붙어서 ,"날씨, 먼지, 단점, 여름"
유광인게 좀 부담스럽고 비닐재질이지만 예쁩니다,"유광, 비닐 재질, 부담스럽다"
고민고민하다 구매하려고 하니 품절이라 재입고 기다렸다 알림 와서 바로 구매했네요 왜 이제야 샀는지 후회가 될 정도로 너무너무 맘에 들고 이뻐요 다른 색상도 구매하고 싶어요 사이즈도 딱이고 편하게 박시하게 잘 입어 질듯 해요,"고민 고민, 박다, 색상, 사이즈, 오다, 재"
너무 이쁘네요 자주 착용할꺼에요 데일리로도 좋고 사이즈도 딱맞아서 좋아요 배송도 빠르고 아주 굿 ,"사이즈, 일리, 배송, 착용"
배송도 빠르고 옷 상태도 괜찮았어요 남자친구가 체격도 있고 키도 있는 편인데 잘 맞아서 커플템이나 선물로 해도 좋을 것 같아오 ,"커플, 남자친구, 배송, 선물, 상태, 키도, 편, 체격, 해도"
남자친구 사줬는데 예쁘게 잘 어울려요 키도 큰 편인데 사이즈 적당하게 잘 어울려요 배송도 빠르고 잘 입겠습니당 ,"어울리다, 적당하다, 편, 남자친구, 배송, 키도, 사이즈, 니당다, 사주다"
아니 진짜 말이 필요 없어용 제가 첨 지갑으로 접하게 된 브랜드인데 진짜 잠바 보자마자 넘 젤 스똴여서 블 네 화 중에 고민하다가 블랙 샀는디 넘 애뻐서 cm 에서 네 화 둘 다 결국 질러서 세가지 색상 모두 다 겟 했어요 뭘 고민중이에요 당장 질러버려 마뗀킴 사랑해요 진짜 배송은 오레 걸렸긴 하지만 기존 기간 보디 훵씬 빠르게 받았어요 세가지 색상 돌려가면서 이것만 입어용 그리구 얇기는 봄 가을에 입기 좋고 바스락 재질에 요즘 날씨 아침 저녁으로 입기 조아욤 진짜 최고의 잠바 짱,"고민, 고민, 돌리다, 사랑, 말, 배송, 가지, 색상"
배송도 빠르고 그냥 미쳤네요 너무 이쁘네요 역시 마땡큐,"배송, 빠르다, 미치다, 마 땡큐, 그냥"
바람막이가 너무 이뻐서 남자가 입어도 이쁜거같아요,"바람막이, 남자"
박시하게 잘 맞구요 예쁩니다 여기저기 매치해서 입기 좋으네용 ,"여기저기, 매치, 박다, 맞다"
매장에서 입어보고 구매한 제품인데 정말 너무 너무 예뻐요 이걸 왜 다들 구매하시는지 알 것 같은 제품 여름빼고 계절에 두루두루 잘 입을 것 같아서 고민 없이 구매한 제품인데 정말 더 더욱 만족합니다 잘 입고 다닐게요 ,"만족하다, 매장, 입어보다, 더욱"
박시한 스타일입니다 저는 지퍼에 큰 문제는 없었고 무난하요 다만 세탁부분이 번거롭네요 ,"번거롭다, 스타일, 세탁 부분, 문제, 지퍼, 박 시한, 없다"
무난하면서 튀고 너무 마음에 들어요 아랫단 조절도 되고 박시한 스타일 좋이해서 너무 마음에 들어요 기본인데 평범하지않은 잘 입을것같아요,"스타일, 박 시한, 기본, 조절, 평범하다, 이해"
고민만 몇달째 결국 들였는데 왜 고민했는지 빨리그냥 사서 입을껄 그랬어요 이뻐요,"고민, 사서, 입을껄, 그냥, 달, 들이다, 그렇다, 고민"
가격만족 핏 만족 계속 손이 가는 옷이에요 추천드립나더,"추천 드립 나다, 가격 만족, 만족, 가다, 손, 계속"
마뗑킴 코팅 점퍼 블랙색상 잘샀어요 저녁에 싸늘한데 잘 입고 가을에 다시 개시해야지,"블랙 색상, 코팅, 저녁, 가을, 점퍼, 다시, 싸늘하다, 마뗑킴"
마뗑킴 코팅 점퍼 블랙색상 잘샀어요 저녁에 싸늘한데 잘 입고 가을에 다시 개시,"블랙 색상, 코팅, 저녁, 가을, 점퍼, 개시, 다시, 싸늘하다"
남자친구 선물했는데 엄청 자주 입고 핏도 예쁘네여,"남자친구, 핏, 선물"
살짝 짧은감이 있긴한데 그래도 너무 만족하고 입고 자주 손이 갑니다,"가다, 만족하다, 손, 짧다"
이뻐요 고민하다샀는데 맘에 들어요 자주입을거같아요 색상도 사이즈도 너무좋아요,"사이즈, 색상, 주입, 고민"
반짝반짝하니 이쁩니다 여름엔 입기 힘들고 봄 가을로 입기 괜찮을것 같습니다 ,"여름, 가을로, 힘들다, 반짝반짝하다"
요즘같은 날씨에 입기 적당하고 가격도 할인받아서 저렴하게 잘샀어요 배송도엄청빠르고 너무이뻐요,"날씨, 저렴하다, 적당하다, 가격, 할인 받다, 배송 빠르다"
마뗑킴 남자가 입기에도 무리 없는거 같아요 이뻐요 색감좋아요,"남자, 무리, 없다, 색감, 마뗑킴"
마뗑킴 남자가 입기에도 무리 없는거 같아요 이뻐요 두번사세요,"번, 남자, 무리, 없다, 마뗑킴"
마뗑킴 남자가 입기에도 무리 없는거 같아요 이뻐요,"남자, 무리, 없다, 마뗑킴"
너무 많이 입고다녀서 크롭 바람막이 살까 고민했는데 그래도 많이 입는데는 이유가 있네요 오버핏이지만 여성스럽고 너무 후들거리지않고 예쁜 디자인이라서 후회 없어요 구매확정이요 ,"확정, 디자인, 여성 스럽다, 이유, 바람막이, 크롭"
핏은 이쁜데 주위에 많이보여서 좀그러네요 옷은 짱,"그렇다, 핏, 보, 주위"
 오버핏으로 핏이 예쁘게 떨어집니다 두꺼운 편은 아니지만 얇은 옷들로 레이어드해서 입으면 쌀한 날씨에도 따뜻하게 입을 수 있어요 ,"레이어 드, 날씨, 아니다, 편, 핏, 오버핏"
검은 코치 자켓 한개 있었음 했는데 좋은 가격으로 나와서 바로 질렀습니다 아주 맘에 들어요,"가격, 코치, 검다, 나오다"
아주 마음에 듭니다 요새 계절에 입기 딱 좋은거 같네요,"요새, 듭니, 계절"
마뗑킴 옷을 정말 예쁘게 잘 뽑네요 반짝거리고 재질도 고급져 보여요,"고급 지다, 재질, 보이다, 뽑다, 반짝거리다, 마뗑킴"
네이비는 한참 기다려애하네요 블랙구입했는데 블렉도 이쁘네요 약감 도톰한데 장마철에 입어도 좋을것 같아요,"장마철, 기다리다 애하, 도톰하다, 네이비, 한참, 블렉"
과하지 않는 유광으로 분위기 살렸고 등에 부담스럽지 않게 로고플레이 가져가면서 Matin kim 느낌 잘 살렸어요 남녀 다 잘 어울릴 옷일 것 같아요,"가져가다, 유광, 어울리다, 부담, 로고 플레이, 남녀"
너무 이쁘다 사길 잘했다는 생각 들어요 추천 하단 끈조절로 통조절 가능해서 각자 핏 조절하세요 ,"조절, 통 조절, 가능하다, 추천, 하단"
스타일링하기 좋고 남녀노소 어울릴 옷이에요 너무 두껍지도 얇지도 않아서 봄 가을 초겨울까지 커버가능 ,"스타 일링, 커버 가능, 어울리다, 남녀 노소, 가을, 초겨울, 얇다"
배송은 주문한 다음날 바로 출고되었어요 오버핏 점퍼라서 편하게 입기좋고 아무옷에나 다 잘어울려요 굿 ,"어울리다, 배송, 편하다, 점퍼, 주문, 날, 오버핏"
유니크 하고 너무 예뻐요 입고 나갈 때마다 친구들이 탐냅니당 교복처럼 입고 있어요 ,"내다, 유니크, 친구, 교복"
너무 멋집니다 세련된 디자인이구요 배송도 파르네요,"디자인 이구, 배송, 파르네, 세련되다, 멋지다"
포장상태가 좀 별루네요 상품은 마음에 쏙 듭니다,"포장 상태, 상품, 루, 듭니"
많이 오버핏이지만 오히려 좋습니다 잘입을거 같아요 ,오버핏
키가 작어서 앞에시 보면 넘 크지만 뒤에서 보면 예뻐요 ,"크다, 키, 작다, 앞 시, 뒤"
오버핏으로 잘맞아요 배송도 빠르고 가성비좋게 잘샀어요 ,"배송, 잘맞다, 오버핏, 빠르다, 가성비"
오버핏으로 맞아서 예뻐요 가성비 좋게샀구요 배송도 빠릅니다 ,"가성비, 배송, 빠르다, 맞다, 오버핏"
재질도 좋고 은근 따뜻해요 특이하고 너무 좋아요,"특이하다, 재질, 은근, 따뜻하다"
재질도 이쁘고 암때나 잘 어울려서 잘 입고 다녔습니다 ,"어울리다, 재질"
다른사람이 입고다니는거 보고 혹해서 질렀어요 후회는 안합니다 예뻐요 ,"다른사람, 혹, 보고, 후회, 지르다"
빤딱빤딱하고 이뻐요 꾸안꾸템으로 입기 좋을듯함니다 ,"빨다 빨다 딱하다, 꾸다 꾸다"
비싸긴 한데 여느 브랜드 바람막이는 다 그정도 가격하니까 후회는 않해요 예쁩니다 ,"비싸다, 바람막이, 브랜드, 여느, 후회, 가격"
운동갈때 걸치기 딱이에요 스트링 잡아서 입으면 힙하고 좋네요,"걸치다, 스트링, 잡다, 힙, 운동 갈다, 딱이다"
