Review,keyword
배송은 빠름 가격은 더 낮춰도 될듯 면이 부드러운 면 아니고 두껍 뻣 몇번 세탁하면 프린팅 쩍 갈라질듯 하다 지금도 흰가루 떨어지는데,"희다 가루, 부드럽다, 지금, 가격, 배송, 세탁, 아니다, 프린팅"
 개째 구매중입니다 사이즈도 딱맞고 옷이 좋아요 ,"사이즈, 맞다, 개"
무난한 티라서 데일리로 입기 좋아용 한번 입었는네 목이 살짝 늘어난거 같지만 검정색으로 재구매 의향 있습니당,"검정색, 늘어나다, 목, 티, 일리, 한번, 재다"
사이즈가 좀 큰 감이 없지 않지만 옷은 예쁩니다 굿,"사이즈, 없다"
너무 예뻐요 사면 절대 후회 안 함 진심 요즘 브라운브레스만 입어용 ㆅ 진짜 살짝 비치고 그냥 사세옴,"브라운 브레스, 비치, 옴, 사면, 진심, 절대"
편하게 입기 좋아요 뒤에 포인트 이뻐요 세탁 후 변형도 거의 없었고 옷 두깨는 얇은 편입니다 ,"편하다, 변형도, 편입, 포인트, 세탁, 없다"
생각보다 엄청 큽니다 그리고 비침이 없습니다 그리거 프린팅 찐해서 예쁘고 나쁘지 않습니다 다시 사면 조금 더 작은 사이즈로 사야겠네요,"사이즈, 그리다, 프린팅, 비치다, 다시, 크다"
예뻐요 깔끔하고 무난히 잘 입을것 같습니다 깔끔,"깔끔하다, 깔다 끄다"
이쁘고 놀러 갈때나 어디서나 입디 좋은거같아요,"서나, 놀다, 갈다"
너무 이쁘지만 단점은 너무 많이 입고 다니네요 그래도 이뻐요,단점
옷 핏이 전체적으로 괜찮고 디자인이 너무 맘에 드네요,"전체, 디자인, 핏"
검정입고 맘에들어 흰색도 구매했어요 너무 얇아 흐물거리는 원단이 아니라서 좋아요,"흐물거리, 아니다, 원단, 검정, 흰색, 얇다"
살짝 오버핏 느낌인데 어깨라인이 예쁘게 떨어져욥,"오버핏, 어깨 라인, 떨어지다 욥"
배송이 생각보다 더 빨리 왔고 사이즈도 잘 맞고 예쁩니다,"배송, 사이즈, 오다, 맞다"
이쁜 데 키가 작아서그런지 생각보다 너무 컸어요 우 키크면 입으야할거같아요,"키크, 키, 작다 그렇다, 크다, 야하다"
생각보다 빨리 와서 좋고 가격도 착한거 같아요 매일 입고 다고 있습니다,"가격, 착하다, 매일, 오다"
원래 무난한 게 가장 예쁜 법 기본템으로 입어주면 예뿌다고 생각해요,"가장, 원래, 예뿌다"
이뻐요 사이즈도 잘 맞습니다 배송도 엄청 빨리 왔어요 ,"사이즈, 배송, 오다, 맞다"
세탁하몀 할수록 줄어들어요 걍m살걸 그랫어여 그래도 너무너무이쁜,"줄어들다, 세탁 몀, 랫, 살걸"
입어보니 편하고 이쁜 반팔티인것 같아요 잘입겠습니다,"입어보다, 편하다, 티"
사이즈가 좀 커는데 괜찮아요 근데 아쉬운점은 한번 입고 빨았는데 목이 쉽게 늘어나더라고요 그점 빼고는 괜찮았어요,"늘어나다, 크다, 사이즈, 점, 목, 한번, 아쉽다 점, 쉬다"
여름에 시원하게 입기 좋을것 같습니다 잘입겠습니다,"시원하다, 여름"
세탁후에 목이나 아랫단이 늘어짐 없이 깔끔합니다,"늘어지다, 목, 세탁 후, 단, 깔끔하다"
사진보다 입으면 진짜 깔끔하고 예뻐요 다른 색깔도 살려고합니다,"살리다 고합, 사진, 색깔, 깔끔하다"
생각보다 s사이즈 인데 큰 거 같아요 근데 딱 이쁜 정도의 큼,사이즈
와 아니 너무 후회해요 빨리 살껄 카고랑 입으면 진짜 예쁨 담에 검은색도 살려구용,"살리다, 크다, 검은색, 아니다, 담, 후회"
반바지랑 입기 예쁘고 좋아요 크긴한데 반바지랑 입으면 딱 예뻐요 다른색도 사려고요,"크다, 반바지, 색도"
사이즈도 적당하고 무난하게 입고 다닐 것 같아요,"적당하다, 사이즈"
레터링 흰티중에 제일 무난하게 고르길 잘한것같아요,"희다 티, 레터 링, 고르다, 제일"
인기있는 이유가 있네요 하나만 입어도 간지나고 멋져요 ,"간지나다, 이유, 하나, 인기, 멋지다"
사이즈도 적당하고 색감도 예뻐서 다음에도 사용해야겠음,"적당하다, 사이즈, 색감, 사용"
예전에 다른디자인 구매했다가 너무 잘입어서 또 구매했어요 세탁후에도 후줄근해지는거 없고 짱해서 대만족입니다 이쁜오버핏이라서 구매하면 진짜 본전 뽑을 티셔츠인듯 ,"만족, 후줄근하다, 디자인, 본전, 세탁 후, 예전, 없다"
배송이빠르고 핏감 짱 이뻐요 다음에 또 있음 살께요,"핏감, 살다, 배송 빠르다"
예전에 다른디자인 구매했다가 너무 잘입어서 또 구매했어요 여러번 세탁해도 후줄근해지는거 없고 짱해서 대만족입니다 이쁜오버핏이라서 구매하면 진짜 본전 뽑을 티셔츠인듯,"만족, 후줄근하다, 디자인, 본전, 번, 세탁, 티셔츠"
남자친구 선물로 줬는데 잘 맞고 이쀼게 잘 입고 다녀서 기분이 좋아여 다들 브라운브레즈로 선물 하십셔,"브라운 브 레즈, 선물, 남자친구, 선물, 기분, 주다"
만족합니다 우선 배송이 엄청빨랐어요 잘 입을수 있어요,"만족하다, 배송, 빨르다"
배송이 빨랐습니다 편하게 잘 입을수 있습니다 좋아요,"배송, 편하다, 빨르다"
마음에듭니다 배송도 엄청빨랐어요 편하게 잘입을께요,"듭니, 편하다, 배송, 빨르다"
얇아서 한여름에 입기 좋고 비침도 없었어요 배송도 빠릅니다 휘뚜루마뚜루 입기 좋은 것 같아요,"한여름, 배송, 비치다, 없다, 얇다, 빠르다"
너무너무컷지만 제가뒤에를무 앗습니다 다아나다 다나 나다,"나다, 다나, 나다, 뒤 무, 컷, 앗다"
Xl가 힙하게 입기 정말 좋네요 심플한게 이뻐요,"가다, 심플, 힙하"
구냥 막 입기 좋아여 무난무난해서 다들 장만하시오,"장만, 구"
배송도 빨랐고 상품을 받아보니 포장도 꼼했습니다 사이즈가 생각보다 더 넉해서 오버핏으로 잘 입을 듯합니다 ,"상품, 배송, 포장, 넉, 사이즈, 오버핏, 빨르다, 받다"
생각보다 사이즈가 넉하네요 편하게 여기저기 잘 입고 다닐 듯합니다 가성비 괜찮네요 ,"여기저기, 가성비, 사이즈, 편하다, 넉"
M이라 제몸에 작을줄 알았는데 생각보다 크고 핏도 괜찮고 기장도 적당해서 맘에 듭니다 다른 색깔도 다음에 사보고싶네요 배송도 일 만에 왔어요 개빨라용,"적당하다, 이르다, 기장, 작다, 배송, 몸"
프린팅이 예쁘고 스타일있어 보여요 오버사이즈 마음에 들어요,"오버 사이즈, 프린팅, 보이다, 스타일"
동생 생일선물로 사줬는데 이뻐서 저도 샀어요 강제 커플티 그냥 동생 사주지말걸 실제로 보니까 더 이뻐서 나도 사버림 난 살생각 없었는데 ,"생일 선물, 사주다 걸, 동생, 커플티, 살, 실제, 강제, 사 버리다, 나다"
통이 전체적으로 꽤 커요 핏 잡으면 이쁨 무난하게 입기 좋을듯 배송도 빨리오고 옷 상태도 좋게왔어요,"전체, 잡다, 상태, 배송, 통, 크다, 오다"
 이면 엉덩이 부분 좀 덮어요 그래도 이뻐요,"엉덩이, 이면, 부분, 덮다"
댄스 공연때 입으려고 구매했습니다 넉하게 입으려고 m사이즈 주문했는데 아주 맘에 듭니다,"사이즈, 듭니, 넉, 댄스, 주문, 연때"
생각해던거보다 더이쁘네요 잘입을께요 다른색으로 또사고싶네요 마니파세요,"색, 말다 파다"
프린팅도 이쁘고 배송도 빨라서 좋았어요 아주 좋아요,"프린팅, 배송"
사진하고 똑같고 키기 사이즈 딱 좋아요 배송이 빨라요,"배송, 사진, 키기, 사이즈, 빨르다, 똑같다"
세탁하면 뒷 프린트가 조금 갈라짐이 있어요 디자인은 너무 예쁩니다 ,"세탁, 프린트, 디자인, 갈라지다"
제 교복입니다 진짜 너무 편하고 이뻐요 배송도 진짜 빠르고 당연히 아시겠지만 저 사진 그대로 생겼습니드 ,"당연하다, 편하다, 교복, 배송, 사진, 그대로, 알다"
디자인 괜찮습니다 색감은 화면과 비슷합니다 새탁후 변형 없었습니다,"화면, 변형, 색감, 탁후, 디자인, 없다"
가격은 조금 비싼편입니다 디자인은 나쁘지않습니다 새탁 후에는 변형 없습니다 배송 괜찮았습니다,"비싸다 편입, 변형, 가격, 배송, 디자인, 탁, 후, 없다, 나쁘다"
루즈핏으로 어디든 잘 어울려요 면도 탄해서 좋아요 ,"어울리다, 면도, 루즈핏"
잘 입고 있습니다 좋습니다 세탁해도 그대로입니다 ,"그대로, 세탁"
오버핏 느낌이 있지만 청바지에 코디하면 힙하고 이뻐요 색깔별로 쟁이고 싶어요 배송도 빨랐고 색감은 완전 올 화이트 였습니다 강추 ,"쟁, 청바지, 코디, 힙, 배송, 강추, 화이트, 색감"
배송도 빠르고 사이즈도 딱 알맞고 디자인도 예뻐요,"사이즈, 디자인, 배송, 알맞다, 빠르다"
옷 너무 맘에 들고 배송 빨랐어요 무슨 옷이랑 입든 잘어울려요,"어울리다, 배송, 빨르다"
커플티로 입었는데 예뻤어요 사이즈는 s했는데 좀 크긴했어요 생각보다 얇긴하지만 여름에 시원하게 입기 좋았습니다,"커플티, 시원하다, 사이즈, 여름, 크다"
커플티로 입었는데 예뻤어요 사이즈는 m하니까 딱 맞았고 생각보다 얇긴한데 여름애 시원하게 입기 좋았습니다,"커플티, 시원하다, 사이즈, 여름 애, 얇다"
디자인도 예쁘고 옷도 편하고 좋았지만 위 아래 기장이 커서 아쉬웠어요 ,"기장, 편하다, 디자인, 커서, 아래, 아쉽다"
요즘 유행하는 스타일 등판이 예뻐요 길이가 좀 길어요,"유행, 판이, 스타일, 길이"
뒷태가 예쁜 티입니다 길이가 약간 긴듯해요 세탁 후에도 변형없어요 ,"티, 길이, 세탁, 후, 변형 없다, 태"
좀 비쳐요 그래도 이쁘고 시원하고 이쁩니다 아니 그냥 이쁘단 말밖에 안나옴,"나오다, 아니다, 시원하다, 비치다, 말, 그냥"
목 늘어남도 많이 없구 탄해요 팔 두번 접어입으니 딱 이쁘네용,"접다, 늘어나다, 번, 없다"
스투시 재질 예쁘고 좋은데 모르고 건조기 돌렸더니 작아져버림 다시 구매할게오 ,"작아지다 버리다, 건조기, 오, 모르다, 재질, 스 투시, 다시, 돌리다"
디자인도 괜찮고 사이즈도 좋았어요 색도 비슷했어요,"사이즈, 디자인, 색도"
디자인이 너무 맘에 들어서 샀는데 검정색이 딱 깔끔하고 이쁜 거 같아용,"검정색, 들어서다, 디자인, 깔끔하다"
길이가 조금 긴 감이 없지않아 있지만 티는 정말 예뻐요,"길이, 티, 없다"
원단 탄하고 적당한 루즈핏 예쁘네요 세탁해도 변형없음,"적당하다, 세탁, 탄하, 원단, 변형 없다, 루즈 핏"
배송 빠르고 원단 탄해요 핏 적당한 루즈핏 예쁘네요,"적당하다, 배송, 원단, 빠르다, 루즈 핏"
예뻐요 근데 쫌 커요 소매가 길어서 저는 두번 접고 입습니나,"입습 니나, 크다, 소매, 접다, 번"
간편하게 입기좋고 너무 이쁘네요 다시 한번 더 살거 같습니다,"간편하다, 살다, 한번, 다시"
완전 이쁘고 편햐요 매일 매알 입어요 다음에 다른색도 살겁니다 ,"살 겁니다, 매일, 알, 색도, 편햐"
옷이 예뻐요 낙한 핏에 재질도 후들후들하니 좋습니다,"후 후, 재질, 낙, 핏"
아이가 마음에 들어 하네요 너무 얇지않아서 좋아요,얇다
여름이라서 이쁜 반팔티를 사고 싶었는데 사이즈가 ws 랑 s 차이가 너무 커서 s사고 잘라입엇어요 그치만 디자인도 그렇고 핏도 그렇고 이쁨 ,"여름, 사이즈, 사고, 티, 커서, 디자인, 사고, 그치다, 차이"
배송도 빠르고 디자인이 예뻐요 색감은 사진과 똑같았고 사이즈도 정사이즈예요 예쁘게 입을께요 ,"사진, 사이즈, 색감, 디자인, 배송, 빠르다, 똑같다, 정사 이즈"
깔끔하고 무난합니다 데일리로 적당해요 괜찬음,"적당하다, 일리, 깔끔하다, 괜찬음"
선명한 화이트로 살짝 오염이 걱정됨 조심해서 입어야할듯,"선명하다, 조심하다, 화이트, 오염, 걱정 되다, 야하다"
디자인은 이쁜데 구김이 잘 생겨서 조금 아쉬워요 그래도 이뻐요,"생기다, 구김, 디자인, 아쉽다"
그저그래요 어깨선이 아쉬워요 그래도 예뻐요오,"그렇다, 어깨 선, 아쉽다, 오"
가격도 싸고 배송도 빠르고 재질도 좋은데 세탁하고 건조기에 돌리면 작아져요,"건조기, 작아지다, 세탁, 가격, 재질, 배송, 돌리다, 싸다, 빠르다"
생각한 그대로 입니다 편하게 입을수 있을것 같아요,"편하다, 그대로"
제가 말랐는데도 이쁘고 여름에 입기 딱좋은거같아요,"여름, 마르다, 딱좋다"
살까 말까 고민했는데 사니깐 확실히 좋네요 추천합니다,"추천, 확실하다, 살다, 사, 말다, 고민"
크기도 적당한 오버핏이고 이뻐요 어디서나 편하게 입기 좋아요,"편하다, 적당하다, 크기, 서나, 오버핏"
조금 비침이 있구 두꺼운 재질 아니구요 무난하고 딱 좋습니다 ,"아니다, 비치다, 재질, 두껍다"
뒤 로고도 예쁘고 티가 탄해서 오래 입을 수 있을 것 같아요 이거 하나만 입어도 포인트 돼고 이너로도 입을 수 있고 좋습니다 ,"하나, 티, 로고, 포인트"
백화점보다 가격 저렴하게 잘샀어요 옷은 약간 긴듯하지만 여유있게 입는스타일 중 여학생 입기 괞찮아요 ,"여학생, 스타일, 저렴하다, 백화점, 가격, 여유"
화면에 나온 그대로고 질도 괞찮아요 여중생들이 기본 블랙 화이트 많이 입는다 추천 받아서 화이트로 주문했어요 ,"여중생, 화이트, 화이트, 화면, 추천, 그대, 나오다, 기본, 블랙"
백화점에서 보구 m사이즈 추천받아서 무신사로 더 저렴하게 주문해요 사이즈는 괜찮은데 길이가 쫌 긴듯해요 ,"백화점, 사이즈, 저렴하다, 사, 주문, 사이즈, 길이, 보구, 추천 받다"
이뻐요 시원해요 고양이 손톱에 빵꾸가 낫어오 고양이 조심하세오,"손톱, 조심하다, 시원하다, 빵꾸, 낫다, 고양이"
사이즈가 좀 크게 나왔습니다 한 사이즈 더 작게 주문하셔도 될듯 합니다 저는 보통 라지 입는데 미듐도 살짝 크네요 ,"크다, 주문, 미듐, 사이즈, 사이즈, 크게, 라지"
디자인 두께감은 맘에들어요 다만 한사이즈 더 작게 샀어야 하나 후회도네요 루즈하게 입어야겠어요 ,"사이즈, 루즈, 디자인, 하나, 작다, 두께 감다"
사이즈도 핏하게 맞고 배송 빠르고 프린팅도 이쁘네요,"프린팅, 배송, 사이즈, 핏하, 빠르다, 맞다"
보통 라지 구입하면 잘 맞는데 후기에 크게나왔다고 해서M샀어요 근데도 좀 크네요 루즈하게 입어야겄어요 ,"루즈, 보통, 라지, 후기, 크다, 크게 나오다, 겄, 맞다"
정말 편하고 이쁩니다 요즘 유행인 이유를 알겠네요,"유행, 이유, 편하다, 알다"
옷 핏이 정말 이쁘고 두껍지 않아서 여름에 입기 좋아요,"여름, 핏, 두껍다"
택배오자마자 뜯어보고 입어밧네여 블랙에 이어서 화이트도 구매 아들이 넘조아라합니다 면이 부드럽고 탄해여 굿입니다,"택배, 넘다 라합, 부드럽다, 아들, 화이트, 블랙"
행사해서 잘구매햇고요 블랙 화이트 완전 깔맞춤으로 이뻐여 목부분도 안늘어지게 탄하고 전반적으로 예쁜 화이트예여 중딩아들이 좋아하네여,"중딩 아들, 전반, 행사, 늘어지다, 목 부분, 탄하, 블랙, 화이트, 화이트"
두번째 구입해여 아이가 블랙 화이트 깔맞춤으로 입네여 티가 이뻐여 목부분도 탄한편이라서 잘안늘어날거같아여 굿입니다,"한편, 목 부분, 화이트, 티, 블랙, 늘어나다"
생각보다 얇지만 디자인이나 핏이 정말 좋네요 아딜가든 입고있어요,"디자인, 아딜 가든, 핏, 얇다"
라이즈도 맞고 오버핏이라 핏이 좋습니다 배송이 빨라서 좋았습니다,"배송, 라이즈, 핏, 오버핏, 맞다"
동생이 사달라고 해서 사줬어요 깔끔하니 예쁜거같아요 ,"동생, 달라, 사주다, 깔끔하다"
요즘 트렌디에 잘 맞는 디자인과 팔 롤업해 입으면 더 이뻐요 ,"롤 업다, 디자인, 트렌디, 맞다"
뒷태가 정말 이쁜 옷이예여 검정 흰색 샀는데 둘다 넘 이뻐요 ,"검정, 흰색, 두다, 태"
옷이 너무 이쁘네요 진짜 마음에 들어요 최곱니다,최 곱다
정말 이뻐요 뒤에 프린팅이 너무 이쁘네요 굿입니당,"프린팅, 뒤, 굿"
핏 괜찬아여 두께도 적당히 있고 깔끔해요 노멀하게 입을수있음,"적당하다, 노멀, 두께, 깔끔하다, 괜찬아"
조금 큰 거 말곤 괜찮아요 아무때나 입기 좋습니다 조금 비치는점은 아쉽네요,"비치다 점, 말다, 아쉽다"
생각보다는 컸어요 그래도 이뻐요 특히 뒤에가 이쁘네요 그리고 동생도 이쁘다고 자주 입어요,"동생, 크다"
이뻐요 색감은 똑같고 디자인도 이쁩니다 고민하시는 분은 꼭 사시길 바랍니다,"고민, 색감, 디자인, 바라다, 분, 똑같다"
옷이 이쁩니다 특히 뒤에가 이뻐요 어느 바지에 입어도 괜찮네요 동생도 이쁘다고 자주 입네요,"동생, 바지"
디자인이 너무 이쁘고 사이즈도 크지도 않고 작지도 않아서 좋네요,"사이즈, 디자인, 크다"
너무 깔끔하고 좋아용 잘 입겠습니당 너무 좋습니당,"니당다, 니당다, 깔끔하다"
예쁜옷 잘사서 잘입고있고 비침도 생각보다 적고 싼가격에 잘산것같습니다,"싸다 가격, 적다, 비치다, 잘살다"
배송도 재질도 굿 세탁후변형없응 디자인 심플 예쁨 ,"재질, 심플, 배송, 디자인, 세탁 후 변형 없다"
저에겐 커서 센치 오빠줬는데 오빠가 잘 맞네요 재질도 톡해서 좋아요,"톡, 센치, 재질, 커서, 오빠 주다, 오빠, 맞다"
잘맞아요 배송도 좋고 세탁후 변형없음 건조기사용가능하나 글씨가 갈라짐 ,"글씨, 건조기 사용 가능하다, 세탁 후, 배송, 갈라지다, 잘맞다, 변형 없다"
엠사이즈 넉해서 다시 스몰로 구입했어요 여름에 잘입고있어요,"엠 사이즈, 여름, 넉, 스몰, 다시"
사이즈도 좋고 맘에 듭니다 이쁘게 입을게요 감사합니다,"사이즈, 듭니"
배송이 많이 오래걸렸어요 사이는 큼직하고 면은 살짝 두껍네요,"배송, 큼직하다, 걸리다, 두껍다"
 검정 입다가 흰색도 구입했어요 넉해서 편하게 입기 좋어용,"편하다, 넉, 검정, 흰색"
검정 입다가 흰색도 구입했어요 넉해서 편하게 입기 좋어용,"편하다, 넉, 검정, 흰색"
생각보다 배송이 엄청 빨라서 좋았고 잘 맞는 것 같아요 블랙이 제일 심플하고 무난한듯,"배송, 심플, 블랙, 제일, 맞다"
이뻐요 잘 입구 다닐듯 합리적이네요 이정도면 헤,"합리 적다, 입구"
일부러 크게 입을려고 m 시켰는데 너무 맘에 들어요 여름에 가장 많이 입고 다니걸로 위 먹었습미다 ,"여름, 일부러, 가장, 걸, 크게"
진짜 너무너무 예뻐요 다른색으로도 여러개 더 살거같습니당,"색, 개, 살다 니당다"
너무 편하고 자주 입게 됩니닽 발 산 것 같아융 야호야호야호,"편하다, 야호 야호 야호, 됩니닽, 융"
옷이 사진이랑 너무너무 똑같고 옷 제질이 너무 부드럽다,"사진, 질, 부드럽다, 똑같다"
여자한테는 엄청 박시합니다 뒤에 프린팅이 이뻐요 ,"여자 늘다, 프린팅, 박다, 뒤"
브라운브레스 너무 흔한 거 같아 안 사려고 했는데 막상 입으신 분들 보니까 너무 예쁘더라구요 그래서 구매했어용 핏은 정핏보다는 약간 크지만 확실한 오버핏은 아녜용 크게 입고 싶으시면 사이즈 업하시는 걸 추천드리나 어깨선이 약간 아래에 있어서 너무 크게 입으시면 부해보일듯 합니당,"업, 추천 드리다, 크다, 사이즈, 확실하다"
평소에 사고싶었던 옷인데 막상 사고 받으니까 더 마음에 들어서 다음엔 다른 색상도 구매 하고싶네요 ,"들어서다, 막상, 색상, 평소, 사고"
누구다 다 있는 정말 깔끔한 스타일 이뻐요 블랙도 주문하려고요,"주문, 블랙, 스타일, 깔끔하다"
저 반팔 하나는 사야겠다 싶어서 무난한 블랙레터링으로 샀는데 예쁘네요,"하나, 블랙 레터 링, 팔, 싶다"
브라운브레스 반팔 너무 예뻐요 마음에 듭니다 굳,"브라운 브레스, 듭니, 팔"
좀 길어요 그래도 깔끔하고 이뻐요 입으면 시원해 보일것 같습니다 ,"시원하다, 보이다, 깔끔하다"
동생사줬는데 깔끔하규 이뻐용 디자인좋아요 세탁변형없어요,"세탁 변형 없다, 디자인, 동생 사주다, 깔끔하다 규"
재질도 좋고 어느정도 오버사이즈에 너무 예쁘네요,"오버 사이즈, 재질"
 번 세탁했더니 목이 턱까지 늘어남 누가 목 짱하다는데 아님 잘 늘어나소 못입음 ,"늘어나다, 늘어나다, 목, 아니다, 누가, 턱, 세탁"
색감은 화면이랑 같아요 최근에 산 거 중에 제일 잘 입고있어요 검정색도 살까 고민중이에요 감사합니다,"고민, 검정색, 화면, 색감, 중, 제일, 최근, 살다"
존예 기준 엉덩이 다 덥고 애들이 너무많이 입어서 강제 눈치게임 ,"엉덩이, 눈치 게임, 강제, 덥다, 애, 기준, 존예"
색감도 좋고 다음에도 사서 입을거같아요 좋아요,"색감, 사서"
옷 너무 예쁘고 다음에도 이 브랜드에서 살거같아요,"브랜드, 살다"
몇 장 째 티셔츠 사고 있는지 모르겠지만 정말 살 때 마다 너무 예뻐요 재질도 괜찮고 ,"재질, 티셔츠, 사고, 마다, 모르다"
완전 이뻐요 맘에 들어서 계속 입고 다닐것 같애요 ,"들어서다, 계속, 애"
요즘 핫한 브랜드라 중딩아들이 좋아합니다 cm kg M사이즈 잘 맞네요 여름에 어떤하의와도 매치가 잘 될 것 같아요 ,"사이즈, 중딩 아들, 여름, 매치, 브랜드, 핫, 좋아하다"
디자인이며 재질이며 핏이며 그냥 완벽입니다 얼렁사세요,"얼렁사세, 재질, 디자인, 완벽, 핏, 그냥"
디자인 배송 모두 만족합니다 항상 이용 중입니다,"만족하다, 중, 디자인, 이용, 항상, 배송"
이쁘고 잘 입고 잇서요 완젼 짱맨잉니다 엉렁 사세오,"엉렁, 완젼, 잇다, 잉니"
생각한 대로 이쁩니다 평소에 입는 반팔들 보다 얇은 걸로 체감해서 확실히 여름 원단으로 좋은 것 같아요,"평소, 원단, 걸, 체감, 확실하다, 팔, 대로"
박시하게 입기 좋습니다 중학생 아이가 만족합니다,"중학생, 만족하다, 박다"
지난번 m사이즈 샀을때 좀 넉함 있던터라 걱정되지만 s구입했어요 잘맞습니다 ,"사이즈, 함, 지난번, 잘맞다, 터, 걱정 되다"
옷이 심플하고 얇고 편해서 좋습니다 한번더 살거 같아요,"심플, 편하다, 살다, 한번, 얇다"
크게 입으려고 일부러 제일 큰 사이즈 구매했어요 디자인도 깔끔하고 품도 좋은데 기장이 너무 길어요 조금만 짧았음 좋았을텐데 그게 젤 아쉽네요,"기장, 일부러, 사이즈, 디자인, 제일, 크게"
사이즈는 일부러 넉하게 주문했어요 목부분이 쉽게 늘어날것같은 불안감이 ,"목 부분, 일부러, 불안감, 넉, 사이즈, 주문, 쉬다, 늘어나다"
품은 그리 안큰데 길이가 많이 길어요 그게 아쉽네요 ,"크다, 그리다, 길이, 그게, 품다, 아쉽다"
디자인도 너무 이쁘고 만족하는데 한테는 너무 커요 제일 작은 사이즈 시켰는데도 큼 ,"만족하다, 사이즈, 디자인, 크다, 작다, 제일, 테"
그냥 어디 입어도 무난하고 이쁨 기본티로 하나쯤 가지고 잇는 게 좋을 듯 ,"티, 가지, 잇다, 그냥, 하나"
배송빨라요 깔끔하게 보내주셨어요 옷감도 좋아요 상세설명과 같아요 ,"상세 설명, 옷감, 보내다, 배송 빨르다, 깔끔하다"
배송은 일정도 걸렸어요 입어보니 뒷면에 로고 크게 박혀있는 게 되게 이쁘고 앞쪽에도 작게 로고 있는데 좀 귀엽네요 어느 바지랑 입어도 잘 어울리고 좋습니다 다만 얇다보니 비침이 좀 있어요 ,"입어보다, 어울리다, 일정, 배송, 바지, 비치다, 작다, 로고"
생각보다 커서 당황했지만 크게 입을려고 사서 괜찮았구 재질이나 프린팅 로고들은 다 마음에 들었어여,"프린팅, 커서, 로고, 재질, 사서, 크게"
좀 큰데 심플하고 좋아요 데일리하게 입을 수 있을 것 같아요,"심플, 데일 리하, 크다"
옷이 일단 매우 이뻐요 주변에서 친구들이 자주 입길래 이뻐서 샀는데 진짜 이쁘고 후회하지 않을 반팔 같아요 지금도 엄청 잘 입고 다니고 있습니다 꼭 사세요,"주변, 입길, 친구, 지금, 팔"
만족하긴 하는데 살짝 보풀이 잘 생겨요 뭔가 좀 많이 많이도 아닌데 보풀 생긴다는 점에서 살짝 아쉽긴 하지만 만족합니다,"만족하다, 생기다, 만족하다, 아니다, 뭔가, 생기다, 보풀, 점"
