Review,keyword
너무 예뻐요 전채적인 기장이 약 간 길긴 하지만 대충 오버핏이라 생각하면 예뻐요 바지 뭐든 잘 어울리고 역시 다 입는 이유가 잇는 거 갘아요 감사합니당 ,"전채, 기장, 어울리다, 이유, 대충, 바지"
재질 좀 도톰한편이고 사이즈는 박시한 스테일 입니다,"도톰하다 편이, 사이즈, 스테일, 박 시한, 재질"
아들입으라고 사줬는데 괜찮네요 잘입길 바래요,"아들, 사주다"
좀 크네용 생각보다 아직 성장중이기 때문에 크면 자주 입겠습니다,"성장 이기, 크다, 크다, 때문"
좋아하는 브랜드라서 다른 색상으로 하나 더 구입했습니다 뭔가 더 긴것같네요,"브랜드, 색상, 뭔가, 하나, 좋아하다"
친구들이 입고다녀서 사봤는데 이쁘고 편해서 입기 좋다,"편하다, 친구, 사보다"
배송도 빠르고 흰색도 이쁘고 좋은것 같아요 잘입을게요,"배송, 흰색, 빠르다"
배송은 빠르고 원래 정사이즈는 M인데 후기에 크다는 말이 많아서 S 샀는데 딱 맞았어용 ,"정사 이즈, 말, 배송, 크다, 원래, 후기, 빠르다, 맞다"
여름에 입기 얇고 사이즈도 잘 맞고 편합니다 자주입어요,"편하다, 사이즈, 여름, 얇다, 맞다"
배송 빠르고 박스티로 입으려고 크게 산건데 성공이요 근데 좀 얇은거 같기도 해요 ,"성공, 박스 티, 배송, 크게, 얇다, 빠르다"
크기가 좀 많이 크고 목부분이 좀 두꺼워서 그게 좀 별로였어요 그점 빼고는 다 좋았어요,"크기, 크다, 목 부분, 점, 빼다, 별로, 두껍다, 그게"
배송은 빨라서 좋앗고 재질은 약간 습한 날씨엔 안 입는 걸 추천 옷 너무 사고 싶엇는데 개 예쁨 ,"날씨, 배송, 추천, 재질, 싶다 늘다"
편하게 입으려고 샀는데 너무 예뻐요 맨날 입어요,편하다
디자인 프린팅 너무맘에 들어요 질리지않구 유니크하여 좋아요 세탁후 변형 거의없어요,"유니크, 변형, 프린팅, 세탁 후, 디자인, 질리, 없다"
세일할때사서 잘입고있어요 기본티로 최고 그냥 단독으로 입어도 이뻐요,"티, 단독, 최고, 일 사서, 그냥"
브라운브레스 두개째 구매입니다 그만큼 만족하는 상품 커플로 입어도 좋아요 ,"커플, 브라운 브레스, 만족하다, 상품, 개"
편하게 입으려고 주문했는데 적당히 괜찮아요 잘입을고 같아요,"적당하다, 편하다, 주문"
입으면 루즈핏으로 예뻐요 편하게 입기 좋아요 오늘도 입었습니당,"편하다, 오늘, 니당다, 루즈핏"
중학생 딸 이쁘게 입고 있어요 바지랑 같이 구매해서 입고있어요,"중학생, 바지"
예뻐요 적당한 오버핏에 기장감도 딱이고 너무 맘에들어요,"기장 감다, 적당하다, 오버핏, 딱이다"
조금 비치긴 하지만 약간 오버팟이라서 편하고 생각보다 두께가 있어 한여름에는 못 입을거같아요,"편하다, 비치다, 한여름, 오버팟"
프린팅이 굉장히 이쁜데 좀 큰편이에요 사이즈 잘 보고 사세요,"크다 편이, 프린팅, 사이즈, 보고, 굉장하다"
남자친구랑 커플티로 맞췄는데 생각보다 이쁜거같아요,"커플티, 남자친구, 맞추다"
사이즈도 넉하고 편하게 입을 수 있어서 좋아요,"넉, 사이즈, 편하다"
한번 사서 입었는데 좋아서 하나 더 샀습니다 짱좋음,"한번, 하나, 사서"
요즘 브라운 브레스가 인기가 올라오는 중이라 잘 구매한 듯 합니다 ,"올라오다, 인기, 브라운, 중이, 브레스"
재질도 탄하고 무난하게 예뻐서 자주 입을 것 같아욤,"재질, 탄하, 같아욤"
프린팅이 아주 그냥 힙하고 이뻐여 좀 크긴 햇는데 오버핏으로 입기 귀여운것 같아용 소재도 얇아서 여름에 시원하게 입기 좋아요,"프린팅, 힙, 시원하다, 크다, 여름, 소재, 햇 늘다"
핏이 예쁘고 배송이 빨라서 좋았어요 앞으로 자주 입을거 같아요,"배송, 핏, 앞"
배송이 빨랐어요 상품 사진이랑 똑같았고 사이즈도 딱 맞았어요 핏이 예뻐서 앞으로 많이 입을거 같아요,"배송, 사진, 사이즈, 상품, 핏, 앞, 빨르다, 맞다"
잘 받았습니다 잘 맞아요 편하답니다 잘 입고 다닐게요 ,"편하다, 받다, 맞다"
좋아요 아주 좋아요 스타일 좋아요 다음번엠 다른걸로,"걸, 스타일, 번엠"
완전 스타일 나고 이쁨니다 뒷모습이 더 이뻐요 굿,"스타일, 나다, 뒷모습"
세탁기 건조기 막 돌려도 변형 전혀 없고 목 늘어남도 없어요 프린팅도 안 갈라지고 너무좋고 예뻐요 그런데 통이 좁고 세로 긴 편이라 바스트가 좀만 있어도 핏이 어정쩡해져요 ,"프린팅, 건조기, 전혀, 변형, 갈라지다, 세탁기, 통, 바스트, 돌리다, 좁다"
생각보다 크기가 커서 좀 놀랬고 길이가 커서 오버핏으로 코디하는게 제일 무난하더고 생각했어요 그래도 옷이 얇아서 시원해 지금 입기 딱 좋아요 디자인이 깔끔해서 데일리로 많이 입고 있어요 ,"코디, 크기, 커서, 시원하다, 길이, 디자인, 일리"
박시한 핏이라 휘뚜루마뚜루 편하게 입고 나갈 때 좋네용,"편하다, 박 시한, 핏"
재질좋네요 탄하고 그런데한여름에는 더울듯,"한여름, 탄하, 재질, 덥다"
브라운브레스 검정로고 입고있는사람은 잘 없어서 좋고 깔끔해서 좋아요,"검정 로고, 브라운 브레스, 없다, 깔끔하다, 사람"
로고가 이뻐요 반바지랑 같이 입고 바다놀러갔어요,"반바지, 로고, 바다 놀다 가다"
얘붑니다 검정살까 고민했는데아 그냥 둘 다 살 걸 ,"얘 부다, 그냥, 고민, 검정 살다"
딸아이 교복이 되어버렸네요 세탁하기 무섭게 입네요 세탁후 변형도 적고 재질도 탄합니다 교복이 될만합니다 ,"변형도, 세탁, 무섭다, 교복, 세탁 후, 재질, 적다, 딸아이"
살짝 길긴한데 트레이닝 반바지랑 입으면 잘 어울릴듯,"길다, 트레이닝, 반바지, 어울리다"
좀 컸지만 너무 이뻤던 너무 흔했지먄 그래도 이뻐요,"크다, 흔하다 먄"
재질 착용감은 괜찮고 여름이라 입기 편함 사이즈는 좀 큰 편이긷 한데 반바지랑 입으면 별로 안 커보여서 좋읍,"크다 보, 착용 감다, 여름, 반바지, 사이즈, 재질, 편하다, 별로"
디자인 깔끔하고 얇아서 시원하긴한데 조금 비치긴함,"시원하다, 비치다 함, 디자인, 얇다, 깔끔하다"
진짜 색 너무 이쁘고 포장도 깔끔하게 잘 왔어요 좋네여,"포장, 오다, 깔끔하다"
흰색 반팔티가 없어서 할인 받아 하나 샀는데 디자인도 깔끔해고 가격도 합리적,"흰색, 합리, 티, 가격, 디자인, 할인, 하나, 없다, 받다"
뒷면 프린팅이 예쁘고 막 입기 좋지만 얇아서 튼할 것 같지는 않아요,"프린팅, 틀다, 얇다"
제 몸에 비해 많이 크긴 해요 넣입해도 너무 큰 게 티나서 오버핏으로 입는 게 가장 좋을 거 같아요,"크다, 티나, 가장, 비다, 몸, 오버핏"
옷이 좀 크긴한데 이쁘고 한여름에도 잘 입을거같네용 잘 입게용,"크다, 한여름"
면이 얇은 편인거 같아요 그리고 세탁 한방에 목이 늘어납니다,"편, 늘어나다, 목, 방, 세탁, 얇다"
아이들 옷은 항상 이 브랜드에서 구매합니당 옷이 원단이 튼하거든요,"틀다, 원단, 브랜드, 항상"
배송은 빠르게 안전하게 잘 배송이왔습니다 디자인도 깔끔해서 좋았습니다 세탁후 변형도 없고 모든 면에서 좋았습니다,"변형도, 안전하다, 배송, 디자인, 모든, 세탁 후, 없다, 빠르다"
화면 그대로 입니다 같이 구입한 조끼에 입으려고 샀는데 단독으로 깔끔하게 예쁘네요 입었을때 더 환한 느낌에 매우 만족합니다 ,"만족하다, 환하다, 화면, 단독, 그대로, 조끼"
기장이 좀 긴거말곤 다 예뻐요 세탁후 변형도 어뵤어요,"변형도, 어뵤어, 기장, 세탁 후"
전부터 사려했는데 사이즈가 너무 커서 고민하다가 결국 샀는데 크게 입어도 이뻐요 ,"커서, 전, 사이즈, 고민, 크게"
뒤에 로고가 크게 박혀있어 이쁘고 사이즈도 넉합니다 스투시가 비싸다면 추천,"비싸다, 추천, 스투시, 사이즈, 넉, 크게, 로고, 박히다, 뒤"
요즘 길거리에 많이 보이는 옷 그만큼 좋다는 거겠죠 핏도 넘 예쁘고 프린팅도 마음에 들어용,"길거리, 프린팅, 보이다, 핏"
기장은 약간 긴 느낌이 있어서 바지에 넣어입고 있습니다 로고가 심플하고 이뻐요,"기장, 심플, 바지, 로고, 넣다"
디자인 진짜 예뻐요 옷 길이감도 적당해서 너무 좋으아요 실물보면 마음에 안 들어할 수가 없는 옷 이에요,"적당하다, 실물, 디자인, 길이 감다, 수가"
브라운브레스 눈에 계속 밟혀서 한 번 사 봤는데 완전 성공이네요 두깨도 있는 편이여서 너무 편하게 잘 입고 있어요 핏도 예뻐서 아주 만족 기준으로 엉덩이 반정도 덮었습니다,"엉덩이, 성공, 편이, 반정, 기준, 만족, 편하다, 브라운 브레스"
초록색 있는데 가장 많이입어서 검정으로 또 샀어요,"검정, 초록색, 가장"
시원하고 이쁘고 여름에 입기 딱이네요 잘 입겠습니다,"시원하다, 여름, 딱이다"
핏 이쁘고 색감 맘에들고 등 프린팅도 이뻐여 크게 입었지만 부해보이지 않아여 배송도 괜찮았습미댜,"부, 프린팅, 배송, 색감, 크게, 밉다 댜"
요즘 유행하는거 같길래 하나 샀어요 맘에 드네요,"유행, 하나"
오버핏으로 딱조아욤 브 질좋고 막 빨래 돌려도 짱하고 최애 브랜드,"돌리다, 브랜드, 최애, 짱하다, 질, 오버핏, 빨래, 딱좋다 욤"
좀 커서 아쉽고 그런 거 빼면 완벽하고 예쁜 옷이네오,"완벽하다, 커서, 그렇다, 네오, 아쉽다, 빼다"
깔끔하고 이뻐요 길이감이 좀 잇어요 건조기에 돌려서 입어야 겠어요,"건조기, 길이, 돌리다, 잇다, 깔끔하다, 겠다"
남자친구 선물해줬는데 단독으로 입기도 좋고 반팔셔츠 안에 입어도 예뻤어요,"셔츠, 남자친구, 단독, 선물 해주다"
이쁨여 믿고 입는 브라운브레스가 잘 산거 같아요 요즘 잘 입고다니는 티입니더,"티, 브라운 브레스, 믿다"
배송도 빠르고 포장도 꼼해서 좋아요 전에 초록색도 사서 잊다가 좋아서 다른색으로 재구매해봤어요,"색, 초록색, 포장, 배송, 사서, 전, 재다 해봤다, 잊다"
사이즈 미스긴한데 오버핏 좋고 핏이그냥 잘나옴,"미스, 잘나오다, 사이즈, 오버핏, 핏이그"
옷의 통이 너무 넓어서 애매하지만 옷의 스타일은 만족이였어요,"애매하다, 스타일, 통, 만족, 넓다"
색깜도 예쁘고 브라운브레스 특유의 브랜드 로고가 엄청 예쁘네요,"브라운 브레스, 특유, 브랜드, 로고, 색깜"
시원하고 데일리로 좋아요 디자인도 괜찮고 딱 여름에 좋아요,"일리, 시원하다, 디자인, 여름"
데일리로 입기 편하고 통풍이 잘되어 시원합니다 ,"통풍, 시원하다, 편하다, 일리, 되어다"
아주 예쁘고 사이즈도 굿합니다 너무 좋아요 짜스,"사이즈, 짜스, 굿"
진짜 개이뻐요 이가격에 이런옷이 있다니 스투시랑 비슷해서 저같이 돈없어서 스투시 못사는 분한테 딱맞는 옷이에요,"스투시, 가격, 스 투시, 분, 살다, 맞다"
사이즈 프린팅 다 너무 이뻐요 딱 오버핏 사이즈고 아무 바지나 다 잘어울려서 잘입고 다닐게요 원래 이거 에이블리에서 사려고 했다가 무신사가 훨씬 싸서 여기에서 사요 ,"에이블리, 어울리다, 원래, 사가, 사이즈, 사이즈, 사"
어깨 가 조금 좁은편인데 어깨 기장이 넓지 않아서 좋아요 ,"좁다 편, 기장, 어깨, 넓다"
제질도 여름제질이라서 계절에 딱 맞춰져있고 무신사가 할인 쿠폰을 많이 줘서 부담없이 사서 입을수 있었음,"여름 질, 쿠폰, 질도, 주다, 사가, 사서, 할인, 부담"
딸아이가 골랐어요 편하게 잘입고있네요 번창하세요,"번창, 편하다, 딸아이, 고르다"
디자인 무난하고 가격 저렴합니다 재구매의사 있습니다 ,"저렴하다, 재다 의사, 디자인, 가격"
디자인도 맘에 들고 배송도 엄청 빨라요 사이즈도 잘 맞아서 너무 좋아요,"사이즈, 디자인, 배송, 빨르다, 맞다"
배송 와안전 빨랐어요 일요일에 시켯는데 화요일에 옴 생각보다 핏도 더 예뻐써요,"오다, 화요일, 일요일, 배송, 핏, 써다, 켯 늘다, 빨르다"
예뻐요 요즘 다 브라운브레스 닙고다니는데 그만큼그런이유가잇네요 ,"닙, 브라운 브레스, 이유 잇다"
오버핏 으로 잘입고 있어요 S사이즈 오버핏 좋아요,"사이즈, 오버핏"
마음에 듭니다 항상 구매하는 옷인데 이번에도 매우 만족합니다,"만족하다, 듭니, 항상"
프린팅이 마음에 들어서 샀는데 생각보다 기장이 기네요 그래도 만족하고 잘입고 있습니다 다음에는 미디움으로도 사야겠네요,"미디움, 만족하다, 들어서다, 기장, 프린팅"
진짜 너무너무 이뻐요 진쨔 강추요 재구매 많이 합니다 ,"강추, 재다, 진쨔"
많이 입는만큼 뻐요 아무데나 입기조음 아무바지랑 잘 어울림,"조음, 바지, 어울림"
길이는 긴데 통이 좀 작아서 아쉬웠어용 그래도 이뻐서 만족해용,"만족하다, 통, 작다, 길이, 아쉽다"
디자인하고 색감이 화면으로 볼때랑 똑같네요 너무 이뻐요,"디자인, 색감, 화면, 볼때, 똑같다"
재질이 부드럽고 편하고 배송 정말 빨랐어요 다음에 다른 제품도 구매할듯요,"부드럽다, 편하다, 배송, 재질, 제품, 빨르다"
원단도 좋고 맘에 들어요 비침이 있긴하지만 잘 입을게요 ,"비치다, 원단"
브라운브레스 티는 심플하지만 뒷면 로고가 넘 매력인 듯 예뻐용,"심플, 매력, 브라운 브레스, 로고, 티"
팔이 조금 길긴한데 얇아서 좋아요 마음에 들어요,"길다, 팔이, 얇다"
 교복마냥 맨날 입고 다님 근데 좀 비치는 건 있는데 너무 예쁨,"비치다, 교복 마냥"
굿샷입니다 추천드립니다 사이즈가 나쁘지않네요,"추천 드리다, 사이즈, 나쁘다, 굿샷입니"
아이오아리아우오어우야으이아우어우이아야,아이오 아리 아우 오어 아우 우이
브라운브레스 티셔츠 벌써 두번째 구매예요 소재가 좋아 흐들해지 않아 좋아요 ,"벌써, 티셔츠, 브라운 브레스, 흐들해, 소재, 두번째"
역시 깔끔한 느낌 어디에나 입기 좋은 것 같아요 좋습니다 ,깔끔하다
진짜 너무 이쁘고 아직까지 단점이라곤 하나도 못 봤어요 기장도 딱 좋아요,"단점, 기장, 하나"
기장도 너무 알맞고 핏도 이쁘게 잘나와요 기본템으로 딱 적당하고 흰색인데 비침도 없고 좋아요,"적당하다, 흰색, 기장, 잘나오다, 비치다, 핏"
고 아들 입는다고샀는데 깔끔하니 이뿌네요 잘입을게요,"아들, 이뿌다, 깔끔하다"
여자친구랑 커플티로 입으려고 샀는데 여자친구한테 너무 잘 맞고 생각보다 실물이 더 이쁘네오,"여자친구, 여자친구, 커플티, 실물, 네오, 맞다"
남자친구가 선물해줬는데 생각보다 크네여 내 몸이 작아서 그런가,"남자친구, 런가, 작다, 몸, 크다, 선물 해주다"
옷 너무 예쁘고 원단이 좋아서 오래오래 입을거같아요,"오래오래, 원단"
아무 옷에나 잘 어울려서 편하게 입고 다녀요 옷 두께도 얇은 편이어서 시원하게 입고 다녀요,"편, 어울리다, 시원하다, 편하다, 얇다, 두께"
처음에는너무비사다고생각햇는데막상입어보니돈값하는것같아요,처음 무비 햇 늘다 막상 입어보다 돈값
오버핏 느낌 좋아하시는 분들이랑 잘 맞을 것 같아요 ,"분, 맞다, 좋아하다, 오버핏"
사이즈는 오버핏이라 커요 깔끔한 화이트 디자인도 좋습니다 ,"크다, 디자인, 사이즈, 화이트, 오버핏, 깔끔하다"
옷 핏이 너무 좋고 길이도 적당하고 프린팅도 예뻐서 추천 드립니다 배송이 조금 느린것은 아쉽지만 그 외에는 다 완뵥합니다,"완뵥합니, 드리다, 적당하다, 배송, 추천, 길이, 프린팅, 핏"
프린트가 너무 이쁘고 배송도 빠르네요 살짝 큰 것 같아요,"프린트, 배송, 빠르다"
배송 너무 빠르고 좋아요 핏 넉합니다 마음에 들어여 ,"넉, 배송, 빠르다"
뒷면이 이쁜 티셔츠 너무 맘에 드네여 다른 컬러도 구매해보려고요,"컬러, 티셔츠"
올 여름 교복처릠 입고 다닐에정이에요 가격도 저렴하고 소재도 맘에 들어요 배송도 빨라서 좋아요 ,"정이, 교복 처릠, 저렴하다, 배송, 가격, 소재, 여름"
블랙이 있는데 너무 잘입고 다녀서 이번에 화이트로 구매해봤어요 역시 소재도 좋고 편하게 입을거 같아요,"편하다, 블랙, 소재, 화이트"
좋아하는 브랜드라서 구매합니다 살짝 크지만 잘 입을것 같아요,"크다, 브랜드, 좋아하다"
요즘 유행하는건지 많이들 입고 다니더라구요 두께감도 있고 디자인도 예쁘네요 가격이 약간 있기는 하지만 ,"유행 건지다, 디자인, 가격"
마른편이지만 박시하게 입을 수 있어 만족합니다 ,"마르다 편이, 만족하다, 박다"
블랙샀다가 이뻐서 화이트도 샀어요 왠만한 여성분들은 S하시면 될것 같아요,"화이트, 여성, 왠만하다, 블랙, 되다"
사이즈도 딱 맞고 옷은 이쁜데 세탁 몇 번 하니까 목이 늘어났네요,"사이즈, 목, 세탁, 맞다, 늘어나다"
옷 핏이 진짜 미쳤어요 살짝 크게 입을려고 사긴했는데 진짜 존예,"크게, 핏, 존예, 미치다"
저한테는 엉덩이 가리는 정도에 크기인데 오버핏 느낌으로 되오있어서 핏이 이뻐요 세탁했을대 변형은 없던거같아용,"엉덩이, 변형, 테, 크기, 가리다, 오버핏, 없다, 세탁"
배송 빠르고 색감도 이쁘고 반팔 살짝 접어서 입으면 이뻐용,"접다, 배송, 팔, 색감, 빠르다"
동생 선물로 줬는데 마음에 들어하네요 길이도 잘 맞아여 팔은 접어입는게 예쁠 것 같아여,"접다, 동생, 선물, 길이, 팔, 맞다"
s로 다세 사야될 것 같아요 저한텐 허벅지 반 조금 안되게 내려와요 팔을 팔꿈치 정도의 길이에요 디자인은 예쁜데 사이즈를 잘 못 골라서 그래도 예뻐요 아주아주 맘에 듭니당,"사이즈, 골, 디자인, 듭니당, 내려오다, 허벅지"
디자인도 완전 이쁘고 배송도 빨랐어요 완전 만족해여,"만족하다, 디자인, 배송, 빨르다"
디자인 너무 예쁘고 배송도 빨랐어요 완전 만족 그자체 ,"자체, 만족, 배송, 디자인, 빨르다"
원래 m사이즈인 저는 똑같이 m으로 시켰지만 매번 무신사에서 반팔을 살 때마다 s로 산다는 것을 까먹고 너무 크게 사버렸어효 하지만 이쁘네용 ,"사이즈, 사, 원래, 산다, 팔"
약간 크긴 하지만 넘 이쁘네요 아이가 이뻐 하네요 서프라이즈 선물 완전 좋아요 ,"서프라이즈, 크다, 선물"
살짝 크긴한데 재질도좋고이뻐요 잘입을께요,"크다, 재질"
배송이 빨리와서 좋았고 생각했던데로 였습니다,"배송, 오다"
핏 예쁘고 원단도 좋아요 휘뚤마뚤 입기 땃 좋은 옷임 ,"원단, 휘뚤마뚤, 옷임"
너무 예쁘고 배송도좋았어요 사이즈가 L인데 살짝 큰느낌이있었어요,"사이즈, 배송, 크다"
크게 입으려고 큰 사이즈샀는데 역시 쌈 뻥함 옷 재질도 좋아서 브라운브레스 요즘들어 구매를 자주 하는 중 ,"브라운 브레스, 크게, 재질, 사이즈"
배송도 빠르고 색도 완전 검은색어서 좋고 세탁후 변형도 없습니다,"변형도, 검은색, 배송, 세탁 후, 색도, 없다, 빠르다"
친구 생일 선물로 사줬는데 깔끔하고 좋네요 만족합니다,"만족하다, 생일, 선물, 친구, 사주다, 깔끔하다"
얇은 흰티인데 생각보다 안비치고 프린팅 선명해서 좋아요 다른 반팔보다 도 좀 더 시원함,"선명하다, 프린팅, 안비, 희다 티, 팔, 시원하다, 얇다"
디자인도 무난하고 휘뚜루 마뚜루로 입기 좋아서 자주 입어요,"디자인, 휘뚜루, 마뚜루"
여자한테는 S도 살짝 크지만 프린팅도 예쁘고 선명해서 자주 입을 거 같습니다 ,"선명하다, 프린팅, 여자 늘다, 크다"
깔끔한 스타일이예요 화이트라 청바지든 면바지든 스타일링 하기 편해요,"청바지, 바지, 스타 일링, 화이트, 편하다, 스타일, 깔끔하다"
여름티셔츠 깔끔하게 입고싶어 구매합니다 무게 여름티셔츠 무게여 면이라 보들보들 합니다 M사이즈 공용이라 넉합니다 청바지랑 잘입어 지며 그냥 입기 좋아요 ,"여름 티셔츠, 넉, 사이즈, 공용, 청바지, 무게"
가성비 좋고 예뻐요 다른 색상도 구매원함 좋아요,"원함, 색상, 가성비"
배송빠르고 선물로 여러가지 구입했는데 할인할 때 잘샀네요,"여러가지, 선물, 할인, 배송 빠르다"
기본티셔츠가 필요해서 주문했습니다 잘 입고 다녀요,"티셔츠, 필요하다, 주문"
제가 원하는 딱 오버핏 티 였어요 디자인도 무난해서 좋아용,"원하다, 디자인, 오버핏"
화면과 비슷해요 편하게 입기 좋아요 예뻐요 또 구매할께요 ,"화면, 편하다"
아들이 마음에 든다고 합니다 사이즈도 잘 맞습니다 ,"사이즈, 아들, 맞다"
흰색이 더 많이사구 더이쁜것같아서 삿는데 핏이랑 너무 이뻐서 놀랐어여 검정으로 또사고싶네용,"흰색, 검정, 핏, 삿는데, 사구, 사고 싶다"
가격도 너무 저렴하고 새탁해도 그대로고 목안늘어나고 너무 깔끔하구이뻐영,"목 늘어나다, 가격, 저렴하다, 그대, 새 탁하다, 깔끔하다"
옷이 조금은 길지만 이쁘게 떨어져서 커도 이뻐여 그리고 뒤에가 진짜 끝장납니다 꼭 구매해보세여,"길, 크다, 떨어지다"
진짜 대박 완전 좋습니다 진짜 대박 완전 좋습니다 ,대박
좀 크고 길긴한데 느무나무느무너무 이쁩니당용 ,"느무 물다 무, 크다, 길다, 니당다"
입고시퍼서 시켰어요 굿 대박적대박적 놀라움,대박 대박
제일 좋아서 자주 꺼내입게 되는 아이템 뒷판이 너무 매력적 자꾸 뒤만 보여주고 싶어요,"매력, 보여주다, 제일, 아이템, 자꾸, 싶다, 판이, 뒤"
좋노 예쁘노 색감 좋노 편하노 시원하노 재질 좋노,"시원하다, 색감, 편하다, 재질"
안이 좀 비치긴 하지만 일단 너무 예뻐서 자주 입고 다닐 거 같아요,"비치다, 안이"
배송 진짜 빨라서 놀랐어요 안이 조금 비치긴 했지만 그래도 좋아요,"배송, 비치다, 안이"
옷 재질도 좋고 잘 늘어지 않아서 좋아요 길이도 길어서 오버핏으로 입고 다니기 좋아요,"늘어지다, 재질, 길이, 오버핏"
소매는 조금 두껍고 디자인은 깔꿉하고 좋았어요,"디자인, 소매, 두껍다, 깔다 꾸다"
일부러 오버핏으로 입으려고 크게샀는데 맘에 들어요 근데 천이 좀 얇은건지 늘어짐이 좀 있네요,"늘어지다, 일부러, 천이, 크게, 오버핏"
여름옷인데 너무 얇지 않고 어느정도 두께감이 있어서 더 좋은거 같아요 화이트라 그런지 어떤바지랑도 잘 어울려서 좋아요 가격이 좀 올라서 속상하네요 ,"어울리다, 속상하다, 그렇다, 올라서다, 가격, 화이트, 여름, 바지"
검정색이 맘에 들어 화이트 구매 매번 손빨래 해야 하는 번거로움이 있지만 옷이 깔끔하고 예뻐요 ,"검정색, 번거롭다, 화이트"
검정색 구매 후 맘에 들어 화이트 재 구매했어요 예뻐요,"검정색, 화이트"
배송 엄청 빠르네여 남자칭구가 등치가 큰데 잘 맞네여 세일할때 사서 꿀 ,"남 자칭 구가, 치가, 배송, 사서, 크다, 일, 빠르다, 맞다"
너무 예뻐용 반팔은 브라운브레스가 제일 짱하고 좋은거같아요 ,"브라운 브레스, 팔, 제일, 짱하다"
목이 좁아서 좀 늘어나요 근데 세일할 때 사서 만족하면서 입고 있습니다,"만족하다, 좁다, 일, 목, 사서, 늘어나다"
완전 그냥 저 스타잋 진짜 다 입으세여 너무 이뻐여 진짜 제 최애옷,"최애, 스타 잋, 그냥"
제 키 기준 엉덩이를 다 덮는 기장이네요 기본티로 잘 입을 것 같습니다 ,"엉덩이, 기장, 티, 기준, 덮다"
역시는 역시 탄하고 예뿌네요 가성비있게 잘 샀어요,"탄하, 가성비, 뿌"
이쁩니다 뒤에 브라운브레스 로고 크게 있는게 특히 예쁜것 같아용 ,"브라운 브레스, 크게, 로고, 뒤"
속옷이 조금 비치긴 하는데 이쁘니까 대만족입니다,"만족, 비치다, 속옷"
잘입고있습니다 무신사에서 주문한 옷은 다 성이입니다,"이입, 사, 주문"
제 핏에 딱 맞고 프린팅도 이쁘게 잘 나와서 좋아요,"프린팅, 나오다, 핏, 맞다"
