Star,Review
4.0,요즘 진짜 거의 교복처럼 입고 다녀요!! xl 클 줄 알았는데 딱 원하는 핏이라서 좋았습니다!!(오버핏 좋아하는 사람임) 그치만... 손세탁하고 나니 앞 쪽에 흰색 실도 아니고 보풀도 아닌 것이 있어서 좀... 그랬지만 그래도 좋아용
5.0,너무 만족하며 입고있습니다. 아디다스 져지는 믿고 사는거지만 핏이 일단 너무 예쁘고 표기상의 기장은 길게 나와있지만 지퍼를 잠구면 시보리가 있어서 기장이 줄어들어요 너무 예쁘고 후회 안합니다!
5.0,약간 벙벙하누정도로 딱좋어요 완전 오버핏은 아니어서 한사이즈 커도 괜찮었을거 같어요
5.0,길이가 길긴하지만 접어 입거나 하면 괜찮습니다
5.0,어깨가 좀 있는 편인데 딱 맞습니다 기장이 길긴한데 접어 입으면 좋아요
5.0,지금 착용하기좋아요 재질도 부드럽고 배송도 빨라서 좋아요
4.0,배송이 빨라서 좋어요 사이즈도 만족합니다  색감이 사진과 똑같아요
5.0,"예쁘게 맞아요~~ 고등학생 아들~등치가 있어서 더 커보이면 어떡하나 고민했는데 후드집업,바람막이보다 더 잘 입을거 같아요~~"
5.0,살짝 여유있게 맞아요~ 카고 바지와 딱 떨어지게 예쁩니다. 고딩 아들~아무대나 편하게 잘 어울려요^^
5.0,배송 빨랐고 입기 너무 편해요 디자인도 너무 이쁘고 편의점 갈때 입기 딱 좋을꺼같아요 잘입을께요
5.0,너무 예뻐요 핏도 좋고 활동하기 편합니다 다음에 또 구매할 거 같아요
5.0,옷 이뻐요 기본템이 되어버렸습니다 봄에 스타일한번 뽐내보세여
5.0,예전에 입던 져지보다 좀더 트렌디하게 나온핏이에요 추천합니다
5.0,시보리가 각을 잘 잡아줘서 예쁘게 잘 떨어집니다.
5.0,오랜만에 져지 샀는데 요즘 유행하는 스타일이라 이쁘네요
5.0,여자친구랑 같이 커플티로 맞추었는데 확실히 이뻐요
5.0,아들래미 구매해줬는데 맘에들어합니다~ 누구나 하나씩은 있는듯~ㅎㅎ
5.0,색감이쁘고 배송도 빨리오고 이쁘네용  사이즈 2xl밖에 없어서 시켰는데 좀 크긴하네요 오버핏좋아해서 만족합니당 이뻐요
5.0,너무 예쁘고 입는순간 힙해지고 무슨 바지에든 잘어울려요
5.0,배송 엄청 빨랐어요 1~2일? 걸렸어요 믿고 입는 트랙탑 역시나 예뻤습니다 코디할 방안도 무궁무진 하고 꾸안꾸로 입기도 좋고 범용성이 너무 좋아요 한사이즈 업해서 입으니까 후리하게 입기 너무 좋아요 힙한 무드를 연출하고 싶으시몀 무조건 한사이즈 업 추천해요 후기만 봤을때 핏하게 입으시려는 분들이 많아서 그런지 제가 생각한 거 보다 사이즈가 막 크지는 않았어용
5.0,휘뚜루마뚜루로 입고 꾸안꾸로 편하게 힙하게 입고 싶을때 입으려고 구매했습니당. 넉넉하게 입는 걸 좋아해서 xl시켰어용 원래는 L입습니다 상체 프레임이 체급에 비해 있으신분들은 저처럼 한사이즈 업 강추 합니다.
5.0,요즘 유행해서 너무 잘산거 같고 그냥 이쁘니깐 꼭 사세요 ㅎㅎ
4.0,옷이 너무 이뻐요 요즘 유행이라는데 잘입을께요
4.0,생각보다 얇아서 봄에 입으면 맞을거같고 사이즈는 딱맞아서 입기 좋았습니다.
5.0,할인쿠폰 팍팍써서 한 8만원에 구매했는데 매우매우 대만족중입니다ㅎㅎ 하자있는곳 없이 깔끔하게 와서 누무 기분이 좋아요😍😍
5.0,일단 배송이 압도적으로 빨라요. 일요일에 시켰는데 월요일에 도착했습니다. 그리고 저랑 신체 사이즈가 비슷하면 xl추처네
5.0,"10년 전에 입던 거 생각나서 다시 샀는데 요즘 다시 유행 도나 봄 길 가는데 중고등학생들 다 입고 다녀서 갑자기 입기 좀 그르네^^,,, 그냥저냥 입을만 합니다~"
5.0,딱 기장이 적당해요 살짝 얇은 감이 없잖아 있어요
5.0,덩치가 있는편인데 사이즈 넉넉히 맞고 편해서 좋아여! 예쁘게 입을수 있어서 마음에 듭니다^^
5.0,핏좋은데 사이즈가 좀 크게나와서 배쪽이 접히네요 그래도 기본템으로 하나는 꼭 장만해야할 제품입니다
5.0,근근본본 아디다스 져지 잠깐씩 나갈 때 입기 좋고 편함
5.0,휘뚜루마뚜루 막 입고다니기 좋아요 핏도 아주 좋습니다 
5.0,두사이즈업해서 오버사이즈로 입으면 좋움 2만원 매장보다 싸게삼
5.0,상체가 좀 기본적으로 커서 사이즈 고민 많이 했는데 기장 빼고는 다 맘에 드네요 넘 예뻐요 
5.0,착용감도 좋고 디자인도 이뻐요! 근데 좀 얇긴 해요
5.0,사이즈 진짜 커요 색감도 비슷하고 디자인도 만족합니당 급한 일 때문에 서둘러 주문했는데 배송 시작 하루만에 도착했어요
5.0,생각보다 얇긴한데 휘뚜루마뚜루 입기 편할 것 같앙요 백수룩에 또 한가지 더 추가했습니다 희희
5.0,역시 믿고 입는 아디다스입니다. 다른 브랜드의 트랙탑도 입어봤지만 결국 아디다스로 돌아오네요..
5.0,슬슬 날이 풀리는 요즘에 입기 좋아요! 너무 두껍지도 얇지도 않아서 딱입니다
5.0,입었을 때 편하고 시보리가 굉장히 짱짱해서 좋았습니다
5.0,정말 편하고 생각보다 옷이 많이 가벼웠던거 같아요
5.0,세탁 후 변형도 없고 배송도 빨리 되었어요. 공부하러 갈 때 아무렇게나 입어도 편하고 재질에 예민한 편인데 손목이나 목 뒤에 거슬리는 것도 없어서 매일 입네요.
5.0,넘 편하고 생각보다 따듯해요 지금 은 낮에 입기 좋고 위에 패딩입기도 편햐요
4.0,적당히 오버핏이라 입기 편하고 데일리로 무난함
5.0,한 사이즈 크게 시켜서 팔이랑 밑단은 좀 길었긴 했는데 딱 정당히 이뻐서 괜찮았어요 건조기 돌렸는데 안 줄어듬 좋아요 :3
5.0,품절 되기전에 사길 너무 잘 한거 같네요 너무 예쁘고 여러 바지랑 매칭하기 좋아서 유용하게 입고 여름에도 잘 입을거 같습니다 ~!
5.0,바지랑 매칭하기 너무 좋은 옷이라서 아주 만족합니다 !
5.0,한번 사고 싶었는데 품절 되기전에 잘 산거 같습니다 어떤 바지랑 다 잘 어울려서 만족합니다
5.0,지금 날씨에 입기  좋습니다 재질도 찰랑찰랑 시원하고 가벼워서 막 입기 좋네요 ㅎㅎ
5.0,예약발송이라 늦을 줄 알았는데 .. 이틀?정도 만에 받았네요  배송 엄청 빨라서 좋았습니다 !! 기본템으로 짱짱
5.0,요즘같이 봄이 다가오는 날씨에 이거하나 입고나가면 ㅁ좋아요
5.0,진짜 겁나 이쁩니다 청바지에 하나 툭 걸치면 그냥 바로 코디 완성
5.0,너무너무 사고싶었던 상품이라 품절된 사이즈 재입고 알림 뜨자마자 구입했어요~~~ 덩치가 좀 있는데 사이즈 잘 맞아요. 너무예쁘고 핏도 맘에들어요!!
5.0,옷이 시보리가 짱짱해서 옷 모양잡기가 쉬워요 옷 이쁘긴해요
5.0,져지 유행해서 샀는데 핏이 너무 이쁘네요 자주입습니다
5.0,요즘 져지 유행해서 샀는데 핏이 진짜 잘나와서 이쁘네요
5.0,좋ㅇ아융 제 키랑 비슷하신분들중에 오버핏 원하시먼 이사이즈로 사시면 될거깉아오
4.0,제품 배송 좋구요 광고 한대로 좋습니다. 요즘 간절기에도 입기 좋아요 색감도 선명하네요
5.0,사이즈 넉넉해서 접어 입으면 엄청 예뻐요 역시 파이어버드
5.0,배송이 하루만에 와서 좋아요 핏도 생각한거랑 딱 맞아서 조아요
5.0,애들한테 인기인가봐요. 너무많이 입네요. 딸아이 구매해줬습니다. 예쁩니다
5.0,진짜 너무 저스트 핏이에요 너무좋음 세탁해도 변형없네여 이뻐요
5.0,세일 맞춰서 저렴하게 잘샀습니다 가성비 좋고 만족합니다
5.0,핏도 오버핏으로 너무 마음에 들고 너무 예뻐서 잘 입을거같아요
5.0,아디다스 져지 입고 싶어서 구매했는데 핏감이 너무 만족스러워요
5.0,짱짱하니 여윽시 아디다스 대충 나갈때마다 주서 입기 좋아요 느낌도 민들맨들 하니 부드러워서 좋습니당
5.0,얇아서 봄여름에 입기 좋을듯합니다 아주 좋습니다.
4.0,사이즈 조견표보니 좀 크겠다 했는데 생각보다 정핏이구요 많이 얇네요
4.0,사이즈가 생각보단 크지않아요 그리고 많이 얇네요
5.0,오예 와이투퀘이 나이스 느낌 쏘 굿 너무너무 예뻐요
5.0,배송도 빠르고 굿입니다 사이즈도 잘 맞아요 옷이 넘 이쁩니다
4.0,역시 믿고보는 아디다스 져지 좋은거 같습니다 아주
5.0,저지의 재질이 아주 부드럽고 두께감도 투박하지 않고 좋아요. 사이즈는 2xl 구입했다가 xl 교환했는데 아주 핏 이쁘게 맞아요.  아주아주 맘에 듭니다. 
5.0,너무 빠른 배송 감사드립니다 옷도 너무 이쁘고 편해요
5.0,"아디다스 져지 살까 말까 고민하다가 사게되었습니당💕 아디다스 져지 살까 말까 고민하시는 분 계신다면 꼭꼭 주문하시길 바랍니당. 일단 파이어버드 너무 이쁘고요 L 사이즈 딱입니다! 맨날맨날 학교갈때,놀러갈때 등 맨날 입고다녀요 진짜 장담합니다 진짜너무이뻐요🙏🙏 학교가면 애들이 다 아디다스 져지입고있어요 ㅋㅋ 그만큼 이쁘고 인기많다는거겠죵?ㅎㅎ "
5.0,"아디다스 져지 살까 말까 고민하다가 사게되었습니당💕 아디다스 져지 살까 말까 고민하시는 분 계신다면 꼭꼭 주문하시길 바랍니당. 일단 파이어버드 너무 이쁘고요 L 사이즈 딱입니다! 맨날맨날 학교갈때,놀러갈때 등 맨날 입고다녀요 진짜 장담합니다 진짜너무이뻐요🙏🙏 교복위에 입어도 이뻐서 학교가면 애들이 다 아디다스 져지입고있어요 ㅋㅋ 그만큼 이쁘고 인기많다는거겠죵?ㅎㅎ "
5.0,아디다스 트랙수트는 진리죠~ 교복템으로 잘입고 있어요
4.0,무난해서 손도 잘가고 편해용 ! 자주 입어질 것같아요
5.0,무난하게입기 좋고 생각보다 사이즈가 작은거같아요
4.0,크기도 적당하고 편안히 입기좋아요. 얇은. 옷이라 봄철에 입기좋아요
5.0,색감도 예쁘고 올검이라 무난하니 좋네요 추천합니다
5.0,마지막으로 운 좋게 구매 했는데 너무 예뻐요 진짜 ㅜㅜ
5.0,역시 아디다스 제 스펙은 이걸로 가세용 탄력 마감 다 굿
5.0,무난하게 매일 입고 있어요 이쁘네요 주머니 지퍼도 있어서 편해요
5.0,립이 많이 조인다는 후기가 많았는데 생각보다 그렇게 조이진 않더라고요? 적당히 탄력감 있어서 마음에 들었습니다. 우븐 재질로 된 트랙탑을 오버사이즈로 입어서 이번 재킷은 적당한 사이즈로 골랐어요. 오버핏도 예쁘지만 이 자켓은 정핏으로 입는 게 조금 더 예쁜 것 같네요.
5.0,배송도 빠르고 아이한테 살짝 크지만 무난하게 잘 어울려요. 
5.0,L이 품절이라 한치수 크게 샀는데 고딩아이한테 살짝 끈듯 잘 맞네요. 배송도 빠르고 휘뚜루마뚜르 입기 좋을것 같습니다.
4.0,편안하게. 입기 좋아요~ 학교갈때 운동할때 간편히 입고 나걀수 있어 좋아요
4.0,스테디인 이유가 있네요ㅎㅎ 짱짱해서 입기 편합니다!
5.0,재질도 부드럽고 배송도 빠르고 편하게 입고 다니기 좋아요
5.0,사이즈 고민 많았는데 적당히 오버핏으로 잘맞네요 ~완전 오버핏으로 갈라면 무조건 사이즈 업하세요~
5.0,사이즈는 작지도 않고 좋은데 시보리가 짱짱해서 지퍼 올리면 조금 딸려 올라오는 부분이 있네요~ 이건 더 커도 이럴거 같고 아무튼 이뻐요
5.0,옛 기억에 다시 사봤는데 역시나 이쁘네요 잘입을게요!!
5.0,사이즈가 생각보다 커서 딱 맞게 입으시면 이뻐요
5.0,아디다스 요줌 더시 유행해서 샀는게 크롭하게 입으니까 너무 이쁘네용
5.0,립이 많이 조인다는 후기가 많았는데 생각보다 그렇게 조이진 않더라고요? 적당히 탄력감 있어서 마음에 들었습니다. 우븐 재질로 된 트랙탑을 오버사이즈로 입어서 이번 재킷은 적당한 사이즈로 골랐어요. 오버핏도 예쁘지만  이 자켓은 정핏으로 입는 게 조금 더 예쁜 것 같네요.
5.0,생각한 대로 오버핏에 기장도 적당해서 마음에 들었어요!
5.0,"170 후반부터는 2XL가 맞는고 같습니다  가격도 쿠폰 맥여서 9만원에 야무지게 샀고 원단, 기장, 두께감 전부 맘에 들어요."
5.0,예상보다 팔 길이가 길었지만 배송도 빠르고 전체적으로 마음에 듭니다.
5.0,사이즈 잘 선택해서 구매한거 같아여 짱짱하고 좋아요
5.0,근본이라 크게 말할건 없지만 배송이 진짜 빨라요
5.0,맨날입어요 ㄹㅇ 저지 불편해서 잘 안입는디 얘는 짱 편해요
5.0,너무 예쁘고 오버핏으로 사서 더 편하게 입을 수 있어서 좋아요  꾸안꾸 느낌 ! 유행 지나도 가볍게 입을 수 있을꺼 같네요 ◡̈ ♥ 
5.0,우리가 흔히 아는 아디다스 기본템!! 여자친구 선물로 줬더니 아주 좋아하네용
5.0,사이즈는 정사이즈인 것 같고 아디다스 트랙탑은 근본템🥷🏿
5.0,여성용은 크롭처런 짧은 데에 비해서 길이도 길고 오히려 더 편합니다.
4.0,옷도 이쁘고 길이도 적당해서 봄이나 가을에 히뚜루마뚜루 입기좋은듯
5.0,핏 존예입니덩~~ 흫흫ㅎ 존예 낡으면 또 살거에요 잘입고다니겠음
5.0,요즘 유행하는 아디다스 져지라서 많이 입을거같고  너무 이뻐서 좋게 잘 산것같습니다
5.0,근본 아디다스 져지! 파이어버드가 다른 져지보다 핏이 예쁜거 같네요
5.0,L사이즈 시켰다 살짝 작은느낌이 있어서 XL로 무료교환받았습니다! 져지 처음사보는데 엄청 이쁘네요
5.0,고등학생 딸아이가 입어요 172키에 53키로 루즈하게 입기위해 큰사이즈 샀어요 이쁘다고 합니다  교복위에 잘입네요 
5.0,루즈하게 입기위해 구매했어요 재질은 일반 아디다스 져지구요  편안하게 잘 맞아요
5.0,고등학생 딸아이가 사달래서 주문했어요 172키에 53키로입니다  파이어버드는 학생들 전용 져지인듯 합니다  교복위에 걸치는 용 아이템인듯 합니다  루즈하게 입어야한다며 XL를 사달라더군요 핏은 사진에서 보시면 알겁니다  요즘애들이렇게 입는걸좋아하는것 같아요 재질은 져지이고 얇아요
4.0,트렌디한 트랙탑.. 운동갈 때도 입고 외출할 때도 입고 만능이어서너무 좋네요
5.0,오버핏으로 입고 싶어서 라지로 교환했고 아래 시보리가 짱짱해서 크롭핏되고 좋습니다 ㅎㅎ 여유있는핏이라 불편하지 않아요
5.0,핏이 화면 그대로여서 좋아요. 색감도 화면 그대로여서 좋아요. 배송이 너무 빨라서 좋아요.
5.0,파이어버드는 재발매 할 때마다 조금씩 핏이 바뀌는거 같네요 원래 좀 크게 나온거 같아 s사이즈였으면 더 좋았겠지만 m 사이즈도 살짝 오버핏으로 잘 맞습니다 밑단 시보리가 짱짱하게 잘 잡아주어서 예전 파이어버드보단 훨씬 좋네요
5.0,오랜만에 사는 져지인데 역시나 너무 예뻐요 사이즈가 큰거밖에 없었지만 뭐 커서 문제될 건 없으니까요~ 박시하게 잘 입겠습니당
5.0,생각보다 따뜻해요 기장은 엉덩이 덮는데 시보리 짱짱해서 골반에 걸쳐입어요 팔기장이 길어서 더 예뻐요! 
5.0,배송도 괜찮았고 아디다스 져지 너무 갖고 싶어서 주문했는데 너무 예뻤어요 밑에 밴딩이 완전 짱짱하긴 하지만 너무 이뻐요
5.0,매장에서 입어보고 구매한건데 적당히 엉덩이 덮고 오버라서 딱 마음에 들어요 지퍼 닫아도 열어도 좋고 요새 날씨엔 히트텍 하나 입고 이거 입고 패딩이나 자켓 입으면 딱입니다 다른 바지에 코디해도 굿 !
5.0,배송이 빨라서 좋았아요 라지하려다 사이즈 사이즈 없어서 강제 엑라했는데 딱 좋네오
5.0,걍 4계절 내내 입기 좋은 옷 깔끔하고 유행 안타서 하나정돈 사면 좋을것같아요쿠폰써서 싸게 샀어요 
5.0,팔부분이랑 기장이 좀 길긴 한데 시보리 때문에 기장은 괜찮고 팔은 접어서 입으면 되서 예뻐요
5.0,진짜 잘 샀음!! 아디다스 유행해서 너무 좋고 저 진짜 뚱뚱한 편인데 큼 겁나 크게 나온거 같음 교복위에 오버핏하게 딱 올라와서 너무 이쁘고 생각보다 부드럽구 얇릅!!
5.0,키큰 통통이 분들에겐 xl 이 딱입니당 시보리 짱짠하고 좋아요~~~
5.0,헐렁하게 입고 싶어서 xl 샀는데 시보리도 짱짱하고 적당합니다! 
5.0,생각보다 얇더라구요! 기본템이라 무난해서 좋아요
5.0,제가 어깨 52 정도인데 2XL로 하니 적당히 오버핏으로 나와서 활용하기도 좋을 것 같네요! 날이 더 풀리면 맛깔난 코디들 시도해보겠습니다~ 봄 맞이 쿠폰을 적용하여 10만원 극초반에 구매했어요 ㅎㅎ
5.0,175 75 운동한체형입니다 너무이뻐요 잘입어야지
5.0,아디다스 파이어버드 트랙탑은 말해 뭐합니까 당장 사세요
5.0,밑단 시보리가 짱짱해서 살짝 배가 불룩 튀어나오는데 아예 시보리를 접으면 해결할 수 있습니다 굳이 그러지 않아도 예쁘긴 합니다 휘뚜루마뚜루 입기 좋습니다 저와 비슷한 스펙이신 분들은 xl가신다면 안에 얇은 후드와 같이 입어도 넉넉할거 같습니다
5.0,살짝 오버핏으로 입고 싶어서 샀는데 만족스러워오
5.0,유행이 돌고돌아 다시 사게 되네요 영원한 클래식입니다 
5.0,생각했던것보다 이쁘지만 좀 얇음 간절기에 입으면 딱일듯
5.0,봄 맞이 할인 쿠폰으로 조금 더 낮춰서 구매할 수 있었어요 ㅎㅎ
5.0,정전기가 좀 일어나긴 하지만 무난한 기본템으로 괜찮네요
4.0,좀 비싸긴한뎅 그래도 완전 예뻐용 핏이 완전 굿굿
5.0,스타일 예상한대로고 칼라도 기본이라 오래 입을수 있을것 같아요
5.0,배송도 빠르고 가격도 좋아서 만족합니다!! 정사이즈보다 한치수 크게 추천드립니다.
5.0,정사이즈보다 한치수 크게 주문했는데 완전 마음에 듭니다!!
5.0,편하게 입기 좋고 마음에 드네요 바지도 같이 구입해야겠어요
5.0,"크긴 한데 생각보다 못 입을 정도로 크진 않아요! 기장도 잘 잡혀서 팔이 살짝 긴 정도예요 s, m 재입고가 느려서 l 샀는데 만족해요!"
5.0,사이즈가 조금 크긴하지만 지퍼 잠그면 딱 적당해요!
5.0,호불호 없이 편하게 입을 수 있을꺼같아요 한 사이즈 큰 게 좋은거 같아요
5.0,배송 빠르고 예뻐서 마음에 들어 너무 잘입는중입니다
5.0,딱 제가 원했던 핏이었어요! 배송도 엄청 빨리와서 좋았어요
5.0,배송빠르고 무난하게 입기좋고 저렴한가격에 득템 
5.0,한사이즈 업해서 샀는데 바람막이나 후드 레이어드 하기 좋아요
5.0,오버한 트랙탑 찾으면 무조건 강추합니다 한사이즈 업하는게 이뻐요
5.0,원하는 핏으로 딱 맞습니다 아주 맘에 들어서 자주 입고 다닙니다
5.0,아디다스 대표 상품~학교갈때 교복위에 잘입고있습니다
5.0,라지 사이즈 없어서 엑스라지로 샀는데 오버핏으로 한 사이즈 크게 산 것도 좋어요
5.0,본대로 시보리가 매우 강한편임 그래도 넉넉해서 괜찮
5.0,남자친구 사줬는데 배송 정말 빠르게 왔어요! 기모 안감이지만 얇고 하체 두꺼운 분들은 잠그면 조금 타이트하지만 지퍼 내리면 너무 예뻐요!
5.0,핏이 딱 원하던 오버핏이어서 좋았어요! 디자인은 말할것도 없고 배송이 빨라서 좋았어요
5.0,널럴한게 가볍게 걸쳐입기 좋아요 잘 구매했습니다
5.0,옷이 너무 예뻐요 그리고 배송도 빨라서 마음에 들어요
5.0,너무 예뻐요 그리고 배송도 빨라서 마음에 들어요
5.0,핏이 딱 좋아서 어디든지 휘뚜루마뚜루 입기 좋아요 역시 아디다스 저지 유행템
5.0,아디다스 트랙탑 갖고 싶었는데 사게 되어 너무 기쁩니다. 배송은 예상과 달리 정말 빨리 왔어요. 입어보니 옷이 정말 널널하고 오버사이즈로 잘 입을 수 있겠더라고요. 무조건 크게 입는 걸 추천합니다. 그리고 입었을 때 약간 따뜻하긴 합니다.
5.0,날씨 풀리고 있어서 구매했는데 완전 국밥템이라 만족스러워요ㅎㅎ
5.0,아디다스 너무 이뻐요!! 핏도 딱이고 봄에도 입기 좋을 것 같아요!
5.0,무난무난한 트랙탑 사고싶어서 샀는데 매우 만족합니다 !!
5.0,이뻐요 한사이즈 더 컸으면 좋을 것 같아요 시보리가 세서 접어입어야돼요
5.0,사이즈도 딱 원하는 정도고 역시 너무 이쁜것 같아요!
5.0,상품 들어오자마자 샀습니다. 한사이즈 작게 샀으면 클날뻔 했네요
5.0,배송도빠른편이고 요새 세일을많이해서 좋아여ㅎㅎ이쁘게잘입을게여
5.0,어깨가 큰편인데도 xl사이즈가 너무너무 풍덩할정도로 남아서 사이즈 교환해서 l사이즈로 받았습니다. 옷감이 맨들맨들하고 마감 깔끔하게 되어있습니다. 할인쿠폰 사용해서 합리적으로 잘 산것같고 잘 입고다닐 것 같습니다. 아우터 110~105 입으시는분들 오버핏 입으실거 아니면 L사이즈로 주문하는게 좋을 것 같습니다.
4.0,배송도빠르고길이도품도적당하네요~ 무신사로주문하세요
5.0,생각했던것보단 얇았고 가볍게 아우터로 걸치기 좋아서 자주 입을 것 같아요
5.0,얇고 핏이 여리여리하게 질 나와요 예쁩니다 자주입을것같어요
4.0,한사이즈 작게 샀으면 진짜 딱이었을 거 같아서 좀 아쉽긴 하지만 역시 이뻐오
5.0,생각보다 큰 지라 여유 있게 입으실려면 한 사이즈 업 하셔요
5.0,며칠전부터 갑자기 아디다서져지가 이쁘다는생각이 들었는데 너무맘에들어요
5.0,남아있는 사이즈에서 L이 없어서 XL로 구매했습니다 클까봐 걱정했는데 ㄴㄴ 딱 오버사이즈로 입기 좋습니다 사이즈가 커서 시보리 쪼임이 안돼서 아쉽지만 이뿌니 상관 ㄴㄴ 두께는 얇아서 겨울에는 좀 춥고 봄에 이뿌게 잘 입을게여 배송 빠르고 좋음 굿
5.0,배송도 빠르게 잘 왔고 사이즈 L XL 중에 고민 엄청 했는데 XL로 하길 잘 한거 같아요!! 살짝 크긴 한데 안에 후드티 입고 입으면 완전 딱이예요!
4.0,생각보다 딱맞는데 기장감이 있어서 원래 사이즈로 사시면 될듯해요
5.0,아디다스 매장에 재고가 없었는데  애정하는 무신사에 원하는 색상과 사이즈가 있어서 구입해서 아주 잘 입고 있습니다
5.0,다시유행한다네요 아들이 좋아합니다. 이쁘다네요^^
5.0,바자다가사아라하나마카타차파휴라으누뮤뷰구쥬쇼게오허래녀모뇨
4.0,예쁘고 입기 편한데 조금 얇아요 그래도 봄에 입기 좋을것 같아요
5.0,생각보다 시보리가 강해요 그래도 핏 이뻐요 추천합니다 
4.0,예뻐요근데시보리가작을줄알았는데역시나작아요
5.0,너무너무 이쁘고 너무너무 사랑스러운 아디다스 ㅠㅠ 
5.0,제품이 퀄리티도 좋고 핏도 맘에 드네요 사길 잘했어요
5.0,생각한 것보다는 얇았는데 되게 이뻐요 자주 입을듯
5.0,디자인 마음에 들고 색감도 화면이랑 비슷합니다!
5.0,"안감이 기모로 되어있어 조금 더울 수도 있을거라 생각했는데, 바람이 잘 통하고 얇아서 시원하고 좋았습니다."
5.0,인기많은 이유가 있어요 이쁘네요 잘입고다니는중
5.0,져지 한 번 입어보고싶어서 샀는데 대만족입니다 집앞 나갈 때나 그냥 편하게 입고 데님바지나 카고바지 입어주면 꾸안꾸 쌉가능이엥요
5.0,시보리가 짱짱하고 예전 감성 그대로네요 빨리 날 따뜻해져서 이것만 입고 나가고싶어요 ㅎ
5.0,너무이쁘고 좋아요!! 소재도좋고 너무너무 이쁜거같아요!
5.0,사이즈는 오버사이즈로 입고 싶으면 XL이나 L 추천 배송도 빠르고 좋아요
5.0,제껀 아니고 선물 주려고 샀는데 그냥 우리가 알던 저지랑 똑같아요 유행해서 놀랐네요 d=(´▽｀)=bჱ̒ ｰ̀֊ｰ́ ) 예뻐요
5.0,편하고 좋아요! 가볍고 여기저기 입기 좋을 것 같아요
5.0,잘 맞고 좋아요! 배송도 빠르고 좋았습니다 만족해요
5.0,세탁 후 변형 없고 디자인도 너무 마음에 들었어요!
5.0,가격도 너무 좋고 핏도 좋고 색상도 좋고 다 좋습니다
5.0,한 사이즈 크게 구매했는데도 너무 크지않아서 좋았습니다
5.0,사이즈가 진짜 크긴 한데 이건 크게 입어야 예쁜 것 같아요 배송도 빨라서 기분 좋게 받을 수 있었어요 캐주얼하게 입을 수도 있고 유니크하게 입을 때도 간단하게 걸칠 수 있을 것 같아요
5.0,사이즈가 좀 크네요 길고요 그래도 너무 좋아요.어디에나 잘 어울립니다.
5.0,깔끔하고 넉넉해서 편하게 착용하기 좋습니다 좋아요 만족합니다
