Review,Star,Processed_Review
생각보다 조금 탁한 크림 색입니다. 그래도 무난하게 입기 좋고 배송도 빨라서 좋습니다.,5.0,생각보다 조금 탁한 크림 색입니다 그래도 무난하게 입 기 좋고 배송도 빨라서 좋습니다
"너무너무 이쁘고 편해요!
리뷰보고 m시켯는데 작아서 l로 교환함요ㅠㅠ
길이 핏 다 좋고 진짜 매일입어요",5.0,너무 너무 이 쁘고 편해요 리뷰보고 시켯는데 작아서 로 교환함 요 길이 핏 다 좋고 진짜 매일 입어요
키가 적은편이라 미디 사이즈가 딱 좋은것 같아요. 기대한 만큼의 두께감 핏감. 한여름 들어가면 살짝 더울것 같긴하지만 초여름까지는 무난하게 입을듯해요.,5.0,키가 적은 편이라 미디 사이즈가 딱 좋은 것 같아 요 기 대한 만큼의 두께감 핏감 한 여름 들어가면 살짝 더울 것 같긴 하지만 초여름까지는 무난하게 입을 듯해요
천은 두터운 편이라서 맘에 들지만 구김이 잘가요,4.0,천은 두터운 편이라서 맘에 들지만 구김이 잘 가요
천이 데님이라 두텁고 비침 없어서 좋아요 주름은 잘 가서 좀 아쉽습니다,4.0,천이 데님이라 두텁고 비침 없어서 좋아요 주름은 잘 가서 좀 아쉽습니다
"적당한 미디길이의 흰색 면치마
검정티셔츠 하늘색 셔츠 등 무엇과도 찰떡이네요. 
게다가 뒷트임이 적당하여 활동성도 굿입니다👍",5.0,적당한 미디 길이의 흰색 면치마 검정 티셔츠 하늘색 셔츠 등 무엇과도 찰떡이네요 게다가 뒷트임이 적당하여 활동성도 굿입니다
좋아요좋아요좋아요배송빨라요 만족합니다 굿굿,5.0,좋아요 좋아요 좋아 요 배송 빨라 요 만족합니다
"길이가 조금더 길었음 즇겠어여, 참고로 저는 키가 작습니다.",3.0,길이가 조금 더 길었음 즇겠어 여 참고로 저는 키가 작습니다
"적당한 두께에 부드러움
아이보리 색상도 맘에 들어요",4.0,적당한 두께에 부드러움 아이보리 색상도 맘에 들어요
길이가 길어서 부담스럽지 않고 치마도 편안해요 다만 배가 나와서 허리가 완전 딱맞네요 신축성이 좋지는 않아요 전체적으로 만족합니다,5.0,길이가 길어서 부담스럽지 않고 치마도 편안해요 다만 배가 나와서 허리가 완전 딱 맞네요 신축성이 좋지는 않아 요 전체적으로 만족합니다
편안한 스커트 예쁘네요 길이도 딱 좋아요 배송도 빠르고 포장 상태도 굿,5.0,편안한 스커트 예쁘네요 길이도 딱 좋아요 배송도 빠르고 포장 상태도 굿
길이나 치마 통은 괜찮은데 배가 나와서 완전 딱맞아요ㅜㅜ 식사하고나면 허리가 많이 타이트할것같네요ㅜㅜ 뒷트임 있어서 걸을때 많이 불편하거나 그러진 않아요 옷 예쁘네요,5.0,길이나 치마 통은 괜찮은데 배가 나와서 완전 딱 맞아요 식사하고 나면 허리가 많이 타이트할 것 같네요 뒷트임 있어서 걸을 때 많이 불편하거나 그러진 않아 요 옷 예쁘네요
"정말 오랜만에 치마, 이걸 예전엔 어떻게 입었을까 하네요 이쁩니다.",5.0,정말 오랜만에 치마 이걸 예전엔 어떻게 입었을까 하네요 이쁩니다
사이즈 여유있고 편해서 좋아요 기장이랑 핏도 딱 좋네요,5.0,사이즈 여유 있고 편해서 좋아요 기장이랑 핏도 딱 좋네요
배송 진짜 빨라요 반나절도 안걸렸습니다.  부담스럽게 하얗지 않은 크림색이라 좋아요. 신축성은 없지만 같이 산 블랙보다 편한 느낌입니다. 평소 66사이즈 입는데 여유롭지 않게 딱 잘 맞네요.,5.0,배송 진짜 빨라요 반나절도 안 걸렸습니다 부담스럽게 하얗지 않은 크림색이라 좋아요 신축성은 없지만 같이 산 블랙보다 편한 느낌입니다 평소 사이즈 입는데 여유롭지 않게 딱 잘 맞네요
흰색 데님치마는 첨인데 정말 잘 산거같습니다!!흰색치마 하면 비치는게 제일 문제인데 데님이라 비치치도 않고 종아요.실제로 입는게 더 이쁩니다.,5.0,흰색 데님치마는 첨인데 정말 잘 산거 같습니다 흰색 치마 하면 비치는 게 제일 문제인데 데님이라 비도 않고 종아 요실제로 입는 게 더 이쁩니다
배송도 빠르고 무신사 스탠다드 제품은 다 좋아요,5.0,배송도 빠르고 무신사 스탠다드 제품은 다 좋아요
"할인도받고 핏도 색상도 만족해요
키작은데 딱좋아요",5.0,할인도 받고 핏도 색상도 만족해요 키 작은데 딱 좋아요
봄에 입기좋은 데님 치마인데 미디 길이로 뒷트임이 있어 활동하기 편해요. 아주 빳빳한 청재질은 아니라 스판기가 있어 더 좋아요. 흰색티에 가디건이랑 딱일듯.,5.0,봄에 입기 좋은 데님 치마인데 미디 길이로 뒷트임이 있어 활동하기 편해요 아주 한 청재질은 아니라 스판기가 있어 더 좋아요 흰색 티에 가디건이랑 딱 일 듯
"허리 잘맞아서 좋아요.
스트레치 전혀 없어요.
쿠폰먹여서 가격좋았어요.",3.0,허리 잘 맞아서 좋아요 스트레치 전혀 없어요 쿠폰 먹여서 가격 좋았어요
완전 이뿜 핏도좋고 배송도 좋고 걍 무조건 사는거 추천,5.0,완전 이뿜 핏도 좋고 배송도 좋고 걍 무조건 사는 거 추천
아주 맘에 들어요 소재고 톡톡하고요 가격도 좋아요,5.0,아주 맘에 들어 요 소재 고 하고요 가격도 좋아요
"스몰 잘 맞아요.
허리 뜨지 않고 맞아서 너무 좋아요~",4.0,스몰 잘 맞아요 허리 뜨지 않고 맞아서 너무 좋아요
"탄탄하고 무난합니다
역시 무신사스탠다드 기본 아이템이 좋습니다",5.0,하고 무난합니다 역시 무신사 스탠다드 기본 아이템이 좋습니다
기본치마입니당 속옷색 주의하면 될거같아여요,5.0,기본치마입니 당 속옷 색 주의하면 될 거 같아 여요
"같은 옷 입다가 안지워지는 얼룩이 생겨서 재구매했어요.
22년 8월에 산 게 왼쪽이고, 이번에 산 게 오른쪽이에요.
색이 탁해진 점은 아쉽지만 디자인은 여전히 마음에 듭니다.",4.0,같은 옷 입다가 안 지워지는 얼룩이 생겨서 재구매했어요 년 월에 산 게 왼쪽이 고 이번에 산 게 오른쪽이에 요 색이 탁해진 점은 아쉽지만 디자인은 여전히 마음에 듭니다
천이 두터워서 맘에 들어요 너무 길지도 짧지도 않은 기본 데님 스커트,5.0,천이 두터워서 맘에 들어 요 너무 길지도 짧지도 않은 기본 데님 스커트
"와이프가 사이즈 좋다고하네요
스판있어서 편하고 추천합니다",5.0,와이프가 사이즈 좋다고 하네요 스판 있어서 편하고 추천합니다
생각보다 길이가 짧아요. 롱은 아니고 미디 치마정도에요.,5.0,생각보다 길이가 짧아요 롱은 아니고 미디 치마 정도에요
배송도 빠르고 너무너무 만족해요!! 탄탄해서 핏도 잘잡아주고~~ 내일 바로 입을라고요 ㅎㅎ,5.0,배송도 빠르고 너무너무 만족해요 해서 핏도 잘 잡아주고 내일 바로 입을 라고요
무신사 쿠폰 적용해서 합리적인 가격으로 잘 구매한 거 같아요 핏도 아주 마음에 듭니다!,5.0,무신사 쿠폰 적용해서 합리적인 가격으로 잘 구매한 거 같아 요 핏도 아주 마음에 듭니다
여름에 입기 좋은 색상이고 사이즈가 딱 맞고 핏이 이뻐요^^,5.0,여름에 입 기 좋은 색상이고 사이즈가 딱 맞고 핏이 이 뻐요
"블랙 구매하고 편하게 잘 입어서 베이지도 구매해봅니다.
사이즈 잘 맞고 착용감도 편하고 좋아요.",5.0,블랙 구매하고 편하게 잘 입어서 베이지도 구매해 봅니다 사이즈 잘 맞고 착용 감도 편하고 좋아요
너무 예쁩니다. 몸무게 대비 허리가 가는편인데 잘 맞아서 좋아요. 길이감도 좋고 상의 코디하기도 좋아요.,5.0,너무 예쁩니다 몸무게 대비 허리가 가는 편인데 잘 맞아서 좋아요 길이 감도 좋고 상의 코디하기도 좋아요
"생각보다 작게 나온거 같은데 허리부분이

그 외에는 편하게 잘 입고 다녀요",5.0,생각보다 작게 나온 거 같은데 허리 부분이 그 외에는 편하게 잘 입고 다녀요
"같은제품 그레이 치마가 있는데
흰색도 있길래 구매해봤어요
제 교복입니다 질도 좋구 강추에요",5.0,같은 제품 그레이 치마가 있는데 흰색도 있길래 구매해봤어요 제 교복입니다 질도 좋구 강추에요
너무 하얀색아니고 적당한 크림색이라 좋습니다,5.0,너무 하얀색 아니고 적당한 크림색이라 좋습니다
디자인 마음에 들고 핏 이쁩니다!! 잘 입도록 할게요,5.0,디자인 마음에 들고 핏 이 쁩니다 잘 입도록 할게요
배송 진짜 빨라요~ 편하게 잘맞아 너무 좋아요 이뻐요~,5.0,배송 진짜 빨라요 편하게 잘 맞아 너무 좋아요 이 뻐요
"기본 크림치마로 최고에요
사이즈는 편하게 입으려고 한사이즈 크게 교환했어요 ㅠ
그래도 라인 괜찮으니 편한 사이즈로 주문하세요",5.0,기본 크림치마로 최고에 요 사이즈는 편하게 입으려고 한 사이즈 크게 교환했어요 그래도 라인 괜찮으니 편한 사이즈로 주문하세요
무난하게 여기저기 입을 수 있어요 가격대비 훌륭합니다,5.0,무난하게 여기저기 입을 수 있어요 가격 대비 훌륭합니다
완전 흰색 아니고 살짝 때탄거같은 아이보리라서 활용하기 좋아요. 10시간 넘게 입고 물뿌려두고 난 뒤에 찍은 건데 구김이 다 펴지진 않았네요. Xs샀다가 교환했는데 플러스 배송이라 그런지 엄청 빨랐어요 맞교환 스피드네요 여튼 맘에들어요,5.0,완전 흰색 아니고 살짝 때 탄거 같은 아이보리라서 활용하기 좋아요 시간 넘게 입고 물 뿌려두고 난 뒤에 찍은 건데 구김이 다 펴지진 않았네요 샀다가 교환했는데 플러스 배송이라 그런지 엄청 빨랐어요 맞교환 스피드네요 여튼 맘에 들어요
옷이 너무 이뻐서 다른 색상도 또 구매예정입니다 진짜 옷 미쳤습니다 진짜 이뻐요,5.0,옷이 너무 이 뻐서 다른 색상도 또 구매 예정입니다 진짜 옷 미쳤습니다 진짜 이 뻐요
제가 키가작고 통통한 편인데 옷이 저를 커버해줘서 너무 귀여운 연출이 나옵니다 올봄은 이옷만 입을거같아요,5.0,제가 키가 작고 한 편인데 옷이 저를 커버해줘서 너무 귀여운 연출이 나옵니다 올봄은 이 옷만 입을 거 같아요
예쁜 크림색이고 뒷트임이 있어서 편해요. 뒷주머니에 얼룩오염이 있어서 교환했는데 신속하게 교환해주셨어요!,5.0,예쁜 크림색이고 뒷트임이 있어서 편해요 뒷주머니에 얼룩 오염이 있어서 교환했는데 신속하게 교환해 주셨어요
"뒷트임 있어서 걷기 편한디 주름은 좀 지는 것 같아요.
허리 28입는데 M 딱 맞네요.(밥먹으면 좀 낄 것 같기도 하지만?)",4.0,뒷트임 있어서 걷기 편한 디 주름은 좀 지는 것 같아 요 허리 입는데 딱 맞네요 밥 먹으면 좀 낄 것 같기도 하지만
선물하려고 구매 했는데 배송이 엄청 빠르네요 대박,5.0,선물하려고 구매 했는데 배송이 엄청 빠르네요 대박
"기장도 적당하고, 트임이 있어서 편해요! 
조금 어두운 크림색이에요",5.0,기장도 적당하고 트임이 있어서 편해 요 조금 어두운 크림색이에요
"배송빠르고  사이즈 잘맞아요
생일쿠폰있어서 싸게 구입했습니다",5.0,배송 빠르고 사이즈 잘 맞아요 생일 쿠폰 있어서 싸게 구입했습니다
"배송빠르고 색상맘에들어요
힙이 있는편이라 입고벗기 불편한데  s로교환하면 길이도 길어지고 배송비들어서 그냥입기로",5.0,배송 빠르고 색상맘에 들어 요 힙이 있는 편이라 입고 벗기 불편한데 로 교환하면 길이도 길어지고 배송비 들어서 그냥 입기로
"s사이즈랑 고민하다xs구입했어요
제가 힙이 쫌있어서 엉덩이 쪽이 딱맞깃한데 이뻐요",5.0,사이즈랑 고민하다 구입했어요 제가 힙이 쫌 있어서 엉덩이 쪽이 딱 맞깃한데 이 뻐요
두께감이 있어서 한여름에는 힘들 거 같네요. 봄에 부지런히 입어야겠습니다.,5.0,두께감이 있어서 한 여름에는 힘들 거 같네요 봄에 부지런히 입어야겠습니다
데님천 탄탄하고 좋아요 ㅎㅎ색감이 크림컬러에요 밝은크림입니당 ㅎㅎ,5.0,데님천 하고 좋아요 색감이 크림 컬러에 요 밝은 크림입니 당
크림색이라 너무 하얗지만은 않고 핏이 예쁩니다,5.0,크림색이라 너무 하 얗지만은 않고 핏이 예쁩니다
색이 화사하고 예쁘고 사이즈도 너무 작지 않고 예뻐요,5.0,색이 화사하고 예쁘고 사이즈도 너무 작지 않고 예뻐요
원단이 탄탄해서 몸매를 잘 잡아줘요 색도 밝아서 상의 매치도 쉬워요,5.0,원단이 해서 몸매를 잘 잡아줘요 색도 밝아서 상의 매치도 쉬워요
허리가 크지만 아주 예쁘게 잘 맞아요 벨트하니 더 예쁘네여 봄이 기다려지는 옷이예요!! 질도 좋고 스타일도 좋아여,5.0,허리가 크지만 아주 예쁘게 잘 맞아요 벨트 하니 더 예쁘네 여 봄이 기다려지는 옷이예요 질도 좋고 스타일도 좋아여
매장기서 입어보고 샀어요 세가지 색이 다 예뻐서 고민하다 친구들이 베이지가 제일 잘 어울린다고 해서 베이지로 겟!!,5.0,매장 기서 입어보고 샀어요 세 가지 색이 다 예뻐서 고민하다 친구들이 베이지가 제일 잘 어울린다고 해서 베이지로 겟
"라지했으면 많이 클뻔했네요
엠사이즈도 생각보다 여유있어요 
일반 데님보다는 얇고 
좀 두꺼운 면 느낌
정강이 중간보다 조금 올라오네용
휘뚤마뚤 이쁠 듯",5.0,라지했으면 많이 클 뻔했네요 엠 사이즈도 생각보다 여유 있어요 일반 데님보다는 얇고 좀 두꺼운 면 느낌 정강이 중간보다 조금 올라오네용 휘뚤마뚤 이 쁠 듯
"가을에 잘 입고 다님
20짜리 모 브랜드 구입했다가 반품하고 무신사 구입
가성비 대박임",4.0,가을에 잘 입고 다님 짜리 모 브랜드 구입했다가 반품하고 무신사 구입 가성비 대박임
길이가 조금 더 길고 통이 조금만 더 넓었으면 좋았을것같아요! 엉덩이 부분이 좀 끼는 느낌이 듭니다. 그래도 기본아이템이라 추천,4.0,길이가 조금 더 길고 통이 조금만 더 넓었으면 좋았을 것 같아 요 엉덩이 부분이 좀 끼는 느낌이 듭니다 그래도 기본 아이템이라 추천
역시 무탠다드!! 핏도이쁘구 질도 좋고 넘 좋아요 데일리로 입으려구요,5.0,역시 무탠다드 핏도 이쁘구 질도 좋고 넘 좋아요 데일리로 입으려구요
사실 사이즈가 작은 건 아닌데.. 골반이 조금 낑겨요 ㅋㅋ 허리는 만족! 저번에 이거 입구 외출 했는데 핏도 이쁘고 되게 만족했어요,5.0,사실 사이즈가 작은 건 아닌데 골반이 조금 낑겨요 허리는 만족 저번에 이 거 입구 외출 했는데 핏도 이 쁘고 되게 만족했어요
배송이 완전 빨랐어요 블프라서 싸게 잘 구매했어요,5.0,배송이 완전 빨랐어요 블프라서 싸게 잘 구매했어요
실제로 매장에서 보고 샀던 색상이라 너무 만족해요,5.0,실제로 매장에서 보고 샀던 색상이라 너무 만족해요
무신사스탠다드 매장에서 실물로 보고 인터넷으로 구매했어요! 샤르르 하게 입으면 예쁠거같아요,5.0,무신사 스탠다드 매장에서 실물로 보고 인터넷으로 구매했어요 샤 하게 입으면 예쁠거 같아요
같은 xs사이즈 치마인데도 데님류는 크게 나왔는지 통도 크고 허리도 커서 핏이 애매해요ㅜㅜ,5.0,같은 사이즈 치마인데도 데님류는 크게 나왔는지 통도 크고 허리도 커서 핏이 애매해요
"사진과 똑같은 색감이에요
요즘 날씨에 입기 좋아요",5.0,사진과 똑같은 색감이에요 요즘 날씨에 입 기 좋아요
무신사 데님류는 좀 크게 나오는 건지 h라인 스커트 같은 경우엔 딱 맞았는데 이거랑 데님 미니 스커트는 허리도 크고 통도 애매하게 커서 핏이 안 예쁘네요ㅜ,5.0,무신사 데님류는 좀 크게 나오는 건지 라인 스커트 같은 경우엔 딱 맞았는데 이 거랑 데님 미니 스커트는 허리도 크고 통도 애매하게 커서 핏이 안 예쁘네요
"기본 스타일이라 깔끔해서 여기저기 활용하기 좋아요
마르고 골반이 작은 체형이라 xs도 들어가는데 완젼 타이트하구요
s이 허리 딱 맞고 골반이 약간 남아서 오히려 앉을 때 편하네요
세일할때 사서 배송이 좀 늦었지만 가성비 좋고 니트 셔츠 맨투맨 티셔츠에 모두 괜찮아서 활용도도 좋아요",5.0,기본 스타일이라 깔끔해서 여기저기 활용하기 좋아요 마르고 골반이 작은 체형이라 도 들어가는데 완젼 타이트 하구요 이 허리 딱 맞고 골반이 약간 남아서 오히려 앉을 때 편하네요 세일할 때 사 서 배송이 좀 늦었지만 가성비 좋고 니트 셔츠 맨투맨 티셔츠에 모두 괜찮아서 활용 좋아요
"기본 스타일이라 깔끔해서 여기저기 활용하기 좋아요
마르고 골반이 작은 체형이라 xs도 들어가는데 완젼 타이트하구요
s이 허리 딱 맞고 골반이 약간 남아서 오히려 앉을 때 편하네요
세일할때 사서 배송이 좀 늦었지만 가성비 좋고 니트 셔츠 맨투맨 티셔츠에 모두 괜찮아서 활용도도 좋아요
크림색은 벨트랑 같이 하면 더 예뻐요",5.0,기본 스타일이라 깔끔해서 여기저기 활용하기 좋아요 마르고 골반이 작은 체형이라 도 들어가는데 완젼 타이트 하구요 이 허리 딱 맞고 골반이 약간 남아서 오히려 앉을 때 편하네요 세일할 때 사 서 배송이 좀 늦었지만 가성비 좋고 니트 셔츠 맨투맨 티셔츠에 모두 괜찮아서 활용 좋아요 크림색은 벨트 랑 같이 하면 더 예뻐요
데일리로 입기 좋아요. 얇은 데님이고 기장도 딱 좋아요,4.0,데일리로 입 기 좋아요 얇은 데님이고 기장도 딱 좋아요
와이프 요청으로 구매해줬습니다 예쁘다고 하네요,5.0,와이프 요청으로 구매해줬습니다 예쁘다고 하네요
와이프요청으로 구매해줬는데 맘에 든다고 하네요,5.0,와이프 요청으로 구매해줬는데 맘에 든다고 하네요
기본템으로 좋습니다!. 깔끔한 데님 스커트입니다,4.0,기본템으로 좋습니다 깔끔한 데님 스커트입니다
"요즘 제 교복입니다..너무 편하고 예뻐요!!
어떤 옷에도 다 잘 어울려서 거의 맨날 입고 다녔어요
더 추워지기 전에 실컬 입으려구요 ㅎ",5.0,요즘 제 교복입니 다 너무 편하고 예뻐요 어떤 옷에도 다 잘 어울려서 거의 맨날 입고 다녔어요 더 추워지기 전에 실컬 입으려구요
평소 허리보통26입고 골반엉덩이있는편입니다. 같은 스커트 잘 입고있어 세일기간에 재구매했어요 그만큼 예쁘고 잘 입어지는 옷입니다. 크림색상이 특히 예뻐 코디하기 좋고 스티치컬러 너무 제 취향이에요^^ 뒷트임있어서 크게 불편하지않아요 허리에서 골반까지 핏이 되게예뻐요 그리고 일자로 툭 떨어집니다. 첫 상품에 문제가 있어 한번 교환 받았는데 이번에는 양품이네요~ 지퍼도 부드럽고 무탠 질이 좋아 늘 만족하고 있습니다. 예쁘게 잘 입겠습니다~,5.0,평소 허리 보통 입고 골반 엉덩이 있는 편입니다 같은 스커트 잘 입고 있어 세일 기간에 재구매했어요 그만큼 예쁘고 잘 입어지는 옷입니다 크림 색상이 특히 예뻐 코디하기 좋고 스티치 컬러 너무 제 취향이에요 뒷트임 있어서 크게 불편하지 않아 요 허리에서 골반까지 핏이 되게 예뻐요 그리고 일자로 툭 떨어집니다 첫 상품에 문제가 있어 한번 교환 받았는데 이번에는 양품이네요 지퍼도  부드럽고 무탠 질이 좋아 늘 만족하고 있습니다 예쁘게 잘 입겠습니다
믿고 구매하는 무신사에요 무탠 바지 치마 정말 애용해요,5.0,믿고 구매하는 무신사에 요 무탠 바지 치마 정말 애용해요
"미듐사이즈 편안하게 잘 맞아요~
그리고 깔끔하게 여기저기 잘 입어질것 같아요~",5.0,미듐 사이즈 편안하게 잘 맞아요 그리고 깔끔하게 여기저기 잘 입어질 것 같아요
예쁜 화이트 데님이에요 에이치 라인에 가까워요.,5.0,예쁜 화이트 데님이에요 에이치 라인에 가까워요
핏이랑 기장이 맘에 들어요!! 배송도 빠르고요!! 추천합니다!!,5.0,핏이랑 기장이 맘에 들어 요 배송도 빠르고요 추천합니다
허리는 살짝 큰데 핏도 예쁘고 재질도 탄탄해서 좋아요,5.0,허리는 살짝 큰데 핏도 예쁘고 재질도 해서 좋아요
"제가 갖고있는 아이보리 청자켓?면자켓에 어울리는 스커트를  여러사이트를 뒤져가며 찾고있었는데 딱! 요기서 찾았네요ㅎㅎ 셋업으로 입고싶어서  컬러가 정말 중요했는데,
진짜 셋트처럼 딱맞아서 기분이 좋았어요~~ 사이즈도 적당히 여유있게 잘맞고 예뻐요!!!",5.0,제가 갖고 있는 아이보리 청자켓면 자켓에 어울리는 스커트를 여러 사이트를 뒤져가며 찾고 있었는데 딱 요기서 찾았네요 셋업으로 입고 싶어서 컬러가 정말 중요했는데 진짜 셋트처럼 딱 맞아서 기분이 좋았어요 사이즈도 적당히 여유 있게 잘 맞고 예뻐요
"엉덩이는 맞는데 허리가 가는 체형이라 역시 허리가 크네요
걷다보면 치마가 돌아가있습니다.. 미듐살걸..",4.0,엉덩이는 맞는데 허리가 가는 체형이라 역시 허리가 크네요 걷다 보면 치마가 돌아가 있습니다 미 듐 살 걸
배송 빨라서 만족스러워요. 사이즈는 라지사면 클것같고 미듐은 좀 끼지만 입을만해요,5.0,배송 빨라서 만족스러워요 사이즈는 라지 사면 클 것 같고 미듐은 좀 끼지만 입을 만해요
예상했던 디자인인데 좀 커요 생각보다. 못입을 정도는 아니라서 그냥 입으려구요 퀄리티도 만족합니다 가을에 후드랑 입고싶어요!,5.0,예상했던 디자데 좀 커요 생각보다 못 입을 정도는 아니라서 그냥 입으려구요 퀄리티도 만족합니다 가을에 후드랑 입고 싶어요
색상깨끗한아이보리색이라다양한상의와어울려요,5.0,색상 깨끗한 아이보리색이라 다양한 상의와 어울려요
색도 크림이라 부담스럽지 않고 길이도 적당해요,5.0,색도 크림이라 부담스럽지 않고 길이도 적당해요
무신사 스탠다드라 믿고 구매해요.사이즈랑 스타일  딱좋구요~배송은 정말 최고로 빠른것 같아요.,5.0,무신사 스탠다드라 믿고 구매해요 사이즈 랑 스타일 딱 좋구요 배송은 정말 최고로 빠른 것 같아요
무신사스탠다드는 믿고 사고있어요.역시나 사이즈 딱 맞구요~배송도 정말 빨라요.,5.0,무신사 스탠다드는 믿고 사고 있어 요역시나 사이즈 딱 맞구 요 배송도 정말 빨라요
출근할 때 입기 좋은 치마임 생각보다 흰색에 가까움 허리가 조금 크지만 오히려 벨트로 포인트 줄 때 더 예뻐서 ㄱㅊ,5.0,출근할 때 입 기 좋은 치마임 생각보다 흰색에 가까움 허리가 조금 크지만 오히려 벨트로 포인트 줄 때 더 예뻐서
"디자인 심플하고 좋아요~
배송도 엄청 빨랐어요 ㅋㅋ 전날에 시켰는데 다음날 오후에 
딱! 도착했어용~",5.0,디자인 심플하고 좋아요 배송도 엄청 빨랐어요 전날에 시켰는데 다음날 오후에 딱 도착했어용
"너무 만족하면거 입고 다닙니다..
원단이랑 둡께도 딱 적당해서 
4개절 내내 입고 다닐거 같아용~
다음에는 베이지색 바지도 살라고요!🫶
(이거 입고 치마 어디서 샀냐고 많이 물어봐요..[진짜임])",5.0,너무 만족하면 거 입고 다닙니다 원단이랑 둡께도 딱 적당해서 개절 입고 다닐 거 같아 용 다음에는 베이지색 바지도 살라고요 이 거 입고 치마 어디서 샀냐고 많이 물어봐 요 진짜임
하얀색 데님 치마가 필요했는데 무신사 스탠다드에서 제가 찾던 스타일의 치마가 있어서 구입했어요. 몇 번 입어보니 역시나 편하고 마음에 듭니다.,5.0,하얀색 데님 치마가 필요했는데 무신사 스탠다드에서 제가 찾던 스타일의 치마가 있어서 구입했어요 몇 번 입어보니 역시나 편하고 마음에 듭니다
