Review,Star,Processed_Review
배송도 빨리왔고 색상도 맘에들어요 깨끗한 흰색이에요! 여행가서 잘입었습니다 편하구 다음에 한사이즈 작게해서 입고 싶어요! 싸구려 재질 아니구요 4계절 내내 잘입을 것 같습니다. 세탁후 변형도 없었습니다,5.0,배송도 빨리 왔고 색상도 맘에 들어 요 깨끗한 흰색이에 요 여행가서 잘 입었습니다 편하구 다음에 한 사이즈 작게 해서 입고 싶어요 싸구려 재질 아니구 요 계절 잘 입을 것 같습니다 세탁 후 변형도 없었습니다
"청치마로 사고 마음에 들어서 흰색도 구매했어요 

만족합니다.",5.0,청치마로 사고 마음에 들어서 흰색도 구매했어요 만족합니다
"지금 입기엔 더워요. 키 158 기장감 괜찮고, 허리는 살짝 큰편이에요. 데님도 사고 싶은데 품절이 진짜 안 풀리네요ㅠㅠ 무신사 스탠다드 벨트사서 하고 다닙니다.",5.0,지금 입기엔 더워요 키 기장감 괜찮고 허리는 살짝 큰 편이에 요 데님도 사고 싶은데 품절이 진짜 안 풀리네요 무신사 스탠다드 벨트 사서 하고 다닙니다
크림베이지  데님으로 긴기장 이쁩니다 배송도 빠르게 쿠폰으로 잘샀어요,5.0,크림베이지 데님으로 긴 기장 이 쁩니다 배송도 빠르게 쿠폰으로 잘 샀어요
배송 완전 빨라요 사이즈 품절이라 m했더니 조금 널널해서 벨트 하니까 괜찮아요 생각한 색감이고 좋은 가격 굿,5.0,배송 완전 빨라 요 사이즈 품절이라 했더니 조금 해서 벨트 하니까 괜찮아요 생각한 색감이고 좋은 가격 굿
"길이도 딱 좋고 색상도 맘에 들고 아주 편합니다.
골반이 있어서 허리는 약간 크지만 어쩔수 없이 골반에 맞혀
입어야 해서 . .
하지만 크림색상이 너무 이쁘고 맘에 듭니다",5.0,길이도 딱 좋고 색상도 맘에 들고 아주 편합니다 골반이 있어서 허리는 약간 크지만 어쩔 수 없이 골반에 맞혀 입어야 해서 하지만 크림 색상이 너무 이 쁘고 맘에 듭니다
무난하게 잘입고있어요 두께도적당합니다^^ 아이보리색이에요,5.0,무난하게 잘 입고 있어요 두께도 적당합니다 아이보리색이에요
"L사이즈로 잘못 배송되어 교환했는데, 교환 절차 빨라서 좋았어요. 봄가을에 입기 좋은 두께고 넉넉하게 나와 입기 편합니다. 세탁도 편하게 할수있어서 맘에 들어요.",5.0,사이즈로 잘못 배송되어 교환했는데 교환 절차 빨라서 좋았어요 봄 가을에 입 기 좋은 두께 고 하게 나와 입기 편합니다 세탁도 편하게 할 수 있어서 맘에 들어요
"상의 넣어 입으려고 한사이즈 크게 주문했는데, 좀 크긴 크네요. 길이, 재질 만족합니다.",4.0,상의 넣어 입으려고 한 사이즈 크게 주문했는데 좀 크긴 크네요 길이 재질 만족합니다
약간 큰 느낌이 있지만 넣어입을거 생각하면 사이즈는 딱 괜찮은거 같아요,5.0,약간 큰 느낌이 있지만 넣어 입을 거 생각하면 사이즈는 딱 괜찮은 거 같아요
살짝 큰 느낌이 있지만 넣어입으면 괜찮습니다 깔끔해요,5.0,살짝 큰 느낌이 있지만 넣어 입으면 괜찮습니다 깔끔해요
평소 s입는데 저한테도 허리가 살짝 큰 느낌이에요,5.0,평소 입는데 저한테도 허리가 살짝 큰 느낌이에요
길이감도 좋고 예뻐요 위에 암거나 입어도 잘어울려요!,5.0,길이 감도 좋고 예뻐요 위에 암거나 입어도 잘 어울려요
"바지 28_29 입는데 허리부분 여유있습니다! 배송완전 빨랐고, 탄탄해서 좋아요 크림색입니다. 가격이 좀 더 싸면 좋을거같아요",5.0,바지 입는데 허리 부분 여유 있습니다 배송 완전 빨랐고 해서 좋아요 크림색입니다 가격이 좀 더 싸면 좋을 거 같아요
"실제보다 누렇게 서진에 찍혔는데 놉!완전 예쁜 크림색으로 상의 코디하기에 스펙트럼이 넓어요.
두께감이 있어서 한여름에는 무리겠지만 계절감없이 막 입기에 좋을듯해요.",5.0,실제보다 누렇게 서진에 찍혔는데 놉 완전 예쁜 크림색으로 상의 코디하기에 스펙트럼이 넓어요 두께감이 있어서 한 여름에는 무리겠지만 계절감 없이 막 입기에 좋을 듯해요
"색감은 예상대로 우유빛 말간 크림색인데 너무 예뻐요.전 누리끼리한 컬러 별론데 딱 좋네요.
신축성 좋고 적당히 캐쥬얼하니 여성스런 코디에도 아울려요.",5.0,색감은 예상대로 우유빛 말간 크림색인데 너무 예뻐요 전 누리끼리 한 컬러 별론데 딱 좋네요 신축성 좋고 적당히 캐쥬얼 하니 여성스런 코디에도 아울려요
좋아요... 구김이 많이티나지만 괜찮아요 좀두꺼워요,5.0,좋아요 구김이 많이 티나지만 괜찮아요 좀 두꺼워요
"허리가 가는 편이라 스몰 선택했는데 잘 맞았어요!
흰색이라 상의를 뭘 입어도 무난하게 잘 어울려요.
다만 구김이 좀 많이 가서 오래 앉았다가 일어나면 주름져 있고 잘 안없어지더라구여..
비침도 없는 편이라 주름 많이 지는거 빼면 다 괜찮은거 같아요! 추천합니다!!",5.0,허리가 가는 편이라 스몰 선택했는데 잘 맞았어요 흰색이라 상의를 뭘 입어도 무난하게 잘 어울려 요 다만 구김이 좀 많이 가서 오래 앉았다가 일어나면 주름져 있고 잘 안 없어지더라구 여 비침도 없는 편이라 주름 많이 지는 거 빼면 다 괜찮은 거 같아 요 추천합니다
구김도 없고 다양한 코디에 활용가능한 색감이에요,5.0,구김도 없고 다양한 코디에 활용 가능한 색감이에요
"와이프사줬는데 너무이쁘데요
잘입고다닙니다",4.0,와이프사 줬는데 너무 이쁘데요 잘 입고 다닙니다
크림색이라 어떤 색감의 옷이랑 매치해도 잘어울려서 잘 입고 다녀요~! 완전 애장템,5.0,크림색이라 어떤 색감의 옷이랑 매치해도 잘 어울려서 잘 입고 다녀 요 완전 애장템
"벌써 3번 이상 입었어요 허리 딱 맞고 기장감도 좋아요 /
수선 필요 없어요 !!
추천입니다",5.0,벌써 번 이상 입었어요 허리 딱 맞고 기장감도 좋아요 수선 필요 없어요 추천입니다
크지만 그래도  굿이에요 추천합니다 좋습니다 굿,5.0,크지만 그래도 굿이에 요 추천합니다 좋습니다 굿
"무난하게 휘뚜루마뚜루 가능합니다
갠츈 앵간한 편입니다",5.0,무난하게 휘뚜루마 뚜루 가능합니다 갠츈 앵간 한 편입니다
치마 길이도 적당하고 색도 이쁘고 핏도 마음에 들어요,5.0,치마 길이도 적당하고 색도 이 쁘고 핏도 마음에 들어요
"사이즈 크진않고 소재좋고 잘맞아요
잘입고다녀요",5.0,사이즈 크진 않고 소재 좋고 잘 맞아요 잘 입고 다녀요
와이프  선물로 사줬는데 상당히 만족해합니다. 사이즈 상담도 굿.,5.0,와이프 선물로 사줬는데 상당히 만족해합니다 사이즈 상담도 굿
"길이도 좋고 활동하기도 편할 것 같아요
색깔도 깔 끔 *_*",5.0,길이도 좋고 활동하기도 편할 것 같아 요 색깔도 깔 끔
"매장에서 입어보고
무신사 스토어에서 바로 구매
배송받고 바로 입고
나갔어요
완죤 조아요",5.0,매장에서 입어보고 무신사 스토어에서 바로 구매 배송 받고 바로 입고 나갔어요 완 죤 조아요
이쁘고 하체 커버를 잘 해줘요 다른 색도 바로 구매했어요,5.0,이쁘고 하체 커버를 잘 해줘요 다른 색도 바로 구매했어요
청치마 샀는데 좋아서 흰색으로 또 샀어요. 잘 입고있어요,5.0,청치마 샀는데 좋아서 흰색으로 또 샀어요 잘 입고 있어요
무신사 옷은 허리 사이즈가 맞아서 너무 좋아요! 길이감도 좋습니더,5.0,무신사 옷은 허리 사이즈가 맞아서 너무 좋아요 길이 감도 좋습니더
얇아서 상의가 좀 비치긴하지만 지금입기에 딱 좋네용!!만족합니당 굳굳,5.0,얇아서 상의가 좀 비치긴 하지만 지금 입기에 딱 좋네용 만족합니당
오 완전 맘에들어용!!!세일하길래 샀는데 지금입기에 딱 좋네용. 근데 생각보다 얇은데 전 좋습니다~~굳굳,5.0,오 완 전 맘에 들어용 세일하길래 샀는데 지금 입기에 딱 좋네용 근데 생각보다 얇은 데 전 좋습니다
박음질이 안된상태로와서 한번 교환했지만 배송도 빠르고 예뻐서 좋아요,5.0,박음질이 안 된 상태로 와서 한 번 교환했지만 배송도 빠르고 예뻐서 좋아요
색감이 크림 아이보리라서 너무 이뻐요 엑스스몰 사이즈 있어서 넘 조아요 ㅋㅋ 길이가 좀더 길었으면 싶긴 한데 그래두 이쁨,5.0,색감이 크림 아이보리라서 너무 이 뻐요 엑몰 사이즈 있어서 넘 조아 요 길이가 좀 더 길었으면 싶긴 한데 그래 두 이 쁨
색깔도 크림색깔로 너무 이쁘고 사이즈도 잘 맞습니당,5.0,색깔도 크림 색깔로 너무 이 쁘고 사이즈도 잘 맞습니당
"핏이 좀 애매해요… “통”이라는 느낌이 너무 크고 밑이 넓어서 약간 부해보여요
하지만 재질은 나쁘지 않습니다… 마감도 좋아요",3.0,핏이 좀 애매해 요 통이라는 느낌이 너무 크고 밑이 넓어서 약간 부해 보여 요 하지만 재질은 나쁘지 않습니다 마감도 좋아요
괜찮아요! 가격도 괜찮고 재질도 괜찮ㄴㅔ요. 무탠다드 믿고사요,5.0,괜찮아요 가격도 괜찮고 재질도 괜찮요 무탠다드 믿고 사요
입어봤는데 허리가 살짝 크네요. 봄 가을용으로 잘 입을 것 같아요,4.0,입어봤는데 허리가 살짝 크네요 봄 가을용으로 잘 입을 것 같아요
크지도 않고 작지도 않고 딱 맞네요. 구김이 두드러지는건 흰색이라 어쩔 수 없는 것 같아요. 어디에나 잘 어울려서 자주 입을 것 같아요,5.0,크지도 않고 작지도 않고 딱 맞네요 구김이 두드러지는 건 흰색이라 어쩔 수 없는 것 같아 요 어디에나 잘 어울려서 자주 입을 것 같아요
크지도 않고 작지도 않고 딱 맞네요. 구김이 두드러지는건 흰색이라 어쩔 수 없는 것 같아요. 어디에나 잘 어울려서 자주 입을 것 같아요.,5.0,크지도 않고 작지도 않고 딱 맞네요 구김이 두드러지는 건 흰색이라 어쩔 수 없는 것 같아 요 어디에나 잘 어울려서 자주 입을 것 같아요
"사이즈는 낙낙하니 좋아요~
잘 늘어나는거 같아요~",5.0,사이즈는 하니 좋아요 잘 늘어나는 거 같아요
"전체적으로 핏이 좋아보여선택
탁월 그잡채
스판기있고 예쁨 쵝오",5.0,전체적으로 핏이 좋아 보여 선택 탁월 그 잡채 스판기 있고 예쁨 쵝오
깔끔한 화이트 데님입니다! 만족해요~ 위에 쨍한컬러랑 매치하면 좋아요!,4.0,깔끔한 화이트 데님입니다 만족해요 위에 쨍한 컬러랑 매치하면 좋아요
길이도 적당하고 탄탄한 재질이어서 날씬해보이고 예뻐요,5.0,길이도 적당하고 한 재질이어서 날씬해 보이고 예뻐요
"여유있게 맞는 편이고
뒷트임이라 걷기 불편하지않아 만족합니다.",5.0,여유 있게 맞는 편이고 뒷트임이라 걷기 불편하지 않아 만족합니다
허리큰거 빼고는 소재도 좋고 기본디자인이라 마음에듭니다.,3.0,허리 큰 거 빼고는 소재도 좋고 기본 디자인이라 마음에 듭니다
허리가 커서 수선해서 입고있습니다.소재가 탄탄해서 이쁘네요,3.0,허리가 커서 수선해서 입고 있습니다 소재가 해서 이쁘네요
"편하게입으려고 s샀는데
허리가 커서 반품하려다가 귀찮아서 수선대기주",3.0,편하게 입으려고 샀는데 허리가 커서 반품하려다가 귀찮아서 수선 대기주
허리가 살짝 크긴한데 핏도 예쁘고 어디든 잘어울립니다!,5.0,허리가 살짝 크긴 한데 핏도 예쁘고 어디든 잘 어울립니다
"별로에여. 실밥 마감 다 별로에요. 
한철입고 안입을거같아요",1.0,별로에 여 실밥 마감 다 별로에요 한 철 입고 안입을 거 같아요
"별로에요. 실밥디 튀어나와있고 마감도 별로에요. 
딱 가격만큼 한철입고 못입을거같은",1.0,별로에 요 실밥 디 튀어나와 있고 마감도 별로에요 딱 가격만큼 한 철입고 못 입을 거 같은
"하체가 좀더 튼실한 저의 체형에는 xs은 좀 꽉끼고 s는 조금 낙낙했습니다.
그래도 무난무난하고 기본템으로 아주 좋아요.",5.0,하체가 좀 더 튼실한 저의 체형에는 은 좀 꽉 끼고 는 조금 했습니다 그래도 무난무난하고 기 본템으로 아주 좋아요
화면과 같고 너무 편하고 좋아요! 다음에 또 구입할게요!,5.0,화면과 같고 너무 편하고 좋아요 다음에 또 구입할 게요
스판이 없어서 불편하고 배 나와 보이긴 해요 후드티랑 잘어울려요,5.0,스판이 없어서 불편하고 배 나와 보이긴 해요 후드 티랑 잘 어울려요
요새 살이 쪄서... 사실 이것도 버겁게 들어가요 스판이 없어서요 ㅠㅠ ㄷ더 널널하게 입고싶으시면 한사이즈 더 업해 입으세요..,5.0,요새 살이 쪄서 사실 이것도 버겁게 들어가요 스판이 없어서 요 더 하게 입고 싶으시면 한 사이즈 더 업해 입으세요
색감좋고 예쁘지만 무릎 잘 늘어나는 청바지같은 원단이라 앞주름하고 오래 앉아있다 일어나면 엉덩이 늘어남이 있어요. 아쉽네요.,4.0,색감 좋고 예쁘지만 무릎 잘 늘어나는 청바지 같은 원단이라 앞 주름하고 오래 앉아 있다 일어나면 엉덩이 늘어남이 있어요 아쉽네요
"허리가 커서 종종 치켜 올려줘야 하지만
디자인은 마음에 들어요.",5.0,허리가 커서 치켜 올려줘야 하지만 디자인은 마음에 들어요
허리 28에 딱 맞는 사이즈 입니다. 깔끔하게 생겼지요,5.0,허리 에 딱 맞는 사이즈 입니다 깔끔하게 생겼지요
크기도 적당하고 예뻐서 자주 입고 다닐 것 같아요 ㅎㅎ,5.0,크기도 적당하고 예뻐서 자주 입고 다닐 것 같아 요
완전 기본템 흰청스커트 입니다. 심플하고 편해요,5.0,완전 기 본템 흰 청 스커트 입니다 심플하고 편해요
냄새도 안나고 지금 날씨에 입으면 딱 좋아요~ 배송도 빨랐어요,5.0,냄새도 안 나고 지금 날씨에 입으면 딱 좋아요 배송도 빨랐어요
"편하게 잘맞고 활용도 높은 옷이라 손이
많이 갈거같아요",5.0,편하게 잘 맞고 활용도 높은 옷이라 손이 많이 갈 거 같아요
편하게 잘맞고 어떤 옷이랑도 잘어울려서 활용도가 높아요,5.0,편하게 잘 맞고 어떤 옷이랑 도 잘 어울려서 활용도가 높아요
홍대 무탠에서 입어보고 구매한건데 진짜 사이즈 딱 맞고 색도 아이보리 너무 이뻐요,5.0,홍대 무탠에서 입어보고 구매한 건데 진짜 사이즈 딱 맞고 색도 아이보리 너무 이 뻐요
"마감이 너무 부족하네요,,, 그래도 배송은 진짜 빠르니깐,,",1.0,마감이 너무 부족하네요 그래도 배송은 진짜 빠르니깐
"실밥 정리가 안된 상품을 받았어요ㅠ 아쉽네요 핏도 예쁘고,,.마감이 아쉬워.,,",1.0,실밥 정리가 안 된 상품을 받았어요 아쉽네요 핏도 예쁘고 마감이 아쉬워
"사이즈랑 길이가 다 좋아요. 기본티나 셔츠, 둘 다 잘 어울립니다.",5.0,사이즈랑 길이가 다 좋아요 기본 티나 셔츠 둘 다 잘 어울립니다
"172/61 스펙에 좀 큰편입니다.
원하던 핏이라 예쁘게 입을 수 있을것 같아요..
적당한 두께라 봄.가을에 입기 좋을것 같아요..
편합니다.",5.0,스펙에 좀 큰 편입니다 원하던 핏이라 예쁘게 입을 수 있을 것 같아 요 적당한 두께라 봄 가을에 입 기 좋을 것 같아 요 편합니다
허리가 생각보다 타이트하게 나온 옷 같아요 그래서 날씬해보여요,5.0,허리가 생각보다 타이트하게 나온 옷 같아 요 그래서 날씬해 보여요
휘뚜루마뚜루 템으로 좋은거 같아요 ㅎㅎ 허리가 살짝 뜨긴 하는데 밥 많이 먹을 수 있어서 오히려 좋아요,5.0,휘뚜루 마뚜루 템으로 좋은 거 같아 요 허리가 살짝 뜨긴 하는데 밥 많이 먹을 수 있어서 오히려 좋아요
사이즈가 딱 맞아요~~ 봄에 입으면 화사할거 같아요,5.0,사이즈가 딱 맞아요 봄에 입으면 화사할 거 같아요
화면에서 보는거랑 똑같네요 핏도 이쁘고 같은 디자인 청데님도 또 구매하고 싶네요,5.0,화면에서 보는 거랑 똑같네요 핏도 이 쁘고 같은 디자인 청데님도 또 구매하고 싶네요
사이즈가 딱 맞네요 뒷트임 적당히 나있고 재질도 뻣뻣하지 않고 봄에 입기 딱 좋네요 이뻐요,5.0,사이즈가 딱 맞네요 뒷트임 적당히 나있고 재질도 하지 않고 봄에 입 기 딱 좋네요 이 뻐요
예쁘고 단아한거같아요 품질이 좋아요 대학생 룩!,5.0,예쁘고 단아한 거 같아 요 품질이 좋아요 대학생 룩
생각보다 기장은 긴데 이것은 제 몸을 탓해야겠지요…,5.0,생각보다 기장은 긴데 이것은 제 몸을 탓해야겠지요
"완전 맘에 들어요!
허리랑 골반 다 여유있게 맞고 편하게 입을 수 있어요
아무 상의에나 다 잘 어울려서 봄에 잘 입을 거 같아요!
퀄리티도 정말 좋습니다!",5.0,완전 맘에 들어 요 허리랑 골반 다 여유 있게 맞고 편하게 입을 수 있어요 아무 상의에나 다 잘 어울려서 봄에 잘 입을 거 같아 요 퀄리티도 정말 좋습니다
"봄에입기너무 좋은 화사한 크림색이에여!
이쁩니다 아무코디나 잘 어울려요",5.0,봄에 입기 너무 좋은 화사한 크림색이에 여 이쁩니다 아무 코디나 잘 어울려요
엉덩이 부분이 조금 크지만 길이도 딱 맞고 편하게 입을거 같아요,5.0,엉덩이 부분이 조금 크지만 길이도 딱 맞고 편하게 입을 거 같아요
뒷투임이 있어서 걸을때 편하고 너무 뻣뻣한 청이 아니라 좋아요,5.0,뒷투임이 있어서 걸을 때 편하고 너무 한 청이 아니라 좋아요
기본템으로 좋아요 생각보다 좀 얇아요! 배송오면 스팀다리미 한번 해서 입어요~,5.0,기본템으로 좋아요 생각보다 좀 얇아요 배송 오면 스팀 다리미 한번 해서 입어요
너무 좋아요 다른 색상도 구매하고 싶습니다. 허리 조금 커요,5.0,너무 좋아요 다른 색상도 구매하고 싶습니다 허리 조금 커요
158에 50kg이에요 평소 27인치 딱맞게 입고 28인치까지 여유있게 입어요 S시켰고 잘맞네요 허벅지랑 좀 남고요 면이라 앉고 일어나면 주름이져요 색깔은 밝은 크림색 이에요 봄가을에  입기 좋은 두께에요 여름은 더울듯 하네요,5.0,에 이에 요 평소 인치 딱 맞게 입고 인치까지 여유 있게 입어요 시켰고 잘 맞네요 허벅지랑 좀 남고요 면이라 앉고 일어나면 주름이 져요 색깔은 밝은 크림색 이에 요 봄 가을에 입 기 좋은 두께에 요 여름은 더울듯 하네요
딱 맞아요~ 정석핏~  색도 크림색 화면의 이미지하고 똑같아요 봄에 입기좋고 이뻐요~,5.0,딱 맞아요 정석 핏 색도 크림색 화면의 이미지하고 똑같아 요 봄에 입기 좋고 이 뻐요
원단 좋고 핏 예쁘게 떨어져요 지금부터 입을 수 있을거 같고 어으 코디에나 잘 어울릴거 같아요,5.0,원단 좋고 핏 예쁘게 떨어져요 지금부터 입을 수 있을 거 같고 어으 코디에나 잘 어 울릴 거 같아요
"스커트 핏 예뻐요 봄에 입을수 있을것 같아요 
길이도 좋고 원단도 좋아요",5.0,스커트 핏 예뻐요 봄에 입을 수 있을 것 같아 요 길이도 좋고 원단도 좋아요
골반이 넓은 편이라 걱정했는데 허리랑 다 여유있게 맞아요! Xs로 하길 잘한 거 같아요! 키가 작은 편이라 기장도 맘에 들어요!!! 봄에 잘 입을 거 같아요 !,5.0,골반이 넓은 편이라 걱정했는데 허리랑 다 여유 있게 맞아요 로 하길 잘한 거 같아 요 키가 작은 편이라 기장도 맘에 들어 요 봄에 잘 입을 거 같아 요
핏 나쁘지않아요 여기저기 매치해서 입기 좋은옷이에요 언넝사세요!!!,3.0,핏 나쁘지 않아 요 여기저기 매치해서 입 기 좋은 옷이에요 언넝사세요
기본디자인의 화이트데님스커트 입고싶던차에 구매했습니다. 기장은 종아리 중간이라 길긴하지만 뒤트임이 있어서 활동에는 불편하지 않습니다.,5.0,기본 디자인의 화이트 데님 스커트 입고 싶던 차에 구매했습니다 기장은 종아리 중간이라 길긴 하지만 뒤트임이 있어서 활동에는 불편하지 않습니다
상품에 대해서 아주 만족하고 입고 있습니다 추천해요,4.0,상품에 대해서 아주 만족하고 입고 있습니다 추천해요
색이 왐전 화이트가 아니라서 좋은듯 사이즈 딱 멎움,5.0,색이 왐 전 화이트가 아니라서 좋은 듯 사이즈 딱 멎움
이게 색이 완전 화이트가 아니어서 오피려 좋은듯,5.0,이게 색이 완전 화이트가 아니어서 오피려 좋은 듯
"합리적인 가격에 구매했습니다
핏너무 예쁘구요
저한테는 M 사이즈가 딱이네요",5.0,합리적인 가격에 구매했습니다 핏 너무 예쁘구요 저한테는 사이즈가 딱이네요
만족합니다 배송도 빠르고 제품도 좋습니다 많이 파세요,5.0,만족합니다 배송도 빠르고 제품도 좋습니다 많이 파세요
아주 만족스러워요. 어떤 옷에 입어도 매칭이 잘돼요,5.0,아주 만족스러워요 어떤 옷에 입어도 매칭이 잘 돼요
"데님이지만 흰색이라 조금 비쳐요
크림색이지만 누렇지않고 화이트 느낌이라 맘에들어요",5.0,데님이지만 흰색이라 조금 비쳐 요 크림색이지만 누렇지 않고 화이트 느낌이라 맘에 들어요
스커트 사이즈 조금 크지만 벨트 하면 괜찮습니다,5.0,스커트 사이즈 조금 크지만 벨트 하면 괜찮습니다
진지하게 색깔별로 다 사고싶을 정도로 편하고 예뻐요,5.0,진지하게 색깔별로 다 사고 싶을 정도로 편하고 예뻐요
입어보자마자 너무 예쁘소 사이즈도 허리가 약간 헐렁하지만 잘 맞아서 너무 좋았어요 !! 전체적인 길이도 적당해서 만족합니다 !!,5.0,입어보자마자 너무 예쁘소 사이즈도 허리가 약간 헐렁하지만 잘 맞아서 너무 좋았어요 전체적인 길이도 적당해서 만족합니다
반팔니트에 입으면 예쁜 것 같아요 길이가 조금만 더 길었으면 좋겠어요,5.0,반팔 니트에 입으면 예쁜 것 같아 요 길이가 조금만 더 길었으면 좋겠어요
저한테는 허리가 좀 크지만 다른부분이 잘맞아서 그냥 입어요. 옷자체도 예쁜것 같아요,4.0,저한테는 허리가 좀 크지만 다른 부분이 잘 맞아서 그냥 입어 요 옷 자체도 예쁜 것 같아요
기장도 적당하고 귀여워서 잘 입고 다녀요! 더러워진다면 다시 사러 올겁니다.,5.0,기장도 적당하고 귀여워서 잘 입고 다녀 요 더러워진다면 다시 사러 올 겁니다
색상깨끗한아이보리색이라다양한상의와어울려.,5.0,색상 깨끗한 아이보리색이라 다양한 상의와 어울려
"딱 기본템이에요
무신사 스탠다드는 질 좋아서 믿고사요",5.0,딱 기 본템이에요 무신사 스탠다드는 질 좋아서 믿고 사요
"사이즈도 잘 맞고 길이도 괜찮아요
색상도 맘에 들어요",4.0,사이즈도 잘 맞고 길이도 괜찮아요 색상도 맘에 들어요
"밝은컬러 사고 싶었는데 맘에들어요
사이즈도 딱 맞고 좋아요",4.0,밝은 컬러 사고 싶었는데 맘에 들어 요 사이즈도 딱 맞고 좋아요
"기대하진 않았는데 생각보다 핏이 이뻐요
다른 색도 사고싶네여",5.0,기대하진 않았는데 생각보다 핏이 이 뻐요 다른 색도 사고 싶네여
예뻐요 근데 신축성1도 없는 재질이라 살 좀만 쪄도 큰일남,4.0,예뻐요 근데 신축성도 없는 재질이라 살 좀 만 쪄도 큰 일남
예뻐요!! 깔끔한 흰색이고 어디에나 매치하기 좋아요!,5.0,예뻐요 깔끔한 흰색이고 어디에나 매치하기 좋아요
생각보다 골반쪽이 너무 마니 남아서 치마를 줄여야하나 고민중인데 아직 한번더 못입었어요 ㅠ,3.0,생각보다 골반쪽이 너무 마니 남아서 치마를 줄여야 하나 고민 중인데 아직 한 번 더 못 입었어요
저한테 허리가 좀 큰데 그래도 핏도 예쁘고 색상도 마음에 들어요~,5.0,저한테 허리가 좀 큰데 그래도 핏도 예쁘고 색상도 마음에 들어요
저한테 사이즈 딱 맞아요 색깔도 이쁘고 핏도이뻐요,5.0,저한테 사이즈 딱 맞아요 색깔도 이 쁘고 핏도 이 뻐요
허리는 좀 크지만 신축성 없어서  넉넉히 사는게 나을것 같아요,5.0,허리는 좀 크지만 신축성 없어서 히 사는 게 나을 것 같아요
흰색 H라인 롱치마 갖고싶어 주문했어요~ 너무 편하고 무난하게 잘 어울립니다,5.0,흰색 라인 롱치마 갖고 싶어 주문했어요 너무 편하고 무난하게 잘 어울립니다
