Review,Star,Processed_Review
이 가격에서는 보세사는 것보다 아주 훌륭하다고 생각합니다-! 아쉬운 점은 주머니 소재가 튼튼하지 않고 주름이 너무 쉽게 생기네용 ㅠㅠ,4.0,이 가격에서는 보세사는 것보다 아주 훌륭하다고 생각합니다 아쉬운 점은 주머니 소재가 하지 않고 주름이 너무 쉽게 생기네 용
"사이즈랑 핏이랑 다 마음에 들어요!
허리가 살짝 크지만 벨트로 포인트 줄수있는 정도에요!",5.0,사이즈랑 핏이랑 다 마음에 들어 요 허리가 살짝 크지만 벨트로 포인트 줄 수 있는 정도에요
딱 원하던 핏과 기장입니다! 다양한 상의와 휘뚜루마뚜루 입기 좋은 것 같아요,5.0,딱 원하던 핏과 기장입니다 다양한 상의와 휘뚜루마 뚜루 입 기 좋은 것 같아요
허리둘레 70센치 엉덩이는 보통 66사이즈 입어야 잘 맞는데 허리에 맞추면 엉덩이 작고 엉덩이 맞추면 허리가 크고 그랬는데 예쁘게 잘 맞아요,5.0,허리둘레 센치 엉덩이는 보통 사이즈 입어야 잘 맞는데 허리에 맞추면 엉덩이 작고 엉덩이 맞추면 허리가 크고 그랬는데 예쁘게 잘 맞아요
엉덩이가 큰편이라 사이즈 걱정했는데 엉덩이는 잘 맞아요. 스판도 좋아서 다리 움직이는데에 전혀 불편하지 않을거같아요,5.0,엉덩이가 큰 편이라 사이즈 걱정했는데 엉덩이는 잘 맞아요 스 판도 좋아서 다리 움직이는 데에 전혀 불편하지 않을 거 같아요
"받자마자 입었을 때는 사이즈가 좀 넉넉했는데
세탁 한번 하고 나니 핏이 약간 줄은 것 같아요
그치만 이 핏이 더 마음에 드네요
뒷트임이 있어서 답답해 보이지 않고 편해요
구김은 좀 심하고 원단이 두꺼운 편이라 더운 날에는 못 입겠지만 크림색이 시원해보이고 여러 룩에 활용하기 좋은 것 같아서 만족합니다",5.0,받자마자 입었을 때는 사이즈가 좀 했는데 세탁 한 번 하고 나니 핏이 약간 줄은 것 같아 요 그치만 이 핏이 더 마음에 드네요 뒷트임이 있어서 해 보이지 않고 편해 요 구 김은 좀 심하고 원단이 두꺼운 편이라 더운 날에는 못 입겠지만 크림색이 시원해 보이고 여러 룩에 활용하기 좋은 것 같아서 만족합니다
생각보다 타이트해서 한사이즈 업 추천드립니다,5.0,생각보다 타이트해서 한 사이즈 업 추천 드립니다
"봄에 입기 좋아요~
좀 타이트 하지만 사이즈도 괜찮은 것 같고
탄탄한 데님이에요",5.0,봄에 입 기 좋아요 좀 타이트 하지만 사이즈도 괜찮은 것 같고 한 데님이에요
"딱 기본 치마라서 어디든지 매치 할 수 있어요! 
여리여리한 느낌이 낭낭해서 좋다구 생각드네요
겨울이니까 귀여운 양말이랑 매치 잘해서 입으면
더더 귀여운 느낌 줄 듯 합니다.",5.0,딱 기 본 치마라서 어디든지 매치 할 수 있어요 여리 여리 한 느낌이 해서 좋다구 생각 드네요 겨울이니까 귀여운 양말이랑 매치 잘해서 입으면 귀여운 느낌 줄 듯 합니다
"오자마자 바로 입어봤는데 지금  날씨에 너무 좋아요!!
그리고 허리는 기존 무탠다드 옷처럼 조금 여유있는 편이에요.
약간의 신축성과 함께 색상과 길이 등 너무 마음에 듭니다!!
사진을 잘 못찍어서 그렇지..더 예뻐요 ㅎㅎ",5.0,오자마자 바로 입어봤는데 지금 날씨에 너무 좋아요 그리고 허리는 기존 무탠다드 옷처럼 조금 여유 있는 편이에 요 약간의 신축성과 함께 색상과 길이 등 너무 마음에 듭니다 사진을 잘 못 찍어서 그렇지 더 예뻐요
예뻐요 일단 예쁘고...맨투맨 후드티 폴라티 아무데나 잘 어울리는듯 롱스커트라 기장 긴 상의 밑에 입으면 귀여워요 뒤에 절개도 되어있어서 신축성 없는 치마 치고 걷기편해요 너무 당연한소린가요? 아무튼 제 키 기준 일어서면 종아리 중간까지 오고 앉으면 무릎 바로 밑까지 와요 무난한데님스커트로 추천..👍,5.0,예뻐요 일단 예쁘고 맨투맨 후드 티 폴라티 아무데나 잘 어울리는 듯 롱 스커트라 기장 긴 상의 밑에 입으면 귀여워요 뒤에 절개도 되어 있어서 신축성 없는 치마 치고 걷기 편해요 너무 당연한 소린가요 아무튼 제 키 기준 일어서면 종아리 중간까지 오고 앉으면 무릎 바로 밑까지 와요 무난한 데님 스커트로 추천
퀄도 괜찮고 핏도 괜찮네요 봄이 오면 입기 딱 인거 같아요,5.0,퀄도 괜찮고 핏도 괜찮네요 봄이 오면 입 기 딱 인 거 같아요
"넘 맘에 들어요! 허리부분이 넉넉해서 벨트하고 다니는데 벨트해도 뒷주름 하나도 안잡혀서 좋습니당~
흰색이어도 데님이라 속비침 걱정 덜하구요 원단도 퀄리티 좋아요
밑에 트임이 있어서 이뻐보이는데 걸을때 보폭이 넘 좁아서 총총 걸어야돼요ㅠㅠㅋㅋ
불편하게 느껴지면 수선해서 입으려구요~",5.0,넘 맘에 들어 요 허리 부분이 해서 벨트하고 다니는데 벨트해도 뒷주름 하나도 안 잡혀서 좋습니 당 흰색이어도 데님이라 속 비침 걱정 덜하구요 원단도 퀄리티 좋아요 밑에 트임이 있어서 이 뻐 보이는데 걸을 때 보폭이 넘 좁아서 걸어야 돼요 불편하게 느껴지면 수선해서 입으려구요
날씬해보이고 어디든 잘 어울립니다! 만족만족~ 아이보리 아니고 흰 색이에용,5.0,날씬해 보이고 어디든 잘 어울립니 다 만족 만족 아이보리 아니고 흰 색이 에용
정말 너무 예쁘고 너무 좋았는데 여행가서.. 된장찌개를 흘리는 바람에.. 다시 살거에요!!,5.0,정말 너무 예쁘고 너무 좋았는데 여행 가서 된장찌개를 흘리는 바람에 다시 살거에요
기본템으로 괜찮은 것 같아요. 근데 길이나 핏감이 아주 세련되지는 않아서 은근 자주 안 입게 되네요,4.0,기본템으로 괜찮은 것 같아 요 근데 길이나 핏감이 아주 세련되지는 않아서 은 근 자주 안 입게 되네요
청바지 27입는 하비형에 뱃살좀 있는데 M사이즈 잘 맞아요! 누런끼없는 크림색이고 깔끔한 느낌 좋아요,4.0,청바지 입는 하비형에 뱃살 좀 있는데 사이즈 잘 맞아요 누런끼 없는 크림색이고 깔끔한 느낌 좋아요
길이랑 두께 딱 적당하구 생각보다 스판끼가 있어서 움직일 때 안 불편해요 근데 색감이 새하얀색은 아니고 아이보리 색이에요 하얀색 아니라 조금 아쉽😞,4.0,길이랑 두께 딱 적당하구 생각보다 스판끼가 있어서 움직일 때 안 불편해 요 근데 색감이 새 하얀색은 아니고 아이보리 색이에 요 하얀색 아니라 조금 아쉽
무탠다드 린넨 셔츠랑 코디되어 있는 스커트를 보고 예뻐서 구매했습니다! 55사이즈 입는데 s주문하니 사이즈 딱 좋네요~~기럭지가 짧아 모델핏은 안나지만 색상도 길이도만족합니다 ^^,5.0,무탠다드 린넨 셔츠랑 코디되어 있는 스커트를 보고 예뻐서 구매했습니다 사이즈 입는데 주문하니 사이즈 딱 좋네요 기럭지가 짧아 모델핏은 안 나지만 색상도 길이도 만족합니다
"허리에 비해 골반 디자인이 좀 넓긴하지만, 막 입기 좋은 것 같아요. 만족합니다.",4.0,허리에 비해 골반 디자인이 좀 넓긴 하지만 막 입 기 좋은 것 같아 요 만족합니다
"생각보다 얇아서 지금입기도 좋아요
사이즈 약간 큽니다
길이감 딱좋고 편해요",4.0,생각보다 얇아서 지금 입기도 좋아요 사이즈 약간 큽니다 길이 감 딱 좋고 편해요
"사이즈 
제 스펙에 M잘 맞아요.
치마 라인 특성상 뱃살 부자의 뱃살 부각은 어쩔 수 없는 것 같지만 열심히 힘주고 다니려고요 
160 키에 너무 길지도 댕강 짧지도 않은 적당한 길이감입니다. 

소재 
무탠다드 답게 탄탄하고 아주 좋아서
넘 맘에들어요. 
소재도 굳 오래입을 것 같아요!!! 
다만 톡톡하고 도톰한 재질이다보니 여름엔 좀 덥지않을까 싶지만 전 그래도 입을겁니다. ㅋㅋ

색, 디자인 
크림컬러에 
스티치가 살짝 더 진한 색이라 
더 멋스러워요 
어떤 룩에나 쉽게 코디할 수 있을 것 같아요! 

결론 
츄천!",5.0,사이즈 제 스펙에 잘 맞아요 치마 라인 특성상 뱃살 부자의 뱃살 부각은 어쩔 수 없는 것 같지만 열심히 힘주고 다니려고 요 키에 너무 길지도 댕 강 짧지도 않은 적당한 길이 감입니다 소재 무탠다드 답게 하고 아주 좋아서 넘 맘에 들어 요 소재도 굳 오래 입을 것 같아 요 다만 하고 도톰한 재질이다 보니 여름엔 좀 덥지 않을까 싶지만 전 그래도 입을 겁니다 색 디자인 크림 컬러에 스티치가 살짝 더 진 한 색이라 더 멋스러워요 어떤 룩에 나 쉽게 코디할 수 있을 것 같아 요 결론 츄천
"흰색이고,핏이 예뻐서 상의 코디하기 좋아요. 무탠은 특히나 사이즈가 다양해서 좋은데, 허리사이즈가 잘 맞아서 안정감있어요. 길이도 적당해서 맘에 듭니다.",5.0,흰색이고핏이 예뻐서 상의 코디하기 좋아요 무탠은 특히나 사이즈가 다양해서 좋은데 허리 사이즈가 잘 맞아서 안정감 있어요 길이도 적당해서 맘에 듭니다
"쪼꼬미가 좋아하는 길이예요
 
미니는 부담스러운데 미디움은 아주 좋아용🤍
더 더워지기전까지 교복입니당",5.0,쪼꼬미가 좋아하는 길이예요 미니는 부담스러운데 미디움은 아주 좋아용 더 더워지기 전까지 교복입니당
크림색이라서 너무 이쁘고 여름에 잘 입을갓 같아요 두께도 적당하고 ㅎㅎ 근데 주름이 좀 잘 갑니다,5.0,크림색이라서 너무 이 쁘고 여름에 잘 입을 갓 같아 요 두께도 적당하고 근데 주름이 좀 잘 갑니다
완전 기본 치마에요. 무난하고 코디하기 쉽습니다. 앉았다 일어나면 생각보다 주름이 잘 지는게 단점이네요.,4.0,완전 기 본 치마에 요 무난하고 코디하기 쉽습니다 앉았다 일어나면 생각보다 주름이 잘 지는 게 단점이네요
치마에 주름이 잘 지긴 한데 이 위에 후드티랑 매치해요 보통,5.0,치마에 주름이 잘 지 긴 한데 이 위에 후드 티랑 매치해요 보통
사이즈가 저한테 어중간하네요 S가 조금 크네요 근데 xs는 또 작을것 같고  제 옷 같지가 않은;;; 세탁하고 나서 보니 옷이 주름이 많이 가네요,4.0,사이즈가 저한테 어 중간 하네요 가 조금 크네요 근데 는 또 작을 것 같고 제 옷 같지가 않은 세탁하고 나서 보니 옷이 주름이 많이 가네요
"158에 통허리에 사이즈 왓다갓다많이하는 편이예요
68~72정도는 왓다갓다하는듯해여..

사이즈는...너무 딱맞구요

장점은 색감이 이쁘고 무난한 디자인이예요
단점 몇가지 나열해보자면

1. 신축성 없음
> 즉 좀만 살쪄도 큰일남
전 매장에서 M입엇는데 너무 널널하니 부해보엿구
그때 S재고가없어가지고 인터넷으로 한치수작은거 사면 맞겟지 하고 시켯는데 너무 딱!!! 진짜 꽉!!맞아서...... 좀만 살찌거나 밥 많이 먹음 큰일나여
안에 좀만 두툼한 상의 못넣어입음

2.길이가 쪼끔 애매함
저같은 다리짧은 키작녀는.. 길이가 먼가 애매한거같아요
차라리 더 길면 나을듯

3.사진에도 나왓다시피 재질이 청?재질이라 그런가
주름 오지게 짐..
출근룩으로 입어봣는데 주름 너무 심하게 져서
어디 오래앉아잇을때 입기엔 ㅂㄹ임
신축성때문에라도 하체 개 뻐근함

그래도 무탠다드 제품 무난하니 좋네여
블프세일로 저렴하게삿으니 이정도면 머 .. 괜춘함!",4.0,에 통 허리에 사이즈 왓 다갓다 많이 하는 편이예요 정도는 왓 다 갓다 하는 듯해 여 사이즈는 너무 딱 맞구 요 장점은 색감이 이 쁘고 무난한 디자인이예요 단점 몇 가지 나열해보자면 신축성 없음 즉 좀 만 살쪄도 큰일 남 전 매장에서 입엇는데 너무 하니 부해 보엿구 그때 재고가 없어가지고 인터넷으로 한 치수작은 거 사면 맞겟지 하고 시켯는데 너무 딱 진짜 꽉 맞아서 좀 만 살찌거나 밥 많이  먹음 큰일 나 여 안에 좀 만 두툼한 상의 못 넣어 입음 길이가 쪼끔 애매함 저 같은 다리 짧은 키 작녀는 길이가 먼 가 애매한 거 같아 요 차라리 더 길면 나을 듯 사진에도 나왓 다시피 재질이 청재질이라 그런 가 주름 오지게 짐 출근룩으로 입어 봣는데 주름 너무 심하게 져서 어디 오래 앉아 잇을 때 입기엔 임 신축성 때문에라도 하체 개 뻐근함 그래도 무탠다드 제품 무난하니 좋네 여 블프세 일로 저렴하게 삿으니 이 정도면 머 괜춘함
100점 허리26입는데 딱이에요 힙도 배도 조금 통통?한데 잘 맞아요,5.0,점 허리입는데 딱이에요 힙도 배도 조금 한데 잘 맞아요
편하고 예쁘네요! 마른 체형인데 넉넉하게 맞아요. 키 158cm한테 기장은 무릎이랑 발목 중간 정도까지 오네요. 품질은 너무 좋아요! 믿고 사는 무신사 스탠다드입니다~,5.0,편하고 예쁘네요 마른 체형인데 하게 맞아요 키 한테 기장은 무릎이랑 발목 중간 정도까지 오네요 품질은 너무 좋아요 믿고 사는 무신사 스탠다드입니다
"166/65
사이즈 잘 맞고 예뻐요.
코디하기도 편함",5.0,사이즈 잘 맞고 예뻐요 코디하기도 편함
데님 마디 스커트인데 편하고 스포티한 상의에도 잘어울려요~,5.0,데님 마디 스커트인데 편하고 스포티한 상의에도 잘 어울려요
이쁘고 길이도 적당하고 다좋은데 구김이 잘생겨요.,4.0,이쁘고 길이도 적당하고 다 좋은데 구김이 잘생겨요
사이즈는 조금 넉넉하고 편해요. 앉아있을때도 편하려고 일부러 좀 넉넉하게 삼 아무데나 입기도 좋아요.,5.0,사이즈는 조금 하고 편해요 앉아 있을 때도 편하려고 일부러 좀 하게 삼 아무데나 입기도 좋아요
"탄탄한 데님 소재라 흰색인데도 비침 없어요 
뭐 묻을까봐 잘 못 입을 줄 알았는데 생각보다 오염에 강한 것 같아서 부담없이 입기 좋아요 
허리 살짝 남기는 하는데 어차피 골반-엉덩이에서 걸려서 상관없고 오히려 편하고 좋은 것 같아요 크지는 않음 !! 
155 기준 길이 이정도입니다 참고하세요",5.0,한 데님 소재라 흰색인데도 비침 없어요 뭐 묻을까봐 잘 못 입을 줄 알았는데 생각보다 오염에 강한 것 같아서 부담 없이 입기 좋아요 허리 살짝 남기는 하는데 어차피 골반 엉덩이에서 걸려서 상관없고 오히려 편하고 좋은 것 같아 요 크지는 않음 기준 길이 이 정도입니다 참고하세요
"사이즈
제 스펙에 M잘 맞아요.
치마 라인 특성상 뱃살 부자의 뱃살 부각은 어쩔 수 없는 것 같지만 열심히 힘주고 다니려고요
160 키에 너무 길지도 댕강 짧지도 않은 적당한 길이감입니다.

소재
무탠다드 답게 탄탄하고 아주 좋아서
넘 맘에들어요.
소재도 굳 오래입을 것 같아요!!!
다만 톡톡하고 도톰한 재질이다보니 여름엔 좀 덥지않을까 싶지만 전 그래도 입을겁니다. ㅋㅋ

색, 디자인
크림컬러에
스티치가 살짝 더 진한 색이라
더 멋스러워요
어떤 룩에나 쉽게 코디할 수 있을 것 같아요!

결론
추천!",5.0,사이즈 제 스펙에 잘 맞아요 치마 라인 특성상 뱃살 부자의 뱃살 부각은 어쩔 수 없는 것 같지만 열심히 힘주고 다니려고 요 키에 너무 길지도 댕 강 짧지도 않은 적당한 길이 감입니다 소재 무탠다드 답게 하고 아주 좋아서 넘 맘에 들어 요 소재도 굳 오래 입을 것 같아 요 다만 하고 도톰한 재질이다 보니 여름엔 좀 덥지 않을까 싶지만 전 그래도 입을 겁니다 색 디자인 크림 컬러에 스티치가 살짝 더 진 한 색이라 더 멋스러워요 어떤 룩에 나 쉽게 코디할 수 있을 것 같아 요 결론 추천
"사이즈 
제 스펙에 M잘 맞아요.
치마 라인 특성상 뱃살 부자의 뱃살 부각은 어쩔 수 없는 것 같지만 열심히 힘주고 다니려고요 
160 키에 너무 길지도 댕강 짧지도 않은 적당한 길이감입니다. 

소재 
무탠다드답게 탄탄하고 아주 좋아서
넘 맘에들어요. 
소재도 굳 오래입을 것 같아요!!! 
다만 톡톡하고 도톰한 재질이다보니 여름엔 좀 덥지않을까 싶지만 전 그래도 입을겁니다. ㅋㅋ

색, 디자인 
크림컬러에 
스티치가 살짝 더 진한 색이라 
더 멋스러워요 
어떤 룩에나 쉽게 코디할 수 있을 것 같아요! 

결론 
츄천!",5.0,사이즈 제 스펙에 잘 맞아요 치마 라인 특성상 뱃살 부자의 뱃살 부각은 어쩔 수 없는 것 같지만 열심히 힘주고 다니려고 요 키에 너무 길지도 댕 강 짧지도 않은 적당한 길이 감입니다 소재 무탠다드답게 하고 아주 좋아서 넘 맘에 들어 요 소재도 굳 오래 입을 것 같아 요 다만 하고 도 톰한 재질이다 보니 여름엔 좀 덥지 않을까 싶지만 전 그래도 입을 겁니다 색 디자인 크림컬 러에 스티치가 살짝 더 진 한 색이라 더 멋스러워요 어떤 룩에 나 쉽게 코디할 수 있을 것 같아 요 결론 츄천
허리가 살짝 널널하긴 하지만 깔끔하고 편해서 입기 좋아요.,5.0,허리가 살짝 하긴 하지만 깔끔하고 편해서 입기 좋아요
"무탠다드는 단연 쵝오에용
사이즈는 좀 크고,편하게 입을 수 있어요
색상이 밝은 크림색이 아닌 좀 그런 크림색이에요
어떠한 옷에다 입어두 돋보이는 옷이에요",5.0,무탠다드는 단 연 쵝 오에 용 사이즈는 좀 크고 편하게 입을 수 있어요 색상이 밝은 크림색이 아닌 좀 그런 크림색이에요 어떠한 옷에 다 입어 두 돋보이는 옷이에요
적당히 신축감도 조금 있고 옷이 문안하게 과하지 않고 기본에 집중해서 편하고 좋습니다,5.0,적당히 신축 감도 조금 있고 옷이 문안하게 과하지 않고 기본에 집중해서 편하고 좋습니다
핏이랑 기장이 맘에 들어요!! 아무 옷이랑 잘 어울릴 것 같고요~ 배송도 빠르고 추천합니다,5.0,핏이랑 기장이 맘에 들어 요 아무 옷이랑 잘 어 울릴 것 같고 요 배송도 빠르고 추천합니다
"기장이랑 뒤 트임 딱 적당하구 색도 예쁜데 제가 하비라 그런가 다리에 맞게 삿더니 허리가 쫌 커요,,",5.0,기장이랑 뒤 트임 딱 적당하구 색도 예쁜데 제가 하비라 그런 가 다리에 맞게 삿더니 허리가 쫌 커요
가성비 좋아요 코디하기 편하고 만족도 높습니다,3.0,가성비 좋아요 코디하기 편하고 만족도 높습니다
허리 24~25고 xs샀는데 살짝 커요. 화이트 색상이라 위에 아무거나 입기 좋아요! 스판끼는 없어서 뻣뻣한데 원래 청 재질이 그러니까 괜찮아요! 허리 살짝 커서 무탠다드 벨트도 샀어요ㅋ,5.0,허리 고 샀는데 살짝 커요 화이트 색상이라 위에 아무거나 입 기 좋아요 스판끼는 없어서 한데 원래 청 재질이 그러니까 괜찮아요 허리 살짝 커서 무탠다드 벨트도 샀어요
슬릿이 있어서 움직임도 편안하고 봄여름가을 너무 덥지않을때 두루 잘입을듯해요,5.0,슬릿이 있어서 움직임도 편안하고 봄 여름 가을 너무 덥지 않을 때 두루 잘 입을 듯 해요
면이라 구김이 잘 가지서 아쉽지만 예뻐요 제 키가 170인데도 생각보다 기장이 길어서 좋았어요,4.0,면이라 구김이 잘 가지서 아쉽지만 예뻐요 제 키가 인데도 생각보다 기장이 길어서 좋았어요
"하이웨스트위치라서입으면 길어보여요 굳굳 
잘어울림",5.0,하이웨스트 위치라서 입으면 길어 보여 요 잘 어울림
"너무 딱 붙지 않고 입을 수 있어서 좋아요~
기장도 너무 길지 않고 너무 두껍지 않아서 좋아요~",5.0,너무 딱 붙지 않고 입을 수 있어서 좋아요 기장도 너무 길지 않고 너무 두껍지 않아서 좋아요
너무이뻐요 핏도좋고 질도좋아요 감사합니다 잘입을께요,5.0,너무 이 뻐요 핏도 좋고 질도 좋아요 감사합니다 잘 입을께요
진짜 치마 모양이 잘 잡혀있어서 핏이 예쁘고 편해요 완전 추천합니다,5.0,진짜 치마 모양이 잘 잡혀 있어서 핏이 예쁘고 편해요 완전 추천합니다
편하게 입기 좋습니다 신축성 없는 원단이라서 큰 사이즈 L로 주문했는데 많이 크네요 그래도 편해서  다른 색으로 M 사고 싶어요 ㅋㅋ,5.0,편하게 입 기 좋습니다 신축성 없는 원단이라서 큰 사이즈 로 주문했는데 많이 크네요 그래도 편해서 다른 색으로 사고 싶어요
오프라인 매장 가서 입어보고 예뻐서 구매했어요 어느 옷에나 잘어울려요,5.0,오프라인 매장 가서 입어보고 예뻐서 구매했어요 어느 옷에나 잘 어울려요
"평소 바지 24인치, 44 입는 날씬한 체형인데 XS 적당히 여유있어요. 신축성이 거의 없어서 밥먹으면 딱맞아요ㅜㅜ 엄청 마르신 분들께는 XS도 클 것 같아요
약간 a라인인 줄 알았는데 일자핏이에요~
키 157 기준 종아리 2/3정도 덮어서 좀 줄여서 입으려구요. 사진은 줄이기 전이에요",5.0,평소 바지 인치 입는 날씬한 체형인데 적당히 여유 있어요 신축성이 거의 없어서 밥 먹으면 딱 맞아요 엄청 마르신 분들께는 도 클 것 같아 요 약간 라 줄 알았는데 일자핏이에 요 키 기준 종아리 정도 덮어서 좀 줄여서 입으려구요 사진은 줄이기 전이에요
귀엽고 딱 맞아요! 아방하지도 않고 좋습니다! 노란끼도 없어서 좋아요,5.0,귀엽고 딱 맞아요 아방하지도 않고 좋습니다 노란끼도 없어서 좋아요
"흰색보다 크림색이라 더 마음에 듭니다
사이즈가 좀 크게 나온 것 같아요
S 사이즈인데 평소 26-27 입는 저에게 잘 맞네요
한 여름에 입기에는 더울 것 같지만 간절기에는 딱 인듯요
만족합니다!",5.0,흰색보다 크림색이라 더 마음에 듭니다 사이즈가 좀 크게 나온 것 같아 요 사이즈인데 평소 입는 저에게 잘 맞네요 한 여름에 입기에는 더울 것 같지만 간절기에는 딱 인 듯 요 만족합니다
이 치마는 어떤 옷이든 잘어울려요 왜냐면 이쁘거든요! 가성비에 맞게 잘 산것같아여!!! 가디건이랑 입으면 완전 이쁠것같아요,5.0,이 치마는 어떤 옷이든 잘 어울려 요 왜냐면 이 쁘거든요 가성비에 맞게 잘 산 것 같아 여 가디건이랑 입으면 완전 이쁠 것 같아요
앉았다 일어나면 주름 많이 지긴하는데 ㄱ이정도야..갠춘. 허리가 조금 크긴한데 니트같은거 안으로 껴입으면 딱맞아여,5.0,앉았다 일어나면 주름 많이 지긴 하는데 이 정도 야갠춘 허리가 조금 크긴 한데 니트 같은 거 안으로 껴입으면 딱 맞아 여
"M사이즈 사도 괜찮았을거같기도 한데,,,어쨌든 와이셔츠에도 입고 맨투맨에도 입고 휘뚜루마뚜루 무난하게 잘입고 있슴당 두께가 좀 있고 좀? 무거워서 가을에 입으면 딱 좋아용",5.0,사이즈 사도 괜찮았을 거 같기도 한데 어쨌든 와이셔츠에도 입고 맨투맨에도 입고 휘뚜루 마 뚜루 무난하게 잘 입고 있슴 당 두께가 좀 있고 좀 무거워서 가을에 입으면 딱 좋아용
"신축성이 보통이라고 나와있어서 어느정도의 신축성은 있을꺼라고 생각했는데 신축성은 거의 없는듯해요! 스판이 짱짱하진않아요!
대신 평소 바지 27사이즈 입는데 S사이즈 허리 좀 넉넉하구요 밥 배부르게 먹어도 남아요! 크다는거죠ㅠㅠ
xs사이즈 있었으면 좋았을듯해요ㅠㅠ 골반이랑도 좀커서 오히려 등치 있어보여요 ㅋㅋ
길이는 제 기준에서는 조금 더 짧아도 괜찮았을듯해요! 그래도 다른 미디사이즈 치마들보다 짧게 잘 나왔더라구요 ! 만족합니다!",5.0,신축성이 보통이라고 나와 있어서 어느 정도의 신축성은 있을 꺼라고 생각했는데 신축성은 거의 없는 듯해요 스판이 하진 않아 요 대신 평소 바지 사이즈 입는데 사이즈 허리 좀 하구요 밥 배부르게 먹어도 남아 요 크다는 거죠 사이즈 있었으면 좋았을 듯해요 골반이랑도 좀 커서 오히려 등치 있어 보여 요 길이는 제 기준에서는 조금 더 짧아도 괜찮았을 듯해요 그래도 다른 미디 사이즈 치마 들보다 짧게 잘 나왔더라구 요 만족합니다
색깔 이뻐요 여름에도 겨울에도 입기 나쁘지 않을 두께예요,5.0,색깔 이 뻐요 여름에도 겨울에도 입기 나쁘지 않을 두께예요
넘나이뻐욧 제갸 생각한 이상적인 핏! 잘입을게요,5.0,넘나이 뻐욧 제 갸 생각한 이상적인 핏 잘 입을 게요
