Review,Star,Processed_Review
"약간의 베이지 색이 섞인 흰색 스커트입니다 면남방이나 가디건, 니트 어디에나 어울리는 치마입니다 겨울에만 못입을 것 같고 언제나 입기 좋아요~",5.0,약간의 베이지 색이 섞인 흰색 스커트입니다 면 남방이나 가디건 니트 어디에나 어울리는 치마입니다 겨울에만 못 입을 것 같고 언제나 입 기 좋아요
"와이프 사줬는데 완전 만족햐합니다^^
백화점 가는 것 좋아했는데 무신사 바지 치마 좋아하게 되었어요",5.0,와이프 사 줬는데 완전 만족햐합니다 백화점 가는 것 좋아했는데 무신사 바지 치마 좋아하게 되었어요
옷이 편하고 예뻐 어느 상의나 대체적으로 잘어울립니다,5.0,옷이 편하고 예뻐 어느 상의 나 대체적으로 잘 어울립니다
살쪄서 큰 사이즈 찾고 있었는데 한줄기 빛 같았어요,5.0,살쪄서 큰 사이즈 찾고 있었는데 한 줄기 빛 같았어요
이뻐용 길이도 적당하고 무신사치마가 가성비예요!,5.0,이 뻐용 길이도 적당하고 무신 사치마가 가성비예요
흰색이라 부담되긴 하는데 잘 입고 다녀여! 가성비예요,5.0,흰색이라 부담되긴 하는데 잘 입고 다녀 여 가성비예요
"도톰해서 맘에 들어요
계던 조금 불편하긴 한뎅 괜찮습니당",5.0,도톰해서 맘에 들어 요 계 던 조금 불편하긴 한 뎅 괜찮습니당
"가성비 좋은치마예요^^ 색도 이쁘고 좋아요^^
와이프가 좋아합니다",5.0,가성비 좋은치마예요 색도 이 쁘고 좋아요 와이프가 좋아합니다
재질도 완전 좋고 사이즈도 잘 맞아서 만족해요. 굿굿!,5.0,재질도 완전 좋고 사이즈도 잘 맞아서 만족해요
27입어서 평 보고 26사이즈 선택했는데 편하고 너무 예쁘네요,5.0,입어서 평 보고 사이즈 선택했는데 편하고 너무 예쁘네요
길이감 있는 스커트 찾고있었는데 딱입니다 역시 무탠다드,5.0,길이 감 있는 스커트 찾고 있었는데 딱입니다 역시 무탠다드
색도 예쁘고 핏도 깔끔합니당 롱치마인데도 걷고 계단오르기 편해서 좋아요!,5.0,색도 예쁘고 핏도 깔끔합니 당 롱치마인데도 걷고 계단 오르기 편해서 좋아요
전체적으로 핏이 예뻐요 ! 허리가 딱 맞아서 좋았습니다,4.0,전체적으로 핏이 예뻐요 허리가 딱 맞아서 좋았습니다
깔끔하고 길이도 잘 맞고 편하게 입기에 좋은것 같아요 무탠다드에 작은 사이즈가 딱맞네요,5.0,깔끔하고 길이도 잘 맞고 편하게 입기에 좋은 것 같아 요 무탠다드에 작은 사이즈가 딱 맞네요
여친이좋아합니다요옹옹오ㅗ로오오옹ㅎㅎ귯깃귯겟,5.0,여친이 좋아합니다 요오로 옹귯깃귯겟
생각보다 재질이 두껍지 않고 편해요 편하게 입을 것 같아요,5.0,생각보다 재질이 두껍지 않고 편해 요 편하게 입을 것 같아요
딱 숨쉬기 좋을만큼 품이 남게 맞아요! 허리단면 38.5 나오시는 분들 충분히 맞습니다,5.0,딱 숨 쉬기 좋을 만큼 품이 남게 맞아요 허리 단면 나오시는 분들 충분히 맞습니다
검정사고 맘에 들어서 크림도 샀어요 이 가격에 퀄리티가 아주 좋아요,5.0,검정사고 맘에 들어서 크림도 샀어요 이 가격에 퀄리티가 아주 좋아요
블랙사고 맘에 들어서 크림도 사버렸어요 이가격에 퀄리티 굿,5.0,블랙 사고 맘에 들어서 크림도 사 버렸어요 이 가격에 퀄리티 굿
"교복처럼 매일 입는 스커트
편하고 시원하고 좋아요",5.0,교복처럼 매일 입는 스커트 편하고 시원하고 좋아요
생각보다 길고 신축성이 없어서 걷기는 좀 불편할 것 같아요.,4.0,생각보다 길고 신축성이 없어서 걷기는 좀 불편할 것 같아요
오프라인 매장가서 입어보고 질 좋고 핏도 예뻐서 구매했어요 후회 앙해요,5.0,오프라인 매장 가서 입어보고 질 좋고 핏도 예뻐서 구매했어요 후회 앙해요
"배송 빠르고 정사이즈네요.
기본 H라인 롱스커트 트임이 있어서 편하네요.
롱스커트 좋아하는데 길이감도 적당 해요.
밝은 아이보리 컬러라 코디하기도 쉬울거 같아요.
추천합니다 .",5.0,배송 빠르고 정 사이즈네요 기본 라인 롱스커트 트임이 있어서 편하네요 롱 스커트 좋아하는데 길이 감도 적당 해요 밝은 아이보리 컬러라 코디하기도 쉬울 거 같아 요 추천합니다
아주 맘에 듭니다. 색상은 오프화이트 느낌입니다~,5.0,아주 맘에 듭니다 색상은 오프 화이트 느낌입니다
사이즈가 타이트 할줄 알았는데 넉넉하네요. 그래서인지 신축성 없는 원단임에도 불편하지 않네요.,5.0,사이즈가 타이트 할 줄 알았는데 하네요 그래서인지 신축성 없는 원단임에도 불편하지 않네요
사이즈가 생각보다 크네요. 신축성 없지만 불편하지 않아요.,5.0,사이즈가 생각보다 크네요 신축성 없지만 불편하지 않아요
생각했던 것보다 퀄리티가 훨씬 더 좋네요 무신사 스탠다드 이용 할게요,5.0,생각했던 것보다 퀄리티가 훨씬 더 좋네요 무신사 스탠다드 이용 할게요
"하리가 살짝 크긴한데
벨트하면 돼용
탄탄해서 좋아요",5.0,하리가 살짝 크긴 한데 벨트하면 돼 용 해서 좋아요
사이즈가 널널하니 잘 맞고 여기저기 다 잘 어울리는 것 같아서 좋아요,5.0,사이즈가 하니 잘 맞고 여기저기 다 잘 어울리는 것 같아서 좋아요
"평소 허리 28 입는 저한테 사이주는 잘 맞았어양..
근데...똥배부각 오지는... 
날 풀리면 맨투맨에다 입어서 뱃살 가려야 댈듯 ㅎ",4.0,평소 허리 입는 저한테 사이주는 잘 맞았어 양 근데 똥배부각 오지는 날 풀리면 맨투맨에다 입어서 뱃살 가려야 댈 듯
"편하게 휘뚜루마뚜루 입기 좋습니다
27-28입는데 M샀더니 허리가 좀 크네요..!",4.0,편하게 휘뚜루마 뚜루 입 기 좋습니다 입는데 샀더니 허리가 좀 크네요
"사이즈 좋구 색감좋구
재질도 이가격에 괜찮은거 같아요",4.0,사이즈 좋구 색감 좋구 재질도 이 가격에 괜찮은 거 같아요
"입다보니 허리가 계속 늘어나긴하는데 
옷은 예뻐요",5.0,입다 보니 허리가 계속 늘어나긴 하는데 옷은 예뻐요
다른 색 샀다가 마음에들어서 크림색도 샀어요 여름에 시원해보이고 좋아요,5.0,다른 색 샀다가 마음에 들어서 크림색도 샀어요 여름에 시원해 보이고 좋아요
"제 키엔 길어서 길이를 줄였어요. 흰색 사고 만족해서 연청도 샀어요
구김이 잘 가긴 하지만 사계절 잘 입을 것 같아요~",5.0,제 키엔 길어서 길이를 줄였어요 흰색 사고 만족해서 연청도 샀어요 구김이 잘 가 긴 하지만 사 계절 잘 입을 것 같아요
사이즈 잘 맞는 것 같아요! 허리사이즈는 조금 여유롭게 맞아서 옷 넣어입기도 가능할 것 같아요,5.0,사이즈 잘 맞는 것 같아 요 허리 사이즈는 조금 여유롭게 맞아서 옷 넣어 입기도 가능할 것 같아요
배송은 빠름 생각보다 걸을때 불편하고 통일자 치마임,5.0,배송은 빠름 생각보다 걸을 때 불편하고 통일자 치마임
"평소에 갖고 싶었던 스타일이였는데, 만족스러운 퀄리티에 만족합니다.
굉장히 깔끔한 스타일에 뭐든 받쳐 입기 좋은 스커트네요, 근데 사이즈 미스로 좀 크게 사서 허리가 낙낙하지만 허리는 줄여 입기로...ㅎㅎ
그래도 엉덩이 쪽은 굉장히 자연스러워서  M 샀어도 괜찮을거 같기도...?
아무튼 색상이랑 길이감이 너무 좋아요! 굿굿",5.0,평소에 갖고 싶었던 스타일이였는데 만족스러운 퀄리티에 만족합니다 굉장히 깔끔한 스타일에 뭐든 받쳐 입 기 좋은 스커트네요 근데 사이즈 미스로 좀 크게 사서 허리가 하지만 허리는 줄여 입기로 그래도 엉덩이 쪽은 굉장히 자연스러워서 샀어도 괜찮을 거 같기도 아무튼 색상이랑 길이감이 너무 좋아요
아이보리 아니고 하얀색이라서 좋아요! 편합니다~,5.0,아이보리 아니고 하얀색이라서 좋아요 편합니다
여름용으로 샀는데 생각보다 조 두껍고 사이즈가 작네요,3.0,여름용으로 샀는데 생각보다 조 두껍고 사이즈가 작네요
"커요
허리도크고
폭도 크고
생각보다 두꺼워요
색은 아이보리에 가깝습니다",3.0,커요 허리도 크고 폭도 크고 생각보다 두꺼워요 색은 아이보리에 가깝습니다
"치마 모양 넘나 이뻐요!
하지만 저에게 살짝 끼어서 살 더 빼고 입으려구요~",5.0,치마 모양 넘나 이 뻐요 하지만 저에게 살짝 끼어서 살 더 빼고 입으려구요
"이쁜아이보리컬러가 이뿌고
부들부들한 면이라 좋아요
골반에 맞추느라 L했더니 크네요

블랙 M으로 하나 더 주문했어요",5.0,이쁜 아이보리 컬러가 이 뿌고 부들부들한 면이라 좋아요 골반에 맞추느라 했더니 크네요 블랙 으로 하나 더 주문했어요
빠르게 배송되어서 만족합니다. 추가구매생각중이예요,5.0,빠르게 배송되어서 만족합니다 추가 구매 생각 중이예요
배송이 빠르게 도착했고 허리가 약간 크고 길이는 종아리 중간 정도 와요,5.0,배송이 빠르게 도착했고 허리가 약간 크고 길이는 종아리 중간 정도 와요
배송이 빠르게 도착했고 허리 사이즈가 좀 큰데 그래도 핏이 예뻐요 완전 화이트 아니고 약간 아이보리 색상인데 예뻐요,5.0,배송이 빠르게 도착했고 허리 사이즈가 좀 큰데 그래도 핏이 예뻐요 완전 화이트 아니고 약간 아이보리 색상인데 예뻐요
원단이 탄탄하고 키가 큰데도 종아리까지 와서 좋아요,5.0,원단이 하고 키가 큰데도 종아리까지 와서 좋아요
길이도 적당하고 허리둘레도 적당하게 맞습니다.,5.0,길이도 적당하고 허리 둘레도 적당하게 맞습니다
"Xs살걸 허리가 헐렁 ,, 다음에 무신사꺼 사면 더 작은고 살려구요 비슷한 체형 참고하세용 저는 교환이 더 긔찮아서 줄임",5.0,살 걸 허리가 헐렁 다음에 무신 사 꺼 사면 더 작은 고 살려 구요 비슷한 체형 참고하 세용 저는 교환이 더 긔찮아서 줄임
생각보다 커용 그래두 예쁘게 입을 수 있을 거 같아용 여름엔 노논,5.0,생각보다 커용 그래 두 예쁘게 입을 수 있을 거 같아 용 여름엔 노논
"입으면 구김이 좀 가긴 해요..하하
근데 넘나 좋습니다! 데님으로도 살거랍니다!",5.0,입으면 구김이 좀 가 긴 해요 근데 넘나 좋습니다 데님으로도 살 거랍니다
"너무 적당하고 좋았어요
제가 보폭이 넓은 편이라 당황스럽지만 
제 보푹 문제니깐 
치마 넘 예쁩니다",5.0,너무 적당하고 좋았어요 제가 보폭이 넓은 편이라 당황스럽지만 제 보푹 문제니깐 치마 넘 예쁩니다
원단도 탄탄하고 핏도 예뻐요. 잘받았습니다.감사합니다.,5.0,원단도 하고 핏도 예뻐요 잘 받았습니다 감사합니다
사이즈 맞고 핏도 예쁘고 잘샀어요..원단도 탄탄하고 좋아요.,5.0,사이즈 맞고 핏도 예쁘고 잘 샀어요 원단도 하고 좋아요
흰색이라 걱정했는데 예쁘고 맘에들어요. 사이즈도 잘 맞고 만족합니다.,5.0,흰색이라 걱정했는데 예쁘고 맘에 들어 요 사이즈도 잘 맞고 만족합니다
어디에나 잘 어울리고 예뻐요! 많이 마른편이라 좀 크긴 하지만 상의를 넣어 입으면 괜찮아요. 가격 대비 질이 좋고 좀 두꺼운 편이라 가을까지 입을 수 있을 것 같네요.,5.0,어디에나 잘 어울리고 예뻐요 많이 마른 편이라 좀 크긴 하지만 상의를 넣어 입으면 괜찮아요 가격 대비 질이 좋고 좀 두꺼운 편이라 가을까지 입을 수 있을 것 같네요
"지짜 좋아요...내 허리 사이즈는 S 33.5였구나,, 어쩜 저에게 딱 잘 맞죠?? 휘뚜루마뚜루 입기 너~무 좋아요. 지땡그땡 어플에서 찾지 말고 무탠다드에서 찾으세요~",5.0,지짜 좋아요 내 허리 사이즈는 였구나 어 쩜 저에게 딱 잘 맞죠 휘뚜루 마 뚜루 입 기 너무 좋아요 지 땡 그땡 어플에서 찾지 말고 무탠다드에서 찾으세요
여름에 휘뚜루마뚜루 입기 좋아요. 지땡그땡에서 찾고찾다가 무탠다드에사 찾았는데 완전 가성비 짱,5.0,여름에 휘뚜루마 뚜루 입 기 좋아요 지 땡 그땡에서 찾고 찾다가 무탠다드에 사 찾았는데 완전 가성비 짱
살쪄서 배랑 엉덩이 걱정했는데 다행히 길이도 핏도 만족입니당,5.0,살쪄서 배랑 엉덩이 걱정했는데 다행히 길이도 핏도 만족입니당
"168/68
누가봐도 하체만 보면 85kg는 나가보일 정도로 하체 비만임 
그냥 비만이 아니고 뮤릎부터 엉덩이까지 진짜 핵돼진데 
잘맞아요
적당히 여유있고 편안함
근데 허리가 큽니다
하지만 귀찮아서 그냥 입습니다
(허벅지 젤 두꺼운 부분 62cm
엉덩이 102cm임)

색깔이 좀 더 다양햇음 깔별로 샀을 거 같음",5.0,누가 봐도 하체만 보면 는 나가 보일 정도로 하체 비만 임 그냥 비만이 아니고 뮤릎부터 엉덩이까지 진짜 핵 돼진데 잘 맞아요 적당히 여유 있고 편안함 근데 허리가 큽니 다 하지만 귀찮아서 그냥 입습니다 허벅지 젤 두꺼운 부분 엉덩이 임 색깔이 좀 더 다양햇음 깔별로 샀을 거 같음
흰색이라 데님이라해도 약간 비치긴 해요 그래도 무난하게 잘 입을 수 있는 거라 괜찮아요,4.0,흰색이라 데님이라 해도 약간 비치긴 해요 그래도 무난하게 잘 입을 수 있는 거라 괜찮아요
허리가 약간 크고 엉덩이쪽을 쭉 내밀면 속옷이 비치긴해도 디자인이 심플해서 아무데나 다 잘 어울려요,5.0,허리가 약간 크고 엉덩이 쪽을 쭉 내밀면 속옷이 비치긴 해도 디자인이 심플해서 아무 데나 다 잘 어울려요
예쁩니다~ 흰치마에 얼룩이 묻어왔는데 귀찮아서 그냥 입어여,4.0,예쁩니다 흰 치마에 얼룩이 묻어왔는데 귀찮아서 그냥 입어여
적당한 크기에 적당한 길이 딱 너무 예쁜 화이트 스커트 입니다,5.0,적당한 크기에 적당한 길이 딱 너무 예쁜 화이트 스커트 입니다
키 158cm에게 발목이 어느 정도 보이는 기장이에요. 긴대로 예쁘네요. 어떤 상의에나 잘 어울려요.,5.0,키 에게 발목이 어느 정도 보이는 기장이에요 긴 대로 예쁘네요 어떤 상의 에나 잘 어울려요
"깔끔하고 이뻐요
추천해드려요 다음에 또 구매하려고",5.0,깔끔하고 이 뻐요 추천해드려 요 다음에 또 구매하려고
"뻣뻣하지 않고 부드럽습니다.
노란 느낌도 없어서 좋아요 
허리는 좀 큰데 엉덩이 부분이 맞습니다. 
편해여!",4.0,하지 않고 부드럽습니다 노란 느낌도 없어서 좋아요 허리는 좀 큰데 엉덩이 부분이 맞습니다 편해여
"평소 바지 24인치, 44 입는 날씬한 체형인데 XS 적당히 여유있어요. 신축성이 거의 없어서 밥먹으면 딱맞아요ㅜㅜ 엄청 마르신 분들께는 XS도 클 것 같아요
약간 a라인인 줄 알았는데 일자핏이에요~
키 157 기준 종아리 2/3정도 덮어서 좀 줄여서 입으려구요. 밝고 살짝 노란끼있는 자연스러운 크림색이라 너무 예뻐요. 생화이트는 아니지만 그렇다고 누런 색도 절대 아니에요",5.0,평소 바지 인치 입는 날씬한 체형인데 적당히 여유 있어요 신축성이 거의 없어서 밥 먹으면 딱 맞아요 엄청 마르신 분들께는 도 클 것 같아 요 약간 라 줄 알았는데 일자핏이에 요 키 기준 종아리 정도 덮어서 좀 줄여서 입으려구요 밝고 살짝 노란 끼 있는 자연스러운 크림색이라 너무 예뻐요 생화이트는 아니지만 그렇다고 누런 색도 절대 아니에요
"사이즈는 딱 좋은데 중간에 파랗게 이염된 부분들이
있었어요. 텍을 제거해버려서 반품을 못했네요.",5.0,사이즈는 딱 좋은데 중간에 파랗게 이염된 부분들이 있었어요 텍을 제거해버려서 반품을 못했네요
선명한 하얀색이기는 하지만 파랗게 뭔가 묻어져있었어요. 택을 재거해서 반품은 못해서 아쉽네요,4.0,선명한 하얀색이기는 하지만 파랗게 뭔가 묻어져 있었어요 택을 재거해서 반품은 못해서 아쉽네요
일부러 xs로 시켰는데 허리는 잘 맞는데 조금 엉덩이 부분ㅇ 작아서 주름이 생겨여 에스로 시킬걸,5.0,일부러 로 시켰는데 허리는 잘 맞는데 조금 엉덩이 부분 작아서 주름이 생겨 여 에스로 시킬 걸
무신사스탠다드 제품은 여기저기 기본으로 입기 좋습니다. 여름에 잘 입을 것 같아요!!,5.0,무신사 스탠다드 제품은 여기저기 기본으로 입 기 좋습니다 여름에 잘 입을 것 같아요
너무 구겨져서 왔고 박음질도 좀 지저분하지만.. 가격이 싸니.. 디자인은 괜찮습니다,4.0,너무 구겨져서 왔고 박 음질도 좀 지저분하지만 가격이 싸니 디자인은 괜찮습니다
"사진이랑 색상 동일하구요
맨날 허리가 컸는데 허리딱 들뜸없이 너무 이쁘게 맞아요!
하필 장마 시작이라..장마 끝나구 입으려구요
완전 한여름에는 더울꺼같은데 실내에서는 괜찮을꺼같아요",5.0,사진이랑 색상 동일하구요 맨날 허리가 컸는데 허리 딱 들 뜸 없이 너무 이쁘게 맞아요 하필 장마 시작이라 장마 끝나 구 입으려구요 완전 한 여름에는 더울꺼 같은데 실내에서는 괜찮을 꺼 같아요
S사이즈가 작을까봐 M샀는데 허리가 많이 커요.,5.0,사이즈가 작을까봐 샀는데 허리가 많이 커요
치마 길이도 마음에 들고 휘뚜루 마뚜루 편하게 잘 입을것같아요,5.0,치마 길이도 마음에 들고 휘뚜루 마뚜루 편하게 잘 입을 것 같아요
"아.. 생각보다 커요.. 긴건 예상 한정도ㅎㅎ
타이트하고싶었는데.. 넉넉해버리 안이쁨 ㅎㅎ;;;;",5.0,아 생각보다 커요 긴 건 예상 한 정도 타이트하고 싶었는데 해버리 안이 쁨
배송 빠르고 옷도 탄탄하고 좋아요 기본템 입니다,5.0,배송 빠르고 옷도 하고 좋아요 기본템 입니다
"딱 기본입니다. 하나 사두면 좋아요
사이즈 일부러 하나 크게 샀어요..많이 크지도 않고 좋아요",5.0,딱 기 본입니다 하나 사두면 좋아요 사이즈 일부러 하나 크게 샀어요 많이 크지도 않고 좋아요
옷이 몸에 안붙고 떠있는 느낌이에요. 앉아있으면 명치까지 올라옴(?),3.0,옷이 몸에 안 붙고 떠 있는 느낌이에요 앉아 있으면 명치까지 올라옴
소재때문인지 오래 앉아있으면 살짝 불편한듯요,4.0,소재 때문인지 오래 앉아 있으면 살짝 불편한 듯요
무난하게 학교에 입고다니기 좋아요. 데님이라 두께가 있는편이라 한여름에 괜찮을지 모르겠네요,5.0,무난하게 학교에 입고 다니기 좋아요 데님이라 두께가 있는 편이라 한 여름에 괜찮을지 모르겠네요
무난하니 예쁜 흰색 롱치마임 탄탄해서 맘에듭니다,5.0,무난하니 예쁜 흰색 롱치 마임 해서 맘에 듭니다
노란끼도 없고 아방하지도 않고 딱맞아서 좋아요,5.0,노란끼도 없고 아방하지도 않고 딱 맞아서 좋아요
"제 빵디를 과소 평가 했습니다..

치마 자체의 디자인, 핏, 색감은 다 예뻐요..
스판기는 없어서 버스 탈 때 약간 빡셉니다..

빵디 사이즈를 확인하고 하나 크게 사서 허리 줄이는 게 베스트 같아요...

재구매 의사는 있어요.. 한 사이즈 크게 산다면 말이죠... 훌쩍",4.0,제 빵디를 과소 평가 했습니다 치마 자체의 디자인 핏 색감은 다 예뻐요 스판기는 없어서 버스 탈 때 약간 빡셉니다 빵디 사이즈를 확인하고 하나 크게 사서 허리 줄이는 게 베스트 같아 요 재구매 의사는 있어요 한 사이즈 크게 산다면 말이 죠 훌쩍
여기저기 이쁘게 입을 수 있어요! 완전 무난템이에요,4.0,여기저기 이쁘게 입을 수 있어요 완전 무난템이에요
"키가 작은 저에겐 롱이지만 그래서 더 맘에 들어요~
색도 누런끼없이 하얘서 예뻐요",5.0,키가 작은 저에겐 롱이지만 그래서 더 맘에 들어 요 색도 누런끼 없이 하얘서 예뻐요
키 170인데 무릎을 살짝 덮을 정도구요. 지금 입기 좋아요. 재질이 좋지는 않지만 가격대비 만족합니다.,5.0,키 인데 무릎을 살짝 덮을 정도구요 지금 입 기 좋아요 재질이 좋지는 않지만 가격 대비 만족합니다
사이즈 잘맞고 디자인도 너무 맘에 들어요. 가격도 훌륭해요.,5.0,사이즈 잘 맞고 디자인도 너무 맘에 들어 요 가격도 훌륭해요
"음...저는 약간 살짝 끼어요.
몸이 불편하진 않은데 보기에는 조금 불편할 수 있을 것 같아서 한 사이즈 더 크게 살 걸 그랬나 생각은 했습니다.
하지만, 색감도 예쁘구요, 신축성이 좀 있어서 편해요. 만족합니다.",5.0,음저는 약간 살짝 끼어요 몸이 불편하진 않은데 보기에는 조금 불편할 수 있을 것 같아서 한 사이즈 더 크게 살 걸 그랬나 생각은 했습니다 하지만 색감도 예쁘구요 신축성이 좀 있어서 편해요 만족합니다
딱 찾고 있던 스타일 ㅠㅠ 무탠다드에 있어서 좋았어요 정말 예뻐요,5.0,딱 찾고 있던 스타일 무탠다드에 있어서 좋았어요 정말 예뻐요
재질이 탄탄하고 좋습니다! 뒤에 트임 덕에 움직이기도 편해요,4.0,재질이 하고 좋습니다 뒤에 트 임 덕에 움직이기도 편해요
허리가 약간 헐거덕하게 맞아요 나머지는 여유있게 맞아서 벨트 하고 입으면 딱 이뻐요,5.0,허리가 약간 헐 거덕하게 맞아요 나머지는 여유 있게 맞아서 벨트 하고 입으면 딱 이 뻐요
길이도 적당하고 아무 옷에나 매치하기 좋아요 굿,5.0,길이도 적당하고 아무 옷에 나 매치하기 좋아요 굿
작을줄 알고 걱정했는데 너무 작지도 크지도 않고 딱 좋은거같아요|~,5.0,작을 줄 알고 걱정했는데 너무 작지도 크지도 않고 딱 좋은 거 같아요
"s사이즈는 허리가 작아서 m샀는데 좀 크네용.
여름엔 좀 춥고 봄,가을이 젤 좋을 것 같아요~",4.0,사이즈는 허리가 작아서 샀는데 좀 크네용 여름엔 좀 춥고 봄 가을이 젤 좋을 것 같아요
사이즈 허리나 길이나 잘맞습니다 원하던 스타일입니다 좋아요,5.0,사이즈 허리나 길이나 잘 맞습니다 원하던 스타일입니다 좋아요
사이즈도 적당하고 색도 맘에 들고 편해서 자주 입을거 같아요,5.0,사이즈도 적당하고 색도 맘에 들고 편해서 자주 입을 거 같아요
색상은 사진이랑 비슷합니다. 엄청 좋은 재질은 아니지만 괜찮아요.,4.0,색상은 사진이랑 비슷합니다 엄청 좋은 재질은 아니지만 괜찮아요
길이는 정강이 정도고 얇지도 두껍지도 않아요. 지금 입기 딱 좋네요.,4.0,길이는 정강이 정도 고 얇지도 두껍지도 않아 요 지금 입 기 딱 좋네요
"완전 화이트는 아니구 살짝 크림색이에요
크롭 니트에 입으려고 샀는데 
이쁘고 편하네요~~ 잘산거 같아요
기장감은 키가 작은 관계로 발목 옵니다 ㅋㅋ
근데 이뻐요",5.0,완전 화이트는 아니 구 살짝 크림색이에요 크롭 니트에 입으려고 샀는데 이 쁘고 편하네요 잘산 거 같아 요 기장감은 키가 작은 관계로 발목 옵니다 근데 이 뻐요
허리둘레 70센치 엉덩이는 보통 66사이즈 입어야 잘 맞는데 허리에 맞추면 엉덩이 작고 엉덩이 맞추면 허리가 크고 그랬는데 예쁘게 잘 맞아요 아 저는 길이 조금 줄였어요,5.0,허리둘레 센치 엉덩이는 보통 사이즈 입어야 잘 맞는데 허리에 맞추면 엉덩이 작고 엉덩이 맞추면 허리가 크고 그랬는데 예쁘게 잘 맞아요 아 저는 길이 조금 줄였어요
재질도 시원하고 편하게 입을 수 있는 치마에요. 색도 완전 흰색이어서 마음에 들어요.,5.0,재질도 시원하고 편하게 입을 수 있는 치마에 요 색도 완전 흰색이어서 마음에 들어요
라인이 정말 예쁘고 편해요. 최근에 살이 확 쪄서 M사이즈랑 S사이즈 고민하다가 살을 빼고 입으려고 S사이즈를 샀는데 딱 맞아요. 살을 빼면 더 넉넉하게 맞을거 같아요. 재질도 시원해서 좋아요.,5.0,라인이 정말 예쁘고 편해 요 최근에 살이 확 쪄서 사이즈랑 사이즈 고민하다가 살을 빼고 입으려고 사이즈를 샀는데 딱 맞아요 살을 빼면 더 하게 맞을 거 같아 요 재질도 시원해서 좋아요
