Review,Star,Processed_Review
생각보다 날씬해보여서 좋아요 근데 다리쪽 좀 비칠거같아서 속바지 필수일듯,5.0,생각보다 날씬해 보여서 좋아요 근데 다리 쪽 좀 비칠거 같아서 속 바지 필수일 듯
"무신사스탠다드라서  믿고 샀습니당.
길이도 너무짧지않고. 재질도 얇아서 여름에 입기 딱 
좋아요  우리집거울이 요술거울이아닌데. 날씬해보임
조만간 바다놀러갈때 입으려고요 167에 72키로도 라지는 잘맞음 굿",5.0,무신사 스탠다 드라서 믿고 샀습니 당 길이도 너무 짧지 않고 재질도 얇아서 여름에 입 기 딱 좋아요 우리 집 거울이 요술 거울이 아닌데 날씬해 보임 조만간 바다놀러 갈 때 입으려고 요 에 키로도 라지는 잘 맞음 굿
완전 널널하니 잘 맞아서 좋더라고요 ㅎㅎ 배송도빨라서 좋아용,5.0,완전 하니 잘 맞아서 좋더라고요 배송도 빨라서 좋아용
배송 빠르고 가격 저렴하고 가볍게 입기 좋고 안 살 이유가 없네요,5.0,배송 빠르고 가격 저렴하고 가볍게 입기 좋고 안 살 이유가 없네요
너무 맘에 들어요! 배송도 빠르고 시원한 재질이에요,5.0,너무 맘에 들어 요 배송도 빠르고 시원한 재질이에요
배도 널널해서 너무 좋아요 ㅎㅎ 최고 배송도 빨라서 더욱 봏았어영,5.0,배도 해서 너무 좋아요 최고 배송도 빨라서 더욱 봏았어 영
"할인을 아주 팍팍해줘서  싼값에  잘샀습니당 ~
생각보다  너무 이쁘네요 . 길이도 너무짧지않고!
 원단도 얇아서  잘입을거같아요!!",5.0,할인을 아주 해줘서 싼 값에 잘 샀습니 당 생각보다 너무 이쁘네요 길이도 너무 짧지 않고 원단도 얇아서 잘 입을 거 같아요
"사이즈 넉넉하고 주문했어요
그래도 옷 디자인 자체가 라인이 있어서 예뻐요
제가 원하던 핏과 길이감이에요",5.0,사이즈 하고 주문했어요 그래도 옷 디자인 자체가 라인이 있어서 예뻐요 제가 원하던 핏과 길이감이에요
낙낙하게 나왔다고 해서 핏되게 XS로 구매했더니 정말 핏되게 맞네요 쿨탠다드인데 그렇게 시원한 느낌은 아니고 비침도 살짝 있어 이너 신경써야 할것 같아요,5.0,하게 나왔다고 해서 핏되게 로 구매했더니 정말 핏되게 맞네요 쿨탠다드인데 그렇게 시원한 느낌은 아니고 비침도 살짝 있어 이너 신경 써야 할 것 같아요
"다리쪽이 비친다는 말이 뭔지 알것 같아요
얇아서 좋은데 허리를 잡아주기때문에 배에 힘을 줘야흡니다ㅔ",4.0,다리 쪽이 비친다는 말이 뭔지 알 것 같아 요 얇아서 좋은데 허리를 잡아주기 때문에 배에 힘을 줘야 흡니다
s샀다가 마음에 들어서 m샀는데.. 이게 더 잘어울려요,5.0,샀다가 마음에 들어서 샀는데 이게 더 잘 어울려요
"딱 좋아요.. 재질 
사이즈도 잘 맞고..
추천해요..
스타일도 좋어요.",5.0,딱 좋아요 재질 사이즈도 잘 맞고 추천해요 스타일도 좋어요
배송은 하루만에 왔고 옷도 저렴하니 좋아요. 얇아서 속치마 꼭 입어야 하네요,5.0,배송은 하루 만에 왔고 옷도 저렴하니 좋아요 얇아서 속 치마 꼭 입어야 하네요
배송  빠르고  옷도 저렴해서 좋아요. 핏도 예뻐서 자주 손이 가요,5.0,배송 빠르고 옷도 저렴해서 좋아요 핏도 예뻐서 자주 손이 가요
"어느날 갑자기 신랑이 무신사에 대한 사랑이 생겨서 저도 한번 볼까나 하고 어플도 깔고 집근처에 가서 보기도 했는데 너무 좋더라구요.
너무 시원하고 바느질도 꼼꼼 진짜 이런 신세계가 있나 싶을정도에요. 그리고 스타일도 너무 좋아서 알림 신청 해놓고 괜찮은거있으면 바로 살거에요",5.0,어느 날 갑자기 신랑이 무신사에 대한 사랑이 생겨서 저도 한 번 볼까나 하고 어플도 깔고 집 근처에 가서 보기도 했는데 너무 좋더라구 요 너무 시원하고 바느질도 진짜 이런 신세계가 있나 싶을 정도에 요 그리고 스타일도 너무 좋아서 알림 신청 해놓고 괜찮은 거 있으면 바로 살거에요
저렴한데 너무 예뻐요 ! 허리를 잡아줘서 날씬해보여요,5.0,저렴한데 너무 예뻐요 허리를 잡아줘서 날씬해 보여요
허리라인이 예뻐요 다만 길이감이 어중간해서 수선하면 더 예쁠것 같아요,5.0,허리라인이 예뻐요 다만 길이감이 어 중간해서 수선하면 더 예쁠 것 같아요
좀 길이가 짧아요 나이가 많은 저에게는 부담되는 길이,3.0,좀 길이가 짧아요 나이가 많은 저에게는 부담되는 길이
"길이는 살짝 긴데 핏이 예뻐여
상하의 따로 신경 안 쓰고 원피스 하나 딱 입으면 되니까
여름에 너무 편하고 굿굿",5.0,길이는 살짝 긴데 핏이 예뻐여 상하의 따로 신경 안 쓰고 원피스 하나 딱 입으면 되니까 여름에 너무 편하고
허리도 잘 잡혀있고 예뻐요! 기장은 처음에는 살짝 애매하다고 생각했는데 더 짧으면 불편했을 것 같습니다.,4.0,허리도 잘 잡혀 있고 예뻐요 기장은 처음에는 살짝 애매하다고 생각했는데 더 짧으면 불편했을 것 같습니다
"길이가 무릎위로 오고 군더더기없이 깔끔한 디자인이에요
제질도 두껍지 않고 세탁해도 변형 크게 없이 좋네요",5.0,길이가 무릎 위로 오고 군기 없이 깔끔한 디자인이에 요 제 질도 두껍지 않고 세탁해도 변형 크게 없이 좋네요
"쿨탠다드라 믿고 구매한 제품입니다.여름에 쿨탠다드는
진짜 사랑이고,진리입니다👏다양하게 디자인이 나와서
너무 좋아요. 더 다양한 디자인 기대할게요 데일리 예쁜
원피스 찾으시는분들 무조건 갯갯",5.0,쿨탠다드라 믿고 구매한 제품입니다 여름에 쿨탠다드는 진짜 사랑이 고 진리입니 양하게 디자인이 나와서 너무 좋아요 더 다양한 디자인 기대할게요 데일리 예쁜 원피스 찾으시는 분들 무조건
"원피스 처음 사보는거라 무난하게 검정 먼저 도전해봅니당
기본템 느낌으로 추천해여
키가 큰편인데 허벅지 중간정도 오고요 이정도 길이면 적당 무난해요. 여름에 시원하게 입고 다니기 가능!",5.0,원피스 처음 사보는 거라 무난하게 검정 먼저 도 전해봅니 당 기본템 느낌으로 추천해 여 키가 큰 편인데 허벅지 중간 정도 오고요 이 정도 길이면 적당 무난해 요 여름에 시원하게 입고 다니기 가능
비치는 원단이라 안에 이너를 입어야 할것 같아요,4.0,비치는 원단이라 안에 이너를 입어야 할 것 같아요
허리라인을 잡아줘서 옷 핏이 예쁘게 나와서 만족합니당,5.0,허리라인을 잡아줘서 옷 핏이 예쁘게 나와서 만족합니당
핏이랑 전체적인 길이 그렇게 막 짧지 않아서 만족해요,5.0,핏이랑 전체적인 길이 그렇게 막 짧지 않아서 만족해요
배송 완전 빠르고 비친다는 후기 많았는데 진짜 비침이 심해요,5.0,배송 완전 빠르고 비친다는 후기 많았는데 진짜 비침이 심해요
편한데 길이가 좀 애매하게 길어서 수선 맡겨야겠어요,5.0,편한데 길이가 좀 애매하게 길어서 수선 맡겨야겠어요
"사진에 색감이 흐릿하게 나왔지만 실제로 보면 그냥 검은색 원피스 입니다~ 깔끔하고 핏이 예뻐서 다른 색도 사고싶어요
길이감 적당하고 맘에듭니다",5.0,사진에 색감이 흐릿하게 나왔지만 실제로 보면 그냥 검은색 원피스 입니다 깔끔하고 핏이 예뻐서 다른 색도 사고 싶어요 길이 감 적당하고 맘에 듭니다
"적당한 길이감 원피스 찾고있었는데 잘 맞아요 
단정하고 허리에 라인있어서 잘 잡아주고 예쁩니다
다른 색도 사고 싶어유",5.0,적당한 길이 감 원피스 찾고 있었는데 잘 맞아요 단정하고 허리에 라인 있어서 잘 잡아주고 예쁩니다 다른 색도 사고 싶어 유
"단추 실밥 처리가 좀 아쉬운 상태로 왔는데 할인 가격 생각하면 그래도 잘 산 것 같아요!
핏도 어깨 길이도 생각한대로 나와서 맘에 들어요! 근데 총장 길이가 애매하게 긴 편이라 수선을 해야되나 그냥 편하게 입을까 고민이 되기는 하네요",4.0,단추 실밥 처리가 좀 아쉬운 상태로 왔는데 할인 가격 생각하면 그래도 잘 산 것 같아 요 핏도 어깨 길이도 생각한 대로 나와서 맘에 들어 요 근데 총장 길이가 애매하게 긴 편이라 수선을 해야 되나 그냥 편하게 입을 까 고민이 되기는 하네요
디자인도 심플하고 믿고 찾는 무탠다드에요! 배송도 빨라용 최고~!!,5.0,디자인도 심플하고 믿고 찾는 무탠다드에 요 배송도 빨라용 최고
합리적인가격에 좋른소재 쿨탠다드 멍멍좋아요,5.0,합리적인 가격에 좋른 소재 쿨탠다드 좋아요
"이런 pk원피스 사고싶었는데 제가 키가 커서 길이가
긴게 필요했습니다. 이건 길이도 적당히 길고 라인도 있어서 강추합니다",5.0,이런 원피스 사고 싶었는데 제가 키가 커서 길이가 긴 게 필요했습니다 이건 길이도 적당히 길고 라인도 있어서 강추합니다
XS샀는대 엄마가 탐나대서 L로도 시켰어요!! 개조아하심,5.0,샀는 대 엄마가 탐나대서 로도 시켰어요 개조아 하심
키가 커서 기장 긴 원피스 찾기 어려웠는데 이건 길이도 딱 좋아요,5.0,키가 커서 기장 긴 원피스 찾기 어려웠는데 이건 길이도 딱 좋아요
사이즈랑 시원한 재질이 마음에 들어서 다른색으로 재구매했네요~ 역시나 마음에 드네요^^ 66반 사이즈인데 L사이즈로 하니 어깨가 맞아요~ 시원하게 잘입을게요~,5.0,사이즈랑 시원한 재질이 마음에 들어서 다른 색으로 재구매했네요 역시나 마음에 드네요 반 사이즈인데 사이즈로 하니 어깨가 맞아요 시원하게 잘 입을 게요
"품질 너무 훌륭합니다. 사이즈도 딱이에요. 
가격대비 만족",5.0,품질 너무 훌륭합니다 사이즈도 딱이에요 가격 대비 만족
"쿨소재라 굉장히 가볍고 시원합니다 !
L사이즈라 널널하나 허리 쉐잎이 있어서 전혀 부해보이지 않아요
널널하게 입을거면 L 딱 맞게 입을거면 M 추천합니다 :)",5.0,쿨 소재라 굉장히 가볍고 시 원합니다 사이즈라 하나 허리 쉐잎이 있어서 전혀 부해 보이지 않아 요 하게 입을 거면 딱 맞게 입을 거면 추천합니다
로켓배송인가요..? 어제시켰는데 오늘 왔어요ㄷㄷ 키 170인데 길이 괜찮고 어깨 좀 있는 체형인데 m사이즈 이쁘게 맞아요 완전 딱이네여,5.0,로켓배송인가요 어제시켰는데 오늘 왔어요 키 인데 길이 괜찮고 어깨 좀 있는 체형인데 사이즈 이 쁘게 맞아요 완전 딱이네 여
시원하게 입을수 있어 좋습니다.길이는 짧지도 얇지도 않은 두께고 편하게 입을수 있어 좋을듯.다크 그린도 탐 나는 중,5.0,시원하게 입을 수 있어 좋습니다 길이는 짧지도 얇지도 않은 두께 고 편하게 입을 수 있어 좋을 듯 다크 그린도 탐 나는 중
옷이 얇아 시원하겠어요.다만 블랙이더라도 속옷은 챙겨 입어야 하는 두께,5.0,옷이 얇아 시원하겠어요 다만 블랙이더라도 속옷은 챙겨 입어야 하는 두께
사이즈 s는 핏되는 스타일이고 좀 편하게 입고 싶다면 m추천.옷이 얇아 비치나 속옷은 꼼꼼히 입어야 합니다.제 키에 짧지 않아 이쁩니다.,5.0,사이즈 는 핏되는 스타일이고 좀 편하게 입고 싶다면 추천 옷이 얇아 비치나 속옷은 히 입어야 합니다제 키에 짧지 않아 이쁩니다
길이도 적당하니 좋아요 23주된 임산부인데 사이즈 넉넉허니 이쁘게 잘 입었습니다 짧지않아 좋네요,5.0,길이도 적당하니 좋아요 주된 임산부인데 사이즈 허니 이쁘게 잘 입었습니다 짧지 않아 좋네요
핏예쁘고 너무 짧지도 길지도 않아서 너무 예뻐오,5.0,핏 예쁘고 너무 짧지도 길지도 않아서 너무 예뻐오
배송 빠르고 크게 기대 안 했는데 날씬해보여요 자주 입을듯,5.0,배송 빠르고 크게 기대 안 했는데 날씬해 보여 요 자주 입을 듯
허리 라인 들어가있어서 날씬해보이고 길이 적당해서 좋음,5.0,허리 라인 들어가 있어서 날씬해 보이고 길이 적당해서 좋음
여자친구 오프라인에서 입어보고 맘에들어 다른색상구매 완료,5.0,여자친구 오프라인에서 입어보고 맘에 들어 다른 색상 구매 완료
"핏이너무이쁩니다
가격도저렴하고배송도빨랐어요
세탁전이라물빠짐이나변형이없길바랍니다",5.0,핏이 너무 이쁩니다 가격도 저렴하고 배송도 빨랐어요 세탁 전이라 물 빠짐이나 변형이 없길 바랍니다
"옷 핏이 너무 이쁩니다
주위에서 이쁘다고..허리라인도 잡아주고 사이즈 딱 맞네요
가볍고 시원하고 재질도 좋아요
골프치러 가야고 묻는 분들도 있었어요
다른 색상으로 한 벌 더 구매할까 합니다",5.0,옷 핏이 너무 이쁩니다 주위에서 이쁘다고 허리라인도 잡아주고 사이즈 딱 맞네요 가볍고 시원하고 재질도 좋아요 골프 치러 가야 고 묻는 분들도 있었어요 다른 색상으로 한 벌 더 구매할까 합니다
"군더더기 없이 깔끔한 디자인에 착용감이 거칠 않고 부드러워요!
길이도 너무 길지 않고 딱 좋았습니다",5.0,군기 없이 깔끔한 디자인에 착용감이 거칠 않고 부드러워요 길이도 너무 길지 않고 딱 좋았습니다
"배송빠르고 제품 가성비가 좋네요, 가볍게 여름 나기 좋을 것 같아요",5.0,배송 빠르고 제품 가성비가 좋네요 가볍게 여름 나 기 좋을 것 같아요
저는 22주차 초산모 에요 친구들과 떠나는 여름휴가에 배는 좀 나왔지만 이쁘게 입고싶어 주문했고 길이나 사이즈 모두 좋었습니다. 편했어요,5.0,저는 주차 초산모 에 요 친구들과 떠나는 여름 휴가에 배는 좀 나왔지만 이 쁘게 입고 싶어 주문했고 길이나 사이즈 모두 좋었습니다 편 했어요
L 잘 맞아요. 무신사 스탠다드 옷 질도 좋고 다 좋은데 사이즈가 타사에 비해 작다는 점….통통녀를 위해 큰 사이즈도 만들어줬음 좋겠다!!!!,4.0,잘 맞아요 무신사 스탠다드 옷 질도 좋고 다 좋은데 사이즈가 타사에 비해 작다는 점녀를 위해 큰 사이즈도 만들어줬음 좋겠다
"사이즈 딱 좋고 무릎위로 조금 올라가서 길이감도 괜찮아요
근데 좀 얇아서 다리 실루엣이 다 보여요
안에 어떻게 입고 다녀야할지 고민이 좀 되네요",4.0,사이즈 딱 좋고 무릎 위로 조금 올라가서 길이 감도 괜찮아요 근데 좀 얇아서 다리 실루엣이 다 보여 요 안에 어떻게 입고 다녀야 할지 고민이 좀 되네요
핏은 예쁜데 두께가 조금 얇아서 다리 부분이 살짝 비쳐보여요.  속바지나 짧은 속치마 입고 입어야겠어요,3.0,핏은 예쁜데 두께가 조금 얇아서 다리 부분이 살짝 비쳐 보여 요 속 바지나 짧은 속 치마 입고 입어야겠어요
"옷 얇아서 한여름에 입어도 될 정도이긴 한데 다리 사이가 비치긴 흐네요ㅠ
그리고 왠만하신 분들은 다 s맞으실것 같아요!
m이랑 고민했는데 s핏이 더 이쁠것 같으서 시켰는데 이뻐요!!",5.0,옷 얇아서 한 여름에 입어도 될 정도이긴 한데 다리 사이가 비치긴 흐네요 그리고 왠만 하신 분들은 다 맞으실 것 같아 요 이랑 고민했는데 핏이 더 이 쁠 것 같으서 시켰는데 이 뻐요
"길이가 긴편이라 길이 수선해서 입었습니다.
얇은편이에요.",4.0,길이가 긴 편이라 길이 수선해서 입었습니다 얇은 편이에요
기본 검정 원피스로 품질이 우수합니다. 매우 만족스럽습니다,5.0,기본 검정 원피스로 품질이 우수합니다 매우 만족스럽습니다
핏도 예쁘고 전체적으로 마음에 들어요 조금 비칠것 같긴 한데 속바지 입으면 괜찮을것같아요 얇아서 덥지 않아 좋습니다!,5.0,핏도 예쁘고 전체적으로 마음에 들어 요 조금 비칠 것 같긴 한데 속 바지 입으면 괜찮을 것 같아요 얇아서 덥지 않아 좋습니다
"사이즈
잘 맞아요 
너무 만족해요 
더운 여름이 입어도 땀 안나고 
시원할꺼 같아요 
다른 칼라
주문 할려고요",5.0,사이즈 잘 맞아요 너무 만족해요 더운 여름이 입어도 땀 안 나고 시원할 꺼 같아 요 다른 칼라 주문 할려고요
핏은 예쁜데 치마 속 비침이 좀 있어서.아무래도 속치마를 입고입어야 할듯요,5.0,핏은 예쁜데 치마 속 비침이 좀 있어서 아무래도 속 치마를 입고 입어야 할 듯요
예뻐요. 너무 작지도 않고 너무 크지도 읺고 핏이 닥 예뻐요. 정사이즈로 주문하면 예쁘게 입을 수 있을 것 같아요. 예뻐서 다른 컬러도 구매하고 싶어요.,5.0,예뻐요 너무 작지도 않고 너무 크지도 읺 고 핏이 닥 예뻐요 정 사이즈로 주문하면 예쁘게 입을 수 있을 것 같아 요 예뻐서 다른 컬러도 구매하고 싶어요
기본데일리로편하게입기좋아요편하게입는데꾸민척쌉가능,5.0,기본 데일리로 편하게 입기 좋아요 편하게 입는데 꾸민 척 쌉 가능
비슷한 디자인으로 하나 같이 삿는데 이 옷이 좀 더 타이트합니다.,5.0,비슷한 디자인으로 하나 같이 삿는데 이 옷이 좀 더 타이트 합니다
"하얀게 뭍어있는데 세탁해서 지워지는거였으면 좋겠네요.

카라부분 틀어진곳 없고 단추도 잘 붙어있어요.",4.0,하얀 게 뭍어 있는데 세탁해서 지워지는 거였으면 좋겠네요 카라 부분 틀어진 곳 없고 단추도 잘 붙어 있어요
너무길어서 살짝 잘랏더니 더 이뿌네요 엄청얇아서 좋긴한데 밝은데 가면 다리라인이 다 보일정돓 비치긴해요!! 저는 걍 청반바지 입고 입어요,5.0,너무 길어서 살짝 잘 랏더니 더 이 뿌네요 엄청 얇아서 좋긴 한데 밝은 데 가면 다리 라인이 다 보 일 정 돓 비치긴 해요 저는 걍 청반바지 입고 입어요
이뻐요 아주 이뻐요 허리가 살짝 들어가서 더 이쁘고 편하고 시원~하네요잉,5.0,이 뻐요 아주 이 뻐요 허리가 살짝 들어가서 더 이 쁘고 편하고 시원하네요잉
우왕 너무 이뻐요 허리도 살짝 들어가서 더 이뻐요,5.0,우왕 너무 이 뻐요 허리도 살짝 들어가서 더 이 뻐요
두께도 적당하고 길이도 마음에 들어요. 허리라인이 많이 들어가있는게 아니라서 편하게 입을것같아요.,5.0,두께도 적당하고 길이도 마음에 들어 요 허리 라인이 많이 들어가 있는 게 아니라서 편하게 입을 것 같아요
여름에 편하게 입기 좋을것 같아요. 다른색상은 비칠것 같아서 검은색으로 샀어요.,5.0,여름에 편하게 입 기 좋을 것 같아 요 다른 색상은 비칠 것 같아서 검은색으로 샀어요
제 신체사이즈에 s입으니까 허리라인 들어가고 치마길이도 딱 적당합니다! 남자친구도 이쁘다고 하네요 ㅎㅎ 자주 입을 것 같아요!,5.0,제 신체 사이즈에 입으니까 허리 라인 들어가고 치마 길이도 딱 적당합니다 남자친구도 이 쁘다고 하네요 자주 입을 것 같아요
허리도 잘 잡히고 예뻐요! 편하게 잘 입을 것 같습니다.,4.0,허리도 잘 잡히고 예뻐요 편하게 잘 입을 것 같습니다
슬림핏으로 약간 허리도 들어가있어서 몸매도 잡아주고 좋았어요 그렇다고 딱 달라붙는 핏은 아니라 편했구요!,5.0,슬림핏으로 약간 허리도 들어가 있어서 몸매도 잡아주고 좋았어요 그렇다고 딱 달라붙는 핏은 아니라 편 했구요
오프라인 매장에서 입어보고 예뻐서 샀어요! 치마가 살짝만 더 짧았으면 좋았겠지만 허리도 잘 잡아주고 예뻐요!,4.0,오프라인 매장에서 입어보고 예뻐서 샀어요 치마가 살짝 만 더 짧았으면 좋았겠지만 허리도 잘 잡아주고 예뻐요
시원하고 편해요 허리라인있어서 핏도이쁘고 가성비조아요,5.0,시원하고 편해요 허리 라인 있어서 핏도 이쁘고 가성비조아요
"딱 알맞게 잘 맞아요
재질도 시원할거 같아요
배송도 빨랐습니다^^",5.0,딱 알맞게 잘 맞아요 재질도 시원할 거 같아 요 배송도 빨랐습니다
핏이 정말이뻐요! 소재도 정말 시원하고 배송도 빨리와요,5.0,핏이 정말 이 뻐요 소재도 정말 시원하고 배송도 빨리와요
핏이 정말 이뻐요~ 소재도 시원해서 잘입을것같아용,5.0,핏이 정말 이 뻐요 소재도 시원해서 잘 입을 것 같아용
배송 엄청 빠르네요 러켓배송인줄 핏이 예쁘고 전체적으로 마음에 들어요,5.0,배송 엄청 빠르네요 러켓배송인 줄 핏이 예쁘고 전체적으로 마음에 들어요
핏이 예뻐서 전체적으로 예쁘네요 적극추천합니다,5.0,핏이 예뻐서 전체적으로 예쁘네요 적극 추천합니다
여자친구 사줬어요 배송이 진짜 빠르네요 놀랬어요,5.0,여자친구 사 줬어요 배송이 진짜 빠르네요 놀랬어요
딱좋아요 속치마는필수입니다 구매시참고하세요,5.0,딱 좋아요 속 치마는 필수입니다 구매 시 참고하세요
핏되게입으니 깔끔하네요 허리선도살짝들어가있어요,4.0,핏되게 입으니 깔끔하네요 허리선도 살짝 들어가 있어요
사이즈나 핏이 아주좋아요~ 얇은거라 비치는것만 빼면요,4.0,사이즈나 핏이 아주 좋아요 얇은 거라 비치는 것만 빼면요
만족스럽습니다:) 허리라인이 잡혀서 더욱 좋은것 같아요:),4.0,만족스럽습니다 허리 라인이 잡혀서 더욱 좋은 것 같아요
"약간 애매한 느낌의 기장과 폼이여서 s시킬걸 싶지만
그래도 편하게 입긴 좋을거 같아요 ㅎㅎ",5.0,약간 애매한 느낌의 기장과 폼이여서 시킬 걸 싶지만 그래도 편하게 입긴 좋을 거 같아 요
"깔끔해요!
디자인도 품질도
주말에 편하게 입기 좋을 듯해용",5.0,깔끔해요 디자인도 품질도 주말에 편하게 입 기 좋을 듯해용
"약간 큰 느낌이지만 오히려 편하게 입을 수 있을거같아요
군더더기 없이 깔끔함",5.0,약간 큰 느낌이지만 오히려 편하게 입을 수 있을 거 같아 요 군 기 없이 깔끔함
원단 너무 시원하고 핏도 좋아요 좀 긴 거 빼면 완전 만족스러움!!,5.0,원단 너무 시원하고 핏도 좋아요 좀 긴 거 빼면 완전 만족스러움
원단 너무 시원하구 핏도 좋아요 좀 긴 거 빼면 완전 만족스러움 ...,5.0,원단 너무 시원하구 핏도 좋아요 좀 긴 거 빼면 완전 만족스러움
"대만족스러운 카라티
얇고 소재도 찰랑해서 여름에 딱좋음
절대 안 들러붙는 재질
하나도안짧음 길고 넉넉하게나온편",5.0,대만족스러운 카라티 얇고 소재도 찰랑해서 여름에 딱 좋음 절대 안 들러붙는 재질 하나도 안 짧음 길고 하게 나온 편
"같은 제품 하늘색 선물 받고 너무 마음에 들어서 또 주문했어요!
같은 사이즈인데도 하늘색보다는 타이트한 감이 있습니다.",5.0,같은 제품 하늘색 선물 받고 너무 마음에 들어서 또 주문했어요 같은 사이즈인데도 하늘색보다는 타이트한 감이 있습니다
배송이 엄청나게 빨리 도착했어요!! 옷도 편하게 잘 입을 수 있을 것 같아요:),5.0,배송이 엄청나게 빨리 도착했어요 옷도 편하게 잘 입을 수 있을 것 같아요
"2만 7천 원 대에 샀는데 지금은 1만 9천 원 대에 살 수 있네요 ㅜ 🥲,, 슬퍼티비

원피스라서 위 아래 매치할 필요도 없고 걍 입을 거 없다 싶으면 입게 되는 옷이에요!
핏은 진짜 개완벽한데 바람 불면 뱃살 보입니다 ㅋㅋ ㅜ",5.0,만 천 원 대에 샀는데 지금은 만 천 원 대에 살 수 있네요 슬퍼티비 원피스라서 위 아래 매치할 필요도 없고 걍 입을 거 없다 싶으면 입게 되는 옷이에요 핏은 진짜 개완벽한데 바람 불면 뱃살 보입니다
"L사이즈샀다 취소하고 M으로 재구매했어요
사이즈 딱입니다",5.0,사이즈샀다 취소하고 으로 재구매했어요 사이즈 딱입니다
"블랙 구입했는데 완전 기본 스타일이에요.
네이비랑 별 차이 앖어요.
다른 색 살껄 그랬어요.
얇아서 속치마나 속바지는 입으셔야 해요.",4.0,블랙 구입했는데 완전 기 본 스타일이에 요 네이비랑 별 차이 앖어요 다른 색 살 껄 그랬어요 얇아서 속 치마나 속바지는 입으셔야 해요
여자친구 대신해서 구매해줬는데 이쁘고 좋네요,5.0,여자친구 대신 해서 구매해줬는데 이 쁘고 좋네요
시원하고 좋아요! 근데 진짜 비치기는 하네요 그래도 만족합니다,5.0,시원하고 좋아요 근데 진짜 비치기는 하네요 그래도 만족합니다
