title,keyword
DOODLE HEART HALF T WHITE GREYISH BLUE,"프린팅, 디자인, 사이즈, 핏, 재질, 배송, 여름, 편하다, 가격, 어울리다"
[SET] 워셔블 케이블 반팔 니트 세트,"사이즈, 여름, 니트, 가격, 색감, 재질, 핏, 가성비, 배송, 덥다"
[2PACK] 쿨 코튼 티셔츠 블랙+화이트,"사이즈, 편하다, 여름, 시원하다, 재질, 가격, 배송, 티, 기본, 얇다"
[3천원 결제혜택]링클 체크 박시 오버핏 롤업 하프 셔츠 다크 네이비,"시원하다, 여름, 셔츠, 얇다, 사이즈, 재질, 편하다, 단추, 가격, 배송"
460G 컷 헤비 피그먼트 티셔츠-차콜-,"사이즈, 색감, 핏, 재질, 피그먼트, 색상, 여름, 적당하다, 편하다, 버먼 트"
[16수 코마사] 2PACK SMALL ARCH T-SHIRT WHITE _ BLACK,"사이즈, 적당하다, 편하다, 여름, 가격, 재질, 티, 가성비, 비치다, 만족하다"
빈티지 워싱 네이비 체크셔츠,"셔츠, 여름, 색감, 얇다, 사이즈, 체크, 배송, 적당하다, 재질, 가격"
[3PACK] 에어쿨링 드라이 기능성 무지 반팔티,"운동, 시원하다, 편하다, 사이즈, 가격, 재질, 가성비, 여름, 소재, 만족하다"
TAG OG TEE - WHITE,"사이즈, 디자인, 배송, 편하다, 크다, 재질, 오버핏, 핏, 적당하다, 깔끔하다"
[2PACK] EL 스트리트 아트워크 오버핏 반팔티 2종 2PACK,"사이즈, 디자인, 가격, 편하다, 배송, 여름, 적당하다, 얇다, 재질, 프린팅"
