title,keyword
[무료반품]베켄바우어 트랙탑 - 인디고_IP0418,"사이즈, 아디다스, 색감, 편하다, 배송, 크게, 지다, 만족하다, 빠르다, 가을"
파이어버드 트랙탑 - 블랙_IJ7058,"사이즈, 배송, 편하다, 아디다스, 크다, 빠르다, 맞다, 시보리, 크게, 오버핏"
ASI 포시즌 에센셜 피그먼트 후드집업_차콜 그레이,"색감, 사이즈, 지퍼, 배송, 후드, 편하다, 가격, 디자인, 오버핏, 가을"
[무료반품]베켄바우어 트랙탑 - 블랙화이트_II5763,"사이즈, 배송, 빠르다, 디자인, 크다, 포인트, 아디다스, 부분, 흰색, 맞다"
2WAY 스웻 후드 집업 (MELANGE GREY),"사이즈, 편하다, 후드, 지퍼, 적당하다, 크다, 집업, 기장, 짧다, 오버핏"
[유튜버 PICK]FR-40S 프렌치 워크 5P 자켓_Military Navy,"사이즈, 크다, 오버핏, 디자인, 편하다, 자켓, 간절기, 만족하다, 배송, 걸치다"
[쿨탠다드] 릴렉스드 베이식 블레이저 [블랙],"여름, 시원하다, 사이즈, 얇다, 가격, 블레이저, 맞다, 배송, 가성비, 편하다"
시어 후드 베스트 블랙,"얇다, 여름, 사이즈, 편하다, 가격, 가볍다, 재질, 덥다, 배송, 걸치다"
[SAINT YEAR] 세미 오버 핏 셋업 수트_GREY,"사이즈, 가격, 셋업, 얇다, 바지, 맞다, 가성비, 결혼식, 적당하다, 색감"
MATIN KIM LOGO COATING JUMPER IN BLACK,"배송, 사이즈, 재질, 얇다, 빠르다, 디자인, 오버핏, 가을, 편하다, 마뗑킴"
