Title,Keyword
DOODLE HEART HALF T WHITE GREYISH BLUE,"디자인, 프린팅, 사이즈, 핏, 재질, 배송, 가격, 편하다, 오버핏, 색감"
[SET] 워셔블 케이블 반팔 니트 세트,"사이즈, 핏, 여름, 색감, 니트, 가격, 가성비, 재질, 배송, 디자인"
[2PACK] 쿨 코튼 티셔츠 블랙+화이트,"사이즈, 여름, 재질, 편하다, 배송, 시원, 핏, 가격, 커버낫, 얇다"
[3천원 결제혜택]링클 체크 박시 오버핏 롤업 하프 셔츠 다크 네이비,"여름, 얇다, 시원, 핏, 셔츠, 재질, 사이즈, 시원하다, 단추, 편하다"
460G 컷 헤비 피그먼트 티셔츠-차콜-,"색감, 핏, 사이즈, 재질, 오버핏, 소버먼트, 여름, 색상, 배송, 워싱"
[16수 코마사] 2PACK SMALL ARCH T-SHIRT WHITE / BLACK,"사이즈, 핏, 여름, 재질, 가격, 편하다, 가성비, 오버핏, 두껍다, 배송"
빈티지 워싱 네이비 체크셔츠,"여름, 색감, 얇다, 색깔, 사이즈, 핏, 가격, 배송, 재질, 편하다"
[3PACK] 에어쿨링 드라이 기능성 무지 반팔티,"운동, 편하다, 시원하다, 가격, 사이즈, 재질, 가성비, 여름, 운동복, 두껍다"
TAG OG TEE - WHITE,"사이즈, 디자인, 배송, 핏, 오버핏, 재질, 편하다, 크기, 세탁, 프린팅"
[2PACK] EL 스트리트 아트워크 오버핏 반팔티 2종 2PACK,"디자인, 사이즈, 가격, 편하다, 자다, 배송, 얇다, 여름, 빠르다, 오버핏"
