Processed_Review,keyword
너무 예뻐요 사진과 같아 요 짧아도 너무 너무 편해요 잘 입고 다녀요,"편하다, 사진, 짧다"
기본 원피스의 핏이 이렇게 이 쁠 수가 월 일 되자마자 쿠폰 먹여서 구매했습니다 역시 기 대한 만큼 핏이 예뻐요 소재도 하구요 글로니 옷은 빨리 사는 게 이득인 거 같습니다 레이어드로 입어도 이 쁘고 벨트 해도 이쁩니다,"먹이다, 레이어 드, 원피스, 이득, 소재, 해도, 기본"
몸에 완전히 핏되는 스타일이고 이상부터는 절대 안 들어갈 것 같네욤,"완전하다, 스타일, 들어가다, 절대, 몸, 핏되, 같네욤"
에 키로인데도 이 적당히 하면서 마니 짧지 않아서 좋아요 는 얼마나 마른 분들이 입는 걸까요 화이트도 구매 예정입니다,"말다, 키, 마르다, 분, 적당하다, 화이트"
가벼운 데이트룩으로 최고에 요 날씨가 풀려서 손이 자주 가요,"날씨, 데이트, 가요, 가볍다, 풀다, 손, 최고"
가슴 작은 편인데도 가슴 압박이 심한 옷이에요 상체에 살은 없는데 흉 통 큰 편이라 했고 허리는 딱 붙지 않아 편하네요 밑단이 생각보다 더 넓은 플레어 입니다,"허리, 편이, 펴다, 압박, 편하다, 상체, 플레어, 작다"
참 조아 요 보시는 대로 짧긴 한데 그거대로 예뻐요,"그거, 보시, 대로, 짧다"
생각보다 잘 늘어나는 원단이고 검정색은 정장 같은 느낌도 나서 좋았어요 키가 작아서 길이는 신경 안 쓰고 구매했는데 앉아 있을 때는 생각보다 안 짧게 느껴져요,"검정색, 신경, 원단, 작다, 정장, 나서다, 길이, 늘어나다, 키"
키가 인데 사이즈며 길이 감 핏 이런 원피스 핏 어디서 찾기 힘든데 딱 했던 그대로라 바지에 레이어드해도 예쁘고 단독으로 입어도 예뻐요,"레이어 드 해도, 이렇다, 단독, 사이즈, 원피스, 그대로, 바지, 길이"
처음에 입어보고 너무 타이트해서 놀랬어요 근데 오히려 편한 거 같아 요 밑에 글로니 골지레깅스 숏 입으니까 짧아도 불편하지 않고 괜찮아요 그리고 옷이 정말 날씬해 보입니다,"골지 레깅스, 날씬하다, 타이 트, 불편하다, 입어보다, 보이다, 처음"
입고 벗을 때 매우 힘들지만 핏이 예뻐요 원단도 해요,"원단, 힘들다, 핏, 벗"
기본템으로 입기 좋아요 단독으오 입어도 좋습니다,단독 오
하고 허리 겁나 얇아 보이고 길이까지 미니하게 제 키에는 딱이였어요,"미니, 겁나다, 키, 보이, 허리, 얇다, 딱이다, 길이"
사이즈가 많이 작게 나와서 엄청나게 마르신 분 아니면 하시는 게 좋을 것 같아요 소재가 엄청 합니다,"아니다, 엄청나다, 마르다, 사이즈, 나오다, 소재, 작다"
정말 왜 이제야 주문했는지 통탄스럽기 짝이 없네요 여리 여리하고 날씬해 보이고 부유방은 가려주는데 제 키에 미디움 입으면 또 기장까지 적당합니다 다른 색도 구매각,"날씬하다, 통탄 스럽다, 가다, 적당하다, 부 유방, 여리다, 미디움, 키, 여리다"
원피스로 입어도 이 쁘고 상의로 입어도 이쁩니 더 이 원피스로 입었을 때 살짝 아슬아슬하긴 하더라구 여 저는 상의로 즐겨 입을 듯합니다,"원피스, 상의, 아슬아슬하다, 구, 즐기다"
핏하며 길이 하며 다 너무 좋아요 원래는 퍼지는 라인 별로 안 좋아하는 이건 안 유치하고 오히려 고급스러워 보이는 느낌이네요,"원래, 고급스럽다, 유치하다, 보이다, 퍼지다, 이건, 라인, 길이"
얇지 않고 적당히 해요 여름 보단 봄에 입는 게 좋을 것 같아요,"적당하다, 얇다, 봄, 여름"
리뷰에 많이 작고 짧다 해서 걱정했는데 저한테는 적당한 길이였어요 한 사이즈 크게 산 후기가 많아서 미디움 재입고 될 때까지 기다리다가 스몰 사이즈가 입고 됐길래 스몰로 구매했는데 두겹이라 그런지 뱃살 부각 하나도 안 되고 몸매 보정에 좋아요 가슴이 작은 편이라 입고 벗기에도 어렵지 않고 핏되는 원피스인데도 안에 셔츠나 이너티를 입어도 자국이 없어서 왜 인 기 많음 지 알 거 같아요,"사이즈, 사이즈, 적당하다, 어렵다, 원피스, 재, 그렇다, 기다리다"
재질이 너무 좋아서 놀랐어요 왜 인기 있는지 알겠는 느낌 길이는 짧지도 길지도 않은데 초반 대 분들은 조금 짧다고 느끼실 수도 있어요,"재질, 수도, 길이, 인기, 초반, 분"
진챠 넘 예뻐서 화이트 사고 블랙 추가 구매했어요 제키에도 치마가 짧아요 키크 신 분들은 너무 짧다고 생각할 수 있을 것 같아요,"키, 키크, 치마, 화이트, 블랙, 사고, 추가, 분"
사이즈가 많이 작다고 해서 걱정했는데 입었는데 딱 예쁘게 잘 맞았어요 근데 기장이 확실히 많이 짧아서 키 크 신 분들은 입으셔야 할 것 같아요,"기장, 사이즈, 확실하다, 작다, 분, 맞다"
글로니 러버 입니 당 고민하다가 세일하길래 구매했는데 너무너무 맘에 듭니다 상체 마른 편이라 보통 사이즈 사면 잘 맞는데 이번엔 좀 히 입고 싶어서 사이즈를 시켰습니 당 근데 전혀 하진 않아 요 딱 맞아요 여기서 살 더 찌면 핏이 별로 일 거 같아 요 개 말라인간이 아니 심 무조건 사이즈 추천해요 글고 역시 글로니 핏을 넘 잘 뽑아요 몸매 짱 좋아 보여 요 굿,"무조건, 말르다 인간, 고민, 추천, 사이즈, 세, 전혀, 사이즈, 듭니"
좀 한 편이라 걱정 많이 하고 샀는데 딱 맞고 너무 다행이에 요 잘 늘어나고 한 재질이라서 벗을 땐 쫌 힘들지만 라인이랑 핏이 너무 예뻐서 대 만족입니다 세일할 때 만 원대에 사서 대 만족이에요,"만족, 만족, 재질, 늘어나다, 다행, 힘들다, 라인, 걱정, 사서"
진짜 맘에 들어 요 딱 정석으로 예쁜 블랙 원피스 사이즈는 웬만 하면 이 맞을 듯 타이트하고 입고 벗을 때 좀 힘들어요 배송 빨라서 좋아요,"힘들다, 타이트, 사이즈, 정석, 원피스, 배송"
완전 기 본 원피스예요 글루니는 베이직 한 아이템을 참 이쁘게 잘 만드는 것 같아 요 가슴 큰 분들은 가슴 압박이 좀 있을 것 같아요,"루니, 만들다, 아이템, 베이직, 압박, 분, 가슴, 원피스"
진짜 너무너무 이 뻐여 키 기준 속바지 입으면 입을 수 있는 정도 고 상체만 보면 하고 싶은데 헸으면 너무 짧아서 다 내놓고 다닐 번 했어 여,"상체, 바지, 기준"
두꺼워서 비침 걱정도 없고 좋아요 다만 생각보다 더 짧고 진짜 딱 붙어요 가격만 좀 저렴하면 하나 더 사고 싶어요,"걱정, 저렴하다, 가격, 사고, 비치다, 없다, 싶다"
배송도 빠르고 넥라인 맘에 들어서 구매했는데 상체 부분이 잘 잡아주는 듯하면서 타이트한 느낌이여서 만족스럽습니다,"만족스럽다, 잡다, 들어서다, 타이트, 배송, 넥라인, 상체, 부분, 빠르다"
옷장에 막 접어놔서 좀 쭈글하게 찍혔는데 한 면 소재예요 핏도 예쁘고 유용하게 입을 수 있습니당,"유용하다, 접다 놓다, 찍히다, 쭈글하, 니당다, 옷장, 소재, 핏"
핏이 이 뻐서 만족합니다 생각보다 단정한 느낌이에요,"만족하다, 단정하다, 핏"
치마가 많이 짧다고 했는데 짧기는 해도 핏이 너무 예뻐서 어쩔 수 없어요 정말 너무 예쁩니다 저만 입고 싶울 정도에요,"치마, 해도, 짧다, 짧다, 핏"
쇼룸에도 없어서 안 입어보고 구매했는데 만족해요,"입어보다, 만족하다, 쇼룸, 없다"
검정색이라 먼지 붙은 게 잘 보이지만 예뻐요 믿고 사는 글로니입니다,"검정색, 살다, 먼지, 보이, 붙다, 믿다"
엄청 미니멀한데 신축성이 좋아서 활동하기도 편하고 몸매도 좋아 보여용,"신축, 보이다, 활동, 미니 멀다, 편하다, 몸매"
랑 고민하다가 샀는데 잘 맞아요 부유방도 잘 가려줍니다,"가다 줍다, 부유 방도, 고민, 맞다"
배송 달 넘게 기다렸지만 진짜 너무너무 예쁘고 마음에 들어요,"넘다, 배송, 기다리다"
배송도 빠르고 물건도 잘 받았습니다 감사합니다,"물건, 배송, 빠르다, 받다"
핏이 예뻐요 생각보다 타이트 하진 않았어요 다만 길이가 넘 짧아요 앉을 때 고비,"길이, 고비, 타이 트, 하진, 짧다, 앉다"
핏이 예뻐요 생각보다 타이트 하지 않았어요 다만 넘 짧아서 길이가 좀 더 길었으면 좋겠어요,"길이, 타이 트, 핏, 짧다"
재질이 도 톰해서 원피스 모양은 잡아주지만 여름에 입 기 더워요 나 시원피스이지만 여름에는 못 입는 두꺼움입니다,"원피스, 잡다, 원피스, 재질, 여름, 톰해, 여름, 덥다, 모양"
세일해서 비교적 저렴하게 삿구 불편한 거 진짜 못 입는데 편해요,"일해, 편하다, 불편하다, 저렴하다, 비교, 삿구"
세일해서 비교적 저렴하게 삿구 불편한 거 진짜 못 입는데 편해요 레이어드 해서 입어 두 예쁨,"일해, 편하다, 저렴하다, 불편하다, 비교, 레이어 드"
진짜 날씬해 보이는데 치마가 너무 짧아요 좀 만 더 길게 만들어 주세요,"날씬하다, 보이다, 만들다, 길다, 줄다, 치마, 짧다"
배송 오래 기 다려서 입고 가려던 약속에는 못 입고 갔지만 사이즈 바꿔주셔서 습니다 허리 얇으신 편이면 그냥 해서 딱 맞게 입는 게 예쁜 것 같아요,"가다, 다리다, 사이즈, 허리, 편이"
스몰로 샀어오 됐나 싶지만 미듐도 괜참아 요 좋어요,"미듐, 스몰, 싶다, 돼다, 괜참"
꽉 끼게 입는 걸 싫어하기 때문에 고민 끝에 사이즈 선택했고 성공했습니다 키가 작은데 힙이 큰 체형이라 했으면 길이 너무 짧았을 것 같아 요 지굼도 똥꼬치마 입고 벗을 때도 편해서 사이즈 선택 잘한 것 같고 요 멜란지 사고 예뻐서 블랙도 구매했습니다,"멜란지, 체형, 사이즈, 편하다, 길이, 선택, 블랙, 고민, 키"
신축성도 적당해서 핏이 너무 예뻐요다음에 다른 색상도 구매하려 구요,"신축 성도, 적당하다, 색상, 핏, 요다음"
구매해는 데 핏이 진짜 이 뻐요 입어보니까 인기 많은 이 유 알겠더라고요 인 저한테도 조금 짧은 느낌이에요,"테, 인기, 핏, 짧다, 입어보다, 알다"
여름에 잘 입고 다녔어요 검정색이라 부담 없이 입기 좋고 뭣보다 핏이 넘 예쁜 듯,"검정색, 여름, 핏, 뭣"
도톰하고 베이직하게 딱 예쁜 핏 에 엉작녀 말라 인간한 테두 마니 짧은 편인데 전 조아욤,"베이직, 녀, 도톰하다, 인간, 조아욤, 말다, 편, 말르다, 짧다"
저 리뷰 원래 안 남기는데 이건 남겨야겠다 싶어서 남겨요 진짜 너무 너무 너무 예쁩니다 딱 입어보면 재질 한 게 느껴지실 거에 요 근데 부유방도 가려주고 몸매도 너무 예쁘게 잡아주는 제가 생각했던 것보다 많이 플레어 느낌이 긴 한데 그래서인지 몸매를 더 예뻐 보이게 해주는 것 같아 요 저랑 키 비슷하신 분들은 사이즈가 딱 예쁜 길이 감일 듯해요 다들 뭐 해 얼릉  구매해,"래서, 입어보다, 이건, 사이즈, 부유 방도, 재질, 잡다, 남기다, 가다"
재질도 하고 몸에 딱 맞아서 좋아요 에게 길이감은 적당해요,"적당하다, 길이 감다, 재질, 몸, 맞다"
배송도 빠르고 포장도 하고 너무 이 뻐요 만족합니다,"만족하다, 포장, 배송, 빠르다"
너어무 사고 싶어서 주 기다려서 받앗는데 진짜 너무 예뻐요 최고임 데이트룩으로 겨론식에 두 괜찮고 다 너무 예뻐요 다만 조금 짧다는 단점이,"단점, 기다리다, 무, 데이트, 겨론, 사고, 최고"
한 달 정도 기다려서 받았네요 배송이 느려서 아쉽지만 남은 여름 열심히 입고 다니려 구요,"기다리다, 배송, 느리다, 여름, 남다"
핏이 너무 예쁘고 조금 짧지만 맘에 듭니다 소재도 합니다,"듭니, 소재, 핏, 짧다"
핏이 진짜 이 뻐요 보통 면 원피스 입으면 배 쪽이 너무 핏되는 느낌이라 별로였는데 이 원피스는 배쪽 부각 없이 편하게 입을 수 있어서 좋아요 기장이 조금 더 길었으면 좋았을 거 같네용,"기장, 원피스, 원피스, 보통, 편하다"
핏이랑 색감 진짜 이 뻐요 재질은 하고 부드러운데 생각보다 두껍습니다,"색감, 부드럽다, 재질, 핏, 두껍다"
거의 한 달 만에 받았는데 핏이 너무 예뻐요 레인부츠에 신으려고 샀는데 장마가 끝나서 받은,"신다, 장마, 레인부츠, 핏, 받다"
한 검정 마른 몸을 소유한 자여 글로니로 오라,"마르다, 오라, 소유, 검정, 몸"
음 핏이 엄청 예뻐요 근데 좀 길이가 많이 짧습니다 어짜피 근데 속바지 입을 거긴 해서,"바지, 길이, 핏, 짧다"
딱 원하던 핏이 구 너무 예뻐요 짧은 걸 좋아해서 길이도 좋고 안에 속 바지 입으면 되니까 딱 좋아요,"길이, 원하다, 바지, 짧다, 좋아하다"
예버 용 가 타이트하다는 후기가 많아서 사니까 배 쪽도 너무 타이트하지 않아서 맘에 듭니당,"타이 트, 타이 트, 듭니당, 후기, 쪽, 예버, 사"
후기 여러 개 읽어보니 에 킬로 정도 돼도 는 넘 딱 맞을 거 같아서 샀더니 배 부분도 적당히 딱 맞고 길이도 괜찮아요 넘 예뽀용,"적당하다, 길이, 여러, 킬로, 부분, 후기, 읽다, 예뽀용"
후기 여럿 읽어보니 는 넘 작을 거 같아 구매했는데 딱 좋아요,"작, 후기, 읽다, 여럿"
허리가 다른 부위에 비해 얇은 편인데 딱 잡아주고 핏이 예뻐요 근데 생각보단 라인으로 퍼져서 아쉽긴 한데 그래도 예쁩니다,"잡다, 퍼지다, 라인, 허리, 편, 비다"
너무 예뻐요 진짜 단연코 완벽한 핏 나 만 사게 다들 사지 마세여,"단연 코, 완벽하다, 말다, 사지"
흼샥으로 구먀했다 너무 맘에 들어서 블략도 구매했어요 똥 꼬치마이긴 합니다 그치만 이 뻐서 견디는 거에 요,"들어서다, 견디다, 그치다, 블략, 꼬치 마이"
사이즈 생각보다 타이트하지 않았어요 단정하고 예뻐요,"단정하다, 타이 트, 사이즈"
이 뻐요 그런데 번 접으면 구김이 남네요 그치만 넘이 뻐 깔별로 사고 싶음,"접다, 그치다, 사고, 구김, 넘다, 남다, 싶다, 깔다 별로"
허리를 하게 잡아주는 느낌이에요 좀 짧아서 아쉽긴 하지만 제가 속 바지를 입으 명 되는 일이니까 여,"허리, 바지, 잡다, 짧다, 일이, 아쉽다"
핏은 너무 얘쁘지만 길이가 넘 짧아서 절대 숙일 수 없는 원피스 입니 당 속 바지 필수예요,"원피스, 길이, 숙이다, 절대, 바지, 핏, 필수, 짧다"
역시 믿고 사는 글로니 너무 예뻐용 근데 샀는데도 엄청 짧고 타이트해요,"타이트해, 살다, 짧다"
매장에서 입어보고 샀는데 진짜 이 뻐요 진짜 만족해요 색도 이 뻐서 친구한테 추천했더니 구매한다고 하더라구 요 진짜 좋아용,"만족하다, 매장, 입어보다, 친구, 색도, 구, 추천"
짧아 요 소재는 수영복 같이 한 원단입니다 롱부츠랑 신으면 예블 것 같네용,"롱 부츠, 수영복, 원단, 신다, 소재, 예블, 짧다"
생각보다 많이 작고 짧아요 바이크 팬츠 사서 같이 입어야 할 거 같아 요 하지만 재질도 좋고 너무 예뻐용,"바이크, 재질, 작고, 사서, 팬츠, 짧다"
수영복 면 느낌이라서 해요 사이즈 삿으면 조금 작았을 거 같아요,"수영복, 사이즈, 작다, 삿으"
화이트 사고 마음에 들어서 블랙도 삿어요 탄성이 좋고 퀄리티가 진짜 좋아요 몸매를 잘 잡아줘요 좀 더 살 빼고 입으면 더 이 쁠 것 같아요 미듐인데도 딱 맞아요,"미듐인데, 들어서다, 퀄리티, 탄성, 잡다, 몸매, 화이트, 블랙"
핏이 너무 예뻐요 몸매 좋아 보이고 가을에 가디건 걸쳐 입어도 예쁠 듯해요,"걸치다, 보이, 몸매, 가디건, 가을, 핏"
핏이 너무 예뻐요 흉통이 작게 나왔다는 후기가 많아서 으로 했는데 사이즈 딱 좋아요 제가 통 자 허리인데 이 거 입으면 허리가 잘록해 보여서 좋아요 근데 길이가 너무 짧아서 속 바지 잘 챙겨 입어야겠어요,"흉통, 보, 허리, 잘록하다, 허리, 사이즈, 길이, 챙기다"
핏이 너무 예뻐요 날씬해 보이고 몸매 완 죤 좋아 보여서 만족스럽습니다,"날씬하다, 만족스럽다, 보, 보이, 몸매, 핏"
예쁩니다 적당히 귀엽고 적당히 단정하면서 원피스 하나만 입어도 허전하지 않아 요 저는 비슷한 여러 뷴들의 스펙인데 에스가 적당히 맞아서 하나도 불편하지 않더라구요,"단정하다, 불편하다, 적당하다, 허전하다, 원피스, 스펙, 하나, 여러"
좀 압박하는데 그래서 핏이 더 이 쁨 아래가 플레어라 너무 맘에 들어 여 글로니 플레어 팬츠랑 같이 입으면 진짜 이쁨,"팬츠, 압박, 플레어, 플레어, 아래"
질도 좋고 핏도 예쁜데 생각 이상으로 타이트하고 작은 원피스에 요 작은 체형이라 작은 사이즈 안심하고 샀는데 완전 딱 맞고 팔뚝살 부각이 좀 되어서 운동 하고 입어야 할 거 같아 요 몸매에 자신 있으시다면 넘 예쁠 원피스입니다 저는 운동 하고 도전할게요,"운동, 원피스, 안심, 타이트, 도전, 사이즈, 체형"
질도 좋고 핏이 예쁜데 생각 이상으로 타이트하고 작은 원피스에 요 작은 체형이라 작은 사이즈 안심하고 샀는데 완전 딱 맞고 팔뚝살 부각이 좀 되어서 운동 하고 입어야 할 거 같아 요 몸매에 자신 있으시다면 넘 예쁠 원피스입니다 저는 운동 하고 도전할게요,"운동, 원피스, 안심, 타이트, 도전, 사이즈, 체형"
한테도 짧아요 바람 부는 날엔 조심해야 할 듯 상체 마른 편인데도 사이즈 엄청 핏되는 사이즈입니다 는 진짜 마른 사람들이 입어야 할 듯 내 몸이 볼륨감이 있다고 생각하면 부디을 사십쇼,"사이즈, 사이즈, 사람, 볼륨, 마르다, 쇼, 몸"
너무 완벽한 핏이라 깔별로 구매했습니다 무진장 세일 때 잘 샀어욤,"무진장, 완벽하다, 일, 핏, 샀어욤, 깔다 별로"
사이즈 고민 배송 직전까지 했는데 저한텐 허리는 여유 있고 가슴은 평소에 니플 패치만 붙여서 딱 좋았어요 길이는 요즘 짧은 스커트 길이인 거 같아 요 여름에 화이트 입으면 시원해 보이고 이 쁠거 같아서 세일하면 추가 구매 갈기겠슴 미더,"일, 패치, 시원하다, 사이즈, 밉다, 스커트, 고민"
사이즈 고민 배송 직전까지 했는데 저한텐 허리는 여유 있고 가슴은 평소에 니플 패치만 붙여서 딱 좋았어요 길이는 요즘 스커트 길이인 거 같아 요 여름에 화이트 입으면 시원해 보이고 이 쁠거 같아서 세일하면 추가 구매 갈기겠슴 미더,"일, 패치, 시원하다, 사이즈, 스커트, 밉다, 고민"
너무 예뻐요 흰색도 사고 싶어요 면이 해서 좋네요,"흰색, 사고, 싶다"
너무 맘에 들어서 일주일에 한 번씩은 꼭 입었어요 소재 해서 세탁해도 아직까진 변형 없구요 핏이 너무 예뻐요,"일주일, 번, 들어서다, 세탁, 변형, 소재"
확실히 제 키에는 정말 짧아요 단독으로 입기에는 부담이 있지만 바지랑 함께 입으려구요,"구, 확실하다, 바지, 단독, 키, 부담, 짧다"
생각보다 가슴 부분이 더 껴서 엄청 말라보여 요 원단도 한 편인 거 같아요,"말라보, 원단, 부분, 편, 가슴, 끼다"
배송 빨리 와서 좋았어요 옷은 흉곽 부분이 많이 작게 나왔고 길이가 짧아서 좀 신경 쓰이긴 합니다 그래도 예뻐요,"신경, 길이, 배송, 오다, 흉곽, 쓰이다, 부분, 작다"
배송 빨라요 옷은 예뻐요 근데 길이가 짧고 흉곽 쪽이 엄청 작아 요 가디건이나 셔츠랑 같이 입으면 좋을 것 같아요,"셔츠, 길이, 배송, 흉곽, 가디건, 작다"
맘에 들어요 고민하다가 산 건데 예뻐요 추턴합 미다,"고민, 추턴합, 밉다"
조아용 조아욤 재질 좋은 게 제일 좋아야 하거덩여 핏은 말모,"거덩, 말모, 조아욤, 재질, 제일, 핏"
세탁 두 번 했는데 변형 없고 재질이 딱 받자마자 조흠 핏이 뿜,"변형, 재질, 흠, 세탁, 핏, 없다, 받다"
으로 사니까 그렇게 짧지 않은 느낌이었아요 핏 진짜 너무 예쁘네여,"사, 느끼다, 짧다"
핏 너무 예쁘고 기장감도 딱 좋아요 바지랑 레이어드 해서 입어도 예쁩니당,"기장 감다, 바지, 레이어 드"
이 옷 핏이 진짜 예뻐요 살까 말까 고민했는데 고민한 시간이 아까워요 근데 제 키에도 길이가 좀 짧습니다,"고민, 길이, 키, 짧다, 아깝다, 살다, 말다"
글로니 맨날 예 빠요 길이도 딱 알맞고 잘 입어질 듯 햐오,"길이, 햐오, 알맞다, 빠"
글로니 맨날 예 빠요 길이도 딱 알맞고 잘 입어질 듯 햐오,"길이, 햐오, 알맞다, 빠"
믿고 입는 글로니 화이트와 블랙 깔별로 구매했어요 데일리하면서도 은 근 포인트 되고 격식 있는 자리에도 가능해요,"가능하다, 데일 리하 서도, 격식, 자리, 화이트, 포인트, 블랙"
핏 진짜 대박이에 요 면 원피스에 이런 핏과 고급스러움이 가능할 줄이야 너무 예쁩니다,"고급스럽다, 원피스, 대박, 가능하다, 이렇다, 줄, 핏"
치마가 좀 짧긴 한데 제 체형에 너무 이쁘게 떨어지는 핏 밑에 가 라인이라 다리도 얇아 보임,"라인, 치마, 보임, 다리, 체형, 짧다, 얇다"
글로니 원피스 제품은 핏이 예뻐서 마음에 들어요,"원피스, 제품, 핏"
너무 맘에 들아 요 하고 질이 좋네요 다른 색도 사고 싶어지는,"색도, 사고, 질, 싶다"
원단이 정말 해서 핏을 잘 잡아줍니다 한 여름에 입기엔 더울꺼 같아요,"잡다 줍다, 원단, 여름, 핏, 덥다"
글로니 좋아요 포장 완전 하고 옷 딱 맞고 진짜 예뻐요,"포장, 맞다"
핏 예술 질 예술 하고 하고요 허리 겁나 얇아 보여요,"보이다, 허리, 겁나다, 예술, 얇다"
한 소재인 게 마음에 들어 요 핏도 예뻐요 세탁 후 변형은 없는데 밑단이 약간 주름지게 되어서 잘 잡아서 건조시키는 게 좋을 것 같아요,"변형, 건조, 소재, 잡다, 주름 지게, 세탁, 핏"
예쁘긴 한데 팔뚝이 너무 부각되어 보여 요 그래도 예쁨,"보이다, 팔뚝, 부각 되어다"
잘 맞아요 기본 디자인에 블랙이라 어디든 막 입 기 좋아요,"디자인, 블랙, 기본, 맞다"
너무 이 뻐요 하기 잘한 거 같아 요 다른 색으로 사고 싶어요,"색, 사고, 자다, 싶다"
우선 길이 매우 짧아서 똥꼬 치마이지만 핏이 너무 이뻐 여 그리고 부유방도 안 보이게 싸악 커버해줍니다 메란지 사고 이 뻐서 또 샀자나요,"커버 해주다, 메란, 치마, 부유 방도, 길이, 보이"
기본 원피스에 요 너무 예뻐요 다만 사이즈가 엄청 해서 입는 것도 조금 힘들어 용 엄청 마르신 분들 제외하시고는 하시는 게 좋을 것 같아요,"마르다, 사이즈, 힘들다, 원피스"
화이트 시켰다가 오염 묻어서 반품 시키고 블랙 으로 주문했는데요 핏이 더 예쁘네요 저도 에 키로인데도 넘 붙어서 없는 군살도 티났었는데 은 적당히 하면서 마니 짧지 않아서 좋아요,"적당하다, 키, 군살, 오염, 말다, 화이트"
우선 미듐 사이즈지만 정말 정말 정말 작아 요 제가 허리가 얇은 편인데도 굉장히 타이트하고 짧습니다 이상은 단독으로 절대 못 입는 원피스에요,"원피스, 이상은, 사이즈, 타이트, 펴다, 단독, 절대, 허리"
가슴 부분이 좀 꽉 끼긴 한데 진짜 예뻐용 사 길 잘한 거 같아 용 응애,"응애, 자다, 가슴, 부분, 끼다"
사이즈 사니까 길이 적당해 요 소재 생각보다 하고 핏이 너무 예쁨,"적당하다, 사이즈, 소재, 길이, 사, 핏"
기본 원피스의 핏이 이렇게 이 쁠 수가 월 일 되자마자 쿠폰 먹여서 구매했습니다 역시 기 대한 만큼 핏이 예뻐요 소재도 하구요 글로니 옷은 빨리 사는 게 이득인 거 같습니다,"원피스, 먹이다, 이득, 쿠폰, 소재, 살다, 기본"
배송 너무 오래 걸렸어요 주 걸렸네요 면 소재 치고 비싼 가격인거 같아 조금 고민했는데 핏이 예뻐요,"가격, 배송, 소재, 비싸다, 핏"
미듐인데도 너무 작게 나온 게 좀 아쉬워요 이상은 안에 반 바지 필수에 요 절대 단독으로는 불가능,"미듐인데, 이상은, 단독, 불가능, 나오다, 절대, 바지, 작다"
너무 이 뻐요 색깔별로 사고 싶을 정도 또 세일하면 다 구매하고 싶어요,"일, 사고, 싶다, 싶다, 색깔 별로"
너무 이쁜데 정말 짧아요 감안하고 사시 길 바랍니다,"감안, 바라다, 사시, 짧다"
드레스가 이 뻐요 원단도 고급진 느낌이고 데이트할 때 딱임,"데이트, 고급 진, 드레스, 원단, 딱이다"
