Review,keyword
크게 입는 걸 좋아해서 젤 크게 삿는데 키가 잇어서 딱 적당한 거 같아 요 재질은 얇진 않은데 막 입을 만해 요,"삿는데, 좋아하다, 만해, 잇다, 재질, 얇다"
할인 기간에 잘 구매한 거여서 배송이 조금 느리긴 했지만 나름 만족합니다,"배송, 느리다, 만족하다, 거여, 기간, 할인, 나름"
편합니다 사이즈 딱 맞고 좀 두껍기는 함 그래도 잘 입을 게요,"편하다, 맞다, 두껍다, 사이즈"
이쁩니다 정 사이즈 옷이 변형이 없음 가격이 정말 착함,"변형, 착하다, 사이즈, 가격, 없다"
타이트히거 정핏이에 여 길이도 짧아서 좋아 여 편해여,"정핏이, 타이트, 히, 편하다, 짧다, 길이"
흰 검 색상 티셔츠만 원해서 두개 저렴한 듯 해서 구매했어요 조금 크긴 한데 오버핏으로 입음됩니다,"티셔츠, 크다, 오버핏, 저렴하다, 원하다, 색상"
기본템으로 좋아요 가격 대비 질도 좋고 만족합니다,"만족하다, 대비, 질도, 가격"
두께감도 적당하고 예일도 자수로 박혀 있어서 너무 이 뻐요 다른 옷들하고 맞춰 입기도 좋아요,"하고, 두께감, 예일, 적당하다, 맞추다, 박히다"
로고가 예뻐서 구매 했는데 옷 자체 내구성도 그렇고 생각보다 가성비 제품인 것 같아 요 디테일도 좋고 오버사이즈 느낌으로 입기에도 좋고 전반적으로 만족합니다 잘 입을 게요 감사합니다,"로고, 만족하다, 제품"
옷이 퀄리티 좋고 싸고 맘에 들어 요 가성비 좋습니다,"가성비, 싸다, 퀄리티"
착용감 낟 베드하고 재질 이 잘 안비침 요 사이즈 굳,"비치다, 베드, 하고, 재질, 사이즈, 착용"
사이즈는 제 스펙 정도 분들한테 적당한 거 같아 요 휘뚜루 마 뚜루 입 기 좋습니다,"분, 휘뚜루, 뚜루, 사이즈, 적당하다, 스펙"
일단 배송이 정말 빨랏고 쿠폰 등으로 할인 받아서 합리적인 가격에 구매할 수 있어서 좋았어요 해서 여름 잘 입을 거 같아요,"배송, 가격, 받다, 빨랏"
빠른 배송과 좋은 가격에 합리적인 제품을 구할 수 있어서 너무 좋습니다 와이드 핏 바지들이랑 무난하게 잘 어울려서 이번 여름 제일 잘 산 반팔티 같습니다,"바지, 배송, 어울리다, 제품, 가격"
크게 입는 거 좋아해서 큰 거 시켰더니 크긴 해요 근데 어깨선도 같이 넓어서 아쉬운 상태고 두께감 좀 있어서 좋아요,"크다, 넓다, 어깨, 선도, 좋아하다, 두께감, 상태"
아무 옷에 나 잘 어울려 요 편하게 입을 수 있어서 좋아요 재질도 부드러워서 좋아요 청바지에 잘 어울릴 거 같아요,"청바지, 편하다, 부드럽다, 어울리다"
재질이 해서 후줄근한 느낌이 적어 요 맘에 드네여,"후줄근하다, 재질, 적다"
가격이 넘 훌륭하고 이 가격에 이핏과 재질이 나오다니 싸 보이지 않는 가성비 갑 임,"이핏, 재질, 가격, 훌륭하다, 가성비, 나오다, 보이지"
너무 크지도 않고 가격 대비 입고 다니기 좋은 거 같습니다,"크다, 대비, 가격"
디자인도 심플하고 딱 제가 원하던 핏이라서 좋은 것 같아요,"핏, 원하다, 심플, 하고, 디자인"
너무 너무 사이즈도 딱 맞구 요 색감 좋구요 요즘 기본템으로 딱 좋아요,"맞다, 사이즈, 색감"
저렴하게 샀는데 원단도 하고 너무 예뻐요 회사 갈 때 주구장 창 입음,"저렴하다, 원단, 주, 구장, 회사"
한 소재라서 비침 거의 없고 사이즈도 적당해서 데일리로 매일 입고 다녀 요,"데일리, 적당하다, 소재, 라서, 사이즈, 없다, 매일, 비침"
두께는 얇지 않고 두꺼운 편이라 화이트 색상은 비침이 없습니다 두꺼워서 그런지 반 소매 옷치곤 한 게 보여 요 이전에 사이즈를 샀다가 너무 크고 이 상한 오버핏이라 로 바꾸었는데 는 완전 정핏도 아니고 해서 딱 좋네요 한 옷이 필요했는데 삼만원 안 되는 가격으로 괜찮은 반소매티 두 벌 사서 완전 좋아요,"사이즈, 색상, 크다, 삼만원, 가격, 두껍다"
가격적인 면에서 볼 때 퀄리티 너무 좋아요 두깨감 적당하며 핏도 너무 좋아요,"퀄리티, 가격, 핏, 적당하다, 깨감"
가격이 굉장히 저렴해서 구매 했는데 매우 만족합니다 제가 왜소 해서 옷이 조금 크기는 한데요 그럼에도 불구하고 매우 만족합니다 솔직히 시켰으면 작았을 거 같아요,"저렴하다, 가격, 작다, 크기, 만족하다, 그렇다"
몸이 살짝 해서 반바지와 입 기 딱입니다 키로 기준 딱입니다,"반바지, 딱이다, 몸, 키로, 기준"
기본적인 반팔로 너무 좋아요 재질도 생각보다 꽤 하네요,"재질, 기본, 팔로"
가성비가 좋고 하니 목 늘어짐 없어요 기본템으로 쟁여두 기 좋은 티셔츠입니다,"티셔츠, 없다, 쟁여, 늘어지다, 가성비"
옷 입었는데 가볍고 깔끔했습니다 여름이라서 갈끔하게 입을 려고 샀는데 잘 샀다고 생각들었습니다,"여름, 깔끔하다, 가볍다, 갈다, 끄다, 려고"
대충 입 기 좋아요 기본티 없으면 사는 거 나쁘지 읺은 데 넣입 헤서 입기에는 조금 짧았어요,"없다, 나쁘다, 짧다, 헤, 넣다, 읺, 대충"
색감은 하얀색이라 비슷하고 가격 대비 만족하는 재질입니다 세탁 후 구김이 조금 있지만 변형은 없는 거 같아여,"색감, 하얀색, 세탁, 재질, 구김, 변형, 만족하다"
사이즈 검정은 정상이고 흰색만 기장이 너무 길게 와서 교환 요청했는데 둘 다 보내야 한다고 해서 보냈는데 교환까지 무려 보름가량 걸리고 이번에 온건 심지어 둘 다 보란 듯이 두개 다 저번보다도 좀 긴 기장으로 보내주셨네요 원래 후기는 잘 달지 않지만 기장이 길어서 교환 요청 한 고객한테 보란 듯이 더 긴 걸로 둘 다 교체해서 보내주신거에 감격해서 후기 남깁니다 교환 한 번  더 신청하긴 귀찮으니까 걍 집에서 운동할 때나 입으려 구여 수고하세요,"교환, 개, 고객, 저번, 보다도, 교체, 흰색, 걸리다"
두께도 적당하고 사이즈도 작거나 크지 않아서 좋아요,"두께, 적당하다, 크다, 사이즈, 작다"
조금 두꺼운 소재라 여름에 입기에 더울 것 같지만 합리적인 가격에 구입했네요,"여름, 소재, 가격, 덥다, 두껍다, 합리"
사이즈도 딱 맞고 오버핏으로 입으려고 샀는데 엄청 만족 중이네요 갑자기 두 개가 오길래 배송 실순줄 알았는데 팩인 걸 이제 알았네요 만 원에 팩 가격 엄청 착 하네요 앞으로 잘 입고 댕기겠습니다,"배송, 실, 순, 줄, 이제, 알다, 팩"
기본 티라서 구입했어요 재질 좋아요 올 여름 잘 입을 게요,"재질, 티, 라서, 기본, 여름"
깔끔한 티셔츠 필요했는데 로고도 작고 귀여워요 할인 금액에 득템,"할인, 금액, 귀엽다, 득템, 필요하다, 깔끔하다, 작고, 티셔츠, 로고"
진짜 검은색 흰색 둘 다 개꿀템이에요 어느 곳이든 잘 어울리고 사이즈도 딱 좋구,"곳, 이든, 개꿀템, 이에요, 사이즈, 어울리다, 흰색, 검은색"
원단 질 좋고 중딩 아들이 좋아 하네요 아들과 아빠랑 같이 커플로 입네요,"아들, 아빠, 커플, 중딩"
사이즈는 보통 라지에 비해 살짝 커요 오버핏으로 입으면 되니까 상관없고요 흰색은 살짝 비친다는 상품평이 있어서 걱정했는데 제 기준으로는 안 비쳐 요 그 정도로 얇지 않아요,"흰색, 사이즈, 상관없다, 크다, 상품, 평이, 걱정, 보통"
일부러 오버핏으로 샀는데 이 뻐요 그리고 생각보다는 길어서 원피스로 입으려고용,"고용, 오버핏, 원피스, 보다는, 일부러"
여름에 매우 두꺼워서 월까지 그리고 가을부터 입을 수 있겠어요,"가을, 여름, 두껍다"
색상이랑 핏이 좋네요 두께감도 좋아요 자주 입을 수 있겠어요,"색상, 핏, 두께감"
운동 갈 때 레깅스 위에 입으려고 구매했는데 딱이에요,"딱이다, 위, 레깅스, 운동"
원단이 중간 정도의 두께는 되어서 흰티임에도 비침이 커버됩니다,"희다, 티임, 커버, 두께, 원단, 비침, 되어다, 중간"
재질은 기본 합니다 막 입기 딱 좋은 재질인 거 같습니다 사이즈는 조금 오버사이즈로 나온다는 댓글을 봐서 평소 라지를 입지맘 미디움으로 사니 딱 맞는 기장감이었습니다 너무 마음에 들었습니다 착용감은 보들 보들하니 너무 좋습니다 부 드러워요 무게 같은 경우는 가볍습니다,"사이즈, 착용, 감다, 가볍다, 무게, 재질"
배송은 빨랐고 세탁 후 변형이 있네요 수축감이 장난아닙니다,"배송, 수축, 빠르다, 장난, 아니다, 변형, 세탁"
통이 커요 사이즈 살 껄 그랬습니 당 근데 건조기 돌리고 빨으니까 길이는 좀 줄어들었어요 핏이 그닥 예쁘진 않음,"줄어들다, 빨다, 근데, 그닥, 건조기, 통, 크다, 핏"
여름에 가볍게 입 기 좋습니다 무난하게 입고 다니기 좋아요,"가볍다, 여름"
싸게 잘 입었습니다 싸다고 품질이 나쁘지는 않아요,"싸다, 품질, 나쁘다"
저렴한 가격에 두 벌 살 수 있어서 좋아요 여름 잘 입을 거 같아요,"가격, 저렴하다, 여름"
사이즈도 딱 좋고 질도 좋아요 저렴한 가격에 득템했어요,"득템, 사이즈, 가격, 저렴하다, 질도"
여름 반팔티가 필요해서 구매했는데 재질 핏 정말 마음에 드네요 벌을 저렴하게 득 템해서 올 여름 반팔티 걱정은 없을 듯 합니다 감사합니다,"필요하다, 저렴하다, 팔, 티"
딱 맞아 요 여름에 입 기 좋아요 너무 얇지 않고 적당히 두께감이 있어요,"여름, 두께감, 적당하다, 얇다, 맞다"
진짜 기 본템이네요 휘뚜루 마뚜루 잘 입을 것 같습니다,"휘뚜루, 마뚜루"
변형 없구 약간 도 톰 해용 완전 좋아요 가성비 최고,"최고, 가성비, 없다, 변형"
옷 이 쁘고 사이즈도 괜탄 고 좋아요 하나씩은 가지고 있으면 좋을 거 같아요,"하나, 씩, 괜탄, 사이즈, 가지"
초 아들에게 잘 맞네요 다른 티셔츠들보다 옷 태가 해 보여서 만족합니다,"티셔츠, 보, 여서, 만족하다, 맞다, 아들, 태"
사이즈 적당하고 옷이 덥지 않아서 여름에 입 기 좋습니다,"여름, 덥다, 적당하다, 사이즈"
선물주려고 샀는데 이라길래 별 기대는 안했는데 역시 심플이 제일 무난하게 예쁜 거 같아 요 특히 흰색이 깔끔해서 잘 입고 다니더라구여,"흰색, 깔끔하다, 선물, 주, 려고, 구"
얇고 가성비 좋고 편하게 입 기 좋아요 흰 옷이 좀 비치는 것만 조심하면 될 거 같아요,"조심하다, 편하다, 얇다, 비치다, 가성비"
검 흰 기본 두가 얇지 않은 천이고 흐트러짐 없이 입을 수 있는 스타일입니다 여름 한철 입는 색상이라 기본으로 구입했는데 핏 여유 있고 잘 입을 듯 함요,"스타일, 색상, 한철, 얇다, 기본, 천이"
편하게 오버핏스럽게 입다고 해서 스몰했더니 원하던 핏 이래요 얇지 않은 원단이고 나름 해 보여서 마음에 듭니다 블랙이랑 세트로 했는데 블랙과 함께 인 구성이 선택 폭이 너무 없어서 아쉬웠어요,"블랙, 아쉽다, 편하다, 스몰, 원단, 이고, 얇다, 보, 여서, 없다, 원하다"
사이즈는 정 사이즈이고 착용감이 정말 편안하네요 오버핏이고 옷 디자인도 너무 마음에 듭니다,"사이즈, 디자인, 이고, 편안하다, 착용, 오버핏"
입을 때는 몰랐는데 두 개 겹쳐놓고 보니 블랙이 화이트보다 좌우 상하로 크네요,"블랙, 모르다, 화이트, 크다, 겹, 치다, 좌우, 상하"
적당히 도 톰하고 각도 잡혀 있어서 마음이 들어 요,"톰, 하고, 잡히다, 적당하다, 각도"
재질맘에 들고 딱이에요 추천합니다 더 살 예정이에요,"예정, 이에요, 재질, 딱이다, 추천"
생각보다 괜찮아요 올 여름에 입으려고 샀습니다,여름
사이즈도 적당해서 편하게 자주 입 기 좋아요 출퇴근용 휘뚜루마 뚜루 개꿀,"적당하다, 편하다, 사이즈, 휘뚜루, 마, 뚜루, 개꿀, 출퇴근"
배송 빠르고 옷 퀄리티도 좋습니다 여름에 자주 입고 다닐 것 같습니다,"여름, 빠르다, 배송, 퀄리티"
약간 큰 듯 했지만 괜찮아요 한 치수 작은 거면 딱 맞을 거 같기도 해요,"맞다, 작다, 치수"
생각보다 조금 큰 느낌이었지만 그래도 괜찮아요 좋아요,느끼다
오버핏 싫어하는 아이가 맘에 든다네요 세탁 후도 괜찮을지 모르겠네요,"모르다, 싫어하다, 오버핏, 후, 세탁"
사이즈는 매우 만족하고 착용 감도 너무 좋습니다 특히 부드러운 느낌이 좋아요,"사이즈, 만족하다, 부드럽다, 착용, 특히, 감다"
사이즈 해서 오버핏으로 입어야 될 것 같아 요 다른 반팔티에 비해 두껍더라구요,"두껍다, 오버핏, 팔, 티, 비다, 사이즈"
기본 티지만 예뻐요 로고가 작아서 더 마음에 들어 요 하나만 입어도 예쁘고 남방이랑 레이어드해서 입어도 예뻐요 잘 샀습니다,"로고, 작다, 하나, 티, 레이어드, 남방"
옷이 얇아서 아주 시원하게 잘 입고 다닐 수 있을 듯 해료,"시원하다, 얇다, 해료"
한 느낌 좋아하시면 아주 만족하실 듯 만족합니다,"만족하다, 좋아하다"
다가오는 올 여름 이 녀석들과 함께라면 이겨낼 수 있겠네요,"다가오다, 녀석, 이기다, 낼, 여름"
하니 굿입니다 자주 입을 것 같습니다 감사합니다,굿
이너로도 괜찮고 단품으로도 잘 입을 거 같아 요 로고도 과 하지 않고 적당해서 좋네요,"적당하다, 단, 품, 으로도, 로고"
주 정도 입어 본 결과 살짝 한 느낌이 들어 요 핏이 예쁘긴 한데 더운 날에 입으면 더 더울듯 합니다,"덥다, 날, 핏"
레깅스 위에 입을 려고 사이즈로 했는데 조금 많이 크긴 하네요 하지만 타 브랜드 보다 원단 훨씬 맘에 듭니다 입어도 축 처지는 원단이 아니고 더 하네요 이제 이 브랜드로 살까합니다,"브랜드, 크다, 사이즈, 레깅스, 원단, 살다, 려고"
다 좋은데 세탁하면 좀 줄어드네요 옷은 예쁜 것 같습니다,"세탁, 줄다, 드"
옷이 좀 크긴 하지만 건조기 한 번 돌려 입으면 괜찮을 꺼 같아 요 옷 이 쁘네요 잘 입겠습니다,"쁘네, 크다, 건조기, 돌리다"
예일 옷은 처음이 엇는데 실 측 사이즈 열심히 재보고 삿습니다 하게 챙겨서 그런지 사이즈 너무 좋앗어요 거기에 옷의 재질 디자인 두께감 모두 너무 만족합니다 또 사고 싶어요,"사이즈, 디자인, 재질, 챙기다, 만족하다, 두께감"
아주 매우 정말 좋습니다 다음에 또 구매하고 싶어요,"하고, 싶다"
가격 대비 깔끔하고 편하고 좋아 여 흰색 또한 좋습니 닿 감사히 잘 입을 게요 뱍스하게 입기도 좋으니 구매 추천,"깔끔하다, 편하다, 감사히, 뱍스하"
학교에서 입으려고 샀는데 너무 예쁘고 단정하고 소재가 너무 맘에 들어요,"단정하다, 소재, 학교"
옷 사이즈도 좋고 예쁜데 이 가격에 두 벌이나 주는 게 말이 안 돼요 최고,"돼다, 말, 벌이, 사이즈, 최고, 주다, 가격"
남편 사이즈로 구매했는데 건조기 돌리니 한 사이즈 정도 줄어드는 거 같아 요 그래서 제가 입어요 건조기 사용하시는 분들 참고하세요 상품은 너무 좋아요,"건조기, 상품, 사이즈, 참고, 사용"
가격도 싸고 검흰 해서 잘 입고 다녀 요 굿이에 요 아주,"굿, 싸다, 검, 희다, 가격"
잘 입고 있습니다 하지만 몇 번 빨았더니 목이 늘어나서 아쉬워 요옷은 정말 예뻐요,"목, 아쉽다, 빨다, 늘어나다"
아주 좋음 어느 옷에나 잘 어울리고 무난하게 입을 수 있음,"에나, 어울리다"
핏도 이 쁘고 두께감도 좋아요 글씨포인트 크기도 딱 좋아요,"핏, 두께감, 크기, 글씨, 포인트"
조금 어 정쩡한 오퍼핏인거 같은데 마실용으로 가격 좋네요,"마, 실용, 오퍼핏, 인거, 정쩡, 가격"
아버지 사드렸는데 무난하면서 포인트 되는 게 괜찮더라구요,"사, 드리다, 아버지, 포인트"
적당히 여름에 입 기 좋습니다 비치지도 않고 적당히 얇아요,"얇다, 여름, 비치다, 적당하다"
사이즈 적당하고 가격도 좋아서 잘 입고 있습니다,"적당하다, 사이즈, 가격"
박시한 오버핏 옷이라 정말 편해 요 하나 더 구매하려고요,"오버핏, 박, 시한, 편하다, 하나"
작년에 한 번 사 서 입어보고 맘에 들어서 다시 구매했어요 하고 목도 잘 늘어 않고 맘에 들어요,"입어보다, 작년, 다시, 목도, 늘다"
색감도 화면색과 동일하고 사이즈도 딱 맞고 편해서 좋아요,"화면, 색, 색감, 사이즈, 동일하다, 편하다, 맞다"
생각보다 두꺼워서 놀랬어요 목 부분이 엄청 해서 잘 안 늘어날 것 같아서 너무 좋아용 디자인도 무난하고 깔끔해서 여기저기 잘 입을 것 같아요,"디자인, 하고, 깔끔하다, 놀래다, 부분, 늘어나다, 두껍다"
그냥 무난한 기 본티로 입기에 좋은 거 같아 요 추천,"그냥, 티, 추천"
딱 기 본 무지 옷으로 입 기 좋아요 한 여름엔 좀 더울 거 같은 두께긴 해요,"두다, 여름, 덥다, 무지"
키에 키로 중 등 남아 오버핏으로 괜찮아요,"오버핏, 키, 키로, 남아"
목 부분이 커서 헐렁거리는 거 말곤 무난하니 좋아요,"헐렁거리, 말다, 커서, 부분"
옷이 하고 되게 편해 요 편하게 막 꺼내 입기 좋아요,"편하다, 되게, 꺼내다"
색상도 너무 마음에 들고 사이즈도 생각한 거랑 너무 잘 맞아서 좋아요 굿,"맞다, 사이즈, 색상"
회사 단체복으로 몇 개 구매 가격 좋고 배송 빠름 천 얇지도 두껍지도 딱 좋음,"단체, 복, 얇다, 빠르다, 회사, 두껍다, 배송, 가격"
면이 도톡하고 사이즈는 조금 크게 나온 것 같습니다,"도톡, 하고, 나오다, 사이즈, 크게"
옷 재질이 해서 좋아요 마른 사람이 입으면 체형 보완 효과도 있는 것 같아요,"재질, 마르다, 사람, 보완, 효과"
사이즈도 딱이 고 생각보다 핏이 좋아서 또 구매하고 싶어요,"하고, 싶다, 딱이다, 핏, 사이즈"
기장이 짧은 편이예요 한번 빨고 나니 좀 더 짧아진 듯 해용,"짧아지다, 짧다, 편이, 예요, 기장, 한번, 나니"
너무 맘에 드누옷이예요 두 벌세트로 편안하게 입을 수 있어 요 두께도 흐느적 거리지 않아서 더 맘에 들어요,"드누옷이, 예요, 편안하다, 벌, 세트, 두께, 거리, 지, 흐느적"
믿고 입는 예일 반팔입니다 여름 대비 하나씩 마련하 세여,"하나, 씩, 여름, 마련, 세, 예일, 팔, 믿다, 대비"
가성비 좋은 옷 재질도 괜찬고 아주 예쁨니다 강추,"괜찬, 재질, 가성비, 강추"
사이즈로 하니 잘 맞고 좋아요 깨끗한 티셔츠 입고 싶어 했는데 딱이네요 원단도 면로 하니 좋아요,"티셔츠, 딱이다, 맞다, 사이즈, 깨끗하다, 면로"
핏 재질 너무 좋습니다 건조기 돌리실 거면 한 치수 크게 하면 좋을 거 같아요,"돌리다, 건조기, 크게, 재질, 치수"
로고 심플하고 소재 하고 너무 예뻐요 중학생 키에 키로에 키로 둘 다 잘 맞아요,"맞다, 심플, 하고, 키, 키로, 중학생, 로고"
너무 얇지도 않고 두께 적당하네요 품이랑 길이도 적당해서 여름 잘 입을 거 같아 요 작은 로고가 포인트가 되어 이쁘네요,"얇다, 로고, 적당하다, 두께, 품, 포인트"
남편은 기 본티 가지고 있는데 같은 걸로 살까 하다가 예일로 구매했어요 여름에 편하게 동네 다닐 때 입으려고 샀습니다 생각보다 재질이 해서 오래 입을 꺼 같아요,"남편, 여름, 편하다, 가지, 재질, 살다"
적당히 얇고 안비쳐서 좋음 크게 나와서 딱 입을 거면 한 사이즈 작게 사는 게 좋을 듯,"비치다, 얇다, 나오다, 작다, 적당하다, 사이즈"
옷핏 굉장히 마음에 들고 무난무난한 옷이라 매일 입 기 좋아요,"옷핏, 굉장하다, 매일"
생각보다 두껍고 해서 맘에 들어 요 여름 입을 게요,"두껍다, 여름"
배송도 빠르고 품질 재질이 좋아요 자주 입을 것 같고 사길 잘한 것 같아요,"자다, 재질, 배송, 빠르다"
예일 기본 티 가볍게 입 기 너무 좋네요 가성비 굿 이용,"가볍다, 예일, 가성비, 기본, 이용"
예일은 솔직히 후기 안 봐도 괜찮아 여 믿고 사셔도 됩니다,"예일, 솔직하다, 믿다, 후기"
예일 제품 처음 사보는데 품질도 좋고 입기 딱 좋네요 만족합니다,"사보다, 만족하다, 예일, 처음, 품질, 제품"
예뻐요 에겐 좀 많이 길 긴 하지만 편하게 입 기 좋을 것 같아요,"편하다, 에겐, 많이"
정말 무난무난해서 예쁩니다 정말 입 기 좋읗 것 같아 요 생각보다 두껍고 편합니다 가성비가 너무 좋아요,"좋읗, 편하다, 두껍다"
스몰 사이즈인데도 통이 매우 넓고 해요 한 소재에 질은 좋고 가성비 좋게 입기 좋은 반팔티입니다 어깨가 좀 넓어 보여서 그건 아쉬워요,"어깨, 사이즈, 인데, 팔, 티, 아쉽다, 소재, 넓다, 보, 여서"
하 일부로 오버핏시켰는데 한번 빨자마자 사이즈 너무 줄어든 다 정말 살 발하다 살발해,"오버핏, 살, 발해, 줄어들다, 빨다, 사이즈, 발, 일부, 한번"
좀 작긴 한데 그래도 그럭저럭 입 고 다닐 만 해요 이라서 가볍게 입 기 좋습니다,"가볍다, 작다, 그럭저럭"
빠른 배송 적당한 핏 딱 좋습니다 편하게 자주 입을 거 같아요,"편하다, 빠르다, 적당하다, 배송"
원단이 하고 힘이 있어요 핏도 여유 있어서 맘에 들어요,"원단, 핏, 힘, 여유"
살짝 하게 입을 수 있어요 하긴 한데 살짝 두꺼워서 여름에 한 겹 입기 가능할 듯 대신 기장은 살짝 짧습니다,"짧다, 여름, 가능하다, 두껍다, 대신, 기장"
딱 적당해서 레이어드 하기도 좋고 두깨가 두툼해서 좋습니다,"두툼, 적당하다, 레이어드, 깨"
픽이라 가상비도 좋은 것 같고 원단도 시원하니 좋은 것 같아요,"시원하다, 픽, 원단, 가상, 비도"
좋은 가격으로 잘 샀습니다 개인적으로 하면 다 좋을 거 같지만 그래도 이쁩니다,"개인, 가격"
두 벌을 이 가격에 너무 맘에 드네요 잘 산 거 같아 요 사이즈도 적당하니 좋아요,"적당하다, 사이즈, 벌, 가격"
군기 도 없음 그냥 기 본티인데 진짜 깔끔한 뭐 물론 남의 대학 써져 있는 거 왜 입냐 외국인이 보면 웃긴다는 글도 있지만 난 입어 예일 만세,"웃기다, 외국인, 티, 인데, 예일, 그냥, 깔끔하다"
조금 두꺼운 거 같지만 괜찮아 요 임신 중이라 사이즈 크게 시킨 건 뎅 너무 좋으네요,"두껍다, 중이, 크게, 사이즈"
맨날 스파 브랜드 옷이나 지하상가 보세 옷 입다가 입어서 그런지 두툼하고 좋네용 이번 여름 걱정 없어요,"이나, 그렇다, 없다, 두툼, 하고, 지하상가, 여름"
심플하고 너무 예뻐 여 사이즈도 딱 맞아 여 사 길 잘한 듯,"자다, 심플, 하고, 사이즈, 맞다"
원래 입는 사이즈 인데 살짝 큽니 다 그리고 얇고 비침 없어요,"얇다, 원래, 없다, 인데, 사이즈, 크다, 비침"
일단 가격 대비 가성비 좋구요 면 티셔츠의 원단 질감 또한 아주 좋습니다 예일 제품은 늘 믿고 구매 합니다,"티셔츠, 제품, 가격, 믿다"
휘뚜루 마뚜루템으로 좋아요 좀 커서 작은 사이즈 사도 괜찮을 것 같았어요,"마뚜루, 커서, 휘뚜루, 사이즈, 작다, 사도"
예일 제품 좋아해서 외투 다음으로 티셔츠 주문했습니다 가격 대비 가성비 좋코 면 티셔츠의 질감도 좋습니다 세탁해도 늘어나거나 그럴 꺼 같지 않코 하니 면의 질감 좋습니다 제가 박시하게 입는 걸 좋아해서 큰 사이즈로 시켰습니다,"티셔츠, 세탁, 사이즈, 제품, 늘어나다, 주문, 박다, 코"
예일 제품 좋아해서 외투 다음으로 티셔츠 주문했습니다 가격 대비 가성비 좋코 면 티셔츠의 질감도 좋습니다 입으면 스타일 핏 두 괜찮습니다,"티셔츠, 좋아하다, 주문, 스타일, 코"
편하게 동네 마실용으로 구입했지만 외출할 때 입어도 될 정도로 컬리티 좋고 오버핏 좋아하시면 강 추합니다,"마, 실용, 좋아하다, 편하다, 오버핏, 외출, 추하다"
일반 사이즈보다 오버핏 느낌나게 좀 큰 편이에 요,"느끼다, 편이, 오버핏, 사이즈, 일반"
작년에도 입었다가 올해에도 사봤습니다 역시 좋아요,"올해, 작년, 사보다"
처음 사봤는데 옷도 하고 사이즈도 좋아요 추가 구매해서 커플룩으로 입으려구요,"구, 사보다, 커플룩, 사이즈, 처음, 추가"
가격 대비 정말 좋구요 심플해서 밖에 피시방 같은데 갈 때 입으면 예쁠거 같아요,"심플, 밖에, 대비, 피시방"
