Review,keyword
좋은 가격으로 득 템했어요 사이즈는 크지도 작지도 않은 정 사이즈에 요 두께도 더운 여름에 입기에 적당한 사이즈에 요 다만 검정색은 먼지가 붙으면 잘 안 떼져서 주의가 필요할 것 같아요,"검정색, 여름, 사이즈, 먼지, 덥다, 크다, 붙다, 작"
수라 전혀 꼭 쥐스 비치는 것도 없고 옷도 해서 무난하게 잘 입고 있습니다,"전혀, 비치다, 없다, 쥐스"
색감 좋고 재질도 좋아서 재구매 구매 하고 있어요 가격 대비 만족도 최상입니다,"만족도, 최상, 색감, 재질, 재다"
너무 얇지도 두겁지도 않아서 좋습니다 기본템으로 입 기 좋아요,"겁, 얇다"
이 가격에 대 만족입니다 싼 재질도 아니고 두께도 보통이라 더 좋습니다,"만족, 가격, 보통, 두께, 재질, 아니다"
목이 진짜 하고 원단이 해요 천년만년 입을 수 있을 것 같아 요 청바지에 입었을 때 핏도 예뻐요,"청바지, 원단, 핏"
굉장히 좋고 예일 로 고 가리면 걍 무지티 같음 글고 목 졸림,"굉장하다, 가리다, 예일, 무지, 티, 졸림"
원단도 좋고 길이도 적당합니다 이너 해서 입어도 되고 많이 입어질 거 같습니다,"적당하다, 원단, 길이, 이너"
면 재질도 좋고 기장도 딱 원하는 오버핏이라 좋아요,"오버핏, 재질, 기장, 원하다"
핏 이 쁘고 총장이 길어서 레이어드해도 이쁠 거 같아요,"레이어드, 총장"
옷 핏도 이 쁘고 목도 해서 오래 입고 다닐 수 있을 것 같아요,"핏, 목도, 오래"
기본 티로 편하게 입 기 좋아요 덩치가 있어서 가슴 둘레 사이즈 한 게 제일 맘에 들어요,"편하다, 덩, 치가, 사이즈, 둘레, 티, 가슴"
옷 재질이 해서 체형을 잘 잡아줘서 좋은 거 같아요,"잡다, 체형, 재질"
가성비 좋게 입기 좋아요 지금 날씨에 반 팔에 겉옷 입고 다니면 좋아요,"날씨, 겉옷, 지금, 팔, 가성비"
재질도 좋고 해 보여 요 로고 큰 거 안 좋아하는데 작아서 귀엽네요,"좋아하다, 귀엽다, 작다, 재질, 보이다, 로고"
옷이 한 옷이라 웬만한 여자분들은 로 사면 될 거 같아요,"여자, 분들, 웬만하다, 사면"
배송 가격 만족합니다 예 일반팔티 대박이 쁘고 좋아요,"대박, 만족하다, 일, 팔, 티, 배송, 가격"
무난무난한 기본티에 요 예일로 고가 포인트가 되긴 해요 근데 검은색은 먼지가 좀,"검은색, 근데, 티, 먼지, 예일로, 포인트, 고가"
배송도 빠르고 세일할 때 샀어요 재질도 좋고 아이가 맘에 들어해서 좋아요 많이 파세요,"파다, 배송, 세일, 재질"
기본 티셔츠 어디에도 다 잘 어울립니 다 세일할 때 구매해서 좋네요 색감도 좋고 사이즈 딱입니다,"티셔츠, 사이즈, 딱이다, 세일, 색감, 어울리다"
깔끔하게 라인과 핏이 너무 좋아요 너무 이 뻐요 어느 코 디든 다 잘 어울립니 다 감사합니다 잘 입을께요,"깔끔하다, 핏, 어울리다, 라인, 디"
예일 처음 샀는데 기본티로 활용하기 나쁘지 않네 요데일리로 굳,"데일리, 티, 예일, 처음, 나쁘다, 활용"
완젼크고 완젼편함 면도 좋고 두꺼움 여름에 이 너나 그냥 단품으로도 좋음,"여름, 완젼크, 단, 품, 으로도, 그냥, 두껍다, 완젼편함, 면도"
옷이 커서 팔소매 부분은 접어서 입어요 사이즈가 커서 편하게 입기 좋아요,"사이즈, 커서, 편하다, 접다, 팔, 소매, 부분"
일 상품 재질도 좋고 두툼하니 넘 조아 여 가성비 최고오,"두툼, 조아, 가성비, 재질, 최고, 오, 상품"
옷 재질 하고 좋아요 데일리로 잘 입고 있습니다 재 구매 의 향 있어요,"데일리, 재질"
나뿌지 않아 요 그냥 딱 기 본티 그 잡채 기준 가 딱 좋은 것 같아 요 시켰으면 컸을 듯,"크다, 그냥, 나뿌, 지, 잡채, 티, 기준"
예일 티셔츠 아들 사줬는데 잘 입고 다녀 요 천도 해서 좋아요,"사주다, 예일, 티셔츠, 아들, 천"
사이즈 잘 맞아요 편하고 좋아요 만족 만족 재질 좋아요,"편하다, 맞다, 만족, 재질, 사이즈"
배송 빠르고 좋아요 목이 좁아서 입고 벗기가 좀 힘드네요,"힘드다, 목, 벗기다, 좁다, 빠르다, 배송"
저렴하게 구매한 거 치고 배송도 빠르고 원단도 해서 좋았네요,"치고, 저렴하다, 배송, 원단, 빠르다"
정도에 키로 사이즈 여유 있게 잘 맞네요 두께가 약간 있어서 지금 입 기 좋아요,"맞다, 지금, 두께, 키로, 여유"
그냥 가볍게 입 기 편하네요 작업할 때도 자주 입을 거 같아요,"가볍다, 그냥, 작업, 편하다"
배송도 빠르고 사이즈도 정 사이즈라 딱 좋습니다,"사이즈, 배송, 빠르다"
무난하지만 생각보다 좀 박시한 느낌입니다 참고하세오,"참고, 박, 시한"
사이즈로 하면 더 이쁘게 잘 맞았을 텐데 사이즈라 크긴 크네요 그래도 박시하게 이쁘게 잘 입겠습니다,"사이즈, 크다, 맞다, 텐데, 박다"
가볍게 입 기 좋아요 두껍진 않고 기본티로 적당합니다,"가볍다, 적당하다, 티, 두껍다"
후드티안에 입으려고 구매했는데 잘 산 거 같아 요 사이즈도 잘 맞고 천도 좋아요,"맞다, 후드, 티안, 사이즈, 천"
이너로 입 기 좋아서 구매했눈 데 그냥 이것만 입어도 이 쁘네요,"쁘네, 이너, 그냥, 눈"
둘 다 괜찮게 만족입니다만 흰색은 쬐 금 속 이 비치는 거 같네요 니플 패치 쓰시던 분은 쓰셔야 할 거 같아요,"만족, 비치다, 패치, 쓸다, 분, 플"
정말 편하게 입고 다닐 수 있는 기장입니다 근데 로고가 작아서 그냥 면 티 처럼 보일 수도 있어요,"로고, 작다, 기장, 편하다, 그냥, 보이다, 근데"
예쁩니다 블랙 흰색 조합으로 사서 데일리룩으로 입기 딱 좋아용,"데일리룩, 조합, 블랙, 흰색, 사서"
재질 한데 목이 좁아요 박시하게 입으려면 이나 았을 듯한 데 도 딱 맞음,"박다, 았, 목, 이나, 좁다, 맞다, 재질"
제품 아주 훌룡합니다 가격도 저렴하고 재질도 너무 좋고 아주 마음에 들어요,"저렴하다, 가격, 제품, 훌룡합니, 재질"
사이즈 잘 맞고 어떤 옷이랑 입어도 잘 어울리고 무난합니다,"맞다, 어울리다, 어떻다, 사이즈"
옷 너무 만족합니다 다 만 기장이 살짝 짧아요 옷 재질은 해서 체형 보완 되고 옷이 잘 안 늘어날 거 같아 요 세미오 버핏 느낌입니다,"늘어나다, 짧다, 체형, 재질, 기장"
옷이 안 비치고 좀 한 느낌이라 구겨 않아서 좋아요 제가 샀는데 동생도 자기 계정으로 들어가서 따라 사더라구요,"계정, 들어가다, 비치, 구기다"
목 부분이 좁아서 입고 벗을 때 머리통이 끼긴 끼는 데 재질도 좋고 예쁨,"머리, 통, 끼다, 벗, 재질, 좁다, 부분"
처음 사면 괜찮은데 입가보면 약간 짧아져요 좋음,"입가, 짧아지다, 처음, 사면"
그렇게 하늘하늘한 소재는 아니고 두깨감이 있어서 안 비칩니다 그냥 무난하게 입 기 좋아요,"깨감, 비치다, 아니다, 그냥, 하늘하늘하다, 그렇게, 소재"
무난하고 편해서 아무 옷이나 다 잘 어울려 요 여름 이것만 신어요,"편하다, 이나, 신어, 어울리다, 하고, 여름"
로고가 작아서 옷이 깔끔해요 두께도 좋구요 편하게 입고 다니기 좋아요,"깔끔하다, 편하다, 두께, 로고, 작다"
사이즈도 딱 적당하고 소재도 한 느낌이라서 너무 좋네요,"적당하다, 사이즈, 소재"
저 정도 신체되시는 분은 사셔 요 목도 좀 쪼이네요 옷은 예뻐요,"쪼이다, 신체, 분, 목도"
딱 스타일이 깔끔해서 좋아요 시원하고 다른 티랑 잘 어울려요,"깔끔하다, 어울리다, 스타일, 시원하다, 티"
너무 이쁘고 좋아서 편하게 외출할 때 입기 좋아요,"편하다, 외출"
와 원래는 라지 구매했었는데 빨래 하니까 작아지네요 엑라로 재구매했어요,"재다, 작아지다, 원래, 엑라, 빨래, 라지"
살짝 두께감이 있어서 비침이 전혀 없어요 편한 차림 때 많이 입을 것 같아요,"두께감, 편하다, 전혀, 없다, 비침, 많이"
가성비 좋아서 괜찮네요 나쁘지 않아 요 휘뚜루 마 뚜루,"휘뚜루, 나쁘다, 뚜루, 가성비"
원단이 너무 얇지 않고 해서 좋아요 그냥 입기에도 좋고 이너로 활용해도 좋을 것 같아요,"활용, 이너, 그냥, 원단, 얇다"
생각보다 이쁘고 핏이 좋아요 기장이 좀 길 긴 하지만 한 번씩 사보는 거 추천,"핏, 기장, 번, 씩, 추천, 사보다"
원래는 사이즈 입는데 오버핏이라 으로 주문했습니다 오버핏보다 어느 정도 작당하게 딱 맞는 느낌을 좋아하시면 본래 입던 사이즈보다 한 치수 작은 것으로 구입하시는 걸 추천합니다 저는 매우 만족하고 입고 있어요,"사이즈, 추천, 작다, 만족하다, 오버핏, 주문"
길이 적당하고 마음에 들어 요 이쁘게 잘 입을 거 같아요,"적당하다, 길이"
오버핏 생각하고 샀는데 살이 많이 쪄서 정 사이즈 느낌이네요 옷은 너무 이쁩니다 제가 하체비만이 고 상체는 한 키로 정도 체형인지라 엑스라지 기준 키로 정도 되시면 정 사이즈 나올 거 같고 키로 중반 정도면 오버핏 괜찮게 나올 거 같애요 그리고 왜 인진 모르겠는데 검정보다 흰색이 한 느낌입니다,"살이, 사이즈, 흰색, 하체, 비만, 찌다, 체형, 인지"
옷이 좀 두껍고 세탁하면 옷이 좀 많이 줄어 들어서 몇 번 입고 안 입게 돼요,"세탁, 줄다, 두껍다, 돼다, 많이, 들어서다"
가성비 젛구요 그렇다고 꼬도 않네 여 좋아 영,"그렇다고, 젛구, 꼬, 가성비"
상체 발달형 엑스라지 하고 깔끔하게 여름 준비 완료,"깔끔하다, 엑스, 라지, 완료, 준비, 상체, 여름, 발달, 형"
색이 선명하고 밝아요 시원해서 여름에 입 기 좋을 거 같아요,"여름, 밝다, 시원하다, 선명하다, 색"
후기 작성만 한다고 대충 입고 사진 찍었더니 스타일이 이 상한 데 굉장히 편하고 스타일 하기 편할 것 같습니다,"스타일, 찍다, 사진, 편하다, 작성, 굉장하다"
로고 크기 적당하고 두깨도 얇아서 여름에 입 기 너무 좋아요 마감도 좋고 전반적으로 만족합니다,"여름, 깨, 만족하다, 얇다, 로고, 적당하다, 전반, 마감"
엠 사이즈라 조금 클까 걱정했는데 기장도 원하는 엉덩이 다 덮는 정도로 오고 핏도 박시한 게 제가 원하던 느낌이라 마음에 들어 효,"원하다, 핏, 엉덩이, 걱정, 크다, 박, 시한"
하나만 사는 거라고 생각했는데 두개와 서 오히려 좋았고 막 집어 입기에 무난하고 딱 좋아요,"개, 하고, 하나, 라고, 집다"
깔끔하고 가성비가 좋습니다 원단도 좋습니다 굿,"깔끔하다, 원단, 가성비"
고민하다 했는데 총장이 조금 아쉽지만 팔이 워낙 길게 나온 터라 이었으면 팔꿈치까지 닿을 뻔 했네요 옷 품질은 좋습니다,"팔꿈치, 팔이, 고민, 길다, 아쉽다"
옷이 어떤 옷에 든 맞아 입기 좋고 색깔이 깔끔해 어디서든 입고 싶습니다,"색깔, 깔끔하다, 서든, 싶다, 어떻다"
티셔츠 자체도 예쁜데 예일 로고가 예뻐서 샀어요,"예일, 티셔츠, 로고, 자체"
좋아 용 완전 휘뚜루 마 뚜루템 할인할 때 후딱 사 서 넘 좋아 여,"휘뚜루, 뚜루템, 후딱, 할인"
원단 하고 가볍게 입 기 좋아용 안에 비침도 없습니당,"가볍다, 비침, 없다, 니당다, 원단"
단색으로 깔끔하고 입을 때 느낌도 좋네요 흰색 옷은 구김이 살짝 보이긴 합니다 사이즈는 딱 맞았습니다,"깔끔하다, 흰색, 사이즈, 단색, 보이다, 맞다, 구김"
큰 사이즈로 샀는데 생각했던 것과 같아서 좋았어요,사이즈
기본템으로 좋습니다 배송도 빨랏고 핏 좋아요 길이 통 도 적당합니다,"적당하다, 빨랏, 배송, 길이"
일단 핏은 은 거 같습니다 다음에도 많이 구매하겠습니다,"핏, 많이"
처음 예일 제품 구매한 이후로 믿고 샀는데 만족입니다,"만족, 믿다, 이후, 예일, 처음, 제품"
반팔이지만 조금 두껍습니다 여름에 통이 큰 바지랑 입우면 잘 어 울릴 것 같슺니 다,"바지, 두껍다, 여름, 팔이, 울리다, 통, 같슺"
총장 길이가 안길 고 적당하니 예쁘네요 또 사고 싶네요,"안길, 싶다, 적당하다, 총장, 길이, 사고"
그냥 기 본티로 가성비 좋은 거 가타요 면이라 한번 빨래하니까 줄더라고요 담엔 한 사이즈 업해서 사야 할 듯,"빨래, 업, 사이즈, 주다, 그냥, 가타, 티, 가성비"
봉제도 깔끔하고 비치는 소재도 아니여서 편하게 잘 입고 다닐 거 같아 요 가성비,"깔끔하다, 편하다, 아니다, 비치다, 가성비, 소재, 봉제"
여름 티셔츠 구비 완료 큰 기 대 안 했는데 만족하고 갑니다,"가다, 만족하다, 티셔츠, 완료, 구비, 여름"
첨에 싸이즈 때문에 고민했는데 하길 잘했어요 길이 품 목 둘레 다 적당하고 잘 맞아요 체육복 안에 입어도 괜찮습니다 잘 입을 게요,"체육복, 맞다, 적당하다, 고민, 첨"
사이즈랑 핏이 너무 예뻐요 여름에 하나만 딱 입으면 예쁠 옷,"여름, 하나, 핏, 사이즈"
여름 때까지 편하게 입을 수 있을 것 같아 요 일반 사이즈 보단 오버핏입니다,"오버핏, 편하다, 사이즈, 일반, 보단, 여름"
싸게 잘 산 거앝아요 심플하고 사이즈도 딱 맞고 좋아요,"사이즈, 맞다, 거앝아, 심플, 하고, 싸다"
예일 반팔티는 언제나 이 뻐용 잘 입고 다니겠습니다,"뻐용, 팔, 티, 예일, 언제나"
크기 적당하고 넣어 입기도 빼서 그냥 입어도 좋아요,"그냥, 적당하다, 빼다, 넣다, 크기"
기준으로 사진처럼 기장 나옵니다 입기 좋은 기본티예요,"티, 예요, 나오다, 기장, 사진, 처럼, 기준"
로고나 캐릭터 없이 이 쁘고 레터링도 꽤 이 뻐서 마음에 드네요,"로고, 없이, 레터, 링, 캐릭터"
재질도 한 거 같고 뮤난하게 코디하기 좋은 거 같아 요 솔직히 가성비 갑인 거 같아요,"솔직하다, 뮤, 난하다, 갑인, 가성비, 코디, 재질"
생각보다는 큰데 남여 공용 사이즈라고 생각하면 나쁘지 않아 요 편합니당,"크다, 사이즈, 라고, 보다는, 남여, 나쁘다, 편하다, 공용"
무난무 난합니다 하얀 티는 앙저 꼭 띠가 좀 보이긴 하는데 안에 이너로 입어야겠네요,"보이다, 띠, 이너, 난하다, 티, 하얗다, 앙"
옷도 예쁘고 사이즈도 잘 맞고 좋습니다 추천합니다,"맞다, 추천, 사이즈"
너무 이 뻐서 자주 입고 있습니다 좋아요 최고에요,"최고, 에요"
제 체형에 딱 맞는 사이즈네요 길이는 생각했던 거보다 조금 길어요 바지 안에 입으면 상관없을 듯해요,"사이즈, 체형, 상관없다, 바지"
색도 맘에 들고 일단 원단 퀄리티가 남 다르네요 정말 하고 얇은 느낌이라 여름에 입기 좋을 거 같아요,"여름, 얇다, 다르다"
세일로 저렴하게 잘 산 거 같아 요 핏이나 질 모두 만족합니다,"저렴하다, 만족하다, 핏, 이나, 세일"
박시하게 입을 수 있어 좋아요 너무 예뻐서 만족합니다 기준 엉덩이 다 덮어요,"박다, 만족하다, 덮다, 엉덩이, 기준"
코튼이라 샀는데 만족스러워요 질도 좋고 예일 영어가 자수로 박혀 있어서 더 예쁜 거 같네요,"만족스럽다, 예일, 코튼, 영어, 박히다"
두께감도 좋고 핏이 예뻐용 가격도 저렴해서 완전 추천입니당,"핏, 저렴하다, 두께감, 추천, 가격"
여름에 반 팔 사야 할 때 한번 사봐도 나쁘지 않음 배송도 빨라서 굿,"사보다, 여름, 나쁘다, 배송, 라서, 한번"
나쁘 지 엑스 해용 싼데 셔츠 두장이고 핏도 해서 가성비 지대루,"이고, 싸다, 핏, 셔츠, 가성비, 엑스, 나쁘다, 지, 대루"
실물로 보니 옷이 생각보다 큽니 다 어깨 좁으신 분들은 옷이 많이 늘어질 수 있을 것 같습니다 하지만 옷 자체는 검은색 흰색 둘 다 이 쁘기 때문에 사이즈 선정만 잘 한다면 이쁘게 입을 수 있겠습니다,"어깨, 사이즈, 검은색, 늘어지다, 크다, 흰색, 분"
적당히 얇고 소매 두께도 적당해서 튀어나오지 않고 핏이 좋아요 팩이라 가성비도 매우 좋은 거 같고 만족 중입니다,"적당하다, 팩, 두께, 얇다, 만족, 튀어나오다"
원단이 하고 비침 없이 가 벼워서 좋아요 포인트 로고가 귀엽고 어디에나 매칭하기 쉬운 기 본티라서 입고 다니기 좋아요,"로고, 벼워, 귀엽다, 매칭, 원단, 에나, 티, 라서"
화이트 색상으로 단품샀다가 넘 이 뻐서 셋트로 또 구입했어요 깔끔하니 너무 이쁘네용,"단, 품, 깔끔하다, 색상, 셋트, 화이트"
기장감이 좀 길긴 한데 전체적으러 예쁘고 자주 입어요,"길다, 전체, 적다, 기장감"
세탁 후 많이 줄어 들긴 하는데 가격 대비 좋은 상품인 거 같습니다,"줄다, 상품, 대비, 많이, 세탁, 가격"
가격도 너무 싸고 옷도 너무 이 쁘고 편하고 좋네요 만족합니다,"편하다, 만족하다, 싸다, 가격"
인데 크기 적당하고 비침도 생각보다 별로 없고 소재도 좋아용,"소재, 별로, 크기, 비침, 적당하다, 인데, 없다"
일단 제방이 돼지 우리라서 가렷 구요 옷 설명할게요 일단 이뿝니다 이 뻐요 특히 흰색 안색이 밝아 보이게 해주는 군요 그리고 두개 다 아무 때나 입을 수 있습니다 매우 좋아요 그리고 저 쬐깐 한 예일 가 매우 치명적입니다 조 거팬츠랑도 어울리고 데님도 어울리고 다 잘 어율려요 그냥 다 해 아 근데 리를 빗 주의할 점은 남이 환불하거나 교환한 옷 받을 수도 있고 실밥 조금 붙어서 옵니다 람쥐 그 래서 저도 검은색은 목이 좀 하고 흰색은 목이 하더라구 용 근데 이쁘니까 괜찮구요 세탁은 아직 안 해봣는데 줄어들 거 같긴 한데요 하지만 이 가격이면 재구매도 해볼 만해서 괜찮습니다 일단 사고 안 맞으면 환불하면 되자나요 그니까 사고 생각하십쇼,"팬츠, 람쥐, 흰색, 돼지, 안색, 세탁, 치명, 검은색"
속안비치고 무난해 요 근데 흰색이 흰색이랄까 그런 느낌이라 인상이 환해 보임 여 기본템으로 아주 좋습니 두 개에 이 정도면 담에도 또 살 듯 세탁은 아직 안 해봤어요 아그리고 특이점이 있다면 흰색은 목이 좀 한데 검정은 이미 늘어져 있는 느낌 그리고 실밥도 리를 빗 나오긴 합니다 아마 누가 입 다가 환불한 거 받은 듯해 여 그래도 머 입겠습니다,"흰색, 랄, 끄다, 세탁, 목, 늘어지다, 실밥, 검정, 담"
옷 사이즈 딱 알맞게 예쁘게 맞아요 요즘 오버핏 많아서 정 사이즈로 입 기 어려웠는데 알맞게 맞아서 너무 좋아요,"알맞다, 맞다, 사이즈, 어렵다, 많다, 오버핏"
원래 사려다가 리뷰 보고 좀 커 보이길래 샀는데 딱 맞고 크지 않아서 좋아요,"보이다, 크다, 원래, 맞다, 보고, 리뷰"
오버핏 느낌 나 고 흰색은 좀 비침이 있어요 기본티로는 그냥 무난해요,"그냥, 오버핏, 비침, 티, 로는, 흰색"
그냥 입기에 좋네요 그리고 옷도 비치지 않아서 좋은 거 같아요,"비치, 지, 그냥"
크기가 클거 같았는데 입고 나니까 그다지 크게 느껴 않았어요,"그다지, 크다, 느끼다, 크게, 크기"
깔끔하고 예쁩니다 할인해서 싼 가격에 얻어서 좋았고 예약 배송이라서 늦게 받았지만 만족스러워요,"할인, 만족스럽다, 배송, 늦다, 깔끔하다, 받다, 얻다, 가격"
한 체형에도 여성분이면 사이즈 해요 네이비 색상 보유 중이라 세일하면서 화이트 블랙 재 구매했는데 만족합니다,"성분, 색상, 체형, 세일, 사이즈, 만족하다, 화이트, 보유"
면수라서 세탁해도 보풀 안 생겨요 그러나 자연 건조로 말렸는데도 조금 줄기는 해요 첫 세탁 시 옷은 검정 흰색 세트로 편하게 입기 좋아요,"세탁, 흰색, 수라, 건조, 검정, 편하다"
옷이 이 뻐서 좋지만 사이즈가 조금 큰 것 같아서 아쉬웠네요,"아쉽다, 사이즈"
면 소재는 좋습니다 다 만 사이즈가 꽤 크네요 평소 사이즈 입으시면 으로 충분할 거 같습니다 전 그냥 교환 귀찮아 박시하게 입을 려구요,"박다, 크다, 려구, 그냥, 사이즈, 평소"
블프 행사 기간이라 배송이 많이 느릴 줄 알았는데 배송도 괜찮고 좋은 가격에 좋은 제품 잘 받았습니다,"느리다, 배송, 가격, 기간, 제품, 받다, 많이"
면재질이고 기본티 입니다 그냥 막 입 기 좋고 가격도 착해서 좋아요 여름엔 거추장 한 거 싫어해서 주구장 창 기본 데일리 옷 즐겨 입을 거 같아 요 저번에 구매 했는데 실용적이라 또 구매 재구매 했어요,"재다, 가격, 주, 구장, 실용, 기본, 티, 재질, 이고, 착하다, 여름, 데일리"
믿고 사는 예일산 다음날 할인해서 뼈 아픈 거 말곤 최고,"할인, 믿다, 일산, 말다, 날, 살다, 최고, 아프다"
단정하게 입고 나가거나 편하게 입을 때 쓰면 좋아요 두께감이 조금 있는 편이다 저렴한 가격에 고급스러운 재질을 보여준 다 핏이 딱 떨어져 깔끔하다,"깔끔하다, 저렴하다, 고급스럽다, 편하다, 단정하다, 두께감, 재질"
저렴한 가격으로 산 옷처럼 보이지 않아 요 어깨까지 쭉 되어 있는 백넥테이핑으로 많이 세탁하면서 변형될 걱정은 안 해도 될 것 같아요 두께감은 조금 있는 편이라고 느꼈어요,"어깨, 처럼, 세탁, 백넥테이핑, 두께감, 느끼다, 편이, 라고, 걱정, 저렴하다"
별 기대 안 했는데 너무 예뻐요 일반 반팔 티보다는 약간 한 소재 같았어요 사이즈는 좀 작게 사는 게 좋을 것 같아 요 평소 사이즈 입어서 로 구매했는데 좀 커요,"사이즈, 작다, 크다"
사이즈는 생각했던 거 보다 컸어요 완전 얇은 소재는 아니고 반팔치고는 조금 두께감이 있었어요 여름에 휘뚤마뚤 입을 수 있는 기본티가 없어서 급 구매했는데 알바할 때나 운동 갈 때 나 잘 입고 다닐 거 같아 요 세일할 때 잘 구매한 거 같아 요 이 가격에 티 개는 아주 좋은 거 같습니다 그리고 배송도 하루 만에 바로 와서 아주 만족입니다,"배송, 가격, 세일, 소재, 얇다, 티"
좋은 가격에 기 본템 잘 받았습니다 깨끗하고 좋네요,"깨끗하다, 받다, 가격"
일단 생각보다 크고 그렇게 두껍지 않아서 좀 흘러내리는 느낌이에요 참고하 세용,"이에요, 그렇게, 참고, 흘러내리다, 크다, 두껍다, 세용"
걍 그래요 보 세티랑 다를 거 별로 없고 목이 조금 더 넓엇으면 예뻣을 거 같아요,"목, 넓엇으, 예뻣, 별로, 그렇다, 다르다, 없다, 세티"
항상 반팔 목 늘어나는 것 때문에 엄청 고민하고 시켰는데 너무 만족해요 빨래를 하고 건조기를 돌려도 크게 변형되지 않고 목도 안 쭈굴해지고 하고 해서 정말 좋아 욥 재구매 해야겠어요,"돌리다, 쭈굴, 건조기, 만족하다"
투펙이라 가격도 합리적이고 깔끔한 핏도 맘에 드네요,"합리, 이고, 핏, 투펙, 깔끔하다, 가격"
너무 얇지도 두껍지도 않습니다 배송 빠르고 가격도 맘에 드네요,"얇다, 두껍다, 빠르다, 배송, 가격"
덩치가 커서 할까 고민했는데 하면 살짝 큰 정도입니다 한 여름에도 가능할 듯 합니다,"여름, 커서, 가능하다, 고민, 덩, 치가"
딱 핏되게 맞아서 좋아요 기장도 크롭 아니라 좋아요,"핏되, 맞다, 아니다, 기장, 크롭"
면재질이고 기본티 입니다 그냥 막 입 기 좋고 가격도 착해서 좋아요 여름엔 거추장 한 거 싫어해서 주구장 창 기본 데일리 옷 즐겨 입을 거 같아 요,"착하다, 여름, 재질, 이고, 즐기다, 그냥, 싫어하다"
로고가 딱 적당하게 있어서 이 쁘고 사이즈도 크지 않고 딱 적당합니다 잘 산 것 같네 여,"적당하다, 크다, 사이즈, 로고"
예일티만 계속 입어 요 깔끔해요 이 뻐요 두말 않고 재구매 합니다,"깔끔하다, 일, 티, 말, 계속, 재다"
기본 티인데 하고 적당히 두께감도 있어서 모양 유지도 잘 되고 비침도 없어요 사이즈도 한 편입니다,"사이즈, 티, 인데, 모양, 두께감, 적당하다, 편입, 비침, 없다"
여자 신체 스펙 저랑 비슷하면 젤 작은 사이즈로 가는 게 젤 이 쁜 거 같은데요 루즈핏 말고 스탠다드 핏 좋아하면 추천입니닷,"좋아하다, 추천, 닷, 루즈, 핏, 사이즈, 스탠다드, 말고, 여자"
