Review,keyword
이번에 무신사 반팔 많이 샀는데 제일 재질이 좋은 것 같아 요 해서 세탁해도 많이 안 늘어남 제 기준 엉덩이 다 덮고 적당한 오버핏이어서 조아 요 대신 팔 부분이 제 팔꿈치 덮을 정도로 길어서 접어 입으먼 더 예쁜 편인 것 같아 요 세트로 팔아서 덕분에 반 팔 쟁엿어요 많이 파세요,"팔꿈치, 팔, 세탁, 부분, 엉덩이, 덮다, 접다"
아주 옷이 이 뻐요 사이즈도 괜찮고 옷감도 좋아요,"사이즈, 옷감"
비침 없고 좋습니다 단독으로 입기도 좋고 안에 이너티로 입어도 좋아요 만족합니다,"단독, 만족하다, 이너티, 없다"
마른 체형인데 그래도 살짝 오버 사이즈에 요 참고하 세용,"사이즈, 체형, 인데, 참고, 마르다, 오버, 세용"
전처적으로 만족 합니다 크기도 좋구 색감도 선명하고 배송도 매우 빨라서 너무 좋습니다,"배송, 크기, 색감, 라서, 만족, 전, 처"
원단도 괜찮고 할인해서 구매했는데 만족합니다,"할인, 만족하다, 원단"
사이즈도 꽤 해서 여성분들은 웬만 하면 사이즈 입는 게 좋을 거 같아 용 두께도 너무 드껍지 않고 딱 젛습니당,"사이즈, 여성, 분들, 드껍, 지, 두께"
기본 티 구입하고 싶어서 투팩이라 당장 구매했어요 일단 저는 키에 가슴 컵 뇨자인데 히 잘 맞습니 당 길이도 길고요 루즈해서 위에 남방 걸쳐 입으니 이 쁘더라고요 재질도 적당히 두꺼워서 오래 입을 것 같습니 당 몇 장 더 구입하고 싶어요,"하고, 길이, 뇨자, 인데, 오래, 재질, 가슴, 맞다"
사이즈가 딱 맞는 것 같아 요 흰색 티가 살 비치는 것도 없고 가성비 있게 팩으로 예일 티 사서 여름 잘 입을 것 같아 요,"팩, 예일, 사이즈, 비치다, 없다, 가성비"
천도 적당하고 여름 내 잘 입을 거 같아 요 세탁 후 변형만 없다면 최고가 될 듯해요,"없다, 적당하다, 변형, 최고, 천, 세탁, 여름"
두께도 얇지 않으면서 부드러워요 길이도 너무 길지 않아 키가 작은 사람에게도 잘 맞아요,"작다, 부드럽다, 길다, 두께, 길이, 맞다, 키, 사람, 에게도, 얇다"
역시 믿고 사는 예일이네요 좀 오버핏 한 느낌이 있어서 크긴 해서 원래 입던 사이즈보다 한 치수 낮춰서 사면 좋을 듯요,"낮추다, 크다, 예일, 원래, 사이즈, 오버핏, 믿다"
건조기를 돌렸더니 옷이 줄었네요 건조기 절대 돌리지 마세툐,"절대, 줄다, 건조기, 돌리다, 마세툐, 돌리지"
핏 색상 디자인 이 박자가 잘 어울려 너무 만족합니다,"만족하다, 색상, 어울리다, 박자, 디자인"
말할 것도 없이 정말 이쁩니다 그냥 기 본티로 입 기 무난합니다 재질도 좋고 사이즈도 괜찮고 만족합니다,"만족하다, 사이즈, 그냥, 재질"
기본으로 받쳐 입는 티셔츠로 괜찮음 여름부터 가을까지 신나게 입고 다녔는데 역시 몇 번 빨고 나니까 색감이 좀 빠지는 건 어쩔 수 없지만 가격 대비 이 정도면 년 입고 다니기에는 부족함이 없음 사이즈 정 사이즈,"티셔츠, 여름, 색감, 사이즈, 가을, 에는, 신나다"
옷 가성비 좋고 예뻐요 어떤 말이 더 필요할지 모르겠는데 암튼 무난하고 예쁨,"하고, 가성비, 암튼, 어떻다, 말, 모르다, 필요하다"
디자인이 상당히 이뻤 다 색감은 되게 선명했다 합리적인 가격이다,"색감, 가격, 디자인, 합리, 상당하다, 선명하다, 되게"
넘 큰티들만 많아서 핏한 티가 필요해서 구매했는데 면도 좋고 이너로 입기에 안성맞춤 입니다,"크다, 티, 필요하다, 많다, 이너, 핏, 안성맞춤"
전번에 블랙 화이트로 구입하고 너무 맘에 들어 추가로 구매했어요 원단이 해 너무 맘에 들 구요 두깨감 있는 원단이라 레이어드용으로 딱입니다 한 여름엔 더워 못 입구 간절기엔 단독으로 입어도 참 멋으러 운 티셔츠입니다,"티셔츠, 덥다, 여름, 하고, 블랙, 간절기, 깨감, 원단"
여기저기 코디해서 입기 좋아요 만능 티셔츠 입니다 면 재질도 아주 좋아요,"티셔츠, 코디, 재질, 여기저기, 만능"
옷의 품질이 너무 좋습니다 옷도 하구요 감사합니다,품질
적당히 색감 좋고 사이즈도 딱 맞습니다 특히 디자인이 맘에 듭니다 가 성비,"색감, 사이즈, 디자인, 맞다, 적당하다, 특히, 성비"
반팔티가 목이 해서 세탁해도 변형 없을 것 같은데 장점입니다 그리고 색감도 노란끼 없는 화이트라 좋네요,"세탁, 색감, 목, 장점, 팔, 티, 없다, 노랗다, 끼"
무난하게 입 기 좋은 거 같아 요 크지도 작지도 않고 적당해요,"적당하다, 작, 크다"
이너로 받쳐 입기 좋아요 옷도 한 원단 임 잘 입고 다닙니다,"이너, 받치다, 원단"
배송도 빨랐고 두장을 같이 사는 거라서 더 맘에 드네요 변형 없구 옷도 하고 좋았어요 많이 입을 것 같아요,"라서, 배송, 없다"
제가 원래는 패션에 관심이 없었는데 요즘 관심이 생겨서 기 본탬으로 입문하려고 이 상품을 샀습니다 사서 입어보니 너무 잘 어울리고 다른 와이드 청바지나 카고 팬츠랑도 잘 어울렸습니다 혼자 써도 되지만 후드티에 레이어드를 하면 좋을 것입니다,"팬츠, 청바지, 패션, 상품, 입어보다, 써다"
사이즈도 무난하고 이쁩니다 가격 대비 너무 좋아요 여러 벌 쟁여두려 구요,"사이즈, 하고, 여러, 쟁, 두다, 구요, 대비, 가격"
어디에나 받쳐 입 기 좋은 디자인의 반팔이어서 좋습니다 여름에 특히 잘 입을 수 있을 것 같아 요 목이 한 편이라 잘 늘어나지 않을 것 같아요,"목, 여름, 늘어나다, 디자인, 팔, 편이"
가성비 세미 오버핏 두팩에 너무 잘 입고 있습니다,"팩, 오버핏, 가성비, 세미"
예일 로고만 깔끔하게 적혀 있는 기 본 티라 휘뚜루 마 뚜루 입 기 너무 좋아요 제가 물건 아무리 좋아도 똑같은 거 안 사는 편인데 이 티는 작년 여름에 사고 올해 여름에도 재구매한 제품이랍니다 남자친구한테까지 선물해줬는데 잘 입고 다니더라구 요 기 본티 찾으신다면 추천드려요,"물건, 여름, 추천, 드리다, 로고, 재, 깔끔하다, 작년, 제품, 랍니, 찾다, 신다"
크게 입으려 삿는데 생각보다 너무 커요 반품비 땜시 걍입고 사이쥬 작은 걸로 주문하려니 품절 언제 입고되려나,"걍, 주문, 삿는데, 걸, 크다, 땜시, 반품, 비"
소매길이가 제일 아쉬워요 루즈도 스탠다드도 아닌 너낌,"아쉽다, 스탠다드, 소, 길이, 낌, 루즈, 아니다, 제일"
디자인도 예쁘고 핏도 조금 크긴 엄청 큰 건 아니라 괜찮음 근데 두꺼웁니 당 얇지 않아서 그거 생각하고 사시 길 좋아 영,"두꺼웁, 크다, 하고, 근데, 핏, 얇다, 아니다"
사이즈 딱 엉덩이 선 까지 옵니닷 팔이 많이 깁니 닷 그냥 질 좋은 반팔티 같슴닷,"같슴닷, 옵, 닷, 그냥, 엉덩이, 팔이, 팔, 티, 사이즈"
싸게 잘 샀어요 여름 다 지나가지만 이너로도 활용 가능할 꺼 같아 요 이쁩니다,"여름, 가능하다, 싸다, 활용, 지나가다"
기본 티 필요해서 구매했는데 사이즈 생각보다 해서 좋았고 색상도 흰 검으로 무난해서 좋았습니다,"색상, 검, 사이즈, 기본"
기본템으로 자주 입을 거 같습니다 심플 이즈 베스트,"심플, 베스트, 이즈"
세일할 떄 삿습니다 믿고 쟁여놓는 에 일 기본 티셔츠라 말할 것 없이 너무 만족합니다,"티셔츠, 만족하다, 삿습니, 믿다, 쟁, 놓다, 없이, 말, 세일, 기본"
저렴하게 잘 샀어요 휘뚤마뚤 잘 입을 게요 재질이 좋아요,"재질, 휘뚤마뚤, 저렴하다"
사이즈는 한 치수 작게 사도 은데 이 사이즈도 아요 디자인은 무난 쓰 근데 생각보다 살짝 두거워서 더울 수도,"사이즈, 디자인, 덥다, 작다, 거워, 근데, 은데"
옷 별 루 완 전 별 루 핵벼루 한 번 빨었던 니 못 다 늘어져 있고 한 번 입으면 바지에 옷 털들이 다 묻어 있고 팔 들면 진짜 겨드랑이 다 보이고 팔을 들 수가 없는 디자인입니다 레이어드 용도 안 됩니다 싼 값 하네요,"팔, 늘어지다, 바지, 털, 디자인, 묻다, 보이, 없다, 빨다"
소매는 큰데 기장이 짧아요 랑 중에 고민했는데 어느 정도 가리는 기장이 좋으시면 구매하세요 사진 속 얼룩은 카메라에 뭐가 묻은 거에요,"카메라, 사진, 소매, 묻다, 중, 뭐, 고민, 에요"
마음에 딱 들어 요 색깔도 괜찮고 사이즈도 괜찮고 착용 감도 편하고 무게도 가볍습니다 스타일링은 무난하게 다 어울리는 편입니다,"색깔, 가볍다, 사이즈, 스타, 일링, 무게, 편하다, 착용, 어울리다"
너무 만족했습니다 좀 커서 속상했지만 좀 작은 사이즈로 재구매 할 생각이 있습니다 고민 말고 사세요 진짜 이건 갓성비,"속상하다, 사이즈, 만족하다, 갓, 성비, 커서, 이건, 말고"
한여름 반팔 옷 치고는 생각보다 두꺼운 편 이었어요 그러나 그냥 집 앞에 간편하게 나갈 때나 급히 대충 입을 때는 정망정 말 좋은 옷 이에 요 예일 로고도 많이 크지도 작지도 않아서 딱 좋고 원단도 해서 속 비침이 크거나 하지도 않구 요 사이즈도 딱 적당했습니다,"크다, 사이즈, 작, 원단, 팔, 간편하다, 두껍다, 대충"
배송 빨라 요 아이 주려고 산거에 요 사이즈 잘 맞네요 잘 입겠습니다,"주, 려고, 맞다, 빠르다, 사이즈, 배송"
전체적으로 좋았어요 포장도 포장돼 어 있었어요 어떤 코디에도 괜찮은 거 같네요 번창하세요,"번창, 포장, 돼다, 전체, 코디, 어떻다"
진짜 맘에 들고 이 가격에 이 정도면 너무 이득이네요 또 구매할 예정입니다,"이득, 예정, 가격"
사이즈 생겼길래 구매해봤는데 저렴하게 잘 산거 같아 요 딱 깔끔한 기 본티라 편하게 입 기 좋아요,"편하다, 해봤다, 저렴하다, 생기다, 깔끔하다, 사이즈, 티"
여름에 입을 긴 셔츠가 필요 했는데 사이즈도 적당하고 핏도 좋고 시 원합니다스타일링 하기에도 좋아요,"셔츠, 원하다, 스타, 일링, 여름, 핏, 적당하다, 사이즈"
포장 합니다 배송 빠릅니다 가격 괜찮습니다,"빠르다, 배송, 포장, 가격"
변형 진짜 심하고 건조기 돌리지 마세요 진짜 다시는 못 입을 옷이 됩니다,"말다, 심하다, 건조기, 다시다, 돌리지, 변형"
좋아요 적당한 크기의 로고와 부드러운 원단이에요,"로고, 원단, 이에요, 크기, 부드럽다, 적당하다"
인데 하고 이 쁘고 이 뻐요 다음에 또 재구매 할 거 같은 그런 옷,"인데, 그렇다, 재다"
편하게 입고 있어요 하게 입고 있구요 면도 해요 약간 두깨감 있어요,"편하다, 깨감, 면도"
아들이 사달라고 해서 사 줬습니다 만족하고 입고 다니네 요핏도 이 쁘긴 한데 여름옷치곤 약간 두꺼운 느낌이랄까요,"여름, 치다, 아들, 만족하다, 쁘긴, 랄, 끄다, 사, 달라, 주다"
할인행사해서 샀는데 사이즈도 적당하고 이 뻐요,"할인, 행사, 적당하다, 사이즈"
예일 반팔 으로 받았는데 색감이나 원단 등 굉장히 좋은 것 같습니다 가격도 저렴하고 기본티로 추천 합니다 배송도 굉장히 빠르고 좋은 것 같아요,"저렴하다, 가격, 배송, 색감, 이나, 추천, 빠르다, 티, 받다"
딱 생각했던 핏 그대로 나오고 정 사이즈 가시면 될 것 같아요,"가시, 나오다, 그대로, 사이즈"
큐티 해용 남친이랑 커플 커플로 맞췃거 등 요 이면 조금 클 고에 용 다들 커플티로 마추세,"커플, 남친, 커플티, 맞췃거, 이면, 마, 추세"
일단 옷은 좋다 색감도 밝고 검은색 하 양색 그리고 사이즈도 내가 원하던 사이즈 다 디자인도 예쁘다,"색감, 디자인, 사이즈, 검은색, 양, 색, 밝다, 원하다"
면이 일반 티 보다 두꺼워서 한 여름엔 입지 마세융 옷 변형도 잘 안 되서 좋구 염 남찡구랑 커플로 맞췃는데 조아용,"두껍다, 커플, 맞췃는데, 남, 찡, 구, 입지, 여름"
색깔이 사진보다 실물이 훨씬 선명합니다 두께도 얇지는 않아서 비치 지도 않아 요 가격도 할인할 때 사서 가성비도 좋았어요,"색깔, 할인, 사진, 가격, 두께, 선명하다, 가성비, 얇다"
기본템으로 갖기 좋은 흰색 옷과 검은 옷 여기서 사세요 가 성비 좋아연,"아연, 갖다, 검다, 흰색, 성비"
원단도 하고 편하게 입을 수 있어서 정말 강 추하는 티셔츠입니다 재구매할 정도로 만족도가 높습니다,"티셔츠, 편하다, 재다, 만족도, 높다, 원단, 추하다"
오버핏으로 편하게 입을 수 있어서 좋아요 그런데 주변에 이 옷 산 사람이 너무 많아서 좀 민망해요,"편하다, 많다, 민망하다, 오버핏, 주변, 사람"
색깔도 이 쁘고 배송도 빠르고 사이즈도 적딩해요,"적딩해, 배송, 사이즈, 빠르다, 색깔"
이 뻐용 근데 세탁하고 건조기 돌리면 목 쪽이 쪼그라듬 근데 핏이 어 정쩡 해서 저는 별로 에 여 근데 가성비는 좋음 배송도 생각보다 빨리 와서 좋았어요,"세탁, 하고, 건조기, 정쩡, 돌리다, 배송, 근데"
조금 한 편인데도 핏이 좋고 디자인 깔끔하고 무난해서 어느 때나 입어도 좋아 요색감도 선명하고 배송도 빠르고 세탁 후 변형도 없어서 추천해요무엇보다 가격이 저렴하지만 원단이 좋아요,"저렴하다, 세탁, 깔끔하다, 가격, 배송, 추천, 디자인, 빠르다"
몇 번 세탁해도 합니다 흰색 검은색 둘 다 잘 입고 다녀요,"세탁, 검은색, 흰색"
여름에 입기엔 살짝 더 운감이 있는데 오버사이즈로 입을 때 팔 소매 두 번 접고 입으면 정말 귀욤귀욤해요,"귀욤귀욤해, 오버, 사이즈, 여름, 운감"
너무 편안하고 색도 좋고 사이즈도 좋습니다 구매를 고민하신다면 무조건 구매하라고 추천할 것입니다,"추천, 사이즈, 색도, 편안하다, 라고, 고민"
그냥 딱 기 본티로 깔끔하니 편하게 손 믾이 가는 옷인 거깉아요 심플이즈 더 베스트 이 말이 딱 어울리는 옷인 거 같아요,"깔끔하다, 편하다, 그냥, 거깉아, 베스트, 어울리다, 말, 티"
일단 두께는 두꺼운 거 같구 이니 가성비는 좋은 거 같아 요 그리고 크게 나왔으니 한 사이즈 적게 사시면 좋을 거 같네용,"사시, 적다, 두께, 가성비, 나오다"
색도 사이즈도 다 좋은데 입을 때 머리 넣는 부분이 왜 케작아 여 내 머리가 큰 건가 머리 넣기 힘들어 여 화장하고 입으면 난리 날 듯 겨드랑이 부분에 실밥이 뜯어져 있더라구 여 한 번 빨구 확인해서 걍입을 게여,"머리, 뜯다, 걍, 사이즈, 색도, 부분, 화장, 하고, 힘들다"
제가 원하 눈 것보다 기장이 조금 짧게 느껴 저서 다시 사면 을 사고 싶네요 그래도 이 쁘고 무난하게 입기 좋습니다 아 그리고 조금 두께감이 잇어서 흰색 티도 거의 안 비쳐요,"두께감, 사면, 짧다, 잇다"
두께가 꽤 있어 여름에 입기는 더울 것 같습니다 저렴한 가격에 잘 구매했습니다,"여름, 저렴하다, 덥다, 가격, 두께"
그냥 아무 바지랑 입어도 잘 어울리고 목도 한 게 딱 제가 원했던 스타일입니다,"스타일, 바지, 그냥, 원하다, 어울리다, 목도"
색은 완전 검은색 그 자체 구요 살까 살까 고민하다가 샀는데 좀 크네요 팔 길이는 적당한 데 밑 기장이 좀 많이 길었어요 그래도 깔끔하고 이 뿌여,"검은색, 색, 길다, 크다, 길이, 깔끔하다, 기장, 고민, 자체"
믿고 입는 예일 디자인도 심플하고 배송도 빨랐습니다 원단도 좋고 여러모로 만족합니다,"디자인, 만족하다, 배송, 심플, 하고, 빠르다, 여러, 모로, 믿다, 예일, 원단"
옷이 생각보다 두툼해요 저는 얇은 여름 옷이라고 생각하고 구매했는데 살짝 덥긴 했어요 봄 가을에 입어도 좋을 것 같아 요 색감은 화면이랑 똑같고 디자인은 깔끔하고 사이즈는 딱 적당했어요 장에 이 가격이면 브랜드 옷 치곤 꽤 합리적이지 않나 무지 티라서 스타일링은 무난하게 가능합니다 배송은 금요일에 시켜서 화요일에 왔어요,"여름, 색감, 가을, 브랜드, 덥다, 깔끔하다, 디자인, 가격, 이면, 이라고, 얇다"
너무 편하고 로고도 작으면서 심플해서 진짜 마음에 들어서 몇 벌 더 사려고 합니다 여름에 가볍게 입고 다니기 좋아요,"여름, 작다, 사려, 가볍다, 편하다, 심플, 로고"
무난무난하게 입 기 좋은 티고 아무 바지나 매칭해도 잘 어울려 요 구겨짐이 좀 있지만 아주 좋습니다 다음에도 사고 싶네요,"바지, 싶다, 구기다, 짐, 매칭, 어울리다"
아주 한 재질이고 더운 여름 날에도 달라붙지 않게 펑 퍼짐하게 입을 수 있어서 좋아요 세탁해도 줄어 듦이 없고 잘 입고 다닙니다,"세탁, 덥다, 여름, 재질, 이고, 날, 줄다"
디자인도 무난하고 이여서 가성비도 좋습니다 잘 산 거 같아요,"여서, 가성비, 하고, 디자인"
세일할 때 사 서 기존 가격보다 싸게 살 수 있어 좋았습니다 예일티 처음 사보는데 재질도 좋고 정말 괜찮네요,"싸다, 세일, 사보다, 가격, 처음"
무난하게 예쁘고 깔끔합니다 로고가 작게 박혀 있어 아무옷에 나 괜찮을 듯 합니당,"깔끔하다, 작다, 로고, 박히다"
소재 라인 두꺼운 정도 가격까지 만족스러운 최애 면티예요 한 달 여 입으며 세태 십 수 번 했는데도 늘어 딤이나 색 바램 없어요 강아지 털 묻은 사진이라 지저분해졌는데 옷은 아주 만족스럽습니다 가을 이너로도 강추해요 사이즈 예쁘게 맞네요,"강아지, 사진, 사이즈, 두껍다, 만족스럽다, 강추, 라인"
두께감 살짝 있도 핏음 예쁩니다 두 장이라 여름에 좋네요,"여름, 핏음, 두께감"
아주 프리하게 입 기 좋은 것 같습니다 옷도 가볍 구요,"프리, 구요, 가볍다"
평소에 그냥 입으려고 샀어요 디자인이랑 길이 감 딱 원하던 대로여서 마음에 들고 가격도 넘 착해여,"디자인, 착하다, 대로, 여서, 평소, 원하다, 그냥"
진짜 예쁘고 무난한데 검은색은 세탄을 한 번 정도 하면 히 물이 빠지는 걸 볼 수 있어요 그래도 핏도 마음에 들고 심플한 게 나름 만족합니다,"검은색, 만족하다, 심플, 핏, 물이"
하고 기본 티라 손이 자주 가요 잘 입고 있습니다,"가요, 손, 기본, 티"
가성비 생각하며 딸아이가 예일 브랜드 골라 주문했는데 벌 가격이었다 해도 만족했을 것 같네요 소재가 하고 각 잡혀서 여러 번 빨래해도 변형 없고 적당히 두툼해 고급스럽습니다 역시 에 일,"소재, 빨래, 브랜드, 고급스럽다, 딸아이, 가격, 주문, 만족하다, 적당하다, 여러"
기본템으로 입기에 좋아요 마감도 깔끔하고 색감도 잘 빠졌어요,"깔끔하다, 빠지다, 마감, 색감"
좋아요 원단도 하고 적당히 두께 있습니다,"두께, 적당하다, 원단"
개인적인 리뷰입니다 정말 제가 샀던 반팔 중 베스트 템으로 뽑히고 있어요 먼저 면 재질이 너무 만족스럽습니다 약간 두꺼운 느낌이 있어 월까지 코디해서 입으려고 요 다만 건조기 돌리실 분은 저도 돌리니까 작아져서 한 사이즈 크게 구매하시는 거 추천 드려 요 아무튼 무신사에서 너무 잘 산 거 같고 나중에 한 사이즈 크게 재구매 계획입니다 너무 만족합니다,"추천, 리뷰, 건조기, 사이즈, 작아지다, 재다, 팔, 만족하다"
너무 예뻐요 데일리하게 잘 입고 있습니다 다 만 건조기 돌리실 분은 한 사이즈 크게 구매 추천 드립니다 너무 상품은 맘에 들어 여,"드리다, 데일리, 돌리다, 상품, 분, 건조기"
정 사이즈 옷이라 길이 감도 적당하고 입었을 때 불편하거나 끼는 곳 없이 편해서 좋아요,"편하다, 불편하다, 사이즈, 적당하다, 끼다, 없이, 감다"
배송은 빠르고 하게 잘 도착했으나 옷이 두께감이 생각보단 두껍 워서 요즘 날씨에는 좀 입기가,"배송, 두껍다, 도착, 날씨, 에는, 빠르다, 두께감"
여름에 입 기 좋은 흰티 입니다 기장이 조금 길어요 재질은 부드럽습니다,"부드럽다, 여름, 희다, 티, 재질, 기장"
사이즈가 크게 나온 건 아니고 정 사이즈 느낌으로 나왔어요,"사이즈, 나오다, 아니다, 크게"
기본 티셔츠로 입 기 딱입니다 핏도 적당히 루즈해서 너무 좋아요,"티셔츠, 루즈, 핏, 딱이다, 적당하다, 기본"
배송도 빠르고 가격 대비 착장감이나 편하고 좋습니다 재구매 의사 있습니다,"착, 이나, 편하다, 배송, 빠르다, 대비, 의사, 재다, 가격"
여름에 편하게 입으려고 샀어요 근데 생각보다 두꺼워서 한 여름에는 못 입을 듯 하게 하니까 적당해요,"여름, 두껍다, 에는, 편하다, 적당하다, 근데"
생각보다 밝아서 살짝 비칠랑 말랑해서 조금 아쉽고 생각보다 좀 크네요,"말랑하다, 비치다, 밝다, 크다, 아쉽다"
사이즈도 오버핏으로 딱 좋고 아무데나 잘 어울 랴요,"오버핏, 랴, 어울, 사이즈"
무난하고 깔끔해요 원단도 한 느낌이고 가성비 좋은 아이템이네요,"깔끔하다, 아이템, 하고, 이고, 원단, 가성비"
기본 아이템을 저렴한 가격에 구입해서 만족합니다 디자인 핏 모두 좋아요 시원하고 편안해서 자주 손이 가네요,"아이템, 편안하다, 만족하다, 저렴하다, 손, 가다, 가격, 시원하다"
배송 빠르고 옷 재질도 너무 좋아요 사이즈도 해서 편하게 입을 수 있어요,"편하다, 사이즈, 재질, 빠르다, 배송"
사이즈도 딱 맞고 심플해서 어떤 옷이랑 입어도 잘 어 울릴 것 같아요,"심플, 맞다, 울리다, 어떻다, 사이즈"
착용감 좋고 예일 꽤 괜찮은 브랜드네요 담해도 입겟습니다,"브랜드, 예일, 담하다, 착용"
옷 너무너무 맘에 들고 싸게 잘 산 거 같아 기 분 좋네요,싸다
배송 빨라서 빨리 받아서 좋고 입었을 때 편하고 이 뻐서 좋아요,"받다, 편하다, 라서, 빨리, 배송"
반팔티 없어서 샀는데 저렴하고 이 뻐서 너무 좋아요,"저렴하다, 없다, 팔, 티"
무난하고 딱 예일스러운 제품입니다 무지티 필요하면 굳,"제품, 하고, 필요하다, 예일, 스러운, 무지, 티"
색이 밝고 사이즈가 딱이며 올 여름 무난하게 입고 다닐 거 같아용,"밝다, 딱이다, 사이즈, 색, 여름"
가성비 갑 가 입으면 그냥 딱 오버핏 티셔츠에용,"티셔츠, 오버핏, 그냥, 가성비"
아주 좋은 상품 감사합니다 데일리로 아주 좋아요 잘 입겠습니다,"데일리, 상품"
가성비 좋고 깔끔하게 잘 입겠슴니다 추천해요 벌에 이 가격이라니,"추천, 가격, 이라니, 깔끔하다, 입겠슴니, 가성비, 벌"
동네 마실 가거나 편하게 오버핏 으류 입으려고 주문했어요 크고 편해서 운동할 때 입어도 괜찮습니다 흰색은 흰색 치고 많이 비치는 편은 아니며 두께는 살짝 두꺼워요 나름 만족,"흰색, 운동, 편하다, 두께, 편"
로고도 크기가 적당해서 무난무난하게 언제든 입을 수 있는 옷이예요 입을 게 없을 때 트레이닝 바지랑 입거나 청바지에 입으면 이 뻐요,"예요, 바지, 청바지, 적당하다, 로고"
비침은 좀 있는 편이 구 주름 되게 잘 잡히는 편 구래도 이 쁘고 편하게 입 기 좋아서 잘 입구 있어요 너무 좋고,"편하다, 구래, 되게, 편이, 비침, 잡히다"
사이즈 잘 맞고 세탁 후에도 변형이 없어서 오래 입을 수 있을 듯 합니다,"세탁, 변형, 맞다, 없다, 사이즈, 오래, 후"
목은 진쩌 안 늘어나 눈 데 주름이 너무 잘 잡힙니다 진짜 그래도 편하게 휘뚜루 마 뚜루 잘 입고 더니 고 있어요 팩이라 너무 조코,"목, 편하다, 주름, 더니, 늘어나다, 팩, 잡히다"
배송 빠르고 좋아요 사이즈는 좀 큽니다 오버핏으로 생각하면 될 듯 해요,"오버핏, 빠르다, 사이즈, 크다, 배송"
타 브랜드 랑 같은 재질인 줄 알았는데 아니였네요,"알다, 아니다, 재질, 브랜드"
처음 착용했을 때는 저한테 정 사이즈로 맞았는데 세탁 후에 줄어서 여자친구 줬습니다 아쉽네요,"사이즈, 착용, 아쉽다, 맞다, 줄다, 주다, 여자친구, 처음, 후"
시원하고 정 사이즈네요 오버핏 하게 살 껄 그랬나 싶기도 하고 얇아서 흰색은 비치다 보니 패치 붙이고 입고 있습니다,"흰색, 얇다, 사이즈, 붙이, 비치, 그렇다, 싶다, 오버핏"
조금은 마른 중 딸 아이 오버핏 입고 십다고 해서 로 구매 사이즈 하네 여 흰색 검정 두루두루 잘 입을 듯합니다 맘에 들어해서 다행,"십다, 오버핏"
