Review,keyword
러닝용으로 구매했어요 너무 편하구요 땀도 잘 마르는 것 같아요,"러닝, 마르다, 편하다"
헬스장 운동복으로 샀는데 만족합니다 빠르게 마르는 옷이라 세탁도 편이 하네요,"편이, 헬스장, 마르다, 빠르다, 세탁, 운동복, 만족하다"
헬스장 갈 때 항상 옷까지 신청했는데 운동할 때 너무 입 기 편하네요 가격도 부담 없어서 별 생각 안 하고 샀는데 만족합니다,"신청, 부담, 헬스장, 갈다, 만족하다, 가격, 편하다, 운동"
가격 대비 원단이나 기능 면에서 메리트가 큰 옷인 것 같아요,"메리트, 원단, 크다, 대비, 기능, 가격"
운동할 때 입으려고 구매했데 너무 편하고 막입고 다니기 좋아서 긴 거까지 하면 총 개네요,"편하다, 운동"
좀 작아서 제 체형이 신 분들은 이나 사이즈 선택하세요 그리고 색감도 좋고 가성비가 너무 좋습니다,"선택, 색감, 체형, 작다, 가성비, 사이즈"
역시 인기 많은 이유가 있네요 너무 마음에 듭니다,"인기, 이유, 많다"
헬스장 반팔티 소재입니다 편하구 조아 요 완전 만족,"조아, 만족, 헬스장, 소재, 편하다"
얇고 기장도 적당해서 운동할 때 휘뚜루마 뚜루 입을 수 있을 것 같아 좋아요,"기장, 뚜루, 휘뚜루, 적당하다, 얇다, 운동"
별 기대 안 하고 샀는데 아무리 세탁해도 목도 안 늘어나고 좋아요,"아무리, 기대, 목도, 늘어나다, 세탁"
감사합니다 사이즈가 정말 잘 맞습니다 잘 쓸 게 여,"쓸다, 맞다, 사이즈"
배송도 빠르고 가격 대비 만족합니다 옷 안에 레이드 해서 입기 좋아요,"레이드, 대비, 빠르다, 배송, 만족하다, 가격"
사이즈 아주 딱이 고 세일할 때 이쁜 상품 저렴하게 구해서 기부니가 좋아요,"기부, 구해, 세일, 상품, 딱이다, 저렴하다, 사이즈"
생각보다 두툼하긴 한데 시원한 소재로 만들어진 것 같네 여 비침은 좀 있어서 단독으로 입긴 힘들 것 같습니다,"힘들다, 만들어지다, 두툼, 단독, 비침, 소재, 시원하다"
배송 빨리 왔고 사이즈 적당합니다 제품 만족스럽습니다,"만족스럽다, 오다, 빨리, 제품, 적당하다, 배송, 사이즈"
운동 갈 때 매일매일 입고 간단한 러닝할 때 많이 입어요,"간단하다, 러닝, 갈다, 운동"
정 사이즈로 딱 입기 좋네요 편하고 좋아요 자주 입을 듯,"사이즈, 편하다"
운동할 때 입 기 너무 좋네요 땀 흡수도 잘 되고 빠르게 말라서 좋습니다,"라서, 빠르다, 흡수, 운동"
운동복이 더 있으면 좋겠어서 구입해 봤는데 이 쁘고 좋아요,운동복
사이즈도 잘 맞고 통풍도 잘 되고 너무 편해서 자주 입어요,"통풍, 맞다, 사이즈, 편하다"
운동할 때 입으려고 구매했는데 통이 커서 운동할 때 편해 요,"커서, 운동, 편하다"
운동용으로 여러 벌 구매 했습니다 싸고 편하고 가성비 최고입니다,"여러, 최고, 싸다, 가성비, 편하다, 운동"
운동 할 때 입으려고 샀는데 편하고 좋아요 활동 시 불편하지도 않구요,"활동, 불편하다, 편하다, 운동"
편하게 입기에 좋습니다 추천합니다 담에도 살게요,"살다, 추천, 편하다"
여름에 운동할 때 입으려고 샀어요 완전 시원한 재질이 네용,"여름, 재질, 시원하다, 운동"
운동복으로 입으려고 구매했는데 만족스러워요,"만족스럽다, 운동복"
안에 받혀 입을 때 괜찮을 꺼 같고 여름 때 따로 입는 것도 이쁠 거 같아 요,"받다, 끄다, 여름"
시원할 꺼 같고 음 생각보다 이 뻐서 놀랬어요 진짜 강추,"놀래다, 강추, 끄다, 시원하다"
음 일단 재질은 잘 안 꾸겨질 꺼 같고 생가보다 이 뻐요,"꾸기다, 생가, 끄다, 재질"
너무 너무 예쁘고 편해서 맨날 입고 있습니다 좋아요,"맨날, 편하다"
운동하려고 삼 사이즈는 적당합니다 잘 입고 다닐,"적당하다, 사이즈, 운동"
헬스할 때 입으려고 구매했습니다 편하고 좋아요,"헬스할, 편하다"
배송 빠르고 좋은 제품을 저렴하게 구매했습니다 감사합니다,"제품, 빠르다, 저렴하다, 배송"
에어쿨링이라고 해서 기대 기대가 크니 실망도 크네요 좋은 품질 티 세일하는 줄 욕심이 과했네요 천 재질 엉망 여름에 입어면 더울듯 겨울에 입어야 시원할 듯 두 번 다시 구매하지 않을 듯,"기대, 크다, 욕심, 엉망, 실망, 겨울, 세일, 이라고, 에어, 쿨링"
잠옷 위에 입어봤는데 생각한 재질이 고 생각보다 안 커요 그래서 운동할 때 적당할 것 같아요,"잠옷, 입어보다, 크다, 적당하다, 재질, 운동"
몇 번 빨았더니 목 늘어남 싼 값에 사서 나쁘지 않음,"빨다, 사서, 나쁘다, 늘어나다, 싸다"
운동할 때 입 기 좋습니다 가성비가 매우 좋습니다,"가성비, 운동"
바람 잘 통하고 빨리 말라서 운동할 때 입 기 좋아요,"바람, 빨리, 라서, 운동"
작은아들 안에 다 받쳐 입을 블랙티 보다가 눈에 들어와 구매요,"작은아들, 블랙, 들어오다, 받치다"
가성비도 좋아서 집에서 그냥 돌아다닐 때 입고 다니고 집 앞에 편의점 갈 때도 자주 입습니다,"돌아다니다, 편의점, 갈다, 가성비"
가격 대비 상당히 좋습니다 오래 입을 수 있을 것 같아요,"상당하다, 오래, 대비, 가격"
좀 두깝고 속 감 좀 끄칠합니다 싼 마이로 입기에 좋아요,"칠하다, 마이, 끄다, 싸다"
괜찮네요 운동할 때 가볍게 입고 있어요 잘 입겠습니다,"가볍다, 운동"
사이즈도 적당하도 재질이 부드러워서 강추합니다,"강추, 부드럽다, 적당하다, 재질, 사이즈"
운동할 때 입는데 너무 좋아서 재구매합니 당 빨래도 쉽고 땀 흘려도 편해서 좋아요,"쉬다, 빨래, 흘리다, 재다, 편하다, 운동"
살짝 두꺼운 곳 같기도 한데 그래도 가성비는 좋은 것 같아요,"두껍다, 가성비"
생각보다 살짝 까슬하기는 한데 사이즈는 무리 없이 잘 맞습니다 재질상 어느 정도 이해하는 게 맞겠죠,"맞다, 이해, 까슬하다, 무리, 재질, 사이즈"
가성비 너무 좋습니다 운동하거나 간단히 나갈 때 입기 딱이에요,"간단하다, 거나, 딱이다, 가성비, 운동"
기대했던 것 만큼 예뻐서 만족스러워요 정말 예뻐요,"기대하다, 만족스럽다"
운동용으로 딱 찾던 반팔티예요 세팩이라 가성비도 최고,"찾다, 최고, 가성비, 운동"
헬스할 때 짱입니다 재구매 의 향 입니다 핳,"헬스할, 재다"
운동할 때도 입고 편한 옷입니다 음 운동할 때 입으면 좋아 보여요,"보이다, 운동, 편하다"
흰 셔츠 안에 입었는데 깔끔하게 잡아줘서 좋았어요 셔츠 위로 나온 라인이 굿,"셔츠, 잡다, 위로, 라인, 희다, 나오다, 깔끔하다"
핏 이 쁘고 색도 좋고 이 거 완전히 여름에 입는 교복임,"완전하다, 교복, 색도, 여름"
막 입기 좋아요 운동 갈 때 입고 나가기 좋아요,"갈다, 운동"
마음에 들어 요 편하게 입 기 좋아요 운동 할 때 입기도 좋아요,"편하다, 운동"
장더 추가 구매했습니다가 성비 여름용 티로 아주 좋습니다,"장더, 성비, 추가, 가다, 여름"
사진은 제가 입은 건 아니지만 제가 입은 기준으로 은 머슬핏 느낌이고 가 딱 적당한 여유 있는 핏 같습니다 이 가격에 벌이면 그냥 사보세요 얼룩 묻어도 타격 감 하나 없습니다,"타격, 머슬핏, 묻다, 얼룩, 여유, 기준, 사보다, 벌이, 사진, 하나"
사진은 제가 입은 건 아니지만 제가 입은 기준으로 은 머슬핏 느낌이고 가 딱 적당한 여유 있는 핏 같습니다 이 가격에 벌이면 그냥 사보세요 얼룩 묻어도 타격 감 하나 없습니다,"타격, 머슬핏, 묻다, 얼룩, 여유, 기준, 사보다, 벌이, 사진, 하나"
기가막힙니다 좋은 가격에 잘 산 거 같습니다 재구매 의사 있어요,"막히다, 의사, 재다, 가격"
세장에 이 정도 가격이면 가성비 괜찮은 거 같아 요 시원하고 좋습니다,"이면, 가성비, 가격, 시원하다"
신축성이 좋고 가볍게 입 기 좋은 제품입니다 저렴한 가격에 구매해서 좋습니다,"신축, 가볍다, 제품, 저렴하다, 가격"
운동할 때 입으려고 샀는데 해서 일상복으로도 괜찮을 듯해요,"상복, 으로도, 운동"
운동할 때 입기 위해 샀지만 핏이 은 근 괜찮아요 데일리로도 입을 수 있는 제품입니다,"위해, 데일리, 제품, 운동"
조금 더 사이즈가 크게 나왔으면 좋겠네요 그 점만 빼면 잘 입고 있습니다,"빼다, 크게, 나오다, 사이즈"
운동할 때 자주 입는데 편하고 좋습니다 재구매 예정,"예정, 재다, 편하다, 운동"
잘 마르고 한 소재라 운동할 때 입기 좋아서 재구매 했어요 런닝용으로 사이즈 하게 주문 했는데 딱 좋아요 어깨가 넓고 팔다리가 긴 편이니 착용 핏 보실 때 참고하세요,"넓다, 팔다리, 런닝용, 어깨, 참고, 착용, 편이, 주문, 재다, 마르고"
가성비 최고 해서 어디 뜯기지만 않으면 오래 입을 듯요,"뜯다, 오래, 최고, 가성비"
작업할 때 좋아요 평고 사이즈 입는데 잘 맞는 거 같아요,"작업, 맞다, 사이즈"
가격 대비 적당합니다 재질은 조금 좋아 보이지는 않네요,"지는, 보이, 대비, 적당하다, 재질, 가격"
여름에 입고 잠옷으로 입기에는 이 거만한 옷이 없습니다,"거만하다, 잠옷, 여름"
너무 편하고 너무 좋아요 여름에 잠 옷으로 입을 려고 샀어요,"여름, 편하다"
이너로 샀는데 편의점 가다가 입어 봐요 재질이 면이 아니라 땀 흡수가 좋고 통풍이 좋아요,"가다가, 편의점, 통풍, 이너, 아니다, 흡수, 재질"
생각보다 부드럽지 않고 까슬하네요 얇진 않아서 단품으로 입을 수 있을 거 같아요,"까슬하다, 부드럽다, 얇다"
얇아서 운동할 때 입으면 시원할 거 같아 요 땀도 잘 마를 듯해서 좋아요,"마르다, 얇다, 시원하다, 운동"
흰색은 속살이 비쳐서 따로 입기엔 무리가 있네요,"무리, 살이, 흰색, 비치다"
보시는 바와 같습니다 두께가 좀 있어서 젖꼭지 걱정은 넣어 두세여,"보시, 넣다, 두다, 젖꼭지, 걱정, 두께"
사진에 나와 있는 대로 실물도 똑같아서 아주 만족합니다,"대로, 똑같다, 실물, 사진, 나오다, 만족하다"
저렴하게 잘 샀어요 약간 두께감이 있지만 비치지 않아서 좋습니다 체격이 좋아 보여요,"체격, 비치, 두께감, 보이다, 저렴하다"
운동할 때 입으려고 구매했는데 땀 자국 티 안 나 고 좋습니다,"자국, 운동"
헬스장 다닐 때 입어볼까 해서 샀어요 입어보니 꽤 하고 해서 편하게 입을 수 있겠어요 재질도 도톰한 편 이네요,"입어보다, 도톰하다, 헬스장, 재질, 편하다"
웅동복으로 할려고 샀는데 확실히 시원하고 강 추 입니다,"웅동복, 확실하다, 시원하다"
가격 디자인 사이즈 재질 모두 다 마음에 들고 좋네요,"디자인, 재질, 사이즈, 가격"
에어쿨링 드라이 기능성 무지 반팔티 잘 받았습니다 기능성 쵝오 입니다,"기능, 쵝오, 드라이, 에어, 쿨링, 받다"
잠옷으로 입으려고 또 샀어요 진짜 운동할 때도 좋을 것 같고 가성비갑 입니다,"잠옷, 가성비, 운동"
상품이 바람도 잘 통하고 정말 시원한 거 같아 요 사이즈도 해서 잘 때 입기도 좋아요 근데 이 거 한 장만 입고 다니기에는 젖꼭지 부분이 엄청 보여서 참고하시면 좋을 거 같아요,"장만, 젖꼭지, 바람, 부분, 참고, 상품, 사이즈, 시원하다"
헬스할 때 입는데 너무 좋네요 시원한지는 잘 모르겠어요,"헬스할, 모르다, 시원하다"
운동할 때 잘 입고 있습니다 좀 까끌거리지만 가격 대비 좋아요,"거리, 끄다, 대비, 가격, 운동"
사진에서는 검정을 입었고 그냥 정핏입니다 괜찮아요,"정핏입니, 검정, 사진"
가격은 아주 싸고 좋으나 여름에 입기에 너무 더울듯,"덥다, 싸다, 여름, 가격"
운동하려고 샀는데 가성비 좋은 것 같아 요 많이 파세요,"파다, 가성비, 운동"
살짝 두께감이 있는 운동복에 흔히 쓰이는 소재 같은 느낌이고 나쁘지 않네요,"쓰이다, 흔하다, 나쁘다, 두께감, 운동복, 소재"
운동용으로 샀는데 가격도 싸고 막입기 좋아요 재질은 조금 까슬까슬해서 피부 약하신 분은 참고하세요,"약하다, 피부, 까슬까슬, 참고, 싸다, 재질, 가격, 운동"
운동할 때 입을 려고 샀는데 너무 편하고 좋네요 재구매 의사 있습 미다,"밉다, 의사, 재다, 편하다, 운동"
옷이 가볍고 핏이 좋습니다 운동 할 때 뿐만 아니라 평상 시에도 입기 좋아여,"평상, 가볍다, 아니다, 운동"
가격 대비 너무 좋고 딱 헬스장에서 입을 만한 옷 굉장히 만족함,"굉장하다, 헬스장, 대비, 만족하다, 가격"
몸에 착용감이 살짝 까끌 하나 가볍고 시원해서 좋네요 드라이한 상태가 상쾌합니다,"상쾌하다, 상태, 드라이, 착용, 하나, 끄다, 가볍다, 시원하다"
얇고 통풍도 잘 돼서 여름에 입 기 좋습니다 땀 난 상태에 러 바람 불면 에어컨이 따로 없어요,"불면, 에어컨, 상태, 바람, 돼다, 통풍, 얇다, 여름"
시원한 재질이라 운동할 때 입 기 좋겠네요 좋은 가격에 잘 구매했습니다,"재질, 가격, 시원하다, 운동"
쿨 소재 옷감 치고는 생각보다 두꺼운 거 같아 요 가격 대비 괜찮습니다,"치고는, 옷감, 대비, 두껍다, 소재, 가격"
하게 입기 좋아요 편하고 사이즈 고민 많이 했는데 원하던 느낌이에요,"고민, 원하다, 사이즈, 편하다"
배송도 아주 빠르고 운동할 때 입기 아주 좋습니다,"빠르다, 배송, 운동"
약간 두껍고 함 개에 이 가격이면 싸게 잘 입을 듯,"이면, 두껍다, 싸다, 가격"
고민 고민하다가 레이어드용으로 구입했어요 확실히 한 느낌이라 이 너나 레이어드용으로는 좋은데 비치는 게 있어서 이거 하나만 입기에는 저는 용도가 이너라 만족합니다,"고민, 레이어드, 으로는, 용도, 하나, 확실하다, 비치다, 이너, 만족하다"
약간 두꺼워서 운동할 따 좀 더 더운 느낌입니다 얇은 거 찾으시면 비추지만 야외 운동이나 두꺼운 거 찾으시면 추천입니다,"찾다, 두껍다, 야외, 비추다, 따다, 덥다, 추천, 운동, 얇다"
오늘 배송 왔는데 편하고 좋습니다 신축성도 좋고 편하네요 가격 대비 정말 좋은 거 같아요,"오늘, 성도, 편하다, 신축, 오다, 대비, 배송, 가격"
저렴한 가격에 샀네요 잘 입을 것 같아 요 근데 조금 더 사이즈가 컷으면 좋았을 것 같네요,"컷으, 저렴하다, 사이즈, 가격"
가성비 짱 좋아요 운동할 때마다 입고 있습니다 입기 편해요,"마다, 가성비, 편하다, 운동"
으로 사려다 한 사이즈 크게 샀는데 을 샀어도 됐을 것 같아 요 가성비 최고 얇고 시원해요,"사려, 돼다, 크게, 최고, 얇다, 가성비, 사이즈, 시원하다"
촉감도 좋구 땀도 잘 말라서 잘 사용하고 있습니다,"촉감, 사용, 라서"
동생한테 사 줬어요 크긴 한데 교복 이너로 좋대요,"대요, 동생, 교복, 주다, 크다, 이너"
가성비 진짜 좋습니다 운동할 때 개 돌려 입으면 넘 좋네요,"돌리다, 가성비, 운동"
작업복으로 쓰려고 샀는데 아주 유용하게 잘 쓰고 있습니다 감사합니다 더욱더 좋은 상품으로 많이 많이 팔고 번창하셔요,"쓰다, 번창, 팔고, 유용하다, 작업복, 상품"
운동할 때 맨날 입어요 땀 잘 마르고 편해서 좋습니다,"맨날, 마르고, 편하다, 운동"
싼 가격에 좋은 티 잘 샀습니다 자주 입고 다닐 듯요,"싸다, 가격"
사이즈는 잘 맞는데 기능성 티 치고는 좀 두꺼운 편이라서 어깨랑 팔뚝살이 좀 많아 보여 요 강제 어깡 행 남성분들 한테는 오히려 좋을 것 같은데 여성분들은 덩치가 좀 커 보일 수 있다는 점 고려하고 구매하시길 그래도 소재도 하고 가성비갑 입니다,"분들, 보이다, 남성, 강제, 어깡, 고려, 치가, 여성, 치고는, 팔뚝"
사이즈 하고 가격도 착하고 운동할 때 입 기 딱 좋습니다,"착하다, 사이즈, 가격, 운동"
운동할 때 입 기 좋구만 유 팔 한 번 걷으먄 멋나부러유,"부러, 걷으먄, 운동"
가성비 좋고 딱히 모자란 것은 없으나 단품으로 입는 게 좋아요,"딱하다, 모자라다, 가성비"
운동할 때 사려고 샀는데 땀 흡수도 잘 되고 무난하게 이 쁘네요 다들 애용하세요,"사려, 쁘네, 애용, 흡수, 운동"
운동할 때나 평소에 편하게 입을 수 있는 점이 좋은 거 같아요,"편하다, 운동"
사이즈 딱 좋고 재질도 괜찮네요 이 가격에 개 사길 잘한 것 같아요,"재질, 사이즈, 가격"
생각 보다 옷이 꺼칠꺼칠 해서 아쉽지만 러닝할 때는 좋아요,"꺼칠꺼칠, 러닝, 아쉽다"
집에서 입 기 너무 편하고 운동할 때 입기도 편합니다,"편하다, 운동"
잘 늘어나지 않고 시원하게 입고 있어요 운동할 때도 좋아요,"늘어나다, 시원하다, 운동"
가볍고 시원해서 좋았고 무엇보다 색감이 나쁘지 않아요,"색감, 나쁘다, 가볍다, 시원하다"
아주 해서 막 입 다 교체하기 좋은 옷입니다,교체
엄청 시원하고 편해서 매일 입고 있습니다 좋아요,"편하다, 시원하다"
가격 대비 옷을 너무 잘 구매해서 세탁 후에도 이 상한 거 없네여,"상한, 대비, 세탁, 가격"
운동할 때 이만한 게 없네요 잘 입고 있습니다 다음에도 구매해야겠네요,"이만, 운동"
생각했던 재질이랑 많이 달라 요 완전 운동복 재질 얇고 통기성 좋아서 빨래는 순식간에 마르네요 거의 세탁기에서 꺼내자마자 말랐어요,"마르다, 순식간, 꺼내다, 달라, 세탁기, 재질, 기성, 빨래, 운동복, 얇다"
티셔츠 소재가 생각보다 부드럽고 편안하네요 자주 입을 수 있을 듯 합니다,"편안하다, 부드럽다, 티셔츠, 소재"
원단이 좋아요 오래 입을 수 있을 거 같아 요 종 사서 화이트 제일 먼저 입어봤습니다,"먼저, 화이트, 사서, 오래, 입어보다, 원단"
하고 무난하게 입 기 좋은 무지 반팔티에요 이 쁘기도 하고 오래 입을 거 같아요,"쁘기, 오래"
사이즈가 큰 게 잘 없는데 잘 맞네요 역시 믿고 보는 무신사,"믿다, 크다, 맞다, 사이즈"
가성비 좋습니다 운동할 때 입으려고 구매했는데 땀도 잘 마르고 무엇보다 막 입 기 좋아요,"마르고, 가성비, 운동"
이 가격에 장이면 완전 혜자입니다 시원하고 합니다,"혜자, 가격, 시원하다"
운동할 때 입으려고 구매했는데 확실히 재질이 좋아요 땀 많이 흘려도 면티보다 덜,"티보, 확실하다, 흘리다, 재질, 운동"
일 할 때 기능성으로 편한 반팔 티로 구매했습니다 저렴한 가격으로 장 이라 만족스럽지만 약간 두깨 감이 있어서 별 하나 뺐습니다,"이르다, 빼다, 하나, 만족스럽다, 기능, 저렴하다, 가격, 편하다"
운동하는 사람 땀 많이 흘리는 사람 입으면 괜찮아요,"사람, 흘리다, 운동"
편안하게 여름에 입 기 편안하고 운동할 때 입기에도 좋네요,"편안하다, 여름, 운동"
재질도 좋고 만족합니다 통기성이 좋아 운동 시 딱입니다,"기성, 딱이다, 만족하다, 재질, 운동"
시원한 원단에 무난한 디자인이 좋았어요 가격도 저렴했어요,"디자인, 원단, 저렴하다, 가격, 시원하다"
더운 여름에 이너로 입을 수도 있고 운동할 때 단품으로 입기 좋아요,"수도, 덥다, 이너, 여름, 운동"
가성비도 좋고 딱 여름에 사용하기 좋은 거 같아요,"사용, 가성비, 여름"
가격이 싸고 운동복으로 막 굴리기 좋은 거 같아요,"리기, 싸다, 운동복, 가격"
흰색은 많이 비치지만 싸게 잘 샀습니다 가 성비 좋네요 많이 파세요,"성비, 비치, 파다, 흰색, 가다, 싸다"
여름 전투복으로 최고 세탁도 간편해서 자주 입히네요,"전투복, 입히다, 간편하다, 최고, 세탁, 여름"
여름 데일리 전투복으로 최고입니다 운동할 때도 잘 입히네요,"전투복, 입히다, 데일리, 최고, 여름, 운동"
생각보다 두께감 있습니다 아직 착용 전이라 성능은 모르겠네요,"성능, 아직, 전이, 모르다, 착용, 두께감"
잘 때 입거나 잠 옷으로 입는데 이만한 게 없습니다,이만
구멍이 뚫려 있는 재질이라 시원합니다 싸게 산 거 같아서 좋아요,"뚫리다, 구멍, 싸다, 재질, 시원하다"
운동할 때 입으려고 샀는데 대 만족입니다 정 사이즈에요,"대다, 만족, 사이즈, 운동"
운동할 때마다 이것만 입습니다 너무 얇지 않으면서도 재질이 시원해서 최고에요,"마다, 최고, 얇다, 재질, 시원하다, 운동"
이 거 무지무지 좋습니다엄청 시원하고 잘 말라요,"무지무지, 말르다, 시원하다"
사이즈도 좋고 핏도 예술이에 요 재구매 의사,"예술, 의사, 재다, 사이즈"
그냥 후 뚜루마 뚜루 입고 다니기 좋습니다 잘 입을 겓요,"루마, 뚜루"
가격이 정말 싸고 운동할 때 나 이너티로 입기 좋습니다,"이너티, 싸다, 가격, 운동"
바람 잘 통하고 좋네요 사이즈가 생각보다 큽니다,"바람, 크다, 사이즈"
엄청 편하고 여룸 반팔티 필요하신 분에게 매우 강추 드리는 제품입니다,"여룸, 필요하다, 강추, 드리다, 제품, 편하다"
운동할 때 통풍이 잘 되서 애용 중인 티셔츠입니다,"중인, 애용, 티셔츠, 통풍, 운동"
빠른 배송 감사합니다 저렴한 가격에 너무 좋은 구성으로 잘 입고 있습니다,"구성, 빠르다, 저렴하다, 배송, 가격"
예전에 구매하고 추가 구매입니다 땀도 금방 마르고 재질도 시원하고 마음에 들어요,"예전, 추가, 금방, 마르고, 재질, 시원하다"
가격에 맞는 퀄리티 적당히 좋음 그리고 적당히 아쉬움,"적당하다, 아쉬움, 퀄리티, 맞다, 가격"
편하게 입 기 좋음 약간 까슬거리는 것 있음 가격에 맞는 옷,"까슬거리, 맞다, 가격, 편하다"
두께도 적당해서 시원하고 좋다 가격도 가성비 있다,"두께, 적당하다, 가성비, 가격, 시원하다"
제질이 시원하고 잘 늘어나서 이 리저리 입기 너무 좋아요,"늘어나다, 시원하다"
외출복으로도 운동복으로도 홈웨어로도 입기 좋아요,"으로도, 홈웨어, 외출복, 운동복"
좋아요 옷이 문제가 없습니다 그리고 항상 잘 입어오던 브랜드,"브랜드, 문제"
오버핏들 보다 거의 치마에 가까운 길이를 찾고 있던지라 딱 밎 음,"치마, 가깝다, 길이, 오버핏, 찾다"
시원한 소재라 지금처럼 더울 때 데일리로 입 기 딱 좋아요 핏도 이 쁘고 좋아요,"데일리, 덥다, 소재, 시원하다"
가성비 좋습니다 재구매 의사도 있습니다 많이 파세요,"파다, 의사, 재다, 가성비"
사이즈는 정 사이즈 고 그냥 막 입 기 좋아요 더러워져도 안 아까운,"더러워지다, 아깝다, 사이즈"
기존에 같은 제품 사이브로 로 이용했으나 이 더 루즈하고 편한 느낌 만족합니다 면 같이 피부에 닿을 시 매끄러움은 없으나 운동용으로 적니다,"브로, 매끄럽다, 루즈, 피부, 기존, 닿다, 이용, 적다, 제품, 만족하다"
운동하거나 엄청 더운 여름에 잘 입었어요 이염 돼도 빨래 돌리고 나면 끄읕,"끄읕, 이염, 거나, 돼다, 돌리다, 빨래, 덥다, 여름, 운동"
너무 편하고 시원해서 매우 매우 만족합니다,"만족하다, 편하다, 시원하다"
크게 입을 려고 삿다가 살짝 딱 맞는 느낌이 있어서 로 재구매했어요 그래도 막 불편하진 않네요,"삿다, 불편하다, 크게, 재다, 맞다"
편하게 입을 때 좋고 사이즈 크게 사서 입으면 욱 편해서 좋았어요,"사서, 편하다, 크게, 사이즈"
편하고 항상 잘 입고 시원해요 가성비 최고입니다 추천,"최고, 추천, 가성비, 편하다, 시원하다"
시원해서 너무 좋아요 운동할 때나 그냥 일상복으로 나 충분해요,"상복, 충분하다, 시원하다, 운동"
생각보다 두껍고 엄청 부드러운 느낌은 아니에 요 막 입고 다니기엔 편합니다,"부드럽다, 아니다, 두껍다, 편하다"
디자인도 좋고 재질도 좋네요 재구매 의사 있어요,"의사, 디자인, 재다, 재질"
가격도 착하고 착용 감 시원하고 좋습니다 굿입니다,"착하다, 착용, 가격, 시원하다"
티셔츠 종결자 다만 땀 냄새가 잘 빠지도록 빨래 시 유의,"유의, 종결자, 빠지다, 냄새, 빨래, 티셔츠"
가성비 갑 싸게 너무 잘 산 거 같네요 올 여름 잘 입을께요,"오다, 싸다, 가성비, 여름"
