Review,keyword
실기시험 칠 때 입었는데 땀에 옷이 붙지 않아 좋아요 적극 추천,"시험, 실기, 적극, 붙다, 추천"
운동복 소재 느낌이라 여름에 시원하게 입 기 좋습니다,"운동복, 소재, 여름, 시원하다"
운동할 때 입어도 좋고 잘 때 입어도 좋아요 너무 편해요 색깔 구성도 마음대로 할 수 있어서 좋네용,"구성, 색깔, 편하다, 운동"
시원하고 입고 다니기 편하네요 여름에 입 기 좋아요,"여름, 편하다, 시원하다"
적당한 두께랑 까칠한 소재감으로 여름엔 시원할 듯,"까칠하다, 두께, 적당하다, 소재, 여름, 시원하다"
헬스 꾸준히 한 건장한 체격이라는 점 참고하세요 편하고 좋습니다 운동할 때도 일상복 이너로도 활용하기 좋아요 세탁 번째인가 번째에 소매 쪽 올이 나갔지만 가격대 생각해보면 아쉬울 건 없는 것 같네요,"꾸준하다, 인가, 소매, 건장하다, 이라는, 상복, 헬스, 체격, 활용, 참고"
울강쥐도 이 옷을 좋아하는 거 같아 요 넘 편해요 하핳,"강쥐, 좋아하다, 편하다"
깔끔하고 운동할 때 입 기 좋아요 여름에 잘 입을 게요,"깔끔하다, 여름, 운동"
일할 때 입으려고 사 서 편하게 잘 입고 있어요 몇 개 더 사놓을 예정입니다,"예정, 서다, 편하다"
운동할 때 입으랴 고샀는데 좋아요 이뿝니다 베리굿,"베리, 이뿌다, 운동"
운동할 때 입으려 구 샀어용 시원하고 좋아 여 가격도 저렴해서 좋네 여,"저렴하다, 가격, 시원하다, 운동"
이게 진짜 이 가격에 기능성이라 목도 안 늘어나고 진짜 좋아요 살짝 아쉬운 건 사이즈를 총장 보고 살짝 크롭 한 느낌을 바라고 샀는데 생각보다 많이 길더라구 요 근데도 이 가격이 개라는 게 진짜 말이 안 돼서 완전 만족 중 입니다,"바라다, 크롭, 라는, 총장, 보고, 목도, 만족, 가격, 돼다, 아쉽다"
메쉬 소재라 시원하고 운동할 때 입기 좋을 거 같아 요 딱 헬스장 운동복 소재 같네요 제의 눈이 보여 요 물론 제 몸이 문제겠죠,"소재, 제의, 겠다, 메쉬, 문제, 헬스장, 보이다, 운동복, 시원하다, 운동"
가격도 저렴하고 너무 만족스러워요 적극 추천합니다,"적극, 만족스럽다, 추천, 저렴하다, 가격"
사이즈 파란 선까지와요 운동할려구 샀습니다 저랑 키 비슷하신 분들은 추천 크지 않고 살짝 엉덩이 반 조금 넘게 가리는 정도입니다 좋아요,"까지와, 파란, 가리다, 엉덩이, 크다, 추천, 사이즈, 운동"
와 가성비 대박이구 운동할 때도 입고 평소에도 이너로 입고 있어요 아주 좋아요,"이구, 대박, 오다, 이너, 가성비, 운동"
세탁 후 목 늘어짐 없고 소재가 해서 운동할 때 도 복안에 입 기 좋아요 여자치고 어깨가 좀 있으니 핏 보실 때 참고 해주세요 사이즈는 아주 조금 여유 있게 딱 맞아요,"복안, 여자, 치고, 늘어지다, 여유, 해주다, 참고, 어깨, 세탁, 맞다"
시원하고 색 갈도 무난해서 아무 옷에 입고 다닙니다,"갈도, 시원하다"
핼스장에서 운동하려고 샀는데 싸고 운동할 때 입으면 아주 좋아요,"핼스장, 운동, 싸다"
체형 기준 좀 타이트 합니다 정핏에서 타이트한 정도 입니다 제가 생각한 후들 흐들 거리는 소재가 아니라 까끌 가리면서 두께가 있는 제품이였어요 운동할 때 안에 받쳐 입 기 좋네요,"타이트, 흐들, 가리다, 정핏, 거리, 기준, 체형, 받치다, 두께, 끄다"
진짜 편해요 운동할 때도 한 느낌 없이 시원합니다 가성비 갑 또 주문했져 여,"주문, 가성비, 편하다, 시원하다, 운동"
운동할 때 편하게 휘뚤마뚤 입고 있습니다 요즘에는 입기 조금 춥지만 운동 마칠 때는 또 그렇게 춥진 않더라구요,"추다, 마치다, 휘뚤마뚤, 그렇게, 운동, 편하다"
기장이 약간 긴 편이라 저는 레이어드 용도로 같이 입으려고 구매했어요 비침이 심하지는 않지만 단독으로 입기에는 비쳐서 단독은 어려울 것 같네요 비칩니다 참고하세요 그 외 기능성이나 상품은 아주 좋아요,"단독, 비치다, 어리다, 심하다, 용도, 레이어드, 기장, 참고, 편이, 상품"
요즘 교복처럼 입고 다니는데 왠만한 바지는 다 매치되 구 슬랙스 랑 입으면 꾸안꾸 가능,"매치다, 바지, 꾸안꾸, 왠만하다, 슬랙스, 가능, 교복"
목요일 아침에 주문했는데 출고 월요일 오후에 됐음,"오후, 목요일, 월요일, 출고, 아침, 돼다, 주문"
운동할 때 입으려고 샀어요 에어쿨링 이라고 해서 얇지 않을까 했는데 생각보다 엄청 얇진 않고 살짝 두툼한 감이 있어요 남여 공용인 거 같아서 로 했는데 또 엄청 큰 편도 아니라서 박스티 같지도 않아 요 약간 생각과 다른 부분이 엄청 많은데 또 엄청 마음에 안 들 지도 않는 요상한 옷입니다 대신 땀은 잘 말라용,"얇다, 공용, 편도, 박스, 남여, 상한, 두툼, 대신, 이라고, 에어"
딱 그 가격에 맞는 옷 같네요 살짝 두껍 긴 한데 나름 굿,"나름, 두껍다, 맞다, 가격"
제가 입 다가 살이 좀 빠져서 로 구매했는데 아주 만족해요 사이즈 비교해서 사진 올렸어요 아주 미세하지만 차이 있음,"미세하다, 차이, 비교, 다가, 올리다, 빠지다, 살이, 사진, 만족하다, 사이즈"
가볍고 편하고 너무 좋아요 운동할 때 입으려고 샀는데 만족해요,"가볍다, 만족하다, 편하다, 운동"
사이즈 정 사이즈로 가면 될 꺼 같고 얇고 금방 마를 꺼 같은 소재여서 일할 때나 운동할 때 맘 편히 입을 수 있을 듯,"끄다, 가면, 사이즈, 마르다, 금방, 소재, 얇다, 편하다, 운동"
아빠 잠옷으로 쓰신다고 해서 구매했어요 재질 색깔 다 만족하는데 처음에 엄마가 따로 손 빨래 안 하고 다른 옷이랑 섞어서 세탁했으면 큰일 날 뻔 했어요 물 엄청 빠지네요,"아빠, 섞다, 큰일, 엄마, 쓸다, 빠지다, 색깔, 처음, 잠옷, 빨래"
정말 너무너무 좋아요 벌써 두 번째 구입해서 입고 있어요 운동할 때 통풍이 잘 되어서 너무 좋아요 평소에 그냥 입기도 괜찮고 핏도 괜찮아요 가슴 운동할 때 아니면 튀어나와 볼 일이 없어요 정말 정말 좋아요,"튀어나오다, 일이, 가슴, 벌써, 되어다, 통풍, 아니다, 운동"
시원시원하고 너무 좋네요 땀도 금방 마르고요굿입니다,"시원시원하다, 금방, 마르고"
제가 딱 원하던 기능성 티라 만족합니다 운동할 때 입으려고 싸게 샀는데 정말 좋아요 살짝 끼게 입으려고 샀는데 딱 좋네요 제 스펙에 살짝 여유 있게 입으려면 이 좋을 것 같습니다,"스펙, 여유, 원하다, 기능, 싸다, 만족하다, 운동"
운동할 때 입으려고 샀는데 길이가 완전 적당하고 좋아요 완전 얇고 찰랑한 옷 일 거라 생각했는데 생각보다 하고 속옷도 안 비치는 두께감이라 괜찮아요,"속옷, 찰랑하다, 길이, 두께감, 비치다, 적당하다, 얇다, 운동"
운동할 때마다 잘 입고 있습니다 땀 잘 마르고 좋아요,"마다, 마르고, 운동"
얇고 땀 흡수 잘되서 운동할 때 입 기 좋습니다 다 만 안쪽이 많이 비칩니다 이너로 입길 추천 드립니다,"입길, 안쪽, 드리다, 비치다, 이너, 추천, 흡수, 얇다, 운동"
운동할 때 입 기 너무 좋은 원단이에요 가성비 좋고요 정 사이즈 사셔도 사이즈 딱 좋아요,"사이즈, 원단, 가성비, 운동"
매쉬 소재에 저스트 핏 가격 대비 굿 티 개 하나당 꼴 잘 입겠습니다,"저스트, 매쉬, 하나, 대비, 소재, 가격"
체격이 좀 있는 편임에도 운동할 때 하게 입 기 좋을 것 같습니다 땀도 잘 마르는 소재인 것 같아요,"편임, 체격, 마르다, 소재, 운동"
가성비 템이네요 운동 시에도 좋고 이너로도 입을 수 있을 것 같아 요 흰색은 사 알짝 꼭지스 비치네요,"지스, 알짝, 흰색, 비치다, 가성비, 운동"
사이즈 한 사이즈 다운하면 운동할 때 달라붙는 핏감 좋습니다 색 감 모니터랑 동일합니다 두께감 얇은 편이나 비침은 적습니다 배송 빠르고 좋습니다 포장 깔끔하게 파손 없이 왔습니다 흰색은 얼룩이 많이 묻어서 검은색을 추천합니다,"모니터, 파손, 핏감, 얼룩, 묻다, 다운, 동일하다, 검은색, 달라붙다, 사이즈"
통풍 잘 되고 시원해서 맘에 들어 요 두께감이 아예 없는 건 아니라서 비침도 없어서 좋아요,"두께감, 비침, 통풍, 아니다, 시원하다"
매우 얇으면서도 땀 흡수가 잘 돼서 이너로 입 기 좋아요 잠옷으로도 나쁘지 않습니다,"나쁘다, 잠옷, 돼다, 으로도, 이너, 흡수, 얇다"
시원한 재질은 아닌 거 같네요 입었을 때 거친 느낌이에요,"거치다, 아니다, 재질, 시원하다"
운동할 때 무난하게 입 기 좋은 옷인 것 같아 용 기본템이라 쟁여두시면 어딘가에 잘 입을 수 있습니다,"어딘가, 두시, 운동"
생각한 것보다 좀 두께가 있고 흰 셔츠는 꼭지 초상권 보호가 아예 안돼요,"보호, 초상권, 꼭지, 셔츠, 희다, 돼다, 두께"
긴팔 구매하고 좋아서 반팔도 구입했네요 가성비 좋아요,"팔도, 가성비"
편하고 싸서 항상 이 반팔만 사 서 다용도로 잘 립아요,"도로, 팔만, 다용, 서다, 싸다, 편하다"
그냥 편하게 운동 하러 갈 때 입 기 좋습니다 무난해 요,"갈다, 편하다, 운동"
너무 편하고 좋긴 한데 총장이 좀 깁니다 참고해용,"총장, 참고, 편하다"
글리머라는 회사가 일본 회사인데 막 그렇게 정보가 없기도 하고 가격이 너무 말이 안 되는 것 같아서 좀 불안했습니다 일단 가격이 너무 깡 패기도 하지만 옷이 너무 하고 운동할 때 정말 편하게 입을 수 있는 그런 옷입니다 색도 다양하고 진짜 극 가성비 제품입니다,"회사, 패기, 불안하다, 정보, 일본, 라는, 다양하다, 색도, 가격, 리머"
사이즈 한 사이즈 다운하면 운동할 때 달라붙는 핏감 좋습니다 색 감 모니터랑 동일합니다 두께감 얇은 편이나 비침은 적습니다 배송 빠르고 좋습니다 포장 깔끔하게 파손 없이 왔습니다,"모니터, 파손, 핏감, 다운, 동일하다, 달라붙다, 사이즈, 적다, 포장, 편이"
매우 얇으면서도 땀 흡수가 잘 돼서 이너로 입 기 좋아요 잠옷으로도 나쁘지 않고 단독으로 입기엔 젖꼭지가 너무 나오지만 그래도 저렴하게 잘 샀네요,"젖꼭지, 단독, 나쁘다, 으로도, 잠옷, 돼다, 나오다, 이너, 흡수, 저렴하다"
사이즈 잘 맞는데 바스트가 있어서 그쪽만 살짝 끼지만 그래도 좋아요,"바스트, 맞다, 사이즈"
얇고 구 김안 가는 재질이에 요 보기에는 편하고 시원해 보이는데 울아들은 땀나고 까슬거린다고 하네요 안 입으면 저라도 입죠 머 전 괜찮은 것 같아 요 일단 가성비는 좋은 것 같구 요 단점은 많이 얇아서 흰색은 살이 비치더라구 요 다른 색은 괜찮아요,"얇다, 까슬거린다, 보기, 라도, 김안, 단점, 아들, 살이, 따다, 흰색"
배송 빨리 왔고 사이즈 적당해서 좋아요 제품 만족스럽습니다,"만족스럽다, 오다, 빨리, 제품, 적당하다, 배송, 사이즈"
헬스 년차 건장한 체격 가격 원에 벌 안 살 이유가 없음 크기 정도면 단품으로도 레이어드로도 쓸 수 있는 사이즈 핏 그냥 반팔티 재질 체감상 군대 때 티 조금 두꺼운 정도로 느껴 짐 그 말은 즉슨 운동할 때 땀 많이 흘릴 때 발군이라는 것 가격도 싸서 막 입기 좋은 반팔,"년차, 즉슨, 체감, 군대, 이라는, 느끼다, 건장하다, 이유, 쓸다, 헬스"
시원하고 괜찮은데 너무 얇아서 그 겉에 뭐를 입어야 될 것 같아요,"얇다, 시원하다"
여름에 시원하게 입 기 좋을 꺼 같습니다 이 가격에 벌이라 가성비도 좋네요,"벌이, 끄다, 가성비, 여름, 가격, 시원하다"
흰티가 안에 비쳐서 이고 만 입기에는 좀 부담됩니다,"부담, 희다, 비치다"
운동할 때 안성맞춤인 옷이 고 저렴합니다 벌이라서 일치 옷은 이걸로 충분합니다,"일치, 안성맞춤, 충분하다, 벌이, 라서, 저렴하다, 운동"
일 할 때 입으려고 샀는데 소재하고 크기 딱 좋네요,"크기, 소재"
운동할 때 입으면 땀 배출이 잘되어서 입 기 좋아요,"배출, 되어다, 운동"
사이즈가 약간 미스 났긴 했지만 땀 흡수 장난 아니네요 시원해요,"장난, 미스, 아니다, 흡수, 사이즈, 시원하다"
땀을 흘리는 직업이라 속에 입을 티를 찾고 있었는데 가성비 좋게 입고 있습니다,"직업, 찾다, 흘리다, 가성비"
합리적인 가격에 잘 샀습니다 색감은 비슷하고 여름에 면티는 너무 잘 늘어나서 이런 재질의 옷을 사려고 했는데 요 제가 사이즈 미스로 한 치수 더 큰 걸 샀으면 좋았겠네요 배에 힘주고 다녀야겠어요,"힘주다, 미스, 치수, 색감, 면티, 사려, 합리, 늘어나다, 크다, 여름"
작업복으로 샀는데 시원하고 세탁 자주 해도 변형 없고 좋아요,"작업복, 해도, 변형, 세탁, 시원하다"
원단 도톰하고 가성비 좋습니다 운동할 때 입으려고 구매했어요,"도톰하다, 원단, 가성비, 운동"
친구한테 선물로 한 장 받았는데 너무 맘에 들어서 제가 장 구매 하였습니다,"친구, 선물, 들어서다, 받다"
가성비 있고 매일 운동할 때마다 입고 있어요 좋아요,"마다, 가성비, 운동"
작업복으로 잘 입는 중 편하고 막 입기 좋음 땀 흘려도 금방 마르는 듯,"작업복, 흘리다, 마르다, 금방, 편하다"
시원해서 운동할 때 입 기 좋네요 세탁을 많이 해도 늘어나는 거 하나도 없어요,"해도, 하나, 늘어나다, 세탁, 시원하다, 운동"
운덩할 때 입으려고 샀습니다 생각보다 작은 데 그래도 하고 젛아요,"젛아, 운덩, 작다"
배송 빨리 왔고 사이즈 적당합니다 만족스럽습니다,"만족스럽다, 오다, 빨리, 적당하다, 배송, 사이즈"
조금 비치기는 한데 시원하고 좋네요 이너로 입기 좋아요,"비치, 이너, 시원하다"
땀 흡수도 잘 될 거 같고 통풍도 잘 되고 운동할 때 입으면 딱일 것 같아요,"딱이다, 통풍, 흡수, 운동"
가격과 재질 가성비 갑입니다 너무 좋아 번 정도 재구매했어오,"재다, 가성비, 재질, 가격"
운동할 때 입기 좋고 가성비 좋고 재질도 생각보다 좋아요,"가성비, 재질, 운동"
가볍고 두께도 적당하니 이너로 입 기 좋아요 한번 세탁하고 나면 구김도 펴질 거고 잘 마르고 구김도 잘 안 가는 소재라 편하게 입을 수 있을 것 같아요,"구김, 거고, 펴다, 두께, 가다, 이너, 가볍다, 마르고, 적당하다, 세탁"
장이라 집에서도 입고 운동 갈 때도 입는 다 빨리 마르고 시원해서 매우 좋음 가성비도 굿,"에서도, 갈다, 빨리, 마르고, 가성비, 시원하다, 운동"
일반 택배 오는 비닐 속에 따로 포장 되어 있지도 않고 옷만 덜렁 들어 있음 재질도 까끌까끌해서 착용 감도 별로 임 너무 싼 마이를 구매한 듯 하네요,"택배, 비닐, 덜렁, 마이, 까끌까끌하다, 별로, 일반, 포장, 착용, 되어다"
여러 번 빨았는데도 목 늘어나지고 않고 좋아요 추천합니다,"빨다, 여러, 늘어나다, 추천"
저렴한 가격에 가성비 좋은 티셔츠 잘 구매한 것 같아 요 여러 번 빨았는데도 색 빠짐도 없고 크게 늘어나지 않네요,"빠지다, 빨다, 여러, 크게, 늘어나다, 티셔츠, 저렴하다, 가성비, 가격"
러닝할 때 입으려고 샀고 추가 구매했습니다 가성비 너무 좋고 시 원합니다,"원하다, 추가, 러닝, 가성비"
착감기는 시원함이 너무 좋습니다 쿨 제품 원탑인 듯합니다,"탑인, 감기, 제품, 시원하다"
일할 때 편하게 입으려고 샀는데 가성비 좋아요 사이즈는 적당하게 나왓어요,"나왓어, 적당하다, 가성비, 사이즈, 편하다"
집에서 편하게 입으려고 샀는데 아주 좋아요 가성비가 좋은 것 같아 요 운동할 때도 애용하고 있습니다,"애용, 가성비, 편하다, 운동"
잘 늘어나고 땀 흡수가 잘 됩니다 길이 감이랑 폭이 좋아서 운동할 때 편해요,"길이, 늘어나다, 흡수, 편하다, 운동"
진짜 편합니다 잘 때도 입고 운동할 때도 입습니다 꼭 사세요,"편하다, 운동"
집에서 잠 옷으로 입으려고 샀는데 무난하게 편하게 잘 입을 거 같아요,편하다
운동 시작해보려고 샀는데 상당히 만족합니다 목 부분도 해서 오래 입을 수 있을 거 같네요,"상당하다, 시작, 부분, 오래, 만족하다, 운동"
빠르게 배송 받아볼 수 있어서 만족스러웠습니다,"만족스럽다, 받다, 빠르다, 배송"
좋아요 이거를 입으면 힙한 사람이 될 수 있어요 조금 두꺼우니 조심하세요 저는 힙합퍼에요,"힙합퍼, 조심하다, 사람, 두껍다"
배송 빠르고 품질 좋네요 가볍게 받쳐 입기도 좋고 단독로 입기도 좋아요,"단독, 받치다, 품질, 가볍다, 빠르다, 배송"
시원하고 헬스장 갈 때 시원하게 입는데 너무 만족해요 재질도 좋고 얇아서 너무 좋습니 당 심지어 이 가격에 세장,"시원하다, 헬스장, 갈다, 만족하다, 얇다, 재질, 가격"
여름에 헬스할 때 입기에 딱 좋습니다 아주 좋아요,"헬스할, 여름"
헬스 할 때 입을 려 구 삿는데 가격 대비 퀄리티 마감 모두 만족 했고 기능성 반팔에 맞게 기능성도 아주 만족 합니다 오래 입을 꺼 같아요,"만족, 기능, 마감, 삿는데, 헬스, 성도, 오래, 퀄리티, 끄다, 대비"
편히 입으려고 큰 사이즈로 구매했어요 벌크 포장처럼 한 번에 포장되어와서 좀 기능성 치곤 도 톰해요,"포장, 크다, 치다, 톰해, 서다, 되어다, 기능, 사이즈, 편하다"
기존에도 샀던 건데 생각보다 하고 입기에 아주 좋습니다,"기존, 건데"
운동할 때 막입을 반 팔티가 필요해서 구매했는데 가성비 진짜 좋은 거 같아요,"막입, 필요하다, 가성비, 운동"
목 늘어짐 없을 듯합니다 정 사이즈 구매 추천합니다 오랫동안 입을 수 있을 듯 추천합니다,"추천, 오랫동안, 늘어지다, 사이즈"
목 늘어짐 없을 듯합니다 정 사이즈 구매 추천합니다,"늘어지다, 추천, 사이즈"
정 사이즈 주문했습니다 딱 맞아요 직접 받아보니 더욱더 만족합니다 추천합니다,"직접, 주문, 받다, 추천, 맞다, 만족하다, 사이즈"
따듯하고 깔끔함이 큰 장점입니다 데일리스타일로 좋습니다 추천 별이 다섯 개 입니다 남녀 구별 없이 착용 가능,"남녀, 구별, 다섯, 가능, 장점, 스타일, 데일리, 따다, 착용, 깔끔하다"
제가 오랫동안 헬스장에서 입는 옷입니다 가격도 저렴한데 핏도 좋아서 운동 하시는 분들에게 강 추 드립니다 세탁 후 변형도 없고 땀 배출도 좋은 편이며 무엇보다 세탁 후 잘 말라서 운동복으로 딱 좋습니다,"세탁, 오랫동안, 변형도, 배출, 편이, 헬스장, 드리다, 라서, 저렴하다, 운동복"
운동할 때 땀도 잘 마르고 신축성도 좋고 가성비 좋네여,"성도, 신축, 마르고, 가성비, 운동"
운동할 때 유용하게 잘 입을 수 있을 것 같아 요 만족합니다,"유용하다, 만족하다, 운동"
외부 작업용으로 구매했는데 아주 마음에 들고 세탁 여러 차례 했는데 아주 하네요 사진도 여러 번 입고 세탁 몇 차례 한 뒤 입고 찍은 사진인데 새 제품 같아요,"차례, 여러, 사진, 세탁, 외부, 찍다, 작업, 제품"
가성비 너무 좋네요 넥라인이 많이 합니다 살짝 머슬핏 내실 분들은 사이즈 다운하세용,"넥라인, 머슬핏, 내다, 다운, 가성비, 사이즈"
땀 잘 말라서 이너로 입 기 좋아요 근데 재질 때문에 약간 까끌한 건 어쩔 수 없는 듯,"어쩔, 때문, 끄다, 라서, 이너, 재질"
엉덩이까지 덮는 기장에 운동할 때 잘 입고 있어요 갓 성비,"덮다, 성비, 엉덩이, 기장, 운동"
입으면서 편했던 점 위주로 후기 올립니 다 개인적 취향이 반영된 후기라 편하게 읽어주세 여 재질은 맨들 맨들 하니 하며 신축성 좋고 하고 통기성도 좋습니다 넥 부분도 늘어남 없이 하머 데일 입고 다니며 매칭 활용성이 좋습니다 무게는 가 벼워서 운동용이나 속으로 받쳐 입기 좋은 거 같습니다 봉제도 히 잘 되어 있어요 가성비도 좋고 년 여름은 글리머 반팔티와,"후기, 위주, 반영, 봉제, 데일, 읽다, 용이, 매칭, 하므다, 취향"
운동 다녀올 때 집에서 편하게 입으려고 구매했어요 원단도 몸에 잘 달라붙지 않고 얇아서 재구매 예정입니다,"다녀오다, 달라붙다, 예정, 원단, 재다, 얇다, 편하다, 운동"
운동할 때 입을 려고 샀는데 이 가격에 벌이 나오니까 땀 냄새 걱정 없어요,"걱정, 벌이, 냄새, 나오다, 가격, 운동"
목이 좀 좁아요 근데 통풍은 어느 정도 되고 약간 두께감이 있긴 한데 입을 만은 한 정도 매쉬라서 안에 입은 티셔츠가 비치긴 하네요,"만은, 좁다, 매쉬, 두께감, 티셔츠, 비치다, 통풍, 라서"
사이즈가 작은 감이 있어서 한 사이즈 업하면 예쁘게 입을 수 있어요,"사이즈, 작다"
세탁 후 변형 없음 옷 편하고 빨래 완전 빨리 말라요 옷도 해요 완전 시원함,"말르다, 빨래, 변형, 빨리, 세탁, 편하다, 시원하다"
따봉 진짜 땀 많고 더위 잘 타는 사람으로서 이 거 짱 장 대박 완전 가격도 저렴하고 좋아용 여름 되면 땀 때문에 맨날 티셔츠 겹 껴입고 다니는데 이거는 땀 흘려도 티도 안 나고 짱 좋음 당연한 거긴 한데 지금 입은 청바지 처럼 그런 재질이랑은 안 어울리고 그냥,"끼다, 이랑은, 청바지, 더위, 당연하다, 어울리다, 대박, 맨날, 사람, 때문"
좋은 가격에 좋은 상품 만났네요 다른 분들에게도 추천합니 당 시원스,"에게도, 만나다, 원스, 상품, 추천, 가격"
가볍게 운동이나 산책할 때 입으면 땀도 금방 마르고 좋을 것 같네요 덩치 좀 있는데 사이즈 운동하기 딱 적당해서 자주 입을 거 같음 추천합니다,"덩치, 산책, 금방, 가볍다, 마르고, 적당하다, 추천, 운동, 사이즈"
제가 딱 원하던 핏 사이즈 소재도 얇아서 기 본템으로 자주 입을 거 같아 요,"원하다, 소재, 얇다, 사이즈"
딱 가 설비 제품이네요 그래서 운동복으로 좋아요 어 차치 년도 못 입고 버리니까 요 그리고 약간은 두껍게 느껴져요,"년도, 버리다, 설비, 차다, 느껴지다, 가다, 제품, 두껍다, 운동복"
너무 편하고 좋습니다 잘 때 운동할 때 내의 로 다 입어요 두께감이 아주 적당해요,"내의, 두께감, 적당하다, 편하다, 운동"
드라이 피트여서 그런지 땀 배출도 잘 되는 거 같아 너무 만족합니다 평소 외출복으로 입어도 나름 괜찮아 자주 입고 다니고 있습니다,"피트, 외출복, 드라이, 나름, 배출, 그렇다, 만족하다"
제 체형 세미 오버핏 엑라 가 세 여 추천 작게 나온 사이즈,"세미, 오버핏, 체형, 나오다, 작다, 가다, 추천, 사이즈"
여름에 입 기 시원해서 딱 좋아요 핏도 잘 나오고요 꼭 지 비침 주위,"주위, 지다, 나오다, 비침, 여름, 시원하다"
편하게 운동하면서 입기에 좋은 옷입니다 추전드려요,"추다, 드리다, 편하다, 운동"
시원하고 좋아요 여름에 이너 아니면 운동용으로 입을 예정입니다,"예정, 이너, 아니다, 여름, 시원하다, 운동"
다른 기능성 티셔츠들 보단 좀 두꺼운 것 같아요 그래도 흡수는 잘 될 것 같네요 땀 흘려보고 다시 쓰겠슴다,"쓰겠슴다, 보단, 보고, 흘리다, 티셔츠, 기능, 흡수, 두껍다"
운동하려고 샀는데 편하고 좋습니다 시원하네요,"편하다, 시원하다, 운동"
운동할 때 항상 입어요 시원하고 땀 흡수 빠르고 통기성이 좋아요,"기성, 빠르다, 흡수, 시원하다, 운동"
안에 매쉬 소재고 생각보다 까끌거림이 적습니다,"끄다, 적다, 매쉬, 소재"
팔기장이 조금 길지만 기능성 소재가 우수해서 이 가격에 손색 없어요,"손색, 우수하다, 기장, 기능, 소재, 가격"
옷이 편해서 더 사게 됐어요 살이 쪄서 한 치수 더 크게 입었는데 좋네요,"찌다, 치수, 살이, 돼다, 크게, 편하다"
저렴한 가격에 잘 구매했습니다 여름에 입 기 딱이네요,"딱이다, 저렴하다, 여름, 가격"
편하게 헬스하게 입 기 편해요 사이즈도 딱 좋숩니다,"헬스하, 좋숩니, 편하다, 사이즈"
