Review,keyword
데일리로 예쁘고 재질이 좋아서 세탁기 돌려도 변형이 거의 없어서 평소에 착용하기 좋습니다,"세탁기, 데일리, 돌리다, 착용, 변형, 재질"
여름철 운동할 때나 일 상생활에도 딱 어울리는 정말 좋은 티 입니다,"생활, 어울리다, 여름철, 운동"
땀이 정말 잘 말라서 운동할 때 입으면 좋고 유니폼 안에 입기도 좋은 재질이어서 평소에도 자주 입는 것 같아요,"유니폼, 라서, 재질, 운동"
시원하고 좋습니다 디자인은 무난무난하고 통풍 잘됩,"디자인, 통풍, 시원하다"
운동할 때 입 기 좋습니다 빨래도 금방 마르고 신축성도 있어서 운동할 때 입으면 강추,"강추, 성도, 신축, 빨래, 금방, 마르고, 운동"
한여름에 입기에는 살짝 더울 수 있고 땀을 조금 먹긴 합니다만 가성비로는 이 제품 못 이깁니다,"먹다, 이기다, 한여름, 덥다, 제품, 가성비"
정 사이즈 고 막 입기에 좋은 거 같아 요 두께는 보통입니다,"보통, 두께, 사이즈"
운동할 때 입으려고 샀습니다 두께는 보통이고 운동할 때 딱 입기 좋아요,"보통, 두께, 운동"
운동복 재질이라 운동할 때 입고 있는데 싼 가격에 좋은 거 같아요,"싸다, 운동복, 재질, 가격, 운동"
제품이 마음에 들어서 다른 사이즈로 추가 구매하였습니다,"들어서다, 추가, 제품, 사이즈"
옷이 두터우나 시원하여 여름에도 입을 만 합니다,"두텁다, 여름, 시원하다"
옷이 시원해서 좋네요 가성비 정말 좋습니다 만족해요,"만족하다, 가성비, 시원하다"
핏도 좋고 편해서 평소에 입고 다니기 진짜 편하고 좋아요,편하다
운동할 때 편하게 입 기 좋습니다 저렴한 가격에 잘 샀네요,"저렴하다, 가격, 편하다, 운동"
제품도 시원하고 엄청 좋은 거 같아 요 감사합니다,"제품, 시원하다"
상품 상태 좋고 시원하니 엄청좇을 거 같아 요 좋네요,"엄청좇, 상태, 상품, 시원하다"
헬스 하려고 샀는데 너무 좋아요 하게 루즈 한 사이즈에 요 헬스장에 갈 때 맨날 돌려 가면서 입어요 약간 까슬까슬한 재질이에 요 땀 나도 그렇게 딱 붙지 않아요,"루즈, 까슬까슬, 헬스, 가면, 붙다, 맨날, 그렇게, 돌리다, 헬스장, 갈다"
사이즈 잘 맞아서 편하게 잘 입고 있습니다요,"맞다, 사이즈, 편하다"
배송이 빨라서 좋고 재질도 좋아요 세탁 후에도 사이즈는 변경되지 않았어요,"변경, 라서, 세탁, 배송, 재질, 사이즈"
가격 좋으니 운동용으로 편하게 막 입 기 좋습니다,"가격, 편하다, 운동"
평소에 무난하게 입고 다니기에 좋은 것 같습니다,
무난하게 여름에 출 근용으로 잘 입고 있어요 내년 여름도 구매 예정,"내년, 여름, 추다, 예정"
원래 많이 이용했던 제품이라 좋네요 추천 드려요,"이용, 드리다, 제품, 추천"
운동할 땨 편하게 입기 좋아요 검은색은 잘 안비치네요,"검은색, 비치다, 편하다, 운동"
운동복으로 샀는데 가성비 대비 퀄리티 좋아용 근데 다만 목 뒤 옆구리 택이 좀 따가 워서 예민한 분들은 참고하 세용,"옆구리, 세용, 따갑다, 예민하다, 참고, 퀄리티, 대비, 운동복, 가성비"
재질도 부드럽고 옷도 사이즈가 해서 아주 좋아요,"부드럽다, 재질, 사이즈"
운동할 때 입기도 좋고 빨리 말라서 여름에 입 기 좋습니다,"빨리, 라서, 여름, 운동"
사이즈도 적당하고 색깔별로 개여서 운동할 때 좋을 듯요,"별로, 색깔, 적당하다, 사이즈, 운동"
운동 복으러 정말 꿀탭입니다 가끔 가다 계속 구매하는 상품입니다,"꿀탭입니, 복으러, 가끔, 계속, 상품, 가다, 운동"
운동 복으러 정말 좋아요 가끔 가다 계속 구매하는 상품입니다,"가끔, 복으러, 계속, 상품, 가다, 운동"
가성비가 좋고 계절 상관없이 입기 좋은 거 같아 요 담에도 또 구매할 거 같네요 재질이 면은 아닙니다,"계절, 상관없다, 면은, 아니다, 가성비, 재질"
사이즈도 적당하고 합리적인 가격이에요 무난하게 잘 입어요,"합리, 적당하다, 사이즈, 가격"
여름에 입 기 좋습니다 가격도 이 정도면 나쁘지 않네요,"나쁘다, 여름, 가격"
디자인도 깔끔하고 시원해서 운동할 때 자주 입을 것 같아요,"디자인, 깔끔하다, 시원하다, 운동"
운동할 때 입 기 딱이고 가격 대비로 너무 좋습니다,"딱이다, 대비, 가격, 운동"
운동이나 집 앞마실용으로 적당해 보입니다 만족해요,"실용, 앞마, 보이다, 적당하다, 만족하다, 운동"
합리적인 가격에 잘 샀습니다 재질도 빨았을 때 잘 말라서 여름에 딱 좋은 거 같아요,"빨다, 합리, 라서, 여름, 재질, 가격"
배송도 빠르고 옷감이나 이런 날씨에 잘 어울려 요,"어울리다, 옷감, 날씨, 빠르다, 배송"
편하게 입을 목적으로 구매했으며 가볍게 입기에 좋습니다,"목적, 가볍다, 편하다"
일하거나 운동할 때 입을 목적으로 구매했는데 가성비 있고 편하게 잘 입을 것 같아요,"목적, 가성비, 편하다, 운동"
예쁘게 몸에 딱 핏되고 통풍도 잘 되서 너무 시원해요 운동하는데 땀이 덜 찼네요,"핏되, 차다, 통풍, 시원하다, 운동"
운동할 때 정말 잘 입고 있어요 시원하고 빨리 말라요 가성비 짱,"말르다, 빨리, 가성비, 시원하다, 운동"
기능성 티를 평소에 많이 입는데 글리머의 기능성 티는 재질 자체가 좀 보들 보들하다고 해야 하나 다른 기능성 티보다 입었을 때 더 안 불편하고 편안하다는 느낌을 받았습니다 목이 늘어나거나 이런 건 재봉질을 잘해주셔서 없을 것 같은데 좀 더 입어봐야 할 것 같습니다,"기능, 보들하다, 자체, 티보, 재봉, 해주다, 리머, 불편하다, 편안하다, 입어보다"
동생 운동할 때 입으라고 사 줬어요 중반한테 사이즈 적당하고 막 입을 수 있어서 좋아요,"중반, 동생, 주다, 적당하다, 사이즈, 운동"
너무 편해서 또 샀어요 운동복으로 너무 좋아 여 장 사세여,"운동복, 편하다"
밝은 하얀색이라 깔끔하고 예뻐요 땀 흡수가 잘 되는 재질이라 더욱 좋구요,"더욱, 하얀색, 밝다, 깔끔하다, 흡수, 재질"
운동할 때 입 기 좋을 거 같아 요 얇아서 자주 이용할 듯합니다,"이용, 얇다, 운동"
옷도 잘 마르고 핏도 좋고 잘 입고 있습니다 운동용으로 좋아요,"마르고, 운동"
배송이 빠르고 제 체형에 잘 맞는 거 같습니다 막 입기도 좋고 또 살 의 향도 있습니다 운동할 때 자주 입을 거 같아 요,"체형, 빠르다, 맞다, 배송, 운동"
운동할 때 입으려고 구매했습니다 시원하고 좋아요,"시원하다, 운동"
운동할 때 입었는데 좋아서 다시 주문했어요 편해요,"주문, 편하다, 운동"
옷감이 약간 두껍고 거친 감이 있습니다 가격치고 좋습니다,"치고, 옷감, 거치다, 두껍다, 가격"
운동하면서 입기에도 좋고 이너티로 입기에도 좋은 것 같아요,"이너티, 운동"
재질 좋고 시원해서 운동 할 때 입 기 좋은 거 같아요,"재질, 시원하다, 운동"
가볍게 외출용으로 운동할 때 입기 편하니 좋아요 처음에는 살에 닿는 재질 느낌이 부드러운 편이 아니라 거부감 있었는데 입 다 보니 저는 괜찮네요,"거부, 닿다, 외출, 처음, 편이, 부드럽다, 가볍다, 아니다, 재질, 편하다"
운동복으로 괜찮아요 그냥 저냥이네요 가격 대비는,"대비, 운동복, 가격"
배송 빨라서 좋았고 깜꿀하고 이 뻐요 사이즈 마음에 들어요,"깜꿀, 라서, 배송, 사이즈"
부모님 드렸는데 편하고 시원하다고 좋아하세요,"부모님, 좋아하다, 드리다, 편하다, 시원하다"
속에 입기로도 좋고 그냥 입기에도 나쁘지 않은 제품입니다,"나쁘다, 제품"
옷 구성도 맘에 들고 저렴하게 구입해서 좋아요 잘 입겠습니다,"구성, 저렴하다"
재질이 시원하고 운동할 때 입으니까 편하고 좋아요,"재질, 편하다, 시원하다, 운동"
운동할 때 입을 라고 샀는데 시원하고 엄청 편하네요,"라고, 편하다, 시원하다, 운동"
완전 얇아 요 너무 커 보여서 줄자로 재봤는데 사이즈 표랑 맞네요 입으니 하게 맞아요 너무 착한 가격 감사합니다,"맞다, 줄자, 착하다, 크다, 얇다, 사이즈, 가격"
운동할 때 입으면 맛있는 티셔츠에 요 땀 배출 잘 되요,"맛있다, 배출, 티셔츠, 운동"
이 가격에 이 정도 퀄리티 라니 잘 입고 다니겠습니 당,"라니, 퀄리티, 가격"
이 가격에 이 정도 퀄리티 라니 잘 입고 다니겠습니당,"니당다, 라니, 퀄리티, 가격"
두께가 얇아서 요즘 운동할 때 랑 일할 때 잘 입고 있습니다,"두께, 얇다, 운동"
기존에 입던 건데 운동할 때 입으려고 추가 구매했습니다,"기존, 건데, 추가, 운동"
엄마께 사 드렸는데 보니까 얇고 좋대요 그런데 해서 잘 헤 않을 것 같구 요 좋은 가격에 좋은 옷 세 벌이나 얻어서 굿,"얻다, 엄마, 대요, 벌이, 드리다, 얇다, 가격"
가성비 우수한 기능성 티이고 통풍 잘 되는 소재라 자주 입어도 문제 없을 것 같네요,"우수하다, 문제, 통풍, 기능, 소재, 가성비"
잘 받았습니다 땀을 마니흘리고 더운 환경에서 일해서 이만한 티가 없네 여 잘 입고 있습니다,"일해, 환경, 이만, 말다, 받다, 흘리다, 덥다"
생각보다 옷이 두꺼워 영 좀 더운 느낌이 너로 입었는데 더웠습니 당 그래고 재질은 한 거 같아요,"덥다, 그렇다, 두껍다, 재질"
여름에 입 기 좋게 나온 재질과 크기가 적당해서 잘 입고 다닐 거 같습니다,"크기, 나오다, 적당하다, 여름, 재질"
재질이 완전 시원한 재질이여서 여름에 입 기 딱 좋아요,"재질, 여름, 시원하다"
크기도 적당하고 진짜 시원하게 입 기 좋은 재질이여서 여름에 편할 거 같아요,"크기, 적당하다, 여름, 재질, 편하다, 시원하다"
너무 너무 시원해요 여름에 입 기 딱 좋고 땀나도 금방 마르고 무겁지 않아서 입 기 좋아요,"무겁다, 따다, 금방, 마르고, 여름, 시원하다"
소재가 션 하니 좋습니다 운동할 때 잠 옷으로 입 기 좋습니다 밝은색은 젖 꼭 쥐쓰 다 비치니 이너로 입으실 꺼 아니면 어두운색들로 사셔용,"은색, 두운, 쓰다, 밝다, 비치다, 끄다, 이너, 아니다, 소재, 운동"
일하면서 입으려고 구매 했습니다 시원하고 좋아요,시원하다
급히 여행간다고 샀는데 깔끔하게 쟐 받았습니다,"급하다, 간다, 여행, 깔끔하다, 받다"
기능성에 초점을 맞춘다면 좋을 듯합니다 입고 런닝을 하니까 시원하니 좋았습니다,"초점, 맞추다, 런닝, 기능, 시원하다"
가성비 최고에 요 저렴하니 막 입을 수 있고 땀 흘려요,"흘리다, 최고, 저렴하다, 가성비"
얇고 좋습니디 요즘같이 더운 날씨에도 잘 입고 다닙니다,"날씨, 덥다, 얇다"
여름에 시원하게 잘 입을 수 있어요 세탁 후에도 변형 없어서 좋네요,"변형, 세탁, 여름, 시원하다"
살짝 두꺼운 감은 잇지만 운동할 때 쓰기 좋아요 땀 흡수도 잘 되고,"쓰기, 잇다, 흡수, 두껍다, 운동"
사실 일반 무지티인 줄 알았는데 그런 옷은 아니에 요 근데 운동복으로 사용하기에는 아주 좋을 것 같아요 잘 입겠습니다,"사실, 알다, 일반, 사용, 그렇다, 아니다, 운동복"
흰 옷은 살짝 비치네요 나머지 옷은 괜찮습니다 시원함,"나머지, 희다, 비치다, 시원하다"
땀이 많은 사람에게 정말 좋은 옷이라고 생각합니다,"이라고, 사람, 많다"
운동복으로 입으려고 구매했어요 가성비 있게 입을 수 있을 거 같아요,"운동복, 가성비"
운동복으로 입으려고 구매했어요 두깨감도 적당하고 가성비 있게 잘산 거 같아요,"잘살다, 적당하다, 운동복, 가성비"
에어쿨링 반팔티를 샀는데 하고 좋은 거 같네요,"에어, 쿨링"
운동할 때 입으려고 구매했는데요 생각보다 두께감이 있고 생각했던 재질은 아니었더라구 요 그래도 잘 입고 있습니다,"두께감, 아니다, 재질, 운동"
흰색 장 검은색 장 네이비 장 보유 중입니다 다른 색도 내주세요 그럼 또 장이 늘어날 테니,"내주다, 장이, 보유, 검은색, 네이비, 색도, 그렇다, 흰색, 늘어나다"
딱 생각한 두께 질감 사이즈라 만족 가성비로 운동할 때 입기 좋은 느낌,"질감, 만족, 두께, 가성비, 사이즈, 운동"
러닝할 때 입으려고 샀어요 조금 두깨 감이 있어서 통기성이 눈에 띄게 있진 않은 것 같아 요 그래도 가성비 따지면 최곱니다,"곱다, 띄다, 러닝, 기성, 따다, 가성비"
운동할 때 땀 흡수도 잘 되고 편하게 입을 수 있어 좋아요,"흡수, 편하다, 운동"
운동할 때 입 기 좋아 보이고 가격 생각하면 막 입기에 좋은 것 같아요,"보이, 가격, 운동"
운동할 때 입기에 좋아 보이고 여름에 입기에 좋은 것 같아 요 가격 생각하면 만족스럽습니다,"보이, 만족스럽다, 여름, 가격, 운동"
운동할 때 입기 좋은 가성비 반팔입니다 땀 흘려서 세탁해도 금방 마르고 괜찮네요,"흘리다, 금방, 마르고, 세탁, 가성비, 운동"
일하거나 운동할 때 편하게 입으려고 구매했는데 가성비 있게 잘 구매한 것 같아 만족하며 입고 있습니다,"만족하다, 가성비, 편하다, 운동"
운동복으로 무난하게 입 기 딱 좋네요 많이 파세요,"파다, 운동복"
가격 대비 품질 좋아요 시원하고 재주문 할려고 합니다 좋습니다,"주문, 품질, 대비, 가격, 시원하다"
배송 빠르고 원단도 너무 좋고 서 늘 서늘해서 여름에 입 기 닥 좋아요,"서늘하다, 서다, 원단, 빠르다, 배송, 여름"
합리적인 가격에 구입해 아들이 잘 입고 있습니다,"아들, 합리, 가격"
우선 시원해서 좋고 세탁 변형 없어서 여름에 잘 입을 것 같네요,"변형, 세탁, 여름, 시원하다"
기능성 소재로 되어 있어 이너로 입기에 좋습니다,"되어다, 이너, 기능, 소재"
입어봤는데 너무 시원해요 가성비도 좋아서 추천합니다,"입어보다, 추천, 가성비, 시원하다"
시원한 재질이라서 여름에 이너로 입 기 좋은 거 같습니다,"이너, 여름, 재질, 시원하다"
운동할 때 입으려고 샀는데 완전 딱이에요 앞으로 자주 애용할 거 같습니다,"애용, 딱이다, 운동"
사이즈는 살짝 딱 맞고 조금 두꺼운 감이 없지 않아 있네요,"두껍다, 맞다, 사이즈"
가격 좋고 장이고 요즘 같은 때에 입 기 좋은 거 같아요,가격
색상도 마음에 들고 사이즈도 마음에 드네요 좋아요,"색상, 사이즈"
가격 대비 괜찮은 상품인 것 같습니다 통풍이 잘 되는 거 가 아용,"상품, 가다, 대비, 통풍, 가격"
작업복으로 구매했는데 딱 좋은 제품입니다 추천해요,"작업복, 제품, 추천"
가성비 좋은 제품입니다 하고 가볍고 편해요,"가볍다, 제품, 가성비, 편하다"
가격도 괜찮고 이 쁘네요 마음에 들어 요 재구매 의사 있어요,"쁘네, 의사, 재다, 가격"
면티 아닙니다 근데 좋고 시원해요 수축 없어서 좋네요 좋은 가격에 잘 샀음당,"수축, 면티, 아니다, 가격, 시원하다"
면티 아닙니다 근데 좋고 시원해요 수축 없어서 좋네요,"수축, 면티, 아니다, 시원하다"
블랙 네이비 고민하다가 네이비 샀는데 아주 괜찮은 선택이었던 듯 해요 살까 살까도 고민했는데 도 충분합니다 이면 너무 컸을 듯 해요,"고민, 네이비, 살다, 선택, 블랙, 충분하다, 이면, 크다"
사이즈가 딱 맞고 좋습니다 운동하면서도 입기 좋고 평상시에도 입을 만 할 거 같아요,"평상시, 맞다, 사이즈, 운동"
운동용으로 입으려고 샀어요 통풍 잘 되고 편해서 좋습니다,"통풍, 편하다, 운동"
무난하고 사이즈 적당합니다 여름에 시원하게 잘 입을 것 같아요,"적당하다, 여름, 사이즈, 시원하다"
쿨링은 잘 되는 것 같은데 조금 두꺼운 느낌이네요,"느끼다, 쿨링, 두껍다"
다리 다쳐서 운동을 못하고 집에서만 입고 있지만 너무 편하고 땀 흡수도 잘 되고 바로 마르고 가성비 최고입니다 또 구매하면 무조건 여기서 살 예정,"다치다, 다리, 무조건, 에서만, 예정, 최고, 마르고, 흡수, 가성비, 편하다"
소재 시원시원하고 좋아요 땀 덜 나 고 흡수도 잘 될 것 같아요 가성비,"시원시원하다, 흡수, 소재, 가성비"
소재 시원시원하고 좋아요 땀 덜 나 고 흡수도 잘 될 것 같아요 가성비,"시원시원하다, 흡수, 소재, 가성비"
국토대장정을 위해 구입했는데 정말 편하게 잘 입었습니다,"국토, 대장정, 위해, 편하다"
정말 좋은 것 같아 요 앞으로도 많이 이용할 거 같습니다,"이용, 으로도"
생각보다 시원하진 않지만 빨리 말라서 좋아요 여름에 쟁야 두 기 좋을 듯,"빨리, 라서, 여름, 시원하다"
운동할 때 입으려고 샀는데 통풍도 잘 되고 가 벼워서 좋아요,"벼워, 가다, 통풍, 운동"
무난하게 운동할 때 입 기 좋습니다 배송도 좋고 대체적으로 만족합니다,"체적, 배송, 만족하다, 운동"
기능성 티셔츠라 확실히 땀이 빠르게 말라서 좋았어요,"확실하다, 티셔츠, 라서, 빠르다, 기능"
운동복 겸 잠옷으로 샀 눈데 좋아요 싸게 잘 샀어요,"눈데, 잠옷, 싸다, 운동복"
생각보다 두꺼워서 더울까 했는데 괜찮았습니다 디자인도 무난해서 맘에 들어 용 운동할 때 잘 입고 있어요,"디자인, 덥다, 두껍다, 운동"
운동할 때 입 기 좋고 그냥 입어도 좋아요 매쉬여서 시원해요,"매쉬, 시원하다, 운동"
네이비가 샹각보다 밝아용 그거 말곤 다 음 더 입어봐야 알 것 같고 보풀 안 나요,"샹각, 나요, 보풀, 그거, 밝다, 네이비, 말다, 입어보다"
이전에 주문했을 때 만족스러워서 재주문 했어요 가성비 좋고 디자인도 맘에 들어 요 올 여름은 이 옷으로 버티렵니다,"주문, 이전, 버티렵니, 디자인, 만족스럽다, 오다, 가성비, 여름"
색상 개 샀는데 흰색은 입고 다니기 좀 아쉬워요 나머지 색상들은 운동 할 때 입 기 편하고 좋습니다,"색상, 나머지, 아쉽다, 흰색, 편하다, 운동"
가성비 최고 이 뻐요 사이즈도 딱 맞아요 앞으로 잘 입겠습니다,"최고, 맞다, 가성비, 사이즈"
여름 기본 이너티로 입기에 최고입니다 재구매각,"매각, 이너티, 기본, 최고, 재다, 여름"
다음에 또 구매하겠습니다 너무 마음에 듭니다 좋아요,
땀이 많아서 받쳐 입으려고 샀습니 당 조아 요 건조도 짱 빠름,"조아, 건조, 받치다, 많다, 빠르다"
옷이 얇아서 보입니다 하지만 검정색이였다면 통풍도 좋고 낙월한 옷일꺼 같아요,"낙월, 검정색, 보이다, 통풍, 얇다"
무엇보다 편하고 막 입 기 좋습니다 가격도 싸서 가성비도 좋습니다,"싸다, 가성비, 가격, 편하다"
배송도 빠르고 땀 흡수도 잘 되는 거 같아 만족하고 있습니다,"빠르다, 흡수, 배송, 만족하다"
사이즈도 알맞도 약간 까칠한 제질이지만 가성비 좋네요,"알맞다, 까칠하다, 가성비, 사이즈"
막 두껍지도 않고 무난하게 입 기 괜찮은 거 같어요,두껍다
가볍 개 입게 좋음 운동복으로 좋습니다 저렴하게 잘 구매했내요,"가볍다, 저렴하다, 운동복"
핏 좋고 여름에 가성비 좋게 이쁘게 입을 수 있어요 목 뒤에 라벨 테두리가 은 근 까끌 꺼리는 거 말고는 엄청 좋아요,"꺼리다, 테두리, 말고는, 라벨, 끄다, 가성비, 여름"
사이즈는 정 사이즈 구요 기 본템이라 자주 입음 가격 좋아요 배송은 빨라요 세탁 전이라 알수 없지만 변형 없으면 좋겠는데 좋은 제품 많이 파세요,"전이, 구요, 알다, 사이즈, 파다, 변형, 제품, 빠르다, 세탁, 배송"
평소 입는 보다는 조금 작았던 거 같고 두꺼운 기능성 티 재질이라고 생각하시면 될 듯 합니다,"이라고, 작다, 기능, 두껍다, 재질"
여름에 입 기 딱 좋아요 땀이 믾은 데 너무 너무 입 기 좋아요,여름
가격 저렴하게 운동할 때 입 기 좋아요 면티는 냄새나서,"나서다, 면티, 냄새, 저렴하다, 가격, 운동"
맘에드네요 사이즈도 딱이 고 미디움 삿음 교환할 뻔 햇음,"미디움, 에드, 햇음, 삿음, 교환, 딱이다, 사이즈"
맘에드네요 사이즈도 딱이 고 미디엄 삿음 교환할 뻔 햇음,"미디엄, 햇음, 에드, 삿음, 교환, 딱이다, 사이즈"
운동복으로 아주 적합한 제품입니다 자주 세탁해도 괜찮아요,"적합하다, 제품, 세탁, 운동복"
퀄리티가 아주 좋은 한 옷인 것 같습니다 더운 곳에서 일하는 남편 때문에 샀는데 아주 시원하게 잘 입을 것 같아요,"남편, 때문, 퀄리티, 덥다, 시원하다"
운동할 때 항상 입는데 너무 편하고 좋아요 가성비 최고,"최고, 가성비, 편하다, 운동"
히 잘 포장된 배송을 잘 받았습니다 감사합니다,"포장, 받다, 배송"
소재도 시원하고 느낌도 좋고 핏도 좋아요 근데 생각한 소재는 아니였어요,"소재, 아니다, 시원하다"
재질이 하고 잘 마를 거 같아 디자인도 깔끔해서 운동할 때 좋을 거 같아요,"디자인, 깔끔하다, 마르다, 재질, 운동"
재질이 하고 잘 마를 거 같아 디자인도 깔끔해서 운동할 때 좋을 거 같아 요,"디자인, 깔끔하다, 마르다, 재질, 운동"
비침도 없고 옷이 입기 좋네요 사 시 능거 강추드혀요,"능거, 강추드혀, 비침"
여름에 더운데 실내 실 외 어디서든 휘뚜루 마 뚜류 입기 좋아요,"실내, 뚜류, 서든, 휘뚜루, 덥다, 여름"
운동용 잠옷 가벼운 외출 용으로 적합 활용도 높고 여름에 입 기 좋아요,"높다, 적합, 외출, 활용, 잠옷, 가볍다, 여름, 운동"
땀도 빨리 마르고 얇아서 자주 입어요 기본 티라 휘뚤마뚤 잘 입고 다닙니다,"휘뚤마뚤, 기본, 빨리, 마르고, 얇다"
가격이 엄청 싸고 엄청 시원해요 운동할 때나 작업할 때 막입기 좋아용,"작업, 싸다, 가격, 시원하다, 운동"
착화감 좋고 통기성도 우수해서 좋습니다 자주 입겠네요,"통기다, 우수하다, 성도"
땀 흡수 잘 되고 통풍도 잘 되서 좋네요 착화감도 좋습니다,"통풍, 흡수"
러닝 서브용으로 입는 중입니다 히 입고 다닐 만 합니다,"서브, 러닝"
가성비로 입을 만 합니다 집 밖 나갈 때 히 입고 다닙니다,가성비
일할 때 입으려고 샀는데 좀 까실흐긴한데 낫뱃,"낫뱃, 깔다"
디자잌 깔끔하고 멋잇어요 잘 입을 게요 많이 파세요,"디자잌, 잇다, 파다, 깔끔하다"
가성비 좋네요 여름에 시원하게 입을 수 있어서 강추,"강추, 가성비, 여름, 시원하다"
가성비 정말 좋네요 여름에 시원해요 강 추합니다,"추하다, 가성비, 여름, 시원하다"
배송이 빨라서 좋아요 가격에 비하면 가성비는 좋은 거 같아요,"라서, 배송, 가성비, 가격"
정말 시원하고 가성비 좋아요 여름에 무지 티 필요하시면 사는 거 추천 드려요,"살다, 필요하다, 드리다, 추천, 가성비, 여름, 시원하다"
이번 여름에 편하게 입을 수 있을 거 같아 요 좋아요,"여름, 편하다"
베송도 바로 오고 옷도 괜찮아요 시원할 거 같아요,"송도, 오다, 시원하다"
일반면 이 아니였네요 자세히 볼 껄 운동복 같네요,"자세하다, 일반, 아니다, 운동복"
너무 좋습니다 그렇게 근육이 있는 몸이 아닌데 팔뚝에 딱 붙어서 좀 몸이 좋아 보이는 것도 있고 기능성 티를 잘 못 입는데 그렇게 까끌거리지 않아서 이건 입기 좋아요 운동가거나 외출 때 무난하게 입고 다닐 꺼 같습니다,"끄다, 그렇게, 근육, 이건, 팔뚝, 붙다, 외출, 거나, 보이다, 아니다"
처음 사고 만족해서 한 번 더 샀어요 일할 때 입어도 좋아요,"사고, 처음, 만족하다"
운동할 때 입을 려고 샀습니다 시원한 재질에 사이즈도 해서 좋아요 저렴한 가격에 너무 잘 샀습니다,"저렴하다, 재질, 사이즈, 가격, 시원하다, 운동"
운동하면서 입을 려고 샀습니다 시원한 재질에 사이즈도 해서 좋아요,"재질, 사이즈, 시원하다, 운동"
매쉬 소재예요 면보다 시원하고 비침도 적어서 맘에 듭니다,"적다, 매쉬, 비침, 소재, 시원하다"
생각했던 쟈질은 아니긴 하지만 여름에 시원하게 입 기 좋을 거 같아요,"쟈질, 아니다, 여름, 시원하다"
