Review,keyword
우선 저는 여잔 데 크게 입을 각오하고 주문했어요 예상대로 크긴 큽니 당 엄청 커요 소매가 긴데 소매 걷어 입으면 안쪽에 코듀로이로 되어 있어서 귀여워요 주머니도 무려 개나 달려 있어요 쓰진 않겠지만 양쪽 다 크게 개씩 총 포켓이라 귀여워요 단추는 똑딱이 단추라 입고 벗기도 편하고 빈티지한 골드 버튼이라 멋스러워요 색감은 물 빠진 색감일 줄 알았는데 예상보단 선명했어 요 폭이 엄청 해서 안에 아무리 껴 입어도 충분할 거 같아 요 여성분들은 그냥 고민 없이 하시면 될 거 같아 요 짧은 바지나 치마랑 코디하면 제가 원했던 느낌이 나와서 만족합니다 남자분들이 자켓으로 입기엔 기장이 길고 코트 느낌이라기엔 또 짧은 느낌이에요 오히려 박시한 아우터 좋아하시는 여성분들께 추천 드리고 싶어요 와이드 팬츠랑 입으면 힙한 무드 연출 가능하고  짧은 옷은 여성스럽고 귀여워질 수 있어요,"크다, 주머니, 포켓, 귀엽다, 똑, 딱이다"
포인트 되는 부분들이 귀여워서 샀어요 자켓 느낌으로 입어도 예쁘고 남방 입은 것처럼 입어도 예뻐요,"귀엽다, 처럼, 자켓"
실측 엄청 크길래 사이즈 다운했습니다 사이즈 다운 해도 될 듯 다 좋은데 충격인 건 버전 나오고 나서야 드디어 배송이 옴,"드디어, 나서다, 배송, 나오다, 다운, 크다, 실측, 충격"
생각보다 색이 어둡습니다 네이비보다 거의 블랙처럼 보여 요 입을까 반품할까 고민하다가 입기로 했네요,"블랙, 처럼, 색, 어둡다, 반품, 고민, 네이비"
디자인 정말 이 뻐요 에 키 초 사이즈인데 약간 오버하게 맞아요,"사이즈, 인데, 오버, 맞다, 디자인"
우선 가성비가 정말 좋아요 이 가격에 워크 자켓이라니 얇은 데 오히려 요즘 날씨에 반 팔에 입고 벗기 딱 좋습니다 색감이 어둡고 사이즈는 오버핏이라 커요,"자켓, 이라니, 색감, 얇다, 사이즈, 팔, 어둡다, 날씨, 크다, 벗기다"
저렴한 가격에 워크자켓을 살 수 있어서 좋네요 배송은 예약 배송이라 다소 느렸고 생각보다 꽤나 얇은 두께였지만 오히려 더워지고 있는 날씨에 지금 입기에 딱이에요,"더워지다, 저렴하다, 느리다, 얇다, 예약, 가격, 배송, 날씨"
워크자켓 대 유행으로 데일리 착용을 위해 구입해봤습니다 라퍼지스토어 역시 가성비 최고입니다 특히 앞 주머니 디테일 대박입니다,"주머니, 퍼지다, 스토어, 워, 크다, 자켓, 해봤다, 데일리, 최고, 대박, 디테일, 특히, 착용"
에 키로 기준 사이즈가 정 사이즈에서 약간 오버핏으로 잘 맞아요 제가 딱 원한 사이즈감이네요,"사이즈, 가다, 맞다, 오버핏, 원한, 키로, 기준"
완전 최고맘에 듭니다 주머니 상표 등 디테일이 너무 과하지 않고 적당히 절제되어 들어갔으나 아메카지 특유의 야상 자켓 느낌이 합쳐 저 코디 범용성이 넖을 것 같습니다 좋은 소재의 웰메이드 옷 저렴하게 만났네요 카키색도 정말이쁩니다,"주머니, 자켓, 저렴하다, 최고, 카키색, 소재"
딱 지금 시기에 입 기 좋은 두께에 요 사이즈는 엄청 크다는 후기 보고 구매했는데 두 약간 긴 편이네요 소매는 한번 접어서 입으니 딱입니다 원하는 핏입니다,"사이즈, 접다, 핏입니, 크다, 딱이다, 보고"
이쁩니다 주머니도 많아서 용이 하고 목 부분 손목 부분 골지 패턴도 접었을 때 유니크해요,"손목, 주머니, 패턴, 유니크, 많다, 접다, 골지, 부분"
에스입으세영 여자분들 너무 이뻐용 박시핏에 기여워 재질도 진짜 너무 좋궁 여기 옷 마니잇는 데 살 때마다 품질이 죠아,"박시핏, 기여, 워, 말다, 잇다, 품질, 여자, 분들, 마다, 죠"
너무 예뻐용 여자 박시핏으로 에스 가능 반 바지에 반팔에 입으면 너무 날씬해 보이고 조아용 이 거 사진은 안에 기 모맨투맨을 입아서 그런 거구 용 강,"사진, 여자, 맨, 투맨, 팔, 바지, 보이, 거구, 날씬하다"
배송빨리 오고 만족합니다 사진과 동일한 제품이네요,"제품, 만족하다, 오다, 동일하다, 사진, 배송, 빨리"
데일리룩으로 입 기 좋아요 착용 감도 편하고 핏도 예쁩니다 어느 옷에 든 다 잘 어울려서 마음에 듭니다,"편하다, 데일리룩, 핏, 착용, 어울리다"
남편이 평소 사이즈 입고 가슴이 발달된 체형인데 핏 여유롭게 맞네요 인터넷 쇼핑으로 성공 확률 프로 될까 말까 인데 이번엔 성공이에 요 아우터 너무 무거우면 안입게 되고 너무 가벼워도 없어 보이는데 무게 감 딱 적당해서 봄 가을 아우터로 아주 만족입니다 여행가서 저도 한 번씩 뺏어 입었는데 물론 크지만 보기 싫을 정도는 아니였네요 라퍼지스토어 아우터 두 번째 구매인데  이제 믿음이 가네요 가성비 좋은 브랜드인 것 같아요,"인데, 쇼핑, 무게, 크다, 퍼지다, 스토어, 만족, 사이즈"
생각보다 두께감이 앏 고 사이즈가 컸지만 디자인 디테일 전부 만족합니다,"사이즈, 디자인, 크다, 만족하다, 두께감, 디테일"
정말 예쁜 자켓입니다 원단도 하고 아주 좋아요 어디에나 다 어울려 요 한 느낌입니다 치노 청바지에 다 굿이요,"청바지, 굿, 자켓, 에나, 어울리다, 원단"
바늘질 마감이 너무 안 좋아서 한 번 교환했지만 이것도 그다지 마음엔 들 진 않네요 다른 라퍼지 옷들에 비해서 바늘 질 마감 상당히 안 좋습니다 보세 옷 퀄리티보다 아주 살짝 좋은 정도네요 디자인 디테일 핏감 모두 마음에 들지만 마감이 다 말아 먹는 느낌의 옷입니다,"바늘, 질, 퀄리, 티보, 핏감, 마감"
사진으로 볼 땐 이 뻤는데 직접 받아보니 이게 무슨 옷인지 사실 좀 갸우뚱하게 됩니다 디자인도 그렇지만 핏 때문에 더 그런 것 같아 요 많이 커서 바로 세탁 건조기 코스로 좀 줄였는데 여전히 좀 부한 감이 있습니다 구매한 가격 대비 퀄리티는 괜찮아서 그 점은 만족합니다 더위가 일찍 찾아와서 요즘 입기는 힘들겠네요,"세탁, 인지, 디자인, 건조기, 사진, 퀄리티, 만족하다, 더위"
남친 선물로 구매했어요 옷 너무 예뻐요 잘 구매한 거 같아요,"선물, 남친"
딱 요즘 걸치기 좋네요 길이감이 좀 있구요 주머니 다섯 개 귀여워요 청바지랑 입어도 잘 어울리네요,"청바지, 귀엽다, 걸치다, 어울리다, 주머니, 길이감"
제품 무난해서 여러 스타일의 코디에도 잘 매치될 거 같아서 좋아요,"매치, 코디, 스타일, 여러, 제품"
사이즈가 꽤 크게 나왔네요 소매가 조금 길고 기장은 많이 깁니다,"길다, 사이즈, 나오다, 기장, 많이, 크게, 소매"
합리적인 가격에 디자인 좋은 옷을 구매해서 좋아요,"가격, 합리, 디자인"
사이즈 상당히 해요 사이즈 하나 내려서 구매하시는 걸 추천 드려요,"사이즈, 드리다, 하나, 내다, 상당하다, 추천"
너무 좋아요 여자가 입어도 잘 어울리는 옷이예요 가을 준비해 놓으려 구요 그런데 왜 한쪽 주머이는 밑에 튿어져 있죠,"예요, 튿어져, 여자, 밑, 놓다, 준비, 주, 머"
가볍게 입 기 좋은 아우터입니다 사이즈는 크게 나왔어요,"아우터, 가볍다, 나오다, 사이즈, 크게"
인데도 불구하고 오버하게 잘 맞습니다 참고하면 좋을 듯함니다,"맞다, 참고, 오버, 불구, 하고"
제품 자체는 마음에 듭니다 다 만 비닐 포장에 떼 다 남은 스티커 자국과 라벨은 옷과 분리된 상태로 들어 있어 새 상품이 아닌 것 같은 느낌이 들더군 요 이런 부분 신경 써 주셨으면 합니다,"제품, 비닐, 포장, 스티커, 상품, 분리, 자체, 남다"
에 키로 사이즈가 정말 딱입니다 부터는 너무 큽니다 강력 추천합니다,"크다, 사이즈, 추천, 강력, 딱이다, 부터는, 키로"
사길 잘한 것 같아 요 디자인이 예쁘고 핏도 예쁘네요,"자다, 디자인, 핏"
빠른 배송 너무 좋았습니다 옷은 사이즈 해서 루즈하게 입 기 좋네요,"루즈, 사이즈, 빠르다, 배송"
원하던 핏과 기장감입니다 간절기에 입으면 딱일 것 같고 멋스러운 워크 자켓이네요,"자켓, 기장감, 원하다, 핏, 딱이다, 멋, 스러운, 간절기, 워, 크다"
다른 제품들은 세탁하고 나면 색상이 쉽게 빠지는 단점이 있던 반면에 여기 제품은 색상이 세탁하고 나서 빠 않아서 정말 좋네요 주변 지인들에게도 추천 많이 했는데 다들 좋아하네요,"색상, 세탁, 하고, 제품, 쉬다, 추천, 좋아하다, 지인, 에게도"
편한 거 같아서 일 단 좋아요 편하게 입고 다닐 게요,편하다
한 사이즈 다운 추천합니다 많이 크지 않아서 좋아요,"크다, 추천, 사이즈, 많이, 다운"
스타일링 하기 너무 좋고 툭 걸치기만 해도 멋 납니다,"걸치다, 나다, 스타, 일링, 해도"
오버핏이라 크게 나오네요 평소 사이즈인데도 크네요,"사이즈, 인데, 크다, 나오다, 크게, 오버핏, 평소"
이뿝니다 이 뿌구여 이 뻐요 배송도 빠르고 실뭉이 더 이 부네요,"실뭉, 부다, 뿌구, 이뿌다, 배송, 빠르다"
디자인이 단조롭지 않으면서 너무 튀지도 않는 것이 정말 좋습니다 제 신체 사이즈에도 잘 맞구 요 좋은 옷 감사합니다,"사이즈, 디자인, 단조롭다, 맞다, 신체"
생각보다 크긴 큽니다 작은 체격은 아닌데 사이즈도 살짝 오버핏이네요 소매는 접으면 딱 맞네요 가볍게 입 기 좋을 것 같습니다 이쁘네요 근데 군대군대 마감이 살짝 아쉽습니다,"군대, 마감, 크다, 사이즈, 맞다, 접다"
간편하게 걸쳐 입기 좋을 거 같아 요 아직 입을 시기가 아니지만 미리 구매했어요 좋으면 나중에 린넨 버전도 구입 예정 입니다,"간편하다, 버전, 아니다, 나중, 시기"
많이 커서 스몰로 주문했고 잘 맞습니다 민족합니다,"주문, 맞다, 스몰, 커서, 민족, 많이"
키에 전체 기장이 기나 폭 싸이는 편안한 느낌을 원해서 전 만족합니다,"만족하다, 편안하다, 원하다, 키, 기장, 전체, 싸이다"
너무 마음에 들어 요 편해요 잘 구매 한 것 같아 요 또 구매 의사 있어요,"편하다, 의사"
배송이 빠르고 너무 좋아요 품은 좀 큰 편이에 요,"편이, 배송, 품다, 빠르다"
워크 자켓답게 살짝 원단에 힘이 있으며 활동하기에도 편하게 부드러움이 갖춰져 있습니다 감사합니다,"편하다, 자다, 활동, 원단, 부드러움, 갖추다, 힘"
첨부된 사진의 색감보다 더 진 한 남색입니다 워크 자켓답게 살짝 원단에 힘이 있으며 활동하기에도 편하게 부드러움이 갖춰져 있습니다 감사합니다,"편하다, 남색, 색감, 부드러움, 활동, 사진, 자다"
색상도 이 쁘고 사이즈도 좋고 포장도 하고 만족합니다,"색상, 만족하다, 사이즈, 포장"
봄 가을에 입 기 좋아요 좀 크긴 큰데 오버핏으로 딱입니다,"오버핏, 크다, 가을, 딱이다"
할인해서 가을에 입을 거 미리 샀어요 생각보다 길이가 긴데 뭐 사진과 동일해요,"사진, 길이, 할인, 동일하다, 가을, 미리"
배송 너무 빠르고요 오버핏으로 편하게 입기 좋을 거 같아요,"오버핏, 편하다, 빠르다, 배송"
아직 입어 보진 않았지만 라퍼지스토오 옷은 뭐 이 쁘죠,"죠, 퍼지다, 스토, 오, 아직"
워크자켓 사고 싶었는데 세일하면서 득 템했습니다 착용 감 좋고 가을에 걸쳐서 입기 딱 좋은 것 같아 요 프렌치한 느낌의 워크 자켓 찾으신다면 강 추드립니다 사이즈 오버한 느낌이라 안에 어느 정도 두께감 있는 옷을 입으면 딱 좋을 것 같아요,"자켓, 워, 크다, 착용, 가을, 두께감, 찾다, 신다"
봄 가을 초겨울 입기 좋은 워크자켓 가성비 좋고 오버핏이라 사이즈가 잘 맞네요,"워, 크다, 자켓, 오버핏, 사이즈, 맞다, 가성비, 초겨울, 가을"
생각했던 무드로 클래식 하게 입 기 좋아요 합리적 가격에 좋은 품질 이네요,"가격, 클래식, 합리, 무드, 품질"
생각했던 무드로 클래식 하게 입 기 좋아요 합리적 가격에 좋은 품질 이네요,"가격, 클래식, 합리, 무드, 품질"
착용감도 좋고 핏 색감 다 만족입니다 최고입니다,"착용, 감다, 만족, 색감, 최고"
빠른 배송 너무 만족해요 실물도 만족하구 재구매 예정입니다,"만족하다, 예정, 배송, 실물, 빠르다, 재다"
사이즈 낮춰서 큼 두껍진 않음 세일해서 좋음,"낮추다, 세일, 사이즈, 두껍다"
적당하게 큰데 일단 사이즈는 다운 하시는 걸 추천합니다,"크다, 적당하다, 사이즈, 추천, 다운"
워크자켓 하나쯤은 가지고 가야 되지 않겠습니까,"가야, 하나, 쯤, 워, 크다, 자켓, 가지"
배송 빠르게 받았어요 재질 부드럽고 무난하고 질 좋아서 만족해요,"만족하다, 부드럽다, 받다, 하고, 재질, 빠르다, 배송"
오배송으로 문제도 있었지만 결국 잘 받아서 한동안 잘 입고 다녔습니다 그런데 끝단 쪽에 실밥이 너무 많이 풀려 있어서 하나 하나 잘라주고 손대줘야 했어요 사이즈는 예상했던 것보다도 더 큰 것 같습니다,"보다도, 사이즈, 문제, 한동안, 많이"
여기저기 실밥이 보이는 것 빼고는 모두 만족합니다 사이즈는 생각한 것보다도 크고 양쪽 주머니 하단에 숨겨진 주머니까지 해서 이네요 간절기 입 기 좋을 것 같아 요,"주머니, 크다, 보이다, 사이즈, 만족하다"
너무 포멀하지 않게 편하게 걸치기 좋은 조금 두꺼운 셔켓 같은 느낌입니다,"셔켓, 편하다, 포, 멀다, 두껍다, 걸치다"
편하게 걸치기 좋은 조금 두꺼운 셔켓 같은 느낌입니다,"셔켓, 편하다, 걸치다, 두껍다"
전 광택 없이 이렇게 생긴 게 좋더라구 요 만족합니다,"구, 만족하다, 이렇게, 없이, 광택, 생기다"
생각보다 두꺼워요 가볍게 입을 아우터로 괜찮아요,"가볍다, 두껍다, 아우터"
옷 핏도 깔끔하거 좋습니다 좋은 가격에 사서 득해서 좋습니다,"깔끔하다, 득, 핏, 가격, 사서"
커플로 입으려고 하나 더 샀어요 커플로 입으니 더 이쁨,"커플, 하나"
여름 빼고는 잘 입을 수잇을 듯 옷 이 쁘고 핏도 이 뻐요,"수, 잇다, 핏, 빼다, 여름"
키 여자에게 이 정도 기장으로 떨어지구 요 초가을에 반 바지랑 코디하면 너무 이쁠거 같아 요 추천합니다,"바지, 추천, 여자, 코디, 기장, 떨어지다, 초가을"
네이비 색 구매 후 스타일이 좋아서 베이지색 추가 구입합니다,"스타일, 베이지색, 네이비, 추가"
세일 기간에 구매해서 저렴하게 잘 구입했습니다 색감은 화면으로 본 거랑 같습니다,"저렴하다, 색감, 화면, 기간, 세일"
가격 대비 실물이 좋은 옷 다른 색상도 구매 의사 있음,"색상, 실물, 대비, 의사, 가격"
잘 받았습니다 감사합니다 잘 받았습니다 감사합니다 잘 받았습니다 감사합니다 잘 받았습니다 감사합니다,받다
배송도 정말 빠르구 요 옷도 정말 이쁩니다 추천이여,"추천, 이여, 배송, 빠르다"
기장이 길어서 더 스타일 있어 보입니다 카라 밑이랑 소매 부분에 코듀로이 재질이어서 더 개성 있네 여 사이즈는 한 치수 다운하시면 될 듯 여 저는 에 입니다,"보이다, 재질, 밑, 부분, 다운"
사이즈 한 치수에서 두치 수는 크게 사야 합니당 이쁘니다 배송도 빨라요오 잘 입을께요 오,"빠르다, 오, 수, 치, 배송, 크게, 치수"
이건 보자마자 사야 된다며 네이비 카키 동시 구매한 제품 생각대로 스타일 좋음 추천,"대로, 스타일, 이건, 카키, 제품"
기장감이 일단 마음에 들고요 마감 부분도 만족해요 봄 가을에 가볍게 걸치기 좋을 거 같아 요 만족스러워요,"만족스럽다, 만족하다, 가볍다, 가을, 걸치다, 기장감"
간절기에 편하게 입으려고 샀는데 너무 마음에 들어 요 다른 색상도 구매하려고요,"색상, 편하다, 간절기"
색상도 재질도 마음에 들어 요 그렇게 무겁지도 않아서 자주 손이 가네요,"그렇게, 가다, 색상, 손, 재질, 무겁다"
사이즈가 해서 너무 편해요 간절기에 주구장 창 입었습니다,"사이즈, 간절기, 주, 구장, 편하다"
한 치수 작게 시켜도 저한테는 오버핏이네요 소매 부분 걷어서 입으면 이 쁠 것 같아요,"오버핏, 테, 걷다, 작다, 소매, 치수, 부분"
반팔티에 툭 걸치기 좋아요 생각보다 원단에 힘은 없습니다,"원단, 팔, 티, 걸치다, 힘, 없다"
생각했던 그대로의 색감이어서 만족합니다 편하게 입을 수 있네요,"색감, 편하다, 만족하다, 그대로"
라퍼지스토어 옷은 다 하지 않고 개성 있으면서 핏도 예뻐서 자꾸 구매하게 됩니다,"퍼지다, 스토어, 핏, 자꾸"
사이즈가 더 컷으면 그런데 사이즈가 딱 맞네요 이쁩니다,"사이즈, 맞다, 컷으"
질감도 너무 좋구 하나 더 구입해야겠어요 입어보니 핏도 너무 이쁘네요 잘 입을 게요,"입어보다, 핏, 하나, 질감"
색상이랑 소재는 좋은데 약간 주머니는 약한 것 같아요,"색상, 소재, 주머니, 약하다"
실제보다 사진이 밝게 나왔는데 디자인이며 핏이 좋아요 마감이 살짝 아 쉽긴 해요,"디자인, 이며, 밝다, 사진, 쉬다, 실제, 나오다, 마감"
제품질이 기대했던 것보다 훨씬 뛰어나고 만족스러워요,"만족스럽다, 뛰어나다, 기대하다, 품질"
초봄 초가을에 입 기 좋아요 최근에 날씨가 일교차 컸는데 잘 입었어요,"초봄, 날씨, 최근, 크다, 초가을, 일, 교차"
일단 디자인은 너무 마음에 듭니다 어디든 소화가 잘될 꺼 같은 느낌이랄까요 무튼 너무 마음에 드는 아이템입니다 추천합니다,"디자인, 추천, 아이템, 소화, 무, 틀다"
옷도착 후 입어보고 완전 만족 쥬말에 입고 나가야지 했는데 사고로 입원 중,"입어보다, 쥬말, 나가야, 지, 사고, 입원, 도착, 만족"
정말 예쁜 자켓입니다 원단도 하고 아주 좋아요 어디에나 다 어울려 요 한 느낌입니다,"자켓, 원단, 에나, 어울리다"
정말 예쁜 자켓입니다 원단도 하고 아주 좋아요 어디에나 다 어울려요,"어울리다, 에나, 원단, 자켓"
박음질이 하고 옷 재질이 좋아요 간절기에 입기도 좋고 스 펙 확인하여 구매해주세요 만족합니다 가성비가 좋은 것 같아 요,"만족하다, 해주다, 재질, 확인, 박음질"
보통 사이즈 즐겨 입습니다 옷이 많이 크게 나와서 사이즈 입어도 이 쁘게 잘 맞네요 너무 오버한 거 싫어 하시는 분은 사이즈 다운 하시면 어떤 핏의 바지와 입어도 이 쁘게 맞을 듯 해요,"바지, 사이즈, 맞다, 많이"
와이드보다는 반 바지나 슬림 핏이랑 입어야 예쁠 듯합니다 래도 좋마하는 스타일이가 아주 만에 들어용,"스타일, 바지, 마하, 핏, 와이드, 보다는, 래도, 만에"
소재가 하고 좋아요 사 계절 어떻게 레이어드하냐 따라 잘 입을 듯,"레이어드, 어떻다, 따르다, 소재, 계절"
사이즈 배송 디자인 모두 마음에 들어 요 번성 하세요,"사이즈, 배송, 번성, 디자인"
간절기 때 입 기 딱 좋은 얇기 고 핏도 오버핏으로 딱 좋아요 셔츠 자켓 느낌나네요,"오버핏, 느끼다, 핏, 얇다, 셔츠, 간절기, 자켓"
색상 디자인 화면이랑 똑같아 요 아무 옷에 다 어울려요,"어울리다, 화면, 똑같다, 색상, 디자인"
옷 이쁩니다 편하게 어디나 걸치기 좋아요 만족스럽네요,"만족스럽다, 편하다, 걸치다"
가격 대비 만족합니다 한 재질이고 가을에 입 기 좋을 것 같아유,"가을, 재질, 이고, 만족하다, 아유, 대비, 가격"
데일리룩으로 입 기 좋아요 사이즈가 조금 크지만 만족합니다,"데일리룩, 크다, 사이즈, 만족하다"
뭔가 평범하면서도 깔끔하게 챙겨입은 느낌의 옷이라 좋습니다,"깔끔하다, 평범하다, 챙기다, 뭔가"
한 달 동안 잘 입고 다녔어요 엉덩이 가려줘서,"가다, 엉덩이"
좋습니다 다음에도 추가 구매하고 싶어요 굿입니다,"굿, 하고, 싶다, 추가"
봄에 입 기 딱 좋아요 셔츠보다 조금 두꺼우며 예쁘네요,"셔츠, 봄, 두껍다"
색감이랑 핏이 예뻐요 봄 가을에 입 기 좋은 두께감이라 지금은 조금 아쉽지만 소장하기 좋아요,"가을, 두께감, 색감, 아쉽다, 소장, 지금"
핏이 예뻐요 아직까진 저녁에 입을 정도로 괜찮은데 더 더워지면 힘들겠네요 봄 가을 입기 예뻐요,"더워지다, 저녁, 가을, 아직, 까진, 힘들다, 핏"
핏이 이 뻐요 오버핏으로 봄 가을 입기 좋아요 잘 입을 게요,"오버핏, 핏, 가을"
이렇게 자주 입게 될지 몰랐는데 안에 깔끔한 이너 하나 입고 코튼 팬츠나 청바지 여러 바지랑 매치하기 편해서 손이 갑니다,"바지, 청바지, 편하다, 모르다, 팬츠, 가다, 매치"
정말 너무 이 뻐요 가볍게 걸치기 좋고 사이즈도 해요,"가볍다, 걸치다, 사이즈"
엄청 커요 색도 화면보단 조금 밝아요 박시하게 입을 게요,"박다, 밝다, 크다, 화면, 보단, 색도"
정도의 많이 마른 여성에게 선물했는데 오버핏으로 이쁘게 잘 맞더군요,"오버핏, 선물, 맞다, 마르다, 많이, 여성"
롱 원피스에 툭 걸치거나 숏팬츠에 입어도 잘 어울리네요,"숏팬츠, 원피스, 어울리다, 걸치다"
기장이 긴 편인 워크자켓인데 오히려 살짝 트렌치 코트 느낌도 나 고 좋네요 군 기 없이 심플해서 더 맘에 들고 옷깃을 세우거나 소매를 걷었을 때 안감으로 코듀로이 처리되어 있어 멋스럽기까지 하네요 이 가격에 대 만족이에요,"코트, 옷깃, 워, 크다, 자켓, 인데, 멋, 스럽다, 가격, 만족, 이에요, 걷다, 세우다"
가성비로 좋네요 핏도 이쁩니다 여러 색상으로 더 나왔음 좋겠네요,"색상, 핏, 가성비, 나오다, 여러"
조금 두께감이 있어서 간절기에 입어야 할 거 같아 요 배송이 늦어서 몇 번 못 입었지만 색상이나 핏이나 옷 자체는 너무 이 쁘고 좋습니다,"색상, 이나, 배송, 핏, 늦다, 두께감"
간절기 외투 휘뚜루 마 뚜루 아주아주 잘 입고 있습니다 감사합니담,"휘뚜루, 아주아주, 뚜루, 외투, 간절기"
스타일 맘에 드는 데 커도 너무 큽니 다 그래도 예뻐서 오버핏인 거 감안하고 입어요,"오버핏, 감안, 하고, 스타일, 크다"
요즘 같은 간절기에 겉옷 하나 필요할 때 막 입 기 좋아요,"겉옷, 필요하다, 간절기, 하나"
사이즈 하고 흔하지 않은 컬러와 디자인이라 툭 걸치면 스타일이 확 사는 느낌,"컬러, 디자인, 스타일, 흔하다, 사이즈, 걸치다, 살다"
사이즈도 좋고 디자인도 맘에 들어 요월까진 입 을 수 있을 거 같아요,"까진, 사이즈, 디자인"
여름까지 쭈욱 입기 편한 자켓 아주 맘에 들어 요 다른 색도 하나더,"쭈욱, 하나, 편하다, 색도, 여름"
스타일도 좋고 이쁘네요 편하고 어디든 잘 어울리는 거 같아 요 마음에 쏙 듭니다,"편하다, 스타일, 어울리다"
너무 이쁘네요 편안하고 어 디든 어울리네 요 자주 손이 갈 거 같아 요 스타일도 좋습니다,"편안하다, 어울리다, 스타일, 손, 디"
굉장히 캐쥬얼하고 좋급니 다 해서 재질도 만족합니다 잘 입겠습니다,"급, 만족하다, 캐, 쥬얼, 하고, 굉장하다, 재질"
굉장히 캐쥬얼하고 좋급니 다 해서 재질도 만족합니다 이거 좋습니다,"만족하다, 급, 캐, 쥬얼, 하고, 굉장하다, 재질"
굉장히 캐쥬얼하고 좋급니 다 해서 재질도 만족합니다,"만족하다, 급, 캐, 쥬얼, 하고, 굉장하다, 재질"
딱 기 본 느낌의 자켓이여서 잘 활용해서 입고 있습니다,"자켓, 여서, 활용"
사진상으로 보는 거와 실제로 보는 거랑 차이가 없습니다,"사진, 상, 실제, 차이, 없다"
사이즈가 생각보다 커서 사이즈도 합니다 디자인도 마음에 듭니다,"사이즈, 디자인, 커서"
기본에 충실한 워크자켓 이네요 카라 뒤 소매 끝 코듀로이 포인트도 맘에 드네요 키 작은 여성분에겐 어 마어마한 오버핏이 됩니다,"작다, 여성, 분, 에겐, 카라, 소매, 포인트, 마, 어마, 충실하다"
사이즈가 많이 힌 편이라 평소 남자 입으시는 분은 로가 도 충분히 여유 있게 맞을 것 같네요 군 기 없는 디자인이 마음에 들고 한 여름 한겨울 빼고는 잘 입을 수 있을 듯해요,"한겨울, 디자인, 평소, 남자, 편이, 맞다"
