Processed_Review,keyword
저는 사이즈 하니까 제가 원하는 길이 핏 딱 나오더라고요 저랑 같은 스펙이신 분들 참고하세요,"나오다, 참고, 사이즈, 스펙, 원하다, 길이"
맛도 리 바지에 요 가 성비 미쳤고 기장감 워싱감도 좋고 데일리 가성비 버뮤다 찾으신다면 강 추입니다,"가성비, 성비, 워싱감, 기장, 바지, 일리, 버뮤다, 추, 찾다 신다"
너무 잘 만드신 거 같아 요 무계는 보통이고 구매한 이유는 유향 따라갈려 고용 재질은 떡 좋습니다 감사합니다,"만들다, 이유, 보통, 재질, 고용, 유향"
생각보다 좀 크고 핏감이 아쉽긴 한데 하나쯤은 싸게 가지고 있기 좋아요,"가지, 크다, 싸다, 하나, 핏감, 아쉽다"
이 뻐요 평히 게 입을 수 있을 거 같구 핏도 귀욥 뽀짝해요 좋라요,"평, 핏, 뽀짝해, 욥"
버뮤다 팬치 입문으로는 딱입니다 아래로 갈 수록 퍼지는 라인이 좋습니다,"입문, 퍼지다, 버뮤다, 아래, 팬치, 라인, 수록, 딱이다"
생각한 것 처럼 핏이 잘 나와서 좋고 여름에 자주 손이 갈 거 같아요,"손, 나오다, 처럼, 여름, 핏"
너무 너무 커요 벨트 무조건 해야 댐 로 시킬까 하지만 그래도 짱 예뻥요,"무조건, 크다, 뻥, 벨트"
제 스펙에 했는데 허리가 진짜진짜 작습니다 다른 분들 어떻게 입으셨는지 모르겠어요 로 교환했습니다 저렴하게 삿는데 교환비 아쉽 근데 배송은 엄청 느림,"배송, 저렴하다, 허리, 교환 비, 작다, 스펙, 느리다"
화면이랑 색감 디자인 똑같아 요 사이즈 입는데 허리 해서 벨트는 해야 하지만 무릎 딱 가려서 좋아요 다른 곳에서도 버뮤다 몇 번 사봤는데 트릴리온 바지가 가성비도 좋고 제일 만족합니다 다 만 바지가 일자가 아닌 자로 퍼지는 형태라 취향이 아니 신 분은 참고하시면 좋을 것 같아요,"만족하다, 참고, 화면, 바지, 사이즈, 디자인, 일자, 버뮤다"
사이즈가 없어서 사이즈 샀는데 허리가 조금 많이 크네요 근데 입어보니까 핏은 괜찮지만 저보다 마르시거나 키가 작으시면 진짜 클 거 같아요,"마르다, 크다, 키, 작다, 사이즈, 사이즈, 허리, 핏"
역시 트릴리온 바지는 믿고 구매합니다 사이즈도 좋고 적당한 기장감과 핏감이 매우 만족입니다 가격도 착해서 가성비도 매우 굿,"만족, 사이즈, 바지, 적당하다, 기장, 착하다, 가격, 가성비"
워싱 있는 버뮤다 팬츠 필요했는데 이 가격이면 너무너무 좋은 상품입니다 무릎까지 오는 기장이고 여름에 입 기 제격입니다 데님 버뮤다 필요하시면 정말 추천 드립니다,"상품, 제격, 필요하다, 드리다, 가격 이면, 오다, 추천, 기장, 워싱"
무진장 할인 할 때 구매했는데 트릴리온 제품은 믿고 살만 합니다 모든 티에 어울리고 기장도 딱 무릎 정도 까지 고 오고 다만 허리가 사이즈 표 보다 살짝 작은 느낌이 긴 한데 그래도 만족 합나 다,"어울리다, 허리, 무진장, 만족, 모든, 사이즈, 할인, 합"
핏도 좋고 색깔도 이 뻐서 코디하기에도 좋고 시원해서 여름에도 잘 입고 다닐 것 같습니다,"코디, 시원하다, 여름, 색깔, 핏"
일단 동생이 마음에 들어하고 이 사이즈 입었는데 기장은 적당한 데 허리가 조금 크네효 워싱이 이 뻐효,"동생, 기장, 적당하다, 워싱, 사이즈, 허리"
일단 배송이 너무 오려 걸려서 목이 빠지는 줄 알았습니다 제가 허리는 얇고 하체가 좀 있는 체형인데 를 골반에 걸치면 기가 막히게 맞아요 근데 그걸 보고 남자친구가 똑같은 상품 다른 색을 주문했는데 너무 큰 거에 요 그래서 비교해보니까 확실히 남자친구가 주문한 상품이 허리랑 바지 통 자체가 조금 더 크더라구 요 같은 라지 사이즈였습니다 색깔마다 근소한 차이가 있는  것 같으니 참고하고 주문하세요,"걸치다, 남자친구, 배송, 주문, 확실하다, 막히다, 상품, 체형, 주문, 자체"
배송이 조금 늦은 감은 없지 않아 있는데 그래도 착용 감도 좋고 이 가격에 이 정도 퀄리티면 배송 늦은 거도 감안이 되긴 하네 여,"배송, 감안, 퀄리티, 가격, 감다, 배송, 착용, 감다"
이랑 이랑 고민했는데 딱 저한테 이 괜찮았고 다리기 신분은 도 좋을 거 같네여,"다리다, 신분, 고민"
처음으로 버뮤다 팬츠를 구매해봤어요 너무 마음에 들어 요 색깔은 이미지 사진이랑 똑같아 요 두께감도 적당해서 여름에 좋을 거 같아 요 저랑 비슷한 신체를 가지 신 분들은 사이즈로 가시면 좋을 거 같아 요 통이 조금 큰 거 같기는 한데 다 좋아요,"적당하다, 사진, 가시, 신체, 이미지, 사이즈, 버뮤다, 통"
딱 무릎에 걸치는 기장으로 이쁘게 잘 입고 있습니다 옷도 되게 한 느낌이라 모양이 잘 유지되고 만족스럽네용,"만족스럽다, 기장, 걸치다, 유지 되다, 무릎, 모양"
워싱도 너무 이 쁘고 가성비로 딱 좋은 거 같아 요 만원대로 구매 할 수 있는 버뮤다 팬츠 중에 퀄리티는 제일 좋은 거 같습니다 평소 입는데 사이즈 딱 맞았어요,"워싱, 퀄리티, 만원, 가성비, 사이즈, 버뮤다, 평소, 제일"
후기가 없길래 고민 많이 했는데 화면이랑 색감 디자인 똑같아 요 사이즈 입는데 살짝 하고 무릎 딱 가려 요 다른 곳에서도 버뮤다 몇 번 사봤는데 트릴리온 바지가 가성비도 좋고 제일 만족합니다 다 만 바지가 일자가 아닌 자로 퍼지는 형태라 취향이 아니 신 분은 참고하시면 좋을 것 같아요,"만족하다, 참고, 바지, 사이즈, 디자인, 일자, 화면, 버뮤다, 아니다, 아니다"
야구 직관 룩으로 입어봤는데 예쁘고 딱이에요 이제 두산 베어스만 야구 잘하면 될 거 같네요,"직관, 베어스, 룩, 두산, 이제, 야구, 딱이다"
허리가 조금 커서 크롭티랑 입으려면 요술단추나 벨트 해야 할 거 같아 염 안 그러면 배가 넘 많이 보임,"크롭티, 커서, 허리, 요술 단추, 보임, 배, 벨트"
이게 바로 버뮤다 팬츠라는 거군 요 허리 빼곤 엉덩이 기장 딱 맞아서 골반 살짝 위로 올려서 입었는데 무릎까지 딱 가려져서 이쁘네요 색도 생각보다 짙은 색도 모델 사진처럼 다크하고 쨍한 게 유니크해서 좋아요 좋은 가격에 잘 샀습니다 허리는 자크가 안 잠겨서 머리 끈으로 고 정시켜봤습니다 사이즈 고르실 때에 참고가 되었으면 좋겠네요,"유니크, 엉덩이, 사진, 가려지다, 올리다, 다크, 머리, 잠기다, 버뮤다"
배송은 네 너무 느려 요 옷은 허리 좀 작게 나온 거 같은데 그 점 빼고는 괜찮아요 좋은 가격에 잘 샀어요,"배송, 가격, 허리, 나오다, 작다, 느리다"
버뮤다 팬츠로 스트릿 한 맛 내기 좋아요 다만 엑스라지 갔으면 더 예쁘게 입을 수 있었을 듯,"엑스, 팬츠, 버뮤다, 내기, 스트릿"
버뮤다 팬츠 검은색 계열 찾다가 가격 디자인 맘에 들어서 구매했습니다 사이즈 표 보고 그에 맞게 사이즈 구매했는데 원래 라면 맞았어야 할 사이즈가 허리가 너무 크더라구 여 그래서 으로 교환했는데 이건 또 애매하게 작고 환불 고민하다가 좀 늘어나겠지 싶어서 으로 계속 착용 중입니다 는 아예 흘러 내릴 정도로 사이즈가 안 맞았어요 사이즈 표가 좀 오차가 큰 거 같아 요 아무튼  사이즈 얘기는 이 정도만 하고 나머지 가격적인 면이나 디자인 색감 등은 만족합니다,"가격, 고민, 오차, 만족하다, 사이즈, 사이즈, 이건, 검은색, 나머지"
바지 굿 근데 마감이 조금 아쉽고 처음 뜯었을 때 냄새가 장난 아니였으니 다들 코 막고 열길,"마감, 냄새, 막다, 처음, 열다, 장난, 바지, 아쉽다"
바지 처음엔 좀 작은 거 같았는데 입 다 보니깐 너무 편해요,"편하다, 처음, 작다, 바지, 보"
요즘 유행하는 버뮤다 데님 팬츠를 처음 사봤는데 사이즈를 로 해야 하나 로 해야 하나 고민 많이 했는데 허벅지 대비 허리가 얇아서 항상 바지 선택이 어려웠으나 이 정도면 벨트 없어도 가 하니 입 기 좋을 거 같습니다 그래도 벨트 있는 게 허리를 딱 잡아줘서 핏이 이 쁠 거 같네요,"유행, 허벅지, 선택, 항상, 허리, 사이즈, 잡다, 허리, 버뮤다"
길이 감도 좋고 두께도 적당해요 워싱 포인트도 이 쁜 거 같아요,"적당하다, 포인트, 워싱, 길이, 감다, 두께"
블프 때 만천원 주고 샀는데 잘 산거 같네요 사이즈는 허리도 딱 맞고 무릎 위로 딱 떨어지는 기장이라서 좋고 디자인은 생각보다 워싱이 그렇게 과하지 않아서 입고 다니기 좋을 거 같아 요,"만천원, 워싱, 기장, 사이즈, 디자인, 허리"
바지 귀염 네 여 허리는 약간 쨍 겼어요 마음에 들어 요 블프치고 배송도 빨랐어요,"블프, 배송, 허리, 바지, 빨르다, 귀염"
예약 배송치곤 빨리 받았으나 색상마다 사이즈 오차가 있는 듯 합니다 다른 색 바지와 동일 사이즈인데도 더 작네요 아쉽습니다,"사이즈, 배송 치다, 색상, 오차, 사이즈, 바지, 동일, 작다"
사이즈 고 하고 허리도 남고 핏도 좋네요 굿입니다,"남고, 허리, 사이즈, 핏, 굿"
디자인도 이 쁘고 가격도 괜찮은 것 같아 요 손이 자주가는 제품입니다,"제품, 디자인, 가다, 가격, 손"
무난하게 아무 옷이나 잘 어 울릴 거 같고 핏도 괜찮은 거 같아서 마음에 듭니다 허리는 딱 맞는 편이네요,"허리, 듭니, 편이, 울리다, 핏, 맞다"
배송 빠르고 팬츠 디자인도 예뻐요 품질이 최고 멋있어요,"품질, 배송, 디자인, 팬츠, 최고, 빠르다, 멋있다"
허리 거 작은 거 빼면 만족스럽습니다 이만한 반바지 없어여,"만족스럽다, 반바지, 허리, 이만, 작다, 없다, 빼다"
블랙이 그냥 블랙이 아니라 이쁜 블랙이라 좋고 워싱도 이 쁘게 들어가 있습니다 핏도 너무 좋고 저번에 구매하고 이번에 블랙으로도 구매했는데 또 한 만큼 엄청 좋고 퀄리티도 대박입니다 불편하거나 무거움은 전혀 없고 가볍고 편안 디자인과 소재인 것 같습니다,"불편하다, 소재, 전혀, 디자인, 블랙, 블랙, 블랙, 대박, 워싱"
흑청 컬러와 워싱 요즘 유행하는 어두운 컬러의 버뮤다 중 최고입니다,"컬러, 컬러, 유행, 청, 두운, 워싱, 버뮤다, 최고"
버뮤다 팬츠는 처음인데 예쁘네요 골반이 넓고 하체가 발달한 체형이라 걱정했는데 사이즈 딱이에요,"체형, 골반, 버뮤다, 처음, 하체, 발달, 사이즈, 팬츠, 딱이다"
바지 핏 예쁘고 어디에나 입어도 괜찮아요 배송 빨라요,"배송, 바지, 빨르다"
허리 사이즈가 작게 나온 거 같지만 나름 이 쁘게 입고 있어요,"허리, 사이즈, 나오다, 나름, 작다"
평소 사이즈에서 업해도 될 듯 요 공복에 입으면 괜찮은데 걱정이네요,"걱정, 공복, 사이즈, 평소, 업"
이 뻐요 배송도 빠르고 가성비 강추 무릎 절반 덮엇어요,"가성비, 배송, 강추, 절반, 빠르다, 무릎, 덮엇어"
사이즈 시켰는데 무릎 절반 정도 덮었어요 이쁩니다 배송도 꽤 빠르고 워싱도 괜찮았어요 살짝 웡 카 같긴 한데 자주 입을 것 같습니다 무엇보다도 완전 가성비 짱,"가성비, 워싱, 배송, 사이즈, 절반"
색감 화면이랑 똑같고 허리 사이즈 잘 재보고 사세요,"화면, 사이즈, 색감, 재 보고, 허리, 똑같다"
무진장 세일 할 때 샀었는데 엄청 이 쁘고 코디하기도 편해요,"무진장, 편하다, 코디 기도, 일"
핏도 예쁘고 기장도 적당하고 좋아요 다만 정말 조금 까슬거리는 느낌이 없지 않아 있습니다 그래도 너무 아프고 계속 까슬거리고 그러는 건 아니라서 하루 종일 입고 다녀도 괜찮았어요,"아니다, 적당하다, 그렇다, 기장, 종일, 아프다"
키에 다리가 안 짧아 보이면서 얇아 보이는 딱 그 절묘한 기장이라서 좋아요 엄청 해서 완전 가성비,"기장, 보이다, 가성비, 절묘하다, 키, 보이다, 다리"
흑청 데님이라서 다 잘 어울리고 편하게 입 기 좋아요,"어울리다, 청, 편하다, 데님"
통도 넓고 버뮤다 느낌이 치마처럼 팔랑 거려서 힙해요 데일리템 낙찰,"일리, 거려, 힙해, 치마, 버뮤다, 팔랑, 낙찰, 통, 넓다"
기장도 적당하고 꽤나 편해서 자주 즐겨 입을 것 같아요,"적당하다, 편하다, 기장, 즐기다, 꽤"
여행가기 전에 급하게 샀는데 다행이 알맞게 도착해서 여행 날 예쁘게 잘 입고 다녔어요 바지가 아래쪽으로 갈수록 넓어져서 치마 같은 느낌도 살짝 나 고 팔랑한 게 시원해 보이고 좋네요 허리는 좀 커서 밸트 아님 골반에 걸치고 다녀야 할 거 같아 요 재질은 데님이라 두꺼운 느낌 있어요,"여행 가기, 도착, 걸, 다행, 여행, 시원하다, 바지, 허리, 재질, 데님"
약간 크긴 하지만 그것대로 또 예뻐서 그냥 품었습니당,"크다, 품다 니당다, 그냥, 그것"
다른 건 다 괜찮은데 허리가 정말 작습니다 못 입을 정돈 아니지만 어 작 네 이 정도 치곤 매우 작은 듯,"작다, 아니다, 허리, 정돈, 작다"
부바지만 착용해 보다 가 이번에 살짝 루즈 한 이번 바지 입어봤는데 처음엔 엄청 어색했는데 막상 하루 종일 입어보니까 이보다 편한 바지가 없어요 허리는 약간 큰데 요술단추로 살짝 줄여 입으니까 괜찮습니다,"요술 단추, 종일, 착용, 부바, 바지, 이보, 바지"
보통 기본 사이즈는 마른 체격이라 좀 많이 큰 느낌인데요 이 제품은 많이 크지 않은 것 같아 좋네요 디자인 소재 색상 너무 맘에 들어요,"크다, 사이즈, 디자인, 색상, 체격, 마르다, 소재"
아들 주려고 산 건데 제가 입어보니 제 사이즈 애 허리는 좀 작습니다 단 추가 안 잠기네요 다행히 아들은 잘 맞고 디자인도 마음에 들어 하네요 싸게 잘 구매했습니다,"입어보다, 잠기다, 작다, 허리, 디자인, 아들, 사이즈, 다행하다, 아들"
바지가 너무 이 뻤어요 이번에 여 자친구랑 데이트 하면서 입어봤는데 매우 만족스럽습니다,"만족스럽다, 친구, 바지, 데이트, 입어보다, 뻤어"
일단 하고 하고 별로 차이가 없어서 그런 가 내가 입기엔 조금 작은 느낌 그래도 디테일 살아있고 그런 부분은 마음에 듬,"그렇다, 별로, 차이, 내"
배송은 일단 탈락 너무 느려 요 옷은 허리 좀 작게 나온 거 같은데 그 점 빼고는 괜찮아요 좋은 가격에 잘 샀어요,"배송, 가격, 허리, 나오다, 작다, 느리다, 탈락"
배송도 빠르고 제품 상태와 포장도 만족 했습니다,"상태, 만족, 포장, 배송, 제품, 빠르다"
워싱이 이 쁘게 잘 들어가 있어요 색 감 이 뻐서 자주 입을 거 같아요,"워싱, 들어가다"
트릴리온은 항상 사이즈 정보랑 다르게 사이즈가 들쭉날쭉인 거 같아 요 근데 이번엔 성공했어요 무신사 코디 추천보고 사 버렸어요 너무 이 뻐요 기장도 통도 모두 완벽합니당,"완벽하다, 물다, 사이즈, 추천 보고, 사이즈, 트릴 리온, 정보, 기장"
디미트리 블랙 바지 맛집이 죠 진짜 가격에 비해 고퀄리티 받을 때마다 놀랩니다 바지 벌째 구매 중인데 기본템 전투복으로 아주 만족 블프 무진장 원에 잘 얻어 갑니다,"무진장, 전투복, 퀄리티, 중, 놀래다, 만족, 디 미트, 바지, 가격"
바지 데님이 선명하고 색으로 음영을 넣어 마치 자연스러운 바지 주름도 만들어줘 흰티나 다른 밝은 계열 티들과 매치해서 입 기 딱 좋아요,"매치, 만들다, 선명하다, 음영, 자연스럽다, 티, 색, 데님, 바지"
배송은 조금 늦긴 하는데 블프라 어쩔 수 없구 디자인이나 색감은 완전 만족했습니다 길이 감도 딱 좋았구 착용 감 역시 좋습니당,"디자인, 색감, 배송, 착용, 감다, 길이"
가격 대비 이 쁘고 질도 나쁘지 않네요 평소 사이즈 입는데 허리 사이즈 작게 나온 거 같아요,"사이즈, 평소, 가격, 질도, 허리, 대비, 나오다, 작다"
좋은 가격에 기본 버뮤다 팬츠 업어가 서 좋네요 무난하게 이 뻐요,"업다, 가격, 팬츠, 버뮤다, 기본"
바지 핏 너무 이 쁘고 색감도 너무 맘에 드네요 쉐 입도 벌어지면서 떨어지는 게 너무 이쁩니다 가성비,"벌어지다, 가성비, 색감, 입도, 바지, 떨어지다"
처음 보고 딱 마음에 들었는데 직접 받아보니까 색깔도 진짜 잘 나왔고 워싱도 이 쁘게 되 있고 길이도 딱 적당해 요 근데 제가 허리가 좀 얇아서 허리는 벨트가 없으면 흘러내리더라고요 진짜 마음에 듭니다 한 주에 세 번은 입어요,"흘러내리다, 허리, 허리, 번은, 적당하다, 듭니, 워싱, 길이"
배송 빠르고 제품도 정말 마음에 들어 요 감사합니다,"배송, 제품, 빠르다"
디자인도 심플하고 반팔이랑 너무 잘 어울려 요 다른 바지들도 많이 만들어 주세요 감사합니다 잘 입겟습니다,"심플, 팔이, 디자인, 만들다, 어울리다, 바지, 줄다"
사이즈도 해서 입 기 좋아요 재구매 의사 있습니다,"사이즈, 재다, 의사"
가격 대비 퀄리티도 괜찮은 편이고 핏이 괜찮아요,"퀄리티, 편이, 가격, 대비, 핏"
다리가 짧아 보일 수 있긴 한데 예쁩니다 힙하고 귀여워요,"힙, 다리, 보이다, 짧다, 귀엽다"
깔끔한 바지인 것 같아 요 이 뻐요 짱 굿 퍼퐥입니다,"바지, 퍼퐥입니, 깔끔하다"
디자인이 예쁘고 색이 정말 마음에 들어 요 강 추합니다,"추하다, 디자인, 색"
이라 허리가 작았지만 살 빼서 입고 싶을 만큼 핏도 괜찮고 가격도 괜찮아유,"가격, 허리, 이르다, 작다, 핏, 싶다, 빼다, 아유"
데일리로 패션 내기 좋았습니다 너무 추전 드려요,"일리, 드리다, 추다, 패션, 내기"
사이즈 완전 딱 맞고 너무 예뻐요 색깔별로 사고 싶을 정도,"사이즈, 사고, 싶다, 색깔 별로, 맞다"
별 기대 안 하고 구매했는데 이게 뭐 시 여 이 리 이 뻐도 돼 다른 색 또 살게유,"살 유, 기대"
모든 상의와 어울리고 이 쁘긴 하지만 가격이 싼 이유가 있는 거 같습니다,"어울리다, 상의, 가격, 이유, 모든, 쁘긴"
저한테는 조금 작아서 누나한테 줬는데 좋아하네요,"테, 누나, 작다, 좋아하다, 주다"
가격도 싸고 좋아요 허리가 생각보다 좁은 데 그래야 핏이 사니 봐줍니다,"줍다, 가격, 좁다, 허리, 싸다, 살다, 래야, 핏"
디자인이 마음에 들고 제가 원했던 핏이 나와서 좋네요,"나오다, 디자인, 핏, 원하다"
너무 편하고 데일리로 입 기 좋은 거 같습니다 가 성비 좋습니다,"성비, 편하다, 일리"
너무 너무 이 쁘고 사람들이 많이 사서 입었으면 좋겠어오,"사람, 사서"
바지가 두께가 있어서 합니다 핏도 예쁘고 좋습니다,"바지, 핏, 두께"
핏 예쁘고 빈티지한 색 금도 너무 마음에 들어 툐 기장도 길어서 제가 원하던 핏입니다,"빈티, 기장, 원하다, 금도, 핏입니"
옷도 세일할 때 잘 샀고 워싱이 너무 이 뻐서 자주 입을 것 같아요,"워싱, 일"
딱 원하던 핏의 버뮤다 팬츠여서 여름에 애용했어요,"팬츠, 여름, 원하다, 버뮤다, 핏, 애용"
기장이 젤 마음에 들었어요 생각보다 허리가 크지 않으니 평상시 생각보다 한 치수 더 크게 사시는 게 좋을 것 같아요,"평상시, 기장, 크다, 허리, 크게, 사시, 치수"
핏 예쁘고 색감도 예쁜데 허리가 조금 커서 벨트 매야 할 것 같아요,"허리, 색감, 커서, 매다, 벨트"
제가 딱 원하는 핏이어서 좋았고 허리가 조금 크긴 한데 입을 만 합니다,"원하다, 허리, 크다, 핏"
좋아용 튀지 않고 한 워싱 찾고 있었는데 딱이네요,"워싱, 딱이다, 튀다, 찾다"
허리가 약간 크긴 하지만 괜찮아요 다리 두꺼워 보일까 봐 걱정했는데 안 두꺼워 보여 요 핏 예쁘고 여기저기 입 기 좋습니당,"여기저기, 허리, 크다, 보이다, 다리, 니당다, 보이다"
원하던 상품이라 빠르게 배송 잘 받았습니다 재구매 의사 있음,"상품, 배송, 재다, 의사, 원하다, 빠르다, 받다"
워싱 예뻐요 가을 까지 잘 입을 거에 요 무겁기 한데 데님이니까,"무겁다, 워싱, 가을, 데님"
예쁘게 잘 입고 있습니다 블프 때 사 서 만족 중이에요,"중이, 만족, 블프"
사이즈 잘 고르셔야 할 듯 허리가 진짜 작아서 복부 비만러들은 사이즈 무조건 하나 더 크게,"비만 러, 무조건, 허리, 사이즈, 작다, 하나, 복부, 크게, 고르다"
마음에 들어 요 핏도 깔끔하고 허리도 맞습니다 잘 입겠습니다,"허리, 핏, 맞다, 깔끔하다"
와 이 거 후기 좋은 이유가 다 있었어요 핏 너무 이 뻐요 여성분들 적당히 로우 라이즈 느낌나게 입을 수 있어요 여자 바지 인데 딱이에요,"여성, 적당하다, 이유, 라이즈, 여자, 바지, 로우"
갖고 있는 버뮤다 중에 제일 예쁨 다른 색도 사야겠다,"색도, 버뮤다, 중, 제일, 갖다"
생각보다 짧아서 무릎이 다 보이지만 너무 예쁨 잘 입을 듯 싶어 용,"보이, 짧다, 싶다, 무릎"
편하게 막 입 기 좋고 재질도 나름 부드럽고 시원해요,"시원하다, 편하다, 부드럽다, 재질, 나름"
패션에 관심 없지만 유행에 떨어지게 입고 싶지 않아서 구매해 잘 입고 있습니다 학원 갈째,"유행, 패션, 학원, 관심, 없다, 싶다"
워싱 들어가 있는 게 너무 이쁘게 잘 빠졌어요 길이도 딱 제가 원하는 길이라 너무 만족합니다,"만족하다, 원하다, 워싱, 들어가다, 길이, 길이"
핏이 너무 이 뻐요 아무도 안 입고 저만 입었으면 좋겠습니다 제발 사지 말아주세요,"말다, 사지, 제발"
옷은 예쁜데 생각보다 허리가 작습니다 그리고 안 쪽 마감이 생각보다 거칠어서 좀 따까웠어용,"마감, 거치다, 작다, 허리, 따다 웠"
워싱이 이 쁘게 들어가 있어서 맘에 듭니다 무난한 색상이라 코디하기에도 편함,"코디, 색상, 워싱, 들어가다, 듭니, 편하다"
색깔도 맘에 들고 핏도 오버핏 정도 되서 너무 예뻐요,"오버핏, 색깔, 되다, 핏"
받지도 않고 확정지었잖아 한 잔해 사진만 봐도 넘 예뻐여,"사진, 잔해, 확정 지다, 받다"
예쁘고 핏도 딱 맞아 떨어져요 사이즈도 딱 맞아요 강 추합니다,"사이즈, 추하다, 맞다, 맞다, 떨어지다, 핏"
생각보다 기장이 짧아서 애매하긴 한데 이 뻐서 입을 것 같아오,"기장, 애매하다, 짧다"
핏이 너무 좋아요 그리고 워싱도 너무 잘 빠졌습니다 입 기 좋습니다,"워싱, 핏, 빠지다"
생각보다 밑통이 큰 느낌이었는데 색감이 너무 이 뻐서 아주 잘 입고 있음,"색감, 밑통, 느끼다"
허리는 좀 끼지만 핏이 정말 너무 예뻐요 잘 입을 게요,"허리, 핏, 끼"
핏도 이 쁘고 워싱도 맛있어서 지금 안 사면 후회합니다,"워싱, 사면, 지금, 후회, 맛있다, 핏"
진심 내가 산 버뮤다 중 가장 핏 예쁜 바지에 속해요 통 적당히 넓어서 예쁘고 뒷포켓이 귀여으요 근데 건조기 돌리지 마세요 줄어들 음,"적당하다, 건조기, 진심, 줄어들다, 속, 가장, 바지, 말다, 돌리지, 버뮤다"
핏이 너무 예뻐서 손이 자주 가는 아이템입니다 근데 앉아 있을 때 배 쪽이 조금 작은 느낌이 듭니다 저랑 같은 스펙이신 분들 참고하세요,"아이템, 참고, 가다, 손, 듭니, 스펙, 작다"
기장도 딱 좋고 색감도 짱이 뻐요 그렇게 불편하지도 않아요,"불편하다, 기장, 색감, 짱"
핏도 좋고 기장도 무릎에 딱 걸쳐 요 허리에 걸치긴 하는데 안정감 있게 입고 싶으면 벨트 착용하는 게 좋을 듯해요,"걸치다, 걸치다, 착용, 기장, 안정감, 허리, 핏"
바지가 부드럽고 그렇다고 흐물 하지 않아서 너무 좋아요 그리고 너무 예뻐요,"부드럽다, 바지, 흐물"
허리가 큰 편이고 소재가 무거워서 입 기 조금 부담스럽지만 그래도 예쁘고 활동하기도 편해용,"편하다, 부담스럽다, 편이, 활동, 소재, 허리, 무거워"
허리가 딱 좋게 나왔습니다 디자인 좋고 기장도 딱 알맞아용,"기장, 허리, 디자인, 알맞다, 나오다"
어제 상품을 받아서 매우 만족합니다 디자인이 좋고 스타일도 멋지네요 저와 제 친구들도 모두 구매했어요 정말 추천합니다,"만족하다, 추천, 친구, 스타일, 디자인, 상품"
