Processed_Review,keyword
배송도 빠르고 사이즈도 괜찮아요 다만 허리가 좀 작게 나오는 거 같아요,"사이즈, 배송, 허리, 나오다, 작다, 빠르다"
색감 미쳤어요 할인할 때 샀는데 잘산 듯합니다 히힣,"색감, 할인, 잘살다, 미치다"
원단질감도 좋고 컬러 워싱도 맘에 들어 요 핏 감 좋습니다,"질감, 워싱, 컬러"
바지 이 뻐요 반바지 필요 햇 능데 잘 산더 같네요 구매 의사 잇어여,"반바지, 바지, 의사, 산더, 능데, 필요, 잇다"
생각보다 바지 통이 크긴 했는데 길이도 맘에 들고 색깔도 예뻐요,"길이, 통, 크다, 바지, 색깔"
사이즈 하고 딱 원하는 느낌입니다 평소 사이즈보다 한 치수 크게 사셔도 좋을 거 같아요,"사이즈, 사이즈, 평소, 원하다, 치수, 크게"
사실 옷 자체만 받았을 땐 별로 일 것 같았는데 입어보니 은 근 이 쁘네요 자주 입고 다닙니다,"입어보다, 사실, 자체, 쁘네, 받다, 별로"
워싱 너무 이 쁘고 사진이랑 색감 완전 똑같고 이 뻐요,"사진, 워싱, 색감, 똑같다"
옷 소재도 괜찮고 요즘 유행하는 팬츠 입문용으로도 괜찮습니다,"입문, 유행, 소재, 팬츠"
교복처럼 입고 있읍니다 워싱이 부담스럽진 않을까 했는데 생각보다 아무데나 잘 어울려서 조아요,"부담스럽다, 어울리다, 교복, 워싱, 읍니"
바지 색도 이 쁘고 사이즈도 잘 맞아서 아주 기분이 좋습니당,"사이즈, 바지, 기분, 색도, 니당다, 맞다"
배송 빨랐고 바지도 이 뻐요 근데 다른 색상으로 같은 사이즈를 주문해서 입어봤는데 블랙 색상이 좀 더 작았어요 색상마다 사이즈 차이가 있는 것 같아 요 두께도 조금 있는 편이라 지금은 살짝 덥지만 바지가 이 뻐서 괜찮아요,"색상, 덥다, 사이즈, 색상, 색상, 바지, 사이즈, 주문, 바지, 차이"
워싱 디테일이 예술이에 요 특히 아래쪽에 붓으로 칠한 듯한 디테일이 돋보여요,"디테 일이, 워싱, 칠하다, 예술, 아래쪽, 붓, 돋보이다"
커요 근데 예뻐요 너무 허리가 살짝 커서 벨트하고 입으니 잘 맞구 요 바지가 예뻐서 맨날 입고 다니고 싶네요,"크다, 커서, 허리, 벨트, 바지"
옷 예쁘고 평소에 입는 코디랑 잘 맞아서 좋아요 자주 입을 듯,"평소, 코디, 맞다"
제 기준 사이즈는 괜찮게 맞습니다 핏이 조금 퍼지는 감이 있지만 디자인 괜찮고 워싱도 이 쁘게 들어가 있어 자주 찾아 입을 것 같습니다,"사이즈, 워싱, 퍼지다, 디자인, 기준, 들어가다"
배송 시킨 날 기준 이틀 뒤에 왔습니다 포장 이중으로 깔끔하게 되어서 왔어요 색감 사진에 있던 그대로의 색감입니다 상품 상태 실밥 같은 게 조금 나와 있어 라이터로 살짝 정리했습니다 그거 제외하곤 다 괜찮아요 사이즈 키 몸무게 운동 쪼끔하는 여자 기준 허리랑 엉덩이 알맞게 맞고 버뮤다라 나머지는 해요 핏 그냥 볼 땐 몰라도 입어보면 살짝 퍼지는 감이 없지 않아 있는데  그래도 이쁩니다 총평 가격 대비 나쁘지 않은 것 같고 워싱도 이 쁘게 들어가 있어 잘 입을 것 같습니다,"엉덩이, 이중, 운동, 사이즈, 그대로, 입어보다, 색감, 평, 모르다, 여자"
색상도 이 쁘고 너무 옷감이 좋아요 또 구매하고 싶네요,"색상, 옷감, 싶다"
색깔도 빈티지스럽게 예쁘고 통도 커서 편한 데님 반바지에 요 빈티지 스타일에 제격인 것 같아 요 추천합니다,"빈티 지다, 추천, 스타일, 제격, 반바지, 빈티, 편하다, 커서, 데님, 통"
사이즈도 딱 맞고 기장감이 너무 좋아요 색깔도 예쁘고,"기장, 사이즈, 색깔, 맞다"
색감도 맘에 들고 가격도 괜찮고 실물 색감이 훨씬 괜찮아요,"색감, 색감, 가격, 실물"
우리 아들이 옷살 때는 무신사에서만 주문합니다 너무 좋아요 좋아요 좋아요,"사, 주문, 아들, 옷살"
옷 예뻐서 놀러 갈 때 자주 입습니 당 워싱 맘에 들어용,"워싱, 입습, 놀다"
옷 예쁘고 편해서 자주 입습니 당 워싱도 잘 들어가서 굉장히 맘에 들어용,"편하다, 들어가다, 워싱, 입습, 굉장하다"
워싱이 너무 맘에 드는 버뮤다 팬츠 마른 중 남자 아이에게 너무 커요 사이즈 때문에 반품할까 고민했지만 옷 자체가 이 뻐 내년에 입으려고 킵합니다,"킵합니, 워싱, 사이즈, 크다, 내년, 버뮤다, 마르다"
딱 제가 원하는 색감입니다 퀄리티도 좋은 편이고 핏도 예쁩니다,"퀄리티, 색감, 원하다, 편이, 핏"
허리가 얇은 편이라 조금 큰 감이 있으나 기장은 딱 원했던 길이여서 만족했어요 소재가 좀 무거워서 입고 운동이나 활동적인 걸 하기엔 불편해 요 디자인은 예뻐요,"활동, 길이, 허리, 기장, 운동, 디자인, 소재, 무거워"
블랙 이어도 하지 않기 여러 포인트가 들어가 있어서 너무 좋아요,"포인트, 이어도, 여러, 들어가다, 블랙"
디자인도 괜찮아요 이쁜 것 같아서 자주 입게 돼요,"디자인, 돼다"
예쁘고 좋아요 살 때는 제일 작은 사이즈가 미디움 뿐이라 미디움으로 샀는데 허리가 커서 흘러내리 긴 해요 그래도 오버핏 느낌나서 괜찮구 색감 디자인 전부 너무 예뿝니더,"미디움, 흘러내리다, 허리, 미디움, 사이즈, 디자인, 커서, 색감"
트릴리온 바지 인생 바지 너무 예쁘고 잘산 거 같아 요 다음에는 긴 바지도 구매할 게요,"인생, 바지, 트릴 리온, 바지, 잘살다"
버뮤다 검정 중에 제일이 뿐 듯 기장 핏 다 맘에 들어오,"검정, 들어오다, 기장, 제일, 중, 버뮤다"
배송도 빠르고 핏도 예뻐요 세탁 후 변형도 없고요 건조기에 돌려도 멀쩡합니다,"변형도, 건조기, 배송, 돌리다, 세탁, 핏, 없다, 빠르다, 멀쩡하다"
여름에 입 기 좋아요 허리가 살짝 작은데 이 정도면 감안하고 입기 좋네여,"감안, 여름, 허리, 작다"
아주 나이스 색 감 쵁크 디자인 쵁크 외모 쵁크 굿입니다,"디자인, 나이스, 쵁크, 외모, 굿"
이쁘고 기장이 길어서 일반 버뮤다보다 좋아요 꼭 구매해 보세요,"기장, 버뮤다, 일반"
너무 이쁩니다 색감도 그렇고 핏도 그렇고 완전 강추드려요,"강추 드리다, 색감, 그렇다, 핏"
이 가격에 워싱이며 핏이며 디테일 다 좋습니다 가 성비 좋아서 여름에 잘 입을 수 있어요,"워싱, 디테일, 성비, 가격, 여름, 핏"
핏이 예쁩니다 허리는 사이즈가 작은 편이니 참고하세요,"허리, 참고, 사이즈, 편이, 작다, 핏"
걍 제 몸 그 자체에 요 제 본체 그냥 개 이 뻐 그냥 입어요,"자체, 본체, 그냥"
바지 길이가 딱 적당해서 입 기 아주 좋은 거 같아요,"적당하다, 길이, 바지"
가격은 괜찮은 편인데 길이는 딱 맞지만 옆으로 너무 커요 치마 같은 느낌으로 됨 아쉬운 편임,"편, 편임, 가격, 크다, 길이, 치마, 옆, 아쉽다, 맞다"
입기 좋아요 편해요 최고에 요 이 뻐요 막 쓰기 졸아요,"편하다, 졸다, 쓰기, 최고"
배송 빠르고 두껍지 않아서 여름에 입 기 좋은 것 같아요,"여름, 배송, 빠르다, 두껍다"
배송 빠르고 여름에 입 기 좋아요 두껍지 않아서 좋은 것 같아요,"여름, 배송, 빠르다, 두껍다"
바지 원단도 맘에 들고 무엇보다 색감과 패턴이 예쁜 거 같아 요 버뮤다 팬츠는 처음 코디해보는데 원래 있던 옷들이랑도 무난하게 잘 매치 될 거 같습니다,"코디, 매치, 버뮤다, 색감, 패턴, 팬츠, 처음, 원단"
상품 사진 색감이랑 실물 색상 비슷하고 검정색이라 매칭도 쉬워요,"검정색, 매칭, 색감, 색상, 사진, 상품, 실물, 쉽다"
실물이랑 상품 사진 색감 비슷하고 블랙이라 매칭하기도 쉬워요,"매칭, 실물, 사진, 블랙, 상품, 색감, 쉽다"
화면이랑 색까 똑같고 워싱도 예쁘게 들어가서 강력 추천해용,"추천, 화면, 강력, 들어가다, 워싱, 색 끄다, 똑같다"
청색이 예뻐서 또 주문한 건데 역시 마음에 들어 요 크롭 니트나 반팔이랑 입으면 찰떡입니다,"청색, 팔이, 크롭, 주문, 니트"
기장도 적당하고 핏도 너무 예뻐서 마음에 들어요,"적당하다, 기장, 핏"
첫 버뮤다 도전이 엇는데 배송도 빠르고 핏도 너무 예뻐서 만족해 용 상의 아무거나 휘뚜루마 뚜루 입어도 예뿌고 넘 편해뇽,"편해뇽, 만족하다, 도전, 상의, 배송, 거나, 버뮤다, 휘뚜루 마"
살까 말까 고민했는데 사니깐 확실히 좋네요 추천합니다,"추천, 확실하다, 살다, 사, 말다, 고민"
굉장히 이 쁘고 색감도 똑같아서 많이 입을 거 같아요,"색감, 똑같다, 굉장하다"
생각보다 사이즈가 작아서 못 입고 있어요 다른 부분보다 허리가 너무 작아서,"부분, 작다, 사이즈, 허리"
가성비로 사게 돼서 너무 좋고 핏도 예뻐요 가을까지 잘 입을 게영,"가성비, 게영, 핏, 돼다, 가을"
워싱도 너무 이 쁘고 가성비로 딱 좋은 거 같아 요 만원대로 구매 할 수 있는 버뮤다 팬츠 중에 퀄리티는 제일 좋은 거 같습니다 평소 입는데 사이즈 딱 맞았어요,"워싱, 퀄리티, 만원, 가성비, 사이즈, 버뮤다, 평소, 제일"
워싱도 너무 이 쁘고 저는 길이가 무릎쯤 왔으면 좋겠었는데 딱 좋은 옷을 찾은 거 같네요,"워싱, 길이, 찾다, 오다"
처음 구매한 버뮤다인데 성공한 거 같아서 기분이 좋아여,"성공하다, 버뮤다, 기분, 처음"
트릴리온 옷은 늘 한 사이즈 크게 사는 게 맞는 듯 이벙엔 한 사이즈 크게 샀더니 잘 맞아요,"이벙, 사이즈, 트릴 리온, 크게, 살다, 맞다, 맞다"
세일할 때 싸게 구매했는데 괜찮네요 무난무난해서 편하게 코디하기 좋은 것 같아오,"일, 코디, 편하다, 싸다"
길이 감 좋고 블랙 계열을 선호해서 너무 야무진 바지인데 생각보다 허리가 작네요,"선호, 바지, 허리, 길이, 블랙, 작다, 야무지다"
색감도 이 쁘고 사이즈도 잘 맞아요 다음에도 재구매 의사 있어요,"사이즈, 색감, 의사, 재다, 맞다"
키에 비해서 조금 많이 컸지만 그래도 예쁘고 입을 만해용,"비, 키, 크다"
평소 인데 입으니 딱이네요 입으면 작았을 거 같습니다,"평소, 딱이다, 작다"
사이즈도 괜찮고 재질도 두꺼워서 제 마음에 드네요,"사이즈, 재질, 두껍다"
사이즈를 잘 몰라서 고민하다 시켰는데 딱 맞게 시킨 거 같아서 너무 좋습니다,"모르다, 사이즈, 고민, 맞다"
정말 예쁘고요 배송도 엄청 빨라서 좋아요 맘에 쏙 드네요,배송
보통 사이즈 많이 입는데 이건 사이즈도 타이트 하네요 뭐 입다 보면 늘어나겠죠 그 외에는 기장도 적당하고 힙합니다 여행가서 잘 입을께요,"힙합, 여행가, 사이즈, 적당하다, 사이즈, 이건, 기장"
생각보다 작아서 한 사이즈 크게 입어야 할 꺼 같아요,"작다, 사이즈, 크게"
배송도 빨리 오고 색상이며 전반적으로 코디할 때도 좋아요,"색상, 전반, 배송, 코디, 오다"
밑단 통도 넓고 색상이며 좋은데 사이즈만 업해도 될 듯합니다,"색상, 업, 사이즈, 통, 밑단, 넓다"
흑청 버뮤다는 처음인데 너무 크지도 작지도 않고 딱 몸에 핏 좋게 맞아서 너무 휘뚜루마 뚜루 잘 입고 있어요,"크다, 청, 버뮤다, 처음, 몸, 휘뚜루 마"
이 가격에 이 정도 디테일에 핏감이면 너무 좋네요 워싱도 예뻐서 어떤 옷이든 잘 어울려 요 무릎에 딱 걸치는 기장이라 다리 짧아 보이지도 않아요,"기장, 어울리다, 보이지, 워싱, 걸치다, 디테일, 가격, 다리"
살이 쪄서 허리가 좀 작긴 한데 다이어트 생각도 들 고 좋네요,"다이어트, 허리, 살이, 작다, 찌다"
바지 디자인 정말 이 쁘고 좋습니다 자주 입을 듯 해요,"디자인, 바지"
바지 디자인 정말 이 쁘고 좋습니다 자주 입을 듯 해요,"디자인, 바지"
버뮤다 팬츠 하나 샀어야 했는데 데님에다가 워싱까지 있고 또 할인할 때 싸게 산 거라 만족 중에 있습니다 사이즈가 좀 큰 거 같아서 조금 아쉬웠어요,"데님, 버뮤다, 사이즈, 만족, 할인, 팬츠, 중, 싸다"
허리가 작게 나온 바지 같아 요 다른 바지보다 작아 요 교환 배송 기간이 좀 걸렸아요 보기에 더워 보이긴 하지만 나름,"허리, 바지, 보이다, 기간, 나오다, 바지, 보기, 배송, 작다"
예쁘고 살짝 크긴 한데 디자인도 마음에 들고 배송도 빨라요,"크다, 디자인, 배송, 빨르다"
생각보다 스크레치가 밝게 나 있네요 그래도 맘에 들어요,"스크레치, 밝다"
많이 두껍지는 않아서 여름에 입 기 좋은 거 같아요,"여름, 두껍다"
텅 크고 재질 좋고 허리는 좀 작게 나온 거 같지만 맘에 들어용 이 뻐요,"허리, 재질, 크다, 나오다, 작다"
디자인 예쁘고 배송이 엄청 빨라 요 싸게 잘 샀어요,"배송, 디자인, 싸다, 빨르다"
여름에 입기엔 조금은 더운 두께감이지만 예뻐서 자주 입어져요,"여름, 덥다, 두께"
밑 위 기장이 조금 찗아서 가랑이가 뒤질 것 같지만 옷이 너무 예뻐요 허리 기 징도 해서 뷔페에서도 살아남을 것 같슴 다 느무 이 뻐여,"가랑이, 기장, 허리, 징, 살아나다, 느무"
저한테는 살짝 작긴 한데 그래도 입을 수는 있습니다,"테, 수, 작다"
진짜 너무 예뻐요 핏도 예쁘고 뭐 하나 안 예쁜 게 없어요 진짜 너무 잘 입고 있어요,"하나, 핏, 없다"
세탁 후 변형도 없고 디자인도 예쁘고 핏도 좋아요 이 가격에 이런 바지는 없을 것 같네요,"변형도, 디자인, 가격, 이렇다, 바지, 세탁, 핏, 없다"
핏이 이 쁘네요 워싱도 이 쁘고 사이즈도 좋습니당,"워싱, 사이즈, 쁘네, 핏, 니당다"
길이가 적당해서 맘에 들어 요 워싱도 이 쁘게 들어 있고 역시 바지 맛집,"적당하다, 길이, 워싱, 바지, 맛집"
살까 말까 고민했던 시간이 아까운 워싱도 예쁘고 얇아서 만족,"만족, 워싱, 얇다, 아깝다, 살다, 말다, 고민"
배송이 빠르고 이 가격에 이 퀄리티 찾기 힘듭니다 이쁘게 잘 입을 게요 사이즈도 딱 맞습니다,"배송, 사이즈, 가격, 퀄리티, 힘드다, 찾기, 빠르다"
배송이 빠르고 이 가격에 이 퀄리티 찾기 힘듭니다 이쁘게 잘 입을 게요,"배송, 가격, 퀄리티, 힘드다, 찾기, 빠르다"
처음에 사이즈 안 맞아서 환불했다가 다시 시켰는데 조금 여유 있어서 훨씬 편한 거 같아 요 포장도 잘 되어 있고 만족스럽습니다,"만족스럽다, 여유, 처음, 사이즈, 포장, 편하다, 다시, 환불"
처음에 사이즈 안 맞아서 환불했다가 다시 시켰는데 조금 여유 있어서 훨씬 편한 거 같아 요 포장도 잘 되어 있고 만족스럽습니다,"만족스럽다, 여유, 처음, 사이즈, 포장, 편하다, 다시, 환불"
옷이 예쁘고 굉장히 편합니다 매우 매우 좋습니다,"편하다, 굉장하다"
허리가 작아서 좀 불편 하지먼 이 뻐용 살 빼거 다시 입자,"멀다, 허리, 입자, 작다, 다시, 불편, 뻐용, 빼다"
배송이 빨리 오고 부드럽고 색도 잘 나와서 예쁘네요,"배송, 나오다, 부드럽다, 색도, 오다"
생각보다 상품 허리가 얇아서 한 치수 크게 가도 될 것 같지만 그냥 딱 맞게 입고 있급니 다 디자인 색감 이쁘구요 버뮤다 처음 입어보는데 아주 마음에 듭니다,"입어보다, 버뮤다, 허리, 디자인, 듭니, 색감, 상품, 처음"
바지 통이 생각보다 커서 약간 치마바지 같아 보일 때가 있긴 한데 나름 귀여움 그래도 가격 대비 만족합니다,"만족하다, 치마 바지, 대비, 바지, 보이다, 가격, 통, 커서"
고민 많이 하고 샀는데 실물 색감은 좀 아쉬웠으나 가격 대비 좋고 허리는 딱 맞습니다,"색감, 허리, 실물, 고민, 대비, 가격, 아쉽다"
이 뻐요 사이즈도 딱 맞고 워싱도 맘에 들어 요 매우 만족합니다,"만족하다, 사이즈, 워싱, 맞다"
반바지 필요해서 구매했어요 좋은 가격과 품질 만족합니다,"필요하다, 만족하다, 가격, 반바지, 품질"
좋은 가격으로 구매했어요 옷 얇고 칼라 이 뻐서 잘 입어지겠어요,"가격, 칼라, 얇다"
편하고 디자인도 예뻐서 자주 입을 것 같아 요 만족합니다,"만족하다, 편하다, 디자인"
무릎 완전히 덮는 걸 생각했는데 그 정도 기장감은 아니라서 저랑 비슷한 체형이면 한 사이즈 업 하시는 거 추천 드립니다 핏은 아주 조아 요 너무 세모 모양으로 떨어도 않고 여름 애착템입니 당 굿,"애착, 아니다, 드리다, 완전하다, 사이즈, 기장 감다, 체형, 추천"
이 바지는 입문하기에 딱 좋은 것 같습니다 잘 입을 개요 감사합니다,"입문, 바지, 개요"
진짜 제가 딱 우하는 느낌입니다 정말 만들어 주신 분에게 사랑을 전해요,"전해, 사랑, 만들다, 주신, 분"
예쁘고 자주 입고 편해서 좋아요 또 살 거 같습니다,편하다
바지 중에 제일 자주 입어요 제일 예쁘고 핏 좋아요,"중, 제일, 바지"
비지 통이 크고 넓고 색감이 정말 예뻐서 좋은 것 같아요,"통, 색감, 비지, 크다, 넓다"
동생 사줬는데 너무 잘 입고 다녀 요 예쁘고 사이즈도 딱 맞네요,"동생, 사이즈, 사주다, 맞다"
이 바지 진짜 레전드 이 뻐요 왜 이 제 샀 나 싶어요 잘 입을 게요,"레전드, 바지, 싶다"
사이즈를 잘못 보고 사서 약간 작지만 살 조금 빼고 입으면 좋을 거 같아 요 이 뻐요,"사이즈, 작, 사서, 보고, 잘못"
바지 색감이 너무 예쁘고 허리 통이 생각보다 작아서 한 치스 크게 사면 좋을 듯해요,"색감, 작다, 통, 사면, 허리, 바지, 치스"
어떤 티에도 어울리는 것 같아 요 양말까지 긴 거 신어주면 진짜 예뻐요,"신다, 어울리다, 티, 어떻다, 양말"
무난하고 할인해서 샀는데 어떤 코디에도 어울리는 것 같아서 국밥 같네요,"할인, 어울리다, 코디, 국밥, 어떻다"
핏이나 색감이 넘 좋고 재질이 해용 한 여름에 입기에는 좀 더울지도 모르지만 잘 입어 보겠습니다,"덥다, 색감, 재질, 모르다, 여름, 핏"
여름에 입기엔 살짝 더울지도 그래도 핏과 색감이 넘 젛아서 잘 입을 것 같아용,"덥다, 색감, 여름, 젛아, 핏"
요새 더워서 그냥 휘뚜루마 뚜루 마구마구 입기 너무 좋아요,"덥다, 요새, 휘뚜루 마, 뚜루, 그냥"
길이 적당하고 얇고 착용 감 만족합니다 근데 오늘 타임 세일 하네요,"만족하다, 적당하다, 오늘, 착용, 일, 길이, 타임, 얇다"
사이즈 안 맞을까봐 걱정했지만 너무 잘 맞고 예뻐서 자주 입게 됩니다,"사이즈, 맞다, 맞다, 되다, 걱정"
다 좋은데 허리 사이즈가 좀 작음 차라리 단면 말고 둘레로 해줬으면 더 알아먹기 쉽지 않았을까 물론 단면도 고려하고 산 건데 작아서,"알 먹기, 고려, 단면도, 허리, 사이즈, 둘레, 작다, 단면"
이쁘긴 하고 색 감 좋고 다 좋은데 사이즈가 왜 이렇게 작은 지 허리 단면이면 둘레는 대충 되는데 진짜 꽉 낌 그래서 밥 먹고 계속 단추 풀고 있었어요 타 브랜드 바지 허리둘레 인 거 입으면 원래 남는데 여긴 정 사이즈보다 더 작게 나오는 듯 그거 감안하고 구매하세요,"단면, 대충, 단추, 사이즈, 사이즈, 먹다, 감안"
편하게 입기 좋고 가성비가 좋아요 추천드려요 굿,"가성비, 추천 드리다, 편하다"
워싱 디테일 보고 산 바진데 기장이랑 사이즈 다 너무 좋아여,"기장, 사이즈, 디테일, 바진, 워싱, 보고"
워싱이 들어간 디자인이 마음애 들어서 구매했는데 만족하고 입는 중입니다,"중, 만족하다, 디자인, 워싱, 들어서다, 들어가다, 애"
루즈핏 이 뻐요 질도 좋아서 여름에 휘뚜루마 뚜루 굿,"여름, 질도, 루즈 핏, 뚜루, 휘뚜루 마"
남자용이라 그런지 너무 컸던 아직 한 번도 못 입음,"남자 용이, 그렇다, 번, 크다"
