Processed_Review,keyword
생각했던 것보다 훨 이 뻐요 맘에 너무너무 듭 미다 굳국,"밉다, 굳다 국"
이 뻐요 생각보다 옷이 많이 띡딱하게 굳은 느낌이 긴 힌데 나쁘지 않이 요,"힌데, 띡 딱하다, 나쁘다, 굳다"
디스플레이 된 사진과 색상이 같아서 좋았던 것 같아 요 디자인도 딱 알맞은 버뮤다 라 길지도 짧지도 않았어요,"색상, 사진, 디자인, 디스플레이, 버뮤다, 짧다, 알맞다"
바지를 올려 입어서 그런지 길이가 애매했어요 골반까지 내려야 원하는 버뮤다핏이 나와서 아쉬웠지만 바지 워싱이나 전체적인 바지는 이 뻐서 더운 여름에 자주 입을 거 같아요,"워싱, 전체, 그렇다, 바지, 원하다, 길이, 나오다, 바지"
버뮤다 팬츠 처음 사보는데 굉장히 만족한 제품입니다 인플루언서 추천에 떠서 사봤는데 기장이 딱 무릎 가릴 정도 오려면 자기보다 한 사이즈 크게 사는 게 정배였네요,"플루, 제품, 사보다, 만족하다, 사이즈, 오다, 추천, 버뮤다, 기장"
바지 길이도 적당하고 색감도 화면이랑 비슷하고 가격도 저렴해 너무 좋아요,"적당하다, 화면, 가격, 저렴하다, 색감, 길이, 바지"
상품 너무 좋습니다 사이즈도 잘 맞고 앞으로 자주 입을 듯,"사이즈, 상품, 앞, 맞다"
너무 이쁜 바지에 요 요새 유행이라 한 번쯤 사고 싶었는데 역시나 이 쁘고 유명한 이유가 있어 용 다른 색도 사고 시 퍼용,"유행, 유명하다, 이유, 퍼용, 바지, 요새, 사고, 색도"
옷이 생각한 기 장보다 너무 길고 핏도 별로에요 비추,"별로, 길다, 장보, 비추다, 핏"
남성 사이즈여서 엉덩이는 끼고 허리는 너무 커요 제가 잘못 산 거 같아 료 근데 디자인은 진짜 예뻐요,"엉덩이, 사이즈, 크다, 디자인, 허리, 남성"
옷이 두꺼워서 약간 더운 거 빼고는 사이즈도 적당하고 핏도 예뻐요,"적당하다, 사이즈, 덥다, 핏, 빼다, 두껍다"
기장감도 좋고 색감도 이 쁘고 찰떡이네요 깔별로 구매해야겠어요,"기장 감다, 색감, 깔다 별로, 찰떡"
실물색감이 더 예쁜 것 같아 염 바지기장도 적당하구 좋음,"바지 기장, 적당하다, 실물 색감"
처음에 받았을 때 제 허리가 좀 얇은 편인데도 허리가 쪼이길래 이상한가 했었는데 계속 입다 보니 적응되서 더 예뿌게 입을 수 있었던 거 같아 요 사이즈는 진짜 버뮤다의 정석인 거 같고 워싱이 정말 맛있게 들어가서 만족스러웠어요,"이상하다, 정석, 들어가다, 사이즈, 워싱, 버뮤다, 허리, 펴다"
트릴리온은 항상 믿고 보는 브랜드 이 죠 색 감 핏 그냥 다 미쳤어요,"트릴 리온, 항상, 브랜드, 믿다, 미치다, 그냥"
처음 사 서 신어봤는데 생각보다 재질도 좋고 사이즈도 괜찮았어요 다음에 또 살꺼 같아요,"사이즈, 재질, 처음, 신어, 살다"
기장도 딱 맞고 색도 이 뻤어 욥 배송도 빨리 왔습니당,"기장, 배송, 색도, 오다 니당다, 뻤어, 맞다"
데님이 정말 쌈 봉해서 이 거 입고 나가서 매번 칭찬 받았어요 힙하대요,"봉, 힙하대, 칭찬, 데님, 받다"
평소 허리 정도인데 허리가 좀 꼈는데 입 다 보니까 늘어나서 딱 좋습니다 이쁘네요 워싱과 길이 감,"워싱, 평소, 허리, 길이, 늘어나다, 허리, 보"
요즘 유행하는 버뮤다 팬츠 무난하고 예쁘게 입고 다닐 수 있습니다,"유행, 버뮤다, 팬츠"
워싱감이 너무 예쁘고 사이즈도 딱 좋음 추천합니다,"추천, 워싱감, 사이즈"
사이즈가 딱 맞아서 좋고 워싱이 너무 예뻐서 마음에 들어요,"사이즈, 워싱, 맞다"
좋은데요 배송이 좀 늦은 감이 있네요 그래도,"배송, 늦다"
디자인도 마음에 들고 색상도 괜찮아요 가격도 저렴하게 잘 샀습니다 좋아요,"색상, 디자인, 가격, 저렴하다"
요즘 이런 팬츠가 유행이라 아들 녀석이 입고 싶다고 해서 다른 컬러로 두 벌 구매했어요 올 여름 잘 입고 다니네요,"유행, 컬러, 녀석, 팬츠, 이렇다, 여름"
무난하고 워싱 잘 빠졌어요 매치하기 좋은 디자인입니다,"디자인, 매치, 워싱, 빠지다"
생각보다 펑 퍼짐한 핏이라 그건 아쉽긴 한데 색감이나 편한 건 맘에 들어요,"퍼지다, 색감, 편하다, 아쉽다, 핏"
가격이 싼 곳을 찾아보다가 이 곳에 왔습니다 가격에 감동하고 디자인에 한 번 더 감동했습니다 앞으로도 이 곳을 애용할 것 같네요,"애용, 감동, 가격, 디자인, 가격, 찾아보다, 오다, 앞, 곳, 곳"
데님 쇼츠 이번에 처음 장만 했는데 여름에 필수템인 듯 다 잘 어울리네요,"어울리다, 필수, 여름, 쇼츠, 장만, 처음, 데님"
데님 쇼츠의 정석 같은 색감과 워싱도 아주 이쁩니다,"색감, 정석, 워싱, 쇼츠, 데님"
버뮤다 팬츠 데님 팬츠로 사봤는데 역시 좋네요 생각보다 더 시원함,"팬츠, 버뮤다, 팬츠, 시원하다, 데님, 사보다"
시즌 오프 때 저렴하게 구매했습니다 근데 허리 사이즈가 좀 작네요 원래 이 사이즌 데 구매할 때 참고하세요 기 장 딱 좋고 워싱은 예쁩니다,"워싱, 저렴하다, 사이즈, 즌, 참고, 시즌, 허리, 원래, 오프"
시즌 오프 때 저렴하게 구매했습니다 근데 허리 사이즈가 좀 작네요 원래 이 사이즌 데 구매할 때 참고하세요 색감은 예쁩니다,"저렴하다, 참고, 사이즈, 즌, 색감, 시즌, 허리, 오프, 원래"
시즌 오프 때 저렴하게 구매했습니다 근데 허리 사이즈가 좀 작네요 원래 이 사이즌 데 구매할 때 참고하세요,"저렴하다, 참고, 사이즈, 즌, 시즌, 오프, 작다, 허리, 원래"
요즘 엄청 잘 입고 다니는 바지 그냥 거의 교복처럼 입고 다녀요,"교복, 바지, 그냥"
인기 많길래 사봤는데 이유가 있었다 핏 예쁘고 워싱도 좋아요,"워싱, 이유, 인기, 사보다, 많다"
저렴한 가격에 좋은 옷을 샀습니다 감사합니다맘에 들어요,"저렴하다, 가격"
일부러 박시하게 사서 허리가 골반에 걸쳐져 있지만 기장이 딱 생각하던 만큼 와서 좋아요,"걸치다, 박다, 기장, 일부러, 골반, 오다, 사서, 허리"
월쯤에 입을 버뮤다 데님 팬츠로 뭘 입을 지 고민됐는데 이 거 사니까 국밥처럼 하게 입고 있습니다 까진 사이즈로 입어도 충분하실 고 같아 요 좋습니당,"국밥, 충분하다, 팬츠, 사이즈, 버뮤다, 고민 돼다"
인생 바지 너무 이 뻐요 완벽한 핏 너무 잘 산 것 같아요,"인생, 완벽하다, 바지"
처음엔 샌드블루 샀었다가 핏은 예쁜데 허리가 너무 쪼여서 고민하다가 로 교환했어요 근데 교환 처리가 생각보다 너무 오래 걸려서 먼저 라지로 사봤는데 생각보다 안 크고 기장이 딱 마지노선이네요 사이즈 바꾸길 잘한 거 같아 요 바지 자체는 진짜 너무 예쁩니다 남자분들은 한 사이즈 업 추천 드려요,"마지노선, 고민, 추천, 먼저, 사이즈, 남자, 처리, 기장, 걸리다"
힙한 느낌을 주기 좋아요 싸게 잘 구매한 것 같습니당,"힙, 싸다, 주기, 니당다"
가성비 좋은 바지인 거 같아 요 핏도 예쁘고 잘 입고 다니고 있어 용,"가성비, 바지, 핏"
색감이랑 핏이 너무 좋습니다 가성비가 매우 좋은 것 같아요,"색감, 가성비, 핏"
이 바지 진짜 깔롱합니다 스트릿부터 캐쥬얼까지 다 잘 어울리고 허리가 살짝 작은 건 감안하고 입을 만 해요,"어울리다, 감안, 허리, 바지, 작다, 캐 쥬얼, 스트릿"
여름에 포인트 주기 좋아요 반 바지라 여기저기 잘 어울려요,"여기저기, 어울리다, 포인트, 여름, 바지라, 주기"
다 마음에 드는 데 살짝 허리가 제 생각보다 작으니 구매하실 때 생각하고 사셔야 할 거에요,"허리, 작다"
워싱도 이 쁘고 가성비 넘치는 버뮤다 팬츠입니다,"팬츠, 가성비, 넘치다, 버뮤다, 워싱"
워싱도 이 쁘고 가성비 넘치는 버뮤다 팬츠입니다,"팬츠, 가성비, 넘치다, 버뮤다, 워싱"
허리 부분이 유독 작네요 바지는 이 뻐요 친구 줬습니다,"바지, 부분, 허리, 친구, 유독, 작다, 주다"
통이 너무 커서 바지가 아니라 치마 같았구 주름도 이상흐게 잡 허서 안 이뻥요,"이상흐, 통, 커서, 허다, 바지, 아니다, 주름, 치마, 뻥"
보는 사람마다 귀엽대 요 키 작은 분들 입으면 기여울 거 같애요 배송도 빠르고 두께감 좀 있지만 이 뻐요,"여울, 배송, 사람, 작다, 빠르다"
동생 사줬는데 너무너무 좋아하네요 이 쁘고 가성비 좋아용 여기저기 다 잘 어울려 요 흑청 무난합니다,"여기저기, 어울리다, 가성비, 동생, 청, 좋아하다, 사주다"
지금 제가 벌크 옵중이 살짝 꽉 끼긴 하는데 살 조금만 빼면 아주 이쁠듯합니다 아주 좋아요 색도 이 뻐요 좋아용,"옵 중이, 벌 크다, 색도, 지금"
너무 좋아요 잘 맞고 핏 추천 드립니다 배송도 빨라요,"추천, 배송, 드리다, 빨르다, 맞다"
길게 입고 싶어서 큰 사이즈로 시켰는데요 생각보다 허리는 많이 크지 않아서 좋았어요 배송은 다행히 약속 하루 전에 도착했습니다 주말 껴서 조금 늦어지는 거 빼고는 괜찮았어요,"크다, 배송, 다행하다, 사이즈, 허리, 전, 길다, 주말"
핏도 괜찮게 나오고 색감도 예뻐서 추천합니다 근데 기장이 좀 긴 거 같어요,"추천, 기장, 나오다, 색감, 핏"
너무 바지가 예쁘고 맘에 듭니다 다른 색으로 재구매 히려 구여,"색, 재다, 바지, 듭니, 려"
저한테는 처음 입었을 때 허리가 좀 작았는데 몇 번 입으니까 딱 맞네요 디자인은 무난무난한 버뮤다입니다,"버뮤다, 테, 디자인, 처음, 허리, 작다, 맞다"
색감은 사진과 동일하게 이쁩니다 핏도 무진장 마음에 들고 배송도 빠르게 왔어요 디자인도 너무 마음에 들어요,"무진장, 동일하다, 사진, 디자인, 색감, 배송"
아주 멋스러워요 스타일리쉬하고 옷이 너무 두껍지도 않고 좋아요,"스타일리쉬, 멋 스럽다, 두껍다"
여자가 있기엔 좀 크긴 한데 오버 핏으로 입으면 이쁜 거 같아요,"여자, 크다, 오버, 핏"
무난 템으로 손이 자주 가는 상품이고 이 가격이면 합리적 소비인 거 같아요,"상품, 가격 이면, 소비, 손, 합리, 가다"
허리 정도 입으시면 주문하시면 맞을 듯 싶습니다,"주문, 허리, 싶다, 맞다"
정말 배송이 빠르고 아무렇게나 입어도 괜찮으거,"배송, 아무렇다, 빠르다"
허리가 조금 꽉 끼긴 하는데 그것 빼고는 기장도 적절하고 맘에 들어서 잘 입고 있어요,"적절하다, 허리, 들어서다, 기장, 빼다"
너무 편하고 예뻐요 디자인도 잘 나왔고 색감이 잘 나왔고 배송도 빨라요,"디자인, 편하다, 배송, 색감, 빨르다, 나오다"
어머님 사드렸는데 힙하다고 너무 좋아하시네요,"어머님, 힙, 좋아하다, 사 드리다"
배송도 빠르고 가격도 싼데 옷도 이 뻐요 화면에서 본거랑 똑같아서 굉장히 맘에 들었습니다,"화면, 배송, 가격, 싸다, 빠르다, 똑같다"
저렴한 가격에 나쁘지 않은 퀄리티 바지 잘 샀습니다,"저렴하다, 퀄리티, 가격, 바지, 나쁘다"
옷 이쁩니다 가격 대비 옷 품질이랑 마감 처리 좋아요 저 같은 체형이 신 분들한테 추천 드리고 싶습니다,"체형, 품질, 분, 드리다, 대비, 추천, 처리, 가격, 마감"
옷 자체는 정말 이쁘구요 제가 비율이 안 좋아서 그런 건진 모르겠는데 다리가 많이 짧아 보이긴 합니다 가 성비 좋아요,"건지다, 비율, 자체, 다리, 성비, 보이다, 그렇다"
남자 핀 구 선물로 줬는데 딱 핏에 맞아 떨어졌어요 아무 옷에 나 잘 어울려요,"어울리다, 선물, 남자, 주다, 맞다, 떨어지다, 핏"
바지 지 퍼 부분이 찢어졌어요 택을 이미 제거해서 망했어요,"제거, 바지, 부분, 택, 찢어지다, 망하다"
바지 존 맛탱 그냥 사 요 세장사요 배송도 빨랐고 핏도 원하던 핏이였어요,"장사, 배송, 원하다, 바지, 핏, 핏, 빨르다, 맛, 그냥"
저의 골반엉이 둘레를 과소평가했나 봅니 당 사이즈 확인하고 샀는데 신축성이 없어서 그런지 너무 딱 불편하게 맞아서 살 좀 빼고 입어야겠어용,"신축, 골반, 불편하다, 그렇다, 사이즈, 확인, 둘레"
반바지 처음으로 사봤는데 엄청 이쁘네요 잘 입고 있습니다,"반바지, 처음, 사보다"
허리가 골반이 아니라 빤쮸 라인에 걸쳐서 벗겨질까 무섭지만 저의 빵실한 엉덩이로 잘 지탱하는 것 같슴 다 살짝 쿵 잼 민핏 되는데 어쩔 수 없음 간 즤코디 가보자고 잇,"무섭다, 엉덩이, 걸치다, 지탱, 즤코디, 골반, 허리, 가보다, 아니다"
이쁘고 딱 맞고 가격도 너무 좋습니다 대박입니다,"대박, 가격, 맞다"
배송도 빠르고 색상이며 핏이며 전체적으로 마음에 듭니다,"색상, 전체, 배송, 듭니, 핏, 빠르다"
번째 만에 사이즈 로 찾았습니다 핏이 마음에 듭니다,"듭니, 사이즈, 핏, 찾다"
에서에서 끝으로 사이즈로 변경했는데 이 제 마음에 듭니다,"사이즈, 듭니, 변경, 끝"
색감 이쁘고 기 장 길어서 좋아요 근데 허리가 생각보다 작아서 조금 낍니다,"색감, 작다, 허리, 끼다"
배송 빠르게 왔습니다 허리 사이즈 저한테는 딱 맞아서 좋았어요,"테, 사이즈, 배송, 허리, 오다, 빠르다, 맞다"
오 좋습니다 아주 입 기 편해요 요즘 입기 딱 좋스니다,"편하다, 좋스니"
세탁해도 그대로 고 너무 좋아요 다들 이 거 꼭 사 세용,"세탁, 세용, 그대로"
버뮤다 사고 싶어서 구매했는데 너무 맘에 들어 요 하나 더 사려 구요,"버뮤다, 사고, 사려, 하나, 싶다"
완전 잘 입고 있어요 색감도 이 쁘고 하나 더 사고 싳어요,"색감, 사고, 하나, 싳어"
허리가 조금 작긴 하지만 입 다 보면 늘어서 괜찮아요,"허리, 늘어서다, 작다"
바지 통이 생각했던 것보다는 조금 컸지만 그래도 핏이 괜찮게 나오네요,"나오다, 통, 바지, 핏, 크다"
예쁘다고 정말 많이 들었습니다 처음 구매한 버뮤다인데 너무 잘 입고 있습니당,"버뮤다, 처음, 니당다"
가성비 좋고 이쁩니다 재질도 하고 좀 두껍긴 해여,"재질, 가성비, 두껍다"
핏이 정말 이쁘게 잘 나오고 제 키에 사이즈 기장감이 딱 적당하네요,"적당하다, 기장, 사이즈, 나오다, 키, 핏"
버뮤다 처음 입어보는데 핏이 생각보다 괜찮아서 그냥 버뮤다 만 입고 있어요 딱 무릎 기장을 덮어줘서 더 마음에 든 것 같아 여,"입어보다, 기장, 버뮤다, 처음, 핏, 무릎"
색감이 너무 많이 진 하지도 않고 색도 딱 제가 원하는 색으로 왔어요,"색감, 색, 색도, 원하다, 오다"
버뮤다 생각햇는데 나 팔바지 마냥 너무 핏이 퍼져요 사놓고 안입는 중 아깝,"퍼지다, 바지, 버뮤다, 핏, 아깝다, 햇 늘다, 마냥"
허리 사이즈가 다른 브랜드에 비해 좀 작게 나온 거 같아요,"허리, 사이즈, 나오다, 브랜드, 비다, 작다"
버뮤다 팬츠 청으로 처음 구매해봤는데 생각보다 크더라고요 사이즈 가격도 이 정도면 입문으로 딱 좋다고 생각합니다 편하게 입을 듯요 굿,"크다, 입문, 청, 가격, 버뮤다, 편하다"
사이즈 딱 잘 맞습니다 저랑 키 몸무게 비슷하심 엠 사에뇨,"사이즈, 사에뇨, 몸무게, 심, 맞다"
색감도 너무 마음에 들고 디자인도 너무 마음에 들어요,"디자인, 색감"
바지가 아주 예쁘고 힙한 스타일에 매우 잘 어울려요,"어울리다, 스타일, 힙, 바지"
바지가 정말 맛있습니다 친구들이 물어봐요 어디서 샀냐고 유후,"물어보다, 친구, 유후, 바지, 맛있다"
색감 좋은 흑청에 워싱 디테일까지 더해져서 분위기 연출하기 좋은 거 같아 요 버뮤다 팬츠 중에서 최애 아이템 됐습니다,"연출, 더하다, 청, 중, 팬츠, 워싱, 아이템, 버뮤다, 색감"
남자친구한테 잘 맞아 영 잘 산 거 같아요,"남자친구, 맞다"
하지 않게 포인트들이 들어가 있어 좋습니다,"포인트, 들어가다"
색깔 너무 이 쁘고 길이 통 다 마음에 듭니다 가격도 저렴해서 강추해요,"강추, 저렴하다, 가격, 듭니, 길이, 색깔"
스티치가 흰색인 줄 모르고 시켰어요 다른 색상 구매 후 맘에 들어서 한 사이즈 큰 걸로 시켰는데 다른 색상과 뭔가 소재가 다른 느낌이 들었어요 더 얇고 안 좋은 듯한 첨에는 좀 맘에 안 들었는데 핏이 예쁘기도 하고 저렴했어서 품기로 했어요,"들어서다, 색상, 흰색, 모르다, 뭔가, 사이즈, 스티치, 소재, 색상"
좋은 기회로 저렴하게 구입했는데 아무래도 여성이 다 보니 이런 거 입을 땐 좀 딱 달라붙고 약간은 크롭 인 상의를 입는 게 더 잘 어울리는 거 같아 요 약간 잼민이 핏 되긴 한데 긴 바지는 입기 싫고 그렇다고 반바지 입긴 애매할 때 좋을 둣,"여성, 어울리다, 잼민, 이렇다, 바지, 애매하다, 저렴하다"
바지 통이 생각보다 많이 큽니 다 치마인 줄 알았어요 근데 좋습니다 허리 둘레는 라지 치고 크진 않음,"크다, 크다, 치마, 허리, 라지, 바지, 통, 둘레"
옷이 이 쁘고 실제로 보면 더 이 뻐요 핏도 너뮤 자연스러워요,"자연스럽다, 실제, 뮤, 핏"
바지 색감이 너무 이쁘게 잘 나왔고 통은 생각보다는 많이 크고 기장도 약간 긴 편이라 버뮤다 느낌 강하게 내고 싶으신 분 사시면 이 쁠거 같아요,"크다, 버뮤다, 사시, 기장, 색감, 강하다, 통, 편이, 바지"
밑으로 갈수록 통이 넓어집니다 하나쯤은 있으면 잘 입을 거 같아,"갈수록, 통, 하나, 밑, 넓어지다"
생각보다 넓고 밑으로 갈수록 더 커지는 바지입니다,"바지, 커지다, 갈수록, 밑, 넓다"
기장은 진짜 베스트인데 살짝 아쉬운 점은 주머니가 너무 꽉 쨍깁니다,"기장, 베스트, 주머니, 점, 쨍깁니, 아쉽다"
동생 옷 사줬습니다 좀 마른 편이라 그런 가 허리가 크지만 핏이 이 사이즈가 예쁜 거 같아요,"동생, 사이즈, 크다, 그렇다, 허리, 편이, 마르다, 핏, 사주다"
어느 상의 에나 잘 어 울릴 만한 바지이고 무난무난히 게 예뻐요,"에나, 바지, 상의, 울리다"
색깔이 이 쁘고 다시 구매할 의사가 있습니다 정말 예뻐요,"의사, 다시, 색깔"
색감도 좋고 편하게 입을 수 있어서 좋은 거 같아요,"색감, 편하다"
다른 하의 에 비해서 사이즈가 조금 작게 나온 것 같은 느낌입니다 착용 감도 보기와는 다르게 괜찮아서 데일리 핏으로도 자주 입을 수 있을 것 같습니다,"사이즈, 다르다, 일리, 나오다, 보기, 착용, 비"
다른 색상 구매했다가 너무 맘에 들어서 이번에는 검은색으로 사봤는데 이번에도 너무 만족합니 당,"검은색, 들어서다, 만족하다, 색상, 사보다"
정말 이 쁘고 가격도 저렴하고 세탁도 편해서 좋았어요,"편하다, 저렴하다, 가격, 세탁"
이 뻐요 반바지 중에 갑 매일 데일리룩으로 입어요,"일리, 매일, 중, 반바지"
허리가 생각보다 많이 작았지만 디자인이랑 핏이 정말 이쁩니다,"디자인, 허리, 핏, 작다"
허리가 작다는 후기 보고 걱정했는데 하게 사이즈 잘 맞고 생각보다 바지가 이 뻐서 너무 만족해요,"만족하다, 허리, 바지, 사이즈, 작다, 보고, 후기"
허리가 조금 작게 나온 거 같아 요 그런데 원단이나 핏은 너무 좋네요,"허리, 원단, 나오다, 작다, 핏"
제품이 실물이 더 예뻐서 좋고 착용할 일이 많을 거 같아요,"착용, 실물, 제품, 많다"
확실히 다른 후기들처럼 허리가 작아서 사이즈업이 필요할 수 있습니다 옷은 예뻐요,"업, 확실하다, 후기, 필요하다, 허리, 작다"
사이즈랑 워싱 디자인 자체는 너무 예뻐요 허리가 조금 끼는 느낌 있는데 살 빼면 될 것 같아요,"사이즈, 워싱, 허리, 디자인, 자체, 빼다"
믿고 다시 주문했었는데 실망하지 않는 바지입니다,"바지, 실망하다, 다시, 주문, 믿다"
사이즈에서 사이즈로 변경해서 주문했는데 그나마 괜찮아요,"변경, 사이즈, 사이즈, 주문"
전에 정 사이즈로 주문했었는데 조금 작아서 한 사이즈 업해서 다시 주문했습니다,"업, 사이즈, 작다, 사이즈, 전, 다시, 주문, 주문"
옷감도 좋고 핏도 좋아서 휘뚜루마 뚜루 딱 좋아요,"휘뚜루 마, 핏, 옷감, 뚜루"
버뮤다 팬츠 입문하기 좋습니다 무난하고 이 뻐요,"입문, 버뮤다, 팬츠"
되게 쌈깔하고 기 장 딱 좋아요 시원하게 잘 입을 게요,"시원하다, 쌈 깔다"
진짜 인생 버뮤다 입니다 이 가격에 이 핏이면 무조건 사세요,"인생, 무조건, 가격, 버뮤다, 핏이"
생각했던 것보다 이쁜 디자인과 핏이에 요 맘에 들어요,"디자인, 핏이"
색감이 예쁘고 배송은 느리지만 무게는 약간 무겁다,"무겁다, 배송, 색감, 무게, 느리다"
사세용 가격 대비 너무 예쁜 바지임이다 맨날 입음,"세용, 바지, 가격, 대비"
배송도 빨리 오고 가격도 나름 괜찮았습니다 색감도 너무 어둡지는 않고 좋네여,"어둡다, 가격, 색감, 배송, 오다, 나름"
사이즈 핏 이 쁨 재질 좋음 진짜 이 거 너무 내 스타일이라 왜 지금 샀 나 싶음,"사이즈, 스타일, 재질, 지금, 싶다"
진짜 트릴리온 바지 처음 사봤는데 엄청나게 만족스러운 바지입니다 브랜드 자체를 갑자기 신뢰하게 된 바지예요 요즘 최 애입니다 어디에 입어도 잘 어울리고 기장감 길고 되게 와이드한데 위에 핏하게 입어도 예쁘고 루즈하게 입어도 박시하게 입어도 예쁩니다 굿,"와이드, 만족스럽다, 바지, 애, 엄청나다, 어울리다, 갑자기, 박다"
헐인하길래 동생 사줬는데 좋아하네욥 말라서 허리가 크긴 한데 잘 입겠대요,"헐다, 동생, 말, 크다, 허리, 좋아하다 욥, 대요, 사주다"
사진으로 보는 것보다 입으니까 훨씬 예쁘네요 색상도 맘에 들어서 자주 입게 됩니다 다른 색상도 이 쁠듯,"사진, 색상, 들어서다"
세일 가격에 정말 만족할 만한 색감의 버뮤다 팬츠입니다 샌드 계열의 버뮤다 팬츠를 사고 만족도 최상이라 다른 색상으로 하나 더 구입 했어요 통이 넓어 시원하고 길이 감도 적당하고 무엇보다도 핏이 예술이라 아직까지 이것보다 더 이 쁜 버뮤다 팬츠 본 적이 없네요 강추에요,"팬츠, 적당하다, 색상, 만족하다, 색감, 시원하다, 만족도, 버뮤다, 강추"
색감이 예쁘고 가격도 괜찮고 디자인이 진짜 예쁘다,"색감, 가격, 디자인"
사이즈가 너무 딱 맞아서 좋아요 워싱도 잘 들어갔고 기장감도 좋아서 이 가격에 너무 잘 산거 같아요,"기장 감다, 사이즈, 워싱, 가격, 맞다, 들어가다"
허리가 사이즈 표보다 조금 작게 니온 거 같지 먼 그래도 잘 입고 있너 어요 이 뻐요,"허리, 어요, 사이즈, 온, 표, 작다"
배송이 진짜 느리고요 색감은 예쁘고요 사이즈가 좀 커요,"배송, 사이즈, 느리다, 크다, 색감"
바지가 너무 이 뻐요 이런 바지 하나 가지고 싶었는데 나중에 다른 색깔로 또 사겠숨다,"가지, 바지, 나중, 이렇다, 바지, 하나, 싶다, 색깔"
두꺼워보여서 더울 줄 알았는데 안 덥고 딱 좋습니다,"덥다, 덥다, 알다, 두껍다 보"
너무 예쁘고 편하고 너무 좋습니다 감사합니다 잘 입을 게요,편하다
사이즈 딱 이쁜 사이즈에 요 무릎 아래로 적당히 내려오고 색감도 좋아요,"적당하다, 사이즈, 내려오다, 사이즈, 색감, 아래, 무릎"
색감도 예쁘고 디자인도 예뻐요 기장은 생각보단 짧네요,"기장, 디자인, 색감, 짧다"
옷 기장이 딱 내가 원하는 느낌이고 색감도 훌륭해서 계속 손이 갑니다 사이즈도 적당해요,"적당하다, 사이즈, 훌륭하다, 기장, 원하다, 가다, 색감, 손, 내"
사이즈 좀 많이 작아서 이 쉬워요 배송 빨리 요 재질 무게 괜찮아요 나쁘지 읺아요,"사이즈, 작다, 배송, 재질, 무게, 읺아, 쉽다, 나쁘다"
사이즈가 좀 작아서 아쉬워요 통 좀 크고요 나머지 재질이나 무게는 적당해요 나쁘지 않아요,"적당하다, 사이즈, 크다, 재질, 작다, 나머지, 무게, 아쉽다, 나쁘다"
상품 배달은 일단 엄청 빨리 요 틀 일 걸린 거 같아 요 총장 길이가 라는 디 이네요 좀 많이 아쉬워요 통이 좀 커요 감안하셔야 할 듯 요 무게 적당해요 재질도 적당해요,"적당하다, 크다, 총장, 배달, 길이, 재질, 통"
