Review,keyword
늦은 후기입니다 사이즈 완전 잘 맞고 정말 이쁜 옷이네요,"늦다, 후기, 맞다, 사이즈"
아디다스 집업으로 유명한 만큼 입자마자 핏 예쁘게 나오고 아무대나 입 기 좋은 것 같아 요 너무 예뻐요,"유명하다, 집업, 나오다, 아디다스"
매일 입어 요 데일리로 짱이 고 너무 편하고 이 뻐요 추천 추천,"추천, 데일리, 편하다"
요즘 아디다스가 이 뻐 보이길래 사봤는데 역시 만족합니다,"사보다, 보이다, 만족하다, 아디다스"
딸이 즐겨 입는 옷 요즘 또 유행이라 검정 하나 더 사 줬어요,"즐기다, 검정, 주다, 하나, 유행"
두껍지도 얇지도 않고 두께감이 적당해서 좋아요 만족합니다,"두께감, 두껍다, 만족하다, 적당하다, 얇다"
그냥 유행하는 거 편하게 잘 산 거 같네요 잘 입을 게요,"유행, 편하다"
너무 좋습니다 잘 입고 있습니다 완전 최고입니다,최고
아디다스 소매 해요 재질 좋습니다 핏 좋습니다,"소매, 재질, 아디다스"
예쁘게 입을 려규 오버사이즈로 샀는데 넘 예쁘네요,"려규, 오버, 사이즈"
국밥입니다 매일 입고 다녀 요 너무 만족합니다 기장이 살짝 긴데 그건 접어서 입으면 돼서 오히려 좋은 듯,"그건, 국밥, 돼다, 접다, 기장, 만족하다"
옷 너무 이 쁘고 정말 좋습니다 번창하시고 다음에 또 구입하겠습니다,번창
너무 이 뻐용 많이 두껍지 않아서 자주 입을 거 같아요,"뻐용, 두껍다"
아디다스져 지 하나 사고 싶었는데 잘 산거 같아요,"사고, 하나, 아디다스"
매우 만족 감사합니다 한 날씨에 딱이네요 잘 입고 다녀요,"만족, 날씨, 딱이다"
너무 뷰티풀하고 이쁩니다 따땃하기도 하고 대 만족이오,"뷰티풀, 이오, 따땃, 대다, 만족"
역시 근본은 근본입니다 어느 바지에도 잘 어울리고 두께감도 적당하고 핏도 딱입니다,"근본, 두께감, 딱이다, 바지, 어울리다, 적당하다"
이쁩니다 갖고 싶어서 재입고 기 다렸어요 힙해요,"다리다, 힙해, 갖다"
하나 사거 싶었는데 저렴하게 잘 샀어요 다른 색도 살까 고민중,"색도, 저렴하다, 살다, 고민, 하나"
배송은 빨리 왔고 색감은 사진과 동일합니다 솔직히 말하면 돈 값은 합니다 진짜 이 뻐요 매일매일 입고 다님,"솔직하다, 동일하다, 사진, 빨리, 색감, 오다, 배송"
요즘 져지가 입고 싶어서 구매했는데 만족합니다 밑단이 완전 해서 투웨이면 더 좋앆을 거 같음,"좋앆, 밑단, 져지, 만족하다"
너무 편하고 핏도 마음에 들어 요 다른 색 하나 더 구매 예정,"예정, 하나, 편하다"
아디다스 저지 하나 장만 하려고 주문했습니다 사이즈로 시켰는데 예쁘게 오버핏 나와서 만족합니다 단점은 약간 기장이 긴 정도,"장만, 단점, 저지, 주문, 하나, 나오다, 기장, 만족하다, 오버핏, 아디다스"
세탁기에 한 번 돌렸는데 보풀 다 일어나서 깜짝 놀랐네요 꼭 손 세탁 하세요,"세탁기, 일어나서, 깜짝, 돌리다, 세탁, 보풀"
생각보다 엄청 빠르게 배송 왔습니다 대 만족하며 입고 있어요,"대다, 오다, 만족하다, 빠르다, 배송"
배송도 빠르고 핏도 좋아요 전 덩치가 있어서 엑스라지인데 작지도 않고 데일리하게 입을 수 있어요,"치가, 엑스, 데일리, 라지, 빠르다, 배송"
간절기에 휘뚜루마 뚜루 입기에 아주 좋아요 아무 데나 잘 어울리고 편해용,"간절기, 뚜루, 휘뚜루, 어울리다, 편하다"
디자인은 좋고 배송 빠르고 가격 좋아 요세틱은 아직 존,"아직, 가격, 디자인, 빠르다, 배송"
이 제품은 그냥 집에 하나 두고 있는 게 마음이 편해요,"두다, 제품, 하나, 편하다"
너무 가지고 싶었던 아디다스 져지를 드디어 구매하게 되었어요 다 무난하고 제가 덩치가 큰데도 정말 멋져요,"멋지다, 드디어, 치가, 가지, 되어다, 져지, 크다, 아디다스"
오랜만에 져 지입는데 편하규 좋아요 화면에 보는 그대로입니다,"하규, 화면, 그대로, 오랜"
사이즈는 딱 핏하게 입는 거 좋아하시면 하시면 될 거 같아 요 요즘 이 거 하나로만 돌려입는데 좋습니다,"하나로, 돌리다, 핏하, 좋아하다, 사이즈"
좀 많이 긴 애 지퍼만 안 잠구면 괜찮네요 사이즈 갈 껄 그랬어요,"잠구, 지퍼, 그렇다, 갈다, 사이즈"
몇 년 만에 입어보는 트랙탑인데 역시는 역시입니다 편하고 좋습니다,"만에, 입어보다, 트랙, 편하다"
사이즈 적당하고 핏이 잘 빠진 거 같아 요 옷 이 뻐요,"빠지다, 적당하다, 사이즈"
아무렇게나 막 걸치기 좋아요 디자인 예쁩니다,"아무렇다, 걸치다, 디자인"
시보리도 하고 가격 대비 만족합니다 배송도 빨랐습니다,"대비, 가격, 만족하다, 시보리, 빠르다, 배송"
생각보다 얇고 더 크기는 한데 그래도 너무 이 뻐요,"크기, 얇다"
좀 크기는 한데 그래도 이 쁘고 생각보다 얇긴 한데 이 뻐요,"크기, 얇다"
올 봄 교복처럼 잘 입었어요 근데 이 제 남들한테도 교복이라 입고 나가면 최소 명 이상이랑 커플처럼 보일 수 있달까요,"교복, 최소, 달다, 커플, 보이다, 오다"
핏이랑 원단이 너무 좋아서 오래 입을 수 있을 것 같습니다,"원단, 오래"
에 하니까 딱 이쁜 오버핏입니 당 주머니에 지퍼도 달려 잇어서 편해용,"잇다, 달다, 주머니, 지퍼, 오버핏, 편하다"
사이즈가 커서 팔 기장은 길지만 상품 디자인은 이 뻐서 맘에 들어요,"상품, 커서, 기장, 디자인, 사이즈"
사이즈가 거의 다 품절이라 를 구매 하였는데 팔기장이 길지만 상품은 이 뻐서 만족해요,"상품, 품절, 기장, 만족하다, 사이즈"
받기 전까지 계속 사이즈 걱정 했는데 아주 만족스럽네 용,"계속, 걱정, 만족스럽다, 받다, 사이즈"
제가 입어서 러샤 고프닉인 거지 옷은 지기게 이쁩니다,"고프다, 지기, 러샤, 거지"
요즘 유행이라 샀는데 재질도 좋고 편하고 이 뻐요,"재질, 유행, 편하다"
여름에 샀지만 날 춥거나 흐릴 때 입을 수 있을 것 같아 요 잘 어울려서 좋아요 감사합니다,"흐리다, 추다, 여름, 어울리다"
아디다스 트랙탑은 뭐 근본 데일리 아이템 가볍고 얇아서 편하고 좋습니당,"아이템, 데일리, 니당다, 근본, 가볍다, 트랙, 얇다, 아디다스, 편하다"
국민 츄리링 정말 하나씩 쟁여두세요 짱입니다 강추,"국민, 츄리, 두다, 강추, 하나"
다 품절이라 고민하다가 박시한 느낌으로 입으려고 구입했어요 편해요,"시한, 품절, 고민, 편하다"
사진으로 봤을 땐 별로 안이 뻤는데 실제로 받고 보면 너무 이 뻐요 편하고 좋네요,"뻤는데, 안이, 실제, 별로, 사진, 받다, 편하다"
오버핏으로 입으려고 샀는데 너무 예뻐요 여자친구가 뺏어 입었는데 귀엽 네 욬 잘 입을 게요,"뺏다, 귀엽다, 여자친구, 오버핏"
정말 이 쁘고 휘뚤마뚤 잘 입고 다닐 수 있어요 딱 핏하게 맞아서 좋네요,"휘뚤마뚤, 핏하, 맞다"
조금 박시하게 입고 싶어서 시켰습니 두 지 퍼 안 잠그면 엉덩이 가려지고 지퍼 잠그면 밴딩 해서 엉덩이 위로 올라가 여 소매가 좀 긴 편인데 접어서 입을 정도는 아닙니두,"잠그다, 엉덩이, 가려지다, 박다, 위로, 올라가다, 밴딩, 소매, 지퍼, 아니다"
두께가 엄청 두껍지 않아서 할 때 걸치기 좋아요 사이즈가 없어서 재고 나 길 기다리다가 우연히 하나 딱 풀린 거 보고 샀는데 좀 크긴 해요 밑단 밴딩이 워낙 해서 밑단 접어서 입으면 딱 좋아요,"밑단, 우연히, 재고, 워낙, 기다리다, 보고, 풀리다, 밴딩, 두껍다, 두께"
매우 만족 감사합니다 겨울 제외 계절로는 딱이네요,"제외, 계절, 겨울, 만족, 딱이다"
오버핏으로 크게 입 기 좋아요 요즘 날씨에 입 기 좋아요,"날씨, 크게, 오버핏"
제가 생각한 핏 그대로 나와줘서 너무 만족스럽습니다,"그대로, 만족스럽다, 나오다"
가볍게 걸치고 다니기 좋은 것 같습니다 단점은 길가다가 같은 옷 입은 사람이 많다 정도,"길가, 치고, 다가, 사람, 단점, 많다, 가볍다"
진짜 좋습니다 사이즈나 두께감 다 좋아서 정말 편해요,"두께감, 편하다, 사이즈"
아디다스 저지 최고 후루룹 였으면 기 장 더 예쁠 것 같지만 사이즈 없어서 샀습니다,"후루룹, 최고, 저지, 아디다스, 사이즈"
이 뻐요 옛 생각이 나는 옷이라 다시 구매했습니다,
여자친구 선물로 샀습니다 힙하고 너무 예쁘네요,"여자친구, 선물"
폴리백 포장으로 받았고 창고에 있던 건지 비닐 팩이 좀 낡은 느낌 그래도 상품은 좋았고 잘 사용할게요,"비닐, 창고, 낡다, 건지다, 폴리, 사용, 포장, 상품, 받다"
로 시키길 잘한 거 같아 요 기장이 좀 긴 거 같긴 하지만 감안하고 입을 수 있을 정도입니다 배송도 빨라서 좋았어용,"감안, 라서, 기장, 배송"
운동하러 갈 때 편하게 입을 만한 옷으로 샀는데 역시 좋습니다,"운동, 갈다, 편하다"
이 가격에 이 좋은 상품을 샀다는 게 너무 좋네요 사장님은 돈이 남으시려나,"사장, 남다, 상품, 가격"
오버하게 입으려고 샀는데 딱입니다 재질이 좀 약해 보이는 게 입을 때마다 불안하긴 합니다,"불안하다, 약하다, 마다, 보이다, 딱이다, 오버, 재질"
엄청 예뻐요 자주 입고 있어요 너무 만족해요 잘 산 거 같아요,만족하다
엄청 예뻐요 너무 맘에 들어 요 자주 입고 있어요 엄청 잘 산 거 같아요,
아디다스 열풍 때문에 같은 옷을 자주 마주치 긴 하지만 이 뻐요,"열풍, 마주치다, 때문, 아디다스"
너무 편하도 두께 좋도 활용도가 너무 좋습니다 완전 강추 도움돼요,"도움, 용도, 돼다, 강추, 두께, 편하다"
사이즈 딱 잘 맞고 어디에든 잘 어울려서 예쁩니다,"에든, 어울리다, 맞다, 사이즈"
사이즈로 샀더니 아우터로도 입을 수 있고 힙하고 좋아요,"아우터, 사이즈"
오버핏으로 입 기 좋은 사이즈 고 가볍게 나갈 때 좋아요,"가볍다, 오버핏, 사이즈"
막 입기도 편하고 재질도 괜찮고 무난하니 좋습니당,"니당다, 재질, 편하다"
어느 바지와 매치하던 힙 한 스푼 첨가됩니다 너무 편하고 예쁜 트랙탑,"첨가, 스푼, 매치, 바지, 트랙, 편하다"
사이즈 적당하고 너무 예뻐요 어디든 매치하기 좋아요,"매치, 적당하다, 사이즈"
져지는 낭만 그 자체인 거 같습니다 싸이월드 시대 느낌 그대로 나네요 캠프 캡이랑 쓰면 정말 귀엽습니다,"싸이월드, 캠프, 낭만, 시대, 쓰다, 귀엽다, 자체, 그대로, 져지"
아들이 좋아합니다 주 구장창 입고 다니네요 아디다스 져 지 굿,"장창, 아들, 좋아하다, 아디다스"
아디다스 계속 눈독 들이 다가 결국 샀는데 검은색이라서 어느 옷에도 괜찮네요 간절기 외투로 잘 입고 다녔어요 할 때 걸치거나 챙 좋은 것 같아 요 아디다스 클래식 디자인이라서 평범한 듯 하지만 나름 포인트가 되기도 하고 잘 입어지네요,"눈독, 외투, 들이다, 평범하다, 기도, 포인트, 나름, 아디다스, 간절기, 다가"
오버핏 좋아하시는 분들 저랑 체격 비슷하신 분들 저 사이즈 가시면 됩니다 너 무너무 이 쁘고 배송 진짜 멍 빨라요,"분들, 체격, 가시, 좋아하다, 오버핏, 빠르다, 배송, 사이즈"
간절기에 너무 잘 입고 다닙니다 하단 시보리 때문에 큰 사이즈로 구매했는데 생각보다 더 크네요,"하단, 크다, 간절기, 때문, 시보리, 사이즈"
오버핏으로 입으려 구 크게 샀는데 소재가 얇아 사 예쁘게 흘러내리는 핏이에 요,"흘러내리다, 핏이, 소재, 얇다, 크게, 오버핏"
너무 이 쁘고 잘 어울려 요 잘 입을 게요 감사합니다,어울리다
좀 크지만 오버사이즈로 입기엔 좋아요 그냥 저냥 굳,"굳다, 오버, 크다, 사이즈"
편안하게 입기에 좋고 가격도 할인해서 잘 삿습니자,"삿습니자, 편안하다, 할인, 가격"
무난무 난 하고 이 뻐요 요즘 날씨에 입 기 딱 좋아요,날씨
져 지 그 자체인 아디다스 져 지 휘뚜루 마 뚜루 입을 수 있어서 좋아요,"자체, 뚜루, 휘뚜루, 아디다스"
완전 완전 강추 입니다 그냥 입으세요 후회는 저는 세상에 한 가지 옷만 입는다면 이 옷을 입겠읍니다,"세상, 읍니, 후회, 가지, 강추"
딱 맞게 입을 수 있는 사이즈인 거 같아 요 오버한 맛으로 입으시려면 제 체형이 신분은 한 사이즈 크게까지도 괜찮아요,"신분, 체형, 사이즈, 오버, 크게, 맞다"
조금 더 작은 사이즈로 사시는 걸 추천 드려요 뭔가 되게 애매해요 오버핏도 아니고 정핏도 아니고 그치만 이 뻐용,"아니다, 뻐용, 사시, 정핏, 그치다, 애매하다, 드리다, 작다, 추천, 오버핏"
좋습니다 배송도 빠르고 핏도 딱 적당하 네료 좋슺니다,"좋슺니, 적당하다, 빠르다, 배송"
빠른 배송 감사합니다 입어보니 원단 나쁘지 않으듯요,"원단, 나쁘다, 입어보다, 빠르다, 배송"
스테디셀러답게 디자인 정말 예쁘고 편해 요 다만 밑단 시보리가 너무 꽉 잡아줘서 아래 지 퍼 쪽이 툭 튀어나오네요,"테디, 셀러, 튀어나오다, 잡다, 아래, 밑단, 디자인, 시보리, 편하다"
교복에도 어울리고 카고 팬츠 데님 팬츠에도 어울리는 만능이여서 한동안 자주 입었네요 보풀 많이 나오는 거랑 주변에 많은 거만 빼면 너무나도 좋아요,"팬츠, 어울리다, 거만, 주변, 능이, 너무나도, 데님, 한동안, 빼다, 많다"
핏이 너무 이 쁘고 가볍게 걸치기도 좋아요 다만 재질이 보풀일어나요,"기도, 일어나다, 보풀, 걸치다, 가볍다, 재질"
핏이 엄청 이 쁘고 가 벼게 입 기 좋아요 다만 재질이 보풀이 나요,"나요, 보풀, 가다, 재질"
요즘 져지가 너무 예뻐서 샀는데 크게 입으려고 샀는데 생각보다 안 크고 예쁜 것 같아 요 주머니에 지퍼도 있어서 좋네용,"주머니, 지퍼, 져지, 크게, 크다"
이쁘고 편합니다 어떤 옷이랑 도 무난무난하게 잘 어울려서 좋습니다,"어떻다, 어울리다, 편하다"
말해 뭐 해 너무 잘 입고 다닙니다 그냥 흑청 하나에 다가 만 입어도 딱이 고 좋습니다 너무 더 일찍 살 걸 하는 생각이,"일찍, 다가, 딱이다, 하나"
편하게 입 기 좋아요 근데 제 옷은 카라 부분이 이 상하게 와서 쫌 별로에요,"카라, 상하, 별로, 부분, 오다, 편하다"
그냥 이 뻐요 아무 데나 막 입어도 다 다른 맛으로 예쁨,
학교 갈 때 교복보다 더 자주 입고 있어요 너무 예쁘고 시보리가 잘 쪼여서 크롭하게 입고 싶을 때 올려 입으면 딱 좋아요,"크롭하, 학교, 쪼이다, 올리다, 갈다, 교복, 시보리"
예뻐요잘 입고 있어요 배송은 조금 느리지만 만족합니다,"느리다, 만족하다, 배송"
힙한 느낌 주고 싶어서 한 치수 크게 주문 했어요 원하는 핏이에요,"주다, 치수, 주문, 원하다, 크게"
기본템 중의 기 본템이라서 구매 했습니다 카고바지에 입는 게 젤 예쁜 거 같아요,"기본, 바지"
심하게 크지 않고 적당한 오버핏으로 편하고 색감도 좋네요,"심하다, 색감, 적당하다, 오버핏, 크다, 편하다"
너무 편하고 이 뻐서 데일리로 입기가 좋아요 스카 칼 때 입 기 좋스비낟,"스카, 좋스비낟, 데일리, 편하다"
기본적이고 심플하지만 그게 제일 멋진 맛일 듯 사이즈도 좋고 이 전 것처럼 해져 버릴 때까지 쭉 같이 갈 겁니다,"맛일, 멋지다, 겁니다, 심플, 버리다, 갈다, 기본, 사이즈"
캬 너무 맛도리입니다 이걸 왜 이제까지 안사 입었는지 후회될 정도에 요 담부턴 아디다스만 살 겁니다,"부턴, 도리, 후회되다, 겁니다, 알다, 아디다스"
막 입 그 좋고 봄 같은 날씨에 걸치면 적당한 두께감이 얘요,"두께감, 날씨, 걸치다, 적당하다"
적당한 핏에 매치하기 좋고 막 입 기 좋네요 추천합니다,"매치, 추천, 적당하다"
이 뻐 여 휘뚜루하게 걸쳐 입을 때 소화가 잘 됩니다,"소화, 휘뚜루, 걸치다"
상품이 아주 맛있어요 그냥 모든 거에 웬만하면 잘 맞아서 잘 착용 중입니다,"웬만하다, 맛있다, 착용, 상품, 맞다"
사이즈도 하고 요즘 유행해서 샀는데 아주 만족합니다,"유행, 만족하다, 사이즈"
활용 좋고 예쁘고 설명이 그닥 필요 없습니다 학생에게는 가격대가 조금 부담스러우 실 수 있지만 사면 후회하지 않아 요,"대가, 그닥, 에게는, 설명, 부담스럽다, 필요, 학생, 사면, 활용, 후회"
너무 두껍지도 얇지도 않아서 가볍게 걸치기 좋아요,"두껍다, 걸치다, 가볍다, 얇다"
너무 좋은 옷 요 정멀 대박이 애여 너무 좋아요,"대박, 멀다"
역시 파이어 버드 트랙탑 하나쯤은 가지고 있어야 합니다 약간 루즈하고 아무데나 매치하기 좋음,"가지, 매치, 루즈, 파이어, 버드, 하나, 트랙"
뭐 입지 싶을 때 딱 입고 나가기 좋습니다 정말 휘뚜루마 뚜루템,"뚜루템, 입지, 휘뚜루"
편하고 어 딜 가나 입 기 좋음 색도 이 쁘고 다른 옷이랑도 잘 어울려요,"가나, 색도, 어울리다, 편하다"
안감이 기 모가 있어서 초겨울까지 단품으로 입을 수 있고 여름만 아니면 계절 활용 가능하다는 게 큰 장점 그냥 힙함 입으면 예아 너무 편함 사이즈 한 사이즈 업하는 거 추천,"예아, 힙함, 장점, 초겨울, 안감, 활용, 가능하다, 계절, 아니다, 여름"
좀 큰데 큰 맛으로 입으니까 예쁘네요 시보리 좀 함,"크다, 시보리"
너무 이 뻐요 가격도 공홈보다 싸게 구매하여 좋습니다,"공홈, 싸다, 가격"
저지는 역시 아디다스 오버핏으로 입고 싶어서 구매했는데 딱 원하던 핏입니다 셋업도 이 쁘지만 카고 등 다른 바지랑 매치해서 입어도 찰떡,"찰떡, 핏입니, 셋업, 매치, 저지, 바지, 원하다, 오버핏, 아디다스"
편하게 입 기 좋고 상품 상태도 아주 양호합니다 잘 입을 거 같아요,"양호, 상태, 상품, 편하다"
딱 국밥 템에 보들보들하고 좋습니다 할인 받아 싸게 잘 샀네요,"보들보들하다, 국밥, 할인, 싸다, 받다"
카키색 카고바지랑 교복같이 입고 있습니다 역시 아디다스 저지 입으면 더 젊어 보이는 거 같아요,"카키색, 젊다, 보이다, 저지, 바지, 교복, 아디다스"
크 너무 편하고 예쁩니다 교복 위에 입는데 딱입니다,"딱이다, 교복, 크다, 편하다"
사이즈가 없어서 크게 샀는데 기 장 빼면 예쁘고 자주 입고 다녀요,"빼다, 크게, 사이즈"
몸에 딱 맞고 정말 편하고 스타일 있어서 좋아요 잘 사용 가능할 듯,"사용, 가능하다, 스타일, 맞다, 편하다"
오버한 느낌으로 딱 떨어져서 굉장히 맘레 들어요,"맘레, 굉장하다, 떨어지다, 오버"
트랙탑 필요했는데 너무 이 뻐요 다음에도 살 거 같아 요 감사합니다,"필요하다, 트랙"
저한텐 살짝 핏하긴 한데 완전 예뻐요 시보리가 강 한 편이에요,"편이, 시보리"
다 품절이라 못 샀었는데 여기서 싸게 사서 좋네요,"사서, 싸다, 품절"
다 품절이라 구하기 어려웠는데 여기서 싸게 사서 좋아요,"어렵다, 사서, 싸다, 품절"
너무 이쁩니다 좋은 가격에 사서 좋네요 잘 입을 게요,"사서, 가격"
기준으로 골반보다 좀 더 아래로 떨어져요 정 사이즈로 입고 싶으신 분들은 추천 드리고 좀 하게 입고 싶으신 분들은 추천드릴게요 사이즈 해서 안에 두껍게 입고도 불편함 없이 입을 수 있어서 좋았어요,"드리다, 추천, 골반, 불편하다, 아래, 기준, 두껍다, 떨어지다, 사이즈"
너무 좋아요 잘 입고 있습니다 배송도 빠르고 괜찮네요,"빠르다, 배송"
아래 쪼임 때문에 엄청 크다느 느낌은 없는 거 같아요,"달다, 쪼이다, 때문, 아래, 크다"
이쁘네요 색감도 좋고 사진보다 실물 훨씬 이 뻐요,"실물, 사진, 색감"
그냥 아무 때나 아무 코디에나 걸쳐도 무난무난한 아디다스 트랙탑 확실히 예쁘긴 한데 너무 막 입었나 보풀이 벌써 올라옴,"벌써, 올라오다, 확실하다, 코디, 보풀, 걸치다, 트랙, 아디다스"
인 여자가 입기에 사이즈 너무 하지 않고 오버핏으로 예쁨,"여자, 오버핏, 사이즈"
화면이랑 같고 후들 후들해서 오히려 여자분들이 이 쁠듯 안질리고 오래 입을 거 같음 한 여름 빼고 사 계절용 굳,"쁠듯, 안질리다, 여자, 굳다, 오래, 화면, 계절, 빼다, 분들, 여름"
엄청 후들 후 등거리고 흐르는 핏이라 더 야리야리 해 보임 키커서 손목 싹 덮는 핏 원해서 샀는데 딱 좋음 한 여름 전까지 잘 입을 듯,"흐르다, 보임, 야리야리, 손목, 거리, 덮다, 여름, 커서, 원하다"
진짜 핏 너무 예뻐요 예전부터 져 지 사고 싶었는데 아주 맘에 쏙 듭니다,"예전, 사고"
생일쿠폰으로 저렴하게 잘 샀어요 기 본템이라 예뻐요,"생일, 쿠폰, 저렴하다"
품은 그렇게 크진 않고 길이는 엉덩이 다 덮을 정도로 긴데 평소에도 오버핏으로 입는 거 좋아해서 괜찮아 여,"품다, 그렇게, 덮다, 엉덩이, 좋아하다, 길이, 오버핏, 크다"
생일 쿠폰으로 저렴하게 잘 샀어요 기 본 템입니당,"생일, 쿠폰, 저렴하다"
믿고 보는 파이어 버드 트렉탑 너무 좋은 져 지입니다,"트렉탑, 믿다, 버드, 파이어"
적당한 사이즈에 데일리로 입고 다닙니다 중학생들이 많이 입나 봐요,"중학생, 데일리, 적당하다, 사이즈"
특유의 무드 근본 핏감까지 아디다스 다운 퍼포먼스를 보여주는 옷,"퍼포먼스, 보여주다, 특유, 다운, 무드, 핏감, 근본, 아디다스"
평소에 진짜 많이 입고 다니는데 뭐랑 입어도 진짜 이 뻐요 그리고 얇아서 요즘 날씨에 입고 다니기 딱 좋아요 무엇보다 가 벼워서 너무 좋아요,"벼워, 날씨, 가다, 얇다"
학교 다닐 때 입을 려고 샀는데 진짜 너무 편해요 얇아서 통풍도 잘 돼서 너무 좋구요 무엇보다 입었을 때 너무 이 뻐요 근데 재질 때문인지는 모르겠지만 한 번 보풀이 나면 좀 심하게 나더라고요,"통풍, 지는, 심하다, 모르다, 학교, 돼다, 때문, 보풀, 재질, 얇다"
치마나 바지 어디에다 잘 어울리고 사이즈는 저한테 넉 낙했어요 안에 기 모맨투맨 입어도 딱히 불편하진 않더라구요,"에다, 치마, 딱하다, 투맨, 불편하다, 바지, 어울리다, 사이즈"
당연히 뭐 집에 하나씩 있어야 된다고 생각하는 옷 입니다,"당연하다, 하나"
자기는 좀 짧게 입고 싶으시다 하시는 분들은 시키시면 맞으실 것 같습니다 기본적으로 팔면 이 좀 길고요 시보리도 해서 좋습니다,"팔면, 짧다, 기본, 맞다, 시보리"
생각보다 허리 밴딩이 쪼여서 좀 불편한 거 말고는 좋아오,"허리, 말고는, 불편하다, 밴딩, 쪼이다"
사이즈 진짜 커요 그래도 잘 입고 다니고 있어요 오버핏 좋아해서 만족,"만족, 좋아하다, 오버핏, 크다, 사이즈"
어제 오후에 주문했는데 거의 반나절 만에 왔네요 포장은 박스가 아닌 폴리백에 왔습니다 상관없어요 핏이 예쁘니까요,"오다, 반나절, 어제, 상관없다, 박스, 폴리, 오후, 포장, 만에, 아니다"
아디다스져 지 다시 유행이여서 샀는데 너무 예뻐요,"유행, 아디다스"
오버하게 입고 싶어서 엑라 갔는데 예상은 했지만 총장이 너무 길어서 아쉽긴 하네요 그래도 예쁩니다,"총장, 예상, 아쉽다, 오버, 가다"
오버핏으로 입을 려고 한 치수 크게 샀는데 핏이 이 쁘네요,"쁘네, 치수, 크게, 오버핏"
이 뻐용 사이즈 크다고 해서 걱정했는데 이 쁘게 박시한 정도입니다,"시한, 뻐용, 걱정, 크다, 사이즈"
예상한 것만큼 겁나 이 쁘구요 너무 좋아 용 여성용 제품도 있긴 한데 확실히 남성용이 더 질도 좋고 이 쁜듯요,"쁜듯, 남성, 쁘구, 용이, 성용, 질도, 겁나다, 예상, 확실하다, 제품"
저렴하게 구매했는데 만족합니다 좋아요 또 구매해요,"저렴하다, 만족하다"
어떤 바지에 입어도 예쁜 옷인 거 같아 요 편하게 입기도 좋습니다,"어떻다, 바지, 편하다"
이빠요 사이즈도 짱이 고 완전 합니다 너무 만족스라워요,"만족, 사이즈"
역시 아디다스죠 이 쁘고 사이즈 적당하고 오버핏이 염,"적당하다, 오버핏, 아디다스, 사이즈"
기본 저지 필해서 샀는데 너무 이쁩니다 맘에 쏙 드러요,"드럽다, 기본, 저지"
