Review,keyword
진짜 착용하는 순간 힙해지고 너무 예뻐서 이것만 한동안 계속 코디하는데 쓸 듯 합니다,"쓸다, 한동안, 순간, 계속, 코디, 착용"
밑 부분이 쪼여서 핏이 이 상해지기도 하는데 머 나름 예뻐요 지 전,"상해, 나름, 기도, 쪼이다, 부분"
생각보다 크게 샀어요 그래도 옷은 이 뻐서 잘 입고 다녀요,크게
일단 시보리 자기주장 최요 그것만 빼면 너무 이 쁘고 좋은 것 같아요,"그것, 주장, 빼다, 시보리"
리얼 지금 개꿀템임 꼭 사셈 무조건 절대 후회안함 망능 아이템,"안함, 리얼, 망능, 개꿀템임, 절대, 아이템, 후회, 무조건"
사이즈가 좀 클 줄 알았는데 잘 맞아서 만족스러웠습니다 옷은 너무 이 뻐요,"알다, 만족스럽다, 맞다, 크다, 사이즈"
배송 빨라서 너무 좋았고 사이즈가 좀 클 줄 알았는데 제가 원하던 핏이라 좋았어요 잘 입고 있습니다,"알다, 라서, 원하다, 크다, 배송, 사이즈"
옷이 너무 얇고 금방 손상될 거 같아 요 그래도 옷은 예뻐서 잘 입어요,"금방, 손상, 얇다"
날이 풀리고 옷차림이 가 벼워질 때 져 지입으면 너무 좋아요,"옷차림, 비다, 풀리다, 가다"
디자인도 너무 이 쁘고 자주 입고 있습니다 근데 길에서 너무 자주 겹치긴 해요,"치다, 디자인"
아디다스 저지 옛날 생각도 나 고 좋습니다 사이즈 아주 크게 해서 입어도 이쁠거 같습니다,"옛날, 저지, 크게, 아디다스, 사이즈"
아디다스 져지는 오랜만이긴 한데 옷 자체는 이 쁨 근데 뭔가 나랑 안 어울리는 듯한 느낌이기도 하고 옷은 이쁨,"오랜만, 이기다, 이기도, 자체, 져지, 어울리다, 아디다스"
크게 입으니까 락스타가 된 것 같애서 기분이 좋아요,"락스타, 기분, 크게"
배송 빨라서 좋아요 그리고 사이즈 작게 나온 것 같아 요 엑스라지 샀는데 한 느낌,"엑스, 라지, 작다, 라서, 나오다, 배송, 사이즈"
그냥 진짜 편하게 휘뚜루마 뚜루 입을 아우터 찾으면 이 거만한 게 없습니다,"거만하다, 찾다, 뚜루, 아우터, 휘뚜루, 편하다"
아주 아주 아주 아주 구 웃 입니다 꼭 하나 사세요,하나
얇고 흐드러지는 재질인데 그래도 이 쁘고 맘에 들어요,"흐드러, 지는, 재질, 얇다"
요즘 진짜 거의 교복처럼 입고 다녀 요 클 줄 알았는데 딱 원하는 핏이라서 좋았습니다오버핏 좋아하는 사람 임 그치만 손 세탁하고 나니 앞 쪽에 흰색 실도 아니고 보풀도 아닌 것이 있어서 좀 그랬지만 그래도 좋아용,"아니다, 나니, 흰색, 사람, 그치다, 세탁, 그렇다, 알다, 보풀, 좋아하다"
너무 만족하며 입고 있습니다 아디다스 져지는 믿고 사는 거지만 핏이 일단 너무 예쁘고 표기상의 기장은 길게 나와 있지만 지퍼를 잠구면 시보리가 있어서 기장이 줄어 들어요 너무 예쁘고 후회 안합니다,"기장, 상의, 표기, 줄다, 거지, 잠구, 후회, 지퍼, 믿다, 살다"
약간 하누 정도로 딱 좋어요 완전 오버핏은 아니어서 한 사이즈 커도 괜찮었을 거 같어요,"아니다, 오버핏, 크다, 사이즈"
길이가 길긴 하지만 접어 입거나 하면 괜찮습니다,"접다, 길이, 길다"
어깨가 좀 있는 편인데 딱 맞습니다 기장이 길긴 한데 접어 입으면 좋아요,"어깨, 접다, 길다, 기장, 맞다"
지금 착용하기 좋아요 재질도 부드럽고 배송도 빨라서 좋아요,"착용, 부드럽다, 라서, 재질, 배송"
배송이 빨라서 좋어요 사이즈도 만족합니다 색감이 사진과 똑같아요,"똑같다, 사진, 색감, 라서, 만족하다, 배송, 사이즈"
예쁘게 맞아요 고등학생 아들 등 치가 있어서 더 커 보이면 어 떡 하나 고민했는데 후드 집업 바람막이보다 더 잘 입을 거 같아요,"집업, 보이, 고등학생, 바람막이, 치가, 후드, 아들, 고민, 하나, 맞다"
살짝 여유 있게 맞아요 카고 바지와 딱 떨어지게 예쁩니다 고딩 아들 아무대나 편하게 잘 어울려요,"고딩, 여유, 아들, 떨어지다, 바지, 어울리다, 맞다, 편하다"
배송 빨랐고 입기 너무 편해요 디자인도 너무 이 쁘고 편의점 갈 때 입기 딱 좋을 꺼 같아 요 잘 입을께요,"편의점, 끄다, 갈다, 디자인, 빠르다, 편하다, 배송"
너무 예뻐요 핏도 좋고 활동하기 편합니다 다음에 또 구매할 거 같아요,"활동, 편하다"
옷 이 뻐요 기본템이 되어버렸습니다 봄에 스타일 한 번 뽐내 보세여,"뽐내다, 버리다, 스타일, 되어다"
예전에 입던 져지보다 좀 더 트렌디하게 나온 핏이에 요 추천합니다,"트렌디, 핏이, 예전, 져지, 나오다, 추천"
시보리가 각을 잘 잡아줘서 예쁘게 잘 떨어집니다,"잡다, 떨어지다, 시보리"
오랜만에 져 지 샀는데 요즘 유행하는 스타일이라 이 쁘네요,"쁘네, 스타일, 오랜, 유행"
여자친구랑 같이 커플티로 맞추었는데 확실히 이 뻐요,"커플티, 맞추다, 여자친구, 확실하다"
아들 래미 구매해줬는데 맘에 들어합니다 누구나 하나씩은 있는 듯,"래미, 해주다, 아들, 하나"
색감이 쁘고 배송도 빨리 오고 이쁘네용 사이즈 밖에 없어서 시켰는데 좀 크긴 하네요 오버핏 좋아해서 만족합니당 이 뻐요,"밖에, 빨리, 색감, 좋아하다, 오다, 만족하다, 오버핏, 크다, 배송, 사이즈"
너무 예쁘고 입는 순간 힙해지고 무슨 바지에든 잘 어울려요,"순간, 에든, 바지, 어울리다"
배송 엄청 빨랐어요 일 걸렸어요 믿고 입는 트랙탑 역시나 예뻤습니다 코디할 방안도 무궁무진 하고 꾸안꾸로 입기도 좋고 범용성이 너무 좋아요 한 사이즈 업해서 입으니까 후리하게 입기 너무 좋아요 힙한 무드를 연출하고 싶으시몀 무조건 한 사이즈 업 추천해요 후기만 봤을 때 핏하게 입으시려는 분들이 많아서 그런지 제가 생각한 거 보다 사이즈가 막 크지는 않았어용,"무궁무진, 방안, 후리, 범용, 사이즈, 무드, 걸리다, 연출, 꾸안꾸, 후기"
휘뚜루 마뚜루로 입고 꾸안꾸로 편하게 힙하게 입고 싶을 때 입으려고 구매했습니 당 하게 입는 걸 좋아해서 시켰어 용 원래는 입습니다 상체 프레임이 체급에 비해 있으신 분들은 저처럼 한 사이즈 업 강추 합니다,"체급, 프레임, 힙하, 비다, 마뚜루, 꾸안꾸, 상체, 강추, 휘뚜루, 좋아하다"
요즘 유행해서 너무 잘 산 거 같고 그냥 이 쁘니깐 꼭 사세요,"니깐, 유행"
옷이 너무 이 뻐요 요즘 유행이라는 데 잘 입을께요,"이라는, 유행"
생각보다 얇아서 봄에 입으면 맞을 거 같고 사이즈는 딱 맞아서 입 기 좋았습니다,"맞다, 얇다, 사이즈"
할인 쿠폰 써서 한 만 원에 구매했는데 매우 매우 대 만족 중입니다 하자 있는 곳 없이 깔끔하게 와서 누무 기분이 좋아요,"누무, 하자, 써다, 기분, 대다, 할인, 만족, 쿠폰, 깔끔하다, 오다"
일단 배송이 압도적으로 빨라 요 일요일에 시켰는데 월요일에 도착했습니다 그리고 저랑 신체 사이즈가 비슷하면 추처네,"처네, 일요일, 압도, 월요일, 신체, 도착, 빠르다, 배송, 사이즈"
년 전에 입던 거 생각나서 다시 샀는데 요즘 다시 유행 도나 봄 길 가는데 중고등학생들 다 입고 다녀서 갑자기 입 기 좀 그르네 그냥 저냥 입을 만 합니다,"도나, 그르, 생각나다, 고등학생, 갑자기, 가다, 유행"
딱 기장이 적당해 요 살짝 얇은 감이 없잖아 있어요,"기장, 적당하다, 얇다"
덩치가 있는 편인데 사이즈 히 맞고 편해서 좋아 여 예쁘게 입을 수 있어서 마음에 듭니다,"치가, 맞다, 편하다, 사이즈"
핏 좋은데 사이즈가 좀 크게 나와서 배 쪽이 접히네요 그래도 기 본템으로 하나는 꼭 장만 해야 할 제품입니다,"장만, 제품, 접다, 하나, 나오다, 크게, 사이즈"
아디다스 져 지 잠깐씩 나갈 때 입 기 좋고 편함,"아디다스, 편하다"
휘뚜루 마뚜루 막 입고 다니기 좋아요 핏도 아주 좋습니다,"마뚜루, 휘뚜루"
두 사이즈업해서 오버사이즈로 입으면 좋움 만 원 매장보다 싸게 삼,"싸다, 매장, 오버, 사이즈"
상체가 좀 기 본적으로 커서 사이즈 고민 많이 했는데 기 장 빼고는 다 맘에 드네요 넘 예뻐요,"본적, 상체, 빼다, 커서, 고민, 사이즈"
착용감도 좋고 디자인도 이 뻐요 근데 좀 얇긴 해요,"착용, 디자인, 얇다"
사이즈 진짜 커요 색감도 비슷하고 디자인도 만족합니당 급한 일 때문에 서둘러 주문했는데 배송 시작 하루 만에 도착했어요,"급하다, 서두르다, 시작, 도착, 하루, 때문, 만에, 색감, 주문, 디자인"
생각보다 얇긴 한데 휘뚜루마 뚜루 입 기 편할 것 같앙요 백수룩에 또 한 가지 더 추가했습니다,"같앙, 추가, 백수, 가지, 뚜루, 휘뚜루, 얇다, 편하다"
역시 믿고 입는 아디다스입니다 다른 브랜드의 트랙탑도 입어봤지만 결국 아디다스로 돌아오네요,"돌아오다, 브랜드, 아디다스, 믿다, 입어보다, 트랙"
날이 풀리는 요즘에 입 기 좋아요 너무 두껍지도 얇지도 않아서 딱입니다,"풀리다, 두껍다, 딱이다, 얇다"
입었을 때 편하고 시보리가 굉장히 해서 좋았습니다,"굉장하다, 시보리, 편하다"
정말 편하고 생각보다 옷이 많이 가벼웠던 거 같아요,"가볍다, 편하다"
세탁 후 변형도 없고 배송도 빨리 되었어요 공부하러 갈 때 아무렇게나 입어도 편하고 재질에 예민한 편인데 손목이나 목 뒤에 거슬리는 것도 없어서 매일 입네요,"예민하다, 변형도, 거슬리다, 손목, 공부, 아무렇다, 세탁, 되어다, 갈다, 빨리"
넘 편하고 생각보다 따듯해요 지금 은 낮에 입 기 좋고 위에 패딩 입기도 편햐요,"편햐, 패딩, 따다, 편하다"
적당히 오버핏이라 입 기 편하고 데일리로 무난함,"데일리, 적당하다, 오버핏, 편하다"
한 사이즈 크게 시켜서 팔이랑 밑단은 좀 길었긴 했는데 딱 정당히 이 뻐서 괜찮았어요 건조기 돌렸는데 안 줄어듬 좋아요,"정당하다, 줄어듬, 건조기, 돌리다, 팔이, 밑단, 길다, 크게, 사이즈"
품절 되기 전에 사길 너무 잘 한 거 같네요 너무 예쁘고 여러 바지랑 매칭하기 좋아서 유용하게 입고 여름에도 잘 입을 거 같습니다,"유용하다, 매칭, 여러, 여름, 품절, 바지"
바지랑 매칭하기 너무 좋은 옷이라서 아주 만족합니다,"매칭, 바지, 만족하다"
한번 사고 싶었는데 품절 되기 전에 잘 산 거 같습니다 어떤 바지랑 다 잘 어울려서 만족합니다,"어떻다, 품절, 사고, 바지, 어울리다, 만족하다"
지금 날씨에 입 기 좋습니다 재질도 찰랑찰랑 시원하고 가 벼워서 막 입 기 좋네요,"찰랑찰랑, 벼워, 시원하다, 날씨, 가다, 재질"
예약 발송이라 늦을 줄 알았는데 이틀 정도 만에 받았네요 배송 엄청 빨라서 좋았습니다 기본템으로,"예약, 이틀, 발송, 만에, 알다, 받다, 라서, 배송"
요즘같이 봄이 다가오는 날씨에 이거 하나 입고 나가면 좋아요,"다가오다, 날씨, 하나"
진짜 겁나 이쁩니다 청바지에 하나 툭 걸치면 그냥 바로 코디 완성,"완성, 청바지, 겁나다, 코디, 걸치다, 하나"
너무 너무 사고 싶었던 상품이라 품절된 사이즈 재입고 알림 뜨자마자 구입했어요 덩치가 좀 있는데 사이즈 잘 맞아요 너무 예쁘고 핏도 맘에 들어요,"알림, 치가, 상품, 품절, 사이즈, 사고, 맞다"
옷이 시보리가 해서 옷 모양 잡기가 쉬워요 옷 이 쁘긴 해요,"모양, 쁘긴, 잡기, 쉽다, 시보리"
져 지 유행해서 샀는데 핏이 너무 이쁘네요 자주 입습니다,유행
요즘 져 지 유행해서 샀는데 핏이 진짜 잘 나와서 이 쁘네요,"쁘네, 나오다, 유행"
좋아 융 제 키랑 비슷하신 분들 중에 오버핏 원하시먼 이사이즈로 사시 면 될 거깉아오,"거깉아오, 멀다, 사시, 분들, 원하다, 오버핏, 사이즈"
제품 배송 좋구요 광고 한대로 좋습니다 요즘 간절기에도 입기 좋아요 색감도 선명하네요,"광고, 선명하다, 간절기, 대로, 제품, 색감, 배송"
사이즈 해서 접어 입으면 엄청 예뻐요 역시 파이어 버드,"접다, 파이어, 버드, 사이즈"
배송이 하루 만에 와서 좋아요 핏도 생각한 거랑 딱 맞아서 조아요,"하루, 만에, 오다, 맞다, 배송"
애들한테 인기인가봐요 너무 많이 입네요 딸 아이 구매해줬습니다 예쁩니다,"인가, 해주다, 인기"
진짜 너무 저스트 핏이에 요 너무 좋음 세탁해도 변형 없네 여 이 뻐요,"저스트, 변형, 핏이, 세탁"
세일 맞춰서 저렴하게 잘 샀습니다 가 성비 좋고 만족합니다,"성비, 맞추다, 세일, 저렴하다, 가다, 만족하다"
핏도 오버핏으로 너무 마음에 들고 너무 예뻐서 잘 입을 거 같아요,오버핏
아디다스 져 지 입고 싶어서 구매했는데 핏감이 너무 만족스러워요,"핏감, 만족스럽다, 아디다스"
하니 여윽시 아디다스 대충 나갈 때마다 주 서 입기 좋아요 느낌도 민들 맨들 하니 부드러워서 좋습니당,"대충, 여윽시, 마다, 서다, 니당다, 부드럽다, 아디다스"
얇아서 봄 여름에 입 기 좋을 듯합니다 아주 좋습니다,"여름, 얇다"
사이즈 조견 표보니 좀 크겠다 했는데 생각보다 정핏이구요 많이 얇네요,"정핏이구, 조견, 얇다, 크다, 사이즈"
사이즈가 생각보단 크지 않아 요 그리고 많이 얇네요,"보단, 얇다, 크다, 사이즈"
오예 와이투퀘이 나이스 느낌 쏘 굿 너 무너무 예뻐요,"와이, 쏘다, 투퀘, 오예, 나이스"
배송도 빠르고 굿입니다 사이즈도 잘 맞아요 옷이 넘 이 쁩니다,"쁩니, 맞다, 빠르다, 배송, 사이즈"
역시 믿고 보는 아디다스 져 지 좋은 거 같습니다 아주,"믿다, 아디다스"
저지의 재질이 아주 부드럽고 두께감도 투박하지 않고 좋아요 사이즈는 구입했다가 교환했는데 아주 핏 이 쁘게 맞아요 아주아주 맘에 듭니다,"박하다, 아주아주, 두께감, 교환, 부드럽다, 저지, 재질, 맞다, 사이즈"
너무 빠른 배송 감사드립니다 옷도 너무 이 쁘고 편해요,"감사, 드리다, 빠르다, 편하다, 배송"
아디다스 져 지 살까 말까 고민하다가 사게 되었습니 당 아디다스 져 지 살까 말까 고민하시는 분 계신다면 주문하시길 바랍니 당 일단 파이어 버드 너무 이 쁘고요 사이즈 딱입니다 맨날 맨날 학교 갈 때 놀러갈 때 등 맨날 입고 다녀 요 진짜 장담합니다 진짜 너무 이 뻐요 학교가면 애들이 다 아디다스 져 지 입고 있어요 그만큼 이 쁘고 인기 많다는 거겠죵,"맨날, 말다, 학교, 갈다, 고민, 살다, 아디다스, 바라다, 장담, 계시다"
아디다스 져 지 살까 말까 고민하다가 사게 되었습니 당 아디다스 져 지 살까 말까 고민하시는 분 계신다면 주문하시길 바랍니 당 일단 파이어 버드 너무 이 쁘고요 사이즈 딱입니다 맨날 맨날 학교 갈 때 놀러갈 때 등 맨날 입고 다녀 요 진짜 장담합니다 진짜 너무 이 뻐요 교복 위에 입어도 이 뻐서 학교가면 애들이 다 아디다스 져 지 입고 있어요 그만큼 이 쁘고 인기 많다는 거겠죵,"맨날, 말다, 학교, 갈다, 살다, 고민, 아디다스, 거겠죵, 계시다, 바라다"
아디다스 트랙 수트는 진리죠 교복템으로 잘 입고 있어요,"수트, 진리, 교복, 트랙, 아디다스"
무난해서 손도 잘 가고 편해 용 자 주 입어질 것 같아요,"가다, 편하다"
무난하게 입기 좋고 생각보다 사이즈가 작은 거 같아요,"작다, 사이즈"
크기도 적당하고 편안히 입기 좋아요 얇은 옷이라 봄철에 입기 좋아요,"봄철, 크기, 편안하다, 적당하다, 얇다"
색감도 예쁘고 올검이라 무난하니 좋네요 추천합니다,"색감, 추천"
마지막으로 운 좋게 구매 했는데 너무 예뻐요 진짜,마지막
역시 아디다스 제 스펙은 이걸로 가 세용 탄력 마감 다 굿,"세용, 탄력, 스펙, 마감, 가다, 아디다스"
무난하게 매일 입고 있어요 이쁘네요 주머니 지퍼도 있어서 편해요,"주머니, 지퍼, 편하다"
립이 많이 조인다는 후기가 많았는데 생각보다 그렇게 조이진 않더라고 요 적당히 탄력감 있어서 마음에 들었습니다 우븐 재질로 된 트랙탑을 오버사이즈로 입어서 이번 재킷은 적당한 사이즈로 골랐어요 오버핏도 예쁘지만 이 자켓은 정핏으로 입는 게 조금 더 예쁜 것 같네요,"적당하다, 조이진, 우븐, 재킷, 탄력, 고르다, 조이다, 자켓, 그렇게, 정핏"
배송도 빠르고 아이한테 살짝 크지만 무난하게 잘 어울려 요,"어울리다, 빠르다, 크다, 배송"
이 품절이라 한 치수 크게 샀는데 고딩 아이한테 살짝 끈듯 잘 맞네요 배송도 빠르고 휘뚜루마 뚜르 입기 좋을 것 같습니다,"뚜르, 끌다, 고딩, 치수, 품절, 휘뚜루, 크게, 맞다, 빠르다, 배송"
편안하게 입 기 좋아요 학교 갈 때 운동할 때 간편히 입고 나 걀수 있어 좋아요,"걀수, 간편하다, 운동, 편안하다, 학교, 갈다"
스테디인 이유가 있네요 해서 입기 편합니다,"스테디, 이유, 편하다"
재질도 부드럽고 배송도 빠르고 편하게 입고 다니기 좋아요,"부드럽다, 재질, 빠르다, 편하다, 배송"
사이즈 고민 많았는데 적당히 오버핏으로 잘 맞네요 완전 오버핏으로 갈라면 무조건 사이즈 업 하세요,"갈라, 오버핏, 무조건, 많다, 사이즈, 고민, 적당하다, 맞다"
사이즈는 작지도 않고 좋은데 시보리가 해서 지 퍼 올리면 조금 딸려 올라오는 부분이 있네요 이건 더 커도 이럴 거 같고 아무튼 이 뻐요,"딸리다, 아무튼, 이건, 올라오다, 올리다, 부분, 시보리, 크다, 사이즈"
옛 기억에 다시 사봤는데 역시나 이 쁘네요 잘 입을 게요,"기억, 쁘네, 사보다"
사이즈가 생각보다 커서 딱 맞게 입으시면 이 뻐요,"커서, 맞다, 사이즈"
아디다스 요줌 더 시 유행해서 샀는 게 크롭하게 입으니까 너무 이쁘네용,"크롭하, 유행, 아디다스"
립이 많이 조인다는 후기가 많았는데 생각보다 그렇게 조이진 않더라고 요 적당히 탄력감 있어서 마음에 들었습니다 우븐 재질로 된 트랙탑을 오버사이즈로 입어서 이번 재킷은 적당한 사이즈로 골랐어요 오버핏도 예쁘지만 이 자켓은 정핏으로 입는 게 조금 더 예쁜 것 같네요,"적당하다, 조이진, 우븐, 재킷, 탄력, 고르다, 조이다, 자켓, 그렇게, 정핏"
생각한 대로 오버핏에 기장도 적당해서 마음에 들었어요,"대로, 기장, 적당하다, 오버핏"
후반부터는 가 맞는 고 같습니다 가격도 쿠폰 맥여서 만 원에 야무지게 샀고 원단 기장 두께감 전부 맘에 들어요,"후반, 부터는, 야무지다, 원단, 두께감, 쿠폰, 가다, 가격, 기장, 맞다"
예상보다 팔 길이가 길었지만 배송도 빠르고 전체적으로 마음에 듭니다,"예상, 전체, 길이, 길다, 빠르다, 배송"
사이즈 잘 선택해서 구매한 거 같아 여 하고 좋아요,"선택, 사이즈"
근본이라 크게 말 할 건 없지만 배송이 진짜 빨라요,"근본, 크게, 빠르다, 배송"
맨날 입어 요 저지 불편해서 잘 안입는 디 얘는 짱 편해요,"불편하다, 맨날, 저지, 편하다"
너무 예쁘고 오버핏으로 사서 더 편하게 입을 수 있어서 좋아요 꾸안 꾸 느낌 유행 지나도 가볍게 입을 수 있을 꺼 같네요,"꾸다, 지나다, 끄다, 사서, 가볍다, 유행, 오버핏, 편하다"
우리가 흔히 아는 아디다스 기본템 여자친구 선물로 줬더니 아주 좋아하네용,"흔하다, 여자친구, 주다, 선물, 기본, 알다, 좋아하다, 아디다스"
사이즈는 정 사이즈인 것 같고 아디다스 트랙탑은 근본템,"사이즈, 근본, 트랙, 아디다스"
여성용은 크롭 처런 짧은 데에 비해서 길이도 길고 오히려 더 편합니다,"처런, 성용, 크롭, 짧다, 길이, 길다, 편하다"
옷도 이 쁘고 길이도 적당해서 봄이나 가을에 히 뚜루마 뚜루 입기 좋은 듯,"루마, 뚜루, 가을, 길이, 적당하다"
핏 존 예입니 덩 존 예 낡으면 또 살거에요 잘 입고 다니겠음,"낡다, 예입, 살다"
요즘 유행하는 아디다스 져지라서 많이 입을 거 같고 너무 이 뻐서 좋게 잘 산 것 같습니다,"져지, 라서, 유행, 아디다스"
근본 아디다스 져 지 파이어 버드가 다른 져지보다 핏이 예쁜 거 같네요,"근본, 져지, 버드, 파이어, 아디다스"
사이즈 시켰다 살짝 작은 느낌이 있어서 로 무료 교환 받았습니다 져 지 처음 사보는데 엄청 이쁘네요,"무료, 처음, 사보다, 교환, 받다, 작다, 사이즈"
고등학생 딸아이가 입어요 키에 키로 루즈하게 입기 위해 큰 사이즈 샀어요 이쁘다고 합니다 교복 위에 잘 입네요,"키로, 딸아이, 위해, 고등학생, 루즈, 교복, 크다, 사이즈"
루즈하게 입기 위해 구매했어요 재질은 일반 아디다스 져 지구 요 편안하게 잘 맞아요,"지구, 일반, 위해, 편안하다, 루즈, 재질, 맞다, 아디다스"
고등학생 딸아이가 사 달래서 주문했어요 키에 키로입니다 파이어 버드는 학생들 전용 져 지인 듯 합니다 교복 위에 걸치는 용 아이템인 듯 합니다 루즈하게 입어야 한다며 를 사달라 더군 요 핏은 사진에서 보시면 알 겁니다 요즘 애들 이렇게 입는 걸 좋아하는 것 같아 요 재질은 져지이고 얇아요,"전용, 보시, 더군, 딸아이, 달래다, 지인, 겁니다, 달라, 이렇게, 고등학생"
트렌디한 트랙탑 운동 갈 때도 입고 외출할 때도 입고 만능이어서 너무 좋네요,"외출, 만능, 트렌디, 운동, 갈다, 트랙"
오버핏으로 입고 싶어서 라지로 교환했고 아래 시보리가 해서 크롭핏 되고 좋습니다 여유 있는 핏이라 불편하지 않아요,"크롭핏, 불편하다, 여유, 아래, 라지, 교환, 오버핏, 시보리"
핏이 화면 그대로여서 좋아요 색감도 화면 그대로여서 좋아요 배송이 너무 빨라서 좋아요,"화면, 그대로, 색감, 라서, 배송"
파이어버드는 재발매 할 때마다 조금씩 핏이 바뀌는 거 같네요 원래 좀 크게 나온 거 같아 사이즈였으면 더 좋았겠지만 사이즈도 살짝 오버핏으로 잘 맞습니다 밑단 시보리가 하게 잘 잡아 주어서 예전 파이어 버드보단 훨씬 좋네요,"조금씩, 바뀌다, 주어, 발매, 마다, 보단, 잡다, 예전, 파이어버드, 사이즈"
오랜만에 사는 져 지인데 역시나 너무 예뻐요 사이즈가 큰 거밖에 없었지만 뭐 커서 문제 될 건 없으니까 요 박시하게 잘 입겠습니당,"문제, 박다, 밖에, 오랜, 니당다, 커서, 살다, 크다, 사이즈"
생각보다 따뜻해요 기장은 엉덩이 덮는데 시보리 해서 골반에 걸쳐 입어 요 팔기장이 길어서 더 예뻐요,"기장, 골반, 덮다, 따뜻하다, 엉덩이, 걸치다, 시보리"
배송도 괜찮았고 아디다스 져 지 너무 갖고 싶어서 주문했는데 너무 예뻤어요 밑에 밴딩이 완전 하긴 하지만 너무 이 뻐요,"밴딩, 갖다, 주문, 아디다스, 배송"
매장에서 입어보고 구매한 건데 적당히 엉덩이 덮고 오버라서 딱 마음에 들어 요 지 퍼 닫아도 열어도 좋고 요새 날씨엔 히트텍 하나 입고 이 거 입고 패딩이나 자켓 입으면 딱입니다 다른 바지에 코디해도 굿,"어도, 닫다, 히트, 패딩, 자켓, 해도, 건데, 매장, 덮다, 날씨"
배송이 빨라서 좋았아요 라지하려다 사이즈 사이즈 없어서 강제 엑라 했는데 딱 좋네오,"강제, 네오, 라지, 사이즈, 라서, 배송"
걍 계절 입기 좋은 옷 깔끔하고 유행 안타서 하나 정돈 사면 좋을 것 같아요 쿠폰써서 싸게 샀어요,"정돈, 안타, 써다, 사면, 계절, 쿠폰, 싸다, 깔끔하다, 하나, 유행"
팔 부분이랑 기장이 좀 길 긴 한데 시보리 때문에 기장은 괜찮고 팔은 접어서 입으면 되서 예뻐요,"기장, 때문, 부분, 접다, 시보리"
진짜 잘 샀음 아디다스 유행해서 너무 좋고 저 진짜 한 편인데 큼 겁나 크게 나온 거 같음 교복 위에 오버핏하게 딱 올라와서 너무 이 쁘고 생각보다 부드럽 구 얇릅,"얇릅, 겁나다, 올라오다, 부드럽다, 교복, 나오다, 유행, 크게, 오버핏, 크다"
키 큰 이 분들에겐 이 딱입니 당 시보리 짱짠하고 좋아요,"에겐, 짠하다, 딱이다, 시보리, 크다"
헐렁하게 입고 싶어서 샀는데 시보리도 하고 적당합니다,"헐렁하다, 적당하다, 시보리"
