Review,keyword
굿 확실히 듣던 대로 시보리가 자기 주장이 강 하네요 어릴 때 이 져지를 입은 형한테 삥 뜯긴 기 억이 납니다,"억이, 듣다, 주장, 어리다, 뜯다, 대로, 확실하다, 져지, 시보리"
사이즈 정 사이즈로 딱 맞고 시보리도 해서 좋아요 크게 사도 이 뻤겠지만 만족합니당 입고 다니면 너무 자주 보이는 게 단점,"뻤겠, 사도, 단점, 보이다, 사이즈, 만족하다, 크게, 맞다, 시보리"
사이즈 구매했다가 너무 커서 사이즈로 교환했어요 만족합니다 사이즈도 해요 이번 옷이 크게 나온 거 같아 요 착용감은 부드럽고 좋아요 입고 싶었던 거라 좋아요,"사이즈, 교환, 착용, 부드럽다, 커서, 나오다, 만족하다, 크게"
파이어버드 갖고 싶었는데 매일 입고 다닐 것 같어용,"파이어버드, 갖다"
사이즈도 좀 큰 가 했는데 하니 너무 좋구 핏도 이 뻐요,"가다, 크다, 사이즈"
입기 편합니다 좋아요 가성비 좋구요 디자인 좋습니다,"가성비, 디자인, 편하다"
역시 아디다스는 항상 실망시키질 않아서 좋아요 엄청 예쁘고 마감도 좋아요,"실망, 마감, 아디다스"
갔다가 로 교환했는데 교환하길 잘 함 흰티에 입어도 묻어나는 거 딱히 없는 것 같음 시보리 많이 조임,"교환, 묻다, 딱하다, 조이다, 희다, 가다, 시보리"
갑자기 트랙 위 아래로 입고 다니고 싶어서 샀어요 편하다,"갑자기, 아래, 트랙, 편하다"
대박 예쁨 그냥 근본 그 자체 크게 입으니까 넘 예쁨,"대박, 자체, 근본, 크게"
평소에 휘뚜루 마뚜루 입기도 좋고 포인트 주기도 좋습니다 재질이 흐물거려서 핏이 이 쁜데 밑단 시보리 때 매 배 부분이 좀 뜨는 게 아쉽네요 기장은 좀 긴 편입니다,"흐물거려, 쁜데, 주기도, 포인트, 마뚜루, 편입, 부분, 아쉽다, 휘뚜루, 밑단"
깔끔한 기 본 아디다스 져 지입니다 총기장이랑 소매 길이도 적당하고 마음에 들어요,"총기장, 소매, 깔끔하다, 길이, 적당하다, 아디다스"
키 인데 도 입어봤거든요 근데 이 핏이 더 맘에 들더라구 요 도 오버핏인데 시보리 접어 입으니 품도 그렇고 기장감이 뭔가 맘에 안 들어서 으로 바꿨어요 는 오버핏인데 뭔가 딱 맞는 오버핏 느낌 길이는 나이나 지 퍼 열먼 겁나 긴데 차피 접어 입을 거라 상관 안 하고 걍 으로 바꿈 시보리 접어 입으면 기 장 안길어요 밑에 시보리가 길고 쪼여서 접어도 절대 안 내려옴 근데 팔 이 겁나 길어요 줄넘기 가능할 듯 이상 팔다리 짧고 상체 긴 호빗의 후기 비슷한 분들 참고하셈,"접다, 겁나다, 오버핏, 시보리, 참다, 안다, 차피, 바꿈, 나이, 팔다리"
가을에 입 기 좋고 천 질감 디자인 다 괜찮네요 만족합니다,"질감, 가을, 디자인, 만족하다"
배송은 일반 배송이랑 똑같이 왔어요 한 사이즈 작게 입으면 더 좋을 거 같긴 한데 기다리기 귀찮아서 걍 입어요 너무 귀여움,"똑같이, 일반, 기다리다, 귀찮다, 배송, 작다, 오다, 사이즈"
초등학생 때 이후로 다시 처음 사네요 그때랑 비슷한 거 같습니다 핏은 훨씬 트렌디하게 나왔네요 야무지게 아무 데나 걸쳐도 예쁜 템입니다 같은 옷 입은 사람 하루에 스 무 명 이상 마주치지만 요,"초등학생, 이후, 마주치다, 트렌디, 야무지다, 사람, 처음, 하루, 걸치다, 나오다"
매장에서 입어보고 무신사에서 저렴하게 구입했어요 너무 맘에 듭니다,"무신, 매장, 저렴하다, 입어보다"
아디다스 트랙탑 다시 유행이여서 매장 사려 했더니 가격이 너무 비싸서 무신사로 시켰는데 매장에서 사는 거보다 만 원이나 아껴서 좋았습니 당 사고 싶었던 옷인 만큼 학원 갈 때나 놀러 갈 때 자주 입어요 아직 아침에 입으면 조금 얇아서 춥고 학교나 학원에서 입고 다니면 아주 딱 알맞아 용 제가 평소에도 사이즈 입어서 사이즈 샀는데 작을 줄 알았는데 생각보다 컸어용 안에 맨 투맨 입고 위에 트랙탑 입으면 아주 딱 알맞습니 당 저랑 키 비슷하고 몸무게 비슷하신 분들은 사이즈가 제격입니다 아디다스 트랠탑 꼭 사세요 안 사면 후회해요,"학원, 알맞다, 매장, 갈다, 트랙, 아끼다, 트랠탑, 제격, 몸무게, 사이즈"
리뷰 보니깐 많이 크다고 해서 걱정했었는데 하게 잘 맞아요 안에 얇은 기 모도 있어서 따뜻하 구 좋아요,"모도, 니깐, 리뷰, 따뜻하다, 걱정, 얇다, 맞다, 크다"
사이즈 젤 작은 건데 기장이 길어서 더 큰 사이즈하면 안 될 거 같아 요 첨엔 애매하게 길까봐 걱정했는데 밑에 시보리 땜에 저절로 올라가서 괜찮아요 예쁩니다,"저절로, 올라가다, 건데, 애매하다, 걱정, 사이즈, 작다, 기장, 시보리, 크다"
갑자기 파이어 버드 꽂혀서 샀는데 길이랑 품 다 괜찮아요 아래 쪼리가 너무 해서 잠그면 핏이 좀 이상한 데 늘어나겠죠 머,"쪼리, 이상하다, 늘어나다, 꽂히다, 갑자기, 아래, 잠그다, 길이, 버드, 파이어"
안의 살짝 기 모 같은 내용이 있어서 따뜻하고 재질은 뭠가 보풀이 잘 일어날 것 같은 재질이에요,"재질, 내용, 일어나다, 따뜻하다, 보풀"
가 정사이즈였던 거 같습니다 좀 오버핏이네요 제 생각엔 져지는 레귤러 핏으로 입어야 이쁩니다 여긴 다들 오버핏 매니아들만 있나 봅니다 저와 비슷한 신체 사이즈이신 분 가세요 너무 해요 상체 근육형인데도요,"매니아, 여기다, 정사이즈, 레귤러, 오버핏, 이신, 가세, 근육, 신체, 상체"
얇게 기 모 같은 게 있는 듯 하지만 얆 고 겨울 빼고는 어찌 저찌 입을 수 있을 거 같은 디 밑단이 너무 해서 지 퍼 잠그면 핏이 이 상해서 풀어서 입어야 되는 게 단점이고 팔 부분이 김,"풀다, 상해, 단점, 빼다, 겨울, 부분, 잠그다, 밑단, 얇다"
파이어버드 갖고 싶어서 택배만 기다렸는데 포장이 하지 않았는지 비에 박스랑 옷도 다 젖었네 영 건조기 돌리는 중입니 덩 좀 아숩 네여,"젖다, 아숩, 박스, 건조기, 기다리다, 택배, 돌리다, 포장, 파이어버드, 갖다"
무난합니다 핏 예뻐 영 지퍼 잠구면 크롭 한 기장이라서 좋아요,"크롭, 잠구, 지퍼, 기장"
배송이 일단 개 빠릅니다 안에 후드 레이어드하려고 폼 히 샀는데 그냥 입어도 사이즈 적당합니다,"레이어드, 후드, 적당하다, 빠르다, 배송, 사이즈"
편하고 가 벼움 조금 비싼 가 싶다가도 입어보면 맛도 리임,"가다, 벼움, 리임, 비싸다, 입어보다, 편하다"
너무 너무 좋아요 제가 딱 생각한 느낌에 생각한 핏입니다 겨울에도 이너로 입 기 좋아용,"핏입니, 이너, 겨울"
역쉬 아디다스 져 지 넘 예쁩니다 져 지 유행이 살짝 저물 긴 했는데 그래도 너무 갖고 싶어서 샀어요 일단 사이즈는 길이는 되게 긴데 지퍼 올리면 바로 크롭 해져서 상관 그 대신 사진 보면 배가 좀 튀어나와서 배불뚝이 같아 짐 그래도 예뻐서 봐줄 만 하게 튀어나 옴 완전 저의 휘뚜루 마 뚜루템입니댜 존 예 무조건 사십쇼,"대신, 튀어, 배불뚝이, 역쉬, 뚜루템입니댜, 사십, 저물다, 크롭, 상관, 튀어나오다"
배송이 좀 느렸지만 상품은 맘에 듭니다 선물용이였는데 작을까봐 걱정했는데 길이도 품도 딱이였어요 받는 사람도 맘에 들어 해서 기 분 좋았어요,"용다, 느리다, 품다, 사람, 선물, 걱정, 상품, 딱이다, 받다, 작다"
배송 진짜 빨라요 주문하고 다음날 바로 도착 했습니다 그리고 일부러 큰 사이즈로 샀는데 오버핏이라서 좋고 마감 하고 합니다 지금 딱 입기 좋아요,"일부러, 마감, 도착, 주문, 오버핏, 빠르다, 크다, 배송, 사이즈"
자다 일어났는데 하루 만에 배송 와 있어요 이 뻐요,"일어나다, 하루, 만에, 오다, 배송"
사이즈가 크게 나와서 로도 충분히 원하는 핏이에 요,"핏이, 충분하다, 원하다, 나오다, 크게, 사이즈"
아디다스 져 지 드디어 샀는데 좀 커용 얇긴 한데 안에 기 모 같은 거 들어 있어서 괜찮을 거 같아요,"드디어, 얇다, 크다, 아디다스"
정핏보다는 오버핏으로 입고 싶은데 아빠 옷 입은 느낌은 내기 싫어서 사이즈 고민하다가 구매했는데 원하던 핏이라 마음에 들어 요 소매 길어서 접어야 하고 밑단 시보리가 완전 합니다 초반에 키로 중반까지는 사이즈 입으셔도 적당한 오버핏으로 입으실 수 있을 것 같아 요 저는 개인적으로 생각보다 옷이 더 얇았어요 참고하세용,"내기, 중반, 오버핏, 키로, 아빠, 초반, 개인, 싫다, 참고, 정핏"
딱 생각한 디자인이여서 예쁘고 여러 바지랑 잘 어울려서 좋습니다,"여러, 바지, 어울리다, 디자인"
깔끔하고 좋아요 그냥 기 본 트레이닝 하나 사고 싶으면 추천해요,"트레이닝, 깔끔하다, 사고, 하나, 추천"
우선 배송이 진짜 개빨랐고 남자 정도인데 오버핏 으루 괜찮데 용 져 지 다시 유행이라 샀어용,"으루, 남자, 유행, 오버핏, 빠르다, 배송"
적당한 두께감이라 봄 가을에 입거나 이 너를 하게 입으면 겨울까지도 가능할 듯해요 주머니 자크가 있어서 저처럼 주머니에 물건 많이 넣어 다니는 사람은 흘릴 일도 없다는 믿고 입는 아디다스,"주머니, 흘리다, 물건, 일도, 넣다, 자크, 사람, 가능하다, 두께감, 겨울"
으로 시켰다가 로 바꿨더니 훨씬 더 좋은 핏이 나온 것 같아 요 랑 비슷하신 분들은 추천 드립니다,"바꾸다, 드리다, 나오다, 추천"
사이즈 기준 엉덩이 애매하게 덮어서 지 퍼 잠그고 활동하면 어느 순간 밑단 밴딩이 골반 위로 올라와 요 총장이 조금만 더 길었으면 좋았을 텐데 지퍼 잠글거면 아예 밑단 안으로 접어서 입어야 될 것 같아 요 제 팔이 짧아서 저한텐 팔 소매는 긴데 팔 긴 분들은 하시면 딱 오버핏으로 멋있게 입으실 것 같아 요 제 팔이 조금만 길었더라면 로 교환했을 것 같아요,"잠그다, 팔이, 밑단, 길다, 텐데, 멋있다, 덮어서, 순간, 활동, 위로"
엄청 오버하게 입고 싶어서 투엑라를 샀으나 체감은 엑스라지 정도 됩니다 많은 리뷰에서 말하시듯이 잠궜을 때 아래 시보리가 해서 불편함이 있으나 오히려 말아 넣어서 크롭하게 연출이 가능 항 것 같아 좋네요 매우 만족스럽습니다,"투엑라, 체감, 리뷰, 크롭하, 넣다, 가능, 연출, 불편하다, 엑스, 아래"
넥 부분이 길고 밑 시보리가 해요 끝까지 잠궈서 입으면 간 쥐남,"쥐남, 부분, 잠그다, 길다, 시보리"
핏이 정말 예쁜 거 같아 요 사이즈도 딱 맞고 바지 모두 다 잘 어울려요,"바지, 어울리다, 맞다, 사이즈"
근본 아디다스 파이어 버드 트랙탑 역시 너무 편하고 해요 봄 가을 초겨울까지는 입을 수 있을 정도의 두께감이었어요 배송도 너무 빠르고 포장도 하게 보내주셨어요 그리고 전 크게 입는 걸 좋아해서 사이즈 주문했어요 기장도 너무 길지 않아서 최고에 요 저랑 같은 신체 스펙이거나 크게 입는 걸 좋아하시는 분은 도 좋을 것 같네요 감사합니다 잘 입을 게요,"좋아하다, 크게, 보내다, 거나, 초겨울, 신체, 스펙, 포장, 두께감, 가을"
아디다스 저지답게 핏은 이쁘구요 지 퍼 잠그면 허리가 해요 전 개인적으로 기장이 길어서 총장 줄였어요,"줄이다, 허리, 개인, 총장, 잠그다, 기장, 아디다스"
사이즈 딱 좋고 역시 파이어 버드입니다 색감도 굿,"색감, 파이어, 버드, 사이즈"
재질도 좋고 색깔도 선명하니 좋아 욥 무난하게 입을 수 있읓 것 같아 욥 사이즈 크게 시키 세욥 추천입니다,"색깔, 있읓, 선명하다, 추천, 재질, 크게, 사이즈"
배송 시킨지 하루 만에 왔어요 포장도 하고 칼 배송이라 놀랐습니다 첫 아디다스 져 지인 대 뭐를 살지 고민하다가 이게 제일 기본템인 거 같아서 구매했어요 주머니에 자크가 있어서 너무 좋고 기준 엉덩이 덮는 기장입니다 참고하 세욧 두께는 딱 가을에 입으면 좋을 꺼 같고 이너 하게 입으면 겨울도 가능할 느낌입니다,"지인, 참고, 주머니, 대다, 자크, 배송, 끄다, 이너, 포장, 가능하다"
진짜 진짜 만족합니당 밑단 시보리가 하긴 한데 전체적으로 옷은 큰 편이라 여성분들은 이 사이즈로 사도 충분할 것 같아요,"여성, 사도, 편이, 충분하다, 분들, 전체, 밑단, 만족하다, 시보리, 크다"
생각보단 사이즈가 크게 나왔어요 처음에 샀다가 으로 교환했더니 딱 맞네요 예뻐요 그리고 얇은 거 치고 은 근 따뜻해요,"보단, 치고, 처음, 따뜻하다, 교환, 나오다, 얇다, 크게, 맞다, 사이즈"
너무 너 무너무 예뻐요 진짜 완전 만족 쿠폰 써서 더 싸게 사서 너무 좋아요 왜 다시 유행 하는지 알 것 같아요,"써다, 사서, 만족, 싸다, 쿠폰, 유행"
예쁩니다 클래식 이즈베스트란 말이 딱이에요 사 계절 잘 입을 수 있습니당,"베스트, 계절, 클래식, 니당다, 딱이다"
사이즈도 딱 좋고 핏도 넘 예뻐서 진짜 교복처럼 입고 다녀요,"교복, 사이즈"
제가 덩치가 있어서 마른 체형에 남자분들은 더 이 쁠꺼 같습니다 물론 제가 입었을 때도 너무 이쁜 져 지입니다,"쁠꺼, 남자, 마르다, 체형, 치가, 분들"
믿고 사는 근본 아디다스 저지 입니다 중학교 때가 생각나네요,"생각나다, 중학교, 믿다, 저지, 살다, 근본, 아디다스"
너무 이 쁘고 편해 요 겨울에는 이너로 입어서 포인트 주면 되고 봄에는 아우터로 입 기 적당한 두께 감입니다,"포인트, 주다, 이너, 겨울, 아우터, 두께, 적당하다, 편하다"
그냥 기 본템에 말해 뭐 해 입니다 사이즈 딱이고 그냥 완전 편하고 이 쁘고 근본의 옷이라고 생각되는 템,"이라고, 딱이다, 근본, 편하다, 사이즈"
아너무 쭈아 시보리 진짜 하네 여 총기장이 길어서 오버핏이란 느낌은 못 받앗 구 서양 인 기준이라 팔이 길고 품이 넉 낙하 단점에서 오버핏인 것 같네요,"이란, 서양, 낙하, 오버핏, 총기장, 단점, 기준, 팔이, 받다, 길다"
좀 더 핏하게 입으려면 사도 됐을 듯 휘뚤마뚤 입기 좋아용,"휘뚤마뚤, 사도, 핏하, 돼다"
옷이 너무 깔끔하고 소재도 좋네요 합니다 옷 자체가,"자체, 소재, 깔끔하다"
시보리 하다는 거 보고 어차피 잠궈 입을 거라서 라지로 샀어요 딱 원했던 오버핏이라 아주 아주 잘 입고 있습니당,"어차피, 보고, 니당다, 라지, 잠그다, 라서, 원하다, 오버핏, 시보리"
동네 마실용으로 샀는데 다른 때에도 여러모로 사용 가능해서 활용도 만점이고 와이드 팬츠랑도 잘 어 올려서 옷 입기 쉽네 영 말해 모합니까 아디다스트랙 탑인데 언능 쟁여들 가세요,"언능, 쟁여들, 동네, 만점, 실용, 모로, 가세, 쉬다, 와이드, 팬츠"
트랜드에 맞고 너무 예뻐요 가성비 좋게 입기 좋네요,"트랜드, 가성비, 맞다"
재질 부드럽고 살짝 오버핏으로 하게 가니깐 막 입어도 스포티한 느낌으로 다가 편하게 휘뚜루마 뚜루 입 기 아주 굿입니다,"스포티, 다가, 뚜루, 부드럽다, 휘뚜루, 가다, 재질, 오버핏, 편하다"
크게 입고 싶어서 로 바꾸려다가 못 바꿨는데 입어보니 도 충분하네요 핏 예뻐요,"바꾸다, 충분하다, 입어보다, 크게"
중아들이 사달라고 해서 사줬는데 좋아합니다,"중아, 달라, 사주다, 좋아하다"
사이즈는 살짝 오버핏 느낌이 나 고 역시 기본 클래식한 아이템이라 졸작 이너로 잘 활용했습니다,"졸작, 활용, 이너, 아이템, 클래식, 기본, 오버핏, 사이즈"
핏 좋네요 적당한 오버핏 느낌입니다 추천해요,"추천, 적당하다, 오버핏"
가볍게 입 기 편하고 예뻐요 유행 지나도 꾸안꾸로 입기 좋을 꺼 같습니다아 봄 가을에 입 기 편한 아우터 오버핏으로 구매해서 더 편하고 예쁜 거 같아 여어,"편하다, 지나다, 꾸안꾸, 끄다, 아우터, 가을, 가볍다, 유행, 오버핏"
존 예입니다 모델 핏처럼 입는 게 이쁜 거 같아 요 정 사이즈 추천,"모델, 예입, 추천, 사이즈"
항상 하나쯤 사고 싶었던 생각이 있었는데 이번에 생일 쿠폰 적용해서 저렴하게 구매했습니다 오프라인 매장에서 입어보고 핏이나 디자인이 너무 맘에 들어서 바로 구매했습니다 역시 저지는 아디다스,"오프라인, 적용, 들어서다, 생일, 매장, 쿠폰, 저렴하다, 저지, 사고, 입어보다"
요즘 다시 아디다스 저지 예뻐 보이네요 할인하는 거로 살까 하다가 걍 사고 싶었던 파이어 버드로 구매했어요,"할인, 보이다, 저지, 살다, 사고, 파이어, 버드, 아디다스"
다시 유행이 돌아오는 거 같더라구 요 오랜만에 입어보니 또 새롭네요,"돌아오다, 새롭다, 오랜, 입어보다, 유행"
진짜 마음에 듭니다 꾸안 꾸 느낌 뭔지 아시죠들 걍 와이드 청바지 매치하면 바로 패션 인터뷰,"꾸다, 인터뷰, 패션, 아시, 와이드, 청바지, 매치"
전부터 갖고 싶었던 아디다스 트랙탑이라 더 만족하고 입은 것 같아 용 사이즈도 좋고 막 입기에도 편해용,"갖다, 트랙, 만족하다, 아디다스, 편하다, 사이즈"
아디다스 저지 말해 뭐 합니까 그냥 트랙탑 정석입니다,"정석, 저지, 트랙, 아디다스"
배송도 상당히 빠르고 총 기장도 생각보다 짧아서 상당 헤 만족하게 입었습니가,"상당, 상당하다, 습니, 짧다, 기장, 만족하다, 빠르다, 배송"
상체 근육형이라 시켰는데 생각보다 한 치수 아쉽긴 하네요 그래도 핏하게 입기 좋습니다,"근육, 상체, 핏하, 치수, 아쉽다"
무난따리 무난따 괜춘따리 괜춘 따 좋은 가격에 잘 구매 하였습니다,"괜춘, 따리, 따다, 가격"
사이즈 딱 좋아요 길이감이 생각보다 긴 느낌이 안 들어서 좋아요 재 스펙엔 강추,"길이감, 들어서다, 스펙, 강추, 사이즈"
너무 예뻐요 날렵해 보이고 샤프해 보이는 느낌이에요 봄이 오면 맨날 입고 다닐 고에요,"샤프, 날렵하다, 보이, 맨날, 보이다, 오다"
갑자기 파이어 버드에 꽂혀서 사고 싶어서 찾아봤는데 합리적 가격으로 살 수 있어서 좋았습니다 두께는 그렇게 두껍지 않아서 요즘 날씨에 안에 반 팔 입고 입었는데 조곰 추웠어요 체육관이라 그럴 수도 있는데 다른 데 선 괜찮을 수도 핏은 약간 어벙한 데 만족한 핏이었습니다 참고로 파이어 버드 우먼으로 샀다가 아쉽게 포기하고 맨으로 다시 재구매 했으요 배송은 칼 배송,"수도, 파이어, 버드, 체육관, 포기, 우먼, 춥다, 어벙, 찾아보다, 꽂히다"
그냥 알던 아디다스 져지 같고 요 사이즈는 생각보다 좀 크네용,"알다, 져지, 크다, 아디다스, 사이즈"
배송이 완전 미쳤음 저녁 시에 시켰는데 다음날 오후 시에 옴 일단 이 거부터 사랑인데 옷도 완전 예쁘고 그냥 교복템 근데 사이즈가 인데도 큼 팔도 길고 통도 넓규 그치만 오버핏으로 딱,"팔도, 미치다, 사랑, 오후, 저녁, 넓다, 그치다, 교복, 길다, 오버핏"
팔이 좀 길 긴 한데 여러 가지 스타일링으로 입게 좋아여,"스타, 일링, 여러, 가지, 팔이"
디지인 두 깔끔하고 가 벼워서 어디든 편하게 입을 수 있어서 좋아요 청치마에 입어 두 귀엽고 청바지에 입어도 기여워용,"디지다, 워용, 기여, 치마, 벼워, 청바지, 귀엽다, 깔끔하다, 가다, 편하다"
이쁘고 지금 날씨에 입 기 딱 좋고 교복 위에 입으면 좋아요,"날씨, 교복"
조카가 사 달래서 사줬는데 넘이쁘다고 매일 입고 다녀요,"달래다, 조카, 사주다"
전 오버핏으로 입고 싶었고 사이즈 자체가 작게 나와 평소 를 착용하지만 로 주문하였습니다 큰 사이즈로 주문하니 제가 원하는 핏감이었고 군 기 없는 깔끔한 디자인이어서 좋았습니다,"주문, 핏감이었, 자체, 착용, 깔끔하다, 사이즈, 작다, 원하다, 나오다, 디자인"
사이즈 표 보면 총장은 긴데 시보리가 엄청 해서 실제 체감은 정도로 생각하고 구매하시먄 될 것 같아 요 생각보다 안에 얇은 기 모처럼 있어서 이너 하나 입고 입으면 안 추워요,"모처럼, 춥다, 체감, 실제, 총장, 이너, 하나, 얇다, 시보리, 사이즈"
매장에서 사이즈 샀다가 너무 커서 로 다시 샀는데도 커요 사이즈가 많이 크게 나왔으니 작게 사는 거 추천 두려용,"두다, 매장, 커서, 사이즈, 살다, 작다, 나오다, 추천, 크게, 크다"
생각했던 것보다 두께가 얇고 밑 부분 시보리가 해요 그레도 맘에 들어서 입어요,"그레, 들어서다, 부분, 두께, 얇다, 시보리"
매번 나오는 디자인이지만 파이어 버드가 소재나 핏이 이 쁜 것 같아요,"소재, 버드, 파이어, 나오다, 디자인"
일단 아디다스 상품 중 과연 베스트라 할 정도로 이 쁜 져 지입니다 이거랑 뭘 매차 해도 이쁘니까 그냥 돌격,"돌격, 베스트, 해도, 상품, 아디다스"
맘에 듭니다 옷도 이 쁘고 딱 맞아요 역시 유행은,"유행, 맞다"
마침 사이즈가 있길래 구매했습니다 하게 잘 맞습니다 여름이 히 왔으면 좋겠어요 아 그런데 흰 반지 위에 입으니 흰 바지에 검은색 이염이 생기더라구요 드라이를 한 번 하고 입어야겠어요 밝은 옷 입으시는 분들은 주의하셔야 할 것 같습니다 디자인은 역시나 클래식이 최고죠 스테디라 관리만 잘 하면 오래 입을 수 있을 것 같습니다 내부 안감은 약간 벨벳 느낌이 나요  부드럽게 몸을 잘 감싸줍니다 다 만 겉면에 보풀이 좀 생기더라구요 재질 특성인 것 같아 아쉽습니다 하지만 예쁜 건 어쩔 수 없네요,"희다, 생기다, 내부, 감싸다, 벨벳, 겉면, 특성, 어쩔, 관리, 이염"
시보리 부분이 쎄 게 잡아줘서 핏 잡기 용하기도 하고 예쁩네 여,"쎄다, 용하다, 잡기, 잡다, 부분, 시보리"
아무 옷에 나 가볍게 매칭하기 좋은 거 같아 요 파이어 버드라서 유로파 바지랑은 다르게 광택 살짝 있고 이너로 매칭하기도 좋네요,"매칭, 유로파, 다르다, 랑은, 광택, 이너, 바지, 가볍다, 라서, 버드"
배송 빠르고 흠 없이 잘 배송 되었구요 상품 디자인 괜찮아요 색상선명하고 간절기에 입 기 좋을 듯해요 배송은 좀 가치 있게 포장해서 주시면 더 좋겠습니다,"배송, 가치, 주시, 선명하다, 간절기, 색상, 포장, 되어다, 상품, 디자인"
길이가 조금 길긴 한데 밴딩 덕분에 지퍼 잠그면 적당해요 사이즈가 조금 큰 것 같딘한데 예뻐요,"같딘한데, 덕분, 밴딩, 지퍼, 잠그다, 길이, 길다, 적당하다, 크다, 사이즈"
배송도 빠르고 딱 맞는 핏으로 구매하고 싶었는데 제가 생각했던 핏으로 나와서 맘에 들어요,"나오다, 맞다, 빠르다, 배송"
핏도 진짜 예쁘고 은 근 따뜻하고 그냥 완벽합니다 깔별로 쟁여야 함,"쟁여, 깔별, 완벽하다, 따뜻하다"
요즘 다시 아디다스 저지 예뻐 보이네요 할인하는 거로 살까 하다가 걍 사고 싶었던 파이어 버드로 구매했어요,"할인, 보이다, 저지, 살다, 사고, 파이어, 버드, 아디다스"
트랜디하고 예뻐용 역시 근본은 근본이네요 재질은 약간 보풀 많이 생길거 같긴 해요,"근본, 트랜디, 생기다, 보풀, 재질"
편하게 입으려고 샀는데 너무 맘에 들어 요 잘 입고 다니겠슴다,편하다
오버핏으로 입으려고 샀는데 엄청 크네요 에 입은 분은 뭐지 대체 저랑 비슷한 키인 여성분들은 추천드려요 흐물흐물하고 얇아서 흘러내려 요 교환하기 귀찮고 막상 했다가 더 이 상할까봐 구매 확정 눌렀어요 조금 초딩처럼 보이기도 하네용,"확정, 누르다, 대체, 초딩, 이기도, 흐물흐물, 흘러내리다, 귀찮다, 여성, 분들"
팔이 조금 긴 거 빼곤 다 좋아요 자주 입고 다닐 것 같습니다,"빼다, 팔이"
옷이 너무 이 뻐요 사람들한테 왜 인기가 많은 지 알겠어요 사는 거 강추입니당,"사람, 인기, 강추, 알다, 많다, 살다"
