Review,keyword
아디다스 어렸을 때 자주 입는데 지금도 여전히 핏이 이 쁘네요 스포티하면서 힙한 감성을 살릴 수 있는 것 같아 요 다른 색상으로도 구매해보고 싶습니다,"여전하다, 스포티, 으로도, 어리다, 감성, 살리다, 색상, 쁘네, 아디다스"
살짝 딩 초가 된 기분 맘에 드러용 엄마 심부름 나갈 때 걸치기 좋아용,"심부름, 초가, 엄마, 드럽다, 기분, 걸치다"
옷이 많이 얇아서 여름에 걸치기 좋아요 기장은 만족스러운데 폼이 너무 크네요,"여름, 만족스럽다, 걸치다, 기장, 얇다, 크다"
져 지 하나 사고 싶어서 샀는데 편하고 예뻐요 근데 기장이 쫌 애매한 듯,"애매하다, 사고, 하나, 기장, 편하다"
밑단 시보리가 하긴 한데 전체적으로 옷은 큰 편이라 여성분들은 이 사이즈로 사도 충분할 것 같아요,"여성, 사도, 편이, 충분하다, 분들, 전체, 밑단, 시보리, 크다, 사이즈"
넘 예쁘고 근본 템입니다 하나씩 들 장만 하시와요,"장만, 근본, 하나"
오버핏인데 밑 부분이 너무 쪼여서 핏이 이 상해지기도 하는데 머 나름 예뻐요 지 전,"상해, 나름, 기도, 쪼이다, 부분, 오버핏"
너무 편하고 원래 크게 입으려고 산 거라서 맘에 드네요,"라서, 크게, 편하다"
원하는 디자인이라 맘에 들고 어디에도 휘뚜루 매일 템입니다,"휘뚜루, 원하다, 디자인"
역시 편해 여 툭하고 걸치기 좋아요 잘 입겠습니가,"습니, 걸치다, 편하다"
엄청 커요 허벅지 중간보다 살짝 위까지 와요 그치만 크게 입는 게 좋아서 그냥 입어 요,"중간, 허벅지, 그치다, 오다, 크게, 크다"
아재들은 아디다스 트랙탑 입고 나갈 때 용기가 필요 합니다,"용기, 필요, 트랙, 아디다스"
여기저기 잘 어울리고 크게 입으니까 편하고 좋슴당,"좋슴당, 여기저기, 어울리다, 크게, 편하다"
사이즈가 크게 나왔어요 정 핏으로 입으시려면 한 치수 작게 입는 것도 좋을 것 같아요,"치수, 작다, 나오다, 크게, 사이즈"
유행해서 예뻤습디당 히헤하 좋아요 다들 구매하셔요,"히헤하, 습디, 유행"
너무 예쁩디다 요즘 유행한다길래 사보았는데 맘에 들어 용,"디다, 사보다, 유행"
너무 이 뻐요 요즘 이것만 입습니다 강 추합니다 꼭 구매하세요,추하다
너무 이 뻐요 요즘 이 거 사고 이것만 입는 것 같네요 강 추합니당,"추하다, 사고"
소재도 디자인도 맘에 들어 요세탁 후 변형은 없고 뜯기지 않음 좋겠네요,"뜯다, 변형, 소재, 세탁, 디자인"
봄에 입 기 딱 좋은 아디다스 져지네요 요즘 밖에 진짜 많이 보여 요 인기인가 싶네요 다들 얼른 구매하셔요,"얼른, 인가, 밖에, 인기, 보이다, 아디다스"
마음에 듭니다 요즘 이것만 입어요 고딩 때로 돌아간 느낌,"돌아가다, 고딩"
정 사이즈로 가면 핏 안나옴 생각보다 늦게 주문해서 추운날 말고는 입을 수가 없으니 아쉽,"수가, 말고는, 가면, 늦다, 추다, 아쉽다, 주문, 나오다, 사이즈"
인기가 많은 만큼 가격이 부담될 줄 알았지만 합리적인 가격이라 너무 좋아요 실착도 너무 맘에 들구요,"가격, 부담, 실착, 합리, 인기, 알다, 많다"
오랜만에 져지를 재구매하게 됐는데 너무 만족합니다,"매하, 재다, 돼다, 오랜, 져지, 만족하다"
정말 정말 강 추합니당 근래 산 옷 중에 가장 맘에 드네요 어디에 입어도 다 어울려요,"근래, 가장, 추하다, 어울리다"
진짜 너무 이쁩니다 평생 갖고 있어야 할 아이템 같아요,"평생, 아이템, 갖다"
요즘 다시 너무 예뻐 보여서 보이자마자 바로 구매했습니다 너무 이 뻐요,보이다
옷도 편하고 질감도 좋고 많이 편해 고 배송도 빨라서 무심하게 그냥 구매하면 될 거 같아 요,"무심하다, 편하다, 질감, 라서, 배송"
옷도 편하고 질감도 좋고 많이 편해 고 배송도 빨라서 무심하게 그냥 구매하면 될 거 같아요,"무심하다, 편하다, 질감, 라서, 배송"
무신사 덕분에 실착 할 수 있네요 크림은 비싸던데,"실착, 크림, 덕분, 비싸다"
남편 선물로 구매했는데 사이즈 하고 좋아요,"남편, 선물, 사이즈"
맘에 듭니다 예전 싸이 감성도 나 고 유행 임거 같아요,"싸이, 감성, 예전, 유행"
너무 예쁘고 해요 핏도 아방 한 느낌이 있어 사 편하고 귀엽게 입을 수 있고 어디에나 받쳐 입 기 최고 임니닷,"받치다, 귀엽다, 최고, 편하다"
져 지 마구잡이로 입으려고 샀는데 넘 잘 산 거 같아 요 기부니가 좋아졌어요,"기부, 마구잡이, 좋아지다"
너무 맘에 들어 요 전체적인 핏도 이쁘고 딱 원하던 디자인의 옷이라 정말 잘 입고 잇네욯,"잇네욯, 전체, 원하다, 디자인"
아디다스 져 지 하나 장만 해봤는데 아랫단 시보리가 너무 해서 살짝 불 펴 놘 것 빼곤 너무 예쁘게 잘 입고 있습니다 재질 좋고 얇아서 봄이랑 여름 저녁 간절기 아주 실용성 입게 잘 입을 수 있을 것 같아요,"아랫, 해봤다, 실용, 펴다, 저녁, 간절기, 장만, 빼다, 여름, 하나"
건조기 돌리니까 보풀이 일어나긴 하는데 너무 잘 입고 있어요 다 잘 어울리고 좋습니다 시원해요 적당한 두께,"건조기, 시원하다, 돌리다, 일어나다, 두께, 보풀, 어울리다, 적당하다"
건조기 돌리니까 보풀이 일어나긴 하는데 너무 잘 입고 있어요 다 잘 어울리고 좋습니다 시원해요 적당한 두께,"건조기, 시원하다, 돌리다, 일어나다, 두께, 보풀, 어울리다, 적당하다"
잘 입고 있습니다 가볍고 청바지에도 어울리고 카고 팬츠에도 잘 어울려 요 시원하고 자주 입습니다,"어울리다, 청바지, 시원하다, 팬츠, 가볍다"
사이즈 참고해서 샀는데 저는 상체에 비해 하체가 짧아서 옷 기장이 생각보다 길었어요 엉덩이를 다 덮더라고요 적당하게 입고 싶으시다면 사에즈 추천합니다 저도 결국 바꿨네요,"하체, 참고, 비다, 상체, 바꾸다, 짧다, 덮다, 엉덩이, 길다, 추천"
나도 드디어 아디다스 져지를 맘에 쏙 드네요 밴딩 부분 쭉 내리면 엉덩이 덮을 정도에 길이여서 굳입니다,"내리다, 굳다, 드디어, 밴딩, 덮다, 부분, 엉덩이, 져지, 길이, 아디다스"
사이즈가 약간 크게 나왔어요 정핏으로 입으려면 감안해서 구매하세요,"감안, 정핏, 나오다, 크게, 사이즈"
친구 선물해줬는데 맘에 들어 하네요 베이직 한 스타일이라서 좋아요,"베이직, 친구, 해주다, 스타일, 선물"
잘 입고 다녀 요 편하고 잘 샀어요 만족하고 추천합니다,"추천, 만족하다, 편하다"
전날 오후에 주문했는데 다음날 오후에 도착했어요 몸이 커서 큰 사이즈 주문했는데 팔 길이 좀 길어서 몇 센치 잘랐어요,"오후, 주문, 전날, 자르다, 센치, 도착, 커서, 길이, 크다, 사이즈"
예뻐요 코디하기 편해요 어디에나 잘 어울려 요 운동복으로도 좋아요,"운동복, 으로도, 코디, 어울리다, 편하다"
배송 빠르고 퀄 좋아요 심하게 오버핏 아니에요 딱 입기 좋음,"심하다, 아니다, 오버핏, 빠르다, 배송"
어디에나 잘 어울려 요 코디하기 쉬워요 기 봄템이에요,"봄템, 쉽다, 코디, 어울리다"
예뻐요 코디하기 편해요 어디에나 다 잘 어울려요,"코디, 어울리다, 편하다"
예뻐요 셋업으로 입어도 좋고 바지 따로 져지 따로 입어도 좋고 넘멋 있어요,"셋업, 바지, 져지"
아주 사이즈도 딱이 고 맘에 듭니다 잘 산 거 같아 요,"딱이다, 사이즈"
딱 이네요 이 사이즈 남았길래 잘 샀어요 너무 만족합니다,"남다, 만족하다, 사이즈"
아디다스 저지가 유행히며 다시 구매했는데 예전 그 느낌 나면서 좋네요,"예전, 저지, 유행, 아디다스"
생각했던 대로 너무 예쁜 아우터였습니다 추천 드려요,"대로, 아우터, 드리다, 추천"
배송도 빨라서 너무 좋았어요 핏이 너무 마음에 들었고 디자인도 너무 마음에 들어요,"라서, 디자인, 배송"
배송도 빨라서 너무 좋았어요 핏이 너무 마음에 들었고 디자인도 너무 마음에 들어요,"라서, 디자인, 배송"
밑단 시보리 부분이 너무 해요 지 퍼 잠구 고 한 느낌으로 입고 싶었는데 그렇게 하면 밧줄에 묶인 것 마냥 해서 어쩔 수 없이 접어서 올려 입어야 해요,"묶인, 밧줄, 어쩔, 잠구, 그렇게, 올리다, 부분, 밑단, 접다, 시보리"
일부러 편하게 입으려고 큰 사이즈 구매했는데 너 무너무 만족스러워요 어릴 때 엄마 아빠가 절대 안 사 줬는데 이젠 제가 구매합니다 이게 어른의 행복 아닐까요,"어른, 행복, 아빠, 엄마, 어리다, 절대, 일부러, 주다, 아니다, 만족스럽다"
고 아들이 너무 잘 입고 있어요 길이도 길지 않고 딱 요즘 스타일이네요,"스타일, 아들, 길이, 길다"
퀄리티도 좋고 사이즈도 좋고 다방면으로 만족합니다,"다방면, 퀄리티, 만족하다, 사이즈"
색감 단색으로 진해서 예쁘고 사이즈도 작게 나와서 한 사이즈 크게 입는 게 좋을 거 같아요,"단색, 진하다, 색감, 사이즈, 작다, 나오다, 크게"
좀 흐물 흐물해 보일 수 있는 게 엄청 그렇지는 않고 재질이 부드랍고 얇아서 입고 다니기 좋아여,"흐물, 부드랍, 흐물해, 그렇다, 보이다, 재질, 얇다"
인데 살짝 오버한 느낌 색 감 예쁘고 재질 부드러워요 지 퍼 완전히 채워도 괜찮고 살짝 풀어도 예뻐용,"채우다, 완전하다, 풀다, 부드럽다, 오버, 재질"
마침 사이즈가 있길래 구매했습니다 하게 잘 맞습니다 여름이 히 왔으면 좋겠어요 아 그런데 흰 반지 위에 입으니 흰 바지에 검은색 이염이 생기더라구요 드라이를 한 번 하고 입어야겠어요 밝은 옷 입으시는 분들은 주의하셔야 할 것 같습니다 디자인은 역시나 클래식이 최고죠 스테디라 관리만 잘 하면 오래 입을 수 있을 것 같습니다 여자친구랑 커플로 입는데 예쁩니다  도움돼요,"희다, 도움, 주의, 마침, 관리, 반지, 이염, 밝다, 드라이, 스테디"
어깨가 넓어서 면 많이 클 줄 알았는데 딱 좋아요 몸 좋으신 분들은 생각보다 사이즈 커도 적당할 듯 해요,"크다, 넓다, 어깨, 알다, 적당하다, 사이즈"
기본템으로 추천드려요 한 사이즈라서 좋아요,"드리다, 라서, 추천, 사이즈"
기본템의 정석입니다 하나쯤 가지고 입으믄 찰떡입니다,"찰떡, 정석, 가지, 하나"
중학생 아들이 입고 싶다 해서 주문했는데 엄청 빨리 왔어요 딱 기본이네요,"중학생, 아들, 기본, 빨리, 주문, 오다"
이쁘긴 한데 사이즈였으면 더 이 뻤을 것 같은데 아쉽네요,"아쉽다, 사이즈"
믿고 입는 아디다스 져 지입니다 품질은 당연히 하고 오래 입을 수 있을 거 같아 요 자주 부딪히는 곳은 보풀이 일어나는 느낌이 있어요,"부딪히다, 당연하다, 품질, 오래, 일어나다, 믿다, 보풀, 아디다스"
교복 위에 입 기 너무 좋아요 다른 색 살까 고민했는데 검정이 제일 무난해요,"검정, 살다, 고민, 교복"
로 구매하길 잘했어요 오버한 사이즈감으로 입어주고 싶다면 제 스펙 기준 추천 드립니다,"스펙, 기준, 드리다, 오버, 추천"
그냥 사이즈로는 정말 큽니 당 자크 잠궈야 길이 줄어들어서 좋아요,"줄어들다, 자크, 잠그다, 길이, 크다, 사이즈"
기본템으로 하나 장만 하려고 고민하다가 샀는데 재질도 부드럽고 편하게 입을 수 있어서 좋아요,"장만, 부드럽다, 고민, 하나, 재질, 편하다"
마침 사이즈가 있길래 구매했습니다 하게 잘 맞습니다 여름이 히 왔으면 좋겠어요 아 그런데 흰 반지 위에 입으니 흰 바지에 검은색 이염이 생기더라구요 드라이를 한 번 하고 입어야겠어요 밝은 옷 입으시는 분들은 주의하셔야 할 것 같습니다 디자인은 역시나 클래식이 최고죠 스테디라 관리만 잘 하면 오래 입을 수 있을 것 같습니다 여자친구랑 커플로 입는데 예쁩니다,"희다, 이염, 주의, 드라이, 밝다, 반지, 마침, 관리, 스테디, 커플"
믿고 사는 아디다스 파이어 버드 트랙탑 핏이 예술입니다,"예술, 믿다, 살다, 버드, 파이어, 트랙, 아디다스"
믿고 사는 아디다스 파이어 버드 트랙탑 사이즈도 딱 예쁘고 핏도 예술 입니다,"예술, 믿다, 살다, 버드, 파이어, 트랙, 아디다스, 사이즈"
일단 무조건 갖고 있어야 하는 아이템 봄 가을 휘뚜루 마 뚜루 매일 입을 수 있음 강추,"아이템, 무조건, 뚜루, 갖다, 강추, 가을, 휘뚜루"
원래는 크림에서 살려다가 여기가 좀 더 싸고 괜찮은 것 같아서 사서 입어보니 전체적으로 괜찮았습니다 질감은 보들보들하고 가격도 정가이고 색감도 선명하고 디자인도 나쁘지 않아서 봄 가을에 두루 두루 돌려서 잘 입을 수 있을 것 같습니다,"정가, 크림, 보들보들하다, 살리다, 선명하다, 질감, 돌리다, 사서, 나쁘다, 전체"
일단 옷 색감은 사진이랑 똑같았고 배송이 매우 빨랐어요 다른 색도 살려고 합니다 근데 시보리에 힘이 없어요 살짝 작아요,"색도, 살리다, 똑같다, 사진, 색감, 작다, 시보리, 빠르다, 배송"
요즘 유향이라 많이 보이기는 하지만 어디에든 이 쁘게 매치할 수 있어요,"유향, 보이, 에든, 매치"
생각한 거보다 질도 좋고 요즘 유행이라 너무 이 뻐요,"질도, 유행"
예전에 샀다가 작은 사이즈로 사서 버린 기억이 이번에는 큰 사이즈로 사서 아주 만족하고 입고 다니고 있어요,"사서, 기억, 버리다, 예전, 사이즈, 작다, 만족하다, 크다"
사이즈 큰 편인데 핏하게 입을 생각이 아니였어서 만족 스럽네요,"핏하, 만족, 아니다, 크다, 사이즈"
배송도 빠르고 완전 마음에 들어 요 좋아요 좋아요 좋아요,"빠르다, 배송"
아들 매일 교볻처럼 입고 다닙니다 두깨감 질감 만족스러워요,"교볻, 깨감, 질감, 아들, 만족스럽다"
밑에 시보리가 생각보다 해서 만세 몇 번 하면 올라가긴 하지만 이 뻐용,"만세, 올라가다, 뻐용, 시보리"
디자인도 평범하고 아무렇게나 입 기 좋아요 배송이 빨라서 좋았어요,"평범하다, 아무렇다, 라서, 디자인, 배송"
요즘 핫한 아디다스 트랙탑 정말 편하고 좋아요 사이즈가 뿐이어서 로 구매했지만 하고 좋습니다,"트랙, 아디다스, 편하다, 사이즈"
도 크던데 더 박시하게 입으려고 샀더니 진짜 크네요 그래도 이 뻐요,"크다, 박다"
너무 이 뻐서 샀는데 진짜 사 길 잘 한 것 같아 요 단점이 있다면 밑단이 해요,"단점, 밑단"
막 입고 다니기 정말 좋은 것 같습니다 잘 입겠습니다,
교복 임 넘 이쁘구 큰데 밴딩 있어서 올리면 돼 요 좋아요,"밴딩, 돼다, 올리다, 교복, 크다"
근본 중의 근본 옷입니 당 다시 유행 중이라 샀는데 짱이 뻐요 기준 투엑라 괜찮았습니다 져 지 말 모 밑단시보리가 해서 크게 입는 거도 괜찮을 듯해요,"근본, 중이, 거도, 투엑, 기준, 유행, 크게, 시보리"
국룰져지 이쁘긴 이쁩니다 클론을 조심해야 한다는 단점 밑에 쭈리가 강 한 편입니당,"조심하다, 쭈리, 한다는, 클론, 국룰, 편입, 단점, 니당다, 져지"
국룰져지 이쁘긴 이쁩니다 클론을 조심해야 한다는 단점 밑에 쭈리가 강 한 편입니당,"조심하다, 쭈리, 한다는, 클론, 국룰, 편입, 단점, 니당다, 져지"
배송 빠르고 좋네요 다만 금액이 좀 사악하네요 그래도 아들이 만족하니 좋아요,"사악하다, 금액, 아들, 만족하다, 빠르다, 배송"
사촌 동생 사줬는데 활동복으로 편하게 입어요 감사합니다,"사촌, 동생, 활동, 사주다, 편하다"
투엑라 하길 잘했네요 오버핏하게 떨어지고 이 뻐요,"투엑, 떨어지다, 오버핏"
색감 맘에 들고 너무 예쁘네 여 역시 유명한 데는 이유가 있습니다,"유명하다, 이유, 색감"
클까봐 걱정했지만 하게 예쁜 핏 나오네요 매우 만족합니다,"걱정, 나오다, 만족하다, 크다"
사이즈 하게 입고 싶어서 로 구매했는데 확실히 이 쁜 것 같아요,"확실하다, 사이즈"
배송은 빨리 왔어요 쿠폰 적립금 해서 저렴하게 구매할 수 있었어요 투웨이로 되어 있어서 스타일링이 너무 편리하고 이 뻐요,"편리하다, 적립금, 일링, 스타, 쿠폰, 되어다, 저렴하다, 빨리, 오다, 배송"
세탁해보니 옷이 줄어들거나 그런 건 없는 듯 합니다 빠른 배송이며 입어보니 핏도 예쁘네요 펑 퍼짐하지 않코 날씬해 보여 요 진한 검정이며 화면과 같아 요 아디치곤 가격도 적당하다 봅니다,"날씬하다, 퍼지다, 진하다, 치다, 줄어들다, 아디, 검정, 화면, 세탁, 그렇다"
감성 어디에든 입기 편한 제품이고 꾸안꾸 느낌 제대로 살립니다,"제대로, 에든, 감성, 꾸안꾸, 살리다, 제품, 편하다"
아주 살짝 길다고 생각해서 딱 맞게 입고 싶다 하시면 추천 드립니다 확실히 이 쁘더라고요 교복이랑 같이 입어도 아주 잘 어울립니다,"덥다, 확실하다, 드리다, 교복, 어울리다, 추천, 맞다"
부드럽고 편하고 좋고 스타일 납니다 여러 번 세탁하니 보풀이 조금 나요,"나요, 여러, 스타일, 세탁, 부드럽다, 보풀, 편하다"
사이즈도 딱 맞고 핏이 너무 예쁘게 떨어집니다 또 구매하고 싶어요,"떨어지다, 맞다, 사이즈"
진짜 제 교복템 어디에나 다 잘 어울리고 예뻐요오옹,"교복, 어울리다"
편하게 입을 라고 샀는데 어느 코디에도 입기 좋네요,"라고, 코디, 편하다"
배송 빠르고 사이즈 업하는 게 편합니다 뜨,"빠르다, 편하다, 배송, 사이즈"
오버핏으로 입으려고 파이어 버드 구매했어요 갑오브갑 블랙 최고입니다,"오브, 블랙, 최고, 버드, 파이어, 오버핏"
진짜 자주 입어요 져 지 살까 말까 하다가 검정으로 하나 샀는데 다른 색도 사려고요 두께도 그리 안 두껍고 괜찮습디다,"그리다, 검정, 말다, 색도, 두껍다, 두께, 살다, 하나"
합리적인 가격에 좋은 제품 구매하게 되어 좋습니다,"합리, 되어다, 제품, 가격"
무난한 검은색 저지 좋네요 자주 입고 다닐 것 같아요,"검은색, 저지"
사이즈 로 잘못 옴 그래도 옷은 이 뻐서 넘어갈 게 여,"넘어가다, 잘못, 사이즈"
제 키에 크게 입으시려는 분들은 조금 작다고 생각하실 수 있을 거 같아 여 팔 부분은 하고 총장은 딱 맞는 느낌입니다,"총장, 부분, 작다, 크게, 맞다"
배송도 빠르고 사이즈도 루즈하게 잘 맞아요 원단도 얇아요,"원단, 루즈, 얇다, 맞다, 빠르다, 배송, 사이즈"
명불허 전입니다 요즘 다시 유행하고 있나보네요 휘뚜루 마 뚜루 잘 입겠습니다,"전입, 불허, 뚜루, 휘뚜루, 유행"
도 충분하고 은 팔이 좀 기네요 그래도 이 쁘면 그만,"그만, 기네, 충분하다, 팔이"
정말 너무너무 전부터 사려고 담아뒀던 상품인데 완전히 마음에 들어버렸숩니 다 이렇게 만족할 줄 이야 최고 야 아디다스 트랙탑은 정말 질리지 않는 최고입니당,"최고, 담다, 이야, 질리, 완전하다, 이렇게, 사려, 버리다, 두다, 상품"
너무 편하도 두께 좋도 활용도가 너무 좋습니다 완전 강추,"용도, 강추, 두께, 편하다"
편하게 입을 라고 크게 샀는데 크기도 적당하고 좋습니다 아래 시보리가 해서 잠그면 안에 티가 울어요,"울다, 라고, 크기, 아래, 잠그다, 적당하다, 크게, 시보리, 편하다"
옷 하고 좋아요 한 치수 업하는 거 추천함 미다,"밉다, 치수, 추천"
요즘 유행하는 아디다스 트랙탑 착용감도 편안하고 환절기에 입기도 적절한 두께입니다 오버핏으로 구매해서 입는 걸 추천 드리구요 최고 단점은 너무 예뻐서 길거리에 입고 다니시는 분들이 자주 눈에 띈다는 거 정도,"띄다, 적절하다, 길거리, 환절기, 편안하다, 단점, 최고, 착용, 드리다, 두께"
근본 파이어버드 너무 이쁘네요 데일리로 계속 입을 듯,"데일리, 계속, 파이어버드, 근본"
총기장이랑 시보리 길긴 한데 말하면 뭐 합니까 파이어 버드 이 쁘고 편하네요,"총기장, 버드, 파이어, 길다, 시보리, 편하다"
싸이즈 여유 있고 생각보다 잘 어울리네요 추천합니다,"싸이즈, 여유, 어울리다, 추천"
옛날 생각도 나 고 너무 이 뻐요 한 사이즈 더 크게 살 껄 그랬어요,"옛날, 그렇다, 크게, 사이즈"
배송도 빠르고 사이즈도 잘 맞아요 파이어 버드 굿,"버드, 파이어, 맞다, 빠르다, 배송, 사이즈"
생각보다 시보리가 해서 크게 가도 좋은 거 같아요,"가도, 크게, 시보리"
배송 빠라서 좋고 재질은 얇은 데 입으면 얇아 보이진 않음 안 감 때문에 좀 따뜻함,"얇다, 때문, 따뜻하다, 보이다, 재질, 빠르다, 배송"
학교에서 맨날 입습니다 너무 이 뻐요 근데 똑같은 옷 많아서 거슬림,"거슬리다, 맨날, 똑같다, 학교, 많다"
배송 빠릅니다 옷은 실제로 입으면 더 이 쁘고 지금 날씨에 딱 입니다,"실제, 날씨, 빠르다, 배송"
재질도 좋고 마음에 들어 요 전투복으로 입을 게요,"전투복, 재질"
조아요저아요조아어 옹 딱 맞아 요 괜찮아요,"요조, 맞다"
미듐 사이즈로 구매했는데 사이즈랑 팔이 길어요 안에 니트류 입고 밖에 걸쳐도 불편하지 않아 요 요즘 같은 계절에 걸치고 다니기 좋아요,"니트, 미듐, 밖에, 치고, 불편하다, 계절, 팔이, 사이즈, 걸치다"
깔끔하고 가볍고 완전 좋아요 가격은 살짝 비싸지만,"비싸다, 깔끔하다, 가볍다, 가격"
너무 좋슺니 당 옷이 이 쁘고 여러 코디하기 참 좋은 거 같아요,"좋슺, 차다, 여러, 코디"
딱 원하던 핏이고 너무너무너무 이 뻐요 지금 날씨에 딱 이야요,"날씨, 원하다"
너무 예쁘고 가볍게 걸치고 와이드 팬츠 입으면 코디하기가 너무 쉽습니당,"쉬다, 와이드, 팬츠, 치고, 니당다, 코디, 가볍다"
진짜 사이즈도 너무 잘 맞구 기장 길줄 알고 걱정했는데 밑에 시보리가 똭 잡아줘서 너무 예쁜 핏 나오네요,"잡다, 걱정, 나오다, 기장, 맞다, 시보리, 사이즈"
역시 트레이닝 져지의 근본 아디다스 최고네요 다시 유행해서 넘 기 뻐요 추억이 새록새록 나네요,"새록새록, 추억, 트레이닝, 최고, 근본, 져지, 유행, 아디다스"
가 없어서 으로 구매했는데 확실히 좀 크네요,"확실하다, 가다, 크다"
배송 빨랐고 잘 산 거 같아 요 앞으로 잘 입겠습니다,"빠르다, 배송"
핏도 이쁘고 마감도 좋고 요즘 유행하는 이유가 있네요,"이유, 마감, 유행"
그냥 무난하게 평소에 이용하기에 너무 좋네용 굿,이용
파이어버드 갖고 싶었는데 계속 품절 떠서 어렵게 구했네요 그만큼 상품에는 만족합니다,"어렵다, 그만큼, 계속, 파이어버드, 갖다, 상품, 품절, 만족하다"
길이도 생각보다 나쁘지 않고 딱 기 본템으로 잘 입을 거 같아용,"나쁘다, 길이"
길이도 생각보다 나쁘지 않고 딱 기 본템으로 잘 입을 거 같아용,"나쁘다, 길이"
그냥 전투용으로 사봤는데 너무 편하고 어디에도 입기 좋네용,"전투, 사보다, 편하다"
근육형 체형입니다 몸에 잘 맞고 가죽처럼 입고 다니는 중임 굿,"중임, 가죽, 근육, 체형, 맞다"
사이즈 합니다 기장도 적당합니다 예쁩니다,"기장, 적당하다, 사이즈"
살짝 긴 감이 있지만 시보리 있어서 넣어 입으니 좋아요 가볍고 편해서 여기저기 아무 옷이나 매치 가능해서 추천해요,"넣다, 여기저기, 가능하다, 매치, 가볍다, 추천, 시보리, 편하다"
좋아 오 저는 아디다스 져 지 꼭 사고 싶어서 많이 큰 사이즈 루 구매했는데 자 알 입으면 그렇게까지 크기 느껴지진 않슴다,"않슴다, 느껴지다, 크기, 그렇게, 사고, 크다, 아디다스, 사이즈"
그저 근본 아디다스 저지입니다 요즘 다시 유행하길래 사봤더니 역시나 훌륭합니다,"훌륭하다, 사보다, 저지, 근본, 유행, 아디다스"
사이즈가 넘크긴 한데 오버핏 원한 거라 괜찮아요 한 사이즈 작게 삿으면 더 좋앗을 듯,"삿으, 원한, 사이즈, 작다, 오버핏, 크다"
져 지 입을 날이 오길래 하나 장만 했습니다 역시 근본 져지,"장만, 져지, 근본, 하나, 오다"
