Review,Processed_Review,common_keywords_all,common_keywords_3_plus
역시 제일예뻐요 하얗고 루즈티에 레이어드하려고 샀는데 잘어울릴거같아요 빨리 여름에 입고싶습니다,역시 제일 예뻐요 하얗고 루저 티에 레이어드하려고 샀는데 잘 어울릴 거 같아요 빨리 여름에 입고 싶습니다, 어울리다,"레이어드, 루저, 빨리, 어울리다, 여름, 티, 하얗다"
치마 러블리하고 키작녀한테 길이도 좋고 가격도 할인받아 싸게 가격대비 좋아요,치마 러블리하고 키작녀한테 길이도 좋고 가격도 할인받아 싸게 가격 대비 좋아요," 대비,  길이,  치마,  러블리","가격, 길이, 대비, 러블리, 받다, 싸다, 치마, 키작녀, 할인"
엄청 러블리하고 리본이 둘러져있어서 귀여워요. 속바지도 있어서 좋아요. 좀 짧아서 키작녀들이 입기 좋아요,엄청 러블리하고 리본이 둘러져 있어서 귀여워요 속바지도 있어서 좋아요 좀 짧아서 키작녀들이 입기 좋아요," 귀엽다,  짧다","귀엽다, 두르다, 러블리, 리본, 속바지, 짧다, 키작녀"
"리본스커트 화이트 너무 귀엽고 사랑스러워요
속바지가 있어 편하고 원단도 가볍고 시원해요",리본 스커트 화이트 너무 귀엽고 사랑스러워요 속바지가 있어 편하고 원단도 가볍고 시원해요," 가볍다,  시원하다,  화이트","가볍다, 귀엽다, 리본, 사랑스럽다, 속바지, 스커트, 시원하다, 원단, 편하다, 화이트"
"요즘 귀여운 리본 레이스 스커트가 자꾸 눈에 밟혀서 사봤는데 진짜 딱 맘에들어요 ㅎㅎ🎀 레이스에 리본까지 달려있어서 귀엽고 크롭티, 박스티, 셔츠까지 다 잘어울리네요!!💝 안에 바지도 넉넉해서 입자마자 편하고 비침도 거의 없어요! 저는 키가 많이 작아서 길이도 딱 괜찮았는데 짧긴 하네욯ㅎㅎ오자마자 찍은거라 주름이 좀 있는데 스팀하니까 금방 펴지더라구요! 여름에 잘 입을거같아요~",요즘 귀여운 리본 레이스 스커트가 자꾸 눈에 밟혀서 사봤는데 진짜 딱 맘에 들어요 레이스에 리본까지 달려있어서 귀엽고 크롭 티 박스티셔츠까지 다 잘 어울리네요 안에 바지도 넉넉해서 입자마자 편하고 비침도 거의 없어요 저는 키가 많이 작아서 길이도 딱 괜찮았는데 짧긴 하네욯오자마자 찍은 거라 주름이 좀 있는데 스팀 하니까 금방 펴지더라고요 여름에 잘 입을 거 같아요,,"길이, 넉넉하다, 레이스, 리본, 밟다, 비침, 사보다, 스커트, 어울리다, 작다, 키"
"요즘 귀여운 리본 레이스 스커트가 자꾸 눈에 밟혀서 사봤는데 진짜 딱 맘에들어요 ㅎㅎ🎀 레이스에 리본까지 달려있어서 귀엽고 크롭티, 박스티, 셔츠까지 다 잘어울리네요!!💝 안에 바지도 넉넉해서 입자마자 편하고 비침도 거의 없어요! 저는 키가 많이 작아서 길이도 딱 괜찮았는데 짧긴 하네욯ㅎㅎ 오자마자 찍은거라 주름이 좀 있는데 스팀하니까 금방 펴지더라구요! 여름에 잘 입을거같아요~",요즘 귀여운 리본 레이스 스커트가 자꾸 눈에 밟혀서 사봤는데 진짜 딱 맘에 들어요 레이스에 리본까지 달려있어서 귀엽고 크롭 티 박스티셔츠까지 다 잘 어울리네요 안에 바지도 넉넉해서 입자마자 편하고 비침도 거의 없어요 저는 키가 많이 작아서 길이도 딱 괜찮았는데 짧긴 하네욯 오자마자 찍은 거라 주름이 좀 있는데 스팀 하니까 금방 펴지더라고요 여름에 잘 입을 거 같아요,,"길이, 넉넉하다, 리본, 밟다, 비침, 스커트, 어울리다, 자꾸, 작다, 키"
디자인 리본이 너무 귀엽고 소재도 시원하고 속바지가 달려 있어요 편해요,디자인 리본이 너무 귀엽고 소재도 시원하고 속바지가 달려 있어요 편해요," 소재,  리본,  시원하다,  디자인,  귀엽다","귀엽다, 달다, 디자인, 리본, 소재, 속바지, 시원하다, 편하다"
"가성비 너무 좋아요ㅠㅠ완젼 갓성비...핀터 갬성 룩 완성...엉덩이가 커서 좀 퍼지긴 하지만 디테일도 너무 이쁘고 이 가격에 살 수 있다니,, 플레이스 스튜디오 감사합니당",가성비 너무 좋아요 완전 가성비 핀터 갬성 룩 완성 엉덩이가 커서 좀 퍼지긴 하지만 디테일도 너무 이쁘고 이 가격에 살 수 있다니 플레이스 스튜디오 감사합니다,,"가성비, 개다, 성, 스튜디오, 엉덩이, 완성, 퍼지다, 핀터"
세일할때 잘사서 만족합니다 !! 밴드라서 엄청 편하고 짧을줄알았는데 내려입으니까 그렇게 막 짧지도 않어요 마음에 들어용 ㅎㅎ,세일할 때 잘 사서 만족합니다 밴드라서 엄청 편하고 짧을 줄 알았는데 내려 입으니까 그렇게 막 짧지도 않아요 마음에 들어요," 짧다,  편하다,  밴드","내다, 라서, 만족하다, 밴드, 사서, 세일, 알다, 짧다, 편하다"
세일할때 잘사서 만족합니다 !! 잘입을게영 마음에 들어용 ㅎㅎ,세일할 때 잘 사서 만족합니다 잘 입을게요 마음에 들어요,,"만족하다, 사서, 세일"
받자마자 너무 짧아서 당황했는데 입어보니까 딱 적당한 길이여서 다행이에요… 리본들 너무 귀여워요,받자마자 너무 짧아서 당황했는데 입어보니까 딱 적당한 길이여서 다행이에요 리본들 너무 귀여워요," 적당하다,  리본,  받다,  길이","귀엽다, 길이, 다행, 당황, 리본, 받다, 여서, 입어보다, 적당하다, 짧다"
가볍고 편해서 여름에 시원하게 입기 좋을것 같아요.제 키에는 많이 짧지 않아요,가볍고 편해서 여름에 시원하게 입기 좋을 것 같아요 제 키에는 많이 짧지 않아요," 시원하다,  짧다,  여름","가볍다, 시원하다, 에는, 여름, 짧다, 키, 편하다"
"군데군데 붙어 있는 리본이 정말 귀엽습니다.
그리고 생각보다 소재가 탄탄해서 라인 유지가 잘 될 것 같아요.
이런 디자인 입어보고 싶었는데 잘 산 것 같아요.",군데군데 붙어 있는 리본이 정말 귀엽습니다 그리고 생각보다 소재가 탄탄해서 라인 유지가 잘 될 것 같아요 이런 디자인 입어보고 싶었는데 잘 산 것 같아요," 소재,  유지","군데군데, 귀엽다, 디자인, 라인, 리본, 붙다, 소재, 유지, 이렇다, 입어보다, 탄탄하다"
"상품 주문 폭주로 오래 기다려서 받았습니다.
기다린 만큼 예뻐서 만족스럽습니다.
색감도 사진과 같이 깨끗한 화이트에 안에 속바지가 덧대어 있어 부담없이 입을 수 있을 것 같습니다.",상품 주문 폭주로 오래 기다려서 받았습니다 기다린 만큼 예뻐서 만족스럽습니다 색감도 사진과 같이 깨끗한 화이트에 안에 속바지가 덧대어 있어 부담 없이 입을 수 있을 것 같습니다,,"기다리다, 깨끗하다, 만족스럽다, 받다, 사진, 상품, 색감, 오래, 폭주, 화이트"
흰 치마 필요했는데 귀여운 치마 겟해서 넘 조아용 세일도해서 더더 🤍,흰 치마 필요했는데 귀여운 치마 겟 해서 넘지 아용 세일도 해서 더더,,"귀엽다, 넘다, 더더, 세일, 치마, 필요하다, 희다"
세일할때 가격이 싸서 별 기대없이 샀는데 생각보다 천도 좋고 이쁘네요. 키가 작아서 길이도 좋아요,세일할 때 가격이 싸서 별 기대 없이 샀는데 생각보다 천도 좋고 이쁘네요 키가 작아서 길이도 좋아요," 세일,  길이","가격, 기대, 길이, 세일, 싸다, 작다, 천, 키"
"리본이 포인트 진짜 너무 귀여워요
안에 속바지가 있어서 입기 편해요",리본이 포인트 진짜 너무 귀여워요 안에 속바지가 있어서 입기 편해요, 리본,"귀엽다, 리본, 속바지, 편하다, 포인트"
