Review,Processed_Review,common_keywords_all,common_keywords_3_plus
"뒤늦게 발레코어에 빠져서 이것저것 구매중인데
무진장블프맞이 저렴하게 구매성공했습니당
처음 구매해본 브랜드인데 기대이상으로 퀄도 좋고 기장감도 적당해서 애용할듯합니다!",뒤늦게 발레 코어에 빠져서 이것저것 구매 중인데 무진장블프맞이 저렴하게 구매 성공했습니다 처음 구매해 본 브랜드인데 기대 이상으로 퀄도 좋고 기장감도 적당해서 애용할듯합니다,,"기장감, 무진장, 브랜드, 블프, 성공하다, 애용, 저렴하다, 처음, 퀄"
너무이뻐요 세일가에 잘 삿어요 페미닌해서 러블리힙스타일 내기 좋아요,너무 이뻐요 세일가에 잘 샀어요 페미닌해서 러블리힙스타일 내기 좋아요,,"내기, 러블리힙, 스타일, 일가"
완전 디자인 대박 맘에 들어요 키작녀는 개강추임,완전 디자인 대박 맘에 들어요 키작녀는 개강 축임, 대박,"개강, 대박, 디자인, 축임, 키작녀"
"진짜 너무 짧아요
블랙이랑 호ㅓ이트 하나씩 구매했는데
화이트는 짧아서 손도 안댐 ㅠ
같은 제품이지만 오차가 있어여
이 길이에 1센치 오차면 엄청 크죠?..",진짜 너무 짧아요 블랙이랑 호이트 하나씩 구매했는데 화이트는 짧아서 손도 안댐 같은 제품이지만 오차가 있어요 이 길이에 센티 오 차면 엄청 크죠, 블랙,"길이, 블랙, 센티, 오차, 제품, 짧다, 하나, 호이트, 화이트"
이뻐요. 가격대비 가성비가 좋아요. 편하고 시원합니다.,이뻐요 가격 대비 가성비가 좋아요 편하고 시원합니다, 시원하다,"가격, 가성비, 대비, 시원하다, 편하다"
"와이프 선물했는제, 너무 예쁘고 자연스러워요. 추천합니다!",와이프 선물했는 제 너무 예쁘고 자연스러워요 추천합니다," 추천,  와이프","선물, 와이프, 자연스럽다, 추천"
이뿌여 기다린 보람잇네여 이쁘고 편하고 좋아요,이 부여 기다린 보람 잇네요 이쁘고 편하고 좋아요, 기다리다,"기다리다, 보람, 부여, 잇다, 편하다"
이뻐오 색감이며 다 마음에 들어오 완전 잘구매한것같음,이뻐 오 색감이며 다 마음에 들어오 완전 잘 구매한 것 같음,,"들어오다, 색감, 이며"
안에 속바지도 있고 허리가 고무줄 밴딩이라서 입기 너무 편해요,안에 속바지도 있고 허리가 고무줄 밴딩이라서 입기 너무 편해요, 고무줄,"고무줄, 밴딩, 속바지, 편하다, 허리"
귀여워요 고민하다샀는데 봄여름가을 다 입을 수 있응거같아요,귀여워요 고민하다 샀는데 봄여름 가을 다 입을 수 있을 거 같아요,,"가을, 고민, 귀엽다, 봄, 여름"
발레코어 느낌으로 너무 러블리하고 예뻐요 좀 짧긴하지만 다리가 길어보여서 좋아요,발레 코어 느낌으로 너무 러블리하고 예뻐요 좀 짧긴 하지만 다리가 길어 보여서 좋아요, 짧다,"길다, 다리, 러블리, 발레, 여서, 짧다, 코어"
살때에는 후기가 별로 없어서 걱정했는데 막상 받아보니 넘 예뻐요 허리도 고무줄이라 밥 먹어도 걱정없고 요즘 유행하는 느낌이라 입기 넘 좋아요,살 때에는 후기가 별로 없어서 걱정했는데 막상 받아보니 너무 예뻐요 허리도 고무줄이라 밥 먹어도 걱정 없고 요즘 유행하는 느낌이라 입기 너무 좋아요," 별로,  걱정,  먹다","걱정, 고무줄, 막상, 먹다, 받다, 별로, 유행, 허리, 후기"
"레이스 리본 마이크로 미니 쇼츠 팬츠 스커트는 여성들에게 우아하고 매력적인 스타일을 선사하네요. 섬세한 레이스 장식과 아름다운 리본 디테일이 돋보고, 풍성한 쇼츠 팬츠 스커트 형식으로 여성의 곡선을 아름답게 감싸줍니다.",레이스 리본 마이크로 미니 쇼츠 팬츠 스커트는 여성들에게 우아하고 매력적인 스타일을 선사하네요 섬세한 레이스 장식과 아름다운 리본 디테일이 돋보고 풍성한 쇼츠 팬츠 스커트 형식으로 여성의 곡선을 아름답게 감싸줍니다,,"곡선, 레이스, 리본, 마이크로, 매력, 미니, 성하다, 쇼츠, 스커트, 스타일, 아름답다, 여성, 우아하다, 장식, 팬츠, 형식"
"다양한 상황에서 스타일링하기 좋으며, 편안하면서도 세련된 룩을 완성할 수 있는거 같아요. 소재와 디자인 모두 고급스러움을 느낄 수 있어 퀄리티 높은 패션템으로 추천드립니다",다양한 상황에서 스타일링하기 좋으며 편안하면서도 세련된 룩을 완성할 수 있는 거 같아요 소재와 디자인 모두 고급스러움을 느낄 수 있어 퀄리티 높은 패션 템으로 추천드립니다," 고급스럽다,  편안하다","고급스럽다, 높다, 느끼다, 다양하다, 드리다, 디자인, 룩, 상황, 세련되다, 소재, 완성, 퀄리티, 패션, 편안하다"
"레이스 디테일과 리본 장식이 매력적인 이 마이크로 미니 쇼츠 팬츠 스커트는 여름철의 활기를 더해주는거 같아요. 짧은 기장이 부담스럽지 않고, 스커트와 쇼츠의 편리함을 한 번에 만날 수 있어 여성들 사이에서 큰 인기를 끌고 있어요",레이스 디테일과 리본 장식이 매력적인 이 마이크로 미니 쇼츠 팬츠 스커트는 여름철의 활기를 더해주는 거 같아요 짧은 기장이 부담스럽지 않고 스커트와 쇼츠의 편리함을 한 번에 만날 수 있어 여성들 사이에서 큰 인기를 끌고 있어요,,"레이스, 마이크로, 미니, 쇼츠, 스커트, 여름철, 여성, 인기, 장식, 짧다, 팬츠, 편리하다, 활기"
약간 과해보일 수 있는 귀여움가득 스커트지만 캐주얼하게 입으면 과하지 않아요,약간 과해 보일 수 있는 귀여움 가득 스커트지만 캐주얼하게 입으면 과하지 않아요," 스커트,  보이다","가득, 귀, 보이다, 스커트, 캐주얼"
너무너무 만족해요 너무 귀엽고 안에 바지가 있어서 편하게 입을 수 있는 점도 좋아요 여름에 입기 좋은 소재라서 잘 산것 같아요,너무너무 만족해요 너무 귀엽고 안에 바지가 있어서 편하게 입을 수 있는 점도 좋아요 여름에 입기 좋은 소재라서 잘 산 것 같아요, 소재,"귀엽다, 라서, 만족하다, 바지, 소재, 여름, 편하다"
일단 너무 이뻐요 기장이 너무 짧지않고 안에 속바지 있어서 안심하고 입어요,일단 너무 이뻐요 기장이 너무 짧지 않고 안에 속바지 있어서 안심하고 입어요,,"기장, 속바지, 안심, 짧다"
여자친구 선물해주었는데 너무 이쁘고 자기 마음에 든데요,여자친구 선물해 주었는데 너무 이쁘고 자기 마음에 든 데요,,"선물, 여자친구, 주다"
"오대박
너무이쁘네여
핑크티랑입어두이쁘구
질도 탄탄하네여
감사핮니다",아 대박 너무 이쁘네요 핑크 튀랑 입어도 이쁘고 질도 탄탄하네요 감사핮니다,,"대박, 질도, 탄탄하다, 튀랑, 핑크, 핮니"
기장이 되게 짧고 내장된 속바지는 자꾸 말려 올라가요 그래서 안에 속바지 하나 더 입고 다녀요. 원래 이런 샤랄라 프릴 옷을 안 사는 편인데 이 스커트는 그렇게 부담스럽지 않아서 제가 원래 입던 옷이랑 매칭하기 좋더라고요. 이쁩니다,기장이 되게 짧고 내장된 속바지는 자꾸 말려 올라가요 그래서 안에 속바지 하나 더 입고 다녀요 원래 이런 샤랄라 프릴 옷을 안 사는 편인데 이 스커트는 그렇게 부담스럽지 않아서 제가 원래 입던 옷이랑 매칭하기 좋더라고요 이쁩니다,,"기장, 매칭, 부담, 살다, 샤랄라, 속바지, 스커트, 올라가다, 짧다, 프릴"
기장이 되게 짧고 내장된 속바지는 자꾸 말려 올라가요 그래서 안에 속바지 하나 더 입고 다녀요. 원래 이런 샤랄라 프릴 옷을 안 사는 편인데 이 스커트는 그렇게 부담스럽지 않아서 제가 원래 입던 옷이랑 매칭하기 좋더라고요 이쁩니다,기장이 되게 짧고 내장된 속바지는 자꾸 말려 올라가요 그래서 안에 속바지 하나 더 입고 다녀요 원래 이런 샤랄라 프릴 옷을 안 사는 편인데 이 스커트는 그렇게 부담스럽지 않아서 제가 원래 입던 옷이랑 매칭하기 좋더라고요 이쁩니다,,"기장, 매칭, 부담, 살다, 샤랄라, 속바지, 스커트, 올라가다, 짧다, 프릴"
핏도 너무 이쁘고 안에 속바지도 있어서 좋은것 같아요,핏도 너무 이쁘고 안에 속바지도 있어서 좋은 것 같아요,,"속바지, 핏"
세일할때 사서 가성비 좋게 잘 샀어용 약간 허접한 느낌이 있습니당,세일할 때 사서 가성비 좋게 잘 샀어요 약간 허접한 느낌이 있습니다,,"가성비, 사서, 세일"
생각했던 것보다 치마 소재가 뻣뻣해요 기장은 적당해요,생각했던 것보다 치마 소재가 뻣뻣해요 기장은 적당해요," 기장,  소재","기장, 뻣뻣하다, 소재, 적당하다, 치마"
"사진과 동일해요
귀여워요
배송도 빠르고 세일해서 저렴히 구매했어요",사진과 동일해요 귀여워요 배송도 빠르고 세일해서 저렴히 구매했어요, 사진,"귀엽다, 동일하다, 배송, 빠르다, 사진, 세일, 저렴하다"
친구한테 선물하기 너무 좋고 디자인도 너무 예쁘고 너무 좋아요,친구한테 선물하기 너무 좋고 디자인도 너무 예쁘고 너무 좋아요, 디자인,"디자인, 선물, 친구"
"정말 발레코어룩에 딱이 스커트예요 ❤️❤️
짧지만 속바지가 있어서 활동성도 좋아요
세탁하면 주름은 잘 잡힐꺼같아요
발레코어룩 유행할때까지 잘 입을게요",정말 발레 코어 룩에 딱이 스커트예요 짧지만 속바지가 있어서 활동성도 좋아요 세탁하면 주름은 잘 잡힐 거 같아요 발레 코어 룩 유행할 때까지 잘 입을게요, 잡히다,"딱이다, 발레, 세탁, 속바지, 스커트, 유행, 잡히다, 주름"
너무 귀엽고 길이도 제 키에는 너무 짧진 않아서 괜찮은거 같아요,너무 귀엽고 길이도 제 키에는 너무 짧진 않아서 괜찮은 거 같아요, 짧다,"귀엽다, 길이, 짧다, 키"
귀여워서 마음에들어요 가격도 적당하고 요즘 트렌드에 잘 맞는거 같아요,귀여워서 마음에 들어요 가격도 적당하고 요즘 트렌드에 잘 맞는 거 같아요,,"가격, 귀엽다, 맞다, 적당하다, 트렌드"
배송은 조금 느렸어요.. 근데 길이며 디자인이며 사이즈며 다 너무 제 스탈이에요 다른 색 더 나왔으면 ㅠㅠ,배송은 조금 느렸어요 근데 길이며 디자인이며 사이즈며 다 너무 제 스탈이에요 다른 색 더 나왔으면," 느리다,  길이","길이, 나오다, 느리다, 디자인, 배송, 사이즈, 스탈, 이며"
"체형 상관 없이 상의 매칭 상관없이 다 괜찮은거 같습니다
생각보다 안 짧아요",체형 상관없이 상의 매칭 상관없이 다 괜찮은 거 같습니다 생각보다 안 짧아요," 상의,  짧다,  체형","매칭, 상관없다, 상의, 짧다, 체형"
"속바지처럼 안감이 되어있어서 흰색이여도 괜찮네요 
디자인이 굉장히 귀엽습니다! 
단독으론 아직 용기가 안나서 애매한 길이의 원피스나 상의랑 레이어드용으로 입기 좋을것 같아서 구매했어요!",속바지처럼 안감이 되어있어서 흰색이어도 괜찮네요 디자인이 굉장히 귀엽습니다 단독으론 아직 용기가 안 나서 애매한 길이의 원피스나 상의랑 레이어드 욕으로 입기 좋을 것 같아서 구매했어요,,"귀엽다, 길이, 단독, 디자인, 상의, 속바지, 안감, 애매하다, 용기, 원피스, 이어도, 흰색"
제 키에 딱 예쁜 기장이고 디자인이 넘넘 귀여워요 생화이트라 넘 맘에 들고 예쁩니다 똑같이 생긴 보세 옷들이 오히려 더 비싸던데 여기 가격이 합리적이에요,제 키에 딱 예쁜 기장이고 디자인이 넘넘 귀여워요 생화 이트라 너무 맘에 들고 예쁩니다 똑같이 생긴 보세 옷들이 오히려 더 비싸던데 여기 가격이 합리적이에요, 합리,"가격, 귀엽다, 기장, 디자인, 똑같이, 비싸다, 생기다, 이트, 키, 합리"
면이 탄탄해서 모양이 잘 잡혀있어요 리본이 너무 많은게 좀 유치해보여서 다 떼어냈는데 이게 더 맘에 드네요,면이 탄탄해서 모양이 잘 잡혀있어요 리본이 너무 많은 게 좀 유치해 보여서 다 떼어냈는데 이게 더 맘에 드네요, 잡히다,"내다, 떼다, 리본, 모양, 보, 여서, 유치하다, 잡히다, 탄탄하다"
요즘 이런 스타일 많이 입길래 사봘는데 짱뒤여움,요즘 이런 스타일 많이 입길래 사봘는데 짱 귀여움, 스타일,"스타일, 이렇다, 입길"
리본 포인트가 여러개 붙어있어서 참 이쁜거 같아요,리본 포인트가 여러 개 붙어있어서 참 이쁜 거 같아요, 리본,"리본, 붙다, 여러, 포인트"
"가격 생각하면 디테일은 좋은데 핏이 약간 아쉬워요ㅠㅠ
그래도 훠뚤마뚤 코디하기 좋을듯해용",가격 생각하면 디테일은 좋은데 핏이 약간 아쉬워요 그래도 훠뚤마뚤 코디하기 좋을듯해요,,"가격, 디테일, 아쉽다, 코디, 핏, 훠뚤마뚤"
너무 예뻐요 맘에 들어요 원하는 모양에 색에 다 짱짱 굳굳 맘에 겁나 들어요,너무 예뻐요 맘에 들어요 원하는 모양에 색에 다 짱짱 굳굳 맘에 겁나 들어요,,"겁나다, 모양, 색, 원하다, 짱짱"
엄청 세일한 가격으로 구매했는줄 알았는데 더 세일도 가능하군요 플레이스 스튜디오 .. 진짜 세일 자주 하는 거 같아요,엄청 세일한 가격으로 구매했는 줄 알았는데 더 세일도 가능하군요 플레이스 스튜디오 진짜 세일 자주 하는 거 같아요,,"가격, 가능하다, 레이스, 세일, 스튜디오, 알다"
완전 여리여리 청순 걸등한테 잘어울릴듯 이뻐요,완전 야리야리 청순 걸 등한테 잘 어울릴 듯 이뻐요,,"야리야리, 어울리다, 청순"
허리가 좀 크고 통도 좀 큰데 길이는 짧아요 디자인 청순그자체임,허리가 좀 크고 통도 좀 큰데 길이는 짧아요 디자인 청순 그 자체임," 허리,  짧다,  길이","길이, 디자인, 자체, 짧다, 청순, 크다, 통, 허리"
좋아요 좋아요 맘에 들어요 사고싶었던 건데 세일해서 샀어요 굳굳이요 굳,좋아요 좋아요 맘에 들어요 사고 싶었던 건데 세일해서 샀어요 굳굳이요 굳, 사고,"건데, 굳다, 굳이, 사고, 세일"
오버핏 티셔츠랑 같이 입으려고 샀어요 완전 마음에 들어요오~,오버핏 티셔츠랑 같이 입으려고 샀어요 완전 마음에 들어요 오,,"오버핏, 티셔츠"
옷은 정말 예쁘고 귀엽고 좋은데 뭔 돈벌레랑 같이 배송해주셔서 받고 기절할 뻔 했어용..! 하지만 속바지도 같이 달려있고 배송도 빨라서 벌레 정도는 그냥 모르는 척 하겠습니다🫣,옷은 정말 예쁘고 귀엽고 좋은데 뭔 돈벌레랑 같이 배송해 주셔서 받고 기절할 뻔했어요 하지만 속바지도 같이 달려있고 배송도 빨라서 벌레 정도는 그냥 모르는 척하겠습니다,,"그냥, 기절, 달다, 돈벌레, 라서, 모르다, 배송, 벌레, 속바지, 주다, 척"
짧다는 후기가 있던데 뭐 약간 내려입어도 되고 저는 그다지 짧단 생각 안들었어요. 귀엽네요. 세탁할때 허리밴드가 뒤집어질듯하지만ㅋㅋ옷 귀엽습니다,짧다는 후기가 있던데 뭐 약간 내려 입어도 되고 저는 그다지 짧단 생각 안 들었어요 귀엽네요 세탁할 때 허리밴드가 뒤집어질듯하지만 옷 귀엽습니다,,"귀엽다, 그다지, 내다, 뒤집어지다, 밴드, 세탁, 짧다, 허리, 후기"
하이틴걸이 될수있습니다 공주가될수있습니다 이쁘니 꼭사세요 위에는 크롭입어야 이쁠듯 ㅎㅎ 전 허벅지살을 빼고 입어야겠습니다,하이틴 걸이 될 수 있습니다 공주가 될 수 있습니다 이쁘니 꼭 사세요 위에는 크롭 입어야 이쁠 듯 전 허벅지살을 빼고 입어야겠습니다,,"걸이, 공주, 빼다, 에는, 크롭"
배송빠르고 너무이쁩니다 가격도 너무 착하고 꼭사세요 마른사람입으면 이쁠것같야용 ㅎㅎ,배송 빠르고 너무 이쁩니다 가격도 너무 착하고 꼭 사세요 마른 사람 입으면 이쁠 것 같아 용, 마르다,"가격, 마르다, 배송, 빠르다, 사람, 착하다"
"키작녀인 저에게는 기장이 딱 좋았네요!
스커트지만 안에는 속바지가 붙어있어서 활동하기도 편해요.",키작녀인 저에게는 기장이 딱 좋았네요 스커트지만 안에는 속바지가 붙어있어서 활동하기도 편해요," 기장,  활동,  편하다","기장, 붙다, 속바지, 스커트, 에는, 키작녀, 편하다, 활동"
너무귀엽고 밴딩이라편해요!! 같이산 티도 오면 올른 매치해입고싶어오,너무 귀엽고 밴딩이라 편해요 같이 산 티도 오면 오른 매치해 입고 싶어온," 밴딩,  귀엽다","귀엽다, 매치, 밴딩, 오다, 오른, 티, 편하다"
"아 무신사 홈페이지가 바뀌고 보는거랑 상품평 쓰는게 불편해져서 잘 안쓸꺼같아요 상품은 마음에 듭니다 많이 파시길 바래요
도움돼",아 무신사 홈페이지가 바뀌고 보는 거랑 상품평 쓰는 게 불편해져서 잘 안 쓸 거 같아요 상품은 마음에 듭니다 많이 파시길 바라요 도움 돼," 홈페이지,  팔다,  불편하다","도움, 물다, 바뀌다, 불편하다, 상품, 쓰다, 쓸다, 팔다, 홈페이지"
"딸이 이고 싶다고 해서 주문했는데 소재도 시원하고 디테일도
예쁘고 맘에 들어요 시원하고 깔끔해요",딸이이고 싶다고 해서 주문했는데 소재도 시원하고 디테일도 예쁘고 맘에 들어요 시원하고 깔끔해요, 주문,"깔끔하다, 디테, 따다, 소재, 시원하다, 일도, 주문"
요즘 리본 레이스가 포인트된 옷들이 인기라길래 구매해봤는데 체구가 작은 저한텐 좀 부해보여 아쉬워요ㅠㅠ,요즘 리본 레이스가 포인트 된 옷들이 인기라길래 구매해 봤는데 체구가 작은 저한텐 좀 부해 보여 아쉬워요,,"기르다, 레이스, 리본, 보이다, 부다, 아쉽다, 작다, 포인트"
리본이 꽤나 기여워요 주름도 적당하고 과하지 않아서 즇아요,리본이 꽤나 귀여워요 주름도 적당하고 과하지 않아서 즇아요," 리본,  주름","귀엽다, 꽤, 리본, 적당하다, 주름, 즇아"
여기 옷 이쁜거같아여 치마가 넘 퐁퐁거리지도 않고 넘 짧지도 않고 넘 부담스럽지도 않은 적당,여기 옷 이쁜 거 같아요 치마가 너무 퐁퐁 거리지도 않고 너무 짧지도 않고 너무 부담스럽지도 않은 적당,,"거리, 부담, 스럽지도, 적당, 짧다, 치마, 퐁퐁"
너무너무 예뻐요 속바지까지 같이 있어서 더 편하네요,너무너무 예뻐요 속바지까지 같이 있어서 더 편하네요,,"속바지, 편하다"
진짜 넘넘 이뻐요!! 키땜에 걱정했는데 속바지 있어서 생각보다 좋아요,진짜 넘넘 이뻐요 키 땜에 걱정했는데 속바지 있어서 생각보다 좋아요,,"걱정, 땜, 속바지"
"바지인데 입으면 진짜 치마같구 고무줄이라 엄청 편해요 !! 
여름이라 흰색으로 샀는데 검은색도 사려구요 ㅎㅎ",바지인데 입으면 진짜 치마 같고 고무줄이라 엄청 편해요 여름이라 흰색으로 샀는데 검은색도 사려고요, 고무줄,"검은색, 고무줄, 바지, 여름, 치마, 편하다, 흰색"
안에 속바지도 있고 일단 스커트가 너무 귀여워요!!,안에 속바지도 있고 일단 스커트가 너무 귀여워요,,"귀엽다, 속바지, 스커트"
배송이 빠르고 가격도 저렴해서 좋아요 길이는 좀 짧지만 속바지가 있어서 덜 불편할것같습니다. 그치만 저보다 키가 크신분들은 너무 짧을수도 있을것같아요,배송이 빠르고 가격도 저렴해서 좋아요 길이는 좀 짧지만 속바지가 있어서 덜 불편할 것 같습니다 그렇지만 저보다 키가 크신 분들은 너무 짧을 수도 있을 것 같아요, 가격,"가격, 길이, 배송, 빠르다, 속바지, 수도, 저렴하다, 짧다, 크다, 키"
빳빳하고 뻣뻣합니다 디테일이뻐요 입다보면 핏이 더 이뻐질 듯,빳빳하고 뻣뻣합니다 디테일 이뻐요 입다 보면 핏이 더 이뻐질 듯,,"디테일, 빳빳, 뻣뻣하다, 핏"
빳빳쓰..뻣뻣쓰..그러나 디테일 이쁨 좀 입다보고 생활감 생겨야 더 이쁠 듯,빳빳쓰뻣뻣쓰그러나 디테일 이쁨 좀 입다 보고 생활감 생겨야 더 이쁠 듯, 디테일,"디테일, 보고, 생기다, 생활, 쓰다"
옷 자체는 예쁜데 체형을 더 살려주지는 못하고 그냥 무난해요 더 말라보일 수도 더 길어보일 수도 없는 핏,옷 자체는 예쁜데 체형을 더 살려주지는 못하고 그냥 무난해요 더 말라 보일 수도 더 길어 보일 수도 없는 핏," 체형,  보이다","그냥, 길다, 말르다, 무난, 보이다, 살리다, 수도, 없다, 자체, 체형"
"속바지도있어서 비침이많지는않은거같아요
너무너무귀여워요
허리밴드도 부드럽고 좋아요",속바지도 있어서 비침이 많지는 않은 거 같아요 너무너무 귀여워요 허리밴드도 부드럽고 좋아요, 비침,"귀엽다, 많다, 밴드, 부드럽다, 비침, 속바지, 허리"
속바지 있어서 많이 비치지도 않고 편하고 너무 예뻐요,속바지 있어서 많이 비치지도 않고 편하고 너무 예뻐요,,"비치다, 속바지, 편하다"
흰색 치마 갖고싶었느데 너무 예쁘고 편해요 속바지 있는 것도 좋아요,흰색 치마 갖고 싶었는데 너무 예쁘고 편해요 속바지 있는 것도 좋아요,,"속바지, 치마, 편하다, 흰색"
짧다는 후기도 있었던것 같은데 159~160정도인제가 입었을땐 딱히 엄청 짧다는 느낌은 없었어요 디자인도 이쁘고 여름에 잘 입고다닐것 같아요,짧다는 후기도 있었던 것 같은데 정도 인제가 입었을 땐 딱히 엄청 짧다는 느낌은 없었어요 디자인도 이쁘고 여름에 잘 입고 다닐 것 같아요," 짧다,  여름","디자인, 없다, 여름, 인제, 짧다, 후기"
짧다는 후기 보고 샀었는데 저는 짧은거 좋아해서 딱 맘에 들어요 귀여움!,짧다는 후기 보고 샀었는데 저는 짧은 거 좋아해서 딱 맘에 들어요 귀여움," 후기,  짧다","보고, 좋아하다, 짧다, 후기"
많이 짧다고 해서 걱정했는데 제 키에도 괜찮네요 안에 속바지도 있어서 아주 좋아요 잘입을게요 ㅎㅎ,많이 짧다고 해서 걱정했는데 제 키에도 괜찮네요 안에 속바지도 있어서 아주 좋아요 잘 입을게요, 짧다,"걱정, 속바지, 짧다, 키"
예뻐요~ 검은색 샀는데 넘 예뻐서 하얀색까지 구매함 키작년에게 완전 잘 어울려요,예뻐요 검은색 샀는데 너무 예뻐서 하얀색까지 구매함 키 작년에게 완전 잘 어울려요," 검은색,  하얀색","검은색, 어울리다, 작년, 하얀색, 함"
중1  딸 사줬는데 엄청 좋아하네요~배송도 빨라요~,중 딸 사줬는데 엄청 좋아하네 요배 송도 빨라요, 빠르다,"배, 빠르다, 사주다, 송도, 좋아하다"
이런 ㄹㅓ블리한 치마 찾고있었는데 발견해서 바로 샀어요,이런 불리한 치마 찾고 있었는데 발견해서 바로 샀어요,,"발견, 불리하다, 이렇다, 찾다, 치마"
"이뻐요 귀엽고
길이랑 허리가 좀 길고크지만 잘입을거같어요",이뻐요 귀엽고 길이랑 허리가 좀 길고 크지만 잘 입을 거 같아요," 허리,  귀엽다","귀엽다, 길다, 길이, 크다, 허리"
"기엽고 생각보다 상태도 박음질도좋아여
여름에 잘입을거같어요",귀엽고 생각보다 상태도 박음질도 좋아요 여름에 잘 입을 거 같아요,,"귀엽다, 박음질, 상태, 여름"
이뽀용 핏도 좋고 안에 바지는 짧지만 괜차눔 잘이블게용,이뻐요 핏도 좋고 안에 바지는 짧지만 괜차눔 잘이블게용, 짧다,"괜차눔, 바지, 짧다, 핏"
넘넘 이뻐요 좀 짧아보이지만 전 161이라 괜찮았고요 160초반까진 가능할 듯 합니다!! 풍성하고 예뻐요,넘넘 이뻐요 좀 짧아 보이지만 전이라 괜찮았고요 초반까진 가능할 듯합니다 풍성하고 예뻐요, 가능하다,"가능하다, 까진, 보이, 성하다, 전이, 짧다, 초반"
이뻐여ㅎㅎ놀러갈 때 입으려 샀어욜 살짝 짧은 감이 있지만 괜찮아여~,이뻐요 놀러 갈 때 입으려 샀어요 살짝 짧은 감이 있지만 괜찮아요, 짧다,"놀다, 짧다"
안에 속바지라서 너무 편하고 발레리나 같아요 예뻐요!,안에 속바지라서 너무 편하고 발레리나 같아요 예뻐요, 편하다,"라서, 발레리나, 속바지, 편하다"
