Review,Processed_Review,common_keywords_all,common_keywords_3_plus
팔이 길긴 해도 딱 적당히 길어서 예쁩니다 가오 살아요,팔이 길긴 해도 딱 적당히 길어서 예쁩니다 가오 살아요," 가오,  팔이","가오, 길다, 살다, 적당하다, 팔이, 해도"
검정색 사려고 했는데 뭔가 아쉬운 느낌리러서 이거 샀는데 만족해요,검은색 사려고 했는데 뭔가 아쉬운 느낌리러서 이거 샀는데 만족해요," 사려,  검은색,  아쉽다","검은색, 만족하다, 뭔가, 사려, 아쉽다"
배송 어마무시하게 빠르고 색감 아주아주 이뻐요,배송 어마 무시하게 빠르고 색감 아주아주 이뻐요," 배송,  색감","무시, 배송, 빠르다, 색감, 아주아주, 어마"
쿠폰 적용해서 싼 가격에 샀습니다 너무 예쁘고 사이즈도 딱 좋네요,쿠폰 적용해서 싼 가격에 샀습니다 너무 예쁘고 사이즈도 딱 좋네요," 가격,  쿠폰","가격, 사이즈, 싸다, 적용, 쿠폰"
너무 예쁘고 만족스러워요  잘 입고 댕겨서 소매부분엔 이미 틴트자국이네용~ 빠른구매하세요,너무 예쁘고 만족스러워요 잘 입고 댕겨서 소매 부분엔 이미 틴트 자국이네요 빠른 구매하세요," 부분,  댕겨","댕겨, 만족스럽다, 부분, 빠르다, 소매, 이미, 자국, 틴트"
무료반품이르 부담없이 주문했습니다 XL 클까봐 걱정했는데 세미오버하게 잘맞네요,무룡 반품이 르 부담 없이 주문했습니다 XL 클까 봐 걱정했는데 세미 오버하게 잘 맞네요," 걱정,  반품,  맞다,  주문,  세미","걱정, 맞다, 무룡, 반품, 부담, 세미, 없이, 오버, 주문, 크다"
약간 정핏에 가깝고 입어놓으니 되게 예쁘네요 좋아요,약간 정에 핏에 가깝고 입어놓으니 되게 예쁘네요 좋아요,,"가깝다, 되게, 정, 핏"
배송 엄청 빨랐어요 남자 사이즈인데도 엄청 크지 않고 딱 적당한 오버핏이라 좋았어요,배송 엄청 빨랐어요 남자 사이즈인데도 엄청 크지 않고 딱 적당한 온 버핏이라 좋았어요," 빠르다,  배송","남자, 배송, 버핏, 빠르다, 사이즈, 적당하다, 크다"
흰색 카라랑 소매 포인트 이쁘고 남자 m사이즈 생각보다 너무 안크고 적당한 오버핏이에요 ,흰색 카라랑 소매 포인트 이쁘고 남자 m사이즈 생각보다 너무 안 크고 적당한 온 버핏이에요," 흰색,  소매,  카라","남자, 사이즈, 소매, 적당하다, 카라, 크다, 포인트, 흰색"
배송 아주 빨랐어요 남자 m사이즈라 너무 클까봐 걱정했는데 생각보다 많이 안 크고 딱 적당한 오버핏이에요 흰 소매랑 카라 포인트 이뻐요,배송 아주 빨랐어요 남자 m사이즈라 너무 클까 봐 걱정했는데 생각보다 많이 안 크고 딱 적당한 온 버핏이에요 흰 소매랑 카라 포인트 이뻐요, 소매,"걱정, 남자, 배송, 버핏, 빠르다, 소매, 적당하다, 카라, 크다, 희다"
아디다스 져지 사고 싶어서 찾아보다가 디자인이 맘에 들어서 구매했어요 똑같은 디자인 별로 없어서 좋습니다,아디다스 저지 사고 싶어서 찾아보다가 디자인이 맘에 들어서 구매했어요 똑같은 디자인 별로 없어서 좋습니다," 찾아보다,  별로, 디자인,  아디다스","들어서다, 디자인, 똑같다, 별로, 사고, 아디다스, 저지, 찾아보다"
아디다스의 붐은 오고있습니다:) 그냥 기본이에요ㅎㅎ,아디다스의 붐은 오고 있습니다 그냥 기본이에요,,"그냥, 기본, 붐, 아디다스, 오다"
디자인 마음에 듭니다ㅎㅎ 개인적으로 우먼라인도 이쁜 것 같아요 지퍼 컬러감이 달라서 여성분들은 사이즈 없으실텐데 우먼라인 정가에 구매하시길 바랍니다:),디자인 마음에 듭니다 개인적으로 우먼 라인도 이쁜 것 같아요 지퍼 컬러감이 달라서 여성분들은 사이즈 없으실 텐데 우먼 라인 정가에 구매하시길 바랍니다," 라인,  개인","개인, 달라, 디자인, 라인, 바라다, 분들, 사이즈, 여성, 우먼, 정가, 컬러, 텐데"
L사이즈로 시켜도 넉넉한 정도고 엄청 벙벙하진 않아서 핏이 ㄱㅊ아요,L 사이즈로 시켜도 넉넉한 정도고 엄청 벙벙하진 않아서 핏이에요,,"넉넉하다, 벙벙하다, 사이즈, 핏"
옷이 정말 이뻐요 사길 잘한거같아요 많이 파세요,옷이 정말 이뻐요 사길 잘한 거 같아요 많이 파세요,,파다
옷이 너무 예쁘고 사이즈도 잘 맞고 잘 산거같아서 만족합니다,옷이 너무 예쁘고 사이즈도 잘 맞고 잘 산 거 같아서 만족합니다, 사이즈,"만족하다, 맞다, 사이즈"
아디다스 옷 하나 사고싶었는데 사이즈도 괜찮고 디자인도 좋아요,아디다스 옷 하나 사고 싶었는데 사이즈도 괜찮고 디자인도 좋아요,,"디자인, 사고, 사이즈, 아디다스, 하나"
정말 이쁘고 좋아요! 덕분에 매일 입고 다니고 있습니다!,정말 이쁘고 좋아요 덕분에 매일 입고 다니고 있습니다,,"덕분, 매일"
넥 부분 색깔 다른 게 진심 너무 예뻐으요ㅠㅠ 밑에 접어입으면 더 예뻐요,넥 부분 색깔 다른 게 진심 너무 예뻐으요 밑에 접어 입으면 더 예뻐요," 부분,  색깔","밑, 부분, 색깔, 접다, 진심"
배송이 미쳤는데요…? 진짜 총알 배송이고 역시 넘 예쁩니당 ,배송이 미쳤는데요 진짜 총알 배송이고 역시 너무 예쁩니다,,"미치다, 배송, 이고, 총알"
약간 목 부분인 카라가 좀 들뜨긴 하지만 예뻤어요 ! 근데 넉넉한 핏이 아니라 완전 정사이즈라서 딱 맞는 핏입니다 !,약간 목 부분인 카라가 좀 들뜨긴 하지만 예뻤어요 근데 넉넉한 핏이 아니라 완전 정 사이즈라서 딱 맞는 핏입니다,,"넉넉하다, 들뜨다, 라서, 맞다, 부분, 사이즈, 아니다, 카라, 핏, 핏입니"
남자옷이라서 조금 길고 크긴한데 핏도 이쁘고 좋아여,남자 옷이라서 조금 길고 크긴 한데 핏도 이쁘고 좋아요, 길다,"길다, 남자, 크다, 핏"
M사이즈 사는게 더 예뻤을 것 같긴 한데 라지도 괜찮아서 그냥 입으려고요,M사이즈 사는 게 더 예뻤을 것 같긴 한데 라지도 괜찮아서 그냥 입으려고요, 라지,"그냥, 라지, 사이즈, 살다"
베켄바우어 트랙탑 크림에서 보고 무신사에서 적당한 금액으로 구매했어요,베켄바워 트랙 탑 크림에서 보고 무신사에서 적당한 금액으로 구매했어요," 트랙,  베켄바워,  적당하다","금액, 무신, 베켄바워, 보고, 적당하다, 크림, 트랙"
전체적으로 큰데 허리에 흰색 단 때문에 더 허리가 긴 느낌이 들어요..그리고 얇아서 단독으로 입기엔 그롷고 패딩 아래에 입으면 좋아툥,전체적으로 큰데 허리에 흰색 단 때문에 더 허리가 긴 느낌이 들어요 그리고 얇아서 단독으로 입기엔 그렇고 패딩 아래에 입으면 좋아툥," 단독,  아래","단독, 아래, 얇다, 전체, 패딩, 허리, 흰색"
데일리하게 입기 딱좋은거 같아요 굉장히 소재가 좋습니다 역싀 아디돠스,데일리 하게 입기 딱 좋은 거 같아요 굉장히 소재가 좋습니다 역싀 아디다스," 아디다스,  데일리","굉장하다, 데일리, 소재, 아디다스, 역싀"
역시 아디다스..ㅠㅡㅜ 너무 이쁩니당🫶🏻👍🏻 L은 품절이라 못 기다리겠어서 XL 시켰는데 저는 키가 있어서 그런지 괜찮았어요! 이 제품 여성용?은 후기 보니까 세미 크롭 느낌이 나서 이 제품을 시켰는데 저처럼 크게 혹은 넉넉하게 입는 거 좋아하시는 분들은 이거 시키시는 거 추천해요! 생각보다는 좀 얇아서 따뜻해지면 가볍게 입기 좋을 것 같아요 여성분들 후기가 얼마 없어서 걱정했는데 저는 만족합니당..🤍 배송도 한 2일?만에 왔어요 완전 짱짱맨,역시 아디다스 너무 이쁩니다 L은 품절이라 못 기다리겠기에 XL 시켰는데 저는 키가 있어서 그런지 괜찮았어요 이 제품 여성용은 후기 보니까 세미 크롭 느낌이 나서 이 제품을 시켰는데 저처럼 크게 혹은 넉넉하게 입는 거 좋아하시는 분들은 이거 시키시는 거 추천해요 생각보다는 좀 얇아서 따뜻해지면 가볍게 입기 좋을 것 같아요 여성분들 후기가 얼마 없어서 걱정했는데 저는 만족합니다 배송도 한 일 만에 왔어요 완전 짱짱맨,,"나서다, 넉넉하다, 만족하다, 보다는, 분들, 성용, 세미, 여성, 제품, 추천, 키"
딱 맞게 입고싶었는데 품절이슈로 무지막지 크지만 xl라도 샀어요 소매는 접으면 되고 길이는 엉덩이 다 덮어여 근데 시보리가 짱짱해서 다 잠구고 좀 만져주면 이쁘게 입을 수 있답니다~,딱 맞게 입고 싶었는데 품절 이슈로 무지막지 크지만 xl라도 샀어요 소매는 접으면 되고 길이는 엉덩이 다 덮어요 근데 시보리가 짱짱해서 다 잠그고 좀 만져주면 이쁘게 입을 수 있답니다, 만지다,"길이, 덮다, 만지다, 맞다, 무지막지, 소매, 시보리, 엉덩이, 이슈, 잠그다, 접다, 짱짱하다, 크다"
딱 맞게 입고싶었는데 품절이슈로 무지막지 크지만 xl라도 샀어요 소매는 접으면 되고 길이는 엉덩이 다 덮어여 근데 시보리가 짱짱해서 지퍼 잠구고 좀 만져주면 이쁘게 입을 수 있답니다~,딱 맞게 입고 싶었는데 품절 이슈로 무지막지 크지만 xl라도 샀어요 소매는 접으면 되고 길이는 엉덩이 다 덮어요 근데 시보리가 짱짱해서 지퍼 잠그고 좀 만져주면 이쁘게 입을 수 있답니다, 만지다,"길이, 덮다, 만지다, 무지막지, 소매, 시보리, 엉덩이, 이슈, 잠그다, 접다, 짱짱하다, 크다"
울아들이 너무너무 좋아합니다~무진장입고 다닙니다~ 간지납니다~,울 아들이 너무너무 좋아합니다 무진장 입고 다닙니다 간지 납니다," 좋아하다,  아들,  간지","간지, 나다, 무진장, 아들, 좋아하다"
배송도빠르고좋습니다 사이즈도 딱맞고 길이도 이뻐요,배송도 빠르고 좋습니다 사이즈도 딱 맞고 길이도 이뻐요," 빠르다,  배송","길이, 맞다, 배송, 빠르다, 사이즈"
제 스펙으로는 XL이 딱 보기 좋아요 옷 색도 이쁘고 흰색 포인트도 있어서 흔하지도 않고 이쁨 굿굿,제 스펙으로는 XL이 딱 보기 좋아요 옷 색도 이쁘고 흰색 포인트도 있어서 흔하지도 않고 이쁨 굿굿, 색도,"xl, 굿굿, 보기, 색도, 스펙, 으로는, 포인트, 흔하다, 흰색"
m은 품절이라 L로 구매했는데 살짝 걱정했던 것 치고는 그렇게 크지 않았어요. 그래도 엉덩이는 거의 덮는 정도? 무겁지도 않고 핏은 예뻤음. 근데 아무래도 사이즈가 커서 그런지 목 끝까지 지퍼 잠그면 살~짝 어중간한 느낌이 있기는 했어요. 그치만 괜춘 잘 입을듯,m은 품절이라 L로 구매했는데 살짝 걱정했던 것치고는 그렇게 크지 않았어요 그래도 엉덩이는 거의 덮는 정도 무겁지도 않고 핏은 예뻤음 근데 아무래도 사이즈가 커서 그런지 목 끝까지 지퍼 잠그면 살짝 어중간한 느낌이 있기는 했어요 그렇지만 괜춘 잘 입을 듯,,"걱정, 괜춘, 그렇게, 덮다, 무겁다, 사이즈, 아무래도, 어중간하다, 엉덩이, 잠그다, 지퍼, 커서, 크다, 품절"
진짜 너무 예뻐요 딱 제가 원하던 핏이어서 너무 만족합니당 꼭사세용,진짜 너무 예뻐요 딱 제가 원하던 핏이어서 너무 만족합니다 꼭 사세요,,"만족하다, 원하다, 핏"
배송도 빠르고 상품도 이뻐요 인디고도 사야겠어요,배송도 빠르고 상품도 이뻐요 인디고도 사야겠어요,,"배송, 빠르다, 상품, 인디고"
라지가 더 이뻤을거같지만 사이즈가없었어서 ㅠ그래도 괜춘하요,라지가 더 이뻤을 거 같지만 사이즈가 없어서 그래도 괜춘하요, 라지,"괜춘하, 라지, 사이즈, 없다"
 m사이즈도 크지만 품절되서 어쩔수없이 l로 샀는데 역시나 커요 그래도 이쁘다..,m사이즈도 크지만 품절돼서 어쩔 수 없이 l로 샀는데 역시나 커요 그래도 이쁘다,,"사이즈, 어쩔, 없이, 크다, 품절"
가격도 합리적이고 디자인도 좋아요 배송도 빨리 와서 굿,가격도 합리적이고 디자인도 좋아요 배송도 빨리 와서 굿, 가격,"가격, 디자인, 배송, 빨리, 오다, 이고, 합리"
호불호가 좀 갈릴 수 있지만 그래도 되게 이쁜 져지입니다 배송도 빠르고 이쁘네요 ㅎㅎ 져지 좋아하시면 사세요,호불호가 좀 갈릴 수 있지만 그래도 되게 이쁜 저지입니다 배송도 빠르고 이쁘네요 저지 좋아하시면 사세요, 갈릴,"갈릴, 되게, 배송, 저지, 좋아하다, 호불호"
사이즈가 품절이라서 어쩔 수 없이 100으로 샀는데 딱 좋았어요 유니크한 기본템인 것 같습니다,사이즈가 품절이라서 어쩔 수 없이 우로 샀는데 딱 좋았어요 유니크한 기본 템인 것 같습니다, 유니크,"기본, 사이즈, 없이, 우, 유니크, 품절"
예뻐요오옹~~~~ 제 체형엔 s 사이즈 사면 좀 더 슬림하게 예뻤을거같긴한데 살짝 넉넉하게 입는것두 나쁘지않네여 시보리가 엄청 짱짱해서 맘에들어요,예뻐요 외옹 제 체형엔 s 사이즈 사면 좀 더 슬림 하게 예뻤을 거 같긴 한데 살짝 넉넉하게 입는 것도 나쁘지 않네요 시보리가 엄청 짱짱해서 맘에 들어요, 체형,"넉넉하다, 사면, 사이즈, 슬림, 시보리, 외옹, 체형"
예뻐용 아래 지퍼 여는 것보다는 접어서 입는게 더 이쁜 거 같음,예뻐요 아래 지퍼 여는 것보다는 접어서 입는 게 더 이쁜 거 같음, 아래,"보다는, 아래, 접다, 지퍼"
완전 이쁘고 너무 좋아요 계속해서 사고 싶어지게 해요,정말 이쁘고 너무 좋아요 계속해서 사고 싶어지게 해요,,"계속, 사고"
아나ㅏ 뭔 배송이 이렇게 빨리 올 수가 있는거죠?? l 품절이라 그냥 xl 시켰는데 오히려 좋아 개귀여워요,아나 뭔 배송이 이렇게 빨리 올 수가 있는 거죠 l 품절이라 그냥 xl 시켰는데 오히려 좋아 개 귀여워요, 품절,"xl, 귀엽다, 그냥, 배송, 빨리, 이렇게, 품절"
옷이 너무 귀여워요 사이즈도 딱 정사이즈 느낌이라 예쁘네요 봄에 잘 입을 거 같아요!,옷이 너무 귀여워요 사이즈도 딱 정 사이즈 느낌이라 예쁘네요 봄에 잘 입을 거 같아요,,"귀엽다, 사이즈"
아디다스는 뭐…더 말할 필요도 없죠 .. 너뮤 이뻐영 소매가ㅠ좀 길긴 하지만 괜찮!,아디다스는 뭐 더 말할 필요도 없죠 너무 이뻐요 소매가 좀 길긴 하지만 괜찮,,"길다, 말, 소매, 아디다스, 없다, 필요"
"밑단 시보리가 하얀색인게 처음엔 별로였는데, 레이어드처럼 느껴져서 좋아요 !!",밑단 시보리가 하얀색인 게 처음엔 별로였는데 레이어드처럼 느껴져서 좋아요, 시보리,"느껴지다, 레이어드, 밑단, 별로, 시보리, 처럼, 처음, 하얀색"
색도 선명하고 핏도 여유있게 맞아서 좋네요. 밑단이 하얀색인데 오히려 레이어드처럼 느껴져서 좋아요,색도 선명하고 핏도 여유 있게 맞아서 좋네요 밑단이 하얀색인데 오히려 레이어드처럼 느껴져서 좋아요," 밑단,  레이어드","느껴지다, 레이어드, 맞다, 밑단, 색도, 여유, 처럼, 핏, 하얀색"
저의 체형에는 정사이즈로 나오고 골격이 있으신 분들은 한사이즈 크게 구매하시길 바래요~ 시보리도 짱짱하고 핏도 예쁘게 나와 구매 대만족이에요,저의 체형에는 정 사이즈로 나오고 골격이 있으신 분들은 한 사이즈 크게 구매하시길 바라요 시보리도 짱짱하고 핏도 예쁘게 나와 구매 대만족이에요," 체형,  사이즈","골격, 만족, 바라다, 사이즈, 시보리, 에는, 짱짱하다, 체형"
배송도 빠르고 질도 좋아서 매일 입을려고 합니다!,배송도 빠르고 질도 좋아서 매일 입으려고 합니다,,"매일, 배송, 빠르다, 질도"
172기준 사이즈 딱이에요! 근데 제가 박시하게 입고싶어서 혹시 딱붙는 핏 원하시면 한 사이즈 작은거 추천드려요,기준 사이즈 딱이에요 근데 제가 박시하게 입고 싶어서 혹시 딱 붙는 핏 원하시면 한 사이즈 작은 거 추천드려요," 원하다,  박시","기준, 드리다, 딱이다, 박시, 사이즈, 원하다, 작다, 추천"
사이즈는 생각했던거보다 작아요! 크게 오버핏으로 입고 싶으면 2사이즈는 업해야할 거 같아요,사이즈는 생각했던 거보다 작아요 크게 온 버핏으로 입고 싶으면 사이즈는 업해야 할 거 같아요,,"버핏, 사이즈, 업, 작다, 크게"
완전 짱짱~~  막 입고 다녀요 투웨이라서 더욱 완벽한 거 같아요  안에 안감도 부드러워서 반팔입고 입어도 딱인 듯,완전 짱짱 막 입고 다녀요 투 웨이라서 더욱 완벽한 거 같아요 안에 안감도 부드러워서 반팔 입고 입어도 딱인 듯, 안감,"딱이다, 라서, 부드럽다, 안감, 완벽하다, 짱짱"
많이 클까봐 걱정했는데 밑에가 어벙벙하진 않아서 조절해서 입기 좋았어요! 소매는 조금 길지도 🥹 그래도 핏은 예뻐요,많이 클까 봐 걱정했는데 밑에 가 어벙하진 않아서 조절해서 입기 좋았어요 소매는 조금 길지도 그래도 핏은 예뻐요,,"가다, 걱정, 벙하다, 소매, 조절, 크다, 핏"
핏도 예쁘고 질도 좋고 배송도 빠른편이여서 만족합니다.,핏도 예쁘고 질도 좋고 배송도 빠른 편이어서 만족합니다," 빠르다,  배송","만족하다, 배송, 빠르다, 질도, 편, 핏"
전혀 흔하지않고 개성있는거같아요 너무 마음에듭니다,전혀 흔하지 않고 개성 있는 거 같아요 너무 마음에 듭니다,,"개성, 전혀, 흔하다"
XL사이즈 샀어도 너무 예뻤을거같네요 찐강추드립니다 예뻐여,XL 사이즈 샀어도 너무 예뻤을 거 같네요 찐 강추 드립니다 예뻐요, 강추,"xl, 강추, 드리다, 사이즈, 찌다"
사이즈 L이랑 XL고민하다가 L샀는데 XL샀어도 괜찮았을거같네요 손이랑 밑단 부분 흰색 너무 예뻐요,사이즈 L이랑 XL 고민하다가 L 샀는데 XL 샀어도 괜찮았을 거 같네요 손이랑 밑단 부분 흰색 너무 예뻐요, 밑단,"고민, 밑단, 사이즈, 손, 흰색"
일부로 한사이즈 크게 갔는데 딱 좋네요. 정사이즈 갔으면 더 타이트 했을거 같아요.,일부로 한 사이즈 크게 갔는데 딱 좋네요 정 사이즈 갔으면 더 타이트했을 거 같아요, 일부,"가다, 사이즈, 일부, 크게, 타이트"
시킨지 하루도 안됐는데 바로 왔네요. 생각보다 두께감 있어요.,시킨지 하루도 안됐는데 바로 왔네요 생각보다 두께감 있어요,,"돼다, 두께감, 오다, 하루"
져지 처음 사서 핏이 별로면 어떡하지 햇는데 매우 이쁩니당,저지 처음 사서 핏이 별로면 어떡하지 했는데 매우 이쁩니다, 처음,"별로, 사서, 어떡하다, 저지, 처음, 핏"
사이즈도 딱 잘맞고 이뻐요~~ 길이도 길지않고 좋음,사이즈도 딱 잘 맞고 이뻐요 길이도 길지 않고 좋음, 길이,"길다, 길이, 맞다, 사이즈"
디자인이 예뻐서 구매했는데 청바지에나 조거팬츠에나 잘 어울려서 자주 입을것 같아요! 어느 계절에도 다 잘 어울릴 것 같아서 자주 입을 예정입니다!!,디자인이 예뻐서 구매했는데 청바지에나 조거 팬츠에 나 잘 어울려서 자주 입을 것 같아요 어느 계절에도 다 잘 어울릴 것 같아서 자주 입을 예정입니다,,"계절, 디자인, 어울리다, 에나, 예정, 조거, 청바지, 팬츠"
지퍼도 두개라 입기 편하고 사이즈도 좋게 나와서 아주 좋습니다,지퍼도 두 개라 입기 편하고 사이즈도 좋게 나와서 아주 좋습니다, 편하다,"개, 나오다, 사이즈, 지퍼, 편하다"
동네 백수룩엔 요거만 한게 없죠 사이즈 좋고 예쁜 옷 싸게 잘 샀습니다. 넉넉하게 입으려면 한사이즈 업 하세요,동네 백수 룩엔 요거만 한 게 없죠 사이즈 좋고 예쁜 옷 싸게 잘 샀습니다 넉넉하게 입으려면 한 사이즈 업하세요, 넉넉하다,"거만, 넉넉하다, 동네, 룩, 백수, 사이즈, 싸다, 업"
와 진짜 실물 개이뻐요 이거 안사면 후회함 L사이즈 저한테 너무 잘 맞아요 핏도 엄청 이뻐요 안사면 후회합니다. 진심으로요,와 진짜 실물 개 이뻐요 이거 안사면 후회함 L 사이즈 저한테 너무 잘 맞아요 핏도 엄청 이뻐요 안사면 후회합니다 진심으로요,,"맞다, 사이즈, 실물, 안사면, 진심, 핏"
와 진짜 실물 개이뻐요 이거 안사면 후회함 L사이즈 저한테 너무 잘 맞아요 핏도 엄청 이뻐요,와 진짜 실물 개 이뻐요 이거 안사면 후회함 L 사이즈 저한테 너무 잘 맞아요 핏도 엄청 이뻐요,,"사이즈, 실물, 안사면, 핏"
아 너무 예뻐요 맘에 쏙 들어요 안감도 따듯해서 좋아요,아 너무 예뻐요 맘에 쏙 들어요 안감도 따듯해서 좋아요,,"따다, 안감"
이거이거 물건입니다 기본템으로 계속소장하고 입을꺼같아요!!,이거 이거 물건입니다 기본 템으로 계속 소장하고 입을 거 같아요,"소장,  물건,  기본,  계속","계속, 기본, 물건, 소장"
디자인이 예쁘면서 운동 할때 입기도 좋고 편하게 입고 돌아 다니기 너무 좋아요!,디자인이 예쁘면서 운동할 때 입기도 좋고 편하게 입고 돌아다니기 너무 좋아요,,"돌아다니다, 디자인, 운동, 편하다"
사이즈 너무 아쉬워요 엘은 너무 큽니다 스몰 있었으면 좋았을텐데,사이즈 너무 아쉬워요 엘은 너무 큽니다 스몰 있었으면 좋았을 텐데," 아쉽다,  사이즈","사이즈, 스몰, 아쉽다, 엘, 크다, 텐데"
M 사이즈 사려다 품절이어서 L사이즈 샀어요(1cm밖에 차이 안나더라구요 ㅋㅋ)좀 크더라구요 근데 M이랑 L이랑 차이가 거의 없어서 M 샀어도 컸을거 같아요 소매랑 카라 포인트가 넘 좋어요 산지 얼마 안돼서 그런가 카라가 잘 안 접히더라구요 아마 시간 지나면 고정될 거 같아요 투웨이라서 더더 좋아요..!! (엄마가 웬일로 날씬해보인다고…ㅋㅎ) 갖고 싶었는데 잘 산거 같아요 히히,M 사이즈 사려다 품절이어서 L 사이즈 샀어요 cm밖에 차이 안 나더라고요 좀 크더라고요 근데 M이랑 L이랑 차이가 거의 없어서 M 샀어도 컸을 거 같아요 소매랑 카라 포인트가 너무 좋아요 산지 얼마 안 돼서 그런가 카라가 잘 안 접히더라고요 아마 시간 지나면 고정될 거 같아요 투 웨이라서 더더 좋아요 엄마가 웬일로 날씬해 보인다고 갖고 싶었는데 잘 산거 같아요 히히, 엄마,"cm, 고정, 더더, 사이즈, 엄마, 카라, 크다"
무난합니더 세일가로 잘삿어요 팔 긴거 맘에 들어요,무난함 니더 세일가로 잘 샀어요 팔 긴 거 맘에 들어요,,"가로, 무난"
지퍼가 잘 안맞물려서 잠그기 빡셈; 팔 기장 길어서좋음,지퍼가 잘 안 맞물려서 잠그기 빡셈 팔 기장 길어서 좋음, 잠그다,"기장, 물리다, 빡셈, 잠그다, 지퍼"
기장이 애매해서 밑단 매무새 좀 잘 만져야 함 그래두 배색 이뻐서 봐줌,기장이 애매해서 밑단 매무새 좀 잘 만져야 함 그래도 배색 이뻐서 봐줌," 배색,  밑단,  기장","기장, 만지다, 매무새, 밑단, 배색, 애매하다, 줌"
역시 동네 백수룩엔 요거만한게 없죠  사이즈 좋고 이쁩니다,역시 동네 백수 룩엔 요 거만한 게 없죠 사이즈 좋고 이쁩니다," 백수,  동네","거만하다, 동네, 룩, 백수, 사이즈, 없다"
옷이 넉넉하네요 s 있었으면 딱 좋을 것 같은제 아쉽네요 ,옷이 넉넉하네요 s 있었으면 딱 좋을 것 같은 제 아쉽네요,,"넉넉하다, 아쉽다"
Xl 가니깐 딱 원하는 핏 나오네요 이쁘네용 잘입겠습니다,Xl 가니깐 딱 원하는 핏 나오네요 이쁘네요 잘 입겠습니다, 원하다,"xl, 가다, 나오다, 원하다"
사이즈가 없어서 L로 시켰는데 생각보다 크지 않고 예쁩니다,사이즈가 없어서 L로 시켰는데 생각보다 크지 않고 예쁩니다,,"사이즈, 크다"
