Review,Processed_Review,common_keywords_all,common_keywords_3_plus
예뻐용~~ 제 체형에 조금 여유있는 정핏 느낌으로 맞아요 하나 작은거 샀으면 더 이뻤을거같긴한데..ㅎㅎ 그래두 맘에 들어용 봄에 잘 입을게요,예뻐요 제 체형에 조금 여유 있는 정핏 느낌으로 맞아요 하나 작은 거 샀으면 더 이뻤을 거 같긴 한데 그래도 맘에 들어요 봄에 잘 입을게요, 작다,"맞다, 봄, 여유, 작다, 체형, 하나"
라지를 사서 전체적으로 사이즈가 좀 많이 커요 그래도 이쁩니다,라지를 사서 전체적으로 사이즈가 좀 많이 커요 그래도 이쁩니다," 라지,  사이즈","라지, 사서, 사이즈, 전체, 크다"
주문하고나서 진짜 금방받아서 좋고 맘에들어요,주문하고 나서 진짜 금방 받아서 좋고 맘에 들어요,,"금방, 나서다, 받다, 주문"
투웨이라 너무 편하고 밑에 부분 살짝 올리면 셔츠 레이어드 한 것 처럼 핏이 나와서 너무 예쁘고 마음에 들어요 어느 바지에든 찰떡이고 사이즈도 딱 루즈하면서 맞습니다,투 웨이라 너무 편하고 밑에 부분 살짝 올리면 셔츠 레이어드 한 것처럼 핏이 나와서 너무 예쁘고 마음에 들어요 어느 바지에든 찰떡이고 사이즈도 딱 루스하면서 맞습니다, 바지,"나오다, 레이어드, 루스, 밑, 바지, 사이즈, 셔츠, 올리다, 이고, 찰떡, 처럼, 편하다"
너무너무멋있는 아이템입니다 어느코디에도 어울리는최고템,너무너무 멋있는 아이템입니다 어느 코디에도 어울리는 최고 탬, 멋있다,"멋있다, 아이템, 어울리다, 최고, 코디"
깃이 약간 접혀서 배송와서 조금 뜨긴하는데 정말 이쁩니다  ㄹㅈㄷ요,깃이 약간 접혀서 배송 와서 조금 뜨긴 하는데 정말 이쁩니다 요,,"깃, 배송, 오다, 접다"
이쁘고 청바지나 트레이닝복에 입어도 이뻐요! 다른 사이즈 다 품절이라 라지 샀는데 한치수 작은거 해ㅛ으면 더 이뻤을거 같아요!,이쁘고 청바지나 트레이닝복에 입어도 이뻐요 다른 사이즈 다 품절이라 라지 샀는데 한 치수 작은 거 해면 더 이뻤을 거 같아요," 청바지,  품절","라지, 사이즈, 작다, 청바지, 치수, 트레이닝복, 품절, 해면"
어깨가 좁아서 사이즈가 아쉽지만 나머지는 다 만족합니덩 그 카라부분이 고정안되는것도 조금 아쉽지만…투웨이라 더 이뿌요,어깨가 좁아서 사이즈가 아쉽지만 나머지는 다 만족합니덩 그 카라 부분이 고 정 안 되는 것도 조금 아쉽지만 투 웨이라 더 이뿌요," 좁다,  사이즈","나머지, 만족하다, 부분, 뿌요, 사이즈, 어깨, 좁다, 카라"
개인적으로 옷 매칭 될만한게 안떠올라서 괴로운거 밀곤 만점 !,개인적으로 옷 매칭될만한 게 안 떠올라서 괴로운 거 밀곤 만점,,"개인, 괴롭다, 떠오르다, 만점, 매칭, 밀다"
너무 이쁘게 잘 쓰겠습니다 배송도 빠르고 잘 받았어요 !,너무 이쁘게 잘 쓰겠습니다 배송도 빠르고 잘 받았어요, 받다,"받다, 배송, 빠르다, 쓰다"
엑스라지 사이즈 딱 좋습니다 추천합니다 왕추천 굿,엑스라지 사이즈 딱 좋습니다 추천합니다 왕 추천 굿,,"라지, 사이즈, 엑스, 추천"
아주 마음애 듭니다 추천합니다  엑스라지 딱 즇아여  추천,아주 마음에 듭니다 추천합니다 엑스라지 딱 즇아여 추천,,"라지, 엑스, 즇아, 추천"
엑스라지 사이즈 좋습니다 아주 마음에 듭니다 추천,엑스라지 사이즈 좋습니다 아주 마음에 듭니다 추천," 추천,  사이즈","라지, 사이즈, 엑스, 추천"
아주 마음애 듭니다 추천합니다 구할수만 있우면 구하새오,아주 마음에 듭니다 추천합니다 구할 수만 있으면 구하 새 오,,"구, 수만, 추천, 하"
엄청 클 줄 알았는데 입으니까 괜찮았어요!! 투웨이 지퍼라 더 이쁘게 입기 가능..ㅠㅠ 새로운 트랙탑 획득해서 좋아유,엄청 클 줄 알았는데 입으니까 괜찮았어요 투웨이 지퍼라 더 이쁘게 입기 가능 새로운 트랙 탑 획득해서 좋아유, 트랙,"가능, 새롭다, 아유, 지퍼, 투, 트랙, 획득"
디자인괜찮고 남자중학생아이  매일입고다닙니다 세일할때 좋은가격에 잘샀어요,디자인 괜찮고 남자 중학생 아이 매일 입고 다닙니다 세일할 때 좋은 가격에 잘 샀어요," 가격,  디자인,  남자,  매일","가격, 남자, 디자인, 매일, 세일, 중학생"
제 스펙은 크지만 편해서 자주 입게돼여 조아여굿,제 스펙은 크지만 편해서 자주 입게 돼요 조아여 굿,,"돼다, 스펙, 크다, 편하다"
카라 있는 져지라서 흔하지 않아요 레이어드 하기도 좋아요,카라 있는 저지라서 흔하지 않아요 레이어드하기도 좋아요," 저지, 레이어드,  카라","라서, 레이어드, 저지, 카라, 흔하다"
160기준 엉덩이 딱 덮는 아주 적절한 기장입니다... 굿굿,기준 엉덩이 딱 덮는 아주 적절한 기장입니다 굿굿," 덮다,  엉덩이","굿굿, 기장, 기준, 덮다, 엉덩이, 적절하다"
아이가 너무좋아합니다 만족합니다 만족합니다,아이가 너무 좋아합니다 만족합니다 만족합니다,,"만족하다, 좋아하다"
배송빠르고 다음날 바로 잘왔어요  사이즈는 적힌그대로인듯,배송 빠르고 다음날 바로 잘 왔어요 사이즈는 적힌 그대로인 듯," 빠르다,  배송","그대로, 날, 배송, 빠르다, 사이즈, 오다, 적히다"
옷 너무 좋고 그냥 검정색 져지 살려 했는데 이거 사길 질한 것 같아요,옷 너무 좋고 그냥 검은색 저지 살려 했는데 이거 사길 질한 것 같아요, 저지,"검은색, 그냥, 살리다, 저지, 질"
마감이 깔끔한 편은 아니라 많이 아쉬워요 s 작을까봐 m 시켰는데 저랑 스펙 비슷하시면 s도 예쁠거 같아요. 오버핏 생각하고 시키긴 했는데 생각보다 크네요 그래도 확실히 아디다스 답게 예쁘고 다둘 어디서 샀냐고 물어보긴 해요 마감이 정가 주고 살 정도는 아니라 세일할때 사는걸 추천해요,마감이 깔끔한 편은 아니라 많이 아쉬워요 s 작을까 봐 m 시켰는데 저랑 스펙 비슷하시면 s도 예쁠 거 같아요 오버핏 생각하고 시키긴 했는데 생각보다 크네요 그래도 확실히 아디다스답게 예쁘고 다 둘 어디서 샀냐고 물어보긴 해요 마감이 정가 주고 살 정도는 아니라 세일할 때 사는 걸 추천해요,,"마감, 물어보다, 세일, 오버핏, 작다, 크다, 확실하다"
너무 이쁘고 꾸안꾸로 좋아요 두께도 적당해서 봄에 입기 좋을 거 같아요,너무 이쁘고 꾸안꾸로 좋아요 두께도 적당해서 봄에 입기 좋을 거 같아요,,"꾸안꾸, 두께, 봄, 적당하다"
흰색포인트가 너무맘에 들어요ㅎㅎ 살까말까 고민햇는데 좋네요,흰색 포인트가 너무 맘에 들어요 살까 말까 고민했는데 좋네요," 흰색,  살다","고민, 말다, 살다, 포인트, 흰색"
오버핏 생각하고 샀는데 오버핏은 절대 아니고 오히러 슬림한 핏이 연출되었습니다. 그래도 마감도 깔끔하고 상품 사진 그대로 와서 좋았습니다색상 바꾸어 재구매 의사 있어요,오버핏 생각하고 샀는데 온 버핏은 절대 아니고 오히려 슬림한 핏이 연출되었습니다 그래도 마감도 깔끔하고 상품 사진 그대로 와서 좋았습니다 색상 바꾸어 재구매 의사 있어요," 사진,  상품","마감, 사진, 상품, 색상, 의사, 재다"
사이즈도 적당하고 배색이 다른게 이뻐요 좋네요,사이즈도 적당하고 배색이 다른게 이뻐요 좋네요,,"배색, 사이즈, 적당하다"
기장이 좀 길긴한데 밑을 접어입으면 괜찮습니당 전체적으로 너무 예뻐요,기장이 좀 길긴 한데 밑을 접어 입으면 괜찮습니다 전체적으로 너무 예뻐요, 접다,"기장, 길다, 밑, 전체, 접다"
얇은 기모가 들어가 있어요. 정말 편해서 자주 입게돼요,얇은 기모가 들어가 있어요 정말 편해서 자주 입게 돼요, 기모,"기모, 돼다, 들어가다, 얇다, 편하다"
이 아디다스 베켄바우어 트랙탑을 입고나서부터 제 인생이 달라졌습니다,이 아디다스 베켄바워 트랙 탑을 입고 나서부터 제 인생이 달라졌습니다," 베켄바워,  트랙,  아디다스","나서다, 달라지다, 베켄바워, 아디다스, 인생, 탑, 트랙"
트랙탑 유행하길래 사봣는데 나름 괜찮네요 베이직해서,트랙 탑 유행하길래 사봤는데 나름 괜찮네요 베이직해서," 트랙,  나름","나름, 베이직, 사보다, 유행, 트랙"
요즘 유행하는 아디다스 트랙탑답게 색상도 정말 예쁘고 핏도 이쁩니다!,요즘 유행하는 아디다스 트랙 탑답게 색상도 정말 예쁘고 핏도 이쁩니다,,"색상, 아디다스, 유행, 트랙, 핏"
너무 인기 많은 제품이어서 여기저기 많이 보이지만 이쁘고 여기저기  코디하기에도 좋은것 같아요 ,너무 인기 많은 제품이어서 여기저기 많이 보이지만 이쁘고 여기저기 코디하기에도 좋은 것 같아요," 제품,  많다","많다, 보이, 여기저기, 인기, 제품, 코디"
"검은색은 너무 흔해서 이 제품으로 구매했는데 확실히 흰색 카라로 포인트를 주니까 더 이쁜듯합니다  주변에서 같은 옷 입은 사람도 별로 못 봤고요  기장은 좀 애매해서 흰색부분 접어서 입는게 제일 이뻐요 상의로 딱 맞게 입고 싶으면 충분히 s 사셔도 되고, 아우터로 입고 싶으면 L 사시면 될 듯합니다 M은 아우터로 입기엔 애매한 느낌 안감이 부들부들해서 상의로 입었을때 전혀 마찰감없고, 지금은 좀 추워서 날씨 풀리기 시작하면 입을 수 있는 두께입니다😃",검은색은 너무 흔해서 이 제품으로 구매했는데 확실히 흰색 카라로 포인트를 주니까 더 이쁜듯합니다 주변에서 같은 옷 입은 사람도 별로 못 봤고요 기장은 좀 애매해서 흰색 부분 접어서 입는 게 제일 이뻐요 상의로 딱 맞게 입고 싶으면 충분히 s 사셔도 되고 아우터로 입고 싶으면 L 사시면 될 듯합니다 M은 아우터로 입기엔 애매한 느낌 안감이 부들부들해서 상의로 입었을 때 전혀 마찰 감 없이 고 지금은 좀 추워서 날씨 풀리기 시작하면 입을 수 있는 두께입니다,,"검은색, 마찰, 상의, 시작, 아우터, 애매하다, 접다, 주변, 춥다, 충분하다, 흰색"
여유있게 입으려고 큰사이즈로 샀어요 만족합니다,여유 있게 입으려고 큰 사이즈로 샀어요 만족합니다,,"만족하다, 사이즈, 여유"
존예입니다 진짜 제발 사세요😴🫶🥲🥲🥹🥹🥹 관리만 잘 하면 체고임,존 예입니다 진짜 제발 사세요 관리만 잘 하면 체고임,"관리,  체고,  제발","관리, 예입, 제발, 체고"
겁나예뻐요;; 근데 딱 더러워지기 쉬운 부분이 하얀색이라 좀 조심스럽습니다...ㅠㅠ,겁나예뻐요 근데 딱 더러워지기 쉬운 부분이 하얀색이라 좀 조심스럽습니다,,"겁나다, 더러워지다, 부분, 쉽다, 조심스럽다, 하얀색"
와 이거 진짜 요물 개이뻐요 다른 트랙탐은 너무 흔해서 좀 특이한거 사고 싶었는데 부담스럽지도 않고 화이트가 포인트로 있어서 너무 이뻐요 배송 오자마자 입어도 대만족 했답니당!,와 이거 진짜 요물 개 이뻐요 다른 트랙 탑은 너무 흔해서 좀 특이한 거 사고 싶었는데 부담스럽지도 않고 화이트가 포인트로 있어서 너무 이뻐요 배송 오자마자 입어도 대만족 했답니다," 화이트,  특이하다","만족, 부담, 특이하다, 화이트, 흔하다"
요즘 유행하는 y2k에 잘 어울립니다 좀 작아서 크게 사세여,요즘 유행하는 yk에 잘 어울립니다 좀 작아서 크게 사세여, 작다,"yk, 어울리다, 유행, 작다, 크게"
핏이 너무 이쁘고 지퍼 두개인게 확실이 여러가지의 코디를 할 수 있는고 같아요,핏이 너무 이쁘고 지퍼 두 개인 게 확실히 여러 가지의 코디를 할 수 있는고 같아요, 지퍼,"가지, 개인, 여러, 지퍼, 코디, 핏, 확실하다"
투웨이여서 스타일링하기 좋구 엄청 편해서 좋아요,투 웨이여서 스타일링하기 좋고 엄청 편해서 좋아요, 편하다,"스타, 편하다"
예뻐요 아디다스 짱 근데 목부분이 다른 져지랑 다르게 안접히고 붕떠서 얼핏보면 깃세운사람같은데 이거맞나요,예뻐요 아디다스 짱 근데 목부분이 다른 저지랑 다르게 안 접히고 붕 떠서 얼핏 보면 깃 세운 사람 같은데 이거 맞나요," 접다,  다르다","다르다, 맞다, 부분, 사람, 세운, 아디다스, 얼핏, 저지, 접다"
지퍼 투웨이라서 좋고 싸게 사서 잘입고다닙니다 굿~,지퍼 투 웨이라서 좋고 싸게 사서 잘 입고 다닙니다 굿, 싸다,"라서, 사서, 싸다, 지퍼"
목 부분 올이 나가 있어 아쉽습니다 검수좀 잘 부탁드립니다,목 부분 올이 나가 있어 아쉽습니다 검수 좀 잘 부탁드립니다," 부분,  검수","검수, 부분, 부탁드리다, 아쉽다, 오다"
아들이 맘에 들어하네요 약기모가 되어있어 봄가을 입기 좋겠어요,아들이 맘에 들어 하네요 약 기모가 되어있어 봄가을 입기 좋겠어요, 기모,"가을, 기모, 되어다, 아들"
약기모가 되어있어 봄가을 입기 좋겠네요 아들이 맘에 들어해요,약 기모가 되어있어 봄가을 입기 좋겠네요 아들이 맘에 들어 해요, 기모,"가을, 기모, 되어다, 봄, 아들"
아디다스 유행이라 삿는디 mz된 기분이라 뭔가 욱김,아디다스 유행이라 삿는디 mz된 기분이라 뭔가 웃김," 기분,  아디다스,  웃기다","mz, 기분, 뭔가, 삿는디, 아디다스, 웃기다, 유행"
교복처럼 입게되고 목부분 흰색인거 너무 귀여움,교복처럼 입게 되고 목부분 흰 색인 거 너무 귀여움,,"교복, 부분, 색인, 처럼"
크롭 져지말고 포인트 있는거 입고시퍼서 샀는데 이뿌다는 얘기 많이 들었어영 만족하면서 자주 입어여 손 마니 갑미다,크롭 저지 말고 포인트 있는 거 입고 시퍼서 샀는데 이쁘다는 얘기 많이 들었어요 만족하면서 자주 입어요 손 마니 갑니다," 시퍼,  말다,  가다,  저지","가다, 만족하다, 말다, 시퍼, 얘기, 저지, 크롭, 포인트"
무조건 2업 하세요 안그러면 쫄쫄이핏 나옵니다,무조건 업하세요 안 그러면 쫄쫄이 핏 나옵니다, 나오다,"나오다, 무조건, 쫄쫄"
조금 길긴 하지만 그래도 접어서 연출 할 수 있어서 괜찮아요,조금 길긴 하지만 그래도 접어서 연출할 수 있어서 괜찮아요, 접다,"길다, 연출, 접다"
생각보다 조금 길지만 배색 포인트가 있어서 예뻐요,생각보다 조금 길지만 배색 포인트가 있어서 예뻐요,,"길, 배색, 포인트"
사이즈도 딱맞고 여기저기 입기 너무 좋네요 잘입겠습니다 ,사이즈도 딱 맞고 여기저기 입기 너무 좋네요 잘 입겠습니다, 사이즈,"맞다, 사이즈, 여기저기"
사이즈도 딱맞고 여기저기 입기 너무 좋네요 잘입겠습니다,사이즈도 딱 맞고 여기저기 입기 너무 좋네요 잘 입겠습니다, 사이즈,"맞다, 사이즈, 여기저기"
흰색 포인트들이 유니크하고 예뻐요 핏도 저같은 멸치들한테 잘 어울림,흰색 포인트들이 유니크하고 예뻐요 핏도 저 같은 멸치들한테 잘 어울림," 유니크,  흰색,  포인트","멸치, 어울림, 유니크, 포인트, 핏, 흰색"
기장이 생각보다 길었지만 그래도 예쁘긴 예쁘네용,기장이 생각보다 길었지만 그래도 예쁘긴 예쁘네요,,"기장, 길다"
사이즈가 생각보다 널널해서 좋아요 만족스러워요,사이즈가 생각보다 널찍해서 좋아요 만족스러워요, 사이즈,"널찍하다, 만족스럽다, 사이즈"
넘 예쁘고 탄탄한 재질?이라서 좋아요 할인할때 싸게 사서 기분도 좋아요,너무 예쁘고 탄탄한 재질이라서 좋아요 할인할 때 싸게 사서 기분도 좋아요,,"기분, 사서, 싸다, 재질, 탄탄하다, 할인"
고민했는데 사길잘했다~~ 넘 예뻐요 근데 사이즈 좀 작고 카라가 잘 안 접혀요 ㅜ,고민했는데 사길 잘했다 너무 예뻐요 근데 사이즈 좀 작고 카라가 잘 안 접혀요," 카라,  고민,  사이즈","고민, 사이즈, 작고, 접다, 카라"
너무나 멋있는 아디다스 기본트랙자켓입니다 최고,너무나 멋있는 아디다스 기본 트랙 재킷입니다 최고," 최고,  트랙","기본, 멋있다, 아디다스, 재킷, 최고, 트랙"
너무나 멋있는 아디다스 기본트랙자켓입니다 최고입니다,너무나 멋있는 아디다스 기본 트랙 재킷입니다 최고입니다," 최고,  트랙","기본, 멋있다, 아디다스, 재킷, 최고, 트랙"
모델이 조금 에러인듯.. 실물이 더 이쁩니다 만족스러워요,모델이 조금 에러인 듯 실물이 더 이쁩니다 만족스러워요," 에러,  실물","만족스럽다, 모델, 실물, 에러"
무난해서 데일리로 가넝합니다 추천합니다 추천,무난해서 데일리로 가넝합니다 추천합니다 추천,"추천,  데일리,  무난","가넝합니, 데일리, 무난, 추천"
마음에 들어요 무난하고 데일리로 가넝합니다 추천,마음에 들어요 무난하고 데일리로 가넝합니다 추천, 무난,"가넝합니, 데일리, 무난, 추천"
옷 너무 예뻐요 우리 예랑이랑 이쁘게 잘 입을게요.,옷 너무 예뻐요 우리 예랑이랑 이쁘게 잘 입을게요,,예랑
실물 이뻐요 사이즈도 넉넉하니 좋습니다 배송도 빨라요,실물 이뻐요 사이즈도 넉넉하니 좋습니다 배송도 빨라요," 빠르다,  배송","넉넉하다, 배송, 빠르다, 사이즈, 실물"
실물 이쁩니다. 사이즈도 좋아요 배송도 빨라서 좋습니다 굿,실물 이쁩니다 사이즈도 좋아요 배송도 빨라서 좋습니다 굿,,"라서, 배송, 사이즈, 실물"
예뻐영 잘 입구 댕기고이써여 귯귯 미듐도 널널해여,예뻐요 잘 입구 댕기고 이 써요 귯귯 미디엄도 널찍해요," 입구,  댕기,  써다,  귯귯","귯귯, 널찍하다, 댕기, 미디엄, 써다, 입구"
길에서 누가 입은 거 보고 예뻐서 샀는데 기대한 것 만큼 예뻐요,길에서 누가 입은 거 보고 예뻐서 샀는데 기대한 것만큼 예뻐요,,"기대하다, 길, 누가, 보고"
너무너무너무 이뻐요 길이도 적당하고 흰색 카라랑 소매가 포인트에용 ,너무너무너무 이뻐요 길이도 적당하고 흰색 카라랑 소매가 포인트에요," 흰색,  소매,  길이","길이, 소매, 적당하다, 카라, 포인트, 흰색"
너무너무 예뻐요 져지인데 투웨이다? 진짜 끝판왕입니다,너무너무 예뻐요 저지인데 투 웨이 진짜 끝판왕입니다,,"끝판, 저지"
좀 핏하게 입고 싶어서 m사이즈 가니 제가 원한핏이 나오네요. 밑단 시보리 호불호 갈릴 수도 있을거 같지만 전 호 입니다 ,좀 피하게 입고 싶어서 m사이즈 가니 제가 원한 피이 나오네요 밑단 시보리 호불호 갈릴 수도 있을 거 같지만 전 호입니다, 갈릴,"가다, 갈릴, 나오다, 밑단, 수도, 시보리, 원한, 피하, 호, 호불호"
생각보다 엄청 빨리왔어요 오프라인에서 입어보고 구매해서 사이즈감도 좋네요,생각보다 엄청 빨리 왔어요 오프라인에서 입어보고 구매해서 사이즈감도 좋네요,,"빨리, 사이즈, 오다, 오프라인, 입어보다"
봄이 가까워지니까 요즘 아디다스 저지 많이들 입으시더라구요. 저는 이 스타일이 배색이 들어가서 산뜻해보여서 선택했는데 실물은 훨씬 이쁘네요,봄이 가까워지니까 요즘 아디다스 저지 많이들 입으시더라고요 저는 이 스타일이 배색이 들어가서 산뜻해 보여서 선택했는데 실물은 훨씬 이쁘네요,,"들어가다, 배색, 보, 봄, 선택, 스타일, 실물, 아디다스, 여서, 저지"
이뻐요 오버핏으로 입으려고 xl로 샀는데 딱원하던 핏입니다 사이즈있으면 꼭 사세요,이뻐요 온 버핏으로 입으려고 xl로 샀는데 딱 원하던 핏입니다 사이즈 있으면 꼭 사세요, 원하다,"xl, 버핏, 사이즈, 원하다, 핏입니"
아디다스라는 시그니처의 새로운 느낌이랄까나,아디다스라는 시그니처의 새로운 느낌이랄까 나,,"끄다, 라는, 새롭다, 아디다스, 처"
사이즈도 적당하고 너무 이뻐용~~😻 근데 생각보다 옷이 얇은 것 같아요,사이즈도 적당하고 너무 이뻐요 근데 생각보다 옷이 얇은 것 같아요, 사이즈,"사이즈, 얇다, 적당하다"
살까말까 고민하다가 세일하길래 샀는게 진작에 살걸 … 진짜 예뻐요,살까 말까 고민하다가 세일하길래 샀는 게 진작에 살 걸 진짜 예뻐요," 말다,  살다,  고민","고민, 말다, 살다, 세일, 진작"
편하게 잘 입습니다 널널해서 사이즈 선택 잘한듯 ㅎ,편하게 잘 입습니다 널찍해서 사이즈 선택 잘한 듯, 사이즈,"널찍하다, 사이즈, 선택, 편하다"
배송 빠르고 좋아요 편하게 막 입기 좋아요 역시 아디다스,배송 빠르고 좋아요 편하게 막 입기 좋아요 역시 아디다스," 빠르다,  배송,  아디다스","배송, 빠르다, 아디다스, 편하다"
흰색 밑단이랑 카라 부분이 너무 예뻐요 포인트로 아주 딱 좋음,흰색 밑단이랑 카라 부분이 너무 예뻐요 포인트로 아주 딱 좋음," 흰색,  카라","밑단, 부분, 카라, 포인트, 흰색"
진짜 이쁘고 배색이 이뻐서 어디에도 잘어울려요.,진짜 이쁘고 배색이 이뻐서 어디에도 잘 어울려요, 배색,"배색, 어울리다"
진짜 이쁘고 y2k스타일에 잘맞아요. 그리고 핏은 오버하게 입을거면 크게사세요.,진짜 이쁘고 yk 스타일에 잘 맞아요 그리고 핏은 오버하게 입을 거면 크게 사세요,,"맞다, 스타일, 오버, 크게, 핏"
걔네 나락갔을때 집에서 쳤지 아디다스 져지 아아 ,걔네 나락 갔을 때 집에서 쳤지 아디다스 저지 아아," 저지,  치다","가다, 걔네, 나락, 아디다스, 아아, 저지, 집, 치다"
배송 빠르고 무난하니 막 입고 다니기 좋은데 포인트 있는 느낌이라 자주 입을 거 같아요 ~,배송 빠르고 무난하니 막 입고 다니기 좋은데 포인트 있는 느낌이라 자주 입을 거 같아요, 빠르다,"무난, 배송, 빠르다, 포인트"
음 진짜 마음에 들었어요 다른 저지들은 너무 흔해서 디자인 좀 튀는걸로 골랐는데 너무 만족해용,음 진짜 마음에 들었어요 다른 저지들은 너무 흔해서 디자인 좀 튀는 걸로 골랐는데 너무 만족해요,,"걸, 디자인, 만족하다, 저지, 튀다, 흔하다"
디자인 너무 예쁘고 재질도 좋아서 자주 입을 거 같아요 ,디자인 너무 예쁘고 재질도 좋아서 자주 입을 거 같아요,,"디자인, 재질"
개이쁘고 시보리가 빡빡해서 좋아요 워싱 블랙데님 이랑 입으면 게모띠,개 이쁘고 시보리가 빡빡해서 좋아요 워싱 블랙 데님 이랑 입으면 게도 띠," 워싱,  데님","게도, 데님, 블랙, 빡빡, 시보리, 워싱"
사이즈 없어서 걍 2XL로 샀는데 딱 생각했던 오버핏이라 너무 좋았어요! 정사이즈로 나온 거라 부한 오버핏도 아니고 예쁜 오버핏이어서 제가 원하던 핏이었습니당.. 엉덩이 4/5 가려지는 정도였어요! 저랑 키 비슷하신 분들 중에 오버핏으로 입고싶으신 분들은 2XL로 가셔도 될 것 같아용! ,사이즈 없어서 그냥 XL로 샀는데 딱 생각했던 온 버핏이라 너무 좋았어요 정 사이즈로 나온 거라 부한 온 버핏도 아니고 예쁜 온 버핏이어서 제가 원하던 핏이었습니다 엉덩이 가려지는 정도였어요 저랑 키 비슷하신 분들 중에 온 버핏으로 입고 싶으신 분들은 XL로 가셔도 될 것 같아요,,"가려지다, 갈다, 분들, 사이즈, 아니다, 엉덩이, 원하다"
일단 디자인부터가 안흔하고 너무너무 예뻐서 맘에 들었어요 핏이 아주 오버하진 않고 너무 얇지도 않아서 좀 더 날씨가 풀리면 자주 입을 거 같네여!,일단 디자인부터가 안 흔하고 너무너무 예뻐서 맘에 들었어요 핏이 아주 오버하진 않고 너무 얇지도 않아서 좀 더 날씨가 풀리면 자주 입을 거 같네요, 오버,"날씨, 디자인, 얇다, 오버, 풀리다, 흔하다"
목부분이 너무 하애사 부담스럽지만 옷은 진짜 예브고 질듀 좋아요,목부분이 너무 하에 사 부담스럽지만 옷은 진짜 예쁘고 질듀 좋아요,,"부담스럽다, 부분, 질듀, 하"
할인또해주세요!!!다른색상또사고싶어요 투웨이집업이라 참좋아요 ,할인 또 해주세요 다른 색상 또 사고 싶어요 투 웨이 집업이라 참 좋아요," 할인,  색상","사고, 색상, 집업, 할인, 해주다"
