Review,Processed_Review,common_keywords_all,common_keywords_3_plus
핏 생각보다 널널하고 좋습니다! 안쪽에 약간의 기모 있어요,핏 생각보다 널찍하고 좋습니다 안쪽에 약간의 기모 있어요,,"기모, 널찍하다, 안쪽"
사이즈가 커서 더 이쁜 것 같아요 져지로 꾸안꾸 쌈가능입니당,사이즈가 커서 더 이쁜 것 같아요 저지로 꿈 안 꾸 쌈 가능입니다," 커서,  저지,  사이즈","가능, 사이즈, 저지, 커서"
주변에서 다들 이쁘다고 했어요!! 사이즈도 적당하고 편해서 좋아용,주변에서 다들 이쁘다고 했어요 사이즈도 적당하고 편해서 좋아요, 사이즈,"사이즈, 적당하다, 주변, 편하다"
가단이랑은 적당하고 팔이랑 기장이 가단에 비해 좀 긴 것 같아요 옷은 이쁩니다,가단이랑은 적당하고 팔이랑 기장이 가단에 비해 좀 긴 것 같아요 옷은 이쁩니다, 기장,"가다, 기장, 비다, 이랑은, 적당하다, 팔이"
배송도 빠르고 상태도 좋았습니다! 색감도 사진이랑 똑같았구요 투웨이라서 더욱더 이쁘게 착용 할 수 있었습니다,배송도 빠르고 상태도 좋았습니다 색감도 사진이랑 똑같았고요 투 웨이라서 더욱더 이쁘게 착용할 수 있었습니다, 배송,"똑같다, 라서, 배송, 빠르다, 사진, 상태, 색감, 착용"
아디다스 트랙탑 중에서도 좀 핏이 있는 제품이에요 참고하고 구매하세요,아디다스 트랙 탑 중에서도 좀 핏이 있는 제품이에요 참고하고 구매하세요, 아디다스,"아디다스, 제품, 참고, 트랙, 핏"
약간 길고 크긴 한데 너무 편하고 아무 옷에나 걸쳐 입을 수 있어서 좋아용!,약간 길고 크긴 한데 너무 편하고 아무 옷에나 걸쳐 입을 수 있어서 좋아요," 편하다,  길다","걸치다, 길다, 크다, 편하다"
트랙탑 유행하길래 흔하진 않은 디자인으로 사고싶었는데 맘에 들어용! 사계절 내내 아우터로도 이너로도 잘 입을 것 같아용!,트랙 탑 유행하길래 흔하진 않은 디자인으로 사고 싶었는데 맘에 들어요 사계절 내내 아우터로도 이너로도 잘 입을 것 같아요, 아우터,"내내, 디자인, 사계절, 사고, 아우터, 유행, 트랙, 흔하다"
재질도 좋고 사이즈도 딱 맞아서 잘 입고 다닐거 같아요,재질도 좋고 사이즈도 딱 맞아서 잘 입고 다닐 거 같아요,,"맞다, 사이즈, 재질"
그냥 보통? ㄱㅊ긴한데 그냥 파이어버드 블랙으로사세여 솔직히가,그냥 보통 긴한데 그냥 파이어버드 블랙으로 사세요 솔직히가," 보통,  블랙","그냥, 보통, 블랙, 솔직하다, 파이어버드"
생각보다 사이즈가 작아요 밑에 흰부분은 별로라서 안으로 접어서 입어요 카라가 옆으로 펼쳐져서 좀 애매해요,생각보다 사이즈가 작아요 밑에 흰 부분은 별로라서 안으로 접어서 입어요 카라가 옆으로 펼쳐져서 좀 애매해요," 애매하다,  별로,  작다","라서, 별로, 부분, 사이즈, 애매하다, 작다, 접다, 카라, 펼쳐지다, 희다"
사이즈 커요! 제 스펙에 입으면 비율이 똥이 될수도 있지만 편해요,사이즈 커요 제 스펙에 입으면 비율이 똥이 될 수도 있지만 편해요," 수도,  사이즈","똥, 비율, 사이즈, 수도, 스펙, 크다, 편하다"
사이즈가 좀 크게 나온 것 같아요 그래도 색상이 무난해서 잘 입긴하는데... 다른 사이즈로 입고싶네요 맞는 사이즈로 ,사이즈가 좀 크게 나온 것 같아요 그래도 색상이 무난해서 잘 입긴 하는데 다른 사이즈로 입고 싶네요 맞는 사이즈로, 색상,"나오다, 맞다, 무난, 사이즈, 색상"
화이트로 포인트 줄 수 있어서 더 좋아요 휘뚜루 입기 좋음 ~!,화이트로 포인트 줄 수 있어서 더 좋아요 휘뚜루 입기 좋음, 포인트,"포인트, 화이트, 휘뚜루"
사이즈좋고 색도 똑같아요 배송도 엄청 빠르네요,사이즈 좋고 색도 똑같아요 배송도 엄청 빠르네요," 똑같다,  사이즈","똑같다, 배송, 빠르다, 사이즈, 색도"
아주 아주 예뻐요. 너무 예뻐서 딸 기분이 좋아졌어요. 트랜드하면서도 예뻐요.,아주아주 예뻐요 너무 예뻐서 딸 기분이 좋아졌어요 트렌드 하면서도 예뻐요, 트렌드,"기분, 아주아주, 좋아지다, 트렌드"
사이즈가 xl만 남아서 그냥 샀는데 여유는 있으나 슬림해보여요,사이즈가 xl만 남아서 그냥 샀는데 여유는 있으나 슬림 해 보여요,,"xl, 그냥, 남아, 보이다, 사이즈, 슬림, 여유"
일주일에 5번 입고 다니는 듯  이거 없으면 이제 간절기 못 지냄 외 않사요 투웨이라서 더 좋음,일주일에 번 입고 다니는 듯 이거 없으면 이제 간절기 못 지냄 외 안 사요 투 웨이라서 더 좋음," 일주일,  지내다","간절기, 라서, 사, 없다, 이제, 일주일, 지내다"
핏도 예쁘고 흔하지 않은 디자인이라 더 자주 입는것 같아여 사이즈는 넉넉해서 안에 후드티 입고도 입을 수 있습니당,핏도 예쁘고 흔하지 않은 디자인이라 더 자주 입는 것 같아요 사이즈는 넉넉해서 안에 후드티 입고도 입을 수 있습니다, 디자인,"넉넉하다, 디자인, 사이즈, 핏, 흔하다"
일반 져자보다 도톰하고 재질 탄탄해요 예쁩니당,일반 져자보다 도톰하고 재질 탄탄해요 예쁩니다," 일반,  재질","도톰하다, 일반, 재질, 지다, 탄탄하다"
보통 져지보다 좀 도톰한 재질이라 좀 더워지면 못 입는데 기여워용,보통 저지보다 좀 도톰한 재질이라 좀 더워지면 못 입는데 기여와 용," 보통,  저지,  재질,  기여","기여, 더워지다, 도톰하다, 보통, 재질, 저지"
흔하지 않아서 좋아요 편하게 꾸안꾸로 입을 때 딱 좋은 것 같아요,흔하지 않아서 좋아요 편하게 꾸안꾸로 입을 때 딱 좋은 것 같아요,,"꾸안꾸, 편하다, 흔하다"
역시 좀 아디다스는 좀 사이즈가 작은 느낌이 있네요 예쁜데 좀 뒀다 입어야할듯합니당,역시 좀 아디다스는 좀 사이즈가 작은 느낌이 있네요 예쁜데 좀 뒀다 입어야 할듯합니다, 작다,"두다, 사이즈, 아디다스, 작다"
가격도 싸게 잘 샀고 막 빨래해도 변형 없어서 좋아요 배송도 빨리오고 안 사면 손해입니다,가격도 싸게 잘 샀고 막 빨래해도 변형 없어서 좋아요 배송도 빨리 오고 안 사면 손해입니다," 가격,  사면,  배송","가격, 배송, 변형, 빨래, 빨리, 사면, 손해, 싸다, 없다, 오다"
봄 저녁에 가볍게 입기 좋아요. 키 164에 좀 큰 감이 있네요,봄 저녁에 가볍게 입기 좋아요 키에 좀 큰 감이 있네요,,"가볍다, 저녁, 키"
일단 디자인이 흔하지 않아서 다른 사람이랑 안 겹치는 점이 제일 마음에 들고 배색 포인트가 보면 볼수록 예뻐옹  ㅜㅜ 아쉬운 점은 사이즈가 큰 것 밖에 안 남았어서…  그래도 만족합니당 근데 카라부분이 잘 안 길들여져서 깃이 잘 안 눕혀집니다,일단 디자인이 흔하지 않아서 다른 사람이랑 안 겹치는 점이 제일 마음에 들고 배색 포인트가 보면 볼수록 예뻐옹 아쉬운 점은 사이즈가 큰 것 밖에 안 남아서 그래도 만족합니다 근데 카라 부분이 잘 안 길들여져서 깃이 잘 안 눕혀집니다,,"눕다, 디자인, 배색, 사람, 아쉽다, 점, 제일, 지다, 치다, 흔하다"
투웨이여서 다양하게 연출할 수 있는 점이 큰 장점인듯요,투 웨이여서 다양하게 연출할 수 있는 점이 큰 장점인 듯 요, 다양하다,"다양하다, 여서, 연출, 장점, 점"
흔하지 않아서 좋은거 가타욤 색감도 너무 이뻐요!!,흔하지 않아서 좋은 거 가타욤 색감도 너무 이뻐요,,"가타, 색감, 흔하다"
집 근처 외출할일 있을때 간절기에 입기 적당합니다,집 근처 외출할 일 있을 때 간절기에 입기 적당합니다, 근처,"간절기, 근처, 외출, 적당하다"
L인데도 핏한 느낌임 크게 입으려했는뎅 실패함 핏한건 처음 입어보는데요 생각보다 말라보임 나름 예쁨띠예^_^,L인데도 피한 느낌임 크게 입으려 했는데 실패함 피한 건 처음 입어보는데요 생각보다 말라 보임 나름 예쁨띠예, 처음,"나름, 띠예, 말르다, 보임, 실패하다, 입어보다, 처음, 피"
가격도 부담스럽지 않고 편해서 데일리로 입기 좋네요.,가격도 부담스럽지 않고 편해서 데일리로 입기 좋네요, 가격,"가격, 데일리, 부담, 편하다"
편해요. 예뻐요. 모두 만족스러워서 부족한 점이 없네요.,편해요 예뻐요 모두 만족스러워서 부족한 점이 없네요,,"만족스럽다, 부족하다, 없다, 점, 편하다"
마감도 깔끔하고 디자인도 예쁘네요. 편하고 좋네요. 완전 맘에 들어요.,마감도 깔끔하고 디자인도 예쁘네요 편하고 좋네요 완전 맘에 들어요, 편하다,"깔끔하다, 디자인, 마감, 편하다"
아래 밑단이 조여서 내려 입기 살짝 애매 하지만 디자인 자체는 이쁘고 좋아요,아래 밑단이 조여서 내려 입기 살짝 애매하지만 디자인 자체는 이쁘고 좋아요, 자체,"내다, 디자인, 밑단, 아래, 애매하다, 자체, 조여"
하연색이 소매랑 부분부분 들어가서 유니크하고 좋아여,하얀색이 소매랑 부분부분 들어가서 유니크하고 좋아요,,"들어가다, 소매, 유니크, 하얀색"
구매하세여 후회안합니다!! 봄 가을에 정말 잘 입을 거 같아여,구매하세요 후회 안 합니다 봄 가을에 정말 잘 입을 거 같아요,,"가을, 후회"
져지에 청바지 코디 해보고싶어 구매했는데 싼 가격애 너무 이쁜 제품 구매해서 좋았습니다,저지에 청바지 코디해 보고 싶어 구매했는데 싼 가격에 너무 이쁜 제품 구매해서 좋았습니다," 가격,  저지","가격, 보고, 저지, 제품, 청바지, 코디해"
지퍼가 두개라는 점.면이 제법 탄탄하다라는점 만듬새도 맘에 들고 적극 추천하는 트랙탑입니다 이뻐요,지퍼가 두 개라는 전면이 제법 탄탄하다는 점 만듦새도 맘에 들고 적극 추천하는 트랙 탑입니다 이뻐요,,"개, 라는, 만들다, 적극, 전면, 제법, 지퍼, 추천, 탄탄하다, 탑, 트랙"
파이어버드 처럼 맨질 거리진않고 야아간 그것보단 거친면인데 오히려 더 좋은기분입니다 사이즈는 확실히 더 슬림해서 스마트한 핏 연출할때 입으면 좋겠어요,파이어버드처럼 만질 거리 진 않고 야아가 그것보단 거친 면인데 오히려 더 좋은 기분입니다 사이즈는 확실히 더 슬림 해서 스마트한 핏 연출할 때 입으면 좋겠어요, 스마트,"거리, 거치다, 기분, 만지다, 사이즈, 스마트, 아가, 연출, 파이어버드"
목과 손매에 흰색으로 테두리진 디자인이 이뻐서 올블랙으로 된 탑을 살까하다가 이걸 구매했는데 와 진짜 이뻐서 테이스터스 쵸이습니다,목과 손매에 흰색으로 테두리 진 디자인이 이뻐서 올블랙으로 된 탑을 살까 하다가 이걸 구매했는데 와 진짜 이뻐서 테이스터스 조이습니다," 디자인,  흰색","걸, 디자인, 목, 살다, 손매, 올블랙, 이스터, 조이다, 탑, 테두리, 흰색"
그냥 베이직템 그래도 포인트가 배색으로 들어가있어 좋습니다,그냥 베이직템 그래도 포인트가 배색으로 들어가 있어 좋습니다,,"그냥, 들어가다, 배색, 베이직, 포인트"
친구들이 다 이쁘대요 흔하지 않아서 좋아요 정말 이쁩니다!,친구들이 다 이쁘대요 흔하지 않아서 좋아요 정말 이쁩니다, 친구,"대요, 친구, 흔하다"
예뻐요! 사이즈가 없어서 큰 걸 샀었는데 그래도 슬림해보이고 좋아요,예뻐요 사이즈가 없어서 큰 걸 샀었는데 그래도 슬림 해 보이고 좋아요, 슬림,"보이, 사이즈, 슬림, 없다"
크롭하게 입으려고 작은 사이즈 샀는데 너무 맘에 듭니다. 스포티한 느낌 내고 싶으시면 강추드려요.,크롭 하게 입으려고 작은 사이즈 샀는데 너무 맘에 듭니다 스포티한 느낌 내고 싶으시면 강추 드려요, 드리다,"강추, 내다, 드리다, 사이즈, 스포티, 작다, 크롭"
너무 이쁘네요 편하게 막 입고 다니기 좋습니다 잘 입고 다니겠습니다,너무 이쁘네요 편하게 막 입고 다니기 좋습니다 잘 입고 다니겠습니다,편하다,편하다
배송 빠르고 디자인 맘에 들어요 화면이랑 색감 비슷해요 색감 좋아요,배송 빠르고 디자인 맘에 들어요 화면이랑 색감 비슷해요 색감 좋아요," 빠르다,  배송","디자인, 배송, 빠르다, 색감, 화면"
아디다스 저지 처음 샀는데 예쁘긴 예뻐요!! 근데 생각보다 엄청 얇아요ㅜㅜ 그래도 오히려 봄 가을 입기 좋을 것 같아요! 사실 s나 m 구매하고 싶었는데 품절이어서 라지로 샀어요. 라지는 오버핏으로 입기 좋을 것 같아요. 옷 디자인이 손목이 흰색이다 보니까 때가 엄청 잘 타요 ㅜㅜ,아디다스 저지 처음 샀는데 예쁘긴 예뻐요 근데 생각보다 엄청 얇아요 그래도 오히려 봄 가을 입기 좋을 것 같아요 사실 s나 m 구매하고 싶었는데 품절이어서 라지로 샀어요 라지는 온 버핏으로 입기 좋을 것 같아요 옷 디자인이 손목이 흰색이다 보니까 때가 엄청 잘 타요,,"가을, 디자인, 사실, 손목, 품절, 흰색"
진짜 예쁘긴한데 너무 흔해져서 학교에서 이옷입은사람 5명은 만나는것 같아요,진짜 예쁘긴 한데 너무 흔해져서 학교에서 이 옷 입은 사람 명은 만나는 것 같아요,,"만나다, 명, 사람, 학교, 흔하다"
생각보다 퀄리티가 좋아 놀랐습니다! 다들 구매하세요! 강추입니다~,생각보다 퀄리티가 좋아 놀랐습니다 다들 구매하세요 강추입니다,,"강추, 퀄리티"
생각보다 퀄리티가 좋아 놀랐습니다! 다들 구매하세요! 강추입니다!,생각보다 퀄리티가 좋아 놀랐습니다 다들 구매하세요 강추입니다,,"강추, 퀄리티"
희귀하고 넘 예쁩니다✌🏻✌🏻 살수있으면 꼭 사세요 어디든 잘어울리고 유행 안타는 디자인,희귀하고 너무 예쁩니다 살 수 있으면 꼭 사세요 어디든 잘 어울리고 유행 안타는 디자인," 안타,  유행","디자인, 안타, 어울리다, 유행, 희귀"
재질이 좋고 스타일도 좋습니다 배송도 늦지않고 강추합니다!!!,재질이 좋고 스타일도 좋습니다 배송도 늦지 않고 강추합니다," 배송,  재질","강추, 늦다, 배송, 스타일, 재질"
검은색 트랙탑 있는데 흰색 포인트가 너무 예뻐서 구매했어요 그냥 검은색보다 포인트되고 너무너무너무너무 예쁨,검은색 트랙 탑 있는데 흰색 포인트가 너무 예뻐서 구매했어요 그냥 검은색보다 포인트 되고 너무너무너무너무 예쁨, 흰색,"검은색, 트랙, 포인트, 흰색"
안감이 조금 기모 아니 기모가 있어 간절기까지도 입을 수 있고 요즘 날씨에도 입기 딱 좋네요,안감이 조금 기모 아니 기모가 있어 간절기까지도 입을 수 있고 요즘 날씨에도 입기 딱 좋네요, 안감,"간절기, 기모, 날씨, 아니다, 안감"
너무 싸게 잘샀습니다^^ 항상 무신사많이애용하고있어요 좋은물건감사합니다,너무 싸게 잘 샀습니다 항상 무신사 많이 애용하고 있어요 좋은 물건 감사합니다," 물다,  싸다,  물건","물건, 물다, 싸다, 애용, 항상"
역시 아디다스!! 입고 다니는데 다들 예쁘다고 어디서 샀냐고 물어보네요,역시 아디다스 입고 다니는데 다들 예쁘다고 어디서 샀냐고 물어보네요,"물어보다,  아디다스","물어보다, 아디다스, 어디서"
"데일리로 입기 딱 좋은 옷, 편하게 입을 수 있는게 제일 큰 장점인 듯??",데일리로 입기 딱 좋은 옷 편하게 입을 수 있는 게 제일 큰 장점인 듯, 제일,"데일리, 장점, 제일, 편하다"
너무너무 이쁘네요 요즘 베켄바우어 유행이라길래 구매했는데 만족합니다! 배송도 빨라요잉,너무너무 이쁘네요 요즘 베켄바워 유행이라길래 구매했는데 만족합니다 배송도 빨라요잉," 배송,  베켄바워,  만족하다","만족하다, 배송, 베켄바워, 빠르다"
튀는 색 사려다 블랙으로 샀는데 고급스럽고 재질좋고 교복위에 입었는데 예쁘네요 데일리룩 이네요 ㅎ,튀는 색 사려다 블랙으로 샀는데 고급스럽고 재질 좋고 교복 위에 입었는데 예쁘네요 데일리룩이네요," 튀다,  재질,  데일리룩","고급스럽다, 교복, 데일리룩, 블랙, 사려, 위, 재질, 튀다"
개인적으로제일 맘애 드는 직업입니다. 맨날 이 잠바만 입고 있어요,개인적으로 제일 맘에 드는 직업입니다 맨날 이 잠바만 입고 있어요,,"개인, 맨날, 잠바, 제일, 직업"
얇은 기모가 들어 있어요. 흰색 부분이 때가 잘 타긴 하지만 빨면 또 잘 지워져요,얇은 기모가 들어 있어요 흰색 부분이 때가 잘 타긴 하지만 빨면 또 잘 지워져요," 기모,  얇다,  흰색, 지워지다","기모, 부분, 얇다, 지워지다, 흰색"
디자인 흔하지 않고 예쁩니다. 핏도 예쁘게 떨어져요.,디자인 흔하지 않고 예쁩니다 핏도 예쁘게 떨어져요,,"디자인, 떨어지다, 핏, 흔하다"
너무 이쁩니다 싸게 잘구매했습니다 강추합니다,너무 이쁩니다 싸게 잘 구매했습니다 강추합니다,,"강추, 싸다"
시보리 완전 짱짱하고 조ㅗ아요!! 몇달 전에 사고 지금까지 잘 입고있습니다 그냥 완전 내 교복..💗,시보리 정말 짱짱하고 좋아요 몇 달 전에 사고 지금까지 잘 입고 있습니다 그냥 완전 내 교복,,"교복, 사고, 시보리, 전, 짱짱하다"
흰색이 포인트로 있어서 너무 예뻐요  심심하지 않고 검은색 바지랑 어울려서 자주 입고있어요 추천합니다,흰색이 포인트로 있어서 너무 예뻐요 심심하지 않고 검은색 바지랑 어울려서 자주 입고 있어요 추천합니다, 흰색,"검은색, 바지, 심심하다, 어울리다, 추천, 포인트, 흰색"
너무 예쁘고 역시 아디다스에요 봄 가을에 딱이에요,너무 예쁘고 역시 아디다스에요 봄 가을에 딱이에요,,"가을, 딱이다, 아디다스"
최고의 아이템입니다 너무 편하고멋있는 제품입니다,최고의 아이템입니다 너무 편하고 멋있는 제품입니다," 멋있다,  편하다,  제품","멋있다, 아이템, 제품, 최고, 편하다"
예쁜데 소매가 너무 잘 더러워져용… 안에 살짝 기모도 있어서 좋아용,예쁜데 소매가 너무 잘 더러워져요 안에 살짝 기모도 있어서 좋아요, 기모,"기모, 더러워지다, 소매"
최고의 트랙자켓입니다 너무나멋있고 요즘입기좋아요,최고의 트랙 재킷입니다 너무나 멋있고 요즘 입기 좋아요, 최고,"너무나, 멋있다, 재킷, 최고, 트랙"
너무나멋있는 아디다스의 트랙자켓입니다 요즘입기 좋아요,너무나 멋있는 아디다스의 트랙 재킷입니다 요즘 입기 좋아요,,"멋있다, 아디다스, 재킷, 트랙"
옷이아주아주이뻐요 똑같은거입은사람 두명 보긴 했지만 ㅠ 근데 카라 끝부분이 안접히는게 저한텐 큰 단점으로 다가왔어요 그래도 감수할만함,옷이 아주아주 이뻐요 똑같은 거 입은 사람 두 명 보긴 했지만 근데 카라 끝부분이 안 접히는 게 저한텐 큰 단점으로 다가왔어요 그래도 감수할만함," 접다,  카라","다가오다, 단점, 똑같다, 사람, 아주아주, 접다, 카라"
슬림한 아들이 입으니 잘어울리네요 배나온 사람은 힘들듯~,슬림한 아들이 입으니 잘 어울리네요 배 나온 사람은 힘들 듯, 아들,"나오다, 사람, 슬림, 아들, 어울리다, 힘들다"
예뻐용 올블랙은 흔해서 흰색 들어간걸로 샀는데 포인트 있어서 더 예쁜듯,예뻐요 올블랙은 흔해서 흰색 들어간 걸로 샀는데 포인트 있어서 더 예쁜 듯," 포인트, 올블랙,  흰색","걸, 들어가다, 올블랙, 포인트, 흔하다, 흰색"
사이즈 여유 있고 예뻐요 어떤 옷이랑 매치해도 잘 어울려요 :),사이즈 여유 있고 예뻐요 어떤 옷이랑 매치해도 잘 어울려요," 매치,  여유,  사이즈","매치, 사이즈, 어떻다, 어울리다, 여유"
배색다르게 들어간게 너무 이쁘고 핏도 맘에 들어요 !,배색 다르게 들어간 게 너무 이쁘고 핏도 맘에 들어요, 배색,"다르다, 들어가다, 배색, 핏"
M이 품절돼서 L로 샀는데 좀 긴 것 빼고는 괜찮앗어요 그리고 시보리가 엄청 짱짱한 편이니 참고하세요!,M이 품절돼서 L로 샀는데 좀 긴 것 빼고는 괜찮았어요 그리고 시보리가 엄청 짱짱한 편이니 참고하세요,,"빼다, 시보리, 짱짱하다, 참고, 편이, 품절"
트랙탑인데 포인트가 들어간 게 멋스럽고 좋네요,트랙 탑인데 포인트가 들어간 게 멋스럽고 좋네요, 포인트,"들어가다, 탑, 트랙, 포인트"
많이 클까봐 걱정했는데 밑에가 어벙벙하진 않아서 조절해서 입기 좋았어요! 소매는 조금 길지만 핏은 예뻐요,많이 클까 봐 걱정했는데 밑에 가 어벙하진 않아서 조절해서 입기 좋았어요 소매는 조금 길지만 핏은 예뻐요,,"가다, 걱정, 길, 밑, 벙하다, 소매, 조절, 크다, 핏"
이맘때 입기 딱 좋은  아이템이예요 편하게 입을 수 있어서 정말 좋아요,이맘때 입기 딱 좋은 아이템이에요 편하게 입을 수 있어서 정말 좋아요,,"아이템, 이맘때, 편하다"
음 블랙 화이트 투톤이라 더 이쁜거 같아요 투웨이라서 더 예쁘게 스타일링 가능합니당,음 블랙 화이트 투톤이라 더 이쁜 거 같아요 투 웨이라서 더 예쁘게 스타일링 가능합니다, 화이트,"가능하다, 라서, 블랙, 일링, 투톤, 화이트"
생각보다 길이가 더 길긴 했지만 괜찮았어요 굿굿,생각보다 길이가 더 길긴 했지만 괜찮았어요 굿굿,,"굿굿, 길다, 길이"
요즘 유행하고 사람들도 많이 입으셔서 저도 궁금해서 샀는데 역시 인기있는데 다 이유가 있구나 싶었습니다!,요즘 유행하고 사람들도 많이 입으셔서 저도 궁금해서 샀는데 역시 인기 있는데 다 이유가 있구나 싶었습니다, 이유,"궁금하다, 사람, 유행, 이유, 인기"
핏하게 입고싶었는데 생각보다 오버하게 입는게 나을 거 같음,피하게 입고 싶었는데 생각보다 오버하게 입는 게 나을 거 같음, 피하,"나다, 오버, 피하"
팔목 쪽에 실밥이 엄청 튀어나와있어서 당황스러웠지만 상품은 정말 예쁩니다,팔목 쪽에 실밥이 엄청 튀어나와있어서 당황스러웠지만 상품은 정말 예쁩니다," 상품,  튀어나오다","상품, 스럽다, 실밥, 쪽, 튀어나오다, 팔목"
좋은데 지퍼가 잘 안 올라가서 불편하고 왔을때 실밥이 풀려있었습니다 신경 안 쓰이진 않지만 그럭저럭 잘 입고 다닙니당 학교갈 때 맨날 입는데 소매 부분이 흰색이라 많이 더러워져요…,좋은데 지퍼가 잘 안 올라가서 불편하고 왔을 때 실밥이 풀려있었습니다 신경 안 쓰이진 않지만 그럭저럭 잘 입고 다닙니다 학교 갈 때 맨날 입는데 소매 부분이 흰색이라 많이 더러워져요,,"갈다, 더러워지다, 맨날, 부분, 신경, 실밥, 쓰이다, 올라가다, 지퍼, 풀다, 학교, 흰색"
2XL밖에 없어서 2XL로 샀는데 평소에 오버핏 많이 입는데 딱 제가 원하는 핏이었습니당!! 진짜 배색포인트도 예쁘고 요즘 휘뚜루마뚜루로 엄청 많이 입고 다니고 있어요,XL밖에 없어서 XL로 샀는데 평소에 오버핏 많이 입는데 딱 제가 원하는 핏이었습니다 진짜 배색 포인트도 예쁘고 요즘 휘뚜루마뚜루로 엄청 많이 입고 다니고 있어요,,"xl, 밖에, 배색, 오버핏, 평소, 포인트, 휘뚜루마뚜루"
아디다스 ~ 너무 이쁩니다 투웨이라서 밑에 검정 부분까지 지퍼 열어서 입으면 진짜 이뻐용,아디다스 너무 이쁩니다 투 웨이라서 밑에 검정 부분까지 지퍼 열어서 입으면 진짜 이뻐요, 아디다스,"검정, 부분, 아디다스, 열다, 지퍼"
음…. 아디다스가 역시나 좀 작게 나오는 느낌…… 외투 투엑라사면 보통 헐렁한 느낌으로 맞아야 하는데 그런 느낌이 없어서리… 좀 아숩네요 배송은 빨라요 색감도 예쁘고 ,음 아디다스가 역시나 좀 작게 나오는 느낌 외투 투엑라사면 보통 헐렁한 느낌으로 맞아야 하는데 그런 느낌이 없어서 좀 아쉽네요 배송은 빨라요 색감도 예쁘고,,"그렇다, 나오다, 라사, 색감, 아디다스, 아쉽다, 외투, 작다"
박시한 느낌으로 잘 입고 있어요. 운좋게 규매햤습니다,박시한 느낌으로 잘 입고 있어요 운 좋게 규매햤습니다,,"규매햤습니, 박시"
