Review,Processed_Review,keyword
치마가 가벼워서 여름에 시원하게 잘 입고 있어요~ 사이즈도 크게 나왓어요,치마가 가벼워서 여름에 시원하게 잘 입고 있어요 사이즈도 크게 나왔어요,"가볍다, 시원하다, 치마, 사이즈, 여름, 나오다, 크게"
S인데도 허리가 좀 크네요..? 근데 허리 양쪽 뒤에 둘레 조절 단추 있기는 합니다. 그래도 xs 샀으면 좀 빡빡했을 것 같은 느낌들어요.,S인데도 허리가 좀 크네요 근데 허리 양쪽 뒤에 둘레 조절 단추 있기는 합니다 그래도 xs 샀으면 좀 빡빡했을 것 같은 느낌 들어요,"허리, 단추, xs, s, 뒤, 양쪽"
제가 원하던 색상과 핏이에요 마음에 듭니다! 좋아요,제가 원하던 색상과 핏이에요 마음에 듭니다 좋아요,"핏, 원하다, 색상"
키는 159고 기장이 길어서 수선했어요. 옷자체는 시원하고 좋네요.,키는 고 기장이 길어서 수선했어요 옷 자체는 시원하고 좋네요,"시원하다, 키, 수선하다, 자체, 기장"
홍대갔을때 오프라인으로 보고 맘에들어서 구매했어요 쿠폰 먹이구 세일해서 오프라인보다 싸게사서 기분이 좋네용  좋아하는 톤의 색상이라 자주 입을거 같아요,홍대 갔을 때 오프라인으로 보고 맘에 들어서 구매했어요 쿠폰 먹이고 세일해서 오프라인보다 싸게 사서 기분이 좋네요 좋아하는 톤의 색상이라 자주 입을 거 같아요,"색상, 오프라인, 쿠폰, 싸다, 좋아하다, 세일, 먹이, 기분"
얇고 예뻐서 색깔별로 다 샀는데 베이지가 좀 어두운 베이지네요 약간 그레이랑 비슷한 느낌? 오히려 어두워서 ㄷ좋음,얇고 예뻐서 색깔별로 다 샀는데 베이지가 좀 어두운 베이지네요 약간 그레이랑 비슷한 느낌 오히려 어두워서 좋음,"색깔, 별로, 그레이, 어둡다, 베이지, 얇다, 두운"
"좋아요!! 여름에 입기 편한 소재입니다~
다른색도 사고싶네요",좋아요 여름에 입기 편한 소재입니다 다른 색도 사고 싶네요,"여름, 소재, 색도, 편하다, 사고"
맘에 들어서 두 장째 쟁였습니다. 올 해 제 교복이에요~~ 위아래 다 무신사에옹,맘에 들어서 두 장째 쟁였습니다 올해 제 교복이에요 위아래 다 무신사에 옹,"쟁, 교복, 무신, 사, 위아래, 째, 올해, 들어서다"
"길이도 딱 좋고 스판이 있어서 엄청 편해요!!
아주 잘 산거 같아요",길이도 딱 좋고 스판이 있어서 엄청 편해요 아주 잘 산거 같아요,"편하다, 스판, 길이"
"건메탈이랑 두벌샀는데
첨에살땐 무조건 건메탈이 더 많이 입어질거라 생각했는데
의외로  베이지가 훨씬 휘뚤마뚤이고
건메탈이 옥입기 까다롭네요
베이지 개추",건에 탈이랑 두 벌 샀는데 첨에 살 땐 무조건 건에 탈이 더 많이 입어질 거라 생각했는데 의외로 베이지가 훨씬 휘뚤마뚤이고 건에 탈이 옥 입기 까다롭네요 베이지 개추,"개추, 휘뚤마뚤, 이고, 까다롭다, 건, 베이지"
"여자친구 선물로 구매
색감이 실물이 더 이쁘고 원단좋은듯합니다",여자친구 선물로 구매 색감이 실물이 더 이쁘고 원단 좋은듯합니다,"선물, 색감, 여자친구, 실물, 원단"
원단 가볍고 부드러워 편하게 맞습니다 핏이 예쁘고 허리 조절 단추가 있어서 편합니다 비오는 날씨에도 잘 입을 듯,원단 가볍고 부드러워 편하게 맞습니다 핏이 예쁘고 허리 조절 단추가 있어서 편합니다 비 오는 날씨에도 잘 입을 듯,"날씨, 부드럽다, 편하다, 가볍다, 맞다, 단추"
반값에 세일하길래 잘 입는 옷이어서 일ㅈ 일에 두어번씩 입는 제 유니폼이에오.,반값에 세일하길래 잘 입는 옷이어서 일 일에 두어 번씩 입는 제 유니폼이에 오,"유니폼, 세일, 두다, 반값, 일, 번, 씩"
"얇고, 비오는 날입어도 되도록 방수가되는 소재입니다! 
휘뚜루 마뚜루 입을 수있어요. 뒷 트임이 있어서 다리가 편해요 한가지 아쉬운건 마르신 분들은 슬림 해보입니다~",얇고 비 오는 날 입어도 되도록 방수가 되는 소재입니다 휘뚜루마뚜루 입을 수 있어요 뒤트임이 있어서 다리가 편해요 한 가지 아쉬운 건 마르신 분들은 슬림 해 보입니다,"슬림, 다리, 아쉽다, 소재, 편하다, 가지, 얇다, 보이다"
사이즈 딱좋아요 재질도 시원해서 여름에 입기 좋을거 같아요!,사이즈 딱 좋아요 재질도 시원해서 여름에 입기 좋을 거 같아요,"여름, 시원하다, 재질, 사이즈"
색감도 예쁘고 너무 잘 입고 있어요 158기준 발목까지 딱 내려와요,색감도 예쁘고 너무 잘 입고 있어요 기준 발목까지 딱 내려와요,"내려오다, 발목, 기준, 색감"
"넘 맘에 들어요 물에 젖어도 금방 마르고 시원합니다!
너무 좋아서 깔별로 다 샀어요ㅎ",너무 맘에 들어요 물에 젖어도 금방 마르고 시원합니다 너무 좋아서 깔 별러 다 샀어요,"젖다, 물, 시원하다, 마르고, 별러"
딱 찾고 있던 스타일이에요 키가 160이라 조금 길긴 한데 예뻐요,딱 찾고 있던 스타일이에요 키가이라 조금 길긴 한데 예뻐요,"스타일, 키, 이르다, 길다, 찾다"
무신사 스탠다드 제품은 스몰도 큰거같아요 그래도 디자인이랑 핏이 이뻐서 자주 입아요,무신사 스탠더드 제품은 스몰도 큰 거 같아요 그래도 디자인이랑 핏이 이뻐서 자주 입아요,"디자인, 핏, 제품, 스탠더드, 스몰, 물다"
세일기간에 저렴하게 샀어요 질도 좋고 만족해요,세일 기간에 저렴하게 샀어요 질도 좋고 만족해요,"만족하다, 저렴하다, 기간, 질도, 세일"
"너무 맘에들어서 다른컬러도 샀어요 
시원하고 편하고 이것만입어요",너무 맘에 들어서 다른 컬러도 샀어요 시원하고 편하고 이것만 입어요,"컬러, 편하다, 시원하다, 들어서다"
소재 가볍고 시원한 편이라 여름에 입기 좋고 반팔에 매치해서 잘 입고 있어요 약간 스판기도 있어서 편해요 허리가 살짝 컸는데 조여입을 수 있게 조절 단추가 달려있어서 좋았어요 무신사스탠다드 제품들은 믿고 입어요ㅎ,소재 가볍고 시원한 편이라 여름에 입기 좋고 반팔에 매치해서 잘 입고 있어요 약간 스판기도 있어서 편해요 허리가 살짝 컸는데 조여 입을 수 있게 조절 단추가 달려있어서 좋았어요 무신사 스탠더드 제품들은 믿고 입어요,"허리, 제품, 단추, 소재, 가볍다, 팔, 스판, 기도"
무신사매장에서 입어보고 구매했어요 엄청얇고 딱 붙는 스타일입니당,무선사 매장에서 입어보고 구매했어요 엄청 얇고 딱 붙는 스타일입니다,"스타일, 입어보다, 얇다, 붙다, 매장, 무섭다"
"스판이라 편하게 입을 수 있어요ㅎㅎ
길이는 164기준 종아리 2/3 덮는 기장인데 사진은 조금 더 길어보이게 나왔네요
쿨한 느낌의 베이지라서 너무 노란끼 도는 상의 보다는 쿨한 색상의 상의가 잘 어울리는 거 같아요!
장마철에 입기 좋아서 지금 시즌에 딱입니당",스판이라 편하게 입을 수 있어요 길이는 기준 종아리 덮는 기장인데 사진은 조금 더 길어 보이게 나왔네요 쿨한 느낌의 베이지라서 너무 노란 끼 도는 상의보다는 쿨한 색상의 상의가 잘 어울리는 거 같아요 장마철에 입기 좋아서 지금 시즌에 딱입니다,"색상, 상의, 보다는, 사진, 노랗다, 쿨하다, 편하다, 종아리, 시즌"
옷이 좀 길긴 한데 너무 편하게입기 딱 좋은거같아용,옷이 좀 길긴 한데 너무 편하게 입기 딱 좋은 거 같아요,"편하다, 길다"
배송진짜 빨라요. 근데 사이즈는 좀 커서 S입었어도 됐을거같아요,배송 진짜 빨라요 근데 사이즈는 좀 커서 S 입었어도 됐을 거 같아요,"빠르다, 커서, 사이즈, 배송"
배송진짜 빨라요. 근데 사이즈는 좀 커요. S입었어도 됐을거같아요,배송 진짜 빨라요 근데 사이즈는 좀 커요 S 입었어도 됐을 거 같아요,"크다, 빠르다, 사이즈, 배송"
"원단이 얇고 시원해서 한여름에도 가능합니다
L 사이즈 치고 허리사이즈는 크게 나왔지만 허리사이즈 조절할 수 있어서 괜찮으실 것 같습니다
검정색도 샀는데 검정색보다 원단이 좀 더 얇아요
비오는 날 입고 빗물에 젖어도 30분이면 마름 굿",원단이 얇고 시원해서 한여름에도 가능합니다 L 사이즈 치고 허리 사이즈는 크게 나왔지만 허리 사이즈 조절할 수 있어서 괜찮으실 것 같습니다 검은색도 샀는데 검은색보다 원단이 좀 더 얇아요 비 오는 날 입고 빗물에 젖어도 분이면 마름 굿,"검은색, 젖다, 사이즈, 한여름, 빗물, 얇다"
"와이프 사줬는데 시원하고 편하다고 잘 입고 있네요
세탁후 변형도 없고 잘 산거 같습니다",와이프 사줬는데 시원하고 편하다고 잘 입고 있네요 세탁 후 변형도 없고 잘 산거 같습니다,"편하다, 사주다, 시원하다, 변형도, 와이프"
이거 사고 검은색 하나 더 샀어요 아아주 맘에 들어요 엄청 편해요,이거 사고 검은색 하나 더 샀어요 아주 맘에 들어요 엄청 편해요,"편하다, 하나, 검은색, 사고"
사이즈 널널하고 편해서 좋은 것 같아요. 자주 입을 듯.,사이즈 널찍하고 편해서 좋은 것 같아요 자주 입을 듯,"편하다, 사이즈, 널찍하다"
아주 편하고 좋습니다. 허리 사이즈 조절할 수 있어서 편해요. 그리고 생각보다 회색빛 돌아요.,아주 편하고 좋습니다 허리 사이즈 조절할 수 있어서 편해요 그리고 생각보다 회색빛 돌아요,"편하다, 돌다, 조절, 사이즈"
넉넉한 사이즈라 편해요. 밝은 컬러는 아니지만 무난해요.,넉넉한 사이즈라 편해요 밝은 컬러는 아니지만 무난해요,"컬러, 무난, 편하다, 사이즈, 밝다, 아니다, 넉넉하다"
검정입어보고 너무좋아서 베이지도 샀는데 맘에들어요 그리고 스판이라 활동하기완전편해요,검정 입어보고 너무 좋아서 베이지도 샀는데 맘에 들어요 그리고 스판이라 활동하기 정말 편해요,"편하다, 입어보다, 스판, 검정"
살짝큰데 너무 예쁘고 좋아요!! 자주 편하게입을 것 같아요,살짝 큰데 너무 예쁘고 좋아요 자주 편하게 입을 것 같아요,"편하다, 크다"
기장이 좀 길었지만 발목안보이게 다녔어요~ 여름에 그렇게 덥지않고 색감도 딱입니다. 흰티랑 입으면 예뻐요,기장이 좀 길었지만 발목 안 보이게 다녔어요 여름에 그렇게 덥지 않고 색감도 딱입니다 흰 티랑 입으면 예뻐요,"덥다, 색감, 여름, 보이, 그렇게, 딱이다"
"너무 이뻐요, 여름철 입기도 좋고 색상별로 쟁여버렸습니다",너무 이뻐요 여름철 입기도 좋고 색상별로 쟁여버렸습니다,"색상, 별로, 여름철, 쟁, 버리다"
"허리 26 입는데 단추 다 안으로 채워도 조금 크네여
핏 예뻐요 그리고 베이지와 그레이 중간 색 같아용",허리 입는데 단추 다 안으로 채워도 조금 크네요 핏 예뻐요 그리고 베이지와 그레이 중간 색 같아요,"그레이, 베이지, 채우다, 크다"
"생각보다 크게 나왔고 스판이라 잘 늘어나요
키-몸무게=100이신분들은 꼭 S사세요",생각보다 크게 나왔고 스판이라 잘 늘어나요 키 몸무게이신 분들은 꼭 S 사세요,"늘어나다, 몸무게, 이신, 스판, 분, 나오다, 크게"
핏도 예쁘고 편해요 소재도 시원해서 너무 좋습니다,핏도 예쁘고 편해요 소재도 시원해서 너무 좋습니다,"편하다, 시원하다, 핏, 소재"
검정이랑 라이트베이지 둘다 샀는데 같은사이즈인데도 라이트베이지가 살짝 더 커요! 치마는 예쁩니다,검정이랑 라이트 베이지 둘 다 샀는데 같은 사이즈인데도 라이트 베이지가 살짝 더 커요 치마는 예쁩니다,"사이즈, 크다, 검정, 치마, 베이지, 라이트"
허리가 보통 사이즈보다 훨씬 크게 나온 것 같으요! 평소에는 작은S 입는데 이거는 xs도 커요 그래도 핏은 예쁩니당,허리가 보통 사이즈보다 훨씬 크게 나온 것 같아요 평소에는 작은 S 입는데 이거는 xs도 커요 그래도 핏은 예쁩니다,"사이즈, 크다, 작다, 핏, 평소, 에는, xs, 허리"
"카고스커트 하나 입고싶었는데 더워서 못입을까봐 장바구니에 담아두고 엄청 고민했는데 괜히 시간만 낭비한듯...
엉덩이부분 맞고 여름에 입어도 될 천과 허리단추조절까지 맘에 듭니다.편하고 핏도 이뻐서 자주 입을것 같아요.",카고 스커트 하나 입고 싶었는데 더워서 못 입을까 봐 장바구니에 담아두고 엄청 고민했는데 괜히 시간만 낭비한 듯 엉덩이 부분 맞고 여름에 입어도 될 천과 허리 단추 조절까지 맘에 듭니다 편하고 핏도 이뻐서 자주 입을 것 같아요,"덥다, 엉덩이, 편하다, 여름, 핏, 허리"
사이즈가 xs치고는 크게 나온 것 같아여 젤 안쪽으로 해도 허리가 커서 치마가 자꾸 돌아가용! 치마자체는 예쁩니당ㅎㅎ,사이즈가 xs치고는 크게 나온 것 같아요 젤 안쪽으로 해도 허리가 커서 치마가 자꾸 돌아가요 치마 자체는 예쁩니다,"커서, 자꾸, 사이즈, 안쪽, 치마, 허리, xs, 치고는, 나오다"
"무신사 요즘 배송 엄청 빠르네요
엄청 얇고 가벼워요
신축성있어서 편하고
밝은색인데 비치지않아서 좋아요
사이즈는 생각보다 살짝 큽니다
상세사이즈보고 라지 시키려다가 m했는데 딱 알맞음 ㅎ",무신사 요즘 배송 엄청 빠르네요 엄청 얇고 가벼워요 신축성 있어서 편하고 밝은색인데 비치지 않아서 좋아요 사이즈는 생각보다 살짝 큽니다 상세 사이즈 보고 라지 시키려다가 m 했는데 딱 알맞음,"사이즈, 크다, 밝다, 은색, 가볍다, 얇다, 알맞다"
"얇고 가볍고 밝은데 안비침
여름에 시원하게 잘 입을것같고
소재때문인지 상세사이즈보다 큰느낌!",얇고 가볍고 밝은데 안 비침 여름에 시원하게 잘 입을 것 같고 소재 때문인지 상세 사이즈보다 큰 느낌,"사이즈, 여름, 가볍다, 밝다, 얇다, 때문, 인지, 시원하다, 상세"
"엄청 얇고 가벼워요
신축성있어서 편하고
밝은색인데 비치지않아서 좋아요
너무 좋아요!",엄청 얇고 가벼워요 신축성 있어서 편하고 밝은색인데 비치지 않아서 좋아요 너무 좋아요,"밝다, 은색, 가볍다, 편하다, 얇다, 비치, 지, 신축, 성"
"무신사 세일기간에 저렴하게 구매했어요.
길이는 살짝 길긴하지만 불편하지는 않아서 그대로 착용하고 있어요.",무신사 세일 기간에 저렴하게 구매했어요 길이는 살짝 길긴 하지만 불편하지는 않아서 그대로 착용하고 있어요,"저렴하다, 길다, 불편하다, 길이, 세일, 기간, 착용"
얇아서 시원하고 잘 늘어나서 편하고 아빠 맘에 든 옷ㅋ,얇아서 시원하고 잘 늘어나서 편하고 아빠 맘에 든 옷,"편하다, 얇다, 늘어나다, 시원하다, 아빠"
인기상품은 이유가 있네요 다리 길어보이고 더 말라보여용 ㅎㅎ얇고 여름에 입기 좋아요 !! 옷 디테일도 넘 맘에들어요  잘입을게용,인기상품은 이유가 있네요 다리 길어 보이고 더 말라 보여요 얇고 여름에 입기 좋아요 옷 디테일도 너무 맘에 들어요 잘 입을게요,"여름, 보이, 인기상, 품다, 보이다, 얇다"
색이 진짜 오묘하고 예뻐요 사진보다 실물이 더 맘에들어요 기장은 길지만 애매한거보다 나은것같아요 맘에 듭니다용,색이 진짜 오묘하고 예뻐요 사진보다 실물이 더 맘에 들어요 기장은 길지만 애매한 거보다 나은 것 같아요 맘에 듭니다 욕,"사진, 오묘하다, 길, 나은, 애매하다, 실물"
아니 저 고민 한 시간들이 무색할정도로 예뻐서 맘에 들어용,아니 저 고민 한 시간들이 무색할 정도로 예뻐서 맘에 들어요,"무색, 아니다, 고민"
"보통 치마 s입는데 이제품은 커서 xs를 샀어요 옆에 조절하는 단추가 있어서 줄이면 딱맞아요~
색깔도 흔치않은 색이라 마음에 들어요",보통 치마 s 입는데 이 제품은 커서 xs를 샀어요 옆에 조절하는 단추가 있어서 줄이면 딱 맞아요 색깔도 흔치않은 색이라 마음에 들어요,"색깔, 색, 제품, 단추, xs, 커서, 보통"
"보통 치마는 s입는데 매장에서 입어봤을때 너무 크고 xs가 잘맞아서 주문했어요
Xs도 살짝 허리가 컸는데 옆에 조절하는 단추가 있어서 너무 유용해요 단추 조절하면 딱 맞습니다
길이는 거의 발목까지 오고 배나 엉덩이 너무 부각되지 않아서 잘 입고다니고 있습니당",보통 치마는 s 입는데 매장에서 입어봤을 때 너무 크고 xs가 잘 맞아서 주문했어요 Xs도 살짝 허리가 컸는데 옆에 조절하는 단추가 있어서 너무 유용해요 단추 조절하면 딱 맞습니다 길이는 거의 발목까지 오고 배나 엉덩이 너무 부각되지 않아서 잘 입고 다니고 있습니다,"발목, 허리, 단추, 길이, 엉덩이, xs"
"키가 큰데 딱 좋은 기장입니다
허리도 조절할수있어 좋고 시원한 재질이라 여름에 딱이네요
편하고 좋아요",키가 큰데 딱 좋은 기장입니다 허리도 조절할 수 있어 좋고 시원한 재질이라 여름에 딱이네요 편하고 좋아요,"여름, 편하다, 재질, 기장, 허리, 딱이다"
건메탈 색상을 먼저 사고 좋아서 베이지도 샀는데 같은 S 사이즈이지만 베이지가 좀더 넉넉하네요! 너무 예쁜 옷이에요! 길이도 색깔도 디자인도 다 좋습니다!,건에 탈 색상을 먼저 사고 좋아서 베이지도 샀는데 같은 S 사이즈이지만 베이지가 좀 더 넉넉하네요 너무 예쁜 옷이에요 길이도 색깔도 디자인도 다 좋습니다,"색깔, 색상, 사이즈, 디자인, 넉넉하다, 건"
블랙 사고 베이지도 구매 ㅎㅎ 세일때 살까 고민 엄청하다가 질렀어요. 같이 산 티셔츠랑 톤온톤이 되니까 더 마음에 들어요.,블랙 사고 베이지도 구매 세일 때 살까 고민 엄정하다가 질렀어요 같이 산 티셔츠랑 톤 온 톤이 되니까 더 마음에 들어요,"티셔츠, 살다, 엄정하다, 톤, 지르다, 베이지"
"허리에 맞추면 엉덩이가 작고 엉덩이에 맞추면 허리가 크고ㅠㅠ
그치만 편하고 가벼워서 자주 입게 되네용",허리에 맞추면 엉덩이가 작고 엉덩이에 맞추면 허리가 크고 그렇지만 편하고 가벼워서 자주 입게 되네요,"엉덩이, 가볍다, 맞추다, 편하다, 허리, 작고"
생각보다 기장이 길어서 키 큰 저에게는 아주 만족스러워욘,생각보다 기장이 길어서 키 큰 저에게는 아주 만족스러워 요녀,"만족스럽다, 에게는, 녀, 기장"
"후들후들 천이라 맘에 들어요 요증 유행 카고 굿굿
비닐 배송은 감점이네요",후들후들 천이라 맘에 들어요 요증 유행 카고 굿굿 비닐 배송은 감점이네요,"배송, 감점, 후, 굿굿, 천이, 유행, 비닐, 증"
후들후들 천이라 맘에 들어요 요증 유행 카고 굿굿,후들후들 천이라 맘에 들어요 요증 유행 카고 굿굿,"굿굿, 후, 천이, 유행, 증, 카"
평소 27-28정도 입는데 s사이즈 편하게 맞아요 길이도 딱 좋음,평소 정도 입는데 s사이즈 편하게 맞아요 길이도 딱 좋음,"편하다, 맞다, 평소, 길이, s, 사이즈"
얇아서 여름에 입기 좋아요  맘에 드네요  단  사이즈  제법 큽니다  너무 만만하게 봤어요  바느질 다시해서 입습니다,얇아서 여름에 입기 좋아요 맘에 드네요 단 사이즈 제법 큽니다 너무 만만하게 봤어요 바느질 다시 해서 입습니다,"사이즈, 크다, 얇다, 바느질, 만만하다"
"너무 편한 치마 입니다 색도 예뻐요
검정색 사고 너무 마음에 들어서 베이지도 구입했어요",너무 편한 치마입니다 색도 예뻐요 검은색 사고 너무 마음에 들어서 베이지도 구입했어요,"치마, 베이지, 편하다, 검은색, 들어서다, 색도"
"검정색 너무 잘 입어서 베이지도 구입했어요
잘 늘어나서 너무 편해요!!
친구가 보고 자기도 똑같은거 구입했어요",검은색 너무 잘 입어서 베이지도 구입했어요 잘 늘어나서 너무 편해요 친구가 보고 자기도 똑같은 거 구입했어요,"친구, 편하다, 늘어나다, 보고, 똑같다, 검은색, 베이지"
카고스커트 사고싶었는데 롱기장이 편하고 손이 자주 갈 것 같아 구입했어요. 핏도 색상도 다 맘에 듭니다! 무탠다드는 실패한 적이 없어요,카고 스커트 사고 싶었는데 롱 기장이 편하고 손이 자주 갈 것 같아 구입했어요 핏도 색상도 다 맘에 듭니다 문탠 다 드는 실패한 적이 없어요,"편하다, 핏, 색상, 손"
"매장에서 입어보고 인터넷으로 주문했어요.
기장은 길어서 수선했구요.
여름에 편하게 입을 수있을꺼같아요~",매장에서 입어보고 인터넷으로 주문했어요 기장은 길어서 수선했고요 여름에 편하게 입을 수 있을 거 같아요,"여름, 입어보다, 수선하다, 주문, 매장, 편하다, 인터넷"
"한여름에도 너무 잘입고 편안해서  좋아요 
바스락 거리는 느낌이 너무 좋아요 
가볍고 피부닿는 느낌도 달라붙지 않아 좋아요
길이는 길지만 뒷트임으로 불편하지 않아요 
깔별로 쟁이고 선물도 주고 
편안하게 휘뚤말뚤",한여름에도 너무 잘 입고 편안해서 좋아요 바스락거리는 느낌이 너무 좋아요 가볍고 피부 닿는 느낌도 달라붙지 않아 좋아요 길이는 길지만 뒤트임으로 불편하지 않아요 깔 별러 쟁이고 선물도 주고 편안하게 휘뚤말뚤,"한여름, 가볍다, 편안하다, 길, 불편하다, 닿다"
"오 왜 무탠타드하는지 알겠어요
진짜 가성비 갑인데 질은 진짜 좋아요 
기본템들 앞으러 여기서 사야겠어요",오 왜 무탠타드하는지 알겠어요 진짜 가성비 갑인데 질은 진짜 좋아요 기본 템들 앞으로 여기서 사야겠어요,"알다, 갑, 앞, 가성비, 질"
168에 55사이즈로 평소에 M사이즈 입는데 이 스커트는 많이 크게 나온 것 같아요. s사이즈로 구매했는데 허리도 편하게 잘 맞고 키가 큰데 기장도 발목 딱 위까지 오네요! 뒤에 트임이 있어서 걸을때 편합니다ㅎㅎ,에 사이즈로 평소에 M사이즈 입는데 이 스커트는 많이 크게 나온 것 같아요 s사이즈로 구매했는데 허리도 편하게 잘 맞고 키가 큰데 기장도 발목 딱 위까지 오네요 뒤에 트임이 있어서 걸을 때 편합니다,"s, 사이즈, 크다, 걸, 발목, 키, 기장, 위"
"신축 짱 좋아요
허리 맞춰서 사이즈 작게 샀는데도 허리가 크네요ㅠㅠ",신축 정말 좋아요 허리 맞춰서 사이즈 작게 샀는데도 허리가 크네요,"크다, 작다, 맞추다, 사이즈, 허리, 신축"
"배송 빨라서 좋아요
재질이 얇고 시원해서 여름에 잘 입을거 같아요",배송 빨라서 좋아요 재질이 얇고 시원해서 여름에 잘 입을 거 같아요,"시원하다, 여름, 얇다, 재질, 라서, 배송"
원래 m입는데 이건 후기 보고 s샀어요 근데 너무 얇아서 뱃살 잘 보임,원래 m 입는데 이건 후기 보고 s 샀어요 근데 너무 얇아서 뱃살 잘 보임,"얇다, 원래, 뱃살, 보고, 이건, 후기, 보임"
"이거진짜편하고너무예뻐용
여름에이것만입고다닐듯요",이거 진짜 편하고 너무 예뻐요 여름에 이것만 입고 다닐 듯요,"여름, 편하다"
"매장에서 보고 산건데 사이즈는 입다보니까 제가 살이 빠지는건지 옷이 늘어나는지 사이즈가 좀 커지더라고요?
그래도 많이 커지지는 않아서 입을만 합니다.
핏 자체도 좋고 얇아서 잘 입을것같지만 바스락 거리는 재질이라 여름에 달라붙으면 좀 더울것같아서 한창 더울때 빼고는 잘 입을 것 같아요",매장에서 보고 산 건데 사이즈는 입다 보니까 제가 살이 빠지는 건지 옷이 늘어나는지 사이즈가 좀 커지더라고요 그래도 많이 커지지는 않아서 입을만합니다 핏 자체도 좋고 얇아서 잘 입을 것 같지만 바스락거리는 재질이라 여름에 달라붙으면 좀 더울 것 같아서 한창 더울 때 빼고는 잘 입을 것 같아요,"살이, 사이즈, 얇다, 덥다, 여름, 재질, 늘어나다, 커지다"
골반에 걸쳐입는 치마인데 편하고 좋습니다. 다른색도 사고싶어요,골반에 걸쳐 입는 치마인데 편하고 좋습니다 다른 색도 사고 싶어요,"치마, 골반, 편하다, 걸치다, 색도, 사고"
재질이 생각한거랑 조금 다르지만 색깔은 마음에 들어요,재질이 생각한 거랑 조금 다르지만 색깔은 마음에 들어요,"재질, 다르다, 색깔"
