Review,Processed_Review,keyword
블랙 구매 후 너무 맘에 들어서 베이지도 구매했습니당. 색이 좀 더 밝은 베이지였으면 좋았을텐데 이 제품 중엔 라이트베이지가 제일 밝은색이라 그냥 주문했어요. 하지만 만족!,블랙 구매 후 너무 맘에 들어서 베이지도 구매했습니다 색이 좀 더 밝은 베이지였으면 좋았을 텐데 이 제품 중엔 라이트 베이지가 제일 밝은색이라 그냥 주문했어요 하지만 만족,"색, 밝다, 은색, 블랙, 제품, 주문, 만족"
하루즞게왔지먄스커트가엄쩡맘에들어서갠춘.얇은데안비쳐요스판엄청좋아요.뒤트임심하지않고걸을때편해요.헐가커서골반에서돌아요.근데맘에들어서올여름잘입을꺼에요.,하루즞게왔지먄스커트가엄쩡맘에들어서갠춘얇은데안비쳐요스판엄청좋아요뒤트임심하지않고걸을때편해요헐가커서골반에서돌아요근데맘에들어서올여름잘입을꺼에요,"하루, 즞게왔지먄, 스커트, 엄쩡, 들어서다, 갠, 추다, 얇다, 비치다, 스판, 뒤, 트이다, 심하다, 걸, 편하다, 헐가, 커서, 골반, 돌다, 올여름, 끄다"
번창하세요번창하세요번창하세요번창하세요번창하세요번창하세요번창하세요,번창하세요 번창하세요 번창하세요 번창하세요 번창하세요 번창하세요 번창하세요,번창
사이즈가 좀 크게 나온거 같아요..얇고 시원한 소재라 한여름에 입어도 괜찮을거 같네요..,사이즈가 좀 크게 나온 거 같아요 얇고 시원한 소재라 한여름에 입어도 괜찮을 거 같네요,"한여름, 얇다, 소재, 나오다, 사이즈, 시원하다"
저렴한 가격에 구매했습니다 배송도 빠르고 좋네요,저렴한 가격에 구매했습니다 배송도 빠르고 좋네요,"배송, 빠르다, 가격, 저렴하다"
조아영 조아영 조아영 조아영 조아영 조아영 조아영,조아영 조아영 조아영 조아영 조아영 조아영 조아영,조아영
길긴한데 편하게 입기 좋아요 트임이 있어서 불편하지도 않네요 여름에 잘입을거같아요 다른색도 사고싶어요,길긴 한데 편하게 입기 좋아요 트임이 있어서 불편하지도 않네요 여름에 잘 입을 거 같아요 다른 색도 사고 싶어요,"색도, 편하다, 여름, 불편하다"
"길이도 딱 맘에들고 색상도 괜찮어요
허리 고무밴딩아니고 허리조절도 가눙해서 굿",길이도 딱 맘에 들고 색상도 괜찮아요 허리 고무 밴딩 아니고 허리 조절도 가능해서 굿,"가능하다, 아니다, 고무, 조절, 길이, 허리, 색상"
얇아서 여름에 입기 좋고 질도 좋습니다. 허리는 크지만 단추로 줄일수 있어요,얇아서 여름에 입기 좋고 질도 좋습니다 허리는 크지만 단추로 줄일 수 있어요,"얇다, 여름, 크다, 줄이다, 허리, 단추"
"키가 좀 있는편인데 길어서 좋네요
허리도 넉넉하게 나왔어요 뱃살이 있는 편인데 잘 맞아요
뒤트임 있고 잘 늘어나는 재질이라 편합니다
지금부터 잘 입어질 것 같아요",키가 좀 있는 편인데 길어서 좋네요 허리도 넉넉하게 나왔어요 뱃살이 있는 편인데 잘 맞아요 뒤트임 있고 잘 늘어나는 재질이라 편합니다 지금부터 잘 입어질 것 같아요,"편하다, 재질, 허리, 나오다, 넉넉하다, 맞다, 늘어나다"
가볍고 얇아서 안입은거 같아요 오래 입고 있었는데 하나도 안불편했어요 키가 작아서 길이 걱정했는데 몸에 착 감기는 소재라 수선 안하고 입으려구요,가볍고 얇아서 안 입은 거 같아요 오래 입고 있었는데 하나도 안 불편했어요 키가 작아서 길이 걱정했는데 몸에 착 감기는 소재라 수선 안 하고 입으려구요,"감기, 불편하다, 작다, 얇다, 구, 가볍다, 오래"
"컬러가 너무 이쁘고 허리는 단추끼우니 잘 맞아요 
정말 가볍고 얇아서 여름에 잘 입을것 같아요",컬러가 너무 이쁘고 허리는 단추 끼우니 잘 맞아요 정말 가볍고 얇아서 여름에 잘 입을 것 같아요,"가볍다, 여름, 얇다, 컬러, 허리, 끼우다, 맞다"
다른색도사고싶어요 스판이라 잘 늘어나고 좋아요 편해요,다른 색도 사고 싶어요 스판이라 잘 늘어나고 좋아요 편해요,"편하다, 늘어나다, 스판, 색도, 사고"
사이즈는 크지만 얇은 소재라 여름철에 편하게 잘 입을 것 같아요.,사이즈는 크지만 얇은 소재라 여름철에 편하게 잘 입을 것 같아요,"여름철, 크다, 편하다, 사이즈, 소재, 얇다"
사이즈는 조금 크지만 얇은 소재라 여름철에 편하게 잘 입을 것 같아요.,사이즈는 조금 크지만 얇은 소재라 여름철에 편하게 잘 입을 것 같아요,"여름철, 편하다, 크다, 얇다, 사이즈, 소재"
생각보다 사이즈가 크고 얇은 소재라 여름철에 편하게 잘 입을 것 같아요.,생각보다 사이즈가 크고 얇은 소재라 여름철에 편하게 잘 입을 것 같아요,"여름철, 편하다, 소재, 사이즈, 크다, 얇다"
소재 얇아서 시원하고 편하게 여름에 입기 좋을거 같아여 뒷주머니 덕분에 속옷 걱정도 안해도될듯,소재 얇아서 시원하고 편하게 여름에 입기 좋을 거 같아요 뒷주머니 덕분에 속옷 걱정도 안 해도 될 듯,"편하다, 얇다, 여름, 속옷, 뒷, 주머니, 걱정, 덕분, 시원하다"
스판끼도 있어서 편하고 진짜 휘뚜루 마뚜루에 재질도 얇아서 한여름에도 잘 입을 것 같아요!!,스판기도 있어서 편하고 진짜 휘뚜루마뚜루에 재질도 얇아서 한여름에도 잘 입을 것 같아요,"편하다, 휘뚜루마뚜루, 한여름, 얇다, 재질, 스판, 기도"
스판? 처럼 쫙쫙 늘어나서 너무 편하고  그리고 시원해서 여름에 즐겨입을것같아요!!,스판처럼 쫙쫙 늘어나서 너무 편하고 그리고 시원해서 여름에 즐겨 입을 것 같아요,"여름, 쫙쫙, 편하다, 늘어나다, 스판, 처럼, 시원하다, 즐기다"
재질이 무척 가볍고 편하게 잘 맞습니다. 여행가서 입으려고 구입했어요. 재질이 잘마르는 재질이라 비올때 유용할 것 같아요.,재질이 무척 가볍고 편하게 잘 맞습니다 여행 가서 입으려고 구입했어요 재질이 잘 마르는 재질이라 비 올 때 유용할 것 같아요,"유용하다, 재질, 가볍다, 편하다, 맞다, 가다"
믿고사는 무탠다드 입니다! 너무 달라붙지도 않고 핏 예뻐요,믿고 사는 무탠다드 입니다 너무 달라붙지도 않고 핏 예뻐요,"믿다, 달라붙다, 살다"
허리가 다른거에비해크긴하네요 단추안쪽으로하면 될꺼같아요,허리가 다른 거에 비해 크긴 하네요 단추 안쪽으로 하면 될 거 같아요,"크다, 안쪽, 비다, 허리, 단추"
스판이라 너무편하네요 길긴길지만편해요 추천합니다,스판이라 너무 편하네요 길긴 길지만 편해요 추천합니다,"길, 길다, 편하다, 추천, 스판"
"허리가 너무 커서 헐렁
뒷단추 잠그니 좀 나은데
그래도 커요",허리가 너무 커서 헐렁 뒤 단추 잠그니 좀 나은데 그래도 커요,"크다, 커서, 잠그다, 낫다, 허리, 헐렁, 단추"
여름에 정말 자주 입을 거 같네요. 얇고 그렇게 버스럭거리지도 않아요. 여기저기 다 잘 어울릴 거 같아서 가성비 좋게 산 거 같아요. 허리 조금 큰 건 옆에 단추 옮겨 달면 돼서 괜찮아유 좋아요.,여름에 정말 자주 입을 거 같네요 얇고 그렇게 버스럭거리지도 않아요 여기저기 다 잘 어울릴 거 같아서 가성비 좋게 산 거 같아요 허리 조금 큰 건 옆에 단추 옮겨 달면 돼서 괜찮아 유 좋아요,"옆, 여기저기, 달, 허리"
여름에 정말 자주 입을 거 같네요. 여기저기 다 잘 어울릴 거 같아서 가성비 좋게 산 거 같아요. 허리 조금 큰 건 옆에 단추 옮겨 달면 돼서 괜찮아유 좋아요.,여름에 정말 자주 입을 거 같네요 여기저기 다 잘 어울릴 거 같아서 가성비 좋게 산 거 같아요 허리 조금 큰 건 옆에 단추 옮겨 달면 돼서 괜찮아 유 좋아요,"옆, 달"
재질이 너무 좋아요 여름에 딱이예요 처음에는 널널한 것 같았는데 입어보니 딱 좋아요,재질이 너무 좋아요 여름에 딱이에요 처음에는 널찍한 것 같았는데 입어보니 딱 좋아요,"여름, 입어보다, 처음, 에는, 재질, 딱이다, 널찍하다"
키에비해 좀 길지만 그냥 입어도 괜찮아요 ㅎㅎ 여름에 교복될듯,키에 비해 좀 길지만 그냥 입어도 괜찮아요 여름에 교복 될 듯,"여름, 비다, 그냥, 길, 키, 교복"
허리가 크고 길이가 길다고 해서 걱정했는데 입었을 때 발목은 보여서 안 줄여서 잘 입고 다니고 있어요! 방수도 돼서 뭐 흘릴 때도 금방 닦여서 휘뚤마뚤 잘 입고 다니고 있습니다,허리가 크고 길이가 길다고 해서 걱정했는데 입었을 때 발목은 보여서 안 줄여서 잘 입고 다니고 있어요 방수도 돼서 뭐 흘릴 때도 금방 닦여서 휘뚤마뚤 잘 입고 다니고 있습니다,"발목, 허리, 닦이다, 휘뚤마뚤, 크다, 길이, 걱정"
매장에서 입어보고 샀는데 양옆에 허리사이즈 조절할 수 있는 단추가 있어서 널널하게 샀어요 엄청 편하고 좋습니다,매장에서 입어보고 샀는데 양옆에 허리 사이즈 조절할 수 있는 단추가 있어서 널찍하게 샀어요 엄청 편하고 좋습니다,"입어보다, 편하다, 매장, 양옆, 널찍하다, 단추"
"사이즈가 커요. 옆에 단추로 줄일 수 있으나 주름이 가서 그대로 입었어요
소재가 시원하고 길어너 입기 편했어요",사이즈가 커요 옆에 단추로 줄일 수 있으나 주름이 가서 그대로 입었어요 소재가 시원하고 길어나 입기 편했어요,"소재, 사이즈, 길다, 단추, 크다, 줄이다, 편하다, 주름"
"오 생각보다 더 마음에 들어요
사이즈도 좋고 아주얇은데 편함",오 생각보다 더 마음에 들어요 사이즈도 좋고 아주 얇은데 편함,"얇다, 사이즈, 편하다"
"트임이 적당하고 얇아서 편하게
입기 쪼아요 요즘 애용함니다",트임이 적당하고 얇아서 편하게 입기 쪼아요 요즘 애용합니다,"애용, 쪼아, 편하다, 트이다, 적당하다, 얇다"
생각한 것보다 훨씬 얇아서 여름에 입기 좋을 거 같아요! 그리고 스판끼도 있어서 아주 편해요 굳굳,생각한 것보다 훨씬 얇아서 여름에 입기 좋을 거 같아요 그리고 스판기도 있어서 아주 편해요 굳굳,"여름, 얇다, 편하다, 굳다"
"발만보여서 이게맞나 싶었는데
코디해서 입기 좋아요
여름에 시원하게 입기 추천",발만 보여서 이게 맞나 싶었는데 코디해서 입기 좋아요 여름에 시원하게 입기 추천,"여름, 맞다, 시원하다, 코디, 보, 여서, 발"
28 입는데 s 사이즈 편하게 맞아요. 얇아서 시원하고 스판끼도 있어서 활동하기 편할 것 같네요~,입는데 s 사이즈 편하게 맞아요 얇아서 시원하고 스판기도 있어서 활동하기 편할 것 같네요,"편하다, 얇다, 맞다, 시원하다, 스판, 기도, 활동"
버튼으로 허리 조절할 수 있어서 너무 편해요 ! 진짜 휘뚜루마뚜루 데일리 템입니다 ㅠ 너어어무 편해요 ㅠ,버튼으로 허리 조절할 수 있어서 너무 편해요 진짜 휘뚜루마뚜루 데일리 템입니다 너어어무 편해요,"편하다, 어어, 무, 휘뚜루마뚜루, 버튼, 조절, 허리"
"무신사 배송답게 칼배송이네요!!
크게 나왔다고해서 후기 꼼꼼하게 읽어보고
한사이즈 작게샀어요!
M샀으면 허리가 정말 컸을것 같아요
얇아서 한여름에도 입을수 있을것 같아요
너무 이뻐요 여기저기 잘 입을수 있겠어요",무신사 배송답게 칼 배송이네요 크게 나왔다고 해서 후기 꼼꼼하게 읽어보고 한 사이즈 작게 샀어요 M 샀으면 허리가 정말 컸을 것 같아요 얇아서 한여름에도 입을 수 있을 것 같아요 너무 이뻐요 여기저기 잘 입을 수 있겠어요,"사이즈, 얇다, 작다, 배송, 크다, 답, 읽다, 보고"
배송이 빠르고 질이 좋았습니다 색상도 사진과 같아요,배송이 빠르고 질이 좋았습니다 색상도 사진과 같아요,"색상, 배송, 사진, 질, 빠르다"
빨리 도착해서 좋았네요 시원해서 한여름에도 입을수 있겠어요,빨리 도착해서 좋았네요 시원해서 한여름에도 입을 수 있겠어요,"한여름, 빨리, 도착, 시원하다"
잘 받았습니다 잘 쓸게요 히히 이뻐요 만족합니다 잘,잘 받았습니다 잘 쓸게요 히히 이뻐요 만족합니다 잘,"만족하다, 쓸다, 받다, 히"
완전 이뻐요ㅎㅎ 잘 입었어요ㅎㅎ젊어진거 같아요ㅎㅎ만족합니딘,정말 이뻐요 잘 입었어요 젊어진 거 같아요만족합니딘,"만족하다, 딘, 젊다"
"바스락소재라서 봄여름에 입기 좋도 허리조절 되는데 좋아요 컬러도 사진이랑 같고 길이도 길어서 좋아요
화이트 컬러도 있음 좋겠어요",바스락 소재라서 봄여름에 입기 좋도 허리 조절되는데 좋아요 컬러도 사진이랑 같고 길이도 길어서 좋아요 화이트 컬러도 있으면 좋겠어요,"컬러, 봄, 여름, 사진, 조절, 소재, 라서"
허리가 더 조절가능했으면 예뻤을 것 같아요 애매하게 남는 느낌있어요,허리가 더 조절 가능했으면 예뻤을 것 같아요 애매하게 남는 느낌 있어요,"애매하다, 가능하다, 남다, 허리, 조절"
매장에서 입어보고 쿠폰이있어서 온라인에서 구매했어요 재질이 여름까지 입을만큼 얇고 시원해서 좋아요 사이즈는 넉넉한데 허리에 단추가 한개 더 있어서 좀 크다싶으면 줄이는게 가능해서 좋아요,매장에서 입어보고 쿠폰이 있어서 온라인에서 구매했어요 재질이 여름까지 입을 만큼 얇고 시원해서 좋아요 사이즈는 넉넉한데 허리에 단추가 한 개 더 있어서 좀 크다 싶으면 줄이는 게 가능해서 좋아요,"사이즈, 쿠폰, 매장, 크다, 단추, 넉넉하다, 입어보다"
"할인할때 저렴하게 구매했어요.
저한텐 기장이 많이 길어서 수선했습니다~",할인할 때 저렴하게 구매했어요 저한텐 기장이 많이 길어서 수선했습니다,"저렴하다, 수선하다, 할인, 기장"
너무이뻐요~~~~옷자체핏이 이쁘네요~~입었을때 너무편하고 시원해요~,너무 이뻐요 옷 자체 피이 이쁘네요 입었을 때 너무 편하고 시원해요,"시원하다, 편하다, 피다, 자체"
사이즈가 살짝 큰것같아요 색감이나 옷핏 그래도 핏은 예빠요옹,사이즈가 살짝 큰 것 같아요 색감이나 옷핏 그래도 핏은 예빠요옹,"색감, 옷핏, 옹, 핏, 사이즈"
엄청 얇아요 여름에 입으려고 샀어요 가격도 싸고,엄청 얇아요 여름에 입으려고 샀어요 가격도 싸고,"싸다, 얇다, 여름, 가격"
작년에 블랙을 잘 입어서 베이지로 구매했습니다. 넉넉해서 민망하게 타이트하지 않아서 좋아요. 봄여름에 잘 입을 것 같아요~,작년에 블랙을 잘 입어서 베이지로 구매했습니다 넉넉해서 민망하게 타이트하지 않아서 좋아요 봄여름에 잘 입을 것 같아요,"봄, 여름, 블랙, 작년, 넉넉하다, 타이트"
땀차는 나일론재질 아니고 시원해요 약간의 신축성있어서 편해요,땀 차는 나일론 재질 아니고 시원해요 약간의 신축성 있어서 편해요,"시원하다, 편하다, 아니다, 재질, 차다, 나일론, 신축, 성"
신축성 살짝 있어서 편하고 흐린 베이지라 좋아요,신축성 살짝 있어서 편하고 흐린 베이지라 좋아요,"편하다, 베이지, 흐리다, 신축, 성"
완전 편해요ㅎㅎ 다른색도 구매하고 싶네요 ㅎㅎ 예쁩니다!,정말 편해요 다른 색도 구매하고 싶네요 예쁩니다,"편하다, 색도"
"은근 크기가 커서 허리 조절해주고 입으니 괜찮아요
길이가 길어서 만족하구요 여름에 잘 입을듯 합니다",은근 크기가 커서 허리 조절해 주고 입으니 괜찮아요 길이가 길어서 만족하고요 여름에 잘 입을듯합니다,"여름, 크기, 커서, 길이, 만족하다, 조절"
단추로 허리 조절할 수 있어서 편했어요 ㅠ 딱 제 허리사이즈랑 맞아 너무 잘 입고 있습니다 ㅠ,단추로 허리 조절할 수 있어서 편했어요 딱 제 허리 사이즈랑 맞아 너무 잘 입고 있습니다,"편하다, 사이즈, 단추, 조절, 맞다, 허리"
너어무 편하고 활동하기에도 무리없어요 스판이어서 잘 늘어납니다 무조건 사세요 ㅠㅠ,너무 편하고 활동하기에도 무리 없어요 스판이어서 잘 늘어납니다 무조건 사세요,"스판, 편하다, 늘어나다, 활동, 무조건, 무리"
"디자인 좋음.
배송 괜찮음.
합리적인 가격은 모르겠음. 세일 더 하면 좋을듯.
색감은 화면과 비슷.
세탁후 변형은 아직 세탁을 안해봐서 모름.",디자인 좋음 배송 괜찮음 합리적인 가격은 모르겠음 세일 더 하면 좋을 듯 색감은 화면과 비슷 세탁 후 변형은 아직 세탁을 안 해봐서 모름,"세탁, 화면, 색감, 변형, 비슷"
"색감은 화면과 비슷
합리적인 가격은 잘 모르겠음.
배송은 괜찮았음.
세탁 후 변형은 아직 세탁안해봐서 모름.
디자인은 요즘 스타일로 주머니가 포인트되서 좋음.",색감은 화면과 비슷 합리적인 가격은 잘 모르겠음 배송은 괜찮았음 세탁 후 변형은 아직 세탁 안 해봐서 모름 디자인은 요즘 스타일로 주머니가 포인트 돼서 좋음,"세탁, 색감, 화면, 주머니, 디자인, 배송, 가격, 스타일"
"허리 가장 안쪽 단추에 해도 답답하지 않고 넉넉해요
소재가 여름에 입기 좋아요",허리 가장 안쪽 단추에 해도 답답하지 않고 넉넉해요 소재가 여름에 입기 좋아요,"여름, 단추, 넉넉하다, 소재, 안쪽, 답답하다, 가장, 허리"
배송이 엄청빠르고 원단도 시원하고 스판끼가 있는건지 상당히 편하네요,배송이 엄청 빠르고 원단도 시원하고 스판기가 있는 건지 상당히 편하네요,"스판, 배송, 빠르다, 편하다, 상당하다, 건지다, 시원하다, 원단"
길이는 수선해야되지만 소재도 시원하고 넘 예뻐용,길이는 수선해야 되지만 소재도 시원하고 너무 예뻐요,"시원하다, 수선하다, 소재, 길이"
"길이 엄청 길어서 제 키에도 거의 발목까지 와요
그래도 움직임은 편함",길이 엄청 길어서 제 키에도 거의 발목까지 와요 그래도 움직임은 편함,"발목, 움직임, 키, 오다, 편하다, 길이"
"얇은 재질이라 더울때 괜찮을거같고
길이는 생각보다도 깁니다",얇은 재질이라 더울 때 괜찮을 거 같고 길이는 생각보다도 깁니다,"덥다, 얇다, 재질, 보다도, 길이"
"생각보다 크다고 느껴졌어요
얇은 재질이라 좋어요",생각보다 크다고 느껴졌어요 얇은 재질이라 좋아요,"느껴지다, 크다, 재질, 얇다"
"여름용 얇은 원단입니다. 
허리밴딩은 없지만 하의77입는분들도 
편하게 입을정도로 여유있어요. 
여름에 편하고 시원하게 자주 입어질꺼같아요.",여름용 얇은 원단입니다 허리 밴딩은 없지만 하의 입는 분들도 편하게 입을 정도로 여유 있어요 여름에 편하고 시원하게 자주 입어질 거 같아요,"여름, 편하다, 시원하다"
"요즘 유행하는 스타일이라 사봤어요
깔끔하고 딱 원하던 스타일이에요
너무 맘에 들어요
여름까지 잘 입을 수 있을 것 같아요",요즘 유행하는 스타일이라 사봤어요 깔끔하고 딱 원하던 스타일이에요 너무 맘에 들어요 여름까지 잘 입을 수 있을 것 같아요,"깔끔하다, 스타일, 여름, 사보다, 원하다"
오프라인에서 보고 너무 마음에 들어서 두가지 색상 다샀어요 편하고 좋아요!!,오프라인에서 보고 너무 마음에 들어서 두 가지 색상 다 샀어요 편하고 좋아요,"색상, 편하다, 보고, 가지, 들어서다, 오프라인"
길이가 엄청 길긴하지만 예뻐요 허리 조절은 크게는 안돼요,길이가 엄청 길긴 하지만 예뻐요 허리 조절은 크게는 안돼요,"길다, 허리, 크게, 조절, 길이"
m으로 구입했다가 허리가 너무 커서 s로 다시 주문했어요. 사이즈 좋습니다~,m으로 구입했다가 허리가 너무 커서 s로 다시 주문했어요 사이즈 좋습니다,"주문, 커서, m, 사이즈, s, 다시, 허리"
발목까지 오는 제가 원하는 길이예요 카고치마 둘러본 중에 젤 이뻐요 천도 시원하고 여름에 자주 입을듯요,발목까지 오는 제가 원하는 길이예요 카고 치마 둘러본 중에 젤 이뻐요 천도 시원하고 여름에 자주 입을 듯요,"여름, 둘러보다, 오다, 시원하다, 천"
"배송 하루만에 왔어요
매장에서 입어보고 샀어요 원래 배가 나와서 L 입어봤는데 여유가 있길래 M으로 주문했더니 완전 딱 좋아요
소재도 시원하고 비칠까 걱정했는데 걱정 안해도 됩니다
길이는 거의 발목에서 조금 위에 오는 정도예요 일자로 떨어지는 날씬해보이는 넘 맘에 듭니다",배송 하루 만에 왔어요 매장에서 입어보고 샀어요 원래 배가 나와서 L 입어봤는데 여유가 있길래 M으로 주문했더니 완전 딱 좋아요 소재도 시원하고 비칠까 걱정했는데 걱정 안 해도 됩니다 길이는 거의 발목에서 조금 위에 오는 정도예요 일자로 떨어지는 날씬해 보이는 넘 맘에 듭니다,"발목, 소재, 주문, 여유, 입어보다, 배송, 매장"
"리뷰사진참고해서 주문했는데 넘넘 커요
허리 다 줄여도 커서 앞단추 위치변경해서 달았어요
저는 엉덩이 허벅지쪽이 H라인으로 안나오고 A라인으로 나와요
저랑 비슷한 체형이시면 무조건 XS 사세요
교환비 6천원 아까워서 전 그냥 입어요ㅠㅠ",리뷰 사진 참고해서 주문했는데 넘넘 커요 허리 다 줄여도 커서 앞 단추 위치 변경해서 달았어요 저는 엉덩이 허벅지 쪽이 H 라인으로 안 나오고 A 라인으로 나와요 저랑 비슷한 체형이시면 무조건 XS 사세요 교환비 천원 아까워서 전 그냥 입어요,"허벅지, 엉덩이, 단추, 라인, 허리, 크다, 커서, 주문"
블랙 색상은 s로 구매해서 입으니 늘어나는것같아 베이지는 sx 로 구매했습니다,블랙 색상은 s로 구매해서 입으니 늘어나는 것 같아 베이지는 sx로 구매했습니다,"색상, 늘어나다, 베이, 지는, s, 블랙, sx"
"색상이 베이지라 아무 색상의 티셔츠랑 다 어울립니다 
스판이라 너무 편하고 길이도 너무 딱좋아요",색상이 베이지라 아무 색상의 티셔츠랑 다 어울립니다 스판이라 너무 편하고 길이도 너무 딱 좋아요,"티셔츠, 색상, 스판, 편하다, 길이, 어울리다, 베이지"
허리가 좀 컸는데 그래도 핏이랑 색은 너무 옙뻐요!!,허리가 좀 컸는데 그래도 핏이랑 색은 너무 옙뻐요,"옙뻐, 크다, 핏, 색, 허리"
매장에서 입어보고 구매해서 사이즈는 좋아요 좀 넉넉한 편이고 소재가 시원해서 여름에 입기도 좋을거같아요 세일해서 저렴한 가격에 잘 샀어요,매장에서 입어보고 구매해서 사이즈는 좋아요 좀 넉넉한 편이고 소재가 시원해서 여름에 입기도 좋을 거 같아요 세일해서 저렴한 가격에 잘 샀어요,"저렴하다, 매장, 가격, 세일, 입어보다, 여름, 시원하다, 소재"
배송이 엄청 빨라서 좋았어요 근데 조금 널널해서 한치수 작게 사셔도 좋을 것 같아요,배송이 엄청 빨라서 좋았어요 근데 조금 널찍해서 한 치수 작게 사셔도 좋을 것 같아요,"배송, 널찍하다, 작다, 라서"
너무넘 마음에 듭니다. 여름 교복되겠어요. 다른 색상 다 지르러가여,너무너무 마음에 듭니다 여름 교복 되겠어요 다른 색상 다 지르러 가요,"색상, 가요, 지르다, 교복, 여름"
"일요일 낮에 주문 했는데 월요일에 도착했어요
재질도 시원한 재질이라서 여름에 입기 좋고, 뒤에 트임이 있어서 걸을 때도 불편함이 없어요.",일요일 낮에 주문했는데 월요일에 도착했어요 재질도 시원한 재질이라서 여름에 입기 좋고 뒤에 트임이 있어서 걸을 때도 불편함이 없어요,"월요일, 일요일, 낮, 여름, 주문, 걸, 도착"
배송 진짜 빠르고 하루만에 옵니다! 품질 너무 좋아서 깔별로 주문했아여,배송 진짜 빠르고 하루 만에 옵니다 품질 너무 좋아서 깔 별러 주문했아요,"주문, 별러, 옵니다, 만에, 빠르다, 배송, 하루"
많이 얇지만 핏이 이쁘고 뒷트임이 있어서 정말 편해요 비침만 없음 좋을텐데 햇빛에 실루엣 비칠듯해요,많이 얇지만 핏이 이쁘고 뒤트임이 있어서 정말 편해요 비침만 없음 좋을 텐데 햇빛에 실루엣 비칠듯해요,"햇빛, 얇다, 편하다, 비치다, 텐데, 비침, 핏"
