Review,Processed_Review,keyword
"일단 땀 배출이 잘되는 재질은 아닙니다
방수성이 좋기 때문이죠",일단 땀 배출이 잘 되는 재질은 아닙니다 방수성이 좋기 때문이죠,"배출, 방수, 성, 재질, 때문, 죠, 아니다"
배송빠르고 제품좋아용 재질도 만족스럽습니다 ㅎㅎ,배송 빠르고 제품 좋아요 재질도 만족스럽습니다,"만족스럽다, 빠르다, 재질, 배송, 제품"
"허리가 조금 크네요 
넘 길어서 조금 잘라서 입으면 더 이쁠거 같아서 
수선 하려구요 
발목이 보여야 날씬해 보이니깐~~ㅋㅋ
제가 찾던 스타일이에요 
크롭이랑 입으니 넘 이쁘구여 
한여름에 딱인듯",허리가 조금 크네요 너무 길어서 조금 잘라서 입으면 더 이쁠 거 같아서 수선하려고요 발목이 보여야 날씬해 보이니깐 제가 찾던 스타일이에요 크롭이랑 입으니 너무 이쁘고요 한여름에 딱인 듯,"발목, 허리, 스타일, 크다"
"이거 진짜 너무 잘산템이에요
이런 바스락 원단이 스판끼도 있다니요 !? 
너무 시원하고 편해서 타임세일을 포착한 스스로를 칭찬합니다. 최고",이거 진짜 너무 잘 산 탬이에요 이런 바스락 원단이 스판기도 있다니요 너무 시원하고 편해서 타임세일을 포착한 스스로를 칭찬합니다 최고,"타임세일, 최고, 칭찬, 스스로, 편하다, 스판, 기도, 탬"
기장은 발목까지 오고 허리가 크지만 단추를 안에 잠그면 좀 나아요ㅎㅎ,기장은 발목까지 오고 허리가 크지만 단추를 안에 잠그면 좀 나아요,"잠그다, 발목, 단추, 크다, 나다, 허리, 오다, 기장"
"허리가 많이 크네요. 단추로 줄일수 있긴 한데 주름이 잡혀서 살짝 어색해요.
세탁하니 박음선있는 곳만 줄어든 것처럼 모양이 잡혔는데 소재 특성때문인것 같아요. 
그래도 가볍고 맥시기장이라 그건 좋습니다!",허리가 많이 크네요 단추로 줄일 수 있긴 한데 주름이 잡혀서 살짝 어색해요 세탁하니 박음선 있는 곳만 줄어든 것처럼 모양이 잡혔는데 소재 특성 때문인 것 같아요 그래도 가볍고 맥시 기장이라 그건 좋습니다,"세탁, 소재, 단추, 가볍다, 허리, 줄어들다, 박다, 선, 줄이다, 기장"
"가볍고 신축성이 좋아서 움직이기 편해요
허리는 좀 큼",가볍고 신축성이 좋아서 움직이기 편해요 허리는 좀 큼,"편하다, 가볍다, 허리, 신축, 성, 움직이다"
"치머길이도 적당해요~
키작은신분들은 길수도 있을꺼 가타요",치머 길이도 적당해요 키 작은 신 분들은 길 수도 있을 거 가타요,"가타, 적당하다, 분, 수도, 치머, 길이, 작다"
길지만 예뻐용 이번 여름 잘입을듯!! 뒤트임잇어서 편해요,길지만 예뻐요 이번 여름 잘 입을 듯 뒤트임 있어서 편해요,"편하다, 길, 뒤, 트이다, 여름"
"사진이랑 똑같아요
허리 크게나와서 한치수 작게입으면 하이웨이스트 되고
정사이즈사면 로우라이즈 되는거가타여
로우라이즈로 입는게 더 이쁠거가타요",사진이랑 똑같아요 허리 크게 나와서 한 치수 작게 입으면 하이웨이스트 되고 정 사이즈 사면 로우 라이즈 되는 거 같아요 로우 라이즈로 입는 게 더 이쁠 거가 타요,"똑같다, 사진, 타요, 거가, 나오다, 작다, 라이즈"
매장에서 입어보고 구매해서 잘 맞고 색도 예쁩니다,매장에서 입어보고 구매해서 잘 맞고 색도 예쁩니다,"입어보다, 매장, 맞다, 색도"
매장에서 입어보고 구매해서 사이즈 잘 맞고 색도 예쁩니다,매장에서 입어보고 구매해서 사이즈 잘 맞고 색도 예쁩니다,"입어보다, 매장, 맞다, 사이즈, 색도"
무탠다드 매장가서 입어보고 샀어요! 너무마음에들어요,무탠다드 매장 가서 입어보고 샀어요 너무 마음에 들어요,"입어보다, 가다, 매장"
생각보다 엄청 기네요. 걸을때 살짝 불편쓰..참고하세요,생각보다 엄청 기네요 걸을 때 살짝 불편쓰참고하세요,"불편, 쓰다, 참다, 걸, 기네"
여름에 입기 좋은 치마!! 생각보다 재질이 얇아서 여름에 입기 딱이고 저는 면이라 탄탄할줄 알았는데 스판끼 있는 소재라 약간의 탄성 있어서 좋아요. 허리 쪽에 단추있어서 허리 사이즈 조절 가능! 가성비 좋은 치마입니다. 근데 약간 핏되는게 있어서 몸매라인이 잘 드러나요.. 제 몸에 예쁜핏은 아니지만 치마 자체는 맘에들어서 여름에 자주 입을것 같아요.,여름에 입기 좋은 치마 생각보다 재질이 얇아서 여름에 입기 딱이고 저는 면이라 탄탄할 줄 알았는데 스판기 있는 소재라 약간의 탄성 있어서 좋아요 허리 쪽에 단추 있어서 허리 사이즈 조절 가능 가성비 좋은 치마입니다 근데 약간 핏되는 게 있어서 몸매 라인이 잘 드러나요 제 몸에 예쁜 핏을 아니지만 치마 자체는 맘에 들어서 여름에 자주 입을 것 같아요,"얇다, 몸매, 여름, 탄탄하다, 단추"
"치마길이가 좀 긴편인데 그래서 오히려 좋앗슴다
색감도 너무 안진해서 여름에 입기 좋슴다",치마 길이가 좀 긴 편인데 그래서 오히려 좋앗슴다 색감도 너무 안진해서 여름에 입기 좋습니다,"색감, 여름, 길이, 편, 좋앗슴다, 진하다"
얇아서 여름에 입기 너무 좋습니단. 핏도 예쁘고 색도 딱 예뻐서 여름 교복처럼 입을 것 같아요~~,얇아서 여름에 입기 너무 좋습니 단 핏도 예쁘고 색도 딱 예뻐서 여름 교복처럼 입을 것 같아요,"교복, 처럼, 여름, 색도, 얇다, 핏"
"허리얇고 골반 좀 있다 하시는분 당장 사세욤
넘 예뻐요 그리고 나일론재질이라서 여름에 입어도 시원해여",허리가 늘고 골반 좀 있다 하시는 분 당장 사세요 너무 예뻐요 그리고 나일론 재질이라서 여름에 입어도 시원해요,"여름, 시원하다, 나일론, 재질"
조금 큰 감이 있지만 입었을때 딱 달라붙는건 아니라 편하게 입을 수 있어요. 재질이 바스락 소재라서 상의 매치하는데 조금 어렵긴 해요.,조금 큰 감이 있지만 입었을 때 딱 달라붙는 건 아니라 편하게 입을 수 있어요 재질이 바스락 소재라서 상의 매치하는데 조금 어렵긴 해요,"어렵다, 편하다, 달라붙다, 재질"
스판기 있어서 휘뚜루마뚜루 입을 수 있어요. 허리는 조금 크지만 단추가 있어서 조절 가능합니다. 재질이 시원해서 여름에 입기 좋아요.,스판기 있어서 휘뚜루마뚜루 입을 수 있어요 허리는 조금 크지만 단추가 있어서 조절 가능합니다 재질이 시원해서 여름에 입기 좋아요,"스판, 여름, 단추, 재질, 허리, 가능하다, 시원하다"
"얇아서 시원하고 스판재질에 뒤트임이 있어서 활동이 편합니다.
스타일도 좋고 만족합니다.",얇아서 시원하고 스판 재질에 뒤트임이 있어서 활동이 편합니다 스타일도 좋고 만족합니다,"스타일, 편하다, 얇다, 만족하다, 재질, 활동, 뒤, 트이다, 시원하다"
사이즈s이구 허리에 단추있어서 허리쪼여입으면 딱맞아요! 엄청 맘에들어서 빨래하고 마르면 또 바로입고 다니고있어요ㅜ,사이즈 s이고 허리에 단추 있어서 허리 쪼여 입으면 딱 맞아요 엄청 맘에 들어서 빨래하고 마르면 또 바로 입고 다니고 있어요,"빨래, 허리, 쪼이다, 맞다"
얇고 시원한 재질이고 스판기도 좋아서 편해요. 봄여름에 입기 좋을것같아요,얇고 시원한 재질이고 스판기도 좋아서 편해요 봄여름에 입기 좋을 것 같아요,"봄, 여름, 편하다, 재질, 이고, 얇다, 시원하다, 스판, 기도"
너무너무 편하고 좋은데 사진에서 핏이 애매하게 나와서 조금 아쉬워요 그냥 편하게 입기 좋은 스커트입니다,너무너무 편하고 좋은데 사진에서 핏이 애매하게 나와서 조금 아쉬워요 그냥 편하게 입기 좋은 스커트입니다,"편하다, 아쉽다, 사진, 애매하다, 스커트"
핏이 좀 애매해요 소재가 엄청 얇아서 시원할것같아요,핏이 좀 애매해요 소재가 엄청 얇아서 시원할 것 같아요,"얇다, 핏, 애매하다, 시원하다, 소재"
가격대비 퀄리티가 좋아요! 그리고 웬만한 여성분들은 s사이즈 추천합니다 사이즈가 조금 크게 나온 것 같아용 기장은 아무래도 제 키에 좀 길긴해용 그래도 색감하고 디자인이 넘 예버서 자주 입을 것 같아요,가격 대비 퀄리티가 좋아요 그리고 웬만한 여성분들은 s사이즈 추천합니다 사이즈가 조금 크게 나온 것 같아요 기장은 아무래도 제 키에 좀 길긴 해요 그래도 색감하고 디자인이 너무 예버서 자주 입을 것 같아요,"s, 사이즈, 색감, 추천, 퀄리티, 길다, 여성, 분들, 디자인"
뒤에가 적당하게 터져있어요. 허리 조절가능해서 좋아요.,뒤에 가 적당하게 터져있어요 허리 조절 가능해서 좋아요,"적당하다, 가능하다, 터지다, 뒤, 허리, 조절"
사려고 한 상품이 아니라 타임세일 하길래 한번 사봤어요  일단 지금 입기에 원단 시원하구요 일반 엠사이즈보다 허리 둘레가 많이 커요그치만 단추로 조절가능하고요 (그래도 큼) 보기싫게 큰게 아니고 세일때 산거라 교환없이 입으려고요 크니깐 편하긴 아주 편하네요. 잘 입을께요,사려고 한 상품이 아니라 타임세일하길래 한 번 사봤어요 일단 지금 입기에 원단 시원하고요 일반 엠사이즈보다 허리둘레가 많이 커요 그 치마 단추로 조절 가능하고요 그래도 큼 보기 싫게 큰 게 아니고 세일 때 산 거라 교환 없이 입으려고요 크니깐 편하긴 아주 편하네요 잘 입을게요,"단추, 사보다, 편하다, 상품, 사려, 크다"
"블랙사고 마음에 들어서 세일할때  또 하나 샀어요 
편안하게 자주 입을 수 있을것같아요",블랙 사고 마음에 들어서 세일할 때 또 하나 샀어요 편안하게 자주 입을 수 있을 것 같아요,"편안하다, 세일, 하나, 블랙"
"색깔별로 다~~~ 쟁이고 싶어요!!
그만큼 맘에 듭니다.
가볍고, 잘 늘어나고, 시원하고, 핏도 예뻐요! 구웃👍",색깔별로 다 쟁이고 싶어요 그만큼 맘에 듭니다 가볍고 잘 늘어나고 시원하고 핏도 예뻐요 굿,"가볍다, 색깔, 별로, 핏, 늘어나다, 쟁, 이고, 시원하다"
"세상에~~ 로켓배송입니다!
어제 주문, 오늘 받았어요~~👍
근데 치마 너무 맘에 드네요!!
왜 다들 좋다좋다 하는지 알겠어요!
진짜 자주 손이 갈 것 같아요❤️",세상에 로켓 배송입니다 어제 주문 오늘 받았어요 근데 치마 너무 맘에 드네요 왜 다들 좋다 좋다 하는지 알겠어요 진짜 자주 손이 갈 것 같아요,"알다, 받다, 세상"
다들 이 치마 사세요... 여름에 시원하고 신축성 있고 난리납니다... 너무 편해요.. 대신 좀 넉넉하게 나온 편이긴 하네여,다들 이 치마 사세요 여름에 시원하고 신축성 있고 난리 납니다 너무 편해요 대신 좀 넉넉하게 나온 편이긴 하네요,"여름, 대신, 편하다, 난리, 넉넉하다"
스판이 체고에여 넘예뽀여 타임세일할때 반값으로샀는데 너무좋아용!! 다만 단추가 안쪽으로 잠구는게 하나 더 있는데 그건 아주조금 불편합니댱 그거말고는 아주 쥬아요!!,스판이 체고에요 너무 예뽀요 타임세일할 때 반값으로 샀는데 너무 좋아요 다만 단추가 안쪽으로 잠그는 게 하나 더 있는데 그건 아주 조금 불편합니댱 그거 말고는 아주 쥬아요,"불편하다, 댱, 단추, 반값, 타임세일, 그건"
엉덩이 낄길거 같아서 넉넉하게 샀어요 허리 줄이는거 있어서 좋아요,엉덩이 낄 길 거 같아서 넉넉하게 샀어요 허리 줄이는 거 있어서 좋아요,"넉넉하다, 엉덩이, 줄이다, 허리"
"허리 29인데 사이즈 살짝 커요
허리 단추로 줄여도 여유 있어요
엄청 얇고 안 입은듯 시원합니당",허리인데 사이즈 살짝 커요 허리 단추로 줄여도 여유 있어요 엄청 얇고 안 입은 듯 시원합니다,"허리, 얇다, 시원하다, 줄이다, 단추, 여유, 크다"
소재가 정말 시원해요 얇은데 엄청 쫀쫀하고 막 입기 너무 좋고 디쟌도 훌륭해요 몸매를 예뻐보이게해주네요 사이즈는 한사이즈 작게 사세요,소재가 정말 시원해요 얇은데 엄청 쫀쫀하고 막 입기 너무 좋고 디자인도 훌륭해요 몸매를 예뻐 보이게 해주네요 사이즈는 한 사이즈 작게 사세요,"얇다, 사이즈, 작다, 디자인, 쫀쫀, 소재, 몸매"
양쪽에 사이즈 조절이 가능한 단추가 두 개씩 있어서 허리가 좀 작거나 크더라도 쉽게 조절이 가능하다는 점이 너무 좋았습니다! 길이도 마음에 들고 겨울에만 빼고 두루두루 잘 입을 수 있을 것 같아요!!,양쪽에 사이즈 조절이 가능한 단추가 두 개씩 있어서 허리가 좀 작거나 크더라도 쉽게 조절이 가능하다는 점이 너무 좋았습니다 길이도 마음에 들고 겨울에만 빼고 두루두루 잘 입을 수 있을 것 같아요,"겨울, 에만, 허리, 사이즈, 길이, 쉬다, 양쪽, 단추, 가능하다"
허리가 커요 입어보고 사는거 추천해요 저는 치마 폭땜에 그냥 벨트메려고 큰거 샀는데 만족이에요,허리가 커요 입어보고 사는 거 추천해요 저는 치마폭 땜에 그냥 벨트 매려고 큰 거 샀는데 만족이에요,"만족, 추천, 입어보다, 크다, 그냥, 려고, 땜, 치마폭"
휘뚜루마뚜루 막 입기 좋아요. 근데 허리가 좀 크네요 ㅠ,휘뚜루마뚜루 막 입기 좋아요 근데 허리가 좀 크네요,"휘뚜루마뚜루, 크다, 허리"
"확실히 무신사 스탠다드는 퀄리티가 좋아요
디테일이라든지 사이즈 라지하려다가 크다해서 엠사이즈했는데

허리가 매우 큰거를 제외하고는 잘 맞아요
허리가 커도 내부단추가 많아서 괜찮아요
검정색도 지를게요",확실히 무신사 스탠더드는 퀄리티가 좋아요 디테일이라든지 사이즈 라지 하려다가 크다 해서 엠사이즈 했는데 허리가 매우 큰 거를 제외하고는 잘 맞아요 허리가 커도 내부 단추가 많아서 괜찮아요 검은색도 지를게요,"크다, 사이즈, 검은색, 퀄리티, 단추, 확실하다, 많다"
"매장에서 실물 보자마자 반해서 구매 안 할수가 없었어요 ㅠ
게다가 재질이 너~무 시원하고 신축성이 좋아서 편합니다 ㅠ
디자인도 너무 예쁘고 만족스럽습니다 !",매장에서 실물 보자마자 반해서 구매 안 할 수가 없었어요 게다가 재질이 너무 시원하고 신축성이 좋아서 편합니다 디자인도 너무 예쁘고 만족스럽습니다,"디자인, 매장, 만족스럽다, 편하다, 재질"
크긴했는데 단추로 조절가능하고 색감예뻐서 마음에들어요,크긴 했는데 단추로 조절 가능하고 색감 예뻐서 마음에 들어요,"크다, 단추, 가능하다, 색감, 조절"
세일해서 저렴하게 구매했어요 얇은원단이라 봄부터 한여름까지 가능하구요 비와도 방수되는 재질이라 입기 너무 편해요,세일해서 저렴하게 구매했어요 얇은 원단이라 봄부터 한여름까지 가능하고요 비 와도 방수되는 재질이라 입기 너무 편해요,"저렴하다, 봄, 한여름, 얇다, 세일, 편하다, 재질, 가능하다"
진짜 색감이랑 핏 제가 딱 원하던 치마입니다ㅠㅠ 허리는 살짝 큰데 조절할 수 있어서 넘 좋구용 기장은 긴데 오히려 이쁘구여 소재도 시원해서 여름에 입기 딱입니다,진짜 색감이랑 핏 제가 딱 원하던 치마입니다 허리는 살짝 큰데 조절할 수 있어서 너무 좋고요 기장은 긴데 오히려 이쁘고요 소재도 시원해서 여름에 입기 딱입니다,"소재, 색감, 여름, 허리, 크다"
M사이즈 샀는데 조금 컸어요! 재질이 시원해서 여름에 입기 딱 좋아요~,M사이즈 샀는데 조금 컸어요 재질이 시원해서 여름에 입기 딱 좋아요,"여름, 시원하다, 재질, 크다, m, 사이즈"
너무 맘에 드네요~ 검정도 주문함!! 여름에 딱입니당,너무 맘에 드네요 검정도 주문함 여름에 딱입니다,"여름, 딱이다, 주문, 함, 검정"
"매장가서 입어보고 삿어요
편하게 입고 싶어서 s사려다가 기장이 길어서 xs로 삿어요!!
허리 조절도 가능해서 너무 좋아요
데일리로 입기도 좋아여",매장 가서 입어보고 샀어요 편하게 입고 싶어서 s 사려다가 기장이 길어서 xs로 샀어요 허리 조절도 가능해서 너무 좋아요 데일리로 입기도 좋아요,"편하다, 데일리, 입어보다, 가다, 가능하다"
"역시 무탠다드가 최고네요
휘뚜루 마뚜루 입기 좋아요
여행가서도 편하게 잘 입었어요

아 기장은 조금 잘랐어요",역시 무탠다드가 최고네요 휘뚜루마뚜루 입기 좋아요 여행 가서도 편하게 잘 입었어요 아 기장은 조금 잘랐어요,"편하다, 자르다, 가다, 휘뚜루마뚜루"
"역시 무탠다드가 최고네요
휘뚜루 마뚜루 입기 좋아요
여행가서도 편하게 잘 입었어요",역시 무탠다드가 최고네요 휘뚜루마뚜루 입기 좋아요 여행 가서도 편하게 잘 입었어요,"편하다, 가다, 휘뚜루마뚜루, 여행, 최고"
배송이 빠르고 좋아요 재질이 얇아서 많이 시원해요,배송이 빠르고 좋아요 재질이 얇아서 많이 시원해요,"배송, 시원하다, 재질, 얇다, 빠르다"
다른 색상도 사고싶어요 블랙이 더 활용도가 높을거같아요~,다른 색상도 사고 싶어요 블랙이 더 활용도가 높을 거 같아요,"블랙, 색상, 높다, 활, 용도, 사고"
그레이빛 도는 밝은 베이지여서 여름에 흰티에 잘어울릴듯하네요 기장감은 많이 길어요,그레이 빛 도는 밝은 베이지여서 여름에 흰 티에 잘 어울릴듯하네요 기장감은 많이 길어요,"밝다, 그레이, 여름, 어울리다, 기장감, 베이지, 여서, 티"
"얇아서 여름에 입기 딱이에요 그리고 신축성도 약간있어서 활동하는데 편하구요
기장은 길긴 하네요",얇아서 여름에 입기 딱이에요 그리고 신축성도 약간 있어서 활동하는데 편하고요 기장은 길긴 하네요,"여름, 길다, 얇다, 신축, 성도, 활동, 편하다, 딱이다"
"완전편하게 입을수 있어용 추천합니다
재질은 고급이 아니지만 짱 편해서 추천합니다",정말 편하게 입을 수 있어요 추천합니다 재질은 고급이 아니지만 짱 편해서 추천합니다,"추천, 편하다, 아니다, 고급, 재질"
"구매해서 교복템으로 너무 잘입고 있어요
소재도 가볍고  다른색상도 구매하려구요~",구매해서 교복 템으로 너무 잘 입고 있어요 소재도 가볍고 다른 색상도 구매하려고요,"가볍다, 색상, 소재, 교복"
"허리가 크게 나왔는데 단추가 있어서 사이즈는
조절가능합니다
여름에도 입기 좋을것 같아요
예쁩니다~~",허리가 크게 나왔는데 단추가 있어서 사이즈는 조절 가능합니다 여름에도 입기 좋을 것 같아요 예쁩니다,"여름, 나오다, 사이즈, 가능하다, 허리"
넘 이쁩니다~ 다른 색도 사고 싶네요 ! 가을까지 입을수 있어요,너무 이쁩니다 다른 색도 사고 싶네요 가을까지 입을 수 있어요,"가을, 색도, 사고"
완전 이뻐요! 입고갔더니 친구들도 이쁘다고 다 사더라고요~ 다른 색도 사려고 합니다!,정말 이뻐요 입고 갔더니 친구들도 이쁘다고 다 사더라고요 다른 색도 사려고 합니다,"사려, 색도, 친구, 가다"
왜 망설였을까요 찾았습니다 나의 여름 교복을요,왜 망설였을까요 찾았습니다 나의 여름 교복을요,"교복, 찾다, 망설이다, 여름"
163에 58 m 사이즈 딱 맞는 몸이어서 m 주문했는데 허리가 큽니다. 단추를 당겨서 끼워도 조금 큽니다. 길이는 발목을 거의 덮는 정도입니다. 디자인이나 재질은 마음에 듭니다.,에 m 사이즈 딱 맞는 몸이어서 m 주문했는데 허리가 큽니다 단추를 당겨서 끼워도 조금 큽니다 길이는 발목을 거의 덮는 정도입니다 디자인이나 재질은 마음에 듭니다,"사이즈, 크다, 발목, 허리, 단추, 길이, 디자인, 덮다, 주문"
라이트베이지가 블랙보다 소재가 훨씬 얇아요. 다른 옷이라고 느껴질 정도인데 왜 이런거죠?,라이트 베이지가 블랙보다 소재가 훨씬 얇아요 다른 옷이라고 느껴질 정도인데 왜 이런 거죠,"블랙, 이라고, 얇다, 소재, 느껴지다, 이렇다, 죠"
색깔이 쨍한 베이지가 아니고 흐린 베이지라 코디하기 더 쉬운 거 같아요,색깔이 쨍한 베이지가 아니고 흐린 베이지라 코디하기 더 쉬운 거 같아요,"쨍, 베이지, 아니다, 색깔, 코디, 쉽다, 흐리다"
"단추로 허리 사이즈를 한번더 조절 가능해서 딱 맞게 입을 수 있어 좋아요!
기장도 핏도 모두 마음이 들어서 건메탈 컬러도 샀어요..ㅋㅋ",단추로 허리 사이즈를 한 번 더 조절 가능해서 딱 맞게 입을 수 있어 좋아요 기장도 핏도 모두 마음이 들어서 건에 탈 컬러도 샀어요,"컬러, 가능하다, 맞다, 핏, 건, 사이즈, 단추"
"여름엔 입으려고 밝은색으로 구매해봤는데 비침은 괜찮을지 
시원하게 입고 다녀보려구요 색색별 구입 했어요",여름엔 입으려고 밝은색으로 구매해 봤는데 비침은 괜찮을지 시원하게 입고 다녀보려고요 색색별 구입했어요,"밝다, 은색, 시원하다, 색색, 별"
여름엔 입으려고 베이지도 구입했어요 색별로 다 구입하는거 같아요 그만큼 편하고 시원하고 좋아요,여름엔 입으려고 베이지도 구입했어요 색별로 다 구입하는 거 같아요 그만큼 편하고 시원하고 좋아요,"색, 별로, 편하다, 여름, 그만큼, 시원하다"
너무 만족스러워요 교복템입니다 다른컬러도 샀어용,너무 만족스러워요 교복 템입니다 다른 컬러도 샀어요,"컬러, 만족스럽다, 교복"
소재가 좀 얇은데 핏은 괜찮네요. 색상 너무 예쁩니다.,소재가 좀 얇은데 핏은 괜찮네요 색상 너무 예쁩니다,"핏, 얇다, 소재, 색상"
배송빠르고 좋은 가격에 구매했습니다 실물이 더 예쁘네요,배송 빠르고 좋은 가격에 구매했습니다 실물이 더 예쁘네요,"실물, 가격, 빠르다, 배송"
생각보다 얇아서 당황했지만 그만큼 여름에 입기 좋아요! 스판끼도 낭낭해서 편하게 입고 있습니다 ~,생각보다 얇아서 당황했지만 그만큼 여름에 입기 좋아요 스판기도 낭랑해서 편하게 입고 있습니다,"여름, 편하다, 얇다, 낭랑하다, 당황"
블랙 구매 후 너무 맘에 들어서 베이지도 구매했습니당. 색이 좀 더 밝은 베이지였으면 좋았을텐데 생각보다 어두워서 아쉽습니다. 색상말곤 다른 부분은 다 만족!,블랙 구매 후 너무 맘에 들어서 베이지도 구매했습니다 색이 좀 더 밝은 베이지였으면 좋았을 텐데 생각보다 어두워서 아쉽습니다 색상 말곤 다른 부분은 다 만족,"색상, 블랙, 색, 어둡다, 밝다"
후기에 기장이 길다 허리가 크다는 얘기가 많고 키 크신 분들 후기가 많아서 걱정했는데 옷 수선 안해도 잘 입고 다니고 있습니다. 구김 많이 질까봐 걱정했는데 구김도 생각보다 안 심하고 색도 밝아서 여름에 입기 딱 좋아요,후기에 기장이 길다 허리가 크다는 얘기가 많고 키 크신 분들 후기가 많아서 걱정했는데 옷 수선 안 해도 잘 입고 다니고 있습니다 구김 많이 질까 봐 걱정했는데 구김도 생각보다 안 심하고 색도 밝아서 여름에 입기 딱 좋아요,"여름, 허리, 색도, 많다, 밝다, 심하다"
"아주 만족합니다
예쁘게 잘입을께요
오프라인에서 보고 착한가격에 구매했어요",아주 만족합니다 예쁘게 잘 입을게요 오프라인에서 보고 착한 가격에 구매했어요,"만족하다, 가격, 착하다, 보고, 오프라인"
"24사이즈가 있어 정말 좋아요
핏감도 너무 좋고 라인도 예쁘고 아주 편안하게 입을 있어 정말 좋아요",사이즈가 있어 정말 좋아요 핏 감도 너무 좋고 라인도 예쁘고 아주 편안하게 입을 있어 정말 좋아요,"편안하다, 라인, 사이즈"
기존에 건메탈사고 예뻐서 또 산 거라 맘에 듭니다 ㅎㅎ,기존에 건메탈사고 예뻐서 또 산 거라 맘에 듭니다,"기존, 건, 메탈, 사고"
