Review,Processed_Review,keyword
일반 휴드티에요 안에 이너로 입기 딱 좋아요!! 셋업으로 좋아요,일반 후드티에요 안에 이너로 입기 딱 좋아요 셋업으로 좋아요,"일반, 셋업, 이너, 후드"
기모도 있어서 따뜻하고 너무 좋아요 !! 여러분 얼른 사세요 ㅜㅜ,기모도 있어서 따뜻하고 너무 좋아요 여러분 얼른 사세요,"얼른, 따뜻하다, 기모"
휘뚜루 마뚜루 입기 좋아용 !! 박시하게 입고싶으면 m 딱 맞는 느낌을 원하면 s로 하시면 될거같아용,휘뚜루마뚜루 입기 좋아요 박시하게 입고 싶으면 m 딱 맞는 느낌을 원하면 s로 하시면 될 거 같아요,"박시, 휘뚜루마뚜루, 원하다, 맞다"
제가 170인데 딱 골반 2-3센치 밑으로 내려왔어요 엉덩이 가리고 싶으신분들은 L 사시면 될거같고  엉덩이가 다 보이는핏이면 좋겠다 이러시면 m사시면 됩니당 팔은 잘 맞아요,제자인데 딱 골반 센티 밑으로 내려왔어요 엉덩이 가리고 싶으신 분들은 L 사시면 될 거 같고 엉덩이가 다 보이는 핏이면 좋겠다 이러시면 m 사시면 됩니다 팔은 잘 맞아요,"사시, 엉덩이, 제자, 골반, 러시, 핏이, 내려오다, 센티, 가리다, 인데"
너무 만족 하고 있어요 잘입을개요 코플로 입고 있어요,너무 만족하고 있어요 잘 입을 개요 코플로 입고 있어요,"플로, 개요, 만족하다"
진짜 너무 예뻐요 이너로 입어도 이쁘고 밖에 입어도 예쁘고 정말 예쁘네요 정말 추천합니다 이너로 추천해요,진짜 너무 예뻐요 이너로 입어도 이쁘고 밖에 입어도 예쁘고 정말 예쁘네요 정말 추천합니다 이너로 추천해요,"추천, 이너, 밖에"
친구가 산거보고 예뻐서 손민수했는데 너무 맘에 들어요!! 일단 색감이 약간 밝은 회색이라 좋았구 핏도 박시한데 어벙하게 아빠옷같은 핏아니라서 좋았어요. 그리고 흐물거리지 않고 적당히 빳빳해서 핏이 더 예뻐요. 그냥 여기저기 레이어드해서 입기 너무 좋아요. 고민하느라 좀 늦게사서 간절기때 못입은게 아쉽지만 겨울에도 패딩이나 코트에 입으니까 예뻐서 너무 만족합니당👍🏻,친구가 산 거 보고 예뻐서 손 인수했는데 너무 맘에 들어요 일단 색감이 약간 밝은 회색이라 좋았고 핏도 박식한데 어벙하게 아빠 옷 같은 핏 아니라서 좋았어요 그리고 흐물거리지 않고 적당히 빳빳해서 핏이 더 예뻐요 그냥 여기저기 레이어드해서 입기 너무 좋아요 고민하느라 좀 늦게 사서 간절기 때 못 입은 게 아쉽지만 겨울에도 패딩이나 코트에 입으니까 예뻐서 너무 만족합니다,"빳빳해, 인수, 늦다, 아빠, 벙하다, 밝다, 박식하다, 물다, 여기저기, 간절기"
"스트릿하게도, 원마일웨어하게도 입기 좋아요 적극 추천",스트리트 하게도 원 마일 웨어 하게도 입기 좋아요 적극 추천,"스트리트, 마일, 적극, 웨어, 추천"
그냥 입어도 이쁜데 이너로 입기엔 두께감이나 원단이나 최고네요 👍,그냥 입어도 이쁜데 이너로 입기엔 두께감이나 원단이나 최고네요,"이나, 원단, 최고, 두께감, 이너, 그냥"
이너로 입을려고 구매 했는데 진짜 딱 가성비 좋고 사이즈도 적당해서 잘 입을꺼 같아요,이너로 입으려고 구매했는데 진짜 딱 가성비 좋고 사이즈도 적당해서 잘 입을 거 같아요,"가성비, 이너, 적당하다, 사이즈"
"그레이 후드집업,, 매우 기본템이에요 기본기도 좋궁",그레이 후드집업 매우 기본 템이에요 기본기도 좋고,"본기도, 그레이, 기본, 이에요, 집업, 후드"
기모라서두꺼울줄알앗는데 좋아요!길이원하던길이ㅜㅜ짧은거조아ㅜㅜ,기모라서 두꺼울 줄 알았는데 좋아요 길이 원하던 길이 짧은 거 좋아,"길이, 알다, 라서, 기모, 원하다, 두껍다, 짧다"
요즘 교복입니다 맨날 입고 다녀요 보는 사람들 마다 핏 이쁘다고 해주시네용,요즘 교복입니다 맨날 입고 다녀요 보는 사람들마다 핏 이쁘다고 해주시네요,"마다, 해주다, 맨날, 사람, 교복"
"패딩도 투웨이 지퍼인데, 불편해서 똑딱이만 잠그고 다닐 정도로 투웨이 별로 선호하진 않습니다. 그치만, 이 제품은 다르네요. 지퍼 안 빡빡하고 잘 빠지고 잘 올라가서 만족. 기모 없는 제품이라 요즘 날씨엔 낮에 긴 팔 입고 입으면 적당한 거 같아요. 밤에는 추워서 안 됨..",패딩도 투웨이 지퍼인데 불편해서 똑딱이만 잠그고 다닐 정도로 투 웨이 별로 선호하진 않습니다 그렇지만 이 제품은 다르네요 지퍼 안 빡빡하고 잘 빠지고 잘 올라가서 만족 기모 없는 제품이라 요즘 날씨엔 낮에 긴팔 입고 입으면 적당한 거 같아요 밤에는 추워서 안 됨,"제품, 선호, 지퍼, 춥다, 다르다, 빠지다, 패딩, 빡빡, 에는, 딱이다"
"시보리가 짱짱한 건 아니고, 기모 없는 제품이라 얇아요. 야상 안에 입거나 아우터 안에 레이어드 해서 입으면 예뻐요. 모자 쓰면 약간 뿔이 생기는데 뭐 귀여움..",시보리가 짱짱한 건 아니고 기모 없는 제품이라 얇아요 야상 안에 입거나 아우터 안에 레이어드해서 입으면 예뻐요 모자 쓰면 약간 뿔이 생기는데 뭐 귀여움,"생기다, 쓰다, 짱짱하다, 시보리, 제품, 모자, 기모, 얇다, 아우터, 없다"
160/58 키로 사이즈 딱 좋아요 사이즈 참고하세용,키로 사이즈 딱 좋아요 사이즈 참고하세요,"키로, 사이즈, 참고"
"살짝 무거운 감이 없지않고, 기장은 짧고 팔은 긴 편입니다. 투웨이라는 점이 가장 마음에 들구요!  제 스펙과 비슷한 분들께서 조금 오버핏으로 입고싶다 하시면 m으로 하시고, 조금은 그래도 몸에 맞게 입고싶다하면 s가 맞을거 같아요~ 주변에서 옷 예쁘단 소리도 2번이나 들었습니다(투웨이 때문에 그런듯) 무난하게 좋은템!",살짝 무거운 감이 없지 않고 기장은 짧고 팔은 긴 편입니다 투 웨이라는 점이 가장 마음에 들고요 제 스펙과 비슷한 분들께서 조금 온 버핏으로 입고 싶다 하시면 m으로 하시고 조금은 그래도 몸에 맞게 입고 싶다 하면 s가 맞을 거 같아요 주변에서 옷 예쁘단 소리도 번이나 들었습니다 투 웨이 때문에 그런 듯 무난하게 좋은 템,"소리, 께서, 맞다, 주변, 라는, 편입, 가장, 때문, 스펙, 가다"
세상에 마상에 너무 이쁘고 가성비 엄청따져서 심혈을 기울인끝에 친구들한테 잔소리들어가며 골랐던건디 흐미 너무 이뻐요 댑악 지퍼가 살짝 걸리는 느낌이 있지만 그래도 이쁨 진짜 아 근데 좀 앏아요,세상에 마상에 너무 이쁘고 가성비 엄청 따져서 심혈을 기울인 끝에 친구들한테 잔소리 들어가며 골랐던 건 디 흐미 너무 이뻐요 대악 지퍼가 살짝 걸리는 느낌이 있지만 그래도 이쁨 진짜 아 근데 좀 얇아요,"기울이다, 대악, 마상, 따지다, 흐미, 심혈, 잔소리, 고르다, 세상, 들어가다"
"크게 입는거 좋아해서 엑라 사이즈 했는데 품은 넓고 소매도 긴데 총장은 그닥 ..  리뷰에 다들 크다크다 하는데 사람마다 기준이 다르닝 ,,, 하하 163 기준 엑라해서 궁댕이 다 안 덮어유 그래도 무난해서 자주입을것 같애용",크게 입는 거 좋아해서 에라 사이즈 했는데 품은 넓고 소매도 긴데 총장은 그다지 리뷰에 다들 크다 크다 하는데 사람마다 기준이 다르니 하하 기준 엑라해서 궁둥이 다 안 덮어요 그래도 무난해서 자주 입을 것 같아요,"기준, 그다지, 궁둥이, 하하, 크다, 리뷰, 마다, 다르다, 품다, 넓다"
S이랑 M고민했는데 원래 오버해서 s사니까 딱맞아요! 너무 마음에 들어요~,S이랑 M 고민했는데 원래 오버해서 s사니까 딱 맞아요 너무 마음에 들어요,"원래, 오버, 고민, 맞다"
후드집업 뭘 사지 고민하다가 후기 보고 샀는데 정말 만족합니다. 안에 입으면 너무 예쁜듯.. ㅎㅎ,후드집업 뭘 사지 고민하다가 후기 보고 샀는데 정말 만족합니다 안에 입으면 너무 예쁜 듯,"사지, 보고, 후기, 고민, 만족하다, 집업, 후드"
총장이 ma-1과 매치했을 때 적당하고 품도 낙낙해서 단품으로 입기에도 좋습니다 정사이즈로 가셔도 좋을 듯 합니다,총장이 ma과 매치했을 때 적당하고 품도 낙낙해서 단품으로 입기에도 좋습니다 정 사이즈로 가셔도 좋을 듯합니다,"ma, 낙낙, 매치, 품다, 갈다, 총장, 적당하다, 사이즈"
너무 잘 입고 있어유 핏도 예쁘고 투웨이라 맘에 드러요 근데 조금 무거워서 어깨가 축- 쳐지는 느낌은 있어요 어좁이라 그런 것도 있고오... 무튼 조금 무겁지만 예뻐서 상관 없어용!,너무 잘 입고 있어 유 핏도 예쁘고 투 웨이라 맘에 드러요 근데 조금 무거워서 어깨가 축 처지는 느낌은 있어요 어좁이라 그런 것도 있고 오 아무튼 조금 무겁지만 예뻐서 상관없어요,"어좁, 드럽다, 처지다, 상관없다, 아무튼, 무거워, 어깨, 그렇다, 무겁다, 근데"
뭐.. 할 말이 없네요 개꿀따리입니다  바로 구매 조지십쇼..  투웨이 개꿀입니다 그거 하나때문에 샀어요,뭐 할 말이 없네요 개 꿀 따기입니다 바로 구매 조지십쇼 투 웨이 개꿀입니다 그거 하나 때문에 샀어요,"조지, 개꿀, 그거, 따다, 때문, 하나, 없다"
"핏 진짜 야무지고 너무 예뻐요 ㅠㅠ 더러운 방, 더러운 거울과 함께지만 생쥐가 되고싶은 꿈을 이룬 거같아요 이제 추워질 날 든든한 동반자를 만났어요 ㅎㅎ",핏 진짜 야무지고 너무 예뻐요 더러운 방 더러운 거울과 함께지만 생쥐가 되고 싶은 꿈을 이룬 거 같아요 이제 추워질 날 든든한 동반자를 만났어요,"더럽다, 만나다, 동반, 이루다, 생쥐, 거울, 든든하다, 야무지다, 추워지다, 이제"
오버로 적당하고 두께감도 적당히있어서 좋은 것 같습니다.,오버로 적당하고 두께감도 적당히 있어서 좋은 것 같습니다,"적당하다, 오버, 두께감"
그냥 적당한 사이즈 같아요 투웨이라 스터일 하기도 좋은 것 같고 다른색도 사보고 싶네요,그냥 적당한 사이즈 같아요 투 웨이라 스타일 하기도 좋은 것 같고 다른 색도 사보고 싶네요,"색도, 사보다, 스타일, 그냥, 적당하다, 사이즈"
"173/56 저랑 비슷한 스펙이신 분들은 오버하게 가려면 ""최소"" L이상 시키셔야 됩니다. 저는 L인데 제 기준에선 정핏에서 세미오버 정도 느낌입니다. 기준은 사람마다 다른 거니까 리뷰 잘 보고 판단하시기 바랍니다~~~~",저랑 비슷한 스펙이신 분들은 오버하게 가려면 최소 L 이상 시키셔야 됩니다 저는 L인데 제 기준에선 정 피트에서 세미 오버 정도 느낌입니다 기준은 사람마다 다른 거니까 리뷰 잘 보고 판단하시기 바랍니다,"기준, 오버, 판단, 최소, 에선, 바라다, 리뷰, 피트, 이신, 마다"
사주길 잘했네요 맘에 들어해요 옷이 편한가봐요 핏도 맘에 드는지 거의 매일 입어요,사주길 잘했네요 맘에 들어 해요 옷이 편한가 봐요 핏도 맘에 드는지 거의 매일 입어요,"사주다, 매일, 편하다"
통이 좀 큼.. 그것빼곤 좋아요. 왜소하신 분은 비추천..^^,통이 좀 큼 그것 빼곤 좋아요 왜소하신 분은 비추천,"왜소하다, 그것, 빼다, 추천, 크다"
기장이 생각보다 짧긴 한데 핏이 예쁘네요 지금 입기 딱 좋게 잘 산 것 같아요,기장이 생각보다 짧긴 한데 핏이 예쁘네요 지금 입기 딱 좋게 잘 산 것 같아요,"짧다, 기장"
키가 155라서 L는 많이 박시하긴 한데 핏이 너무 예뻐요! M 샀어도 됐을 것 같아요,키 가라서 L는 많이 박식하긴 한데 핏이 너무 예뻐요 M 샀어도 됐을 것 같아요,"가라, 박식하다, 늘다, 돼다"
사이즈 안맞을까봐 걱정했는데 잘 맞습니다 제가 몸이 좀 많이 큰데 XL 문제옶습니다,사이즈 안 맞을까 봐 걱정했는데 잘 맞습니다 제가 몸이 좀 많이 큰데 XL 문제옶습니다,"옶습, 맞다, xl, 걱정, 크다, 사이즈"
핏이 너무 예뻐요 기장이 짧아서 더 맘에 드는 것도 있네요,핏이 너무 예뻐요 기장이 짧아서 더 맘에 드는 것도 있네요,"짧다, 기장"
마른체형에 170초중반 키이신 분들! m사이즈 가시면 예쁘게 레이어드해서 입을 수 있습니다!,마른 체형에 초중반 키이신 분들 m사이즈 가시면 예쁘게 레이어드해서 입을 수 있습니다,"중반, 가시, 이신, 마르다, 체형, 분들, 레이어드, 사이즈"
예쁘고 좋아요 팔길이에 비해 좀 짧긴한데 그래도 예쁜핏이에요 휘뚜루마뚜루 입기 좋아요 !! 그리고 투웨이를 좋아해서 예쁩니당 좀 오버핏이 좋다! 하시는 분들은 이거 사셔도 될 거 같아욤 그런데 엉덩이 다 덮진 않아요,예쁘고 좋아요 팔 길이에 비해 좀 짧긴 한데 그래도 예쁜 핏이에요 휘뚜루마뚜루 입기 좋아요 그리고 투 웨이를 좋아해서 예쁩니다 좀 온 버핏이 좋다 하시는 분들은 이거 사셔도 될 거 같아요 그런데 엉덩이 다 덮진 않아요,"덮다, 비다, 휘뚜루마뚜루, 좋아하다, 엉덩이, 이에요, 길이, 버핏, 짧다"
사이즈도 좋고 만족합니다 다음에도 또 구매할게오,사이즈도 좋고 만족합니다 다음에도 또 구매할 게 오,"만족하다, 사이즈"
사이즈 딱 오버하게 이쁩니다 투웨이 지퍼라 연출하기 좋아요!,사이즈 딱 오버하게 이쁩니다 투웨이 지퍼라 연출하기 좋아요,"연출, 오버, 지퍼, 사이즈"
생각보다 짱짱하고 핏도 맘에들어요 ! 가성비 좋음,생각보다 짱짱하고 핏도 맘에 들어요 가성비 좋음,"짱짱하다, 가성비"
소재도 괜찮아 보이고 지퍼랑 주머니도 다 좋아요! 근데 지퍼가 굳이 2개가 필요하진 않을거 같아요,소재도 괜찮아 보이고 지퍼랑 주머니도 다 좋아요 근데 지퍼가 굳이 개가 필요하진 않을 거 같아요,"굳이, 주머니, 지퍼, 필요하다, 보이, 소재, 근데"
짚업해도  오픈해서 입어도 괜찮아요  사계절 잘 입을 것 같아여,집업 해도 오픈해서 입어도 괜찮아요 사계절 잘 입을 것 같아요,"오픈, 사계절, 해도, 집업"
내용 너무 짧다고 더채우래여오요오요오요옷은 이쁘어요요,내용 너무 짧다고 더 채우래요 오 요오 요오 요 옷은 이쁘어요요,"요요, 채우다, 내용, 짧다"
핏이 딱 이쁘게 떨어지는 핏이라 엄청 맘에 들어요 근데 팔에 보풀이 생기더군요 ..ㅠㅠ,핏이 딱 이쁘게 떨어지는 핏이라 엄청 맘에 들어요 근데 팔에 보풀이 생기더군요,"생기다, 보풀, 떨어지다, 근데"
진짜 이뻐요 후드집업 없어서 샀는데 짱짱 좋아요 어깨도 넓어보여요 크킄,진짜 이뻐요 후드집업 없어서 샀는데 짱짱 좋아요 어깨도 넓어 보여요 크크,"크크, 짱짱, 넓다, 어깨, 보이다, 없다, 집업, 후드"
너무 무난하고 집앞에 편하게 꾸며서 입고 나가기 좋아요,너무 무난하고 집 앞에 편하게 꾸며서 입고 나가기 좋아요,"꾸미다, 하고, 무난, 편하다"
핏 아방하게 개좋고 쭈리 원단도 좋습니다. 투웨이라 좋네요.,핏 아방하게 게 좋고 추리 원단도 좋습니다 투 웨이라 좋네요,"추리, 원단"
174/63 m 크롭한 기장 넉넉한 팔 넉넉한 통 마음에 들어요,m 크롭 한 기장 넉넉한 팔 넉넉한 통 마음에 들어요,"넉넉하다, 크롭, 기장"
핏은 이쁘지만 주관적으로 볼때 그렇게 큰 메리트는 없는구 같아요 검정옷을 입으면 먼지가 좀 묻어나오고 조금 무겁고 안감 마감처리가 좀 많이 아쉽습니다... 막입으면 금방 헤질거 같아요 사이즈는 큰편이니 정사이즈로 가시는게 좋은 것 같습니다!,핏은 이쁘지만 주관적으로 볼 때 그렇게 큰 메리트는 없는 구 같아요 검정 옷을 입으면 먼지가 좀 묻어 나오고 조금 무겁고 안감 마감 처리가 좀 많이 아쉽습니다 막 입으면 금방 헤질 거 같아요 사이즈는 큰 편이니 정 사이즈로 가시는 게 좋은 것 같습니다,"주관, 헤질, 메리트, 가시다, 크다, 금방, 검정, 안감, 처리, 사이즈"
가을을 준비하는 후드집업 중에 제일 좋은거 같습니다 ㅎ,가을을 준비하는 후드집업 중에 제일 좋은 거 같습니다,"준비, 제일, 가을, 집업, 후드"
이뻐용 좀 긴 티랑 레이어드 식으로 입는 게 잘 어울리네요,이뻐요 좀 긴 티랑 레이어드 식으로 입는 게 잘 어울리네요,"어울리다, 레이어드"
집 앞이나 편안하게 입고 나가기 좋을 거 같아서 자주 입을 거 같네요,집 앞이나 편안하게 입고 나가기 좋을 거 같아서 자주 입을 거 같네요,"편안하다, 이나"
오버핏으로 딱 좋아요 제 스펙이랑 비슷하신분들 무조건m ㄱㄱ 기장이 생각보다 짧긴한데 오히려 좋아요👍,온 버핏으로 딱 좋아요 제 스펙이랑 비슷하신 분들 무조건 m 기장이 생각보다 짧긴 한데 오히려 좋아요,"무조건, 스펙, 분들, 버핏, 짧다, 기장"
요즘 빠져있는 후드집업입니다 두께는 얇으면서 탄탄하고 기장도 길지않아서 좋아요!,요즘 빠져있는 후드집업입니다 두께는 얇으면서 탄탄하고 기장도 길지 않아서 좋아요,"빠지다, 탄탄하다, 두께, 얇다, 길다, 기장, 집업, 후드"
올 때 실밥이 약간 튀어나와 있고 안감이 약간 묻네요 그리고 새 옷 꾸릉내?? 가 약간 나요 한 번 빨고 입으시면 됩니다. 기장은 딱 엉덩이 반 위 지점에 얹어지는 느낌이고요 팔 기장은 길어서 오랑우탄 같은 체형인 저에겐 안성맞춤입니다. 학교갈 때 개꿀이구요 두께도 좀 얇아서 이너로 입기에도 좋을 거 같아요!,올 때 실밥이 약간 튀어나와 있고 안감이 약간 묻네요 그리고 새 옷 꾸릉내 가 약간 나요 한 번 빨고 입으시면 됩니다 기장은 딱 엉덩이 반 위 지점에 얹어지는 느낌이고요 팔 기장은 길어서 오랑우탄 같은 체형인 저에겐 안성맞춤입니다 학교 갈 때 개꿀이고요 두께도 좀 얇아서 이너로 입기에도 좋을 거 같아요,"얹다, 지점, 꾸릉, 오랑우탄, 안성맞춤, 튀어나오다, 에겐, 기장, 나요, 실밥"
베이직하게 입으려고 샀는데 다른 브랜드가격보다도 싸고 적당히 재질도 좋아서 데일리로 입고다니고 있어요 처음에는 새옷냄새가 조금 나지만 세탁하면 괜찮아질거같아요 아무튼 짱편하고 160인 저한테 너무 마음에 드는 핏입니당,베이직하게 입으려고 샀는데 다른 브랜드 가격보다도 싸고 적당히 재질도 좋아서 데일리로 입고 다니고 있어요 처음에는 새 옷 냄새가 조금 나지만 세탁하면 괜찮아질 거 같아요 아무튼 짱 편하고 인 저한테 너무 마음에 드는 핏입니다,"보다도, 베이직, 브랜드, 아무튼, 핏입니, 냄새, 싸다, 세탁, 데일리, 에는"
폼은 넉넉한데 기장은 짧아서 좋아요 뜨뜻합니다,폼은 넉넉한데 기장은 짧아서 좋아요 뜨뜻합니다,"뜨뜻하다, 넉넉하다, 짧다, 기장"
후드집업이 필요해서 한참 고민하다가 샀는데 너무 맘에 들어요ㅠ 오버핏처럼 나오는 핏이 맘에 들고 색감도 되게 이뻐서 맘에 들어요 가격도 짱👍👍,후드집업이 필요해서 한참 고민하다가 샀는데 너무 맘에 들어요 온 버핏처럼 나오는 핏이 맘에 들고 색감도 되게 이뻐서 맘에 들어요 가격도 짱,"한참, 필요하다, 되게, 색감, 처럼, 가격, 고민, 나오다, 버핏, 집업"
엄청 널널해서 안에 뭘 입든 편하게 입어질거 같아요 170 기준 엉덩이 반절 못가려요 사진에서 앞쪽이 좀 더 길게 나와서 저거보다 짧다고 보시면 돼요 팔은 긴편! 풍덩해서 짱편해요,엄청 널찍해서 안에 뭘 입든 편하게 입어질 거 같아요 기준 엉덩이 반절 못 가려요 사진에서 앞쪽이 좀 더 길게 나와서 저거보다 짧다고 보시면 돼요 팔은 긴 편 풍덩해서 짱 편해요,"반절, 풍덩, 앞쪽, 보시, 편하다, 널찍하다, 기준, 돼다, 사진, 가다"
가장 기본적이지만 가장 예쁘고 편하고 얼른 가을이 왔으면 좋겠어요!,가장 기본적이지만 가장 예쁘고 편하고 얼른 가을이 왔으면 좋겠어요,"가장, 얼른, 오다, 가을, 기본, 편하다"
가을에 가볍게 걸치기 좋은 집업이네요 가성비 조타,가을에 가볍게 걸치기 좋은 집업이네요 가성비 좋다,"가볍다, 업다, 걸치다, 가을, 가성비"
집업후드인데 가격이 워낙 저렴해서...솔직히 재질이나 이런거 기대 안하고있었는데 생각보다 두껍고 묵직하더라구여 L사이즈 구매시 171 64정도 스펙이면 오버하게 입을수있는 정도에여,집업 후드인데 가격이 워낙 저렴해서 솔직히 재질이나 이런 거 기대 안 하고 있었는데 생각보다 두껍고 묵직하더라고요 L 사이즈 구매 시 정도 스펙이면 오버하게 입을 수 있는 정도예요,"워낙, 묵직하다, 솔직하다, 기대, 이면, 저렴하다, 이렇다, 스펙, 인데, 이나"
입었을 때 딱 떨어지는 핏이 너무 예뻐요 약간 무거운게 아쉬운 것 같아요 팔 길이에 비해 옷 길이는 짧은 거 같네요 모자 크기랑 핏이 마음에 들어요,입었을 때 딱 떨어지는 핏이 너무 예뻐요 약간 무거운 게 아쉬운 것 같아요 팔 길이에 비해 옷 길이는 짧은 거 같네요 모자 크기랑 핏이 마음에 들어요,"길이, 크기, 비다, 떨어지다, 모자, 무겁다, 아쉽다, 짧다"
전 큰 거 좋아해서 조앗음요 얇김하지만 핏 예쁘니까 괜춘합니다용,전 큰 거 좋아해서 조앗음요 얇긴 하지만 핏 예쁘니까 괜춘합니다용,"다용, 추다, 좋아하다, 얇다, 크다"
팔이 좀 길어서 여자가 입으면 약간 귀엽게 입을 수 있을 거 같아요. 여름에 학교에서 에어컨 틀어서 추우면 입으려고 샀는데 좀 얇아서 가을에 입어도 좋을거 같아요 이뻐요!!,팔이 좀 길어서 여자가 입으면 약간 귀엽게 입을 수 있을 거 같아요 여름에 학교에서 에어컨 틀어서 추우면 입으려고 샀는데 좀 얇아서 가을에 입어도 좋을 거 같아요 이뻐요,"틀다, 여자, 에어컨, 여름, 추다, 학교, 귀엽다, 팔이, 가을, 얇다"
옷 자체의 기장은 딱 맞고 핏도 제가 원하는 핏 진짜 딱 그대로 나와서 너무 좋았고 투웨이라 여러 느낌으로 코디 할 수 있어서 좋은 것 같아요 이 가격대에 이 정도면 완전 만족입니다!,옷 자체의 기장은 딱 맞고 핏도 제가 원하는 핏 진짜 딱 그대로 나와서 너무 좋았고 투 웨이라 여러 느낌으로 코디할 수 있어서 좋은 것 같아요 이 가격대에 이 정도면 완전히 만족입니다,"완전하다, 그대로, 여러, 만족, 자체, 코디, 원하다, 가격, 나오다, 맞다"
"남친룩 느낌으로 입고싶어서 오버사이즈로 샀어요 소재 탄탄하고 원하던 박시함, 넓은 품에 비해 숏한 기장감까지 다 맘에 들어요 원단 자체가 싸구려같아 보이지않습니다 다만 투웨이 지퍼가 잘 안돼서 조금 답답할때가 있네요",남자친구 룩 느낌으로 입고 싶어서 오버사이즈로 샀어요 소재 탄탄하고 원하던 박시함 넓은 품에 비해 쇼트한 기장감까지 다 맘에 들어요 원단 자체가 싸구려 같아 보이지 않습니다 다만 투웨이 지퍼가 잘 안돼서 조금 답답할 때가 있네요,"답답하다, 쇼트, 싸구려, 보이지, 남자친구, 박시, 기장감, 소재, 원단, 넓다"
사이즈가 좀 넉넉하니 큽니다. 색감은 괜찮은 편이고 재질도 좋은 것 같아 데일리로 편하게 입기 좋은거 같아 맘에듭니다. 가성비가 좋은것 같습니다.,사이즈가 좀 넉넉하니 큽니다 색감은 괜찮은 편이고 재질도 좋은 것 같아 데일리로 편하게 입기 좋은 거 같아 맘에 듭니다 가성비가 좋은 것 같습니다,"데일리, 편이, 색감, 넉넉하다, 가성비, 재질, 크다, 편하다, 사이즈"
이뻐요 잘 산거같아요 또 다른것도 살 예정입니다,이뻐요 잘 산 거 같아요 또 다른 것도 살 예정입니다,예정
좋습니다 지퍼가 두개로 좋고 가죽 자켓 안에 입기 좋아요,좋습니다 지퍼가 두개로 좋고 가죽 재킷 안에 입기 좋아요,"가죽, 재킷, 지퍼"
투웨이 제품 후드집업 처음사보는데 너무 맘에 들어요 174 65 제 스펙기준 m은 적당하고 L은 클거같아요,투 웨이 제품 후드집업 처음 사보는데 너무 맘에 들어요 제 스펙 기준 m은 적당하고 L은 클 거 같아요,"사보다, 기준, 스펙, 제품, 처음, 크다, 적당하다, 집업, 후드"
