Processed_Review,keyword
글로리 말로 말 모 글로리 핏 이쁜 거 두말하면 입 아파요 허리가 늘고 긴 체형 어깨 넓고 듬직한 편 아마도 개 이뻐요 근데 똥구멍 치마 되는 건 알고 사셔야 합니다 s 샀다가 저의 태평양과 같은 어깨와 마치 개의 가슴 같은 부유방을 숨겨주지 못하길래 m으로 바꿨더니 똔꼬 치마도 덜하고 덜 여전히 똔꼬치마는 맞음 찌지 개랑 태평양 어깨도 잘 가려 줍니다 아주 맘에 듦 검은색도 사고파뇸,"말, 여전하다, 검은색, 치마, 개, 덜하다, 듬직하다"
예약배송이라 쇼룸에서 사이즈 입어보고 샀는데 좀 다른 거 같아요 배송된 게 좀 더 타이트 한 느낌 바스트 있으면 좀 불편하실 거 같아요 M 사세요 전 S 샀는데 좀 불편해요 그리고 너무 짧아서 단독으로 입기엔 조금 부담스러워요 대신 소재는 수영복 소재 같아서 스판도 좋고 주름도 잘 안 가고 민소매가 부담스러운 분들에게도 괜찮을 거 같아요,"민소매, 수영복, 불편하다, 입어보다, 쇼룸, 불편하다, 분, 부담스럽다, 사이즈, 대신"
화사해 보이고 예쁘지만 기장이 조금만 더 길었으면 좋겠음 많이 짧아서 좀 부담스러울 수도,"부담스럽다, 기장, 보이, 화사하다, 수도, 길다, 짧다"
두 겹이라 비치지도 않고 정말 탄탄합니다 올해 원피스 중 제일 이쁜 듯요 너무 맘에 들어서 세 칼라 구매했습니다,"원피스, 겹, 들어서다, 비치다, 탄탄하다, 올해, 제일, 칼라"
재질이 탄탄해서 흰색임에도 비침이 거의 없어서 좋았어요 노란 기나 푸른 기 없이 깨끗한 화이트 컬러라 색깔도 맘에 들었습니다 제가 흉통이랑 체구가 너무 작아서 딱 맞는 사이즈의 원피스가 잘 없는데 이건 제 몸에 딱 맞는 핏으로 예쁘게 떨어져서 만족해요 민소매 디자인이 부 유방 쪽을 잘 커버해 줘서 아우터 없이 입어도 핏이 예쁜 거 같아요 다만 입었을 때는 기장이 딱 괜찮은데 계단 올라갈 때나 허리 숙일 때는 좀 신경이 쓰이긴 합니다 딱 정석 기본 템 느낌이라 하나쯤 가지고 있으면 여기저기 활용해서 입기 좋을 것 같아요,"흰색, 활용, 사이즈, 만족하다, 신경, 여기저기, 흉통, 정석, 탄탄하다, 재질"
바스트는 좀 타이트하지만 여성스럽고 예쁩니다 잘 산 거 같아요,"여성 스럽다, 타이트, 바스트"
쫀쫀하게 핏을 잡아주는 약간은 수영장 재질 같은 옷입니다 무신사 불프 때 저렴하게 샀는데 예뻐서 잘 입고 있어요 벨트 백이나 카디건같이 포인트 되는 아이템이랑 매치해도 예뻐요,"수영장, 아이템, 매치, 물다, 잡다, 재질, 저렴하다, 백이, 포인트"
진짜 너무 이뻐요 살랑살랑거리는 핏 매장에서 입어본 건데 화이트는 엠 멜란지는 에스 입었어요,"거리, 매장, 멜란지, 입어보다, 화이트, 에스"
허리를 잘 잡아줘서 좋아요 기장이 짧은 편이기는 합니다 저보다 키 큰 분들은 m사이즈 사셔야 될 것 같아요 완전히 만족하고 검은색도 사고 싶어요 뱃살 부각 있어요,"사이즈, 검은색, 완전하다, 만족하다, 잡다, 편이, 기장, 허리"
운동복으로 레이어드해서 잘 입었어요 소재가 좋아서 비침 전혀 없지만 기장이 짧아요,"운동복, 레이어드, 기장, 전혀, 소재, 비침, 없다, 짧다"
키가 작은 편인데도 짧은 편이긴 합니다 근데 재질도 되게 짱짱하고 스판이 좋아서 딱 붙는 핏이어도 그렇게 막 불편하진 않아요 이번 여름에 잘 입고 다닐 것 같습니다,"불편하다, 펴다, 스판, 펴다, 재질, 키"
글로리 핏 말해 머 해고 탄탄하게 딱 잡아줘서 정말 좋아요 입으면 백배 이쁨 좀 짧긴 함,"말, 잡다, 탄탄하다, 글로리, 해고, 백배"
상체 쪽에 좀 뜨는 거 빼면 너무 예쁘고 활용도도 높음,"활용 도도, 상체, 쪽, 빼다, 높다"
솔직히 글로나 옷이 가격대가 있고 호불호가 많이 갈려서 반신반의로 샀는데 생각보다 더 마음에 들네요 사이즈 고민 많이 했는데 딱 붙는 옷이라서 뱃살 부각 좀 있을 것 같아 m으로 했는데 딱 좋은 것 같습니다 기장도 딱 너무 짧지 않아서 좋아요 기장 s사이즈랑 cm 밖에 차이 안 나긴 합니다 상체 발달형인인데 상체 딱 붙어요 s사이즈 했으면 딱 꽉 꼈을 것 같은 아무래도 딱 붙는 옷이라 체형 부각 좀 있긴 한데 다른 딱 붙는 옷들에 비해서는 부각이 덜 되는 신기한 옷입니다 다만 배에는 힘주고 다녀야 할 듯 특히나 치마 부분 디자인이 마음에 들어서 저는 잘 입을 것 같아요 이건 잘 산 것 같습니다 사진보다 움직이는 실물로 볼 때 훨씬 나아요 여건이 되시는 분들은 입어보고 구매하시기를 등 뒷부분 팔 들거나 움직이면 조금 뜨긴 합니다,"반신반의, 움직이다, 움직이다, 여건, 부각, 기르다, 디자인, 사이즈, 사진"
소재가 좋아서 비침 전혀 없습니다 맘에 들어요 레이어드용,"레이어드, 전혀, 소재, 비침, 없다"
디자인 너무 깔끔하고 예뻐요 미니멀하게 입기 좋은 옷 같습니다,"미니 멀다, 디자인, 깔끔하다"
재질이 되게 시원하고 탄탄한 느낌이라 너무 예뻐요 기장이 짧긴 한데 레이어드하면 예쁠 거 같아요 블랙도 구매하고 싶네요,"레이어드, 시원하다, 기장, 재질, 탄탄하다, 블랙, 짧다"
아직 한 번도 안 입었지만 이뻐요 밑으로 갈수록 퍼져서 배 나와도 숨기기 가능 근데 먼가 목이 답답하달까,"갈수록, 목, 퍼지다, 멀다, 숨다, 번, 가능"
기장이 짧은 편이라 앉으실 때 불편하실 수 있지만 핏이 너무 예쁩니다 화이트 색상이지만 재질이 탄탄해서 비침이 없어서 너무 좋아요 약간 입고 벗는 게 힘든 점이 있긴 해요 다른 컬러도 구매하고 싶어요 상체가 마르신 분들은 s 하셔도 괜찮아요,"색상, 불편하다, 상체, 마르다, 탄탄하다, 재질, 비침, 기장"
원단 쫀쫀하고 몸 잘 잡아줘요 완전 화이트가 아닌 약간의 크림 색상도 너무 이쁜듯합니다,"잡다, 원단, 색상, 아니다, 화이트, 크림, 쫀쫀"
정말 타이트한 핏의 원피스에요 팔 부각 적 나래서 아직 밖에 못 입구 나감 듬직해 보여요 살을 빼야죠,"원피스, 타이트, 듬직하다, 보이다, 입구, 살, 나래, 부각"
친구 선물해 줬는데 잘 어울렸어요 친구도 맘에 들어 했습니다,"선물, 친구, 친구, 주다, 어울리다"
핏이 정말 예쁩니다 마음에 들어서 검은색도 샀는데 저한텐 M사이즈가 더 예뻤어요,"사이즈, 검은색, 들어서다, 핏"
핏이 진짜 예쁘고 재질이 두 겹이라 비침도 없고 탄탄해서 좋아요 엄청 덥거나 그런 재질도 아니고 가격이 비싼 게 유일한 단점인데 세일할 때 구매해 허 만족합나다,"만족하다, 유일하다, 단점, 탄탄하다, 재질, 덥다, 세일, 아니다, 재질"
짧다는 후기 보고 산 건데도 단독으로 입기에는 짧네요 다른 색상하고 싶었는데 품절이어서 흰색 샀는데 흰색도 품절됐더라고요 흰색이라도 얻어서 다행입니다,"흰색, 흰색, 다행, 흰색, 단독, 색상, 품절, 건데"
여름휴가 가서 잘 입었어요 비침 없는데 시원하고 신축성이 좋아서 활동하기도 편하네요,"신축, 활동, 여름 휴가, 시원하다, 편하다, 가다, 비침, 없다"
여행 일전에 급하게 주문했는데 출발 시간 전에 택배 받고 여행에 잘 챙겨갔어요 빠른 배송 부탁드린다고 문의드렸었는데 친절히 답변해 주시고 빠른 배송해 주셔서 감사합니다 키 작고 마른 체형인 분들 너무 예쁘게 입을 수 있는 원피스에요 흰색인데도 탄탄한 소재 때문에 비침 없었습니다 그래도 혹시 모르니 어두운색 속옷은 피해주세요 그리고 노출이 많은 디자인임에도 소재와 핏 감 때문에 부담스럽지 않게 예쁘게 입을 수 있는 원피스에요 이제 올에는 카디건이랑 같이 코디해 줘도 예쁠 원피스입니다 여행 갈 때 꼭 챙겨가세요 기장이 짧아서 다리도 길어 보이게 잘 나오고 흰색이라 얼굴도 화사하게 잘 나와요 인생 샷 무조건 건집니댜 여행에 가장 잘 챙겨갔단 생각이 드는 옷이에요,"흰색, 두운 색, 흰색, 소재, 부담, 무조건, 친절하다, 부탁드리다, 챙기다"
진짜 이 원피스 첫 품절 뜨고 뜬눈으로 지내다가 알림 뜨길래 바로 질러버린 원피스 너무 짧은 원피스 안 좋아해서 엠으로 구매했습니다 기준 엠은 허벅지 중간쯤이네요 딱 좋은 기장감 스판 짱짱이라 밥 먹고도 숨쉬기 가능,"원피스, 지르다 버리다, 허벅지, 기장감, 기준, 먹고다, 스판, 품절, 가능, 지내다"
돈 없어서 살까 말까 고민했는데 사길 잘했어요 글로리 최고,"글로리, 최고, 없다, 살다, 말다, 고민"
소재도 부드럽고 시원해서 좋아요 비침 없는 탄탄한 면인데도 시원한 게 신기하네요 조금 짧은 느낌은 있지만 키인 제가 단독으로 입기에 무리 없는 길이였습니다,"시원하다, 신기하다, 시원하다, 부드럽다, 무리, 소재, 단독, 키"
제가 살쪄서 좀 딱 맞긴 하긴 하지만 핏 진짜 맘에 들어서 블랙도 구매하려고요,"들어서다, 블랙, 살찌다, 맞다"
짧다는 후기 보고 산 건데도 단독으로 입기에는 짧네요 다른 색상하고 싶었는데 품절이어서 흰색 샀는데 흰색도 품절됐더라고요 흰색이라도 얻어서 다행입니다 예뻐서 마음에 들어요,"흰색, 흰색, 다행, 흰색, 단독, 색상, 품절"
진짜 딱 붙어요 그래서 만족입니다 허리라인 잡아줘서 좋고 밑단 이쁘게 퍼져요 길이는 많이 짧습니다 도톰해서 비침 거의 없어요 요즘 글로리 질 다운되고 있는데 이 원피스는 추천합니다,"만족, 원피스, 추천, 잡다, 길이, 허리 라인, 퍼지다, 글로리, 도톰하다"
글로 너답게 재질도 튼튼하고 쫀득해요 신축성도 좋고 길이감은 조금 짧지 먼 레이어드해서 입으면 너무 이뻐요,"신축 성도, 레이어드, 튼튼하다, 재질, 답, 길이감"
길이가 생각보다 조금 더 짧고 사이즈는 정말 딱 맞는 거 같아요,"길이, 사이즈, 짧다, 맞다"
소재가 엄청 탄탄해서 몸에 딱 달라붙어요 길이는 생각보다 짧지만 안에 속바지 잘 입고 입으면 될 것 같아요,"탄탄하다, 속바지, 소재, 길이, 몸"
길이가 좀 짧긴 해요 조금 아슬아슬 한데 안에 속바지 잘 입고 입으면 너무 이쁠 것 같아요 비침은 원단 자체가 탄탄하게 나와서 화이트인 거 치고 그렇게 안 비쳐요,"비치다, 비침, 화이트, 자체, 탄탄하다, 나오다, 길이, 아슬아슬"
처음에는 허리와 배 부분이 약간 떠서 핏이 애매하다 생각했는데 오히려 편하게 입을 수 있는 것 같고 무엇보다 상체 부분은 잡아주고 a 라인으로 떨어지는 핏이 너무 예쁘고 마음에 들어요,"라인, 허리, 잡다, 처음, 상체, 편하다"
허리가 인치 정도여서 그런지 허리와 배 부분이 좀 떠서 주름이 지는 게 아쉽긴 하지만 다른 부분은 다 잘 맞아요 길이도 제 키에 적당해요 핏도 a 라인으로 예쁘게 잡히고 재질도 주름이 쉽게 잡히거나 비치지 않는 소재라 마음에 들어요 깔끔하고 고급스러운 느낌의 옷이에요,"적당하다, 허리, 고급스럽다, 비치, 인치, 그렇다, 라인, 잡히다"
약간 웨딩촬영할 때 입으면 이쁠 것 같다는 생각이 들었어요 쫀쫀한 느낌에 질이 좋고 엄청 슬림 해 보여서 체형 보완을 원하시면 만족할 만한 옷이에요,"원하다, 만족하다, 보, 체형, 질, 보완"
핏이 진짜 도라 버렸습니다 허리를 탁 잡아주는 그 느낌 다만 제가 키가 작아서 그런지 길이가 살짝 긴 느낌이었고 허리가 긴 체형인데 좀 더 길어 보이게 만들더라고 오 그렇지만 너무 예뻐버려요 최고야,"만들다, 그렇다, 허리, 허리, 길다, 길이, 도르다, 작다, 키"
색상은 이쁜 흰색이고 역시나 재질은 탄탄해요 후기대로 좀 짧아요 안에 속바지를 바이커 팬츠를 입어야 하나 고민 중 대신 몸매랑 핏이 진짜 이쁘게 잡아줘요 이거 입고 밥은 못 먹는 걸로,"흰색, 색상, 속바지, 탄탄하다, 바이 크다, 몸매, 재질, 먹다"
거진 달 걸려서 받은 원피스 나의 인내심 테스트였어요 구랴도 진짜 너무 생각한 그대로의 옷이라 만족도 진짜 너무 편하고 입고 벗을 때도 편해요 하지만 엄청 핏되서 배에 힘주고 다녀야 합니다 하지만 그 맛에 입는고 아니겠어요 완전 맘에 들어요 잘 입겠습니다,"만족도, 인내심, 그대로"
예뻐요 뭐 살짝만 묻어도 티 나긴 합니다 조심해서 입어야 해용,"조심하다, 나다, 묻다"
예뻐요 짧아도 쪼금 쪼여도 다 감수하고 입을만합니다,"감수, 짧다, 쪼이다, 쪼금"
맘에 들어요 생각보다도 훨씬 옷이 폼이 더 작더라도요 쪼여요 그리고 키 기준으로도 엄청 엄청 짧습니다,"기준, 폼, 쪼이다"
원피스로 입기엔 짧은데 원래 레이어드 욕으로 산 거라 만족해요,"원피스, 만족하다, 레이어드, 욕, 원래, 짧다"
너무 예뻐요 재질도 맘에 드는데 조금 도톰해서 여름엔 못 입겠어요,"도톰하다, 재질, 여름"
휘뚜루마뚜루 입기 너무 좋아요 다른 색상도 구매하고 싶어요,"색상, 싶다"
쫀쫀하니 핏되어서 너무 이쁩니다 믿고 사는 글로리,"글로리, 살다, 핏 되어다, 쫀쫀하, 믿다"
짧지만 재질과 핏은 완벽한 그런 원피스 단독으로도 입어도 무난하고 셔츠나 같이 입어도 쪼아온,"완벽하다, 무난, 재질, 원피스, 단독, 셔츠, 그렇다, 핏, 쪼아온"
스몰은 짧다는 후기가 많아 미디엄으로 시켰는데도 제 키에도 뒤쪽은 살짝 짧다는 감이 있어요 하지만 핏은 끝장나줍니다,"미디엄, 스몰, 키, 후기, 핏, 짧다"
길이는 좀 짧지만 너무 예뻐요 카디건이랑 입으면 오빠요,"카디건, 길이, 짧다, 오빠"
입기 조금 힘들지만 핏도 좋고 사이즈도 잘 맞아요,"사이즈, 힘들다, 맞다, 핏"
핏도 재질도 너무 좋아요 흰색 원피스는 좀 뚱뚱해 보일 수 있는데 말라 보여서 잘 산 거 같아요 좀 짧지만 잘 입을게요,"보, 재질, 원피스, 보이다, 말르다, 흰색, 핏, 짧다"
처음에 입었을 때 흉통이 미치도록 쪼이지만 시간 지나면 좀 편해져서 괜찮아요 s 사서 좀 기장이 많이 짧아서 반바지 입었는데 예뻐요 허리 잡아주고 예쁘게 라인 잡아줘서 사진 찍기 너무 좋았어요 재질도 약간 탄탄한 수영복 느낌 나고 값 한 걸 같아요,"편하다, 수영복, 흉통, 미치다, 기장, 잡다, 사진, 반바지, 사서, 재질"
입기 좀 힘들지만 핏도 너무 예쁘고 디자인도 마음에 들어요,"디자인, 힘들다, 핏"
너무 딱 붙는 건 싫어서 한 사이즈 업했더니 딱이네요 핏 예뻐요,"사이즈, 싫다, 업, 붙다, 딱이다"
핏이 정말 예뻐요 레이어드로 와이드 팬츠 매치하거나 겉에 카디건 셔츠 매치해서 한 벌로 여러 스타일 시도할 수 있어서 정말 만족스럽습니다,"매치, 매치다, 만족스럽다, 카디건, 레이어드, 셔츠, 여러, 와이드, 시도"
생각보다 두꺼워서 탄탄하게 입기 좋아요 몸에 예쁘게 핏 됨,"탄탄하다, 몸, 두껍다"
믿고 사는 글로리 처음 룩북 나왔을 때부터 너무 사고 싶었어요 재질이 엄청 쫀쫀해서 마음에 들어요 근데 뱃살이 좀 부각돼서 위에 뭘 입고 입어야 돼요 어딘가에 구겨놔서 주름이 좀 져있는데 주름이 잘 지는 편은 아니에요,"구기다 놓다, 아니다, 어딘가, 살다, 지다, 재질, 주름"
믿고 사는 글로리 처음 룩북 나왔을 때부터 너무 사고 싶었어요 재질이 엄청 쫀쫀해서 마음에 들어요 근데 뱃살이 좀 부각돼서 위에 뭘 입고 입어야 돼요,"재질, 사고, 글로리, 살다, 처음"
엄청 쫀쫀한 재질이네요 제 키에 딱 괜찮은 길이에요,"길이, 재다, 키, 쫀쫀"
사이즈 고민 진짜 많이 했는데 저 체구가 작은 편인데도 미디엄 딱 맞아요 소재는 탄탄하고 핏이 좋아요 블랙도 살 거예요,"펴다, 탄탄하다, 사이즈, 소재, 미디엄, 블랙, 작다, 고민, 체 구가"
하 인생 원피스입니다 꼭 사주세요 고민하신다면 구매 각,"고민, 원피스, 인생, 사주다"
글로리 핏 말해 머 해고 탄탄하게 딱 잡아줘서 정말 좋아요 입으면 백배 이쁨 이 옷을 안 샀다면 지금쯤 땅을 치고 후회했을 것입니다,"말, 잡다, 탄탄하다, 글로리, 해고, 땅"
글로리 핏 말해 뭐해 기본인데 러블리한 딱 글로리 감성 그 자체,"러블리, 글로리, 기본, 감성, 자체, 뭐, 말"
가슴 부분이 쪼여서 좀 힘들어요 기장도 약간 짧지만 그래도 이뻐서 괜찮아요,"힘들다, 기장, 가슴, 부분, 짧다, 쪼이다"
핏 너무 이쁜고 색상도 정말 화이트라 좋은데 길이가 좀 짧아요,"색상, 길이, 화이트, 짧다"
깔 별러 구매 완료했습니다 화이트 원피스지만 비침이 심하지 않아서 블랙 컬러 속옷만 아니면 괜찮을 것 같아요,"원피스, 비침, 심하다, 아니다, 화이트, 별러, 컬러, 완료"
휴가 때 입으려고 샀어요 레이어드해도 이쁘고 여름에 단독으로 입어도 이쁠 거 같아요,"레이어드, 단독, 여름, 휴가"
허리를 좀 잡아줬으면 했는데 그렇진 않아서 좀 별론데 이거 아님 다 좋음,"허리, 아니다, 론데, 잡다 주다, 그렇다"
왜 다들 글로니글로니 하는 줄 알겠네요 핏이 진짜 예뻐요 수영복 재질에 시원한 느낌,"시원하다, 재질, 수영복, 핏, 알다"
작을까 봐 걱정했는데 쫀쫀한 수영복 재질이라 잘 늘어나더라고요 다만 많이 짧기는 해서 청바지랑 레이어드해서 입어야 할 것 같습니다,"청바지, 레이어드, 수영복, 늘어나다, 재질, 쫀쫀, 짧다, 작다"
두 겹이라 비치지도 않고 정말 탄탄합니다 올해 원피스 중 제일 이쁜 듯요 너무 맘에 들어서 세 칼라 구매했습니다,"원피스, 겹, 들어서다, 비치다, 탄탄하다, 올해, 제일, 칼라"
일단 색감이 정말 흰색이라 마음에 들어요 애매한 흰색 아닌 게 너무 좋아요 딱 맞게 입고 싶어서 s 샀는데 뱃살 부각 있고 저보다 키 크신 분들은 m 사셔야 할 것 같아요,"흰색, 색감, 흰색, 애매하다, 크다"
글로리 말로 말 모 글로리 핏 이쁜 거 두말하면 입 아파요,"글로리, 말로, 아프다, 말"
깔끔하고 너무 예쁩니다 여름에 편하게 자주 입을 것 같아요 조금 짧긴 하지만 제 키가 더 짧아서 괜찮아요,"편하다, 여름, 키, 짧다, 짧다"
키 기준 길이가 짧긴 해요 그래도 딱 예쁜 기장입니다,"기장, 길이, 기준, 짧다"
원피스 위쪽은 딱 달라붙는 핏이라 좋았어요 블랙으로 재구매 하고 싶을 정도,"블랙, 원피스, 재다, 핏, 위쪽, 싶다, 달라붙다"
길이가 많이 짧을 거 같아서 M으로 주문했는데 이것도 짧긴 짧아요 그래도 옷은 생각했던 대로 예쁩니다,"대로, 길이, 짧다, 짧다, 주문"
사이즈 고민했는데 S사이즈 예쁘게 잘 맞아요 핏이 너무 예쁘고 생각보다 부담스러운 느낌이 아니라서 만족합니다,"만족하다, 아니다, 사이즈, 사이즈, 부담스럽다, 맞다"
동생 사줬는데 좋아하네요 길이가 좀 짧은 거 말곤 좋대요,"동생, 말다, 길이, 짧다, 대요, 좋아하다, 사주다"
솔직히 글로나 옷이 가격대가 있고 호불호가 많이 갈려서 반신반의로 샀는데 생각보다 더 마음에 들네요 사이즈 고민 많이 했는데 딱 붙는 옷이라서 뱃살 부각 좀 있을 것 같아 m으로 했는데 딱 좋은 것 같습니다 기장도 딱 너무 짧지 않아서 좋아요 기장 s사이즈랑 cm 밖에 차이 안 나긴 합니다 상체 발달형인인데 상체 딱 붙어요 s사이즈 했으면 딱 꽉 꼈을 것 같은 아무래도 딱 붙는 옷이라 체형 부각 좀 있긴 한데 다른 딱 붙는 옷들에 비해서는 부각이 덜 되는 신기한 옷입니다 다만 배에 힘주고 다녀야 더 예쁠 듯 특히나 치마 부분 디자인이 마음에 들어서 저는 잘 입을 것 같아요 이건 잘 산 것 같습니다 등 뒷부분 팔 들거나 움직이면 조금 뜨긴 합니다,"반신반의, 움직이다, 부각, 디자인, 사이즈, 가격 대가, 신기하다, 힘주다"
솔직히 글로나 옷이 가격대가 있고 호불호가 많이 갈려서 반신반의로 샀는데 생각보다 더 마음에 들네요 사이즈 고민 많이 했는데 딱 붙는 옷이라서 뱃살 부각 좀 있을 것 같아 m으로 했는데 딱 좋은 것 같습니다 기장도 딱 너무 짧지 않아서 좋아요 기장 s사이즈랑 cm 밖에 차이 안 나긴 합니다 상체 발달형인인데 상체 딱 붙어요 s사이즈 했으면 딱 꽉 꼈을 것 같은 아무래도 딱 붙는 옷이라 체형 부각 좀 있긴 한데 다른 딱 붙는 옷들에 비해서는 부각이 덜 되는 신기한 옷입니다 다만 배에 힘주고 다녀야 더 예쁠 듯 특히나 치마 부분 디자인이 마음에 들어서 저는 잘 입을 것 같아요 이건 잘 산 것 같습니다,"반신반의, 부각, 디자인, 사이즈, 가격 대가, 신기하다, 힘주다, 이건"
너무 예뻐요 일부러 엠사이즈 했는데 다른 곳은 다 맞는데 등 뒤 목부분이 살짝 뜨더라고요 티가 나진 않아서 그냥 품습니다,"일부러, 목 부분, 엠 사이즈, 나진, 품다, 티"
너무 예뻐요 밝은 색상이라 비칠 거 각오했는데 생각보다 원단이 두꺼워서 속옷 많이 안 비치네요,"색상, 비치다, 원단, 비치다, 속옷, 밝다"
바스트가 있는 편이 아님에도 확실히 바스트가 조이긴 하네요 그래도 예쁩니다,"바스트, 아니다, 조이다, 확실하다, 편이"
작은 제 키에는 살짝 긴 감이 있지만 무척 예쁘고 편합니다,"편하다, 키, 무척, 작다"
딱 붙는 핏 찾았었는데 생각한 대로에요 여기저기 입기 좋아요,"여기저기, 대로, 찾다, 붙다"
믿고 사는 글로리 핏 너무 예뻐요 정말 깔끔해요 다른 색도 살 거예요,"글로리, 색도, 살다, 믿다, 깔끔하다"
블랙도 사고 싶을 정도류 예쁜데 너무 짧음 소재는 너무 얇지 않아 좋아요,"류, 소재, 블랙, 사고, 얇다, 싶다, 짧다"
핏 진짜 너무 예뻐요 완전 인생 원피스예요 사진 찍으면 밝아서 너무 예쁘게 나와요,"나오다, 인생, 사진, 찍다, 원피스"
