Review,Processed_Review,keyword
"와이프 선물했는제, 너무 예쁘고 자연스러워요. 추천합니다!",와이프 선물했는 제 너무 예쁘고 자연스러워요 추천합니다,"자연스럽다, 와이프, 선물, 추천"
이뿌여 기다린 보람잇네여 이쁘고 편하고 좋아요,이 부여 기다린 보람 잇네요 이쁘고 편하고 좋아요,"잇다, 보람, 부여, 기다리다, 편하다"
이뻐오 색감이며 다 마음에 들어오 완전 잘구매한것같음,이뻐 오 색감이며 다 마음에 들어오 완전 잘 구매한 것 같음,"들어오다, 이며, 색감"
안에 속바지도 있고 허리가 고무줄 밴딩이라서 입기 너무 편해요,안에 속바지도 있고 허리가 고무줄 밴딩이라서 입기 너무 편해요,"밴딩, 고무줄, 허리, 편하다, 속바지"
귀여워요 고민하다샀는데 봄여름가을 다 입을 수 있응거같아요,귀여워요 고민하다 샀는데 봄여름 가을 다 입을 수 있을 거 같아요,"가을, 고민, 여름, 귀엽다"
발레코어 느낌으로 너무 러블리하고 예뻐요 좀 짧긴하지만 다리가 길어보여서 좋아요,발레 코어 느낌으로 너무 러블리하고 예뻐요 좀 짧긴 하지만 다리가 길어 보여서 좋아요,"다리, 길다, 러블리, 여서, 코어, 발레, 하고, 짧다"
살때에는 후기가 별로 없어서 걱정했는데 막상 받아보니 넘 예뻐요 허리도 고무줄이라 밥 먹어도 걱정없고 요즘 유행하는 느낌이라 입기 넘 좋아요,살 때에는 후기가 별로 없어서 걱정했는데 막상 받아보니 너무 예뻐요 허리도 고무줄이라 밥 먹어도 걱정 없고 요즘 유행하는 느낌이라 입기 너무 좋아요,"없다, 걱정, 먹다, 막상, 별로, 고무줄, 유행, 후기, 받다, 에는"
"레이스 리본 마이크로 미니 쇼츠 팬츠 스커트는 여성들에게 우아하고 매력적인 스타일을 선사하네요. 섬세한 레이스 장식과 아름다운 리본 디테일이 돋보고, 풍성한 쇼츠 팬츠 스커트 형식으로 여성의 곡선을 아름답게 감싸줍니다.",레이스 리본 마이크로 미니 쇼츠 팬츠 스커트는 여성들에게 우아하고 매력적인 스타일을 선사하네요 섬세한 레이스 장식과 아름다운 리본 디테일이 돋보고 풍성한 쇼츠 팬츠 스커트 형식으로 여성의 곡선을 아름답게 감싸줍니다,"아름답다, 여성, 쇼츠, 팬츠, 레이스, 스커트, 리본, 우아하다, 곡선, 돋보다"
"다양한 상황에서 스타일링하기 좋으며, 편안하면서도 세련된 룩을 완성할 수 있는거 같아요. 소재와 디자인 모두 고급스러움을 느낄 수 있어 퀄리티 높은 패션템으로 추천드립니다",다양한 상황에서 스타일링하기 좋으며 편안하면서도 세련된 룩을 완성할 수 있는 거 같아요 소재와 디자인 모두 고급스러움을 느낄 수 있어 퀄리티 높은 패션 템으로 추천드립니다,"상황, 편안하다, 패션, 세련되다, 다양하다, 고급스럽다, 드리다, 느끼다, 높다, 완성"
"레이스 디테일과 리본 장식이 매력적인 이 마이크로 미니 쇼츠 팬츠 스커트는 여름철의 활기를 더해주는거 같아요. 짧은 기장이 부담스럽지 않고, 스커트와 쇼츠의 편리함을 한 번에 만날 수 있어 여성들 사이에서 큰 인기를 끌고 있어요",레이스 디테일과 리본 장식이 매력적인 이 마이크로 미니 쇼츠 팬츠 스커트는 여름철의 활기를 더해주는 거 같아요 짧은 기장이 부담스럽지 않고 스커트와 쇼츠의 편리함을 한 번에 만날 수 있어 여성들 사이에서 큰 인기를 끌고 있어요,"쇼츠, 스커트, 활기, 만날, 편리하다, 일과, 여름철, 장식, 미니, 여성"
약간 과해보일 수 있는 귀여움가득 스커트지만 캐주얼하게 입으면 과하지 않아요,약간 과해 보일 수 있는 귀여움 가득 스커트지만 캐주얼하게 입으면 과하지 않아요,"가득, 캐주얼, 보이다, 스커트"
너무너무 만족해요 너무 귀엽고 안에 바지가 있어서 편하게 입을 수 있는 점도 좋아요 여름에 입기 좋은 소재라서 잘 산것 같아요,너무너무 만족해요 너무 귀엽고 안에 바지가 있어서 편하게 입을 수 있는 점도 좋아요 여름에 입기 좋은 소재라서 잘 산 것 같아요,"점도, 라서, 만족하다, 소재, 여름, 바지, 편하다, 귀엽다"
일단 너무 이뻐요 기장이 너무 짧지않고 안에 속바지 있어서 안심하고 입어요,일단 너무 이뻐요 기장이 너무 짧지 않고 안에 속바지 있어서 안심하고 입어요,"안심, 하고, 기장, 속바지, 짧다"
여자친구 선물해주었는데 너무 이쁘고 자기 마음에 든데요,여자친구 선물해 주었는데 너무 이쁘고 자기 마음에 든 데요,"데요, 여자친구, 선물, 주다"
"오대박
너무이쁘네여
핑크티랑입어두이쁘구
질도 탄탄하네여
감사핮니다",아 대박 너무 이쁘네요 핑크 튀랑 입어도 이쁘고 질도 탄탄하네요 감사핮니다,"핑크, 튀랑, 감사, 핮니, 대박, 질도, 탄탄하다"
기장이 되게 짧고 내장된 속바지는 자꾸 말려 올라가요 그래서 안에 속바지 하나 더 입고 다녀요. 원래 이런 샤랄라 프릴 옷을 안 사는 편인데 이 스커트는 그렇게 부담스럽지 않아서 제가 원래 입던 옷이랑 매칭하기 좋더라고요. 이쁩니다,기장이 되게 짧고 내장된 속바지는 자꾸 말려 올라가요 그래서 안에 속바지 하나 더 입고 다녀요 원래 이런 샤랄라 프릴 옷을 안 사는 편인데 이 스커트는 그렇게 부담스럽지 않아서 제가 원래 입던 옷이랑 매칭하기 좋더라고요 이쁩니다,"원래, 올라가다, 샤랄라, 매칭, 되게, 그렇게, 프릴, 살다, 속바지, 자꾸"
기장이 되게 짧고 내장된 속바지는 자꾸 말려 올라가요 그래서 안에 속바지 하나 더 입고 다녀요. 원래 이런 샤랄라 프릴 옷을 안 사는 편인데 이 스커트는 그렇게 부담스럽지 않아서 제가 원래 입던 옷이랑 매칭하기 좋더라고요 이쁩니다,기장이 되게 짧고 내장된 속바지는 자꾸 말려 올라가요 그래서 안에 속바지 하나 더 입고 다녀요 원래 이런 샤랄라 프릴 옷을 안 사는 편인데 이 스커트는 그렇게 부담스럽지 않아서 제가 원래 입던 옷이랑 매칭하기 좋더라고요 이쁩니다,"원래, 올라가다, 샤랄라, 매칭, 되게, 그렇게, 프릴, 살다, 속바지, 자꾸"
핏도 너무 이쁘고 안에 속바지도 있어서 좋은것 같아요,핏도 너무 이쁘고 안에 속바지도 있어서 좋은 것 같아요,속바지
세일할때 사서 가성비 좋게 잘 샀어용 약간 허접한 느낌이 있습니당,세일할 때 사서 가성비 좋게 잘 샀어요 약간 허접한 느낌이 있습니다,"허다, 사서, 가성비, 세일"
생각했던 것보다 치마 소재가 뻣뻣해요 기장은 적당해요,생각했던 것보다 치마 소재가 뻣뻣해요 기장은 적당해요,"뻣뻣하다, 적당하다, 소재, 기장, 치마"
"사진과 동일해요
귀여워요
배송도 빠르고 세일해서 저렴히 구매했어요",사진과 동일해요 귀여워요 배송도 빠르고 세일해서 저렴히 구매했어요,"동일하다, 사진, 빠르다, 배송, 저렴하다, 세일, 귀엽다"
친구한테 선물하기 너무 좋고 디자인도 너무 예쁘고 너무 좋아요,친구한테 선물하기 너무 좋고 디자인도 너무 예쁘고 너무 좋아요,"친구, 선물, 디자인"
"정말 발레코어룩에 딱이 스커트예요 ❤️❤️
짧지만 속바지가 있어서 활동성도 좋아요
세탁하면 주름은 잘 잡힐꺼같아요
발레코어룩 유행할때까지 잘 입을게요",정말 발레 코어 룩에 딱이 스커트예요 짧지만 속바지가 있어서 활동성도 좋아요 세탁하면 주름은 잘 잡힐 거 같아요 발레 코어 룩 유행할 때까지 잘 입을게요,"코어, 발레, 성도, 딱이다, 활동, 잡히다, 주름, 세탁, 유행, 스커트"
너무 귀엽고 길이도 제 키에는 너무 짧진 않아서 괜찮은거 같아요,너무 귀엽고 길이도 제 키에는 너무 짧진 않아서 괜찮은 거 같아요,"에는, 길이, 귀엽다, 짧다"
귀여워서 마음에들어요 가격도 적당하고 요즘 트렌드에 잘 맞는거 같아요,귀여워서 마음에 들어요 가격도 적당하고 요즘 트렌드에 잘 맞는 거 같아요,"트렌드, 맞다, 적당하다, 가격, 귀엽다"
배송은 조금 느렸어요.. 근데 길이며 디자인이며 사이즈며 다 너무 제 스탈이에요 다른 색 더 나왔으면 ㅠㅠ,배송은 조금 느렸어요 근데 길이며 디자인이며 사이즈며 다 너무 제 스탈이에요 다른 색 더 나왔으면,"스탈, 나오다, 느리다, 이며, 근데, 사이즈, 이에요, 배송, 디자인, 길이"
"체형 상관 없이 상의 매칭 상관없이 다 괜찮은거 같습니다
생각보다 안 짧아요",체형 상관없이 상의 매칭 상관없이 다 괜찮은 거 같습니다 생각보다 안 짧아요,"상관없다, 체형, 매칭, 상의, 짧다"
"속바지처럼 안감이 되어있어서 흰색이여도 괜찮네요 
디자인이 굉장히 귀엽습니다! 
단독으론 아직 용기가 안나서 애매한 길이의 원피스나 상의랑 레이어드용으로 입기 좋을것 같아서 구매했어요!",속바지처럼 안감이 되어있어서 흰색이어도 괜찮네요 디자인이 굉장히 귀엽습니다 단독으론 아직 용기가 안 나서 애매한 길이의 원피스나 상의랑 레이어드 욕으로 입기 좋을 것 같아서 구매했어요,"굉장하다, 이어도, 단독, 원피스, 안감, 으론, 용기, 나서다, 애매하다, 레이어드"
제 키에 딱 예쁜 기장이고 디자인이 넘넘 귀여워요 생화이트라 넘 맘에 들고 예쁩니다 똑같이 생긴 보세 옷들이 오히려 더 비싸던데 여기 가격이 합리적이에요,제 키에 딱 예쁜 기장이고 디자인이 넘넘 귀여워요 생화 이트라 너무 맘에 들고 예쁩니다 똑같이 생긴 보세 옷들이 오히려 더 비싸던데 여기 가격이 합리적이에요,"넘다, 생화, 이트, 똑같이, 비싸다, 합리, 생기다, 이고, 이에요, 기장"
면이 탄탄해서 모양이 잘 잡혀있어요 리본이 너무 많은게 좀 유치해보여서 다 떼어냈는데 이게 더 맘에 드네요,면이 탄탄해서 모양이 잘 잡혀있어요 리본이 너무 많은 게 좀 유치해 보여서 다 떼어냈는데 이게 더 맘에 드네요,"떼다, 유치하다, 잡히다, 모양, 많다, 내다, 여서, 탄탄하다, 리본"
요즘 이런 스타일 많이 입길래 사봘는데 짱뒤여움,요즘 이런 스타일 많이 입길래 사봘는데 짱 귀여움,"늘다, 입길, 스타일, 이렇다"
리본 포인트가 여러개 붙어있어서 참 이쁜거 같아요,리본 포인트가 여러 개 붙어있어서 참 이쁜 거 같아요,"여러, 차다, 포인트, 붙다, 리본"
"가격 생각하면 디테일은 좋은데 핏이 약간 아쉬워요ㅠㅠ
그래도 훠뚤마뚤 코디하기 좋을듯해용",가격 생각하면 디테일은 좋은데 핏이 약간 아쉬워요 그래도 훠뚤마뚤 코디하기 좋을듯해요,"훠뚤마뚤, 아쉽다, 디테일, 코디, 가격"
너무 예뻐요 맘에 들어요 원하는 모양에 색에 다 짱짱 굳굳 맘에 겁나 들어요,너무 예뻐요 맘에 들어요 원하는 모양에 색에 다 짱짱 굳굳 맘에 겁나 들어요,"굳다, 짱짱, 겁나다, 원하다, 모양"
엄청 세일한 가격으로 구매했는줄 알았는데 더 세일도 가능하군요 플레이스 스튜디오 .. 진짜 세일 자주 하는 거 같아요,엄청 세일한 가격으로 구매했는 줄 알았는데 더 세일도 가능하군요 플레이스 스튜디오 진짜 세일 자주 하는 거 같아요,"세일, 가능하다, 스튜디오, 알다, 레이스, 가격"
완전 여리여리 청순 걸등한테 잘어울릴듯 이뻐요,완전 야리야리 청순 걸 등한테 잘 어울릴 듯 이뻐요,"야리야리, 청순, 어울리다"
허리가 좀 크고 통도 좀 큰데 길이는 짧아요 디자인 청순그자체임,허리가 좀 크고 통도 좀 큰데 길이는 짧아요 디자인 청순 그 자체임,"크다, 청순, 자체, 허리, 디자인, 길이, 짧다"
좋아요 좋아요 맘에 들어요 사고싶었던 건데 세일해서 샀어요 굳굳이요 굳,좋아요 좋아요 맘에 들어요 사고 싶었던 건데 세일해서 샀어요 굳굳이요 굳,"굳다, 사고, 굳이, 건데, 세일"
오버핏 티셔츠랑 같이 입으려고 샀어요 완전 마음에 들어요오~,오버핏 티셔츠랑 같이 입으려고 샀어요 완전 마음에 들어요 오,"오버핏, 티셔츠"
옷은 정말 예쁘고 귀엽고 좋은데 뭔 돈벌레랑 같이 배송해주셔서 받고 기절할 뻔 했어용..! 하지만 속바지도 같이 달려있고 배송도 빨라서 벌레 정도는 그냥 모르는 척 하겠습니다🫣,옷은 정말 예쁘고 귀엽고 좋은데 뭔 돈벌레랑 같이 배송해 주셔서 받고 기절할 뻔했어요 하지만 속바지도 같이 달려있고 배송도 빨라서 벌레 정도는 그냥 모르는 척하겠습니다,"배송, 벌레, 돈벌레, 기절, 뻔하다, 모르다, 그냥, 주다, 달다, 라서"
짧다는 후기가 있던데 뭐 약간 내려입어도 되고 저는 그다지 짧단 생각 안들었어요. 귀엽네요. 세탁할때 허리밴드가 뒤집어질듯하지만ㅋㅋ옷 귀엽습니다,짧다는 후기가 있던데 뭐 약간 내려 입어도 되고 저는 그다지 짧단 생각 안 들었어요 귀엽네요 세탁할 때 허리밴드가 뒤집어질듯하지만 옷 귀엽습니다,"그다지, 뒤집어지다, 귀엽다, 내다, 짧다, 밴드, 세탁, 후기, 허리"
하이틴걸이 될수있습니다 공주가될수있습니다 이쁘니 꼭사세요 위에는 크롭입어야 이쁠듯 ㅎㅎ 전 허벅지살을 빼고 입어야겠습니다,하이틴 걸이 될 수 있습니다 공주가 될 수 있습니다 이쁘니 꼭 사세요 위에는 크롭 입어야 이쁠 듯 전 허벅지살을 빼고 입어야겠습니다,"걸이, 허벅지, 하이, 공주, 크롭, 빼다, 에는"
배송빠르고 너무이쁩니다 가격도 너무 착하고 꼭사세요 마른사람입으면 이쁠것같야용 ㅎㅎ,배송 빠르고 너무 이쁩니다 가격도 너무 착하고 꼭 사세요 마른 사람 입으면 이쁠 것 같아 용,"사람, 착하다, 마르다, 빠르다, 배송, 가격"
"키작녀인 저에게는 기장이 딱 좋았네요!
스커트지만 안에는 속바지가 붙어있어서 활동하기도 편해요.",키작녀인 저에게는 기장이 딱 좋았네요 스커트지만 안에는 속바지가 붙어있어서 활동하기도 편해요,"에게는, 활동, 키작녀, 에는, 붙다, 기장, 스커트, 편하다, 속바지"
너무귀엽고 밴딩이라편해요!! 같이산 티도 오면 올른 매치해입고싶어오,너무 귀엽고 밴딩이라 편해요 같이 산 티도 오면 오른 매치해 입고 싶어온,"오른, 매치, 오다, 밴딩, 편하다, 귀엽다"
"아 무신사 홈페이지가 바뀌고 보는거랑 상품평 쓰는게 불편해져서 잘 안쓸꺼같아요 상품은 마음에 듭니다 많이 파시길 바래요
도움돼",아 무신사 홈페이지가 바뀌고 보는 거랑 상품평 쓰는 게 불편해져서 잘 안 쓸 거 같아요 상품은 마음에 듭니다 많이 파시길 바라요 도움 돼,"상품, 쓸다, 홈페이지, 물다, 도움, 바뀌다, 바라다, 팔다, 불편하다, 쓰다"
"딸이 이고 싶다고 해서 주문했는데 소재도 시원하고 디테일도
예쁘고 맘에 들어요 시원하고 깔끔해요",딸이이고 싶다고 해서 주문했는데 소재도 시원하고 디테일도 예쁘고 맘에 들어요 시원하고 깔끔해요,"시원하다, 따다, 깔끔하다, 일도, 주문, 디테, 소재"
요즘 리본 레이스가 포인트된 옷들이 인기라길래 구매해봤는데 체구가 작은 저한텐 좀 부해보여 아쉬워요ㅠㅠ,요즘 리본 레이스가 포인트 된 옷들이 인기라길래 구매해 봤는데 체구가 작은 저한텐 좀 부해 보여 아쉬워요,"구가, 기르다, 부다, 아쉽다, 포인트, 보이다, 작다, 레이스, 리본"
리본이 꽤나 기여워요 주름도 적당하고 과하지 않아서 즇아요,리본이 꽤나 귀여워요 주름도 적당하고 과하지 않아서 즇아요,"즇아, 주름, 적당하다, 리본, 귀엽다"
여기 옷 이쁜거같아여 치마가 넘 퐁퐁거리지도 않고 넘 짧지도 않고 넘 부담스럽지도 않은 적당,여기 옷 이쁜 거 같아요 치마가 너무 퐁퐁 거리지도 않고 너무 짧지도 않고 너무 부담스럽지도 않은 적당,"퐁퐁, 스럽지도, 적당, 거리, 부담, 치마, 짧다"
너무너무 예뻐요 속바지까지 같이 있어서 더 편하네요,너무너무 예뻐요 속바지까지 같이 있어서 더 편하네요,"편하다, 속바지"
진짜 넘넘 이뻐요!! 키땜에 걱정했는데 속바지 있어서 생각보다 좋아요,진짜 넘넘 이뻐요 키 땜에 걱정했는데 속바지 있어서 생각보다 좋아요,"넘다, 걱정, 속바지"
"바지인데 입으면 진짜 치마같구 고무줄이라 엄청 편해요 !! 
여름이라 흰색으로 샀는데 검은색도 사려구요 ㅎㅎ",바지인데 입으면 진짜 치마 같고 고무줄이라 엄청 편해요 여름이라 흰색으로 샀는데 검은색도 사려고요,"검은색, 흰색, 고무줄, 인데, 여름, 바지, 치마, 편하다"
안에 속바지도 있고 일단 스커트가 너무 귀여워요!!,안에 속바지도 있고 일단 스커트가 너무 귀여워요,"스커트, 속바지, 귀엽다"
배송이 빠르고 가격도 저렴해서 좋아요 길이는 좀 짧지만 속바지가 있어서 덜 불편할것같습니다. 그치만 저보다 키가 크신분들은 너무 짧을수도 있을것같아요,배송이 빠르고 가격도 저렴해서 좋아요 길이는 좀 짧지만 속바지가 있어서 덜 불편할 것 같습니다 그렇지만 저보다 키가 크신 분들은 너무 짧을 수도 있을 것 같아요,"불편하다, 수도, 짧다, 빠르다, 배송, 저렴하다, 크다, 가격, 길이, 속바지"
빳빳하고 뻣뻣합니다 디테일이뻐요 입다보면 핏이 더 이뻐질 듯,빳빳하고 뻣뻣합니다 디테일 이뻐요 입다 보면 핏이 더 이뻐질 듯,"빳빳, 디테일, 뻣뻣하다, 하고"
빳빳쓰..뻣뻣쓰..그러나 디테일 이쁨 좀 입다보고 생활감 생겨야 더 이쁠 듯,빳빳쓰뻣뻣쓰그러나 디테일 이쁨 좀 입다 보고 생활감 생겨야 더 이쁠 듯,"빳빳쓰뻣뻣, 생활, 보고, 쓰다, 생기다, 디테일"
옷 자체는 예쁜데 체형을 더 살려주지는 못하고 그냥 무난해요 더 말라보일 수도 더 길어보일 수도 없는 핏,옷 자체는 예쁜데 체형을 더 살려주지는 못하고 그냥 무난해요 더 말라 보일 수도 더 길어 보일 수도 없는 핏,"수도, 보이다, 살리다, 체형, 말르다, 자체, 그냥, 무난, 길다, 없다"
"속바지도있어서 비침이많지는않은거같아요
너무너무귀여워요
허리밴드도 부드럽고 좋아요",속바지도 있어서 비침이 많지는 않은 거 같아요 너무너무 귀여워요 허리밴드도 부드럽고 좋아요,"부드럽다, 비침, 많다, 밴드, 허리, 속바지, 귀엽다"
속바지 있어서 많이 비치지도 않고 편하고 너무 예뻐요,속바지 있어서 많이 비치지도 않고 편하고 너무 예뻐요,"비치다, 편하다, 속바지"
흰색 치마 갖고싶었느데 너무 예쁘고 편해요 속바지 있는 것도 좋아요,흰색 치마 갖고 싶었는데 너무 예쁘고 편해요 속바지 있는 것도 좋아요,"갖다, 흰색, 치마, 편하다, 속바지"
짧다는 후기도 있었던것 같은데 159~160정도인제가 입었을땐 딱히 엄청 짧다는 느낌은 없었어요 디자인도 이쁘고 여름에 잘 입고다닐것 같아요,짧다는 후기도 있었던 것 같은데 정도 인제가 입었을 땐 딱히 엄청 짧다는 느낌은 없었어요 디자인도 이쁘고 여름에 잘 입고 다닐 것 같아요,"딱하다, 인제, 짧다, 후기, 없다, 여름, 디자인"
짧다는 후기 보고 샀었는데 저는 짧은거 좋아해서 딱 맘에 들어요 귀여움!,짧다는 후기 보고 샀었는데 저는 짧은 거 좋아해서 딱 맘에 들어요 귀여움,"보고, 좋아하다, 짧다, 후기"
많이 짧다고 해서 걱정했는데 제 키에도 괜찮네요 안에 속바지도 있어서 아주 좋아요 잘입을게요 ㅎㅎ,많이 짧다고 해서 걱정했는데 제 키에도 괜찮네요 안에 속바지도 있어서 아주 좋아요 잘 입을게요,"걱정, 속바지, 짧다"
예뻐요~ 검은색 샀는데 넘 예뻐서 하얀색까지 구매함 키작년에게 완전 잘 어울려요,예뻐요 검은색 샀는데 너무 예뻐서 하얀색까지 구매함 키 작년에게 완전 잘 어울려요,"작년, 하얀색, 검은색, 어울리다"
중1  딸 사줬는데 엄청 좋아하네요~배송도 빨라요~,중 딸 사줬는데 엄청 좋아하네 요배 송도 빨라요,"사주다, 송도, 좋아하다, 빠르다"
이런 ㄹㅓ블리한 치마 찾고있었는데 발견해서 바로 샀어요,이런 불리한 치마 찾고 있었는데 발견해서 바로 샀어요,"발견, 불리하다, 찾다, 이렇다, 치마"
"이뻐요 귀엽고
길이랑 허리가 좀 길고크지만 잘입을거같어요",이뻐요 귀엽고 길이랑 허리가 좀 길고 크지만 잘 입을 거 같아요,"길다, 허리, 크다, 길이, 귀엽다"
"기엽고 생각보다 상태도 박음질도좋아여
여름에 잘입을거같어요",귀엽고 생각보다 상태도 박음질도 좋아요 여름에 잘 입을 거 같아요,"상태, 박음질, 여름, 귀엽다"
이뽀용 핏도 좋고 안에 바지는 짧지만 괜차눔 잘이블게용,이뻐요 핏도 좋고 안에 바지는 짧지만 괜차눔 잘이블게용,"괜차눔, 바지, 짧다"
넘넘 이뻐요 좀 짧아보이지만 전 161이라 괜찮았고요 160초반까진 가능할 듯 합니다!! 풍성하고 예뻐요,넘넘 이뻐요 좀 짧아 보이지만 전이라 괜찮았고요 초반까진 가능할 듯합니다 풍성하고 예뻐요,"넘다, 전이, 까진, 보이, 초반, 가능하다, 성하다, 짧다"
이뻐여ㅎㅎ놀러갈 때 입으려 샀어욜 살짝 짧은 감이 있지만 괜찮아여~,이뻐요 놀러 갈 때 입으려 샀어요 살짝 짧은 감이 있지만 괜찮아요,"놀다, 갈다, 짧다"
안에 속바지라서 너무 편하고 발레리나 같아요 예뻐요!,안에 속바지라서 너무 편하고 발레리나 같아요 예뻐요,"발레리나, 라서, 편하다, 속바지"
역시 제일예뻐요 하얗고 루즈티에 레이어드하려고 샀는데 잘어울릴거같아요 빨리 여름에 입고싶습니다,역시 제일 예뻐요 하얗고 루저 티에 레이어드하려고 샀는데 잘 어울릴 거 같아요 빨리 여름에 입고 싶습니다,"제일, 루저, 하얗다, 빨리, 레이어드, 여름, 어울리다"
치마 러블리하고 키작녀한테 길이도 좋고 가격도 할인받아 싸게 가격대비 좋아요,치마 러블리하고 키작녀한테 길이도 좋고 가격도 할인받아 싸게 가격 대비 좋아요,"가격, 할인, 러블리, 키작녀, 싸다, 대비, 받다, 하고, 길이, 치마"
엄청 러블리하고 리본이 둘러져있어서 귀여워요. 속바지도 있어서 좋아요. 좀 짧아서 키작녀들이 입기 좋아요,엄청 러블리하고 리본이 둘러져 있어서 귀여워요 속바지도 있어서 좋아요 좀 짧아서 키작녀들이 입기 좋아요,"두르다, 러블리, 키작녀, 하고, 리본, 속바지, 귀엽다, 짧다"
"리본스커트 화이트 너무 귀엽고 사랑스러워요
속바지가 있어 편하고 원단도 가볍고 시원해요",리본 스커트 화이트 너무 귀엽고 사랑스러워요 속바지가 있어 편하고 원단도 가볍고 시원해요,"원단, 사랑스럽다, 가볍다, 화이트, 시원하다, 스커트, 리본, 편하다, 속바지, 귀엽다"
"요즘 귀여운 리본 레이스 스커트가 자꾸 눈에 밟혀서 사봤는데 진짜 딱 맘에들어요 ㅎㅎ🎀 레이스에 리본까지 달려있어서 귀엽고 크롭티, 박스티, 셔츠까지 다 잘어울리네요!!💝 안에 바지도 넉넉해서 입자마자 편하고 비침도 거의 없어요! 저는 키가 많이 작아서 길이도 딱 괜찮았는데 짧긴 하네욯ㅎㅎ오자마자 찍은거라 주름이 좀 있는데 스팀하니까 금방 펴지더라구요! 여름에 잘 입을거같아요~",요즘 귀여운 리본 레이스 스커트가 자꾸 눈에 밟혀서 사봤는데 진짜 딱 맘에 들어요 레이스에 리본까지 달려있어서 귀엽고 크롭 티 박스티셔츠까지 다 잘 어울리네요 안에 바지도 넉넉해서 입자마자 편하고 비침도 거의 없어요 저는 키가 많이 작아서 길이도 딱 괜찮았는데 짧긴 하네욯오자마자 찍은 거라 주름이 좀 있는데 스팀 하니까 금방 펴지더라고요 여름에 잘 입을 거 같아요,"레이스, 리본, 밟다, 금방, 찍다, 박스, 스팀, 넉넉하다, 자꾸, 사보다"
