Review,Processed_Review,keyword
"요즘 귀여운 리본 레이스 스커트가 자꾸 눈에 밟혀서 사봤는데 진짜 딱 맘에들어요 ㅎㅎ🎀 레이스에 리본까지 달려있어서 귀엽고 크롭티, 박스티, 셔츠까지 다 잘어울리네요!!💝 안에 바지도 넉넉해서 입자마자 편하고 비침도 거의 없어요! 저는 키가 많이 작아서 길이도 딱 괜찮았는데 짧긴 하네욯ㅎㅎ 오자마자 찍은거라 주름이 좀 있는데 스팀하니까 금방 펴지더라구요! 여름에 잘 입을거같아요~",요즘 귀여운 리본 레이스 스커트가 자꾸 눈에 밟혀서 사봤는데 진짜 딱 맘에 들어요 레이스에 리본까지 달려있어서 귀엽고 크롭 티 박스티셔츠까지 다 잘 어울리네요 안에 바지도 넉넉해서 입자마자 편하고 비침도 거의 없어요 저는 키가 많이 작아서 길이도 딱 괜찮았는데 짧긴 하네욯 오자마자 찍은 거라 주름이 좀 있는데 스팀 하니까 금방 펴지더라고요 여름에 잘 입을 거 같아요,"레이스, 리본, 하네욯, 밟다, 금방, 스팀, 박스, 넉넉하다, 찍다, 자꾸"
디자인 리본이 너무 귀엽고 소재도 시원하고 속바지가 달려 있어요 편해요,디자인 리본이 너무 귀엽고 소재도 시원하고 속바지가 달려 있어요 편해요,"달다, 시원하다, 소재, 디자인, 리본, 편하다, 속바지, 귀엽다"
"가성비 너무 좋아요ㅠㅠ완젼 갓성비...핀터 갬성 룩 완성...엉덩이가 커서 좀 퍼지긴 하지만 디테일도 너무 이쁘고 이 가격에 살 수 있다니,, 플레이스 스튜디오 감사합니당",가성비 너무 좋아요 완전 가성비 핀터 갬성 룩 완성 엉덩이가 커서 좀 퍼지긴 하지만 디테일도 너무 이쁘고 이 가격에 살 수 있다니 플레이스 스튜디오 감사합니다,"가성비, 핀터, 개다, 스튜디오, 완성, 일도, 커서, 엉덩이, 퍼지다, 디테"
세일할때 잘사서 만족합니다 !! 밴드라서 엄청 편하고 짧을줄알았는데 내려입으니까 그렇게 막 짧지도 않어요 마음에 들어용 ㅎㅎ,세일할 때 잘 사서 만족합니다 밴드라서 엄청 편하고 짧을 줄 알았는데 내려 입으니까 그렇게 막 짧지도 않아요 마음에 들어요,"그렇게, 알다, 사서, 내다, 짧다, 밴드, 라서, 만족하다, 세일, 편하다"
세일할때 잘사서 만족합니다 !! 잘입을게영 마음에 들어용 ㅎㅎ,세일할 때 잘 사서 만족합니다 잘 입을게요 마음에 들어요,"사서, 만족하다, 세일"
받자마자 너무 짧아서 당황했는데 입어보니까 딱 적당한 길이여서 다행이에요… 리본들 너무 귀여워요,받자마자 너무 짧아서 당황했는데 입어보니까 딱 적당한 길이여서 다행이에요 리본들 너무 귀여워요,"당황, 다행, 입어보다, 여서, 받다, 이에요, 적당하다, 길이, 리본, 귀엽다"
가볍고 편해서 여름에 시원하게 입기 좋을것 같아요.제 키에는 많이 짧지 않아요,가볍고 편해서 여름에 시원하게 입기 좋을 것 같아요 제 키에는 많이 짧지 않아요,"가볍다, 시원하다, 에는, 여름, 편하다, 짧다"
"군데군데 붙어 있는 리본이 정말 귀엽습니다.
그리고 생각보다 소재가 탄탄해서 라인 유지가 잘 될 것 같아요.
이런 디자인 입어보고 싶었는데 잘 산 것 같아요.",군데군데 붙어 있는 리본이 정말 귀엽습니다 그리고 생각보다 소재가 탄탄해서 라인 유지가 잘 될 것 같아요 이런 디자인 입어보고 싶었는데 잘 산 것 같아요,"군데군데, 유지, 라인, 입어보다, 탄탄하다, 붙다, 이렇다, 소재, 디자인, 리본"
"상품 주문 폭주로 오래 기다려서 받았습니다.
기다린 만큼 예뻐서 만족스럽습니다.
색감도 사진과 같이 깨끗한 화이트에 안에 속바지가 덧대어 있어 부담없이 입을 수 있을 것 같습니다.",상품 주문 폭주로 오래 기다려서 받았습니다 기다린 만큼 예뻐서 만족스럽습니다 색감도 사진과 같이 깨끗한 화이트에 안에 속바지가 덧대어 있어 부담 없이 입을 수 있을 것 같습니다,"기다리다, 깨끗하다, 오래, 폭주, 대다, 만족스럽다, 없이, 색감, 상품, 화이트"
흰 치마 필요했는데 귀여운 치마 겟해서 넘 조아용 세일도해서 더더 🤍,흰 치마 필요했는데 귀여운 치마 겟 해서 넘지 아용 세일도 해서 더더,"치마, 희다, 더더, 필요하다, 넘다, 세일, 귀엽다"
세일할때 가격이 싸서 별 기대없이 샀는데 생각보다 천도 좋고 이쁘네요. 키가 작아서 길이도 좋아요,세일할 때 가격이 싸서 별 기대 없이 샀는데 생각보다 천도 좋고 이쁘네요 키가 작아서 길이도 좋아요,"기대, 없이, 싸다, 작다, 세일, 가격, 길이"
"리본이 포인트 진짜 너무 귀여워요
안에 속바지가 있어서 입기 편해요",리본이 포인트 진짜 너무 귀여워요 안에 속바지가 있어서 입기 편해요,"포인트, 리본, 편하다, 속바지, 귀엽다"
