Processed_Review,keyword
도영님이 추천해 주셔서 구매했는데 덩치 있는 남자분들도 입을 수 있을 정도로 크게 나왔습니다 로고도 적당한 크기에 있어서 부담스럽지 않게 입을 수 있어요,"부담, 덩치, 크기, 추천, 도영, 적당하다, 주다, 크게"
기본으로 입기 좋아요 오버사이즈로 비율이 좋게 입기느누별로고 막 입거나 유니 섹스하게 입게 좋습니다 근데 소매길이가 참 묘해서 소매 접기가 안돼요,"누 로고, 길이, 오버 사이즈, 묘, 접기, 비율, 기본, 섹스"
아주 살짝 비쳐요 그리고 너무 큰 것 같아요 남녀 공용이어서 그런지 구김 없이 아주 편히 입을 수 있을 것 같아요 질은 상당히 좋고 막 아주 얇은 소재나 냉감 원단이 아니어서 쿨 코튼이라고 부를 수 있을지는 모르겠는데 일반 면보다는 땀이 빨리 말라요,"공용, 아니다, 코튼, 말르다, 비치다, 상당하다, 원단, 그렇다"
여름엔 단품으로 가을봄엔 이너로 입기 아주 좋은 제품입니다,"제품, 가을 봄, 품, 여름, 이너"
저렴한 가격에 잘 구입해서 입고 있어요 추천합니다,"추천, 저렴하다, 가격"
사이즈 적당 아무렇게나 입기 좋고 저렴합니다,"저렴하다, 사이즈, 적당, 아무렇다"
생각보다 크지만 좋아요 무난하니 예쁘네요 굿굿,"무난, 크다, 굿굿"
편한 사이즈로 잘 입고 다닐 수 있습니다 가성비 좋아요,"가성비, 사이즈, 편하다"
만족합니다 가성비 좋아요 재구매 할 거예요 최대 탬이에요,"탬, 가성비, 만족하다, 재다, 최대"
너무 편하고 좋아요 추천합니다 재구매 의사 있음 운동할 때 편하게 입고 운동하기 좋아요,"운동, 편하다, 운동, 추천, 편하다, 재다, 의사"
가갹대비 훌륭한 티셔츠입니다 휘뚜루마뚜루 입기도 좋고요,"티셔츠, 훌륭하다, 가갹 대비"
생각했던 재질이고 시원하고 얇아서 여름에 입기 좋아요,"재질, 시원하다, 여름, 얇다"
싼 가격에 옷 두벌 나쁘지 않은 핏 너무 가성비 좋습니다,"가성비, 가격, 벌, 나쁘다"
편하게 입기 좋아요 안에 입는 용도로도 잘 활용하고 있습니다,"활용, 도로, 편하다"
잘 입고 다녀요 깔 끙 하고 나 편해서 좋아해요 배소도 빠르게 왔어요 변형 없이 입을 것 같아요,"편하다, 변형, 배소, 좋아하다, 오다"
저렴한 가격에 빠른 배송 감사합니다 조금만 더 저렴했으면 합니다,"저렴하다, 가격, 배송, 저렴하다, 빠르다"
사이즈도 적당하고 너무 좋았습니다 추천합니다,"추천, 적당하다, 사이즈"
배송이 빨리 와서 너무 좋고 깔끔하고 데일리로 입기 좋고 어떤 옷이랑 이어도 무난 템이라서 다 잘 어울릴 것 같아요 할인쿠폰 사용해서 저렴하게 샀는데 기분이 좋네요 잘 입을 것 같아요,"사용, 할인 쿠폰, 배송, 어울리다, 저렴하다, 이어도, 데일리"
이 제품 가격 대비 품질이 너무 우수하네요 빨리 사세요,"우수하다, 품질, 가격, 대비, 제품"
잘 산 것 같아요 무난하게 마음에 듭니다 잘 입고 다녀요 깔끔하고 좋아요 추천해요 사도 크게 후회할 거 같진 않아요,"무난, 추천, 사도, 깔끔하다"
면이 좋아 재구 매했어요핏 도 예쁘고 만족합니다,"만족하다, 재다, 핏"
맨날 입는 거 이너로 입기에 최고예요 이것만 입어요,"이너, 최고"
배송도 포장도 좋아요 피이 이뻐서 어디에나 어울립니다 옷이 이쁩니다,"어울리다, 포장, 배송, 피다"
원단도 여름에 입기 좋게 얇아서 너무 좋아요 옷도 너무 예쁘고 만족합니다,"만족하다, 원단, 여름, 얇다"
정말 저렴하고 얇아서 여름에 입기 좋은 제품입니다,"저렴하다, 제품, 여름, 얇다"
넉넉하고 좋은데 팔은 다른 티셔츠보다 조금 짧은 편이에요 참고하세요,"티셔츠, 편이, 참고, 넉넉하다, 팔, 짧다"
초등학생 딸내미 사줬더니 잘 맞고 잘 입고 다닙니다 재질도 괜찮고 너무 길지 않아서 좋아요,"초등학생, 재질, 길다, 사주다, 맞다"
커버나 반팔 티 무난하고 질이 좋아서 한 세트 더 샀어요 세탁해서 입어도 변형이 별로 없고 깔끔하게 청바지랑 잘 어울려요,"변형, 청바지, 어울리다, 세탁, 무난, 별로, 팔, 질, 커버"
사이즈가 잘 맞아요 여름에 입기 좋고 너무 얇지 않아서 비침도 없고 좋아요 원단도 세탁 몇 번 돌렸는데 괜찮네요,"사이즈, 비침, 원단, 여름, 세탁, 없다, 얇다"
소재가 좋아서 엄청 시원합니다 다만 흰옷을 얇아서 비칠 수도 있을 것 같아요,"시원하다, 소재, 비치다, 수도, 희다, 얇다"
옷 이 쿨 소재다 보니 조금 얇아서 비침이 살짝 있는듯하지만 부드럽고 시원하긴 합니다,"시원하다, 부드럽다, 소재, 비침, 얇다"
남자친구 선물로 샀는데 만족합니다 여름에 이 가격에 이 무난한 디자인 필수 템,"만족하다, 남자친구, 선물, 디자인, 무난, 가격, 여름, 필수"
품에 비해 기장이 조금 깁니다 얇아서 여름에 잘 입고 다닐 거 같아요,"기장, 여름, 비다, 얇다, 품"
적당히 얇고 적당히 흐물거려서 좋습니다 기장은 좀 긴 거 같아요,"적당하다, 기장, 흐물거려, 얇다"
원단 재질도 탄탄하고 세탁 후도 변형 없이 유지되어 좋아요,"탄탄하다, 변형, 재질, 세탁, 원단, 후, 유지 되어다"
Basic Tshirts for everyday,
엄청 잘 입고 있어요 질도 너무 좋고 부드럽고 시원해요 여름 박스티로 딱,"박스 티, 부드럽다, 시원하다, 질도, 여름"
생각보다 어깨선이 애매해서 다음에 살 때는 m으로 사고 싶어요,"애매하다, 사고, 어깨 선, 싶다"
제가 어깨가 넓은 편이라 그런지 어깨선이 살짝 애매하긴 했는데 그래도 편하게 입기 좋은 옷인 것 같네요,"편하다, 그렇다, 편이, 애매하다"
좀 길긴 한데 얇고 여름에 잘 입고 다닐 거 같아요 너무 마음에 들어요 가성비 최고 꼭 사세요 강추,"가성비, 강추, 여름, 길다"
가격도 합리적이고 사이즈도 잘 맞고 배송도 빨라요,"합리, 사이즈, 가격, 배송, 빠르다, 맞다"
똑같은 제품 아주 잘 입다가 오래되어서 새로 구입했어요 건조 빠르고 일반 면 티에 비해 시원합니다 사진 찍으며 보니 검은색이 조금 더 기네요 나도 몰랐던 사실임,"시원하다, 검은색, 사실, 사진, 건조, 나다, 일반, 새롭다"
개의 가격으로 개를 사서 너무 저렴해서 좋습니다,"저렴하다, 가격, 사서, 개, 개"
진짜 편하게 막 입기 좋아요 목 늘어남 아직 없서영,"편하다, 늘어나다, 없다 서영"
운동하려고 산 건데 가성비가 좋네요 개 구매해서 운동복으로 입습니다,"운동, 가성비, 운동복"
검둥이 흰둥이 둘 다 편하고 소재도 좋아요 깔끔하게 입기도 최고,"검둥이, 편하다, 흰둥이, 소재, 최고, 깔끔하다"
S 사이즈도 입어보고 싶어서 샀는데 만족합니다,"만족하다, 사이즈, 입어보다, 싶다"
운동하면서 막 입으려고 일부러 크게 샀는데 왕왕 크긴 하네요 그래도 편하고 좋습니다,"운동, 왕왕, 편하다, 일부러, 크다, 크게"
편하고 시원하고 좋아요 여름엔 무조건 반팔 무지 티죠,"무조건, 편하다, 시원하다, 무지, 여름, 티, 팔"
기존 샀다 티셔츠라 매우 만족스럽습니다 역시 티셔츠는 기본이 찐입니다,"만족스럽다, 티셔츠, 티셔츠, 기본, 기존, 찌다"
땀이 많아서 여름에 반팔 입어도 더웠는데 쿨 코튼이라서 그런지 다른 반팔에 비해 시원하고 소재도 좋은 거 같아요,"코튼, 그렇다, 시원하다, 팔, 소재, 팔, 여름, 비다"
배송도 빠르고 옷도 좋아요 속에 입기도 좋고 지금처럼 여름엔 하나만 입어도 편하네요,"편하다, 배송, 여름, 속, 하나"
자주 세탁해도 탄탄하고 좋습니다 xs은 딱 정 사이즈 느낌이라 사이즈 업해서 입어도 좋을 것 같아요,"업, 세탁, 탄탄하다, 사이즈"
재질 시원하고 여름에 입기 너무 좋아요 세트로 잘 입고 있어요,"시원하다, 세트, 재질, 여름"
사진과 같은 제품으로 배송상태도 괜찮았습니다,"배송 상태, 제품, 사진"
디자인은 진짜 깔끔하고 면이랑 스포츠 티 랑 그사이인 질감인 것 같아요,"디자인, 질감, 스포츠, 깔끔하다"
편하게 입고 다니기 좋습니다 몇 달째 문제없이 잘 입고 다니고 있어요,"편하다, 문제, 달"
재질이 아무리 세탁해도 변형이 적다고 해서 주문해 봤는데 세탁은 많이 해보진 않았지만 핏이 적당하고 맘에 들어요,"변형, 적당하다, 세탁, 재질, 세탁, 주문, 적다"
사이즈 좋고 색감 이쁘고 디자인도 좋아요 너무 굿,"디자인, 사이즈, 색감"
매우 깔끔하고 가성비 좋은 면 티 하나 뽑자면 저는 이거,"가성비, 하나, 뽑다, 깔끔하다"
작년에 구매하고 좋아서 다시 구매했어요 마음에 들어요,"작년, 다시"
남편 엑스라지 사이즈 딱 좋아요 기본 티셔츠 제일 손 많이 갑니다,"엑스, 사이즈, 티셔츠, 가다, 남편, 제일, 기본"
저렴한 가격 간편하게 착용 가능해서 좋은 거 같네요,"간편하다, 가능하다, 저렴하다, 가격, 착용"
왜 유명한지 알겠습니다 데일리로 편하게 마음껏 입을 수 있습니다,"유명하다, 편하다, 데일리, 알다, 마음껏"
여기저기 편하게 입으려고 샀는데 아주 만족해요 재질이 얇으면서도 탄탄해서 입으면 시원해요,"여기저기, 만족하다, 시원하다, 탄탄하다, 편하다, 재질, 얇다"
무진장 불프 때 구매해서 아주아주 저렴하게 샀습니다 목 부분 마감 처리 정말 꼼꼼해서 목 늘어남 걱정이 없어요 검은색은 진한 검정이 아닌 밝은 검정이었고 흰색은 아주 약간 아이보리 느낌입니다 그래도 하얘요 비침 정도도 이 정도면 나쁘지 않은데 살짝 부담스러울 수도 있어요 세탁 후 변형은 없었고 배송도 한 일 정도에 왔어요 믿고 사는 커버 나입니다 제 키 기준 팔 기장은 팔꿈치에서 좀 더 위고 아래 기장은 엉덩이 덮습니다 참고하세요 많이 파세요,"무진장, 엉덩이, 걱정, 흰색, 검은색, 검정, 변형"
사이즈 넉넉하고 여름에 시원하게 입기 좋아요 좀 얇은 편이긴 해요,"시원하다, 넉넉하다, 펴다, 사이즈, 여름, 얇다"
커버나 예전부터 입고 싶었는데 드디어 하나 장만했습니다 어깨선 안 맞을까 봐 걱정했는데 잘 맞아서 좋았어요 여름인데 휘뚜루마뚜루 걸쳐 입기 좋은 것 같습니다 버뮤다랑 입어도 이쁠 것 같아요,"버뮤다, 걸치다, 커버, 여름, 하나"
다음에는 M으로 주문해야겠어요 품이 너무 커요 살이 없으니까 좀 커네요 좋은 좋아요,"크다, 크다, 살이, 품, 주문"
할인할 때 싸게 잘 샀어요 재질이 너무 튼튼하고 좋아요,"튼튼하다, 할인, 싸다, 재질"
박시하게 데일리로 입기 좋아요 운동할 때 입기도 좋아요,"운동, 데일리, 박시"
재구매했어요 얇아서 여름에 입고 다니기 좋아요,"여름, 재다, 얇다"
배송 빨라요 아무 코디에나 무난하게 입을 수 있어서 좋네요,"무난, 코디, 배송, 빠르다"
적당한 핏에 무난해요 편하게 입기 좋은 것 같아요,"무난, 적당하다, 편하다, 핏"
디자인이 깔끔해서 마음에 들고 편하게 입기 좋은 옷입니다,"디자인, 편하다, 깔끔하다"
여름마다 늘 쟁여두고 입고 있어요 사이즈 낙낙하고 편해요,"쟁여두, 편하다, 사이즈, 낙 낙하, 여름"
약간 오버 피트인데 운동할 때 레깅스 위에 입으면 부담 없고 이뻐요,"레깅스, 피트, 운동, 오버, 부담, 위, 없다"
여름 내내 잘 입은 기본 티 맨날 입고 세탁기 건조기 막 돌려서 후줄근해진 감이 있으나 재구매할 정도로 만족,"건조기, 후줄근하다, 돌리다, 만족, 재다, 세탁기"
자주 입는 티셔츠 라마디 두고 입으려고 구매했어요 항상 손이 가는 티셔츠 편하고 좋아요,"티셔츠, 편하다, 항상, 손, 두다, 라마디, 가다"
사이즈 크게 나왔는데 건조기 돌렸더니 사이즈가 많이 줄었네요 그냥 무난한 스타일입니다 소재 그냥 그래요,"스타일, 사이즈, 사이즈, 건조기, 무난, 소재, 그렇다, 줄다, 돌리다"
시즌오프로 저렴하게 구입했어요 남녀 공용이라서 M도 사이즈가 넉넉하네요 배송도 빠르고 좋습니다,"공용, 시즌 프로, 저렴하다, 넉넉하다, 사이즈, 배송, 남녀, 빠르다"
기본으로 입기 좋은 반팔 티 뭐 입을지 생각하지 않고 막 입을 수 있어서 좋아요 검정 흰색 기본 티라 활용도도 좋고 재질로 탄탄해서 오래 입을 것 같아요,"탄탄하다, 재질, 검정, 기본, 활용 도도, 흰색"
재구매입니다 튼튼하고 좋습니다 추천합니다,"추천, 재다, 튼튼하다"
재구매입니다 튼튼하고 좋습니다 추천합니다,"추천, 재다, 튼튼하다"
핏도 좋고 여름에 입기 좋은 재질입니다 흰색 검은색 다 좋아요,"재질, 검은색, 흰색, 여름, 핏"
여름에는 일반 기본 면 티가 많이 필요해서 구매했어요,"필요하다, 일반, 여름, 기본, 티"
무난하게 편하게 막 입기 좋은 기본 면 티입니다 추천,"무난, 티, 추천, 편하다, 기본"
기본 면 티입니다 두께 감길 이 모두 무난하게 입을 수 있어요,"무난, 티, 감다, 기본, 두께"
일상복으로 잘 입고 있어요 아주 예쁘고 무난합니다,"무난, 일상복"
세일 중이라 좋은 가격에 구매했습니다 역시 짱짱하고 좋네요 목 시보리 부분도 단단해서 잘 늘어날 거 같지 않아서 좋을 거 같아요,"중이, 가격, 단단하다, 시보리, 늘어나다, 세일, 부분, 짱짱하다"
매우 만족한 상품입니다 배송도 빠르고요 무난합니다,"무난, 상품, 만족하다, 배송, 빠르다"
싸게 잘 샀어요 기본 티로 입기 좋아요 재질도 가격 대비 훌륭합니다,"훌륭하다, 재질, 싸다, 가격, 대비, 기본, 티"
싸게 잘 샀어요 재질도 괜찮고 디자인도 딱 기본 핏입니다 편하게 입기 좋아요 세탁 후에도 변형 없습니다,"변형, 편하다, 재질, 디자인, 기본, 세탁, 싸다, 후, 핏입니"
cm kg 마른 체형 남자친구한테 사줬는데 심플한 디자인에 박식하고 그냥 입어도 이쁜 옷이에요 어깨 라인이 약간 아래에 있어서 좁은 어깨 단점도 보완해 주고 배송도 빠르고 남자친구도 엄청 좋아하네요 소재도 나쁘지 않아 보여서 만족스러워요,"남자친구, 심플, 박식하다, 남자친구, 보, 보완, 좁다"
일단 가격이 너무 만족스러웠고 옷이 시원시원해서 좋았습니다,"시원시원하다, 가격, 만족스럽다"
튼튼하다고 해서 운동용으로 샀습니다 사이즈 고민했는데 xs 시키니 딱 정 사이즈라 s나 m 사서 넉넉하게 입어도 좋았을 것 같아요,"사서, 사이즈, 운동, 넉넉하다, 사이즈, 튼튼하다"
깔끔하니 완존 만족요 할인함 또 구매함요 사이즈도 s 딱 입기 좋아요,"만족, 사이즈, 완존, 함, 할인 함, 깔끔하다"
약간 시원한 재질인 거 같아요 사이즈도 온 버핏이라 너무 좋아하네요,"사이즈, 재질, 시원하다, 좋아하다, 버핏"
시원한 편입니다 엄청나게 쿨하진 않지만 적당히 얇은 편인 느낌입니다,"적당하다, 쿨하다, 편입, 엄청나다, 편, 시원하다, 얇다"
흰색 검은색 기존 티셔츠로 편안하게 잘 입을 것 같아요,"편안하다, 티셔츠, 흰색, 검은색, 기존"
흰색 검은색 기본 티셔츠로 이쁘게 입을 것 같아요,"티셔츠, 검은색, 흰색, 기본"
저렴한 가격에 좋은 퀄리티까지 챙길 수 있어서 좋았네요 기본 티셔츠로 편안하게 입을 것 같아요,"티셔츠, 편안하다, 저렴하다, 챙기다, 가격, 기본, 퀄리티"
합리적인 가격이 세탁 후 변형도 없어요 커버나 제품이라 질이 좋아서 그런지 오래 입을 거 같아요 재구매 의사 있습니다,"합리, 그렇다, 변형도, 가격, 제품, 재다, 질, 의사"
배송처리 빼고는 다 좋습니다 색상도 괜찮고 얇아서 여름에 입기 최고,"배송 처리, 색상, 여름, 얇다, 빼다, 최고"
배송 빠르고 군더더기 없는 티셔츠 한철 잘 입을게요,"티셔츠, 한철, 배송, 군더더기, 없다, 빠르다"
한철 입고 말 것 같아요 며칠 입었더니 엉덩이 쪽에 보풀 지림 싼 맛에 입는 거지만 그래도 보풀이 너무 빨리 생겨서 놀랐어요 검은색은 먼지도 잘 붙고 근데 재질이 한여름에도 괜찮은 재질이라 그냥 입습니다,"엉덩이, 며칠, 먼지, 생기다, 재질, 재질, 거지, 한철"
커버나 너무 좋아요 굿굿 이 가격에 두 벌이나 아주 가성비 좋은 것 같아요 질도 이 정도면 나름 만족해요,"만족하다, 가성비, 벌이, 가격, 커버, 질도, 나름"
사이즈도 맞고 괜찮아서 무난 무난하게 입기 좋아요,"무난, 사이즈, 무난, 맞다"
예쁘게 잘 맞아요 편하게 입기 좋아요 배송도 빠르고 좋아요,"편하다, 배송, 빠르다, 맞다"
시원하고 찰랑대는 원단이네요 기본으로 입기 좋습니다,"원단, 시원하다, 찰랑대다, 기본"
휘뚜루마뚜루 입으려고 산 건데요 생각보다 얇지만 목부분은 짱짱해요 사이즈 근데 너무 커서 두 사이즈 작게 사도 충분했을 것 같아요 흰색 한번 빨았는데 늘어남 없이 유지 중입니다,"중, 흰색, 사이즈, 목 부분, 한번, 늘어나다, 유지"
적당히 박식하고 입으면 이뻐요 여름 내내 잘 입겠어요,"적당하다, 박식하다, 여름, 내내"
배송 엄청 빠르고요 티셔츠 질이 너무 좋습니다 추천,"티셔츠, 추천, 배송, 질, 빠르다"
근본 가성비 커버나 어디에 입든 편하고 핏도 이쁜 커버나 그냥 사세요 너무 마음에 들어요 나중에 여유가 생기면 더 살 의향 있습니다,"생기, 가성비, 여유, 커버, 편하다, 나중"
가격 대비 굿 외출용이나 잠옷용으로도 개안습니다 시원 하이 좋네요,"개다, 가격, 하이, 시원, 대비, 잠옷, 외출 용이"
선물로 사줬는데 잘 입고 다녀요 길이는 조금 긴 느낌이 있는 거 같아요,"선물, 길이, 사주다"
길이가 적당하고 옷이 예쁘고 편안해서 활동할 때 입기 좋을 것 같아요,"적당하다, 편안하다, 활동, 길이"
편안하게 잘 맞아요 색이 생각보다 흰색 아니고 아이보리 색이니까 참고하시면 좋을 것 같아요 사이즈는 내 키면 m 사시면 될 것 같아요,"참고, 사시, 사이즈, 아니다, 색, 아이보리, 흰색, 키, 편안하다"
기본 템으로 무난하게 좋은 것 같고 심플한 게 제 스타일이었어 요로 두 가지 색 받을 수 있어서 좋았숩니당 편하게 자주 입고 다닐 예정이에요,"무난, 심플, 편하다, 가지, 요로, 기본"
사이즈는 크고 옷감이 두꺼워서 비치지 않고 좋은 거 같아요,"사이즈, 비치, 크다, 옷감, 두껍다"
선물로 줬는데 마음에 들어히늨 것 같아서 다행입니다,"다행, 선물, 주다, 늨"
원단이 가볍고 색상도 선명해서 좋았어요 배송도 빨리 와서 굿굿,"선명하다, 색상, 가볍다, 배송, 오다, 원단, 굿굿"
여름에 입기 너무 얇지도 않고 딱 시원한 면이에요 핏이 넉넉한 편이라서 너무 편해요 이번 여름에 휘뚤마뚤 잘 입을 것 같습니다 무게도 가벼워서 겨울에는 후드티 안에 이 너 이로 입기도 좋을 것 같아요,"편이, 넉넉하다, 시원하다, 가볍다, 겨울"
싼 가격에 장 잘 샀고 두 개다 퀄리티가 좋습니다,"퀄리티, 가격, 개다"
바람 잘 통해서 너무 시원해요 평소에 무난하게 입기 좋아요,"평소, 통해, 시원하다, 무난, 바람"
먼저 배송도 빠르게 왔고요 이 가격에 티셔츠 개라니 진짜 레전드입니다 맨날 입고 다니는 중 너무 좋아요,"레전드, 개, 먼저, 배송, 티셔츠, 가격"
가성비가 좋고 재질이 탄탄하고 좋아요 다른 색상도 있다면 구매하고 싶어요,"가성비, 색상, 탄탄하다, 재질, 싶다"
이 옷이 편해서 이것만 사는데 기존 authentic에서 essential로 바뀌었는데 동일해서 만족해요 사이즈는 L 입으시는 분들은 M 추천드려요 옷이 크게 나왔어요,"추천 드리다, 만족하다, 동일하다, 편하다, 사이즈, 살다, 기존"
두 번째 구매입니다 평상시에도 입고 운동 갈 때도 입는데 올해 여름 내내 입고 내년에도 재구매 의사 있어요 그리고 무엇보다 가격이 합리적이어서 좋아요,"내년, 합리, 가격, 운동, 재다, 평상시, 내내"
기본 티로 활용하기 좋아요 청바지에 입으면 좋을 거 같아요,"청바지, 활용, 기본, 티"
너무너무 예쁘고 편합니다 예쁘게 잘 입겠습니다,편하다
사이즈 조금 크게 나와서 반품시켰었어요 사이즈 꼭 줄여사세요,"줄이다, 사이즈, 나오다, 크게, 반품"
천이 너무 좋네요 몸에 감기는 느낌이 좋고 시원해요 배송도 하루 걸리네요,"시원하다, 걸리다, 배송, 감기, 천이, 몸"
재질이 너무 좋고 크기도 잘 맞아서 제 키에 이거 사면 될 거 같아요,"크기, 키, 재질, 사면, 맞다"
너무 편하다 편하게 입을 수 있다 어디에든 받쳐 입기 좋음,"편하다, 편하다, 받치다"
먼저 제가 여자 치고는 덩치가 있어서 사이즈가 맞을까 걱정이 되었는데 다행히 딱 맞았어요 저보다 덩치가 있거나 딱 맞는 걸 싫어하시는 분들은 큰 사이즈를 사는 것을 추천드려요 무난하게 잘 입을 수 있는 제품인 것 같습니다,"추천 드리다, 덩 치가, 무난, 먼저, 사이즈, 걱정, 사이즈, 다행하다, 살다"
여름이라 더워서 시원한 소재의 반소매를 찾고 있었는데 마침 딱 좋은 옷을 발견해서 구매했습니다 이름 그대로 쿨한 소재라서 시원해서 너무 마음에 들고 품은 조금 넉넉하지만 또 그거 나름대로 편하게 입을 수 있어서 좋았어요,"발견, 소재, 시원하다, 넉넉하다, 소재, 시원하다, 마침, 소매, 여름"
여름이라 더워서 시원한 소재의 반소매를 찾고 있었는데 마침 딱 좋은 옷을 발견해서 구매했습니다 쿨한 소재라서 시원해서 너무 마음에 들어요,"발견, 시원하다, 소재, 소재, 소매, 시원하다, 덥다, 마침, 여름"
여름에 입기 좋은 소재여서 입기 좋네요 커버 낮은 믿고 사세요,"소재, 여름, 커버, 믿다, 낮다"
좋은 가격에 깔끔하게 입기 좋아요 배송도빨랍답니다,"가격, 배송 빨랍답, 깔끔하다"
원단도 얇고 가격도 좋고 너무 만족합니다 휘뚜루마뚜루 잘 입을 것 같아요,"만족하다, 원단, 가격, 얇다"
원단도 깔끔하고 옷도 무난해서 좋음 투 팩이라 하 잘 산 듯,"원단, 무난, 팩, 깔끔하다"
가성비 짱짱 신축성 좋고 가볍고 시원하고 예쁘고,"신축, 가성비, 가볍다, 시원하다, 짱짱"
여름이라 반팔 티셔츠가 많이 필요한데 요고 자주 입게 되는 것 같아요,"티셔츠, 필요하다, 여름, 팔"
배송도 빠르고 재질도 좋아요 가격도 싸서 굿이에요,"배송, 가격, 재질, 싸다, 빠르다, 굿"
디자인 이쁘고 사이즈 괜찮습니다 전체적으로 만족합니다,"만족하다, 전체, 사이즈, 디자인"
사이즈 괜찮고 디자인 이쁩니다 전체 떡으로 만족합니다,"만족하다, 사이즈, 디자인, 전체, 떡"
편하게 입으려고 큰 사이즈 샀는데 대만족 얇고 시원해요,"시원하다, 만족, 사이즈, 편하다, 얇다"
여름에 단독으로 입기에 가볍고 편합니다 시원하게 잘 입을 것 같아요 상체가 약간 덩치 있는데 딱 맞네요,"상체, 덩치, 가볍다, 편하다, 시원하다, 단독, 여름"
이번에까지 한 번 구매한 거 같네요 커버나 반팔 티는 꾹 룰입니다,"룰, 커버, 티, 팔"
기본 티 찾다가 두 장 세트로 구매했습니다 아주 좋아요,"세트, 기본, 찾다"
옷 자체는 얇아서 한 여름에 입기 좋아요 무난하게 어느 옷에 입어도 편하고 잘 어울려서 자주 입어요,"어울리다, 무난, 자체, 편하다, 여름"
여름 티 국룰이쥬 커버나 년마다 재구매합니다,"재다, 국룰이쥬, 커버, 여름"
옷도 편하고 여름에 가볍게 입기 좋은 재질입니다,"가볍다, 편하다, 재질, 여름"
기본 아이템으로 너무 괜찮아요 아들이 잘 입고 다닙니다,"아들, 아이템, 기본"
기본 티로 사용하기 너무 좋아요 다들 하나씩 장만하세요,"장만, 사용, 하나, 기본, 티"
휘뚜루마뚜루 굿굿 휘뚜루마뚜루 굿굿 평소에 입기도 아예,"평소, 아예, 굿굿"
