Processed_Review,keyword
쫀쫀한 짜임에 탄력까지 가성비 말할 것이 많은 장점을 가지고 있어 추천드립니다 흘러내림 없어 아주 잘 신고 있고 두 번 세 번 구매하고 않습니다 감사히 잘 신겠습니다,"추천 드리다, 가성비, 흘러내리다, 장점, 가지, 말, 신고"
사이즈 입는 체형입니다 후기 중에 많이 크게 나온다고 M사이즈 입으신 거 보고 혹시 몰라 M사이즈로 시켰는데 그래도 조금 남을 정도로 넉넉한 오버사이즈로 나옵니다 사이즈 참고하고 주문하세요 사이즈 외에 재질 착용감 두께 너무너무 만족하고 데일리룩으로 입고 다니고 있습니다,"체형, 만족하다, 넉넉하다, 나오다, 사이즈, 사이즈, 나오다, 사이즈, 오버 사이즈, 참고"
이 제품 추천하는 분들이 많더라고요 두께도 적당하고 원단도 부드럽고 디자인도 깔끔해서 맘에 들어요,"적당하다, 부드럽다, 추천, 디자인, 분, 원단, 제품, 많다"
편하고 아주 좋아요 나중에 떨어지면 또 살 거 같아요,"나중, 편하다, 떨어지다"
기본으로 입기 아주 좋은 티셔츠입니다 편하게 잘 입을 거 같아요,"티셔츠, 편하다, 기본"
한 번 빨았는데 코팅이 거의 벗겨져서 아쉬웠어요,"코팅, 아쉽다, 빨다, 벗겨지다"
운동용으로 구입했는데 평상시에도 잘 착용하고 있어요 좋아요,"평상시, 운동, 착용"
합리적인 가격으로 커플티로도 딱 좋은 제품인 거 같아요 커버나 원래 좋아하는 브랜드이지만 옷은 처음이네요 잘 입을게요,"커플티, 합리, 브랜드, 처음, 가격, 제품, 커버, 원래"
온 버핏처럼 입을 수 있어서 좋았고 연 배송 꼼꼼하게 왔습니다 무난한 무채색인 만큼 아무 때나 입을 수 있어서 굉장히 마음에 들었습니다,"무채색, 무난, 배송, 오다, 버핏"
기존에 사놨던 거 너무 잘 입어서 추가로 개 더 샀네요 근데 예전과 재질감이 좀 달라진 거 같아요 기능성 느낌이 좀 줄어든 느낌,"기능, 재질감, 줄어들다, 기존, 달라지다, 추가, 예전"
XL 사이즈 약간 큼 평소 XXL 입는 분들도 적당한 크기입니다,"크기, 평소, 적당하다, 사이즈, 분"
배송 하루 만에 왔아요 원단 얇고 부드러워서 착용감 편할 거 같아요,"부드럽다, 착용, 배송, 원단, 편하다, 하루, 오다, 얇다"
저 진짜 커버나 좋아하는데 무난하고 핏도 딱 좋고 너무 좋아요 개추 빨고 건조기 돌려도 넥도 안 늘어나고 너무 좋아요,"무난, 늘어나다, 커버, 건조기, 돌리다, 개추, 넥, 핏"
저렴하게 잘 구매했어요 핏도 맘에 들었습니다 옷 이뻐요,"저렴하다, 핏"
전체적으로 아주 마음에 듭니다 기장은 너무 길어서 수선해서 입었지만,"전체, 수선하다, 기장"
역시 커버넛 디자인이랑 마감이 좋습니다 만족합니다,"만족하다, 디자인, 마감, 커버 넛"
쿨 코튼이라서 그런지 다른 보통 옷보다는 질감이 얇고 아주 살짝 비칠 수도 있을 것 같아요,"코튼, 그렇다, 보통, 비치다, 질감, 수도"
운동할 때 착용하려고 구입했습니다 편하게 잘 입어질 듯해요,"착용, 운동, 편하다"
이쁘네요 사이즈도 원하던 사이즈라서 좋아요 또 구매할게요,"사이즈, 사이즈, 원하다"
포장이 엄청 꼼꼼하게 오네요 세탁 후에 사이즈 변형도 없고 프린팅도 그대로인 게 참 마음에 드네요 사이즈는 정 사이즈입니다,"사이즈, 사이즈, 사이즈, 포장, 프린팅, 변형도, 그대로, 오다"
생각보다 많이 얇아요 여름에 시원하고 좋겠지만 가을 겨울에는 조금 추울 거 같아요 사이즈는 크지도 작지도 않고 보통이에요 무엇보다 배송이 빨라서 좋네요,"배송, 보통, 시원하다, 사이즈, 크다, 겨울, 가을, 여름"
연도에 구매했던 거 추가 주문했는데 재질이 바뀌었네요 아쉬워요,"재질, 연도, 추가, 아쉽다, 바뀌다, 주문"
옷은 많이들 사는 거 보고 사서 만족합니다 생각보다 엄청 쿨 원단은 아니고 반반 정도 되는 거 같아요 오버 피트인데 어깨 쪽보다 길이가 길어요,"만족하다, 아니다, 살다, 길이, 사서, 원단, 오버"
옷 길이가 길게 나온 거 같고 여름 옷치고 원단이 그리 얇은 것 같진 않네요,"원단, 길이, 여름, 그리다, 길다, 나오다, 얇다"
무난하고 질 좋은 티셔츠였습니다 배송도 빨리 왔고요 온 버핏으로 연출되는 크기였습니다 흰색은 깔끔한 흰색이었어요,"무난, 흰색, 배송, 흰색, 티셔츠, 크기, 오다, 연출"
합리적인 금액으로 질 좋은 티셔츠 장 구매했습니다,"합리, 티셔츠, 금액"
커벗 낫은 제가 자주 입는 브랜드 중 하나인데 면 질감도 아주 좋고 옷길이도 아주 좋습니다 자주 애용할게요,"애용, 하나, 질감, 브랜드, 크다 벗"
착용감이 딱 좋고 재질도 좋습니다 무게는 가벼운 편이며 로고도 참 이쁘네요 가격도 너무 좋고 입고 다니기 딱이에요,"착용, 가격, 무게, 가볍다, 편이, 재질, 로고"
막 입으려고 샀어요 안 비치고 부드러워서 만만하게 입어요,"만만하다, 비치, 부드럽다"
개인데 저렴하고 아주 좋습니다 역시 커버나 편해요,"편하다, 저렴하다, 개, 커버"
고등학생 아들 입으려고 구입했늣데 편해서 두 색상 번갈아가면서 잘 입어요,"고등학생, 편하다, 번갈아 가면, 색상, 아들, 했늣"
블랙 화이트 기본 색상이라 좋고 착용감도 편해서 마음에 들어요,"색상, 착용 감다, 편하다, 화이트, 블랙, 기본"
배송이 아주 빠르고 기본 템이어서 그런지 어떤 코디든 무난해요,"무난, 배송, 그렇다, 코디, 기본, 어떻다, 빠르다"
역시 쿨 코튼은 커버 낯이 만족스럽니다 사이즈도 좋고,"만족스럽다, 코튼, 사이즈, 커버, 낯"
기본 반팔 티는 커버 낯이 최고인 듯 그냥 막 입어도 괜찮음,"커버, 팔, 기본, 최고, 낯, 그냥, 티"
남편이랑 같이 입는데 둘디 잘 맞고 좋아요 재질이 시원함당,"남편, 시원하다, 재질, 두다, 맞다"
너무너무 시원한 소재예요 이너로도 단독으로도 편하게 입기 최고인듯합니다,"시원하다, 단독, 편하다, 최고, 소재"
기본 템으로 너무 좋고 커버나 퀄리티는 역시 최고에 오,"퀄리티, 커버, 기본, 최고"
저렴한 가격에 잘 샀어요 그냥 편하게 입고 다니기 좋아요,"저렴하다, 편하다, 가격, 그냥"
기본 반팔 티로 입으려고 샀는데 딱이에요 편하게 입고 다녀요,"편하다, 팔, 기본, 티, 딱이다"
기본 면친데 면도 톡톡하니 좋고 배송도 빠르고 가격도 저렴하고 막 입기 좋은 옷이에요,"치다, 면도, 배송, 저렴하다, 가격, 톡톡하다, 기본"
중학생 남아 s사이즈 사주고 만족해서 고등학생 딸 주려고 xs 구매했어요 기본 반팔인데 면도 톡톡하니 좋고 만족스럽네요,"고등학생, 중학생, 만족하다, 만족스럽다, 사이즈, 사주다, 팔, 톡톡하다, 려고"
출퇴근용으로 딱이에요 잘 쓰고 다닐게요 감사합니다,"쓰다, 출퇴근, 딱이다"
무더운 여름에 반바지에 코디해서 입으면 기본 티로는 최고입니다,"코디, 반바지, 무덥다, 여름, 티, 기본, 최고"
딱 맞는 사이즈에 빠르게 배송 와서 너무 좋습니다,"사이즈, 오다, 배송, 빠르다, 맞다"
그냥 흰색 검은샏 기본 티여서 휘뚜루마뚜루 입기 좋아요,"흰색, 티, 기본, 그냥, 검은샏"
면 질감이 부드럽고 두껍지 않아요 여름에 입기 딱 좋습니다,"부드럽다, 여름, 질감, 두껍다"
안녕하세요 벌써 올여름만 몇 번째 구입인지 모를 만큼 여러 벌 구입해 줬습니다 아들이 대만족이라고 합니다 잘 입고 다녀요 또 구매할게요,"안녕하다, 벌써, 만족, 아들, 올여름"
이 가격에 두 장이면 무조건 구매해해야 함 받자마자 입어보고 바로 만족,"입어보다, 무조건, 만족, 가격, 받다, 해해"
옷 질도 좋네요 사구려 제품 같지 않네요 잘 입을 것 같아요,"질도, 구려, 제품"
베이직한 티셔츠는 어느 곳에나 코디하기 딱이에요 옷감도 괜찮고 여름에 부담 없이 입기 좋아요,"베이직, 티셔츠, 코디, 여름, 옷감, 딱이다"
여윽시 믿고 보는 티셔츠 렛츠고 더운 여름에 찰떡,"여름, 여윽시, 티셔츠, 덥다, 찰떡, 믿다, 렛츠고"
깔끔하고 무난한 티셔츠 그냥 반바지랑 입어도 되고 셋업 슈트랑 입기도 좋습니다,"슈트, 티셔츠, 반바지, 무난, 셋업, 깔끔하다"
입을 거 없을 때 입으려고 샀는데 몇 개 더 사서 잘 입고 있어요,"사서, 없다"
남녀 공용이라 xs랑 s 중 엄청 고민하다가 xs로 샀는데 기장감이나 핏은 젤 예쁜 사이즈 같아요 제 키에 엉덩이 반쯤까지 오고 딱 정에 핏으로 입을 수 있습니다 조금 더 온 버핏을 원한다면 s 샀으면 됐을 거 같아요 화이트 블랙 둘 다 이쁘고 깔끔하네요,"엉덩이, 공용, 사이즈, 고민, 기장감, 원하다, 정"
깔끔하고 핏도 이쁘고 좋아요 소재도 좋고 가볍게 입기 딱 좋아요,"가볍다, 소재, 핏, 깔끔하다"
배송 빠르고 상품도 사이즈 잘 맞습니다 좋아요 샘 김도 너무 좋네요,"상품, 배송, 사이즈, 김, 빠르다, 맞다"
사이즈고 맞고 가성비도 좋아서 괜찮아요 묻어도 잘 지워저욤,"지우다 욤, 가성비, 사이즈, 묻다, 맞다"
티셔츠가 필요해서 흰색 검은색 pack 구매했는데 조금 얇긴 한 대 저렴한 가격에 구매해서 좋아요 재질도 시원합니다 데일리로 좋아요,"필요하다, 티셔츠, 검은색, 가격, 데일리, 흰색, 재질, 저렴하다"
목 부분이 두꺼워서 조금 답답하고 빨래하면 마르기까지 좀 오래 걸리긴 한데 그래도 무난 무난하게 여름에 매일 잘 입고 있어요 배송도 비닐팩에 예쁘게 잘 오고 좋아요 사이즈는 엉덩이 다 덮어서 조금 크긴 해요,"무난, 사이즈, 매일, 엉덩이, 무난, 비닐 팩, 걸리다, 답답하다"
가성비 갑 두 장 줘서 너무 좋고 옷 두께나 마감도 좋아요,"마감, 가성비, 주다, 두께"
얇아서 여름에 입기 좋고 신축성 역시 좋아유 가성비 좋은 거 같습니다,"신축, 가성비, 여름, 아유, 얇다"
기본 티가 필요해서 구매했는데 딱 좋네요 재구매율 높은 이유가 있어요,"필요하다, 재다 율, 이유, 기본, 티, 높다"
버뮤다에 신을 양말 구매해 봤는데 쫀쫀하고 좋아요,"버뮤다, 신, 쫀쫀, 양말"
원단이 진자 시원하고 좋아요 다음 여름에 또 사려고요,"시원하다, 원단, 여름, 진자"
완전제가 찾던 핏이랑 옷감도 좋아요 지금 날씨에 입어도 달라붙는 그런 것도 아니라 최고 인생이 찾음,"인생, 날씨, 그렇다, 아니다, 핏, 최고, 찾다"
정말 예쁘고 가성비가 정말 좋네요 다음에 또 살 것 같아요,가성비
편하게 입기 좋고 한 번 빨면 재질이 달라지는 느낌이 드는데 크게 신경 쓸 정도는 아니에요,"아니다, 달라지다, 신경, 재질, 편하다, 크게"
배송 빠르지도 않고 느리지도 않고 평균적인 배송일정에 맞게 온 거 같습디 사이즈 기본 티로 입기에는 너무 좋고 만족합니다 그 외에는 색감 재질 면에서도 기본으로 입기에는 무난하며 흰색 무지 티를 제외하고는 제일 편하게 입을 수 있어 거 같습니다,"만족하다, 무난, 평균, 무지, 사이즈, 배송 일정, 흰색"
재질이 좋고 딱 알맞은 핏으로 편하게 입기 좋네요,"편하다, 재질, 핏, 알맞다"
일단 재질이 너무 부드럽고 편하게 입을 수 있어요,"부드럽다, 편하다, 재질"
무난하게 딱 입을 수 있는 티고 마감도 꼼꼼해서 좋아요,"마감, 무난, 티, 꼼꼼하다"
늦게 구매하는 바람에 흰 거 두 장 실패 어쨌건 매번 사는 커버나 포장여윽시 훌륭쓰 휘뚜루마뚜루 입기 좋슴미,"훌륭쓰, 포장 윽시, 실패, 커버, 바람, 살다, 좋슴미"
이뻐요 제 키에는 살짝 크기는 하지만 잘 입겠습니다 완전 여름 재질에 통풍도 잘 돼서 자주 입을 것 같아요 세일 따 사길 잘했어요,"크기, 키, 재질, 통풍, 세일"
나의 교복 이 옷 저 옷 코디하기 편하고 예쁨 굿깔별로 주문했음,"코디, 편하다, 교복, 주문, 굿 깔별"
후기 내용은 제 체격에 L도 클 것 같았는데 고민하다가 원래 사이즈 XL로 샀어요 생각보다 안 커서 오버 피인 줄 모르겠네요,"내용, 커서, 사이즈, 고민, 오버, 원래, 체격"
기본 티로 이거만 한 게 없습니다 아이 볼 때 입으면 안심돼요,"거만, 기본, 티, 없다, 안심 돼다"
한 달 정도 입었는데 원단이 좋아요 길이감도 적당하고요,"적당하다, 길이감, 원단"
최고네요 항상 커버나 구매하지만 좋네요 다음에 또 구매할게요,"항상, 커버, 최고"
반팔 티 여러 개 필요해서 구매했는데 저렴하고 좋아요,"필요하다, 저렴하다, 여러, 팔"
너무 편하게 입을 수 있어서 좋아요 집에서도 밖에 나갈 때도 무난하게 입을 수 있어요,"집, 편하다, 무난"
번째 구매하는 여름 기본 템입니다 뭔가 더 얇아진 것 같기도 하고 시원하네요,"시원하다, 뭔가, 기본, 여름, 얇다"
가성비가 좋아서 자주 사게 되네요 옷도 얇고 시원해요,"시원하다, 가성비, 얇다"
깔끔하고 무난해서 좋아요 기본 티로습니다 굿 잡,"티 습니, 무난, 기본, 깔끔하다"
티셔츠에 항상 탑 순위여서 옷 뭐 살까 하다가 사봤는데 색도 선명하고 휘뚜루마뚜루 입고 다니기 좋네요,"선명하다, 항상, 티셔츠, 색도, 순위"
배송도 밀리지 않고 재질도 저는 마음에 들어서 좋습니다,"들어서다, 밀리, 재질, 배송"
여름에 시원하게 입기 좋겠어요 사이즈도 좋고 기본 템입니다,"시원하다, 사이즈, 여름, 기본"
배송 빠르고 좋았어요 요즘 같은 날씨에 입기 딱 좋아요 그런데 흰색 티는 너무 비쳐서 입기가 조금 힘들 수도 있어요,"날씨, 비치다, 배송, 힘들다"
깔끔하고 사이즈도 좋아요 기본 티로 정말 잘 샀다는 생각이 들어요,"사이즈, 기본, 티, 깔끔하다"
기본 티로 완전 잘 입고 있어요 아마 계속 재구매할 듯,"재다, 아마, 기본, 계속, 티"
저렴한 가격에 품질이 좋네요 만족합니다 추천합니다,"만족하다, 추천, 저렴하다, 품질, 가격"
디자인이 깔끔하고 배송도 빨라서 매우 만족스럽습니다,"만족스럽다, 디자인, 배송, 깔끔하다"
어깨선과 핏 모두 아주 만족스럽습니다 딱 맞아서 좋아요,"만족스럽다, 어깨 선, 맞다"
배송 빠르게 왔습니다 재질과 사이즈도 만족합니다,"만족하다, 사이즈, 재질, 배송, 오다, 빠르다"
탄탄하면서도 동시에 시원한 소재라 여름에 입기 좋습니다 동네 갈 때나 운동할 때 입기 좋을 것 같습니다 예뻐요,"탄탄하다, 동시, 운동, 시원하다, 소재, 동네, 여름"
데일리로 편하게 입기 좋아요 디자인도 예뻐서 만족합니다,"만족하다, 디자인, 데일리, 편하다"
커버나 화이트 블랙 두 개 구매했는데 옷이 너무 이뻐요 역시 커버나,"커버, 블랙, 화이트"
두해 입고 또 새로 구매했어요 편하게 입는 티셔츠예요,"편하다, 새롭다, 티셔츠"
너무 좋아서 번째 구매하는 사람이에요 막 입기 좋아요,사람
원단은 좋은데 얇아서 살짝 비치니 옷 안에 입기를 추천합니다,"추천, 원단, 비치다, 얇다"
사진과 동일하고 착용감 좋아요 색상하고 디자인이 무난하고 예쁘게 나와서 기존 옷하고 매칭이 잘 돼요,"색상, 동일하다, 매칭, 사진, 무난, 디자인, 나오다, 착용, 기존"
재작년에 똑같은 거 사서 잘 입었는데 아무래도 여름 옷이라 몇 번 빨고 입고하다 보니 색이 좀 노래져서 새로 구입했습니다 늘어짐도 없고 적당한 두께라 만족합니다 약간 찰랑한 느낌 나는 소재인데 두께가 너무 얇으면 또 보기 싫은데 아주 적당해요,"만족하다, 적당하다, 재작년, 적당하다, 노랗다, 색, 소재, 늘어지다"
배송도 빨리 왔고 상품도 마음에 들어요 잘 입겠습니다,"배송, 상품, 오다"
커버 낮은 사랑입니다 믿고 사죠 핏도 좋고 세탁해도 안 줄어들어서 좋아요,"줄어들다, 사랑, 세탁, 커버, 핏, 믿다, 낮다"
여름에 땀 많이 나는데 땀 흡수도 잘하고 세탁해도 목 안 늘어나요 작업복으로 잘 입고 있어요 강추,"작업복, 세탁, 늘어나다, 강추, 흡수, 여름, 나다"
두 개인데 가격이 싸고 재질도 좋아요 아무 때나 무난하게 입을 수 있어서 가성비 템으로 추천드려요,"추천 드리다, 가성비, 무난, 가격, 개, 재질, 싸다"
너무 면 시원하고 좋아요 동생 사줬더니 엄청 좋아하네요,"동생, 시원하다, 사주다, 좋아하다"
여름에 정말 시원하고 옷 자체가 그냥 이쁩니다 잘 입고 있음,"시원하다, 자체, 여름, 그냥"
빠른 배송 감사합니다 친구한테 추천받았는데 굿,"친구, 배송, 추천 받다, 빠르다"
실제로 보면 생각보다 얇아요 근데 팔뚝이랑 여기저기 커버돼서 매일매일 입고 싶어요 옷 너무 이쁘고 블랙도 사고 싶어요 나키랑 아스 티도 있는데 핏은 나키랑 비슷한데 얘가 더 얇아요 통기성 좋고 앞으로 잘 입고 다닐게 융,"여기저기, 통 기성, 나키, 매일, 실제, 블랙"
요즘 휘뚜루마뚜루 빨래도 금방 마르고 목부분도 탄탄 재구매 의사 있습니다,"목 부분, 금방, 마르고, 재다, 의사, 탄탄, 빨래"
엑스스몰 사이즈 넉넉히 잘 맞습니다 재질도 부드럽고 얇지 않아 비치지 않아서 가격 대비 만족합니다,"만족하다, 넉넉하다, 사이즈, 재질, 엑스 스몰, 부드럽다, 비치, 가격, 대비, 얇다"
깔끔하고 핏이 잘 맞아요 사이즈도 생각했던 대로 정 사이즈입니다 상의 무게도 가벼워서 착용감이 좋습니다,"사이즈, 사이즈, 착용, 가볍다, 상의, 무게, 대로, 핏"
마감도 훌륭하고 핏도 너무 마음에 드네요 자주 활용 예정입니다,"훌륭하다, 마감, 활용, 핏, 예정"
배송이 무척 빠르고 여름 내내 휘뚜루마뚜루 입기 편해서 좋아요,"배송, 편하다, 무척, 여름, 빠르다, 내내"
여기저기 활용하기 좋아 갖춰 놓아야 할 말 그대로 딱 기본 티입니다,"여기저기, 티, 활용, 기본, 그대로, 놓다, 갖추다"
생각보다 질이 좋고요 아주 편하고 잘 입을 수 있겠어요,"편하다, 질"
부드럽습니다 피트 도 잘 맞고 단벌로 입어도 좋을 것 같습니다,"부드럽다, 단벌, 피트, 맞다"
깔끔하고 예뻐요 시원한 소재라서 여름에 입기 좋아요,"소재, 시원하다, 여름, 깔끔하다"
깔끔하고 핏이 잘 맞아요 사이즈도 생각했던 대로 정 사이즈입니다 바지 무게도 가벼워서 착용감이 좋습니다,"사이즈, 사이즈, 착용, 가볍다, 바지, 무게, 대로, 핏"
정말 예뻐요 싸게 사서 정말 좋아요 가성비가 정말 좋네요,"가성비, 사서, 싸다"
몇 년 전 구매하고 재구매인데 역시나 기대만큼 좋습니다,"기대, 재"
기본에 충실한 반팔입니다 가벼운 외출용으로 너무 좋을 것 같아요,"충실하다, 팔, 기본, 가볍다, 외출"
이 티셔츠가 되게 가성비 좋다는 얘기를 들어서 구매했습니다 휘뚜루마뚜루 입을 수 있고 사이즈도 넉넉해서 편하게 입을 수 있습니다 재질도 좋아하는 재질이라서 만족하고 가격 대비 좋은 여름 티셔츠 같아요,"티셔츠, 재질, 티셔츠, 가성비, 만족하다, 넉넉하다, 사이즈, 편하다, 재질"
편하고 길이감도 좋아요 자주 입을 것 같아요 색상 두 가지다 마음에 듭니다,"길이감, 색상, 편하다, 가지"
세탁해도 잘 변형 안되고 흰색은 비침 당연히 있긴 한데 그렇게 신경 쓰일 정도 아닙니다 좋아요 사세요 후회는 안 합니다,"아니다, 당연하다, 신경, 흰색, 변형, 세탁"
디자인도 이쁘고 깔끔한 색상에 합리적인 가격 세탁 후 변형도 없어 좋아요 배송도 빠르고요 색상도 맘에 들어요,"변형도, 색상, 색상, 합리, 배송, 디자인, 가격, 세탁"
아이를 사줬는데 재질도 좋고 스타일도 이쁘고 품도 맘에 들어 재주문하였습니다 너무너무 맘에 들어요,"스타일, 재질, 품다, 재주 물다"
학원 갈 때 입기 좋은 것 같고 너무 편해요 다음에도 이런 제품이 나온다면 다시 살 것 같아요,"나오다, 이렇다, 편하다, 다시, 제품, 학원"
가격 대비 좋아요 평소 입고 l 주문했더니 조금 세미 오버로 입을만해요,"만해, 평소, 오버, 가격, 대비, 세미, 주문"
좋은 가격에 좋은 퀄리티에요 너무 잘 산 거 같아요,"퀄리티, 가격"
저렴하게 잘 구매했습니다 소재 때문에 여름에도 시원하네요 흰색은 살짝 비쳐요,"저렴하다, 비치다, 시원하다, 여름, 흰색, 소재, 때문"
배송도 빠르고 포장도 잘되어 배송 되었어요 더위를 잘 타는 신랑 괜찮다고 다행히 잘 입고 다녀요 만족한다네요,"만족하다, 다행하다, 배송, 포장, 배송, 신랑, 되어다"
두께도 적당하고 여름에 입기 시원하고 가성비도 너무 좋습니다,"적당하다, 가성비, 시원하다, 여름, 두께"
여름에 매번 사이즈 업해서 재구매합니다 중학생 아들 여름에 편하기 입기 좋네요,"업, 중학생, 편하다, 재다, 사이즈, 여름, 아들"
그냥 아무렇게나 입기에는 최고인 느낌이어서 좋음,"최고, 아무렇다, 그냥"
중학생 딸아이 잘 입고 다니네요 편하게 막입기 좋아요 만족합니다,"만족하다, 중학생, 막, 편하다, 딸아이"
재질도 쫀쫀하고 박음질도 튼튼해요 이너로 입어도 엄청 좋네요 여름에 잘 입고 다닐 것 같습니다,"튼튼하다, 박음질, 재질, 이너, 여름, 쫀쫀"
재질도 쫀쫀하고 박음질도 튼튼해요 엄청 좋네요 여름에 잘 입고 다닐 것 같습니다,"튼튼하다, 박음질, 재질, 여름, 쫀쫀"
년 전 구매한 옷 아직도 입는데 좋아서 또 샀어요,
색감 화면과 같고 여름에 시원하게 입을 수 있어요,"시원하다, 화면, 색감, 여름"
너무 편하기도 하고 가격도 좋고 전부다 만족합니다,"만족하다, 편하다, 가격"
역시 믿고 사는 커버나 자주 애용합니다 다음에도 살 거여요,"애용, 거여, 살다, 커버, 믿다"
깔끔해 보이고 편하게 입기 좋아요 사이즈도 딱 맞아요,"사이즈, 보이, 편하다, 맞다, 깔끔하다"
레이어드하기 좋아요 이거 하나만 입기엔 좀 얇은 느낌,"레이어드, 하나, 얇다"
굳 배송도 빨랐고 여름 재질이라 그런지 다른 잔 팔고 다 얇고 시원해요,"그렇다, 재질, 시원하다, 배송, 팔고, 여름, 얇다, 빠르다"
사이즈는 xs로 샀고 세탁 후 변형도 없고 쿨 재질이라 시원하고 화면과 같아요 배송도 빨리 왔어요,"시원하다, 변형도, 재질, 배송, 사이즈, 오다, 없다"
사이즈 넉넉하니 좋아요 흰색 검은색 돌려가며 잘 입을게요,"돌리다, 검은색, 사이즈, 넉넉하다, 흰색"
핏이 너무 좋고요 일단 냉감이 확실해요 굴재질이라 너무 부드럽고 스판도 좋아요 가성비 좋은 티셔츠입니다 운동이나 일상복에도 잘 어울려요 재구매 예정,"운동, 티셔츠, 냉감, 어울리다, 굴 재질, 일상복, 가성비, 확실하다"
무난하고 괜춘햐요 다른 티 보다 얇은 것 같기도 하고,"무난, 얇다, 괜춘햐"
사이즈 크다고 해서 M으로 사니까 딱 맞네요 흰색은 살짝 비침에,"비침, 흰색, 크다, 사이즈, 사, 맞다"
상의 입는데 xs 잘 맞아요 온 버핏으로 입기 싫은데 크다고 해서 골랐더니 좋네요,"상의, 크다, 싫다, 버핏, 맞다"
상의 입는데 xs 잘 맞아요 온 버핏으로 입기 싫은데 크다고 해서 골랐더니 좋네요,"상의, 크다, 싫다, 버핏, 맞다"
가성비 갑입니다 꼭 사세요 데일리로 좋음요 귣굳,"가성비, 데일리, 갑, 귣굳"
두께가 얇아서 흰색 같은 경우는 비침이 있어요 기본 티로 입기 좋음,"경우, 흰색, 비침, 기본, 티, 얇다, 두께"
할인하고 있고 두벌이 와서 평소에 입기 좋습니다,"평소, 할인, 벌이, 오다"
생각보다 얇아서 비침이 있습니다 대신 얇아서 시원해요,"시원하다, 비침, 대신, 얇다"
믿고 입는 커버나 짱 재질 시원하고 여름에 막 입기 좋아요 흰옷 노래지고 검은 옷 색 바래지면 또 사야지,"지면, 노랗다, 시원하다, 재질, 커버, 검다, 여름"
배송 진짜 빨라요 디자인도 깔끔합니다 완전 잘 맞아요,"디자인, 배송, 맞다, 깔끔하다, 빠르다"
