Review,Keyword
면 질감이 부드럽고 두껍지 않아 요 여름에 입 기 딱 좋습니다,"여름, 질감, 두껍다"
안녕하세요 벌써 올 여름만 몇 번째 구입인지 모를 만큼 여러 벌 구입해 줫습니다 아들이 대 만족이라고 합니다 잘 입고 다녀 요 또 구매할게요,"올여름, 벌써, 대만족, 여러벌, 몇번째"
이 가격에 두장이면 무조건 구매야 함 받자마자 입어보고 바로 만족,"장이, 받다, 무조건, 만족, 가격, 입어보다"
옷 질도 좋네요 사 구려 제품 같지 않네요 잘 입을 것 같아요,"제품, 사구려, 질"
베이직한 티셔츠는 어느 곳에나 코디하기 딱이에 요 옷감도 괜찮고 여름에 부담 없이 입기 좋아요,"코디, 옷감, 여름, 티셔츠, 베이직"
여윽시 믿고 보는 티셔츠 렛츠 고 더운 여름에 찰떡,"여윽시, 믿다, 찰떡"
깔끔하고 무난한 티셔츠 그냥 반 바지랑 입어도 되고 셋업수트랑 입기도 좋습니다,"깔다끄다, 반바지, 셋업수트"
입을 거 없을 때 입으려고 샀는데 몇 개 더 사서 잘 입고 있어요,
남녀 공용이라 랑 중 엄청 고민하다가 로 샀는데 기장감이나 핏은 젤 예쁜 사이즈 같아 요 제 키에 엉덩이 반쯤까지 오고 딱 정핏으로 입을 수 있습니다 조금 더 오버핏을 원한다면 샀으면 됐을 거 같아 용 화이트 블랙 둘 다 이쁘고 깔끔하네요,"남녀공용, 화이트, s, xs, 블랙, 핏, 깔다끄다, 오버핏, 기장감, 정핏"
깔끔하구 핏도 이 쁘고 좋아요 소재도 좋고 가볍게 입 기 딱 좋아요,"가볍다, 소재, 깔다끄다, 핏"
배송 빠르구 상품도 사이즈 잘 맞습니다 좋아요 샘감도 너무 좋네요,"샘감다, 사이즈, 상품, 배송빠르다, 잘맞다"
사이즈 고 맞고 가성비도 좋아서 괜찮아요 묻어도 잘 지워저욤,"사이즈, 묻다, 지우다, 가성비"
티셔츠가 필요해서 흰색 검정색 구매했는데 조금 얇긴 한 대 저렴한 가격에 구매해서 좋아요 재질도 시원합니다 데일리로 조아요,"시원, 흰색, 티셔츠, 데일리, pack, 검정색"
목 부분이 두꺼워서 조금 하고 빨래하면 마르기까지 좀 오래 걸리긴 한데 그래도 무난무난하게 여름에 매일 잘 입고 있어요 배송도 비닐팩에 예쁘게 잘 오고 좋아 욤 사이즈는 엉덩이 다 덮어서 조금 크긴 해요,"엉덩이, 크다, 여름, 덮어서, 좋아욤, 두껍다, 목, 사이즈, 배송, 마르다, 매일, 빨래, 비닐팩"
가성비 갑 두 장 줘서 너무 좋고 옷 두께나 마감도 좋아요,"두께, 마감, 가성비"
얇아서 여름에 입 기 좋고 신축성 역시 좋아 유 가성비 좋은 거 같습니당,"니당다, 얇다, 여름, 신축성, 가성비"
기본 티가 필요해서 구매했는데 딱 좋네요 재구매율 높은 이유가 있어요,"기본티, 재다율"
버뮤다에 신을 양말 구매해봤는데 하고 조아요,"쫀쫀, 양말, 신, 조아, 버뮤다"
원단이 진자 시원하고 좋아용 다음 여름에 또 사려구요,"원단, 시원, 여름"
완전제가 찾던 핏이랑 옷감도 좋아 여 지금 날씨에 입어도 달라붙는 그런 것도 아니라 최고 인생티찾음,"최고, 옷감, 찾다, 인생티찾다, 핏, 달라붙다"
정말 예쁘고 가성비가 정말 좋네요 다음에 또 살 것 같아요,"살, 가성비"
편하게 입 기 좋고 한 번 빨면 재질이 달라지는 느낌이 드는데 크게 신경 쓸 정도는 아니에요,"편하다, 번, 재질, 크게"
배송 빠르지도 않고 느리지도 않고 평균적인 배송 일정에 맞게 온 거 같습디 사이즈 기본 티로 입기에는 너무 좋고 만족합니다 그 외 에는 색감 재질 면에서도 기본으로 입기에는 무난하며 흰색 무지티를 제외하고는 제일 편하게 입을 수 있으거 같습니다,"색감, 무지티, 재질, 사이즈, 배송"
재질이 좋고 딱 알맞은 핏으로 편하게 입기 좋네요,"재질, 핏"
일단 재질이 너무 부드럽고 편하게 입을 수 있어요,"편하다, 재질"
무난하게 딱 입을 수 있는 티고 마감도 해서 좋아요,"꼼꼼, 마감"
늦게 구매하는 바람에 흰 거 두 장 실패 어쨋건 매번 사는 커버낫 포장여윽시 훌륭쓰 휘뚜루 마 뚜루 입기 좋슴미,"희다, 늦다, 포장, 휘뚜루마뚜루"
이 뻐요 제 키에는 살짝 크기는 하지만 잘 입겠습니 당 완전 여름 재질에 통풍도 잘 되서 자주 입을 것 같아 요 세일 따 사 길 잘했어요,"통풍, 여름, 키, 세일, 크기"
나의 교복 이 옷 저 옷 코디하기 편하고 예쁨 굿깔별로 주문했음,"코디, 교복, 굿깔다별로"
후기 내용은 제 체격에 도 클 것 같았는데 고민하다가 원래 사이즈로 샀어요 생각보다 안 커서 오버핏인 줄 모르겠네요,"사이즈, 오버핏, 체격"
기본 티로 이 거만한 게 없습니다 아이 볼 때 입으면 안심되요,"안심, 기본티"
한 달 정도 입엇는데 원단이 좋아요 길이 감도 적당하구요,"원단, 길이감"
쵝오네요 항상 커버낫 구매하지만 좋네요 다음에 또 구매할게요,"쵝오, 커버낫, 항상"
반팔티 여러 개 필요해서 구매했는데 저렴하고 좋아요,"팔티, 저렴"
너무 편하게 입을 수 있어서 좋아요 집에서도 밖에 나갈 때도 무난하게 입을 수 있어요,"편하다, 집에서도, 밖에나갈다"
번째 구매하는 여름 기본 템입니다 뭔가 더 얇아진 것 같기도 하고 시원하네요,"여름, 얇다, 기본, 시원하다"
가성비가 좋아서 자주 사게 되네요 옷도 얇고 시원해요,"시원, 가성비"
깔끔하고 무난해서 좋아요 기본티로 습니다 굿잡,"깔다끄다, 굿잡, 기본티"
티셔츠에 항상 탑 순위여서 옷 뭐 살까 하다가 사봤는데 색도 선명하고 휘뚜루마 뚜루 입고 다니기 좋네요,"색, 티셔츠, 휘뚜루마뚜루"
배송도 밀리지 않고 재질도 저는 마음에 들어서 좋습니다,"배송, 재질"
여름에 시원하게 입 기 좋겠어요 사이즈도 좋고 기 본 템입니다,"여름, 시원, 기본, 사이즈"
배송 빠르고 좋았어요 요즘 같은 날씨에 입 기 딱 좋아요 그런데 흰색 티는 너무 비쳐서 입기가 조금 힘들 수도 있어요,"날씨, 흰색티, 힘들다, 배송, 비치, 빠르다"
깔끔하고 사이즈도 좋아요 기본티로 정말 잘 샀다는 생각이 들어요,"사이즈, 깔다끄다, 기본티"
기본 티로 완전 잘 입고 있어 용 아마 계속 재구매할 듯,"재다, 기본티"
저렴한 가격에 품질이 좋네요 만족합니다 추천합니다,"만족, 저렴하다, 가격, 추천, 품질"
디자인이 깔끔하고 배송도 빨라서 매우 만족스럽습니다,"디자인, 만족스럽다, 라서, 배송, 깔끔하다"
어깨선과 핏 모두 아주 만족스럽습니다 딱 맞아서 좋아요,"어깨선, 핏"
배송 빠르게 왔습니다 재질과 사이즈도 만족 합니다,"배송빠르다, 사이즈, 재질"
하면서도 동시에 시원한 소재라 여름에 입 기 좋습니다 동네 갈 때나 운동할 때 입기 좋을 것 같습니다 예뻐용,"시원, 여름, 소재, 동네, 운동, 탄탄"
데일리로 편하게 입 기 좋아요 디자인도 예뻐서 만족합니다,"디자인, 데일리, 만족"
커버낫 화이트 블랙 두 개 구매했는데 옷이 너무 이 뻐요 역시 커버낫,"커버낫, 화이트블랙"
두 해 입고 또 새로 구매했어요 편하게 입는 티셔츠예요,"편하다, 티셔츠"
너무 좋아서 번째 구매하는 사람이에요 막 입 기 좋아요,"막, 2번째"
원단은 좋은데 얇아서 살짝 비치니 옷 안에 입기를 추천합니다,"원단, 얇다, 비치"
사진과 동일하고 착용 감 좋아요 색상하고 디자인이 무난하고 예쁘게 나와서 기존 옷하고 매칭이 잘 돼요,"착용, 색상, 디자인, 사진, 기존, 매칭"
재작년에 똑같은 거 사서 잘 입었는데 아무래도 여름 옷이라 몇 번 빨고 입고 하다 보니 색이 좀 누래 져서 새로 구입했습니다 늘어짐도 없고 적당한 두께라 만족합니다 약간 찰랑한 느낌나는 소재인데 두께가 너무 얇으면 또 보기 싫은 데 아주 적당해요,"색, 여름, 소재, 찰랑, 두께"
배송도 빨리 왔고 상품도 마음에 들어 요 잘 입겠습니다,"배송, 상품"
커버낫은 사랑입니다 믿고 사죠 핏도 좋고 세탁해도 안 줄어들어서 조아염,"세탁, 핏, 사랑"
여름에 땀 많이 나는데 땀 흡수도 잘하고 세탁해도 목 안 늘어나 요 작업복으로 잘 입고 있어요 강추,"여름, 강추, 흡수, 목, 땀, 세탁, 작업복"
두 개인데 가격이 싸고 재질도 좋아요 아무 때나 무난하게 입을 수 있어서 가성비템으로 추천드려요,"가격, 재질, 가성비"
넘 면 시원하고 좋아 여 동생 사줬더니 엄청 좋아하네요,"시원, 동생, 사주다, 넘다"
여름에 완전 시원하고 옷 자체가 그냥 이쁩니다 잘 입고 있음,"여름, 시원"
빠른 배송 감사합니다 친구한테 추천 받았는데 굿,"빠르다배송, 친구, 추천"
실제로 보면 생각보다 얇야 요 근데 팔뚝이랑 여기저기 커버돼서 매일매일 입고 싶어요 옷 너무 이 쁘고 블랙도 사고 싶어요 나 키랑 아스 티도 있는데 핏은 나 키랑 비슷한데 얘가 더 얇아용 통기성 좋구 앞으로 잘 입고 다닐 게 융,"통기성, 나키, 블랙"
요즘 휘뚜루 마 뚜루 빨래도 금방 마르고 목 부분도 재구매 의사 있습니당,"마르고, 재다의사, 목부분, 빨래, 탄탄"
엑몰 사이즈 히 잘 맞습니다 재질도 부드럽고 얇지 않아 비치지 않아서 가격 대비 만족합니다,"얇다, 넉넉하다, 엑스스몰, 가격, 재질, 비치지, 사이즈, 부드럽다, 만족하다"
깔끔하고 핏이 잘 맞아요 사이즈도 생각했던 대로 정 사이즈 입니다 상의 무게도 가 벼워서 착용감이 좋습니다,"착용, 무게, 핏, 사이즈, 깔다끄다"
마감도 훌륭하고 핏도 너무 마음에 드네요 자주 활용 예정입니다,"마감, 핏"
배송이 무척 빠르고 여름 휘뚜루 마 뚜루 입 기 편해서 좋아요,"편, 배송, 휘뚜루마뚜루, 여름내내"
여기저기 활용하기 좋아 갖춰 놓아야 할 말 그대로 딱 기 본티입니다,"말그대로, 놓다, 기본티, 여기저기, 활용, 갖추다"
생각보다 질이 좋구요 아주 편하구 잘 입을 수 있겠어요,"편, 질"
부드럽습니다 핏도 잘 맞고 단벌로 입어도 좋을 것 같습니다,"단벌, 부드럽다, 핏"
깔끔하고 예뻐요 시원한 소재라서 여름에 입 기 좋아요,"여름, 소재, 깔다끄다, 시원하다"
깔끔하고 핏이 잘 맞아요 사이즈도 생각했던 대로 정 사이즈 입니다 바지 무게도 가 벼워서 착용감이 좋습니다,"착용, 무게, 핏, 사이즈, 깔다끄다"
정말 예뻐요 싸게 사서 정말 좋아요 가성비가 정말 좋네요,"싸다사서, 가성비"
몇 년 전 구매하고 재구매인데 역시나 기 대만큼 좋습니다,"기대, 재다, 년전"
기본에 충실한 반팔입니다 가 벼운 외출용으로 너무 좋을 것 같아요,"가볍다, 기본, 팔, 외출"
이 티셔츠가 되게 가성비 좋다는 얘기를 들어서 구매했습니다 휘뚜루 마 뚜루 입을 수 있고 사이즈도 해서 편하게 입을 수 있습니다 재질도 좋아하는 재질이라서 만족하고 가격 대비 좋은 여름 티셔츠 같아 요,"여름, 재질, 사이즈, 가성비, 휘뚜루마뚜루"
편하고 길이 감도 좋아요 자주 입을 것 같아 요 색상 두 가지 다 마음에 듭니다,"편, 색상, 길이감"
세탁해도 잘 변형 안 되고 흰색은 비침 당연히 있긴 한데 그렇게 신경 쓰일 정도 아닙니다 좋아요 사세요 후회는 안합니다,"흰색, 신경, 비치, 세탁, 후회"
디자인도 이쁘고 깔끔한 색상에 합리적인 가격 세탁 후 변형도 없어 좋아요 배송도 빠르고 요 색상도 맘에 들어요,"변형, 색상, 디자인, 가격, 배송, 세탁"
아이를 사줬는데 재질도 좋고 스타일도 이쁘고 품도 맘에 들어 재주문하였습니다 느 므 느므 맘에 들어요,"품, 스타일, 재질"
학원 갈 때 입 기 좋은 것 같고 너무 편해요 다음에도 이런 제품이 나온다면 다시 살 것 같아용,"편하다, 제품, 학원, 다시, 살다"
가격 대비 좋아요 평소 입고 주문했더니 조금 세미오버로 입을 만해 요,"가격대비, 100, 세미오버, 평소, l주문, 만해"
좋은 가격에 좋은 퀄리티에 요 너무 잘 산 거 같아요,"퀄리티, 가격, 잘살다"
저렴하게 잘 구매했습니다 소재 때문에 여름에도 시원하네요 흰색은 살짝 비쳐요,"여름, 소재, 비치, 저렴하다"
배송도 빠르고 포장도 잘 되어 배송 되었어요 더위를 잘타는 신랑 괜찮다고 다행이 잘 입고 다녀요 만족 한다네요,"신랑, 다행, 만족, 포장, 배송"
두께도 적당하고 여름에 입 기 시원하고 가성비도 너무 좋습이다,"두께, 여름, 가성비"
여름에 매번 사이즈 업해서 재구매합니다 중학생 아들 여름에 편하기 입기 좋네요,"편하다, 사이즈, 여름"
그냥 아무렇게나 입기에는 최고인 느낌이여서 좋음,"최고, 아무렇다, 그냥"
중학생 딸 아이 잘 입고 다니네요 편하게 막 입기 좋아요 만족합니다,"편하다, 중학생, 딸, 막, 만족하다"
재질도 하고 박 음질도 해요 이너로 입어도 엄청 좋네요 여름에 잘 입고 다닐 것 같습니닷,"여름, 이너, 박음질, 재질"
재질도 하고 박 음질도 해요 엄청 좋네요 여름에 잘 입고 다닐 것 같습니닷,"여름, 박음질, 재질, 틀다틀다"
년 전 구매한 옷 아직도 입는데 좋아서 또 샀어요,"아직도, 3년전"
색감 화면과 같고 여름에 시원하게 입을 수 있어요,"여름, 시원, 색감, 화면"
너무 편하기도 하고 가격도 좋고 전부 다 만족합니다,"가격, 편, 만족"
역시 믿고 사는 커버낫 자주 애용합니다 다음에도 살 거야요,"애용, 커버낫, 살다"
깔끔해 보이고 편하게 입 기 좋아요 사이즈도 딱 맞아요,"편하다, 사이즈, 깔다끄다"
레이어드 하기 좋아요 이 거 하나만 입기엔 좀 얇은 느낌,"얇다, 레이어드"
굳 배송도 빨랐고 여름 제질이라 그런지 다른 잔팔보다 얇고 시원 해요,"시원, 여름, 굳다, 배송, 질"
사이즈는 로 샀고 세탁 후 변형도 없고 쿨 제질이라 시원하고 화면과 같아 요 배송도 빨리 왔어요,"시원, 변형, xs, 배송, 화면, 쿨"
사이즈 하니 좋아요 흰색 검은색 돌려가며 잘 입을께요,"검은색, 넉넉하다, 흰색, 돌리다, 사이즈"
핏이 너무 좋구요 일단 냉감이 확실해요 쿨 재질이라 너무 부드럽고 스판도 좋아요 가성비 좋은 티셔츠입니다 운동이나 일상복에도 잘 어울려 요 재구매 예정,"스판, 일상복, 재다예정, 냉감, 핏, 가성비, 쿨재질"
무난허고 괜춘햐요 다른 티보다 얇은 것 같가도 하고,"괜춘, 얇다, 티"
사이즈 크다고 해서 으로 사니까 딱 맞네요 흰색은 살짝 비침유,"크다, 흰색, 사이즈, 비치유, M"
상의 입는데 잘 맞아요 오버핏으로 입 기 싫은 데 크다고 해서 골랐더니 좋네요,"크다, 오버핏, xs, 상의"
상의 입는데 잘 맞아요 오버핏으로 입 기 싫은 데 크다고 해서 골랐더니 좋네요,"크다, 오버핏, xs, 상의"
가성비 갑입니다 꼭 사세요 데잉리로 좋음 여 귣 굳,"데잉리, 가성비, 귣굳"
두께가 얇아서 흰색 같은 경우는 비침이 있어요 기본티로 입 기 좋음,"흰색, 비치, 두께, 기본티"
할인하고 있고 두벌이 와서 평소에 입 기 좋습니다,"평소, 할인, 벌이"
생각보다 얇아서 비침이 있습니다 대신 얇아서 시원해요,"얇다, 시원하다"
믿고 입는 커버낫 짱 재질 시원하고 여름에 막 입 기 좋아요 흰 옷 누래지 고 검은 옷 색 바래지면 또 사야지,"희다, 여름, 재질, 커버낫, 검다"
배송 진짜 빨라요 디자인도 깔끔합니다 완전 잘 맞아요,"배송, 디자인"
선물해줫는데 좋아하네요 배송도 빨라요 휘뚜루 마뚜루 입을 수 잇슴 다,"잇다슴, 배송, 선물, 휘뚜루마뚜루"
저렴한 가격에 깔끔한 기 본티 장 너무 맘에 듭니다 검정 흰색 다 사이즈도 질도 좋아요 감사합니다,"검정흰색, 가격, 기본티, 사이즈, 질"
여기 옷 편해서 자주 입고 있어 소 재구매 했습니다 다 만 아쉬운 건 보다 길이가 긴 것 같아 요 길이는 더 길 고 통은 도 작은 느낌하지만 잘 입고 있습니다,"통, 길이, 재다, 편"
일할 때 대충 입을 라고 샀는데 조아용 전투복으로 입을 게용,전투복
기본 옷으로 입 기 정말 좋고 편해요 매번 구매 중입니다,"편하다, 중, 기본"
옷 두께랑 핏이랑 딱 적당해 요 기본 반팔 티로 추천합니다,"두께, 팔티, 핏"
기본 티로 입기 아까울 정도로 예쁘네요 가성비 아주 좋습니다,"기본티, 가성비"
반팔은 역시 커버낫이 시원하고 예쁜 것 같아요,"시원, 팔, 커버낫"
역시 커버낫은 커버낫이네요 반 팔 브랜드의 네요,"goat, 브랜드, 팔, 커버낫"
팔에 있는 라벨이 뽀인 떠 목도 하니 안 늘어날 것 같고 비침도 없고 이너로나 기본템으로 나 완벽해용,"라벨, 목, 기본, 비치, 이너"
기본템으로 완벽합니다 너무 얇지도 두껍지도 않아서 여름 반팔로 적당하고 특히 흰티는 이너로도 너무 이쁘네요,"얇다, 여름, 두껍다, 기본, 팔, 이너, 완벽, 희다티"
레이어드로 입을 려고 구매 했구요 세일할 따 사면 좋아요,"사, 레이어드, 세일"
면티 무거워서 못 입겠어서 쿨코튼 샀는데 확실히 가볍고 좋습니다 돼지에게도 적합,"무거워, 돼지, 못, 쿨코튼, 가볍다"
퀄리티가 좋고 이쁩니다 여름에도 시원하게 입을 수 있어요,"퀄리티, 시원, 여름"
항상 하게 입 기 좋은 무난한 반팔 사이즈도 적당히 여유 있어서 여름에 안 달라붙고 쾌적한 느낌이어서 좋음,"여름, 팔, 쾌적"
잘 입고 있어요 여름에 너무 무난하고 편하게 입을 수 있어요,"편하다, 여름"
오버핏으로 입 기 딱입니다 적당해서 자주 입을 거 같은데 옷이 얇아요,"얇다, 오버핏, 적당"
이쁘거 좋아요 잘 씁니다 잘 써요 잘 쓰겠습니다 감사힙니다,"감사, 잘쓰다"
사이즈도 잘 맞고 두께도 생각한 댜로 적당합니다,"두께, 사이즈, 적당"
자주 세탁해도 잘 안 늘어나고 이너로 활용 가능해서 좋아요,"이너, 세탁"
재질이 약간 그 운동할 때 입는 티셔츠 그런 재질이 섞여 있어서 자주 세탁해도 목 부분 잘 안 늘어나고 좋아요,"운동, 티셔츠, 재질, 목부분"
쿨 소재라 여름에 시원하게 입을 수 있을 것 같고 사이즈는 정 사이즈인 것 같아요 깔끔하니 맘에 들어요,"쿨소재, 여름, 사이즈, 정사이즈, 깔다끄다"
몇 년 전에 구매해서 아직도 입고 있는데 목 늘어짐도 없고 품질도 좋아서 두장 더 구매했어요,"아직도, 년전, 목늘어지다, 장더, 품질"
감시합니다 너무 좋은 제품 잘 입었어요 앞으로도 구매 예정 백 프로 구매,"제품, 감시, 예정, 백프로"
재질이 부드럽고 평소에도 입기 편하며 어느 코 디든 잘 어울립니다 정말 추천 드립니다 가격값을 하는 티 같습니다,"편하다, 추천드리다, 코디, 가격값, 부드럽다"
항상 이 너용으로 구매 중입니다 오래 입어도 하고 세탁 후에 변형이 적어요,"변형적다, 오래, 세탁후, 짱짱하다, 항상"
예쁘고 뭐 묻어도 잘 지워져서 좋은 거 같어요 다들 사시길,"다사, 자다지워지다, 묻다"
로 시켰다가 사이즈 미스로 으로 교환했어요 쿨코튼이라 구김 덜하고 시원함,"사이즈미스, 구김, 쿨코튼, 시원하다"
사계절 잘 입고 있는 커버낫 기본 티 추가 구매했습니 당 소재도 시원하니 너무 좋고 아무리 세탁해도 변형 없어서 넘모 좋은 같아요,"변형, 소재, 기본티, 커버낫, 세탁"
저렴한 가격에 잘 구매한 거 같아 요 사이즈도 너무 박시하지도 않게 잘 맞네요,"가격, 사이즈, 박다, 저렴하다"
일반 사 계절 면 티가 더워서 구매 더 저렴한 상품도 많앗으나 브랜드 보고 선택 했습니다 아들이 하루 이 너테로 입고 갓 다 오더니 훨 시원하다 하네요 만족합니다,"테, 일반, 아들, 시원하다, 면티, 브랜드, 사계절"
선물 햇는데 좋아하네요 선물하기 좋은 듯 합니다,선물
색상 두께감 모두 만족합니다 편하게 자주 입 기 좋아요,"편하다, 두께감, 색상"
잠옷으류 입고 다니기 편해요 헬스장 갈 때도 대충 입음,"잠옷, 헬스장"
입기 편해서 재구매 했어요 좋은 가격으로 잘 구입했어요,"가격, 편, 재다"
적당한 두께에 가격 대비 퀄리티도 좋아 만족합니다,"퀄리티, 가격, 두께, 만족"
몇 번 입으면 늘어나는 그런 재질이 아니라서 여름엔 단벌로 입고 추울 땐 이너로 사 계절 끄적할 수 있는 아주 고밸류의 옷이라고 할 수 있겠네요,"추다땐, 여름, 재질, 밸류, 사계절"
매년 구매하는 제품입니다 재질 좋고 목 안 늘어나고 이너로 단독으로 다 좋아요,"재질, 매년, 목, 늘어나다, 이너, 단독"
전 흰 티로 개 구입했는데 레이어드 할 때 정말 예뻐서 검정색도 구입 할려고요 정말 예뻐요,"레이어드, 검정색"
커버낫 기능성 원단인 줄 알고 구매 했는데 면티였습니다 반품하기 귀찮아 그냥 입기로 했어요 까슬까슬한 느낌의 원단으로 깔끔하게 입기엔 괜찮을 것 같아요 너무 두꺼운 면 티는 아닙니다 여름에 간편하게 하나 입고 나면 될 것 같고 가을 겨울엔 속지로,"반품, 가을, 겨울, 간편, 여름, 까슬, 두껍다, 기능성원단, 커버낫, 면티, 깔다끄다, 속지"
휘뚜루 마 뚜루 입 기 정말 좋습니다 기장감도 하고 제질도 좋습니다,"기장감, 질, 휘뚜루마뚜루"
가격도 합리적이고 제품도 질이 좋은 거 같습니다,"제품, 질, 가격"
사이즈가 많아서 어떤 사이즈 구입해야 할 지 걱정했는데 남자 기준 괜찮아요 근데 좀 길게 내려오는 걸 원하시면 까지도 괜찮을 것 같습니다 디자인도 깔끔하고 재질도 여름에 입 기 딱 좋을 것 같아 요 팩에 만 원 중반대로 구입했고 배송도 빠르고 포장도 해서 만족합니다,"디자인, 포장, 재질, 사이즈, 남자, 배송"
사이즈가 많아서 어떤 사이즈 구입해야 할 지 걱정했는데 남자 기준 괜찮아요 근데 좀 길게 내려오는 걸 원하시면 까지도 괜찮을 것 같습니다 팩에 만 원 중반대로 구입했고 배송도 빠르고 포장도 해서 만족합니다,"포장, XL, 남자, 배송, L, 사이즈"
여름에 가볍게 입 기 좋은 거 같아요 또 구매할 꺼에요,"가볍다, 여름"
운동할 때나 가볍게 입 기 너무나도 좋은 옷입니다,"가볍다, 운동"
라지 사이즈는 긴 바지 입을 때 입고 엑스라지는 운동 갈 때나 반 바지 입을 때 입으니 잘 어울립니다,"엑스라지, 라지사이즈, 바지, 운동, 반바지"
라지 사이즈는 긴 바지 입을 때 입고 엑스라지는 운동 갈 때나 반 바지 입을 때 입으니 잘 어울립니다,"엑스라지, 라지사이즈, 바지, 운동, 반바지"
배송 빠르고 가격 저렴해서 너무 좋아요 추천해요,"가격, 배송, 추천"
매 여름마다 꾸준히 사는 것 같아 요 옷감이 좋아서 잘 늘어나지도 않고 시원해요,"여름, 시원, 옷감"
사이즈가 조금 큽니 다 이너로 입거나 집에서 입으면 시원하고 좋네요,"시원, 사이즈, 이너, 집"
생각보다 오버핏이에 요 그래도 출근룩으로 잘 입어요,"오버핏, 출근룩"
깔끔하고 재질도 괜찮은 거 같아 요 편하게 입기 너무 좋고 년 뒤 블프 때 재구매해야겠네요,"편하다, 깔다끄다, 재다, 재질"
재질 너무 좋아요 깔끔해요 세탁해도 변형 없어요 아무 옷에 이뿌네요 포장도 좋고 총알배송,"총알배송, 재질, 세탁, 포장"
포장도 하게 되어 있어서 깨끗하게 받을 수 있었어요 색도 화면이랑 똑같아요,"깨끗, 포장, 화면, 색"
쿨코튼이라 시원하고 잘 입고 다닙니다 운동할 때도 셔츠 안에 받쳐 입기도 좋아요 굿 소비 굿 소비,"시원, 굿소비, 쿨코튼, 셔츠, 운동"
기본 티로 아주 좋습니다 가격도 괜찮고 사이즈 딱이에요,"사이즈, 기본, 가격, 티"
기본 티로 아주 좋습니다 가격도 좋고 사이즈도 딱이에요,"사이즈, 기본, 가격, 티"
무난템이에요 어디에든 잘 어 울릴 것트 같아서 좋아요,"어울리다, 에든"
여름에 입 기 아주 좋아요 너무 두껍지도 않고 얇지도 않아서 입 기 좋아요 옷이 팔꿈치까지 내려와서 팔꿈치 가려주니 너무 좋네요,"여름, 얇다, 팔꿈치, 두껍다"
기본 티 끝판왕 이너로도 좋고 오버핏으로도 활용 가능,"이너, 오버핏, 기본티, 끝판왕"
