Review,Keyword
한 바지였습니다 핏도 나쁘지 않고 만족스럽네 여,"만족스럽다, 바지, 핏"
밑위가 생각한 거 보다 너무 길어요 나머 진 나 좋음,"밑위, 나머진"
통이 커요 색감이 진짜 이 뻐요 길이도 딱 좋음,"길이, 크다, 통, 색감"
너무 너무 이쁩니다 믿고 구매하시면 절대 후회하지 않을 겁니다,"후회, 믿음"
상체가 짧고 하체가 조금 더 긴 편인 저한텐 기장은 딱 이였어요 근데 허리가 커서 좀 마니 남았져 그래도 예쁩니다 디테일굿이 에용,"상체, 하체, 크다, 허리, 짧다, 디테일굿"
예뻐 여 근데 여름에 입을 거면 여름용 사시고 기본은 겨울 가을 봄에 잘 입고 댕길 듯 핏 잘 나와욤,"가을, 기본, 겨울, 나와욤, 봄, 댕길, 사시, 핏, 여름"
색도 그렇고 엄청 예쁜데 전체적으로 통도 그렇고 엄청 커요,"그렇다, 전체, 크다, 통, 색도"
사계절 입어도 괜찮을 것 같아 요 색상도 무난하고 굿,"색상, 굿, 사계절"
허리 사이즈가 좁은 편이고 재질이랑 핏은 예뻐요,"사이즈, 편, 좁다, 재질, 허리, 핏"
늘 무신사에서 구매합니다핏도 예쁘구 색상도 화면 하구 같습니다,무신사
핏이랑 사이즈랑 질감이랑 전부 맘에 들었습니다,"질감, 핏, 사이즈"
너무 핏이 이 쁘고 좋아요 그리고 옷도 시원하니 정말 좋습니당,"핏, 시원하다"
핏도 하니 이 쁘고 편하고 약간 얇은 편이라서 저는 여름에도 잘 입고 다 녔담니당,"편하다, 녔담다, 얇다, 편이라서, 핏, 여름"
그냥 왜 이걸 이제야 삿을까라는 느낌 정도 드네요,"이제야, 삿을까, 걸"
일단 통이랑 기장이 매우 큽니다 사이즈 고려하시고 사는 걸 추천 드려 요 바지 스타일 자체는 매우 만족,"추천, 기장, 바지, 고려, 만족, 크다, 통, 사이즈, 걸, 살다, 드리다, 스타일, 자체"
진짜 예뻐요 다리 핏도 예쁘게 떨어지고 아주 맘에 듭니 당,
바지는 말할 것도 없이 이 쁘구 여 그런데 일자 배기가 아니라 벌룬 핏이라는 점 그리고 워싱이 생각보단 아쉽고 얇다는 점은 감안하셔야 됩니당,"워싱, 바지, 보단, 쁘구, 벌룬, 얇다, 말, 아쉽다, 배기, 핏, 일자"
통이 진짜 하고 커서 딱 원했던 느낌 내면서 입 기 좋아요,"커서, 내면, 통, 원하다"
제가 원래 엄청난 하비 인데 이 바지가 허리는 좁고 통은 커서 굉장히 편합니다 다른 색도 살 생각 입다,"편하다, 커서, 하비, 살, 통, 색도, 허리, 엄청나다"
허리 부분이 타이트해서 당기면서 늘려서 입었는데 그 부분 말고는 정말 모든 게 완벽합니다 올 여름 최애 바지가 되었어요 아주 만족합니다,"늘리다, 바지, 말고는, 만족, 최애, 허리, 타이트, 오다, 당기다, 완벽, 여름"
기장감 편안함 통 모든 면에서 가격 대비 만족하면서 꾸준히 입고 있습니다,"가격, 꾸준하다, 만족, 기장감, 통, 편안함, 대비"
생각하던 핏이 그대로 나와서 맘에 들어 요 다음에 또 구매할 게요,"나오다, 핏, 그대로"
얇아서 지금 입 기 좋아요 다들 득 템 하십시 요 잘 입을 게요,"얇다, 득"
남친에게 선물으로 샀는데 너무 괜찮으더라구 요 근데 허리 사이즈가 좀 크네요 길이는 괜찮고요 아무거나 잘 어울려서 쉽게 코디 할 수 있습니다,"길이, 수, 크다, 선물, 사이즈, 남친, 구, 허리, 어울리다, 쉬다, 거나, 코디"
힙하게 멋집니다 색상도 고급스럽고 길이와 사이즈 적당합니다,"색상, 길이, 멋지다, 사이즈, 힙하, 고급스럽다, 적당하다"
사이즈가 생각보다 크고 냄사가 나지만 그것보다 옷이 이 쁘고 색상도 잘 나와서 마음에 들어요,"색상, 나오다, 크다, 사이즈, 냄새, 그것"
핏이 정말 예쁘고 디자인도 너무 좋고 색감도 예쁩니다,"디자인, 핏, 색감"
아들 사줬는데 핏도 예쁘고 색도 너무 예뻐요 남여 모두 예쁘게 입을 수 있어요,"수, 사주다, 색도, 남여, 핏, 아들"
생각보다 핏도 좋고 재질도 괜찮습니다 가성비 좋아요,"재질, 핏, 가성비"
로 시키길 너무 잘했고 와이드 해서 너무 예쁩니다 평생입을 청바지 하나 마련했네요,"청바지, 와이드, 하나, 평생, 마련"
사이즈 하나만 작은 거 살 걸 이건 저의 선택이였으니 옷 자체에는 너무 만족합니다 아방한 핏도 좋고 디테일들도 예뻐서 자주 입고 있어요 추천,"추천, 하나, 만족하다, 이건, 살, 선택, 사이즈, 걸, 작다, 방한, 자체, 핏, 디테일"
생각보다 더 와이드하지만 핏이 이 뻐서 커버가 되는 바지,"커버, 바지, 핏, 와이드"
디자인 이 쁘고 핏도 멋있고 하는데 허리가 조금 작네요 진짜 살 빼고 바로 입어야겟다,"살, 작다, 빼다, 허리, 디자인, 멋있다, 핏"
필루미네이트 역시 핏이 너무 예쁘네요 아주 만족스럽습니다,"만족스럽다, 핏, 필루미트"
중남학생 마른 편이라 다리가 길어서 로 선택했눈 데 은 짧았겠네요 아주 만족해 하네요,"다리, 길이, 중남학생, 만족, 선택, 편, 마르다, 짧다"
디자인 예쁘고 입고 다니기 편해요 색감이 아주 좋습니다,"디자인, 편하다, 색감"
통도 넓고 색상이면 두께 적당해서 잘 입고 있습니다,"색상, 적당, 통, 두께, 넓다"
여름 교복처럼 입고 다님 편하고 예쁘고 좋아요 다만 여자가 입기에는 허리가 큼,"허리, 편하다, 교복, 여름"
얇고 편해서 데일리로 편하게 입 기 좋아요 추천합니당,"데일리, 편하다, 추천, 얇다"
사진 만큼 이 쁘고 사이즈 한 수치 줄이는 게 좋을 거 같아요,"사이즈, 수치, 사진, 줄이다"
데미지 들어간 포인트도 맘에 들고 와이드 한 바지 핏도 맘에 듭니다,"데미지, 바지, 와이드, 핏, 포인트"
우선 바지 크기가 전체적으로 커서 편하긴 하지만 허리도 같이 커서 수선을 맡기거나 벨트가 없으면 입기 힘들다는 게 단점 그래도 바지 자체는 굉장히 예뻐서 다리가 발달되어 있으시거나 특히 허벅돼 분들에게 강 추합니다,"바지, 다리, 커서, 허다벅돼다, 수선, 전체, 벨트, 특히, 추하다, 발달되어다, 크기, 분, 허리, 자체, 강"
아직 더워서 제대로 못 입고 있지만 디자인은 정말 예쁜 것 같습니다,"디자인, 제대로, 아직, 덥다"
색감이랑 핏 미쳤습니다 남자친구 추천해줬다가 너무 예뻐서 저도 따라 샀어요,"추천, 따르다, 색감, 핏, 남자친구"
일단 바지가 너무너무 편하고 팔랑거림이 너무 맛있어요,"바지, 팔랑거리다, 맛있다, 편하다"
와이드 한 핏이라서 편하게 코디하기 좋은 구 같아요,"편하다, 와이드, 구, 핏, 코디"
디자인도 색감도 재질도 다 마음에 듭니다 좋은 가격에 구매했습니다,"디자인, 재질, 가격, 색감"
일단 힌 달동안 입었는데 막 입어도 좋은 거 같아요,"달동, 막, 힌"
청바지 제일 기 대중입니다 색상이 너무 예쁘게 잘 빠졌지 뭐 에용,"청바지, 색상, 뭐, 대중, 빠지다"
바지 색이 이 뻐요 핏도 와이드 핏으로 잘 나와서 무난하요,"바지, 와이드, 나오다, 색, 핏"
사이즈도 딱 적당하고 옷도 너무 예뻐서 오래 입을 것 같습니다,"오래, 적당, 사이즈"
처음에는 유튜버가 추천해주어서 별로 인 듯 생각 했는데 막상 입어보니 너무 예뻐요,"유튜버, 별로"
배송이 빨라서 좋았고 기장이 길어서 바지가 이 뻐요,"바지, 라서, 기장, 배송"
추리닝 만큼 편하게 입을 수 있는 청바지 고 주머니가 짱커오,"청바지, 편하다, 수, 짱크다, 주머니, 추리닝"
적당한 워싱과 포인트를 잘 살린 바지입니다 요즘 제일 많이 입는 거 같네요,"워싱, 바지, 적당하다, 포인트"
바지 너무 편안하게 잘 입고 있네요 여름 바지로 무조건 사서 입으시는 거 강력 추천합니다 꼭 사입으세요,"바지, 무조건, 편안, 사서, 여름"
워싱 정도나 핏 기장 모두 다 맘에 드는 바지라서 자주 입고 다닙니다,"워싱, 기장, 핏"
착용감 디자인 마음에 들어 요 다른 색상도 구매하고 싶네요,"착용, 색상, 디자인"
마르신 분들은 허리가 생각보다 커서 놀라 실수도 있습니다 하지만 바지는 너무 만족스러운,"실수, 커서, 허리, 만족스럽다"
예뻐요 워싱도 적당하고 귀여움 크긴 한데 오히려 좋습니다,"워싱, 귀, 적당하다, 크다"
통이 생각보다 큰데 편해서 좋아요 여름에도 입을 만 할 듯,"여름, 편하다, 크다, 통"
후들 후들 한 면이 고 엄청 크지만 예상했던 핏이라 맘에 들어요,"크다, 후, 핏"
허리 끼긴 하지만 입기 좋고 허뚱이에게 강추,"끼다, 강추, 허리, 허뚱이"
바지 확실하게 통 넓은 바지 원하신 분에 개 추찬합니다,"바지, 추찬합, 개, 통, 넓다, 분, 원하다"
정말 아무 옷이나 다 잘 어울리고 지금까지 샀던 바지 중 최고에요,"어울리다, 바지, 중, 최고"
생각보다 착용감이 편해서 평상시 아무 때 나 입고 다니기 너무 좋아요,"착용, 편하다, 평상시"
정말 편하기도 하고 이 쁘고 봏아서 자주 입고 있습니다,편하다
사이즈가 생각보다 크긴 한데 그래도 핏이 예쁘고 입기 좋습니다,"크다, 핏, 사이즈"
색감이 너무 예쁘고 핏이 좋았습니다 기장이 살짝 긴 감이 없지 않아 있는데 그래도 만족합니다,"기장, 만족, 색감, 없다, 핏"
인기 있는데엔 이 유가 있습니다 고민하지 말고 사세요,"유, 인기, 고민"
옷이 이 쁜데 약간은 무거운 면도 있어요 가을 겨울에 입으면 따뜻할 거 같네요,"가을, 겨울, 무겁다, 면도, 쁜데, 따뜻하다"
색감도 예쁘고 바지에 들어간 포인트들도 최고 저만 입게 아무도 사지 말아주세요,"최고, 저만, 사지, 색감, 말다, 포인트"
바지 예쁘고 색감도 시원하이 예쁘고 좋아 여 재질도 좋았어요,"바지, 재질, 색감, 시원하다"
생각보다 얇아서 여름에 입기에 너무 좋았습니다,"얇다, 여름"
한 달 동안 제일 많이 입었어요 진짜 핏 개이 쁨 회사 동료도 이 쁘다고 칭찬해줬어요,"회사, 달, 쁨, 칭찬, 동료, 핏"
디자인 이 쁘고 가장 감도 제가 딱 생각하고 원했던 기장이라 너무 맘에 들어 요 잘 입겠습니다,"디자인, 기장"
아들이 잘 입고 다니네 요 역시 무신사에서 구입하길 잘 한 것 같아요,"물다, 아들"
워시드 들어간 형태가 사진이랑 비슷하게 나와서 좋았다,"형태, 사진, 워시드, 들어가다"
완전 좋아요 패션 피플이 된 거 같아요 친구들도 이 쁘대요 추천,"친구, 추천, 패션, 쁘대, 피플"
일단 옷 재질 자체가 일반 청바지에 비해 찰랑거리고 시원한 느낌이 들었습니다 또 찰랑거리는 성질 덕인지 잘 구겨도 않고 와이드 핏이 옷을 수시로 고쳐 입지 않아도 핏이 고정되어 있어서 여러모로 편했고 핏도 너무 좋아서 구매하실 거라면 적극 추천 드립니다,"구기다짐, 시원하다, 고정, 찰랑거리다, 재질, 핏"
좋아요 예쁘고 편하고 근데 사이즈가 좀 크게 나온 것 같아요,"크게, 편하다, 사이즈"
사길 잘했어요 시원해 보이고 핏도 예쁘고 한 달이 지나도 그대롭니다,"시원하다, 달이, 지나다, 대롭니, 보이, 핏"
생각보다 와이드 합니다 하지만 핏이 이쁩니다 구매 전 어느 정도 와이드한 지 확인해 보세요,"확인, 와이드, 지다, 핏, 전"
기장이 조금 길 긴 하지만 예뻐요 통도 넓고 딱 핏도 이쁜 거 같아요,"기장, 통, 넓다, 핏, 길"
픽도 너무 좋고 사이즈도 좋고 너무 이 뻐요 맛있습니다,"픽, 맛있다, 사이즈"
생각보다 통이 많이 커서 핏이 많이 해요 고등학생 아들 이쁘게 잘 입고 있어요,"커서, 통, 고등학생, 핏, 아들"
세련되고 스트릿으로 입 기 너무 좋아요 친구한테 바지 칭찬도 들었습니당,"바지, 친구, 스트릿, 칭찬, 세련되다"
핏이 예쁘고 너무 좋았습니다 깔끔하게 입기에 너무 좋아요,"깔다끄다, 핏"
색상 기장 모든 게 다 만족스러운 바지입니다 특히 워싱 부분 정말 좋네요,"워싱, 바지, 색상, 기장, 부분, 만족스럽다"
핏 정말 이쁘게 잘 나오고 길이든 통이든 적당하게 이쁜 거 같아 요,"길이, 통이든, 나오다, 적당하다, 핏"
스크래치 디테일이 좋았고요 와이드 해서 입니다,"와이드, 스크래치, 디테일"
리뷰들이 다 좋아서 기대하고 샀 난 데 생각보다 핏이 애매해 다 해야 하나 쪼금 아쉬워 요잉,"쪼금, 애매, 기대, 아쉽다, 리뷰, 핏"
사이즈와 통이 엄청 커서 무난하게 입긴 어려운 거 같아요,"크다, 어렵다, 통, 사이즈"
진짜 넘 예 색깔별로 소장하고 싶어 용 진짜 굿 일단 이색이 젤 이 쁭거 같아요,"색깔별로, 이색, 굿, 젤, 소장, 쁭거"
색감 이쁘고 핏이나 질도 괜찮아요 너무 추천해요,"추천, 핏, 색감, 질"
전 이런 바지 안 어울리나 바 여 통 되게 넓네요 에 바,"바지, 되게, 통, 넓다, 어울리다"
평소에 입으려고 주문했습니다 허리도 예상한 대로 딱 맞아서 잘 입고 있어요,"대로, 주문, 맞다, 허리, 예상"
청바지를 좋아하는데 여름이어서 못 입어서 슬퍼서 여름 버전으로 샀어요 얇고 가볍고 좋아요 올 여름 너무 더워서 한 여름엔 못 입었어요 근데 초여름까진 입고 다녔습니다 이 바지에 위에 크롭티 입으면 존 예작 살,"청바지, 바지, 가볍다, 살, 존, 버전, 얇다, 슬프다, 덥다, 크롭티, 작, 위, 오다, 초여름, 여름"
옷 이 쁘고 키 큰 분들도 부담 없이 입을 수 있어서 좋아여,"크다, 부담, 키, 수"
바지가 워싱 조금 들어가 있는 게 엄청 이 쁘고 기장도 엄청 괜찮습니다 꼭 사세요,"워싱, 바지, 기장, 꼭, 들어가다"
원하던 느낌으로 핏이 나와서 맘에 들어 요 넓게 입으시는 거 좋아하면 추천,"추천, 나오다, 원하다, 넓다, 좋아하다, 핏"
생각했던 핏인데 조명에 따라서 색감이 자주 바 껴요,"조명, 끼다, 핏, 색감"
기장이 너무 안길어서 좋아요 와이드 핏 색 감 다 좋습니다,"기장, 와이드, 안다, 색감, 핏"
예쁘고 핏도 마음에 드는데 살짝 통이 많이 큰 느낌이라 거의 통 바지로 보일 수도 색상이랑 가성비는 엄청 좋아요,"바지, 색상, 크다, 보이다, 통, 수도, 가성비, 핏"
기장이 딱 좋고 색감핏 감재질 모두 너무 만족했습니다,"기장, 핏, 색감"
허리가 생각보다 큽니 다 기장은 제가 원하는 길이에 조금 길지만 색감이 정말 이 뻐요,"크다, 허리, 길이, 색감"
요즘 핫한 핏 몇 년은 더 젊어진 것 같은 느낌 힙하게 스타일링 하기 좋은 것 같아 요,"스타일링, 핫, 힙하, 젊다, 핏"
여름용이 여도 한 여름에 입기는 덥고 저녁이나 여름 끝 무렵에 입으면 좋을 거 같아요,"저녁, 여름, 덥다"
핏도 예뻐요 근데 허리가 좀 많이 커서 벨트 필수에요,"벨트, 핏, 허리, 필수"
사이즈가 치곤 굉장히 크지만 핏 이 쁘게 떨어져서 조아요,"크다, 핏, 떨어지다, 사이즈"
여태 산 바지 중에 제일 마음에 들어 요 웬만한 상의에 다 어울리고 요 통도 커서 편하게 입기 좋아요 색감도 실물이 훨씬 예쁩니 당 고민하고 계시다면 그냥 사세요 가 성비도 입니둥,"바지, 성비, 가다, 입니둥, 통, 색감, 고민, 상의, 실물, 당"
완전 이 쁘고 사이즈도 잘 맞고 색상도 트랜디해서 좋아요,"맞다, 색상, 사이즈, 트랜디"
앞쪽 워싱 있어서 포인트 입기 무난한 고 핏 이 뻐요,"워싱, 핏, 앞쪽, 포인트"
평소 입는데 사이즈 하고 핏도 너무 예뻐요,"핏, 사이즈"
이번 년도 너무 더워서 아직 못 입었어요 근데 이 뻐요,덥다
옷도 깔끔하고 예뻐서 편하게 입기 좋고 통도 넓어서 편해요,"편하다, 깔끔하다, 통, 넓다"
깔끔하게 입을 수 있어서 좋았고 편해서 좋았습니다,"수, 깔끔하다"
너무 좋아요 와이드 팬츠 중에서도 와이드 해서 개 좋음,"팬츠, 와이드, 개"
통이 너무 커요 생각보다 커서 당황했네요 그래도 기장이랑 잘 맞아요,"기장, 크다, 당황, 통"
허리 밴딩이 없어서 조금 불편한 감이 없제 않아 있지만 예뻐요 빈티지한 느낌이라 좋아요,"빈티지, 불편, 허리, 밴딩"
핏이 깔끔하게 떨어져서 좋아요 워싱도 예쁩니다,"깔다끄다, 워싱, 핏, 떨어지다"
핏도 이쁘고 색상도 좋코 아주 만족합니다 대 만족입니다,"색상, 만족하다, 만족, 코, 핏, 대다"
길이도 마음이 들 고 재질도 가격대치거 괜찮은 거 같아요,"재질, 길이, 가격"
예전부터 살지 말지 고민하다 시켰는데 바지 통이 너무 큰 거 말고는 좋아요,"바지, 예전, 살지, 말고는, 크다, 통, 고민, 말지"
크기가 엄청 크고 길어요 색감도 맘에 들고 얇아서 여름에 잘 입을 것 같아요,"길이, 얇다, 색감, 크기, 여름"
허리가 조금 클 수 있지만 디자인 자체가 너무 마음에 들고 허벅지도 해서 입 기 편해요,"디자인, 허벅지, 허리, 편하다"
여름용이라 시원하고 핏도 생각했던 만큼 좋네요 잘 입을께요,"시원, 핏, 여름"
생각보다 실물이 이 뻐서 잘 입을 것 같네요 감사합니다,실물
일단 핏은 정말 마음에 들고 다른 바지들은 불편한 데 이 바지는 편해서 자주 입게 됩니다,"편하다, 핏"
색감도 예쁘고 빈티지한 느낌이 너무 좋아요 핏도 예뻐서 상의 아무데나 휘뚤마뚤 입어도 그냥 다 예뻐요 사이즈도 큰 편이라 편하게 입을 수 있어서 자주 입고 다니는 청바지입니다 추천 드려용,"편하다, 색감, 상의, 휘뚤마뚤, 빈티지, 핏"
되게 좋아요 이 거 입으면 힙합 전사 될 수 잇음 근데 좀 사이즈 크긴 해요 저는 그게 매력으로 다가 왔지만 벨트 없으면 새 깅해야 함요 바지 자체는 깔롱 쥑입니다,"매력, 벨트, 사이즈, 깅, 전사, 깔다롱, 힙합"
핏 기장 색 다 원하던 스타일 입니다 무더운 날만 아니라면 충분히 입을 수 있어요,"기장, 무덥다, 수, 충분하다, 색, 스타일, 핏, 날"
핏 떨어지는 것도 예술이고 원단도 괜찮아서 여름에 막 입고 다니기 좋앗어요,"예술, 떨어지다, 막, 원단, 핏, 여름"
청바지를 크게 입고 싶어서 주문했는데 색 두 이 쁘고 핏도 이뻐여,"청바지, 크게, 주문, 색, 핏"
인생 바지에 용 너무 이 뻐여 긁힌 자국이 포인트가 되고 색감도 이 뻐서 자두 입을 거 같아용,"긁힌, 바지, 자국, 인생, 색감, 자두, 포인트"
청바지 색이 너무 이 쁘고 착용감이 너무 편해서 좋아요,"청바지, 편하다, 색, 착용"
와이드 팬츠 첨 입어보는데 진짜 색이 쁘고 딱 맞음,"와이드, 팬츠, 맞다, 색, 입어보다"
생각보다 조금 얇아서 여름에 입 기 좋았고 워싱도 너무 잘 들어가서 입 기 좋아요,"워싱, 얇다, 여름, 들어가다"
필루미네이트 자주 애용하는데 후기가 좋아서 구매 했어요 살짝 길긴 한데 무리 없이 입을 만 해요,"후기, 길다, 무리, 애용, 필루미트"
생각보다 워싱은 덜 보이지만 핏이랑 포인트가 너무 예뻐요 감사합니다,"워싱, 핏, 보이, 포인트"
바지가 너무 예쁘고 핏이 좋아요 자주 입을 거 같아요,"바지, 핏"
모델 분 사진 같은 핏을 원했지만 제 몸의 문제 때문에 이것도 나름대로 예쁜 것 같아 요 허리가 좀 크긴 했지만 무골 반인 저한테 완전 딱입니다,"크다, 사진, 무골, 몸, 허리, 문제, 딱이다, 핏, 모델"
에 인데 너무 통도 크고 길이도 길어서 사는 게 나을 것 같아 요 예쁘고 편합니다,
바지통이 생각보다 더 커서 옆에서 볼 때 뭔가 제 다리가 좀 커진 기분이였어요 엄청 편하고 그렇게 덥진 않을 것 같아 많이 애용할 것 같습니다,"다리, 편하다, 볼, 커지다, 크다, 기분, 덥다, 바지통, 애용, 옆"
원래 입으시는 거보다 한 사이즈 적 게 시켜야 할 듯합니다 보통 바지 입는데 이 거시켰는데 살짝 아주 살짝 커요 벨트 차야 댐 바지는 엄청이 뻐요,사이즈
여름에도 입 기 좋고 하얀 티셔츠에 코디하기 좋아요,"여름, 티셔츠, 코디"
바지색이 오묘해서 흔하지 않은데 튀는 것도 아니고 에 쁨,"바지색, 튀다, 쁨, 오묘"
빈티지한 워싱감이 너무 좋았어 용 바지 에 들어가 있는 스크래치들도 포인트였고 바지 지퍼도 잘 여닫히고 좋습니다,"바지, 워싱감, 지퍼, 스크래치, 빈티지, 포인트"
입는 기준으로 빈틈 없이 딱 맞습니다 한 여름까진 에 바이고 초여름이나 초가을 정도에 적절할 듯 하네요,"빈틈, 바이, 초가을, 여름까진, 기준, 맞다, 적절하다, 초여름"
바지 너뮤 편하고 좋아요 손이 자주 갑니다 근데 입 다 보니 많이 늘어나서 더 오버핏 됨,"바지, 편하다, 가다, 늘어나다, 손, 오버핏"
조금 길이감이 길고 허리가 큰 건 사실이지만 제가 원하던 핏이라 완전 만족합니당,"만족, 크다, 길이감, 길다, 허리, 원함, 핏"
바지 핏이랑 색이 좋아요 스크래치 디테일도 이 뻐요,"바지, 색, 스크래치, 핏, 디테일"
사이즈가 커서 좋았고 어디든 나갈 때 편하게 입을 수 있어서 좋았어요 색깔도 예쁘고 힙해서 더 마음에 들었던 것 같습니당,"편하다, 색깔, 커서, 수, 힙해, 사이즈, 니당다"
바지 이쁘고 워싱 잘 들어갔어요 다음에 또 살 거 같아요,"워싱, 바지, 살, 들어가다"
예뻐요 기 장 살짝 길고 통도 넓긴 한데 와이드 느낌으로 코디하기 좋아요,"와이드, 통, 길다, 넓다, 코디"
허리가 약간 크긴 하지만 핏이 미쳤음 이 가격애 개혜자,"가격, 개혜자, 미치다, 크다, 허리, 핏"
두껍지 않고 사 계절 입을 수 있을 것 같아 요 허리가 살짝 크긴 했지만 만족스럽습니다,"수, 만족스럽다, 크다, 계절, 허리"
핏도 엄청 이 쁘고 길이도 딱 맞아서 너무 좋아요 지금 시기에 입기는 약간 두꺼운 편인데 그래도 핏이 이 뻐서 잘 입고 다닙니다,"길이, 두껍다, 맞다, 시기, 핏"
청바지 중에 소재가 두께감이 두껍지 않아 좋아요통이 넓어 통풍도 잘 되서 여름에도 입기 좋아요,"청바지, 통, 소재, 통풍, 넓다, 두께감, 여름"
지인 선물로 해 줫어용 나중에 입은 거 보고 예쁘면 저듀 살게 용,"저듀, 보고, 살, 나중, 선물, 주다, 지인"
청바지 색깔이 너무 이쁘게 잘 나왔고 와이드 느낌 좋았어용,"청바지, 색깔, 와이드, 나오다"
살짝 새 거라 이 상한 냄새 나긴 하는데 예뻐요 생각보다 커요,"냄새, 상한, 크다"
조카 생선으로 삼 디자인 와이드하고 편함 바지 밑단이 유니크함,"조카, 편하다, 바지, 와이드, 밑단, 생선, 유니크, 삼, 디자인"
생각보다 허리 사이즈가 합니다 와이드 핏이 다 보니 허벅지나 그런 쪽도 합니다,"허벅지, 와이드, 사이즈, 허리, 핏"
예뻐요 딱 입기에 좋습니다 근데 사이즈 미스였음,"미스, 사이즈"
바지가 처음에 로 시켰다가 너무 커서 로 바꾸긴 했지만 그래도 조금은 컸긴 한데 입고 다니기엔 좋았습니다 여름엔 살짝 더운 것 같아요,"바지, 커서, 크다, 덥다, 바꾸다, 여름"
기장 긴 걸 원해서 사이즈 크게 주문했어 용 근데 진짜 크네요 얇기도 한 여름 빼고는 다 괜찮을 거 같아 요 가 벼워서 좋아용,"크게, 기장, 주문, 가다, 크다, 얇다, 사이즈, 빼다, 벼워, 여름"
딱 떨어지는 핏과 덥지 않아서 좋았습니다 겨울이 오기 전까지 애용할 것 같네요,"겨울, 떨어지다, 덥다, 핏, 애용"
무신사에서 처음으로 바지 사보는데 이 거 뭐죠 요 물입니다 왜 이제서야 샀는지 기준 기장은 조금 길지만 그게 예쁘잖아요,"물다, 바지, 기장, 기준, 물"
여름에 입기 좋은 얇은 원단에 와이드 핏이라 시원합니다 아주 저렴한 가격에 잘 샀네요,"가격, 와이드, 시원, 얇다, 저렴, 원단, 핏, 여름"
길이도 조금 길고 허리가 좀 크긴 하지만 핏이 진짜 예쁨 대 만족 색감도 예쁘고 여기저기 잘 어울리는 듯 해요 세일해서 사서 가격 대비 넘 좋음,"길이, 세일, 색감, 허리, 핏"
좀 큰 것 같긴 한데 그래도 잘 입을 게요 핏 이 뻐요 자주 입을 것 같습니다,"크다, 핏"
디자인도 이 쁘고 핏도 이 쁘게 잘 나와서 범용성 있게 코디가 가능해서 좋아요,"나오다, 가능하다, 범용성, 디자인, 핏, 코디"
기장이 좀 길긴 하지만 진짜 예쁩니다 딱 좋음 오버핏에 색감까지 굿,"길다, 기장, 오버핏, 색감"
우선 사이즈가 잘 맞고 인데 기장도 해서 좋았어용,"맞다, 기장, 사이즈"
