Review,Keyword
일단 왕 창 큽니다 여자 사이즈 기준으로 엄청 크고 길어요 밑단 엄청 접어서 핀으로 고정했는데 다니는데 불편함은 없었고 흘러내리는 핏이나 색감이 예뻐서 만족했어요 특히 색감이 정말 마음에 들었습니다 너무 밝거나 푸른 색이 튀지 않고 빈티지하고 흐릿한 색감이라 딱 찾고 있던 데님 색상이었어요 그리고 제 체형 기준으로는 꾸안 꾸 데일리 느낌 보단 정말 짱 큰 바지로  스트릿한 무드 내 고 싶으신 분들께 잘 맞을 것 같아요,"밑단접다핀고정, 흘러내리다핏색감만족하다, 크다, 특히색감, 여자기준, 크다어요, 불편하다없다, 밝다푸른색튀다빈티지하고흐릿색"
남자 바지라 정말 크네요 은 남자친구 주고 저는 로 바꿨어요 후기 사진은 기준 사이즈입니다 그래도 넘 예쁘고 얇아서 여름에 잘 입을 거 같아요,"바지, 크다, 남자, 후기, 얇다, 사진, 기준, 사이즈, 바꾸다, 주다, 남자친구, 여름"
대인 우리 아 부지 젊은 스타일로 입히 고 싶어서 생신선물로 구입했어요 년 전 울아버지 대학 다닐 때 유행하던 스타일이라 옛날 생각나신다고 좋아라 하시고 생각보다 잘 어울리셔서 깜짝 놀랐어요 두께도 적당하고 편해서 좋다고 하심 요 대인 울 오빠도 사서 같이 입고 다니고라고 하려 구요,"사서, 스타일, 유행, 심, 두께, 어울리다, 생신선물, 대인, 울, 대학, 옛날, 젊다, 전, 편하다, 부지, 울아버지, 생각나다, 오빠, 적당하다, 깜짝, 입히다"
허리에 딱 맞고 허벅지도 편안하게 움직일 수 있어서 좋습니다 어디에든 어울리는 색감도 마음에 들어요,"허벅지, 색감, 맞다, 움직임, 편안함, 허리"
아 바지 쥰 내 맛있다 필루미네이트 클났다 이제 매달 월급 꼬라박을 게요,"바지, 꼬라박, 매달, 크다, 월급, 쥰, 맛있다, 필루미트"
재질이 얇아서 여름에도 입기 좋을 것 같고 색감이 밝아서 시원해 보입니다,"시원하다, 얇다, 색감, 밝다, 재질, 여름"
바지 센치면 저한테 딱 좋아서 입어봤는데 발 등에도 안 닿길래 길이 재봤더니 센치도 안나와 요 길이 좀 잘 적어주세요 으로 교환하고 싶었는데 도 허리가 크고 번거로워서 안 했어요 짧으니까 핏이 이 상해서 상의 짧은 거 못 입고 최대한 내려 입어요 구냥 교환할 걸,"바지, 길이, 안나, 센치, 교환, 크다, 적다, 닿다, 발, 최대한, 상의, 허리, 재, 짧다, 상해, 번거롭다, 핏, 입어보다"
바지 너무 마음에 들어 요 색감도 스크레치 디테일도 완전 예쁩니다,"바지, 디테일, 색감, 스크레치"
뭣도 모르고 시켰는데 이렇게 맘에 들 줄 몰랐습니다 주변에서 이쁘다고 말 많이 들었습니다 사진이 흐릿하지만 실물 진짜 입니두,"주변, 흐릿하, 뭣, 모르다, 사진, 말, 실물, 이렇게"
크게 입으려고 샀는데 핏도 너무 좋지만 색감이 너무 좋아요 제가 산 바지 중에서 제일 좋은 거 같아요,"크게, 바지, 색감, 중, 핏, 산"
인생 바지 찾았네요 핏이 일단 너무 이쁩니다 색은 실제로 보면 더 빈티지한 맛이 강해요 새로운 데님 사고 싶으시면 추천 드립니다,"바지, 추천, 사고, 새롭다, 인생, 강하다, 색, 맛, 드리다, 데님, 빈티지, 핏"
워싱도 잘 되어 있고 핏도 예쁩니다 가격도 착해요,"워싱, 가격, 핏"
사진 핏보고 구매했는데 첨에 딱 입어보자마자 제 인생 바지임을 바로 알았습니다 기장감이며 워싱 핏 모든 게 완벽했어요 원단도 얇은 편이라 여름에도 충분히 입을 수 있을 거 같습니다,"워싱, 바지, 기장감, 사진, 원단, 핏"
바지 진짜 인생 바지에 요 진짜 통 커서 산 건데 실제로 받아보니 더 커서 좋았고 허리가 살짝 크긴 했는데 벨트하고 입으니 너무 이 뻐용 색감도 워싱 이쁘게 잘 들어가 있구 중간 중간 포인트로 박혀 있는 거도 이 뻐요 이 가격대에 이런 바지 못 구함,"워싱, 바지, 커서, 벨트, 인생, 통, 색감, 박히다, 허리, 포인트"
원래 사이즈 시켰다가 너무 커서 사이즈로 교환했는데 길이도 마음에 들고 핏도 마음에 들어 요 워싱이 독특해서 진짜 이쁩니다,"워싱, 길이, 핏, 사이즈"
허리 너무 편안하고 길이 감 딱 좋습니다 찢어진 곳 포인트랑 워싱 과 하지 않아서 맘에 들어요,"워싱, 길이, 편안, 허리, 찢어지다, 포인트"
멋이라는 것이 폭발했다 골반 바지로 입고 싶었지만 그러기엔 살짝 작아 요 시키면 흘러 내릴까봐 한 건데 사이즈가 약간 아쉽습니다 그치만 바지는 예뻐요 너무 만족해요,"멋, 바지, 흐르다, 만족하다, 골반, 사이즈, 작다, 아쉽다, 내리다, 그치다"
예약 배송일보다 늦어져서 슬펐지만 너무너무 맘에 들어 요 워싱이 너무 이 쁘고 무엇보다 이 가격에 이런 퀄리티 라니 길이도 좋아여,"워싱, 길이, 가격, 이렇다, 예약, 슬프다, 배송일, 늦어지다, 퀄리티"
내 생각보다 와이드해서 놀랏 음 기장은 적당하고 배송도 빠름 허리가 얇은 편이라 벨트 필수,"벨트, 와이드, 허리, 필수"
제발 길이 조금만 더 줄일 수는 있지만 늘릴 순 없잖아요 제 발 만 진짜 제 발 키 큰 형님들은 무릎 구부려야 원하던 핏이 나와 요 디자인 예쁘고 이런 사이즈 없네 길이가 짧아 슬픈 삐에로아저씨 반품할까 무한 반복 하며 고민하다가 싼 가격에 어쩔 수 없이 길이 좀 더 긴 버전 목 빠지게 기 다립니다,"길이, 가격, 키, 사이즈, 반품, 디자인, 무릎, 목"
남자 아이 아주 마른 중학생 허리 살짝 크고 길이가 상세 사이즈보다 긴 거 같아 요 핏은 아주 예뻐요,"길이, 크다, 남자, 사이즈, 마르다, 중학생, 허리, 상세, 핏"
옷은 너무 예뻤는데 사이즈가 생각보다 너무 커서 조금 놀랐어요 그래도 옷은 예뻐서 잘 입고 다닐 게요,사이즈
찰방찰방한 재질이고 생각보다 허리가 큼 로우 라이즈로 입어야 할 듯 개힙함 허리는 신발끈으로 묶고 다님 힙,"허다, 찰방찰방, 묶다, 크기, 허리"
딱 원하던 색감에 핏입니다 어디에나 어 울릴 법한 적당히 물 빠진 색감,"법, 색감, 빠지다, 원하다, 어울리다, 적당하다, 핏, 물"
잘 입고 다니는 중입니다 엄청 크긴 한데 운동화 끈으로 뒤에 묶고 다니면 귀 옂고 좋아요,"크다, 뒤, 묶다, 귀, 끈, 중, 옂, 운동화"
요새 입을 청바지가 없고 워싱 데님을 찾고 있었는데 이 제품을 발견했을 때 진짜 이거다 하는 생각이 들어서 바로 구매하게 되었는데 일단 포장이 해서 좋았고 데님 자체 퀄리티가 좋아서 매우 만족하게 된 제품입니다 사진보다 실물이 더 예뻐서 믿고 구매하셔도 될 것 같네요 필루미네이트 옷 자체를 첨 사는 데 믿고 구매하는 브랜드를 한 개 찾은 것 같아 요 일단 저는   워싱 데님 입문자 분들께 이 옷 강력 추천 합니다 가격이 깡패에 여 진짜 입어보세요 전 요새 이 바지만 입어요 끝으로 많이 파시 고 번창하시고 전 나중에 또 재구매 의사 있슴다,"청바지, 워싱, 재다, 입문, 가격, 믿음, 실물, 포장, 데님, 깡패, 번창, 끝, 퀄리티"
허리가 너무 크긴 한데 색감도 이 쁘고 길이도 적당해요,"길이, 크다, 적당, 색감, 허리"
조금씩 디테일 워싱 들어간 게 이 쁘고 얇아서 여름까지 잘 입을 수 있을 것 같아서 좋습니다 가 벼워서 편하게 입 기 좋아요,"워싱, 편하다, 얇다, 벼워, 여름, 디테일"
너무 오래 기다렸고 예정일보다 더 늦어져서 아쉬웠지만 워싱도 예쁘고 색상도 좋아요 바지 통이 생각보다 더 크기는 하는데 괜찮을 것 같아서 입어보려구요,"워싱, 바지, 색상, 예정일, 기다리다, 통, 아쉽다, 늦어지다, 크기, 오래, 입어보다"
이런 디테일들은 잘 보이지도 않게 상품 사진을 업로드 하는 건 좀 아쉽네요 워싱이나 핏 기장이 딱 취향이라 주문했는데 디테일들 보니까 좀 짜쳐서 입지는 않을 거 같습니다,"워싱, 기장, 주문, 업로드, 사진, 아쉽다, 취향, 짜다치다, 입지, 핏, 디테일"
고심 끝에 이 제품을 구매했는데 살 당시에는 신상이라 고민했는데 그 고민을 없앨 만큼 좋습니다,"신상, 고민"
생각보다 진짜 크네요 로 사도 괜찮았을 것 같아 요 하지만 다들 이쁘다고 그러고 재질도 시원하고 넘 잘 산 거 같아 요 다른 색상도 구매하고 싶어용,"색상, 그렇다, 시원, 크다, 재질, 사도, 산"
청바만 얇고 가벼운 느낌이라 여름에도 충분히 입고 다닐 수 있겠어요 허리는 잡아주고 다리 부분은 오버핏으로 내추럴하지만 차려입은 듯한 느낌을 주더라고요 바지는 사이즈를 입는데 으로 받아 보니 허리는 맞고 바지 밑단이 조금 끌리는데요 굽 있는 신발을 신을 경우 전혀 문제가 되지 않을 거 같아 요 딱 붘는 크롭티랑 코디하면 여름 티디로 작살 날 거 같은데 살이 올 라 크롭티는 무리고 오버핏 티셔츠들이랑 코디를 해볼 거 같아요,"다리, 바지, 수, 가볍다, 차려입다, 얇다, 충분하다, 오버핏, 내추럴, 받다, 여름, 잡다, 사이즈, 끌리다, 부분, 밑단, 맞다, 허리, 주다, 청바지"
제 인생 바지입니다 허리가 좀 크긴 한데 벨트로 핏 안 망가지게 충분히 커버 가능합니다 벨트 차고 골반 라인까지 올리면 진짜 신발 신었을 때 핏 너무 예쁘게 떨어져서 거의 맨날 입고 있어요 아 참고로 저 이 거 흑청은 사이즈 샀는데 좀 딱 맞는 느낌임니 다 여러분 저랑 키 몸무게 스탯 비슷하시면 그냥 사시고 벨트 차시죠 절대 후회안함요,"커버, 바지, 신발, 맨날, 키, 스탯, 벨트, 크다, 흑청, 인생, 사이즈, 몸무게, 맞다, 허리, 핏, 후회"
얇아서 여름에도 입을 수 있을 것 같아 요 바지 통이 많이 크긴 한데 편하게 입거나 힙하게 입을 때 좋을 것 같아 요 밑 위가 길긴 한데 그냥 입어도 이 뻐요 하니깐 제 키에 딱 알맞게 떨어지구 허리 사이즈도 벨트 필요 없을 것 같아요,"바지, 편하다, 수, 키, 알맞다, 크다, 밑, 얇다, 통, 니깐, 힙하, 떨어지다, 길다, 위, 여름"
제가 다리가 짧아서 길이가 좀 긴 거 빼고는 다 마음에 들었어요 넘 예쁨,"짧다, 다리, 길이, 빼다"
처음에 했다가 길이가 너무 애매해서 교환했어 용 교환 거의 주 걸렸지만 넘 예뻐서 용서 엄청 크긴 한데 힙하게 입기 아주 굿 상세 사이즈 길이 믿으시면 안 될 것 같아 용 생각보다 길이 짧아요 허리 크긴 한데 흘러내리진 않고 골반에 걸쳐집니당,"길이, 주, 굿, 교환, 골반, 처음, 크다, 걸리다, 애매하다, 힙하, 사이즈, 믿다, 흘러내리다, 상세, 허리, 짧다, 걸치다, 용서"
사이즈 제 신체 사이즈에 입으니까 딱 적당히 맞네요 허리살 출렁이는 제 게 허리띠 필요 없는 정도로 너무 크지 않게 맞아요 그런데 엉덩이나 허벅지 쪽은 허리에 비해 더 커서 좀 주름진 핏이예요 디자인 스크래치며 색감이며 정말 마음에 드네용 바지 밑단 뒷면에도 스크래치 디테일이 있어서 하지 않고 포인트 됩니다 색감도 흔하지 않게 물 빠진 블루라 여기저기 잘 어울 리면서도 독특해요 마음에 들어 요 부자재 디자인이나 사이즈는 정말 마음에 드는데 지퍼가 좀 하네요 지퍼만 보완되 몀 더 좋은 옷 일 듯 해용,"크다, 주름, 사이즈, 색감, 맞다, 부자재, 지퍼, 스크래치, 신체, 디자인, 적당하다, 독특, 포인트"
하비에 전체적인 이라서 일단 사이즈표에 의존해 과 연 맞을까 하며 시켰는데 웬 걸 너무 이쁘게 잘 맞고 제가 찾던 일자핏이 딱 여기 있었어요 그동안 다른 바지들은 허리가 너무 크거나 통이 너어무 크거나 해서 못 입는데 이렇게 제 몸에 잘 맞는 바지를 찾은 것 같아 좋슴니 당 그리고 두껍지 않아서 여름에도 충분히 입을 수 있을 것 같아 요저는 여름에 긴 바지만 입는  사람입니다 그리고 이 번 주에 입어야 해서 문의 드렸는데 일단 친절하시 구 배송이 끝내주게 빨라요한 일 만에 온 듯합니다,"바지, 연, 의존, 하비, 전체, 그동안, 크다, 웬, 무, 통, 걸, 맞다, 찾다, 사이즈표, 허리, 일자핏"
중 상 남자 인증샷 올렸읍니다 하고 한 저의 피지컬과 잘 어울리네요,"올리다읍니, 피지컬, 남자, 어울리다, 중, 인증샷, 상"
이 제품의 품질이 좋아요 이 바지가 마음에 들어요,"바지, 제품, 품질"
전체적으로 색감과 핏 가격 박자를 모두 갖춘 만족스러운 상품입니다 다 만 사이즈를 샀음에도 조금 사이즈가 큰 단점이 있었습니다 저렴한 가격 덕에 수선 비용을 포함하기에도 충분한 가격이었지만 저랑 비슷한 체형의 분들에게는 수선이 필수적일 것 같습니다 전반적으로 깔끔한 코디를 원하시는 분들에게 추천드립니다 첫 사진이 배송 받은 직후의 사진이고 두 번째와 세 번째는 수선한 후의  사진이니 참고라시길 바라겠습니다 바지가 포인트 재질도 있고 가격도 저렴해서 개인적으로는 만 졷합니다,"가격, 수선, 박자, 만족, 비용, 체형, 포인트, 색감, 사이즈, 저렴, 재질, 졷합니, 상품, 핏, 개인, 코디"
에키로 임 여자 바지 보통 입 음 남녀 공용이라 뭘 사야 할지 몰라서 샀는데 핏 미쳐 돌아버림 죵나이뿌다,"바지, 공용, 여자, 미치다, 죵이뿌다, 모르다, 뭘, 돌다버리다, 핏, 에키, 보통, 남녀"
통 엄청 크고 길이 엄청 길어요 색감 대박이에 요 이 바지 입고 세 명한테 바지 예쁘다는 소리 들었습니다 힙하게 잘 빠졌어요,"바지, 길이, 명, 크다, 통, 색감, 힙하, 대박, 빠지다, 소리, 세"
생각보다 통이 넓어서 놀랐지만 색감이랑 착용감이 넘 좋아서 만족 해 용 허리 엄청 커서 벨트 필수,"커서, 만족, 벨트, 통, 색감, 허리, 넓다, 착용, 필수"
비만인데도 엄청 하고 허리 살짝 남았어요 그리고 통도 큰 편이고 되게 얇아서 여름에 입어도 안 더울 것 같아 요 활동하기 편합니다,"활동, 얇다, 통, 허리, 비만, 여름"
허리 진짜 커서 벨트 필수인데 그만큼 바지가 맛있습니다 펄럭펄럭 입는 맛이 있어요,"벨트, 바지, 펄럭펄럭, 허리"
랜덤 질문에 답변한 리뷰 사이즈는 어떤가요 저도 사이즈 고민으로 여러 신체 스팩에 따른 착샷을 많이 보고 결정하였는데 결론적으로 저와 비슷한 정도시면 이 찰 딱 콩 딱입니다 기장은 스니커즈 신은 기준으로 복숭아뼈 살짝 덮으면서 핏이 아주 잘 떨어집니다 허리는 허리띠 없이 입고 다닐 수 있을 정도지만 전 없는 뱃살을 가지고 계신 분들이라면 쪼금 딱 맞을 수도 있겠 다는 생각입니다 재질은 어떤가요 흔히 아는 청바지의 질감이지만 나누자면 거칠기보다는 부드러운 편입니다 무게는 어떤가요 꽤나 가 벼운 편에 속한다고 생각하지만 그렇다고 하지 않다는 건 아닙니다 구매한 이유는 무엇인가요 가성비 있는 가격에 적당히 와이드 한 핏 바지를 찾아보다가 여러 가지 제품 보고 비교하고 구매하였습니다 만족도는 별이 다섯 개 입니다 사진은 출근 해서 옷 갈아입다가 생각나서 찍은 거라 양해 부탁드립니다 무료 상품 체험단이 되고 싶은 진정성 있는 속물 리뷰였습니다,"갈아입다, 출근, 가볍다, 착샷, 질감, 복숭아뼈, 사진, 핏, 가격, 와이드, 만족, 사이즈, 스팩, 답변, 뱃살, 콩, 리뷰, 허리, 결론, 질문, 무료, 스니커즈, 무게, 랜덤, 재질, 신체, 상품"
설명 진짜 한 마디면 됩니다 맛있네요 일단 써머 원단으로 나와서 원단이 얇고 딱 좋아요 색감도 사진에 나온 거 그대로에요 핏감이 진짜 대박이에 요 벌룬인데도 엄청 좋네요,"설명, 벌룬, 색감, 핏감, 원단, 맛있다"
청바진 데 적당한 워싱과 컬러와 착 붙 핏이에 요 허리는 크지만 로우 라이즈로 입기엔 적당하고 너무 이 뻐요,"청바지, 워싱, 로우, 착, 크다, 적당, 라이즈, 붙다, 컬러, 허리"
레전드 맛도리 인생 바지 찾았습니다 너무 하지 않아 편하고 핏도 짱이 뻐요 인데 좀 크긴 한데 왕크니까 왕이 쁘다 이게 커도 안이 쁜 바지가 있는데 이건 진짜 핏 짱이 뻐요 당신들 고민할 시간에 빨리 사야 빨리 입습니다 배송도 빨랐고 색감도 짱이 뻐요 디자인도 워싱이 이 쁘게 잘 돼 있어요 지금 당장 구매 버튼 눌러 요 라잇나우,"바지, 편하다, 레전드, 이건, 맛도리, 크다, 왕크다, 인생, 왕, 찾다, 쁜, 안이, 짱, 핏"
사이즈가 완전 딱 맞았고 길이 감 너무 이 쁘고 색감도 너무 이쁜데 올려 입지 않는다면 밑 위가 많이 길어요,"길이, 밑, 사이즈, 색감, 맞다, 위"
사이즈는 살짝 크지만 착용 감 좋고 여름용이라 얇아서 좋았고 어떤 옷이랑 도 코디하기 편해서 좋네요,"편하다, 크다, 얇다, 사이즈, 착용, 여름, 코디"
사이즈가 없어서 사봤는데 허리도 딱 맞고 기장도 걱정했던 거보다 딱 적당한 길이라 좋아요 제 스펙 기준 바지 배꼽 위까지 올려 입어도 기 장 발등 덮을 락 말락 수준입니다 전 바지 끌고 다닐 정도로 긴 건 원하지 않아서 만족합니당,"바지, 기장, 만족, 끌, 사이즈, 발등, 덮다, 말락, 허리, 원하다, 락"
바지 자체가 빈티지스럽고 어떤 코디에도 잘 어울리는 거 같아 요 봄 여름에 밝은 코디에도 잘 어 울릴 거 같은데 그냥 후드 집업 하나 걸치고 입어도 바지에 워싱이랑 디테일 덕분에 한 층 분위기가 사는 느낌 와이드 핏이라 한 사이즈 다운 하셔도 예쁠듯 합니다 저랑 비슷한 체형은 추천 드려요,"바지, 후드, 집업, 체형, 사이즈, 봄, 빈티지, 여름, 디테일, 코디"
크다 많이 큰 예쁜 데님 기존 와이드 데님보다 통이 매우 큽니다 통은 무탠다드 슈퍼 와이드 슬렉스 정도로 한 사이즈 작게 구매했어야 했나 싶을 정도로 큽니 다 허리 위치 잘 조절해서 입어야 한 느낌 적을 것 같아 요 저는 데님 무탠 슬렉스 사이즈 입으며 해당 제품 벨트 없이 딱 맞게 입을 수 있었어요 색상은 너무 예쁘고 물 빠진 인디고 느낌이라 기존에 있던 데님과  색상이 달라서 너무 만족해요 제품 마감은 전체적으로 가격 대비 괜찮지만 실밥 많아서 정리 필요합니다 두께는 일반적인 데님 청바지보다는 얇아서 약간 후들 후들 거리는 느낌이며 얇긴 하지만 바람 엄청 잘 통할 정도는 아니에요,"위치, 와이드, 슬렉스, 크다, 통, 사이즈, 작다, 허리, 데님, 기존, 슈퍼, 조절"
크다 많이 큰 예쁜 데님 기존 와이드 데님보다 통이 매우 큽니다 통은 무탠다드 슈퍼 와이드 슬렉스 정도로 한 사이즈 작게 구매했어야 했나 싶을 정도로 큽니 다 허리 위치 잘 조절해서 입어야 한 느낌 적을 것 같아 요 저는 데님 무탠 슬렉스 사이즈 입으며 해당 제품 벨트 없이 딱 맞게 입을 수 있었어요 색상은 너무 예쁘고 물 빠진 인디고 느낌이라 기존에 있던 데님과  색상이 달라서 너무 만족해요 제품 마감은 전체적으로 가격 대비 괜찮지만 실밥 많아서 정리 필요합니다 두께는 일반적인 데님 청바지보다는 얇아서 약간 후들 후들 거리는 느낌이며 얇긴 하지만 바람 엄청 잘 통할 정도는 아니에 요 디미트리 와이드 데님보다 매우 큽니다 입으시는 여성분들 대단하다 느껴질 정도,"위치, 와이드, 슬렉스, 크다, 통, 사이즈, 작다, 허리, 데님, 기존, 슈퍼, 조절"
바지핏이 너무 좋고 캐트릿하게 입기 좋아요 계절 입기도 좋을 것 같네용,"계절, 캐트릿, 바지핏"
허리 딱 맞구 색감 워싱 다 너무 이 뻤어요 사자마자 최애바지 등극,"워싱, 색감, 사, 맞다, 극, 허리, 최애바지"
사이즈가 워낙 크다고 해서 제일 작은 걸로 샀는데도 커요 허리가 많이 남아 요 그래서 원래도 밑 위가 긴 바지인데 허리가 많이 내려와서 바지에 응아 한 것 처럼 보여서 허리를 줄이던 가 올려서 벨트하고 입던 가 해야겠어요 여름 버전으로 샀는데 시원 하단 느낌은 없고 얇아서 퍈 하긴 하네용 컬러가 아주 이쁩니다 허리만 딱 맞았으면 엄청 좋았을 것 같아 요 그게 살짝 아쉽고  디자인은 너무 예뻐요,"바지, 줄이다, 벨트, 가다, 크다, 밑, 올리기, 버전, 사이즈, 시원, 얇다, 맞다, 허리, 위, 컬러, 디자인, 퍈, 여름"
편하게 입고 다니기 좋아요 후 뚜루 마 뚜루 입니다,"뚜루, 편하다, 후, 마"
필루미네이트 데미지 워시드 데님 팬츠 체험단 후기입니다 먼저 체험단으로 선정해주신 필루미네이트와 무신사 감사합니다 일단 빠른 배송 좋습니다 포장도 깔끔하구요 색감이 진짜 대박입니다 실물이 더 이 뻐요 재질도 좋고 두께감도 적당해서 좋아요 여름엔 좀 더울 수도 있을 거 같습니다 하지만 봄 가을엔 완전 손이 자주 갈거 같은 바지입니다 핏은 와이드하고 기장이 길어 서 전 한 사이즈 작게 시켰어도 나쁘지 않을 거 같네요 이 정도 가격에 이런 퀄리티 바지 구매하면 너무 좋을 것 긑습니다 가성비도,"깔끔하다, 팬츠, 색감, 실물, 수도, 체험, 두께감, 여름, 데미지, 빠르다, 덥다, 포장, 데님, 필루미트, 후기, 배송, 대박, 워시드, 재질, 적당하다"
색이 미쳤어요 이런 빈티지한 색 잘 못 봤 눈데 색이 너무 이 뻐요 만약 바지 사게 되면 여기서 다시 살 것 같아 요,"바지, 눈데, 미치다, 살, 색, 빈티지"
가격이 믿기지 않을 정도로 핏이랑 색감 사이즈 다 맘에 들어요,"가격, 사이즈, 믿다, 색감, 핏"
힙하고 핏이 정말 예뻐 자주 입고 다니고 있습니다,"힙, 핏"
살짝 크긴 한데 색감 마음에 들고 핏이 대체적으로 깔끔합니다 다리 길이 작으셔도 충분히 핏 좋게 나와여,"다리, 길이, 깔다끄다, 크다, 색감, 충분하다, 핏"
재질 좋아요 거칠거나 두꺼운 천을 입으면 좀 한 면이 있는데 이건 부드럽고 얇아서 활동하기 즇아요 한겨울은 차가 울듯 그런데 상세 페이지에는 신축성이 있다고 되어 있는데 실제로는 없어요 색 예뻐요 노란 청입니다 진짜 색이 너무 예뻐요 스 크래치도 예뻐요 사이즈 개 커요 남자바지라서 어느 정도 감안은 했고 스키니 핏보다 와이드를 좋아하긴 해서 상관은 없는데 커요 골반 에 멈춰가지고 벨트나 단추를 하나 더 달던가 해야 할 거 겉아요 근대 큰 만큼 엄청 편합니다 품이 큰 거지 길이는 적당해요 평균 체구 가지신 여성분은 주문하시건가 이 바자 안 사시는 걸 추천합니다,"두껍다, 얇다, 천, 울다, 상세, 없다, 즇아, 색, 실제, 차갑다, 활동, 되어다, 페이지, 청, 거치다, 이건, 부드럽다, 한겨울, 노랗다, 재질, 신축성"
통이 엄청 크네 여 기 장 수선해서 입는데 너무 마음에 듭니다,"크다, 수선하다, 통"
허벅지랑 다리 통이 굉장히 큽니다 또 큰 맛이 있지만 요 굉장히 와이드 한 거 찾으시는 분께 추천,"허벅지, 굉장하다, 다리, 와이드, 추천, 크다, 통, 찾다, 맛, 분께"
진짜 너무너무너무너무 크지만 힙 한 라인 하나 뜯어먹고 입을 옷 다이소에서 단추사서 핏 안 해치는 선에서 최대로 졸려 매고 한 번 뒤집어 까야 안 끌려 요,"졸리다, 번, 단추, 다이소, 크다, 뜯다먹다, 해치다, 끌리다, 끄다, 뒤지다, 매다, 핏, 라인, 힙"
진짜 엄청 커 요큐 하지만 그냥 입어 요 왜냐면 예쁘니까 굉장히 얇아서 한 여름에 입기에도 찰떡입니다,"굉장하다, 크다, 얇다, 찰떡, 여름, 요큐"
고민한 시간이 아까울 정도로 너무너무 마음에 들어 요 평소 아주 큰 빅 사이즈 핏을 입고 싶었는데 이렇게 만나게 되어 넘 감사합니다 참고로 허리 개 크고 기장 개길지만 수선하면 됩니다 넘 이 뻐요 다들 사지 마세요 저만 입게,
완전 좋아요 그냥 아무거나 입어도 옷 잘 입는 것처럼 보여 요,"보이다, 거나"
여자친구 추천으로 구매했는데 정말 옷이 이 쁘고 좋네용 사이즈 미스로 좀 큰 사이즈를 산 것이 약간 아쉽지만 그래도 스타일 핏이 너무 이 뻐서 좋습니다,"추천, 크다, 미스, 사이즈, 여자친구, 아쉽다, 산"
