Review,Processed_Review,keyword
셔츠 완전 대박 예쁘네요 너무 마음에 쏙 듭니다 짱,셔츠 완전 대박 예쁘네요 너무 마음에 쏙 듭니다 짱,"대박, 셔츠"
사이즈도 적당하고 여름에 입기 좋아여! 믿고 구매합니다,사이즈도 적당하고 여름에 입기 좋아요 믿고 구매합니다,"믿다, 적당하다, 사이즈, 여름"
여름에도 입기 좋고 봄 가을에도 입기 좋을것 같네요,여름에도 입기 좋고 봄 가을에도 입기 좋을 것 같네요,"가을, 여름"
총장이 조금 더 길었으면 좋겠어요 옷은 이쁩니다,총장이 조금 더 길었으면 좋겠어요 옷은 이쁩니다,"총장, 길다"
총장이 조금만 더 길었으면 좋겠다는 생각이 있지만 이뻐요,총장이 조금만 더 길었으면 좋겠다는 생각이 있지만 이뻐요,"총장, 길다"
체크셔츠 하나 살려고 찾다가 구매했은데 괜찮아요,체크 셔츠 하나 살려고 찾다가 구매했은데 괜찮아요,"살리다, 하나, 찾다, 체크, 셔츠"
색깔 너무 예쁘고 체크무늬도 맘에 들어요 재질이 탄탄해서 좋아요,색깔 너무 예쁘고 체크무늬도 맘에 들어요 재질이 탄탄해서 좋아요,"탄탄하다, 색깔, 무늬, 재질, 체크"
티셔츠 위에 살짝만 걸쳐도 너무 이뻐요! 사이즈도 저한테 딱이네요,티셔츠 위에 살짝만 걸쳐도 너무 이뻐요 사이즈도 저한테 딱이네요,"티셔츠, 딱이다, 걸치다, 사이즈"
적당한 오버핏에 디자인도 괜찮습니다. 가격 대비 좋은 제품입니다. ,적당한 온 버핏에 디자인도 괜찮습니다 가격 대비 좋은 제품입니다,"대비, 버핏, 제품, 디자인, 가격, 적당하다"
근래에 샀던 체크셔츠 중에서 가장 맘에 드네요. 데일리로 매일 입었네요.,근래에 샀던 체크 셔츠 중에서 가장 맘에 드네요 데일리로 매일 입었네요,"매일, 근래, 가장, 데일리, 체크, 셔츠"
생각한 핏과 재질이여서 너무 마음에 듭니다 자주 입을 거 같아요,생각한 핏과 재질이어서 너무 마음에 듭니다 자주 입을 거 같아요,재질
패턴이쁘고요 카라랑 소매가 좀 탄탄함 편입니다 요즘 셔츠가 다 길어서 별론데 이 셔츠는 딱좋네요 ,패턴 이쁘고요 카라랑 소매가 좀 탄탄함 편입니다 요즘 셔츠가 다 길어서 별론데 이 셔츠는 딱 좋네요,"편입, 론데, 셔츠, 소매, 카라, 탄탄하다, 패턴"
박시한 스타일로 지금 한여름에 입기 좋은 재질임!,박시한 스타일로 지금 한여름에 입기 좋은 재질임,"박시, 스타일, 한여름, 재질"
기장도 너무 길지않고 빈티지한 느낌으로 너무 좋아요,기장도 너무 길지 않고 빈티지한 느낌으로 너무 좋아요,"길다, 빈티, 기장"
배송은 하루만에 왔고 원단감은 생각보다 얇아서 지금 입기에 괜찮을 것 같아요,배송은 하루 만에 왔고 원단감은 생각보다 얇아서 지금 입기에 괜찮을 것 같아요,"만에, 원단감, 하루, 오다, 배송, 얇다"
에스엔에스에서 구경하다가 구매했는데 배송도 빠르고 가격이 합리적이라서 좋아요. 가볍게 걸치기 좋은 두께감이라 체고,에스엔에스에서 구경하다가 구매했는데 배송도 빠르고 가격이 합리적이라서 좋아요 가볍게 걸치기 좋은 두께감이라 체고,"에스, 체고, 구경, 합리, 두께감, 가볍다, 걸치다, 빠르다, 가격, 배송"
휘뚜루마뚜루 입기 좋은 오버핏 셔츠입니다! 소재가 너무 얇지도 두껍지도 않은 시원하게 걸치기 좋은 소재라 너무 맘에 드렁요! 예쁘게 잘 입을게요,휘뚜루마뚜루 입기 좋은 오버핏 셔츠입니다 소재가 너무 얇지도 두껍지도 않은 시원하게 걸치기 좋은 소재라 너무 맘에 들어요 예쁘게 잘 입을게요,"소재, 휘뚜루마뚜루, 오버핏, 두껍다, 시원하다, 걸치다, 얇다, 셔츠"
옷이 아주 이쁩니다. 이쁜 체크무늬 셔츠입니다 최고,옷이 아주 이쁩니다 이쁜 체크무늬 셔츠입니다 최고,"최고, 무늬, 체크, 셔츠"
좋아요 예뻐요 잘 입고 있습니다 앞으로도 잘 입을게요!,좋아요 예뻐요 잘 입고 있습니다 앞으로도 잘 입을게요,으로도
얇아서 여름에 잘 입고다니고 있어요! 길이가 쪼끔 짧은게 아쉽지만 길이가 긴 반팔이랑 같이 입으니까 이쁘네요ㅎ,얇아서 여름에 잘 입고 다니고 있어요 길이가 쪼끔 짧은 게 아쉽지만 길이가 긴 반팔이랑 같이 입으니까 이쁘네요,"길이, 쪼끔, 팔이, 아쉽다, 짧다, 여름, 얇다"
여름용 셔츠로 시원하니~ 적절하게 활용 가능할 것 같아요 !,여름용 셔츠로 시원하니 적절하게 활용 가능할 것 같아요,"적절하다, 활용, 가능하다, 시원하다, 여름, 셔츠"
옷이 얇고 사이즈도 살짝 오버핏에 맘에 듭니다 두껍지 않아서 편하게 입을 수 있을 것 같아요,옷이 얇고 사이즈도 살짝 온 버핏에 맘에 듭니다 두껍지 않아서 편하게 입을 수 있을 것 같아요,"버핏, 두껍다, 편하다, 사이즈, 얇다"
할인할때 해당 브랜드 옷을 첫 구매했는데 맘에 듭니다 체크 남방 자주 살 것 같아요 옷이 얇아서 덥지 않아요,할인할 때 해당 브랜드 옷을 첫 구매했는데 맘에 듭니다 체크 남방 자주 살 것 같아요 옷이 얇아서 덥지 않아요,"해당, 할인, 남방, 브랜드, 덥다, 체크, 얇다"
흔하지 않고 빈티지한 느낌인 체크셔츠라 좋았어요,흔하지 않고 빈티지한 느낌인 체크 셔츠라 좋았어요,"흔하다, 빈티, 체크, 셔츠"
클래식한 체크무늬로 다양한 스타일에 슂게 매치할 수 있어 매우 만족스러워요 ! 소재도 부르더워 착용하는데에 있어 불편함이 없었고 세탁 후에도 형태가 잘 유지되어 오래오래 입을 수 있을것 같네요 !!,클래식한 체크무늬로 다양한 스타일에 슂게 매치할 수 있어 매우 만족스러워요 소재도 부르더워 착용하는 데에 있어 불편함이 없었고 세탁 후에도 형태가 잘 유지되어 오래오래 입을 수 있을 것 같네요,"부르다, 오래오래, 클래식, 불편하다, 형태, 유지, 매치, 되어다, 다양하다, 스타일"
옷 진짜 이쁘게 잘 나온 거 같아요. 안에 민소매 입고 겉옷으로 걸치면 여름에듀 입기 즇아요,옷 진짜 이쁘게 잘 나온 거 같아요 안에 민소매 입고 겉옷으로 걸치면 여름 에듀 입기 즇아요,"겉옷, 에듀, 즇아, 민소매, 나오다, 걸치다, 여름"
사이즈 넉넉하게 잘 맞고 이쁘네요 저럼한 가격에 잘 입을게요.,사이즈 넉넉하게 잘 맞고 이쁘네요 저럼 한 가격에 잘 입을게요,"저러다, 넉넉하다, 맞다, 가격, 사이즈"
핏 색감 가격 모든점이 맘에 드네요 이번 여름에 잘 입을꺼 같습니다,핏 색감 가격 모든 점이 맘에 드네요 이번 여름에 잘 입을 거 같습니다,"모든, 가격, 여름, 색감"
가볍고 참 좋습니다 자주 입을것 같아요 시원하네요,가볍고 참 좋습니다 자주 입을 것 같아요 시원하네요,"차다, 가볍다, 시원하다"
"쇼핑몰 옷처럼 포장되어,, 배송 옴 .,,, 봉투도 찢어져있고 ,, 옷은 멀쩡 하지만 뭔가 ? ㅎㅎ 두께감은 사계절 용  후들후들 거리진 않아욤",쇼핑몰 옷처럼 포장되어 배송 옴 봉투도 찢어져있고 옷은 멀쩡 하지만 뭔가 두께감은 사계절 용 후들후들 거리 진 않아요,"찢어지다, 처럼, 멀쩡, 봉투, 쇼핑몰, 되어다, 사계절, 거리, 포장, 뭔가"
두께감은 적당히 있고 사계절용 입니당 여름 ㄴㄴ 겨울용 ㄴㄴ 그냥저냥 간절기에 입을만하고 초여름 저녁~에어컨대비 용으로 좋아욤,두께감은 적당히 있고 사계절용입니다 여름 겨울용 그냥저냥 간절기에 입을만하고 초여름 저녁 에어컨 태비 용으로 좋아요,"사계, 태비, 만하, 겨울, 저녁, 절용, 초여름, 에어컨, 그냥, 간절기"
배송이 겁나빠르고요 색감 좋습니다 생각보다 많이컸어요,배송이 겁나빠르고요 색감 좋습니다 생각보다 많이 컸어요,"겁나다, 크다, 빠르다, 배송, 색감"
사이즈도 잘 맞고 색깔도 생각보다 예뻐서 마음에 들어요,사이즈도 잘 맞고 색깔도 생각보다 예뻐서 마음에 들어요,"색깔, 맞다, 사이즈"
배송도 빠르고 좋아요 상품도 좋아요 사이즈 좋네요 빠르고 좋아요 배송도 빠르고 좋아요 ,배송도 빠르고 좋아요 상품도 좋아요 사이즈 좋네요 빠르고 좋아요 배송도 빠르고 좋아요,"빠르다, 배송, 상품, 사이즈"
잘 쓰고있었는데 빨래한번하고 나니까 옷길이 반됐어요,잘 쓰고 있었는데 빨래 한번 하고 나니까 옷길이 반 됐어요,"쓰다, 빨래, 한번, 돼다, 길이"
얇고 체크가 이뻐서 여기저기 먀치해서 입을 수 있을거같아요,얇고 체크가 이뻐서 여기저기 마치 해서 입을 수 있을 거 같아요,"여기저기, 체크, 얇다"
타임세일 할때 싸게사서 좋습니다. 체크셔츠 많이 삿는데 맘에드네요,타임세일할 때 싸게 사서 좋습니다 체크 셔츠 많이 샀는데 맘에 드네요,"사서, 타임세일, 싸다, 체크, 셔츠"
배송 빠르고 가볍게 걸치기 너무 좋아요 잘 산거같습니다 ,배송 빠르고 가볍게 걸치기 너무 좋아요 잘 산 거 같습니다,"가볍다, 걸치다, 빠르다, 배송"
약간 노란기가 있는데 하얀게 더 이뻣을듯합니다만 일단은 핏이나 다 마음에듭니다,약간 노란 기가 있는데 하얀 게 더 이뻤을듯합니다만 일단은 핏이나 다 마음에 듭니다,"하얗다, 이나, 노랗다"
찜해놨는데 세일하길래 두개나 샀어요 너무 예쁩니다,찜해놨는데 세일하길래 두 개나 샀어요 너무 예쁩니다,세일
좋습니다 가격도 괜찮고 입기 편하고 이뻐요 조아요,좋습니다 가격도 괜찮고 입기 편하고 이뻐요 좋아요,"편하다, 가격"
야름에 입을 셔츠 찾았는데 두께감이 많이 두껍지 않아서 지금 입고 다니기 딱 좋을것 같아요!! 이뻐서 너무 만족입니다,여름에 입을 셔츠 찾았는데 두께감이 많이 두껍지 않아서 지금 입고 다니기 딱 좋을 것 같아요 이뻐서 너무 만족입니다,"만족, 두께감, 찾다, 두껍다, 여름, 셔츠"
얇아서 여름에도 입기 좋고 색감도 이뻐서 자주 입을거 같아요,얇아서 여름에도 입기 좋고 색감도 이뻐서 자주 입을 거 같아요,"여름, 색감, 얇다"
생각했던 색감과 원단은 아닌데 편하게 입기 좋을거같아요,생각했던 색감과 원단은 아닌데 편하게 입기 좋을 거 같아요,"아니다, 원단, 편하다, 색감"
옷이 귀엽고 이뻐요 빈티지한 색상도 너무 이쁘네요 잘 입을게요,옷이 귀엽고 이뻐요 빈티지한 색상도 너무 이쁘네요 잘 입을게요,"귀엽다, 빈티, 색상"
마감질이 좀 아쉽습니다 팔부분이랑 몸통 부분좀 젋어서 저한테는 조금 아쉬웠습니다 그치만 크게 입는 거 좋아 하시는 분들한테눈 추천 드립니다,마감 질의 좀 아쉽습니다 팔 부분이랑 몸통 부분 좀 젊어서 저한테는 조금 아쉬웠습니다 그렇지만 크게 입는 거 좋아하시는 분들한테 눈 추천드립니다,"부분, 아쉽다, 질의, 젊다, 몸통, 드리다, 마감, 크게, 좋아하다, 추천"
체크 패턴 크기도 적당히 큼직하고 박시해서 좋아요,체크 패턴 크기도 적당히 큼직하고 박시해서 좋아요,"큼직하다, 크기, 박시, 패턴, 적당하다, 체크"
얇고 박시한 셔츠로 최곱니다. 포인뜨!로 주기 좋아요,얇고 박시한 셔츠로 최곱니다 포인트로 주기 좋아요,"포인트, 주기, 곱다, 박시, 얇다, 셔츠"
얇긴해서 여름이라도 잘입고다닐거같인요 굿굿,얇긴 해서 여름이라도 잘 입고 다닐 거 같은 요 굿굿,"이라도, 굿굿, 여름, 얇다"
너무너무 이쁩니다. 베이지 색감도 약간 들어있고 네이비가 진해서 이뻐요!! 주변에서도 다들 이쁘다고 어디꺼냐고 물어봤습니단,너무너무 이쁩니다 베이지 색감도 약간 들어있고 네이비가 진해서 이뻐요 주변에서도 다들 이쁘다고 어디 거냐고 물어봤습니다,"물어보다, 주변, 에서도, 진하다, 베이지, 네이비, 색감"
길이가 짧고 소재도 시원해서 좋아요 ㅋㅋ 넘 키크신 분은 작을 수 있겠어요 디자인도 이쁘고 맘에 들어요 체크도 이쁘게 들어갔네요 ㅎㅎ,길이가 짧고 소재도 시원해서 좋아요 너무 키 크신 분은 작을 수 있겠어요 디자인도 이쁘고 맘에 들어요 체크도 이쁘게 들어갔네요,"들어가다, 소재, 길이, 시원하다, 짧다, 크다, 디자인, 체크"
배송이 말도 안되게 빠르고 재질도 시원시원하니 좋아요,배송이 말도 안 되게 빠르고 재질도 시원시원하니 좋아요,"시원시원하다, 되게, 빠르다, 재질, 배송"
체크무늬 이쁘고 실제로 보면 재질도 괜찮아서 입기 진짜 좋아요,체크무늬 이쁘고 실제로 보면 재질도 괜찮아서 입기 진짜 좋아요,"실제, 무늬, 재질, 체크"
체크 색감 좋구요 핏도 살짝 오버 사이즈라 이쁘네요,체크 색감 좋고요 핏도 살짝 오버사이즈라 이쁘네요,"오버, 사이즈, 체크, 색감"
아들이 아주 잘입고 다닙니다 사진으로봤을땐 몰랐는데 시원한원단에 색감도 오묘해요 언뜻보면 블랙같지만 자세히보면 네이비가조금 섞인 베이지도 약간보입니다 블랙 버뮤다나 인디고버뮤다 다 잘어울려요,아들이 아주 잘 입고 다닙니다 사진으로 봤을 땐 몰랐는데 시원한 원단에 색감도 오묘해요 언뜻 보면 블랙 같지만 자세히 보면 네이비가 조금 섞인 베이지도 약간 보입니다 블랙 버뮤다나 인디고 버뮤다 다 잘 어울려요,"블랙, 버뮤다, 아들, 언뜻, 모르다, 오묘하다, 인디고, 자세하다, 섞이다, 보이다"
배송도 빠르고 포장도 꼼꼼합니다. 잘 구매했어요.,배송도 빠르고 포장도 꼼꼼합니다 잘 구매했어요,"꼼꼼하다, 포장, 빠르다, 배송"
셔츠가 얇아서 여름에 입어도 괜찮고 색갈도 이쁘지만 세탁하면 사이즈가 좀 줄어들어요,셔츠가 얇아서 여름에 입어도 괜찮고 색깔도 이쁘지만 세탁하면 사이즈가 좀 줄어들어요,"줄어들다, 세탁, 색깔, 사이즈, 여름, 얇다, 셔츠"
색감이 예뻐요 세일해서 싸게 샀네요 추천합니다,색감이 예뻐요 세일해서 싸게 샀네요 추천합니다,"세일, 싸다, 추천, 색감"
한여름에도 입을 수 있는 여름 체크셔츠 찾고 있었는데 얇고 디자인도 예뻐서 구매했습니다. 기장도 적당하고 무엇보다 입었을 때 덥지 않아서 추천합니다.,한여름에도 입을 수 있는 여름 체크 셔츠 찾고 있었는데 얇고 디자인도 예뻐서 구매했습니다 기장도 적당하고 무엇보다 입었을 때 덥지 않아서 추천합니다,"덥다, 한여름, 찾다, 추천, 기장, 디자인, 적당하다, 체크, 여름, 얇다"
색상이 선명하고 예뻐요~ 두께도 적당하고 길이도 길지않아서 맘에들어요~,색상이 선명하고 예뻐요 두께도 적당하고 길이도 길지 않아서 맘에 들어요,"선명하다, 길다, 두께, 길이, 색상, 적당하다"
여름이여도 실내는 추운데 이런 이쁜 데일리 셔츠하나는 구매하는거 강추강추완전강추입니나 개이뻐요,여름이어도 실내는 추운데 이런 이쁜 데일리 셔츠 하나는 구매하는 거 강추강추완전강추입니나 개 이뻐요,"강추, 이어도, 추다, 이렇다, 실내, 하나, 데일리, 여름, 셔츠"
사이즈도 적당하고 색감이 사진보다 더 이쁩니다,사이즈도 적당하고 색감이 사진보다 더 이쁩니다,"사진, 적당하다, 사이즈, 색감"
얇아서 여름에 입기 시원하고  색상도이뻐요 추천,얇아서 여름에 입기 시원하고 색상도 이뻐요 추천,"추천, 색상, 시원하다, 여름, 얇다"
좋아요. 적당한 두께로 봄 여름 가을까지 잘입을것 같아요.,좋아요 적당한 두께로 봄여름 가을까지 잘 입을 것 같아요,"두께, 가을, 적당하다, 여름"
색상이 선명하고 예뻐요~ 두께도 얇아서 좋고 기장도 적당해요~,색상이 선명하고 예뻐요 두께도 얇아서 좋고 기장도 적당해요,"선명하다, 두께, 색상, 기장, 적당하다, 얇다"
색상이 선명하고 예뻐요~ 두께도 얇고 기장도 맘에 듭니다~,색상이 선명하고 예뻐요 두께도 얇고 기장도 맘에 듭니다,"선명하다, 두께, 색상, 기장, 얇다"
한여름에는 못입고 적당한 날씨까지는 괜찮아요. 이쁩니다.,한여름에는 못 입고 적당한 날씨까지는 괜찮아요 이쁩니다,"까지는, 에는, 날씨, 한여름, 적당하다"
총장이 짧아서 그런지 생각보다 사이즈가 작게 나온느낌이지만 마음에 듭니다,총장이 짧아서 그런지 생각보다 사이즈가 작게 나온 느낌이지만 마음에 듭니다,"그렇다, 작다, 총장, 나오다, 짧다, 사이즈"
진짜 생각보다 너무 이뻐요 다른색상 있으면 바로 사겠는데 ㅠㅠ 아쉽네요,진짜 생각보다 너무 이뻐요 다른 색상 있으면 바로 사겠는데 아쉽네요,"아쉽다, 색상"
실제로 받아보면 몬가 후줄근한 경우가 많아서  그냥 큰 기대없이 주문한 옷인데  받아보고 너무예뻐서 놀랐습니다 적당한 오버핏이고 얇아서 한여름엔 안되겠지만 여름에도 롤업해서 입고다닐수있을것같아요,실제로 받아보면 뭔가 후줄근한 경우가 많아서 그냥 큰 기대 없이 주문한 옷인데 받아보고 너무 예뻐서 놀랐습니다 적당한 온 버핏이고 얇아서 한여름엔 안되겠지만 여름에도 롤업 해서 입고 다닐 수 있을 것 같아요,"받다, 롤업, 경우, 안되다, 후줄근하다, 많다, 기대, 없이, 주문, 이고"
체크셔츠 며칠동안 찾고 있었는데 이 셔츠로 구매했습니다 한여름 전까지 입을 수 있는 두께감이고 셔츠도 이뻐요!,체크 셔츠 며칠 동안 찾고 있었는데 이 셔츠로 구매했습니다 한여름 전까지 입을 수 있는 두께감이고 셔츠도 이뻐요,"셔츠, 며칠, 이고, 한여름, 찾다, 두께감, 체크"
체크난방이 안어울리는 편인데도 핏이 이뻐서 그걸 이김,체크 난방이 안 어울리는 편인데도 핏이 이뻐서 그걸 이김,"그걸, 난방, 펴다, 이기다, 어울리다, 체크"
합리적인 가격에 무난한 디자인과 완벽한 색감까지 더해져서 정말 자주 손이 갈거같은 셔츠입니다,합리적인 가격에 무난한 디자인과 완벽한 색감까지 더해져서 정말 자주 손이 갈 거 같은 셔츠입니다,"완벽하다, 더하다, 합리, 갈다, 무난, 디자인, 가격, 색감, 셔츠"
체크배색이 생각보단 좀 밝은 느낌이에요. 재질로 가볍고 바스락거리는 코튼이라 부드럽고 더워져도 입을 수 있을거 같아요. 길이가 좀 많이 길긴한데 막상 입으면 핏이 예쁩니다,체크 배색이 생각보단 좀 밝은 느낌이에요 재질로 가볍고 바스락거리는 코튼이라 부드럽고 더워져도 입을 수 있을 거 같아요 길이가 좀 많이 길긴 한데 막상 입으면 핏이 예쁩니다,"코튼, 바스락, 막상, 더워지다, 배색, 거리, 보단, 부드럽다, 길다, 이에요"
배송도 빠르고 체크 컬러 이뻐서 만족스럽습니다. 밤에 걸치기 좋아요:),배송도 빠르고 체크 컬러 이뻐서 만족스럽습니다 밤에 걸치기 좋아요,"컬러, 만족스럽다, 걸치다, 빠르다, 배송, 체크"
배송도 빨리오고 옷색감도 마음에 들어요  예쁩니다,배송도 빨리 오고 옷 색감도 마음에 들어요 예쁩니다,"빨리, 오다, 배송, 색감"
편하게 입기도 좋고 패턴도 마음에 드네요 잘 입을게요~~,편하게 입기도 좋고 패턴도 마음에 드네요 잘 입을게요,"패턴, 편하다"
편하게 입기 좋고 여름에도 무난하게 입을 수 있을것같아요,편하게 입기 좋고 여름에도 무난하게 입을 수 있을 것 같아요,"무난, 편하다, 여름"
예쁜데 총장이 조금 짧아서 아쉬워요 그래도 간절기에 손 자주 갈것같아요,예쁜데 총장이 조금 짧아서 아쉬워요 그래도 간절기에 손 자주 갈 것 같아요,"갈다, 총장, 간절기, 아쉽다, 짧다"
가볍게 소매 걷고 입고 다니고 있어요 뭔가 정갈한 느낌보단 편하게 연출하게 되네요,가볍게 소매 걷고 입고 다니고 있어요 뭔가 정갈한 느낌보단 편하게 연출하게 되네요,"연출, 정갈하다, 소매, 보단, 걷다, 뭔가, 가볍다, 편하다"
여름에 입긴 힘들겠지만 간절기에 입기엔 더할나위없네요 추천해요,여름에 입긴 힘들겠지만 간절기에 입기엔 더할 나위 없네요 추천해요,"힘들다, 나위, 더하다, 없다, 간절기, 추천, 여름"
길이가 약간 짫게 나왔네요 그런데로 무난하게 데일리로 입기편할거같고 초여름까지 잘입을거같네요 가격이 좀더 저렴했으면 좋앗을거 같습니다,길이가 약간 짫게 나왔네요 그런대로 무난하게 데일리로 입기 편할 거 같고 초여름까지 잘 입을 거 같네요 가격이 좀 더 저렴했으면 좋았을 거 같습니다,"그런대로, 초여름, 저렴하다, 무난, 나오다, 길이, 데일리, 편하다, 가격"
체크셔츠 요즘 이뻐보여서 하나 샀는데 너무 만족합니다.,체크 셔츠 요즘 이뻐 보여서 하나 샀는데 너무 만족합니다,"여서, 하나, 만족하다, 체크, 셔츠"
품이 생각보다 큰데 길이가 딱 좋아요 키 작아서 길이 때문에 옷 고민 많이 하는데 이건 좋네용 얇아서 여름에도 잘 입고 다닐 것 같습니다!,품이 생각보다 큰데 길이가 딱 좋아요 키 작아서 길이 때문에 옷 고민 많이 하는데 이건 좋네요 얇아서 여름에도 잘 입고 다닐 것 같습니다,"길이, 때문, 이건, 작다, 고민, 크다, 여름, 얇다"
생각보다 품이 큰데 이뻐요 요즘 다 오버핏이라 키 작은 저한테 남방 찾기 어려웠는데 길이 딱 엉덩이 덮을 정도로 와요 얇아서 여름에도 잘입고 다닐 것 같아요!!,생각보다 품이 큰데 이뻐요 요즘 다 온 버핏이라 키 작은 저한테 남방 찾기 어려웠는데 길이 딱 엉덩이 덮을 정도로 와요 얇아서 여름에도 잘 입고 다닐 것 같아요,"어렵다, 찾기, 남방, 엉덩이, 덮다, 작다, 버핏, 오다, 길이, 크다"
색감좋고 약간 까슬까슬한 재질입니다 여름에 입기 좋을거같아요,색감 좋고 약간 까슬까슬한 재질입니다 여름에 입기 좋을 거 같아요,"까슬까슬, 재질, 여름, 색감"
빈티지한 색감과 얇아서 여름에 착용 가능해서 좋아요 !,빈티지한 색감과 얇아서 여름에 착용 가능해서 좋아요,"가능하다, 착용, 빈티, 여름, 얇다, 색감"
사이즈도 딱 좋고 가격도 적당하고 데일리로 입기 좋아요,사이즈도 딱 좋고 가격도 적당하고 데일리로 입기 좋아요,"데일리, 가격, 적당하다, 사이즈"
약간 빳빳하구요 근데 전이게 매력이라고 생각이들어요,약간 빳빳하고요 근데 전이가 매력이라고 생각이 들어요,"전이, 이라고, 매력, 빳빳, 근데"
여름에 입어도 될 정도로 얇아서 좋아요 잘 입을게요,여름에 입어도 될 정도로 얇아서 좋아요 잘 입을게요,"여름, 얇다"
좋아요 두껜 보통정도 되는 것 같아요 잘 입을게요 ,좋아요 두껜 보통 정도 되는 것 같아요 잘 입을게요,"두껜, 보통"
막상 환불하려다가 받고 정하자 하고 받았는데 괜찮아요!!,막상 환불하려다가 받고 정하자 하고 받았는데 괜찮아요,"받다, 환불, 막상"
색깔도 마음에들고 딱 좋네요 자주 입을것 같습니다,색깔도 마음에 들고 딱 좋네요 자주 입을 것 같습니다,색깔
원단두께감 적당하고 색감도 이쁘네요 만족합니다,원단 두께감 적당하고 색감도 이쁘네요 만족합니다,"두께감, 원단, 만족하다, 적당하다, 색감"
사진보다 색감이 밝네요 원단 두께 적당하고 이쁨,사진보다 색감이 밝네요 원단 두께 적당하고 이쁨,"사진, 두께, 밝다, 원단, 적당하다, 색감"
